chunked_content,place,relevant_hashtags
디즈니 스토어 인형 옷 햅 파이브 우메다 쇼핑 오사카 쇼핑 소비 요정 미키 미니 피글렛 한땀핸즈,Hep Five  HEP5 ヘップ ファイブ,"['#디즈니스토어', '#우메다쇼핑', '#오사카쇼핑', '#소비요정', '#미키', '#미니', '#피글렛', '#한땀핸즈']"
오사카 위주 사진 실시간 스토리 분 여행 주제가 먹방 여행 만큼 정말 어마 마하 고온 오사카 여행 관광 오사카 글리코 보기 민망 하루 열 끼 사진 안 척 안 척 사기 스타 그램,Japan Osaka,"['#하루에열끼', '#먹수진이라고합니다', '#사진은안먹은척', '#많이안먹는척']"
일본 여행자 센터 일 여행객 위해 여행 정보 및 쿠폰 제공 여행 서포터 쇼핑 센터 드럭스토어 패션 잡화 면세점 상품 포켓 와이파이 등 혜택 제공 일본여행 필수 코스 돈키호테 드럭스토어 비룻 빅 카메라 공항 면세점 이용 장소 혜택 면세 할인 중복 할인 이용 방법 설명 일본여행 센터 플러스 친구 등록 후원 링크 쿠폰 다운 후 직원 제시 일본여행 센터 친 일본 여 행시 할인 혜택 플러스 친구 추가 링크 httpspfkakaocom haUIC 일본여행 센터 홈페이지 httpwwwjptourcokr 일본여행 센터 일본여행 도쿄 여행 오사카 여행 할인 쿠폰 할인 정보 면세 찬스 돈키호테 일본여행 쿠폰 돈키호테 할인 쿠폰 돈키호테 쇼핑 리스트 오사카 쇼핑 httpspfkakaocom haUIC httpwwwjptourcokr,,"['#일본여행자센터', '#일본여행', '#도쿄여행', '#오사카여행', '#면세찬스', '#돈키호테', '#일본여행쿠폰', '#오사카쇼핑']"
,"Osaka, Japan",[]
오사카 여행 오늘 레옹 여인 낭만 여행자 왼쪽 무릎 상태 보호대 도저히 꼴 그냥 캐릭터 스커트 현장 코디 교체 계절 앞서 준비 직업 탓 시간 흘럿 금은 나이 과 속도 서너 무 시간 이번 여행 또 추억 지하철 좀 헤멘거 나름 만족도 오사카 자유여행 둘이서 다음 여행 기약 일본여행 자유여행 자매 여행 오사카 쇼핑 타코야끼 길거리 음식 파르코 백화점 패션 계정 소통 비 니코 디 오렌지 비니 낭만 안나 스타일,오사카 도톤보리,"['#오사카여행', '#일본여행', '#자매여행', '#오사카쇼핑', '#타코야끼', '#파르코백화점', '#패션계정소통', '#비니코디', '#오렌지비니', '#낭만안나스타일']"
일본 여행 맥도날드 시율 애 맥도날드 노래 불고기 버거 불고기 맛 이나 자기 스시 시율 진짜 일본 맥도날드 버거 감자 튀김 편 불고기 버거 치즈버거 소스 시율 입맛 안 것 스시 언제 꿀맛 아침 스시 맥주 오사카 오사카 여행 오사카 맛집 오사카 성 오사카 공중정원 오사카 공중 전망대 오사카 유니 버셜 스튜디오 오사카 오사카 쇼핑 오사카 여행 아이 오사카 아이 오사카 여행 육아 소통,일본 오사카,"['#오사카', '#오사카여행', '#오사카맛집', '#오사카성', '#오사카공중정원', '#오사카공중전망대', '#오사카유니버셜스튜디오', '#오사카성', '#오사카쇼핑', '#오사카여행', '#아이와오사카', '#아이와오사카여행']"
지갑 마구 마구 날 파르 코다이 마루 아이 세상 지갑 날,오사카 신사이바시,"['#파르코', '#다이마루', '#아이들세상', '#지갑털리는날']"
지갑 다시 예 뽀 이번 여행 때 하루하루 깜짝선물 거 앞 지금 외쳐죵 언제 어도 기분 소리 미키 가방 요 카드 지갑 레드 레드 지갑 돈 오사카 쇼핑 쇼핑 osaka 오사카 면세 찬스 프라다 지갑 프라다 prada 프라다 카드 지갑 동전지갑 디즈니 스토어 미키마우스 가방 디즈니 가방 면세점 쇼핑 조말 론 향수 조말 론 잉글리쉬 페어 앤 프리지아 잉글리쉬 페어 앤 프리지아 osaka prada,,"['#오사카쇼핑', '#쇼핑', '#osaka', '#오사카', '#면세찬스', '#프라다지갑', '#프라다', '#동전지갑', '#디즈니스토어', '#미키마우스가방', '#디즈니가방', '#면세점쇼핑', '#조말론향수', '#조말론잉글리쉬페어앤프리지아', '#잉글리쉬페어앤프리지아']"
출장 딸 나 간식 꾸러미 떡 양갱 도 끼 모찌 여러 아이 입국 다음 직접 사진 세상 왜 디저트,,[]
먹방 쇼핑 천국 재 방문 마력 도시 일본 오사카 Osaka BS 유학 모든 일본 도시 중 번 온 사람 여러 번 재 방문 오사카 미식 쇼핑 천국 유명 포토 스팟 또한 박자 확행 여행지 추천 여행 시기 항공 약 소요 비자 무비 물가 도쿄 비 편이 에티켓 흡연 시 정해진 장소 휴대 용 재떨이 것 일본 오사카 달 살기 어학 연수 영어 캠프 등 경험 건 요 상상 현실 해외 살이 고민 BS 유학 jichu im cherry hb c sun r yuriajue edel gongjuuha Osaka BS BS jichu im cherry hb c sun r yuriajue edel gongjuuha,,[]
오사카 항상 쿠 혼또니 오이 시 데쓰 가족 여행 여행 일본여행 오사카 여행 오사카 쇼핑 오사카 먹방 오사카 맛집 쿠 대게 맛집 여행 스타 그램 스타 그램 가족 스타 그램 일 본스타 그램,오사카 시,"['#급여행', '#일본여행', '#오사카여행', '#오사카쇼핑', '#오사카먹방', '#오사카맛집', '#가니도라쿠', '#대게맛집', '#일본스타그램']"
오사카 여행 중 가장 맘 신세카이 시장 츠텐카쿠 전망대 더 맘 역시 무 계획 여행 젤 일본 일본여행 오사카 오사카 여행 오사카 맛집 오사카 카페 오사카 쇼핑 신세카이 신세카이 거리 신세카이 맛집 츠텐카쿠 츠텐카쿠 전망대 츠텐카쿠 타워 여행 여행 스타 그램,신세카이,"['#일본', '#일본여행', '#오사카', '#오사카여행', '#오사카맛집', '#오사카카페', '#오사카쇼핑', '#신세카이', '#신세카이거리', '#신세카이맛집', '#츠텐카쿠', '#츠텐카쿠전망대', '#츠텐카쿠타워', '#여행']"
전 사진,,[]
고민 끝 샴푸 컨디셔너 구입 aesopskincare 친구 지인 선물 자주 브랜드 나 이번 처음 어제 내 또 샴푸 이야기 내 베프 듯 말 네 사고 샴푸 사 시간 낭비 역시 친구 골 해 지혜 놈 ml 돈 산 이솝 소비 기록 오사카 쇼핑 샴푸 aesopskincare ml,"Osaka, Japan","['#에이솝', '#소비기록', '#오사카쇼핑']"
그녀 모시 오사카 가이드 종료 박 의 일 여행가이드 마치 다시 일상 복귀 계절 이 시간 추억 다음 여행 위해 살 다소 문자 j 의 일본 여행기 끝 돈키호테 쇼핑 캐리어 삼 osaka 오사카 오사카 추억 오사카 쇼핑 일본 다이소 쇼핑 청주공항 효율 여 행마 브 투어 여행 충전 j osaka,,"['#오사카', '#돈키호테쇼핑', '#캐리어하나더삼', '#osaka', '#오사카', '#오사카의추억', '#오사카쇼핑', '#일본다이소쇼핑', '#청주공항', '#효율적인여행', '#마브투어', '#여행은충전']"
별로 듯 데 애 마음 쁨이꺼 반 반 별로 살 거 생각 준 때 사 게 쁨이꺼 것 사려 돈 별로 안 생각 건 나 착각 에디슨 포크 스푼 세트 모양 나 건가 무 얼른 여름 쁨 준 유카타 모습 카 혼포 쇼핑 떼샷 오사카 쇼핑,,"['#아카짱혼포', '#오사카쇼핑']"
레인부츠 비 왜 날씨 요정,"Osaka, Japan",['#날씨요정']
댓글 달 일본 과자 자가 비 선물 이벤트 새해 시 작 지도 얼마 안 것 계절 꽃 도 생각 올해 상반기 여행 틈 온 것 중 매달 곳 일본 여행 요 매달 일본 팔로워 분 드릴 게 생각 요즘 제 최애 과자 가루비 자가 비 선물 댓글 달 이벤트 참여 이벤트 응모 기간 금 오후 당첨 발표 일 금 오후 배송 일 토 상품 자가 비 가루비 종류 세트 총 명 선정 방식 블로그 인스타 댓글 취합하 랜덤 추첨 참여 방법 망고 요정 인스타 팔로잉 해당 게시 글 누르기 게시 글 참여 완료 댓글 달기 유의사항 블로그 인스타그램 동시 진행 둘 참여 가능 블로그 이웃 분도 이벤트 신청 가능 당첨 연락 무효 처리,"잠깐만요, 갑자기 찾아온 이벤트 소식입니다.",['#참여완료']
한겨울 은행 단풍 그대로 kyoto 고 웨이 팅끝 맛집 다뿌 시기 kyoto,,['#kyoto']
가을 코끝 날 계절 겹 머플러 양말 신고 커피 계절 여름 끝 가을 시 작 화이트와인 하이 볼 시간 레드와인 사케 시간 소 애 일리 가을 옷 린넨 사계절 린넨 린넨 원피스 엄마 옷 일본 린넨 일본 쇼핑 일본여행 오사카 쇼핑 교토 쇼핑 ootd 네스트 브 veritecoeur 베리 데코 ootd veritecoeur,오사카 시,"['#소애노데일리', '#가을옷', '#린넨', '#사계절린넨', '#린넨원피스', '#엄마도예쁜옷', '#일본린넨', '#일본쇼핑', '#일본여행', '#오사카쇼핑', '#교토쇼핑', '#ootd', '#네스트로브', '#베리데코']"
눈 기선 살수 샤넬 만세,Orange Street,[]
그릇 못 몇개 요리 줄 무슨 그릇 함정 그릇 수 내공 한참 뒤 가치 듯 살림 쪼랩 것 아무 생각 간장 종류 별로 졸 졸 잔뜩 이 야매 새댁 최 기자 최 기자 교토 교토 쇼핑 오사카 쇼핑 살림 쪼랩 요리 쪼랩 그릇 쇼핑 살림 장만 간장 덕후 교토 여행 오사카 여행 칼질 칼 그릇 음식,,"['#야매새댁', '#최기자', '#교토쇼핑', '#오사카쇼핑', '#살림쪼랩', '#요리쪼랩', '#그릇쇼핑', '#살림장만', '#간장덕후', '#교토여행', '#오사카여행', '#칼질이어려워서칼을사봄', '#그릇은있는데음식이없어']"
얼마 전 일본 오사카 오직 유니 버셜 스튜디오 포켓몬 센터 위 여행 가이드 이모 덕분 난바 오사카 교토 등등 수 날 오늘 또 김씨 아빠 포함 못 안 여행 안 일 인지 하나 여행 엄마 간이 콩알 경험 일본 일본여행 오사카 오사카 여행 교토 난바 오사카 오사카 쇼핑 유니 버셜 스튜디오 재팬 유니 버셜 스튜디오 오사카 도톤보리 아시아나 항공 osaka japan kyoto universialstudiojapan 아시아나 비즈니스석 비지니스석 osaka japan kyoto universialstudiojapan,,"['#일본', '#일본여행', '#오사카', '#오사카여행', '#교토', '#난바', '#오사카성', '#오사카쇼핑', '#유니버셜스튜디오재팬', '#유니버셜스튜디오오사카', '#도톤보리', '#아시아나항공', '#osaka', '#japan', '#kyoto', '#universialstudiojapan', '#아시아나비즈니스석', '#비지니스석']"
크리스마스 오사카 여행 kg kg,Dotonbori Osaka,[]
금보 무료 마루 아파트먼트 호텔 mimaruapartmenthotel 비즈니스 호텔 일본 볼 수 형태 호텔 여기저기 볼 수 만큼 그 규모 무시 수 코로나 팬데믹 직전 일본 비즈니스 호텔 산업 규모 약 해 우리나라 전체 호텔 산업 약 배 수준 그 이유 비즈니스 호텔 경쟁력 덕분 우선 접근성 출장 자 타겟 호텔 기차역 지하철역 등 교통 요지 위치 다음 가격 레스토랑 수영장 등 공용 시설 최소 합리 가격 객실 제공 집중 덕분 비즈니스 호텔 출장 개인 여행 온 사람 인기 비즈니스 호텔 단점 객실 크기 보통 경우 평 성 급 객실 일반 평 정도 것 감안 절반 수준 셈 객실 크기 방이 비 느낌 공용 시설 최소 때문 호텔 내 수 공간 등 찾기 요미 마루 호텔 비즈니스 호텔 장점 단점 극복 전 호텔 마루 호텔 여러 지역 컨셉 운영 중 요 그 중 보드 게임 컨셉 마루 아파트먼트 호텔 남바 스테이션 시티 호 퍼스 직접 무엇 다른 직접 투숙 체험 요미 마루 아파트먼트 호텔 미리보기 비즈니스 사람 위 비즈니스 호텔 애물 단지 보물 단지 라운지 잠 시간 객실 호텔 전체 하나 게임 동네 호텔 미래 마루 아파트먼트 호텔 스토리 전문 프로필 링크 시티 호 퍼스 오사카 mimaruapartmenthotel,,"['#지금보면무료', '#미마루아파트먼트호텔', '#시티호퍼스', '#오사카']"
오늘 하루 하쿠나마타타 더 사주 더 간단 꿀팁 가지 팔로우 매일 오전 나 하루 운세 수 무료 사주 풀이 참여 오늘 운세 글 아래 댓글 하트 일주일 이상 참여 DM 캡처 인증 해주시 매일 더 사주 하쿠나마타타 에너지 소 원 성취 보아 더 내용 오늘 운세 다음 사주 스타 그램 운세 스타 그램 사주 상담 사주 곳 사주팔자 사주 리학 사주 풀이 쇼핑 샷 오사카 쇼핑 쇼핑 떼샷 쇼핑 호스트 커플룩 쇼핑몰 구제 쇼핑몰 괌 쇼핑 반려견 키링 반려견 옷 냥 간식 반려견 미용 반려 묘 스타 그램 DM,,"['#사주', '#사주잘보는곳', '#사주팔자', '#사주풀이', '#오사카쇼핑', '#커플룩쇼핑몰', '#구제쇼핑몰', '#괌쇼핑', '#반려견키링', '#반려견옷', '#냥이간식', '#반려견미용']"
travelcontents 간사이 쇼핑몰 travelcontents,,['#간사이쇼핑몰']
눈 귀요미 스누피 유니 버셜 스튜디오 재팬 호 캉스 일본여행 오사카 오사카 여행 오사카 맛집 오사카 쇼핑 오사카 호텔 여행 여행 스타 그램,Universal Studio Japan スパイダーマン,"['#유니버셜스튜디오재팬', '#호캉스', '#일본여행', '#오사카', '#오사카여행', '#오사카맛집', '#오사카쇼핑', '#오사카호텔', '#여행']"
간사이 공항 비 일기예보 걱정 구름 오사카 다행 비행기 쿨쿨 잠 잔 시율 오사카 여행 시작 오사카 오사카 여행 오사카 맛집 오사카 성 오사카 유니 버셜 스튜디오 오사카 오사카 쇼핑 오사카 여행 아이 오사카 아이 오사카 여행 육아 소통,간사이 국제공항,"['#오사카', '#오사카여행', '#오사카맛집', '#오사카성', '#오사카유니버셜스튜디오', '#오사카성', '#오사카쇼핑', '#오사카여행', '#아이와오사카', '#아이와오사카여행']"
도톤보리 글리코 구경 돈키호테 쇼핑 연휴 첫날 바로 면세 돈키호테 친구 부탁 샤샤 초콜릿 로키 소닌 파스 술 것 것 때 미리 살걸 마지막 날 한번 더 UFO 라면 대왕 유부 우동 식품 품절 한국 사람 한국어 도배 해외여행 간 느낌 안 여행 내내 족 시간 코너 사면 극락 매우 저렴 이 정도 여기 인형 다누 펀치 방 먹이 간 여기 뭔가 엄마 양말 것 도톤보리 도톤보리 강 도톤보리 경 도톤보리 글리코 도톤보리 리버 크루즈 도톤보리 거리 글리코 돈키호테 쇼핑 돈키호테 오사카 여행 일본여행 해외여행 오사카 쇼핑 오사카 난바 오사카 핫 신사이바시 연휴 여행 족 시간 일본여행 선물 면세점 쇼핑 선팔 맞팔 칼 맞팔 소통 반 반사 테러 첫 줄 반사 UFO,"Dotonbori Street, Osaka","['#도톤보리', '#도톤보리강', '#도톤보리야경', '#도톤보리글리코상', '#도톤보리리버크루즈', '#도톤보리거리', '#돈키호테쇼핑', '#돈키호테', '#오사카여행', '#일본여행', '#해외여행', '#오사카쇼핑', '#오사카난바', '#오사카핫플', '#신사이바시', '#연휴여행', '#휴족시간', '#일본여행선물', '#면세점쇼핑', '#선팔하면맞팔', '#칼맞팔', '#좋반', '#좋아요반사', '#좋아요테러', '#첫줄반사']"
물 맥주 더 오사카 여행 오사카 오사카 여행 오사카 맛집 오사카 쇼핑 난바 돈토 보리,,"['#오사카여행', '#오사카', '#오사카여행', '#오사카맛집', '#오사카쇼핑', '#난바', '#돈토보리']"
날씨 오사카,오사카성,[]
,Dotonbori Osaka,[]
이제 눈치 눈치 바람 왜 프란체스카,"Dotonbori, Osaka-Shi, Osaka, Japan",['#프란체스카']
젓가락 선물 아래 고양이 받침 상자 마음 귀요미 올케 일본 여행 뇌 것 메 오토 부부 젓가락 선물 오사카 쇼핑,,"['#메오토', '#젓가락선물', '#오사카쇼핑']"
오 타이산 제품 제공 맛점 저 만 황 가야 칼국수 샤브 이열치열 후루룩 맛 폭염 특보 구 날씨 식후 깝깝 오 타이산 포 생약 성분 모든 체질 요 냄새 코로 훅 몇번 계피 향 입자 분말 형태 숨 참고 권해 처럼 가루 사래 기분 탓 진 깝깝 스윽 해 개별 포장 기도 일본 국민 소 화제 구매 nanbamall 오 타이산 오 타이산 소 화제 일 소 화제 일본 숙취 난바 일본 쇼핑 일본 직구 오사카 쇼핑 nanbamall 맛점 샤브샤브 nanbamall nanbamall,,"['#오타이산', '#제품제공', '#황가야칼국수', '#오타이산', '#오타이산소화제', '#일본소화제', '#일본숙취', '#난바몰', '#일본쇼핑', '#일본직구', '#오사카쇼핑', '#nanbamall', '#맛점', '#샤브샤브']"
광고 오사카 항공권 도 SKT 휴대폰결제 로 고양이 와스프 막 힐링 겜 소 과금 돈키호테 쇼핑 리스트 어차피 체카 신 카 하나 하나 입력 소비 생활 저 아이폰 유저 아이클라우드 혜택 iCloud 최대 개월 무료 체험 이벤트 신청 기간 대상 iOS 기기 사용자 혜택 iCloud GB 최대 개월 무료 체험 개월 이후 자동 정상 요금 부과 월 부가세 포함 개월 추가 무료 체험 시 별도 절차 통해 최대 개월 무료 체험 가능 개월 추가 무료 체험 청구 할인 점 참고 신청 방법 페이지 아래 가입 버튼 누르기 코드 교환 페이지 지금 교환 버튼 누르기 개월 무료 확인 설정 완료 개월 추가 무료 체험 방법 페이지 아래 참여 버튼 누르기 Apple ID 지불 방법 휴대폰 설정 후 구독 갱신 완료 httpsdcbeventsktelecomcomepMjAyMzAyMjgwMDAwNzYx 간편 결제 SKT 휴대폰결제 SKT iCloud iOS iCloud GB Apple ID httpsdcbeventsktelecomcomepMjAyMzAyMjgwMDAwNzYx SKT,도톤보리,"['#광고', '#오사카항공권', '#휴대폰결제', '#아이폰', '#아이클라우드', '#간편결제', '#SKT휴대폰결제']"
아이미 언제 갑자기 아기 아기 엄마 딸 그램 개월 아기 코디 린넨 코디 린넨 코트 린넨 원피스 티디 내츄럴 코디 네스트 브 nestrobe 소 애 일리 데 일리 ootd 오사카 쇼핑 교토 쇼핑 nestrobe ootd,오사카 시,"['#아기랑', '#아기랑엄마랑', '#딸그램', '#30개월아기', '#30대코디', '#린넨코디', '#린넨코트', '#린넨원피스', '#오오티디', '#내츄럴코디', '#네스트로브', '#소애노데일리', '#데일리룩', '#ootd', '#오사카쇼핑', '#교토쇼핑']"
자 이번 오사카 간사이 공항 편입 니 잉 과자 것 꼭 추천 내 맘 RG 지금 공항 오 리스트 나하 하코다테 나리타 아오모리 코로나 영향 현재 판매 안 경우 수 습 여러분 일본여행 공유 사람 태그 tokyopass 를 해쉬태그 일본여행 로 사진 주말 꼭 공유 일본여행 오사카 여행 tokyopass RG tokyopass tokyopass,도쿄패스,"['#일본여행', '#오사카여행', '#tokyopass']"
주도 호쿠 스핀오프 유니클로 키티 티셔츠 발주 완료 정도 소요 조금 여유 요 일본 더 가격 wpc 비코 양산 호쿠 스핀오프 구매 요한 번 또 마이카 오징어 스낵 아몬드 멸치 칼디 카레빵 명란 빵 인기 브랜디 스틱 커피 아이스 밋있어 요즘 곧 hosinocookiss 생일 이벤트 준비 조금 다시 늘 관심 wpc hosinocookiss,,['#호쿠스핀오프에서']
PSG Popup Store Osaka psg store tokyo edifice PSG Popup Store Osaka psg store tokyo edifice,なんばパークス（Namba Parks）,[]
야마자키 리미티드에디션 야마자키 오사카 쇼핑 yamazakilimitededition whiskey yamazakilimitededition whiskey,,"['#야마자키리미티드에디션', '#야마자키2023', '#오사카쇼핑', '#yamazakilimitededition']"
간사이 공항 스시 바츠키 마고 몬 스시 다시 도전 생각 외로 여기 요기 주방 앞 서서 만큼 안 수도 스시 맛 여기 스시 목마름 좀 해결 기대 안해 더더 맛 오사카 여행 마무리 나위 스시 안 쓔 스팸 주먹밥 저걸 사 묵 편의점 어딧 고집 기절 돈키호테 다이소 세리 털 느므많 애비 도쿄바나나 애끼 우리 구름 모집 산책 옴 우리 오사카 여행 여행 기록 오사카 맛집 오사카 쇼핑 일본 쇼핑 오사카 맛집 오사카 여행 오사카 가족 여행 아이 오사카 쓔 아인 오사카 쓔 아인 여행,,"['#간사이공항', '#스시바', '#츠키지마고에몬', '#스시', '#편의점', '#느므많네', '#도쿄바나나', '#애끼묵는다고', '#오사카여행', '#나의여행기록', '#오사카맛집', '#오사카쇼핑', '#일본쇼핑', '#오사카맛집', '#오사카여행', '#오사카가족여행', '#아이들과오사카', '#쓔아인오사카', '#쓔아인여행']"
요즘 날씨 후디 반바지,道頓堀グリコサイン (Dotonbori Glico Sign),[]
끈 신상 원래 체리 고민 고민 해도 체리 큐빅 것 규 톡 때 것 요 번 구찌 신상 딸기 지갑 취향 저격 바로 겟뚜 소비 요정 이치고 딸기 매력 구찌 구찌 지갑 구찌 지갑 신상 신상 오사카 쇼핑 오사카 구찌 큐 백화점 가격 고민 감사 무니 gucci GUCCI 딸기 지갑 osaka 스트로베리 우메다 우메다 쇼핑 gucci GUCCI osaka,,"['#구찌신상', '#소비요정', '#잘샀네잘샀어', '#이치고', '#이쁘다', '#구찌', '#구찌지갑', '#구찌지갑신상', '#신상', '#오사카쇼핑', '#오사카구찌', '#한큐백화점', '#가격도착하지', '#감사하무니다', '#GUCCI', '#osaka', '#우메다', '#우메다쇼핑']"
조카바보 득템 유카타 두 벌 일본여행 꼭 아기 유카타 오사카 쇼핑 시티 카 혼포 득템,Hotel Sun White,"['#조카바보', '#득템', '#유카타', '#일본여행', '#아기유카타사주고', '#오사카쇼핑', '#게이한시티몰', '#아카짱혼포']"
축 입 꼬리 고민 라면 입 꼬리 성형 반영구 즉각 효과 부담 쏙 비용 경험 노하우 맞춤 수술 러블리 입 꼬리 이벤트 신청 프로필 링크 꾹입 꼬리 성형 입 꼬리 수술 입 꼬리 입 꼬리 수술 곳 입 꼬리 성형수술 입 꼬리 성형 곳 입 꼬리 성형 효과 입 꼬리 후기 강남 입 꼬리 성형 강남 성형 외과 선팔 맞팔 여행 스타 그램 오사카 쇼핑 교토 카페 셀피 그램 거울 샷 인 친구 함 벚꽃 네일 여의도 벚꽃 축제 석촌호수 벚꽃 데이트 그램,,"['#입꼬리성형', '#입꼬리성형', '#입꼬리수술잘하는곳', '#입꼬리성형잘하는곳', '#입꼬리성형효과', '#입꼬리후기', '#강남입꼬리성형', '#강남성형외과', '#선팔100', '#맞팔100', '#오사카쇼핑', '#교토카페', '#거울샷', '#인친구함', '#벚꽃네일', '#여의도벚꽃축제', '#석촌호수벚꽃']"
구 리코 핫 한국 커플 오사카 가족사진 오사카 맛집 서울 공유 사진 못 끼니 뿌시러 오사카 여행 자매 스타 그램,道頓堀グリコサイン (Dotonbori Glico Sign),"['#오사카', '#오사카맛집', '#오사카여행']"
오늘 하루 하쿠나마타타 더 사주 더 간단 꿀팁 가지 팔로우 매일 오전 나 하루 운세 수 무료 사주 풀이 참여 오늘 운세 글 아래 댓글 하트 일주일 이상 참여 DM 캡처 인증 해주시 매일 더 사주 하쿠나마타타 에너지 소 원 성취 보아 더 내용 오늘 운세 다음 사주 스타 그램 운세 스타 그램 사주 상담 사주 곳 사주팔자 사주 리학 사주 풀이 쇼핑 샷 오사카 쇼핑 쇼핑 떼샷 쇼핑 호스트 커플룩 쇼핑몰 구제 쇼핑몰 괌 쇼핑 반려견 키링 반려견 옷 냥 간식 반려견 미용 반려 묘 스타 그램 DM,,"['#사주', '#사주잘보는곳', '#사주팔자', '#사주풀이', '#오사카쇼핑', '#커플룩쇼핑몰', '#구제쇼핑몰', '#괌쇼핑', '#반려견키링', '#반려견옷', '#냥이간식', '#반려견미용']"
스시 회전초밥 간사이 공항 일본도 스시 집 오늘 꼭 다짐 가장 먼저 계란 초밥 왕꿀맛 역시 에피타이저 계란 오사카 맛집 오사카 여행 오사카 쇼핑 오사카 여행 코스 오사카 여행 팁 오사카 오사카 여행 차,関西エアポート株式会社ー 𝙺𝚊𝚗𝚜𝚊𝚒 𝙰𝚒𝚛𝚙𝚘𝚛𝚝𝚜,"['#스시', '#회전초밥', '#간사이공항', '#역시', '#에피타이저는', '#계란으로', '#오사카맛집', '#오사카여행', '#오사카쇼핑', '#오사카여행코스', '#오사카여행팁', '#오사카', '#오사카여행1일차']"
오사카 여행 오사카 쇼핑 트란시노 오사카 쉐라톤 코 호텔 돈카츠 카 오사카공항 버스 닷 사이 제 터미널 닷 사이 남자 둘 마지막 오사카 호 캉스 쉐라톤 코 호텔 체크 라운지 음료 간식 바로 쇼핑 호텔 근처 트란시노 기미 계속 제품 보 친구 하나 구매 일본 초반 이틀 시장조사 때 돗톤 보리 근처 약국 가장 쌋었던 기억 여분 간후 구매 후 맛집 호텔 근처 식당 돈카츠 카 입장 숙소 라운지 라운지 사람 서방 전화 안내 연락 라운지 음식 마감 전 봣 더니 직원 능화 좀 직원 음식 먼저 친구 마사지 혼자 남아 라운지 문 시간 맥주 드링킹 자고 일어나서 조식 공항버스 타고 공항 출발 친구 터미널 터미널 함 이번 여행 난 수화물 호텔 온 맥주 빵 셀프 수속 마치 쇼핑 봣 닷 사이 이 보 먼저 누나 말 구매 부탁 병 구매 이번 여행 환전 왓 일행 환전 뭐 나니 땐 손 돈 잔돈 이 전부,,"['#오사카여행', '#오사카쇼핑', '#트란시노2', '#오사카쉐라톤미야코호텔', '#돈카츠카와라', '#오사카공항버스', '#닷사이23', '#제2터미널닷사이2024년']"
하나 무사 도착 오사카 쇼핑 그릇 초이스 맘에듬,,['#오사카쇼핑']
오사카 쇼핑 여행 목적,우메다,"['#오사카쇼핑', '#여행의목적']"
