chunked_content,place,relevant_hashtags
작년 최초 출시 인기 킷 사막 쿠다 방맥 메뉴 다시 판매 기간 꼭 확인 가시 일본 쇼핑 정보 도쿄 패스 쇼핑 내 여행 자랑 사람 태그 tokyopass 를 해쉬태그 도쿄 패스 로 사진 주말 꼭 공유 일본여행 일본 맛집 tokyopass tokyopass tokyopass,日本,"['#도쿄패스', '#도쿄패스', '#일본여행', '#일본맛집', '#tokyopass']"
거 옆 타코야키 가게 시선 편 일본여행 일본 일본인 오사카 오사카 여행 오사카 맛집 japan osaka 오사카 쇼핑 오사카 여행 일본 카페 난바 난바 맛집 ootd ootdfashion takoyaki japan osaka ootd ootdfashion takoyaki,오사카,"['#일본여행', '#일본', '#일본인', '#오사카', '#오사카여행', '#오사카맛집', '#japan', '#osaka', '#오사카쇼핑', '#오사카여행', '#일본카페', '#난바', '#난바맛집', '#ootd', '#ootdfashion', '#takoyaki']"
오늘 이온 산 켄 메이크 블러셔 섀도우 돈키호테 나 드럭스토어 마지막 날 쇼핑 안 구입 함 면세 품 포장 안 채 처 낼 아침 한번 일본여행 도톤보리 osaka 오사카 여행 오사카 자유여행 여행 스타 그램 오사카 쇼핑 일본 화장품 canmake osaka canmake,,"['#이온몰', '#돈키호테', '#면세품', '#일본여행', '#도톤보리', '#osaka', '#오사카여행', '#오사카자유여행', '#오사카쇼핑', '#일본화장품']"
제품 제공 다음주 벌써 크리스마스 효 니들스 슈프림 베 이프 등등 일본 구매 대행 문의 aaoaao 이벤트 관부 오사카 쇼룸 오사카 쇼핑 리스트 오사카 쇼핑 일 편집 aaoaao,스웨이 커피 스테이션,"['#제품제공', '#오사카쇼핑리스트', '#오사카쇼핑', '#일본편집샵']"
오사카 가면 글코 필 th 길 낮 밤 구 둘 움 성 수기 때 밤 사람 도라방스였 낮 반전 완전 휑 점등 시간 해 지기 전 소등 오전 더 일찍 소등 날 함 Chome Dotonbori Chuo Ward Osaka 구글지도 도톤보리 에비스 다리 고 난바역 도보 거리 움 쿠쿠 다스 아슠림 th Chome Dotonbori Chuo Ward Osaka,도톤보리,[]
지금 다음 날 또 간 아이스크림 집사 장님 매우 엄근진 그녀 성공,오사카 신사이바시,[]
일본 오사카 쇼핑 이토 카 마트 가지 추천 일본 여행 가면 매일 편의점 쇼핑 이토 카 일본 대표 슈퍼 세븐 일레븐 SEVENi Groupe 의 기업 SEVEN PREMIUM 상품 SEVENi Group 의 각 사의 상품 개발 담당자 개발 출시 만큼 마트 쇼핑 제대로 이토 카 마트 고고 면세 여권 꼭 이토 카 먹거리 위주 베스트 고베 후게츠 고프르 센베 과자 모 코 면 밥 DADACA DRIPCAT 드립커피 SAISON FACTORY 당근 드레싱 슈가 버터 트리 버터 스테이 츠 쿠키 닛신 고로 구라 씨리얼 이토 카 아베 노점 영업 시간 지하 층 층 층 면세 카운터 쇼핑 리스트 일본 슈퍼 오사카 쇼핑 오사카 쇼핑 리스트 오사카 마트 오사카 슈퍼 오사카 편의점 japantravel japantrip osakaitoyokado SEVENi Groupe SEVEN PREMIUM SEVENi Group DADACA DRIPCAT SAISON FACTORY japantravel japantrip osakaitoyokado,,"['#이토요카도', '#일본쇼핑리스트', '#일본슈퍼', '#오사카쇼핑', '#오사카쇼핑리스트', '#오사카마트', '#오사카슈퍼', '#오사카편의점', '#japantravel', '#japantrip', '#osaka', '#itoyokado']"
일본 day 둘째 날 마지막 스케줄 유니 버셜 도톤보리 사실 유니버셜 일정 안 비소 식이 유니버셜 워낙 오사카 가면 곳 법도 또 불 글리코 안 저희 킨류 라멘 애 이치란 더 아주 완 야경 숙소 근처 라이프 마트 초밥 사서 숙소 취침 누누 보 체력 덕분 아주 일정 것 일본 일본여행 오사카 오사카 여행 도톤보리 도톤보리 맛집 킨류 라멘 라멘 오사카 맛집 라이프 마트 오사카 쇼핑 일본 쇼핑 가족 여행 여행 스타 그램 day,,"['#일본', '#일본여행', '#오사카', '#오사카여행', '#도톤보리', '#도톤보리맛집', '#킨류라멘', '#라멘', '#오사카맛집', '#라이프마트', '#오사카쇼핑', '#일본쇼핑']"
오사카 쇼핑 일본 쇼핑 템 NO 네이버 후드 맘 슈프림 옷 첫 구매 꼼데 재고 선물 템 킬빌 신발 를 도 불스 저지 못 난가 머리 발끝 PSG 스토어 마치 산드로 매장 APC XL 앤드 원더 때 럭키 오사카 하루 오사카 여행 NO PSG APC XL,,"['#오사카쇼핑', '#오사카하루', '#오사카여행']"
구석 내 진짜 빈티 샵 제품 진짜 취향 저격 가격 한참 구경 감탄 진짜 갖 라라 빈티 오사카 오사카 빈티 오사카 쇼핑 오렌지 스트리트 osakaosakavintageshopvintagejapan osakaosakavintageshopvintagejapan,,"['#라라빈티지', '#오사카', '#오사카빈티지', '#오사카쇼핑', '#오렌지스트리트', '#osaka', '#osakavintageshop', '#japan']"
도쿄바나나 러버 주목 도쿄바나나 이번 소개 도쿄바나나 오 리지 널 스티커 세트 도쿄바나나 오 리지 널 상품 도쿄바나나 한정 스티커 포함 제품 리뉴얼 간사이 국제공항 국제선 제 터미널 면세점 현재 절찬 리 판매 리뉴얼 도쿄바나나 점포 키 오스 모든 제품 주문 키 오스 상품 주문 계산 상품 결제 카운터 상품 픽업 간사이 공항 면세점 도쿄바나나 점포 도쿄바나나 오 리지 널 스티커 세트 판매 장소 간사이 국제공항 후쿠오카 국제공항 나하 공항 구마모토 공항 오이타 공항 히로시마 공항 기타큐슈 공항 미야자키 공항 가고시마공항 국제선 판매 장소 변동 가능성 라인업 개입 세금 포함 개입 세금 포함,,[]
수건 알 톡 세탁 집 전체 세상 향 솔솔 세제 얼 신랑 구 저 그 만인 캡슐 세제 또 가정 구 rojaezzang 항상 고마 용 rojaezzang,울산,[]
참나 맨즈 이즈 참나 호빵맨 컵라면 또 왜 킨 keenHOODMOCgorpcore 울 아가씨 오사카 여행 사진 한장 텅 장각 드릉드릉 오사카 쇼핑 살로 몬 salomon 트레킹 코어 등산 keenHOODMOCgorpcore salomon,,"['#울아가씨가오사카여행중쏘아올린사진한장', '#텅장각', '#드릉드릉', '#오사카쇼핑', '#살로몬', '#트레킹화', '#고프코어룩', '#등산룩']"
뽈뽈뽈,Umeda Hankyu,[]
티디 패션 공항 패션 아침 스시 뿌시 다이소 돈키 나물 욕 ZERO 살 이번 여행 카 soldout brush 돈키호테 이제 답방 한국 도착 후 kansaiairports 오사카 여행 오사카 여행 오사카 쇼핑 역광 역광 사진 일본여행 오사카 자유여행 여행 기록 여행가 또 일본 쇼핑 담 나고야 여행 여행 그램 여행사진 간사이 간사이 공항 간사이 국제공항 로이스 초콜렛 청 치마 청 치마 코디 운동화 코디 청바지 티 ZERO soldout brush kansaiairports,関西エアポート株式会社ー 𝙺𝚊𝚗𝚜𝚊𝚒 𝙰𝚒𝚛𝚙𝚘𝚛𝚝𝚜,"['#오오티디패션', '#공항패션', '#치이카와', '#돈키호테', '#오사카여행', '#오사카여행', '#오사카쇼핑', '#역광', '#일본여행', '#오사카자유여행', '#여행기록', '#여행가고싶다', '#또가고싶다', '#일본쇼핑', '#나고야여행', '#여행그램', '#간사이', '#간사이공항', '#간사이국제공항', '#로이스초콜렛', '#청치마', '#청치마코디', '#운동화코디', '#청바지에흰티']"
띠용 갑자기 오사카 온 이유 커밍 주말 여행 주말 일상 일요일 아침 일본여행 오사카 여행 오사카 카페 오사카 쇼핑 오사카 여행 오사카 자유여행 오사카 먹방 p 의 여행 무 계획 여행 얼굴 여행 코디 여행 여행 맞팔 여행 소통 티 티디 패션 티티 티디 ootd 티디 그램 패션 소통 패션 인스타 패션 계정 맞팔 패션 계정 패션 계정 환영 패션 계정 소통 관람차 뷰 맛집 p ootd,,"['#주말여행', '#주말일상', '#일요일아침', '#일본여행', '#오사카여행', '#오사카카페', '#오사카쇼핑', '#오사카여행', '#오사카자유여행', '#오사카먹방', '#p의여행', '#무계획여행', '#얼굴', '#여행코디', '#여행룩', '#여행맞팔', '#오오티', '#오오티디패션', '#오오티티', '#오오티디ootd', '#오오티디그램', '#패션계정맞팔', '#패션계정', '#패션계정환영', '#패션계정소통', '#관람차', '#뷰맛집']"
오사카 돈키호테 쇼핑 리스트 추천 템 저 돈키호테 도톤보리 미도스지 점 의약품 층 바로 이동 콜라겐 C 젤리 핑크색 타 C 젤리 노란색 콜라겐 C 젤리 글루코사민 콘드 이친 비타민 C 유 피부 미백 탄력 도움 수 오 타이산 A 체 때 때 속 때 위장 약 위 로이 츠 보코 COOL 전 파스 츠 보코 직경 센치 센치 두 가지 종류 어깨 허리 관절 등 수 CURE 엑스트라 오일 클렌징 ml 차 클렌징 각질 관리 모 공 관리 블랙 헤드 쏙쏙 제거 무엇 색조 화장 Kracie 터닝 케어 악용 화이트 닝 세 럼 ml 고순 비타민 C W 유효 성분 배합 자외선 트러블 피부 보호 역할 해 오사카 쇼핑 추천 돈키호테 주소 구글맵 돈키호테 도톤보리 미도스지 점 검색 운영 시간 운영 도톤보리 글리코 도보 내 오사카 돈키호테 도톤보리 미도스지 점택 스프 리 위치 건물 층 면세 카운터 준비물 여권 개월 이내 입국 도장 카드 현금 조건 세금 포함 이상 구매 시 더 여행 정보 minekoo 계정 팔로우 후 minekoo minekoo 매 여행 오사카 제작 지원 C C C C A COOL CURE ml Kracie ml C W minekoo minekoo minekoo,,['#매일이여행']
세계 목욕 가장 사랑 나라 일본 그 목욕 문화 요 한국 다른 일본 온천 문화 일본 소도시 정보 프로필 내 태그 웹사이트 링크 참조,일본,[]
일본 퀄리티 편의점 음식 컵라면 궁합 삼각김밥 대부분 한국 사람 맛 새우 마요네즈 삼각김밥 추천 항상 일본 편의점 삼각김밥 진짜 일본 가기 전 이 글 저장 가기 해외여행 출발 여행 무작정 오사카 교토 가이드북 더 알 수 계획 형 지금 바로 팔로우 travelgilbut 여행가 친구 공유 해외여행 오사카 여행 일본 편의점 음식 일 편의점 travelgilbut,,"['#해외여행', '#오사카여행', '#일본편의점음식', '#일본편의점털기']"
해외여행 전 필수 확인 것 꼭 나라 별 필수 쇼핑 템 가면 안 여행 정보 interparktour 팔로우 tip 인터파크 투어 여행 쇼핑 나라 별 쇼핑 리스트 interparktour tip,,['#쇼핑']
coupon HEP hepfive osaka osakatrip osakacafe umeda umedacafe umedafood osakastation 오사카 오사카 여행 오사카 맛집 오사카 카페 오사카 쇼핑 우메다 kyotocafe nagoyacafe kobecafe coupon HEP hepfive osaka osakatrip osakacafe umeda umedacafe umedafood osakastation kyotocafe nagoyacafe kobecafe,𝐂𝐚𝐟𝐞 𝐇𝐮𝐬𝐡,"['#osaka', '#osakatrip', '#osakacafe', '#umeda', '#umedacafe', '#umedafood', '#osakastation', '#오사카', '#오사카여행', '#오사카맛집', '#오사카카페', '#오사카쇼핑', '#우메다', '#kyotocafe', '#nagoyacafe']"
누군가 오사카 간다 꼭 추천 곳 저장 오사카 때 보기 오렌지 스트리트 소품 편집 꼭 가야 함 가로수길 경리 압구정 로데오 방앗간 편집 행복 사 여기 땐 꼭 빈손 손 가득 햅 파이브 전망대 오사카 야경 가장 곳 볼 수 전망대 고소공포증 밑 보지 말기 BB 아메리카무라 프리 마켓 BB 헬로키티 에반게리온 서브컬처 아이템 빈티 나이키 시계 캐논 카메라 사케 잔 빈티 박물관 우메다 요시노 스시 우메다역 지하 푸드코트 초밥 집 대여섯 가게 전통 장인 초밥 퀄리티 bird 도톤보리 조금 수 재즈 감성 주인 아저씨 일본 올드 재즈 취하 숙소 전 마지막 코스 제격 오사카 오사카 여행 오사카 쇼핑 오사카 코스 오사카 맛집 오사카 카페 오사카 자유여행 오사카 먹방 여행 코스 추천 일본여행 BB BB bird,"Osaka, Japan","['#오사카', '#오사카여행', '#오사카쇼핑', '#오사카코스', '#오사카맛집', '#오사카카페', '#오사카자유여행', '#오사카먹방', '#일본여행']"
도쿄 패스 카톡 오픈 채팅 방 일본 가면 꼭 쇼핑 템 대해 이야기 실제 구 매 경험 아이템 투표 결과 중 상위 랭킹 쇼핑 템 소개 그 외 여러분 생각 추천 템 댓글 여행 자랑 사람 태그 tokyopass 를 해쉬태그 도쿄 패스 로 사진 일요일 꼭 공유 일본여행 일본 쇼핑 tokyopass tokyopass tokyopass,ドン・キホーテ 道頓堀御堂筋店,"['#도쿄패스', '#일본여행', '#일본쇼핑', '#tokyopass']"
이제야 오사카 구매 제품 돈키호테 정도 구매 꼼데가르송 바오 바오 러쉬 GU Bershka 무인양품 IDEE 등 원래 러쉬 거의 반값 로 잼 보디 스프레이 x 왕 구매 러쉬 제품 인스타 글 또 의외 득템 엄마 나 동생 셋 이서 구매 데 IDEE 에코 색감 튀어 포인트 비 오레 선크림 꼭 오사카 하울 오사카 쇼핑 오사카 쇼핑 리스트 쇼핑 쇼핑 리스트 일본 일본 쇼핑 GU Bershka IDEE x IDEE,,"['#오사카', '#돈키호테', '#꼼데가르송', '#바오바오', '#러쉬', '#무인양품', '#러쉬', '#이데샵', '#오사카하울', '#오사카쇼핑', '#오사카쇼핑리스트', '#쇼핑', '#일본', '#일본쇼핑']"
오사카 현 지인 빈티 쇼핑 스팟 나카 자키 초 빈티 샵 잡화 점 현지 MZ 동네 오사카 현지 PICK 나 알 빈티 쇼핑 스팟 더 오사카 인기 명소 트리플 확인 triplekr 프로필 링크 클릭 MZ PICK triplekr,"Nakazakicho , Japan",[]
광고 모기 접근 금지 모기 물리 가요 전 모기 한번 물리 퉁퉁 부어 정도 편이 제피 유독 편이 늘 모 기 패치 달 살 여행 때 꼭 모 기 패치 진짜 온몸 곳곳 제 모기 패치 것 것 사용 호빵맨 모 기 패치 건 못 거 제 일본 여행 때 쇼핑 리스트 무조건 구매 것 하나 일본 여행 가지 못 때 직구 쇼핑몰 난바 구입 구매 일본 판매 여러가지 종류 일본 직구 난바 선 구입 수 일본 쇼핑몰 리스트 구매 직구 구매 수 최고 호빵맨 모기 패치 모기 패치 일 모 기 패치 캠핑 용품 여름 필수 난바 일본 쇼핑 일본 직구 오사카 쇼핑,,"['#광고', '#호빵맨모기패치', '#모기패치', '#일본모기패치', '#여름필수', '#난바몰', '#일본쇼핑', '#일본직구', '#오사카쇼핑', '#nanbamall']"
쇼핑 다시 난바 도톤보리 글리코 신사이바시 오렌지 스트릿 오사카 오사카 쇼핑 쇼핑 일본 쇼핑 슈프림 스 투시 비비안 웨스트우드 아트 모스 돈키호테 빈티 빈티 샵 osakastyle osaka nanba dotonbori glico shinsaibashi shopping shop orangestreet supreme stussy vivianwestwood redlabel donquixote osakastyle osaka nanba dotonbori glico shinsaibashi shopping shop orangestreet supreme stussy vivianwestwood redlabel donquixote,오사카 난바,"['#난바', '#도톤보리', '#신사이바시', '#오렌지스트릿', '#오사카', '#오사카쇼핑', '#쇼핑', '#일본쇼핑', '#슈프림', '#스투시', '#아트모스', '#돈키호테', '#빈티지', '#빈티지샵', '#osakastyle', '#osaka', '#shinsaibashi', '#orangestreet']"
오렌지 스트릿 세 컨핸 샵 누비 오사카 가면 빈티 샵 꼭 구 모델 상태 제품 하루 보 쇼핑 오사카 쇼핑 오 사 카빈 티 샵 오사카 여행 일본여행 오렌지 스트릿 osaka japan ndstreet kindal hedy osaka japan ndstreet kindal hedy,"Osaka, Japan","['#오사카쇼핑', '#오사카빈티지샵', '#오사카여행', '#일본여행', '#오렌지스트릿', '#osaka', '#japan', '#kindal']"
오사카 지인 쿠키 선물 오사카 살 수 쿠키 레트로 느낌 디자인 색감 케이스 속 쿠키 가득 뚜껑 열 자마자 버터 향 솔솔 오늘 협찬 주시 AGF 드립 커피 커피 쿠키 오후 시간 일본 추억 나라 지인 곳 예보 태풍 등 안 뉴스 아무 일 늘 나날이 바 color tin AGF A friend from Osaka sent me a cookie gift It is a cookie that can only be bought in Osaka Inside the case with a nice retro designIts full of deliciouslooking cookies Delicious butter scent as soon as I opened it Today I ate cookies with AGF coffee It was a happy afternoon with delicious coffee cookies Japan is a place where close friends liveI heard some bad news about earthquakesI hope you have a peaceful and happy day without anything happening 선물 쿠키 커피 agfagf 드립커피 드립커피 추천 일 오사카 오사카 쇼핑 오사카 기념품 agf teatimecoffeepresentjapancookies AGF color tin AGF A friend from Osaka sent me a cookie gift It is a cookie that can only be bought in Osaka Inside the case with a nice retro designIts full of deliciouslooking cookies Delicious butter scent as soon as I opened it Today I ate cookies with AGF coffee It was a happy afternoon with delicious coffee cookies Japan is a place where close friends liveI heard some bad news about earthquakesI hope you have a peaceful and happy day without anything happening agfagf agf teatimecoffeepresentjapancookies,,"['#쿠키', '#agf', '#일본', '#오사카', '#오사카쇼핑', '#오사카기념품', '#agf', '#japan']"
나 주부 하이 홈 오사카 쇼핑 타마 스타벅스 밀크 포머 새댁 새댁 일상,,"['#하이홈', '#오사카쇼핑', '#우타마로', '#새댁', '#새댁일상']"
minzzinique osaka 오사카 쇼핑 메종 마르지 엘라 minzzinique trip minzzinique osaka minzzinique trip,오사카 시,"['#오사카쇼핑', '#메종마르지엘라']"
미혼 일 땐 감흥 곳 애 엄마 시오니 신세계 역시 일본 육아용품 기 옷 괌 가세 여행 중 로이 잠깐 의 여유 고민 카 혼포 쇼핑 구경 정말 겨우 겨우 참고 꼭 곤욕 벌써 중 개 개시 공항 길 아울렛 gap 가격 아기 옷 보고 정신 잠깐 놨다 시간 제대로 쇼핑 못 온 이 라면 캐리어 무게 초과 다음 번 빈 캐리어 하나 더 요 개월 아기 생후 개월 일본 오사카 여행 오사카 쇼핑 일본 육아용품 일본 쇼핑 육아용품 카 혼포 아가 짱 혼포 육아 쇼핑 육 아스타 그램 맘 스타 그램 딸 스타 그램 줌마 육아 맘 서울 맘 원숭이 띠맘 여행 스타 그램 japan osaka travel shopping instababy instagood instalike instalove instadaily gap japan osaka travel shopping instababy instagood instalike instalove instadaily,Osaka Japan,"['#10개월아기', '#일본', '#오사카여행', '#오사카쇼핑', '#일본육아용품', '#일본쇼핑', '#육아용품', '#아카짱혼포', '#아가짱혼포', '#육아', '#쇼핑', '#젊줌마', '#육아맘', '#서울맘', '#원숭이띠맘', '#japan', '#osaka']"
건축물 산책 키 타 하마 숍 카페 코 호로 도 건축물 층 위치 건물 숍 느낌 스콘 하나 꿀꺽 투 느낌 볼 하나 조금 무소유 마야 뭐 yayo osaka 호쿠 고독 출장 yayo osaka,喫茶室Kohoro（コホロ）,"['#야요', '#yayo', '#호쿠고독한출장러']"
이번 꼭 보기 약속 마메 시바 아가 내내 힐링 은,"Osaka, Japan",[]
순간 추억 여행 시작 osakatravel 오사카 여행 오사카 쇼핑 osakatravel,오사카 시,"['#osakatravel', '#오사카여행', '#오사카쇼핑']"
한국인 관광객 점점 큐 백화점 우메다 본점 이번 소개 디저트 맛집 도쿄바나나 자매 브랜드 바움 쿠헴 맛집 긴자 넨린 nenrinya 이번 추천 제품 개별 포장 입 스트레이트 바움 야와라 카메 카스텔라 일품 후 입 마운트 바움 싯카 리메겉 안쪽 일품 후 입 마운트 바움 오맛챠 우지 말차 향 가득 후 입 마운트 바움 브라우니 듬뿍 카카오 감칠맛 후 입 바움 종합 세트 종류 개입 무려 겨울 한정판 선물 개별 포장 후 오사카 여행 오시 큐 백화점 우메다 본점 제철 디저트 꼭 한번 구입 큐 백화점 우메다 본점 지하 층 주소 Kakudacho Kitaku Osakashi Osaka nenrinya Kakudacho Kitaku Osakashi Osaka,,[]
오사카 샵 투어 일본 여행 분 관광지 투어 옷 우리 관광지 쇼핑 투어 선호 내 이야기 MBTI P 의 성향 이번 오사카 때 계획 잡지 성공 샵 투어 자부 공유 다오 사카 쇼핑 만 지역 난바 Namba 우메다 Umeda 오렌지 스트리트 오렌지 스트리트 리얼 맥코이 대부분 빈티 취급 샵 다음 콘텐츠 난바 namba 유동 인구 도심 답 빔 Beams 유나이티드 애로우즈 United arrows 뷰티 앤 유스 BeautyYouth 비 Bshop 널 스탠다드 히노 Hinoya 등 다카시마야 난바파크스 쇼핑 투어 개인 빔 beams PB 상품 위주 로만 난바 점 우메다 점 추천 다비 발 위주 오어 슬로우 버즈 릭슨 코 모리 캡틴 선샤인 등 브랜드 볼 수 역시 난바 점 우메다 점 볼 게 더 널 스탠다드 프레드 페리 라코스테 위주 한국 다른 진짜 프레드 페리 라코스테 수 가장 추천 샵 노야 버거 스 플러스 버즈 릭슨 웨어하우스 슈가 케인 등 가장 눈 샵 방문 가치 우메다 umeda 우메다 또한 다이마루 백화점 중심 샵 자리 잡고 앞서 언급 난바 샵 대부분 나 우메다 빔 비 방문 추천 난바 매장 상대 볼 게 빔 난바 점 건 폴로 랄프 로렌 리복 의외 브랜드 볼 수 다비 또한 규모 커서 외 아크 로 등 국내 매장 볼 수 브랜드 경험 수 일본 편집 샵 장점 매장 특성 상대 점 다각 편집 전개 브랜드 별 주 모델 심심 치 볼 수 샵 스태프 또한 멋 그 열정 서비스 또한 경험 수 무엇 장점 일본 브랜드 국내 가격 구 수 점 대신 구두 일본 사지 말 대체로 한국 MBTI P Namba Umeda namba Beams United arrows BeautyYouth Bshop Hinoya beams PB umeda,"Osaka, Japan","['#난바', '#namba', '#우메다', '#umeda']"
야마자키 볼 부터 수량 한정 발매 산토리 프리미엄 하이 볼 야마자키 suntory premium highball yamazaki 용량 ml 알코올 도수 가격 세금 포함 산토리 위스키 주년 기념 수량 한정 상품 산토리 프리미엄 하이 볼 야마자키 지난 의 하쿠슈 출시 은 산토리 창업 토리이 신지 야마자키 의 땅 위스키 생산 시작 이 해이 쿠슈 마찬가지 야마자키 증류 소의 원주 사용 대략 개 정도 수량 한정 것 소식 야마자키 증류 소의 모습 야마자키 브랜드 컬러 디자인 캐치프레이즈 미즈 여운 위스키 숙성 사용 미즈 나무 오크 통 향 일본인 향 수 처음 때 얘 돈 맛 문제 향 좀 좀더 야마자키 캔 냉장고 보관 뒤 얼음 부어 것 캔 실온 보관 때 얼음 부어 것 낫 즉 온도 조금 설정 것 좀더 야마자키 위스키 느낌 지난 번 하쿠슈때 이번 야마자키 하이 볼 가격 대한 이야기 시중 판매 하이 볼 캔 비 약 배 정도 가격 일본 이자카야 음식점 야마자키 하이 볼 이상 가격 판매 것 생각 일단 나 수긍 간다 현재 마트 편의점 판매 하쿠슈 피드때 마트 보시 것 듯 재고 수 및 진열 수가 편의점 조금 마트 개 이상 번 수급 좀 편이 앞 말 대략 개 정도 생산 예정 나 첫날 살짝 구입 산토리 프리미엄 볼 야마자키 suntorypremiumhighballyamazaki 산토리 주년 산토리 주년 야마자키 볼 산토리 위스키 산토리 위스키 볼 도쿄 맛집 오사카 맛집 후쿠오카 맛집 도쿄 쇼핑 오사카 쇼핑 후쿠오카 쇼핑 일본 쇼핑 일본 쇼핑 리스트 야마자키 하이 볼 highball 야마자키 위스키 yamazakihighball 수량 한정 기억 저편 일본 suntory premium highball yamazaki ml suntorypremiumhighballyamazaki highball yamazakihighball,"Yakuin, Chuo-ku","['#야마자키하이볼', '#산토리프리미엄하이볼야마자키', '#suntorypremiumhighballyamazaki', '#산토리100주년야마자키하이볼', '#산토리위스키', '#산토리위스키하이볼', '#도쿄맛집', '#오사카맛집', '#후쿠오카맛집', '#도쿄쇼핑', '#오사카쇼핑', '#후쿠오카쇼핑', '#일본쇼핑', '#일본쇼핑리스트', '#야마자키', '#하이볼', '#야마자키위스키', '#yamazakihighball', '#수량한정', '#기억저편']"
오사카 Salon du Kuma Kitashinchi 마지막 날 점심 간 규 오 마카 세 가지 코스 중간 것 전부 프라이 빗 룸 분위기 아주 음식 메인 마블링 고기 거의 기름 인 느낌 기름 끼 개인 닥 다른 요리 분위기 서비스 마지막 만찬 저녁 가격 대가 점심 기 곳 듯 Salon du Kuma kitashinchi Kita Ward Dojimahama Chome F Dojima Nakanishi Bld 점심 Salon du Kuma Kitashinchi Salon du Kuma kitashinchi Kita Ward Dojimahama Chome F Dojima Nakanishi Bld,Salon du kuma3 北新地,[]
진짜 남자 왜 사고 표정 남편 술 코너 앞 가면 다른 남편 라이프 센트럴 스퀘어 난바 점 현 지인 대형 마트 현 지인 도시락 초밥 편의점 가격 퀄리티 택 스프 리 가능 호텔 가지 과자 소스 반찬 등등 마트 쇼핑 꼭 오사카 난바역 거리 매우 오사카 라이프 마켓 오사카 쇼핑 오사카 마트,なんば Namba,"['#라이프센트럴스퀘어난바점현지인들이', '#오사카라이프마켓', '#오사카쇼핑', '#오사카마트']"
어른 놀이터 백화점 쇼핑 간 곳 완구 코너 퍼즐 정신 못 프라모델 쇼핑 산 조형 수업 영감 거 거 알쥐 텍 스프 리 횡재 기분 장난감 코너 사랑 어른 퍼즐 오사카 쇼핑,,"['#장난감코너를사랑하는어른', '#신기한퍼즐', '#오사카쇼핑']"
