chunked_content,place,relevant_hashtags
우리 끼리 오사카 여행 친구 여행 나라 해외여행 특 혜택 쿠팡 여행 확인 스페인 여행 산티아고 순례 길 오사카 오사카 쇼핑 사이판 다이빙 괌 여행 푸켓 여행 방콕여행 왓 포사 세부 여행 우정 여행 쿠팡,,"['#오사카여행', '#친구랑여행', '#해외여행', '#쿠팡여행', '#스페인여행', '#산티아고순례길', '#오사카성', '#오사카쇼핑', '#사이판다이빙', '#괌여행', '#푸켓여행', '#방콕여행', '#왓포사원', '#세부여행', '#우정여행', '#쿠팡']"
오늘 수박 바 날 책 팔 리지 시대 서점 동네 서점 요 오사카 세이 책방 매출 책를 팔 아야 고민 책 대신 북 커버 주목 북 커버 책 거 발상 세상 북 커버 위트 소개 SNS 도 시작 세이 도의 북 커버 순식간 일본 전역 실제 고객 발길 늘 매출 세이 북 커버 확인 요 책 대신 북 커버 위트 아이디어 발견 글로벌 트렌드 여행 cityhoppersco seiwado book store SNS cityhoppersco seiwado book store,,[]
행복,なんば Namba,[]
일본 콘마 꼭 거 예전 한번 꼭 먹기 미니 포장 리뉴얼 된거 심지어 리뉴얼 꽤 의 강추템 빵 요 우리 집 빵 맛집 식빵 모닝 빵 베이글 그냥 더더 더 두번째 영상 요즘 집 에어 프라이어 나 저 도로 정도 구 기호 따라서 뭐좀 더 더 더 것 시리즈 치마 피자 소스 저 콘마 진짜 최고 실패 남녀 노소 입맛 확신 돈키호테 사심 슈퍼 구입 요 실온 판매 걱정 쟁 대신 수화물 요사 하우스 만가 돈키호테 각종 편의점 주변 로손 돈키호테 집앞 슈퍼 도톤보리 동네 밤 오사카 위치 하우스 숙박 문의 카톡 convoy loveyosi 플러스 친구 sani 오사카 여행 오사카 여행 준비 오사카 자유여행 오사카 호텔 오사카 숙박 오사카 숙소 스타 그램 맛스타 그램 오사카 쇼핑 콘마 소스 스프레드 큐피 jmt 일본 쇼핑 리스트 jmt 빵 빵 순이 콘마요빵 빵 맛집 오사카 빵 꼭 개사 세 미니 마요네즈 에어 프라이어 에어 프라이어 요리 집빵 주부 스타 그램 convoy loveyosi sani jmt jmt,,"['#일본', '#콘마요', '#꼭사야해', '#오사카여행', '#오사카여행준비', '#오사카자유여행', '#오사카호텔', '#오사카숙박', '#오사카숙소', '#오사카쇼핑', '#콘마요소스', '#일본쇼핑리스트', '#빵순이', '#콘마요빵', '#빵맛집', '#오사카빵', '#꼭사세요', '#두개사세요', '#미니언', '#마요네즈', '#에어프라이어', '#에어프라이어요리', '#집빵']"
공항 도착 시율 시율 더 엄마 생일 축하 시율 오사카 출발 하루 인천공항 육아 소통 오사카 오사카 여행 오사카 맛집 오사카 오사카 쇼핑 오사카 여행,인천공항 Incheon Airport,"['#인천공항', '#오사카', '#오사카여행', '#오사카맛집', '#오사카성', '#오사카쇼핑', '#오사카여행']"
일본여행 기록 히츠 마 부시 오사카 쇼핑 일본 맛집,오사카 닛폰바시니,"['#히츠마부시', '#오사카쇼핑', '#일본맛집']"
털 방울 레그 워머 착샷 색상 블랙 화이트,문델리온,[]
오사카 나미 시안 카페 쯔기 꽁꽁 곳 제 니 잇츠 팔로워 위해 공개 곳 북적 난바 살짝 나미 시안 화과자 전문점 무려 역사 이 곳 현 지인 곳 화과자 당고 등 판매 관광객 일본 현지 그 중 일본 어르신 곳 테이크아웃 줄 늘 저 이번 달 전 미리 예약 안 쯔기 카페 예 약 제로 손님 곳 글 마지막 예약 꿀팁 의 역사 수 곳 오늘 이야기 나미 시안 쯔기 아부 리 미타 라시 당고 개 세트 아이스크림 당고 화과자 종류 하나라 는걸 알 카페 쯔기 미타 라시 당고 판매 아마 오사카 교토 여행 미타 라시 당고 보신 분 그 미타 라시 당고 시작 원조 맛 확 미타 라시 당고 핵심 간장 얼마나 간장 사용 따라서 맛 발런스 좌우 마지막 살짝 짭쪼름 맛 당고 떡 감칠맛 폭발 당고 식 이 이인 진짜 x 쫀득해 단어 이 당고 보고 거 해도 과언 정도 식감 밥 거 순식간 흡입 간장 소스 워낙 소스 숟가락 계속 퍼먹 정도 맛 당고 세트 마지막 아이스크림 이 아이스크림 또 정말 별미 바닐라 아이스크림 당고 소스 위 단 표본 마지막 수 side note 주소 Chome Shikitsuhigashi Naniwa Ward Osaka 일본 영업 시간 오전 오후 수 휴무 예약 필수 예약 시 이용 가능 예약 링크 httpswwwhotpepperjpSA 위 링크 접속 후 나미 시안 쯔기 검색 번역기 예약 전화번호 호텔 번호 x side note Chome Shikitsuhigashi Naniwa Ward Osaka httpswwwhotpepperjpSA,カフェ つぎね,[]
일본 오사카 하루 끼 추천 먹킷 기록 도톤보리 위치 장어 밥집 장어 살이 살살 녹 정도 슴슴한데 양은 편 미리 예약 가면 일본 Osaka Chuo Ward Shinsaibashisuji Chome 이치란 도톤보리 점 이치란 그냥 추억 일본 가면 홀린 듯이 가게 매직 랄 여러 지점 맛 아무 곳 가도 기 기 마늘 의 쪽 실파 차슈 맛 배면 기본 조합 추천 난바 점 탄탄 느낌 라멘 맛 메뉴판 맨 오른쪽 라멘 추천 프리미엄 몰츠 곳 무조건 점수 시작 용 Chome Nanbanaka Naniwa Ward Osaka 일본 우메다역 큐 백화점 푸드코트 스시 집 푸드코트 맛 여기 호 라이 교자 쇼핑 당 일 절대 이예 큐 지하 가면 눈 지갑 디저트 호타루 쿠시카츠 난바 맛 쿠시카츠 합리 가격 곳 보 못 덕 기억 곳 추천 예약 미리 예약 자리 식사 Chome Namba Chuo Ward Osaka 일본 앤드류 에그타르트 에그타르트 무조건 고 Chome Dotonbori Chuo Ward Osaka 일본 로손 당고 기차 알 우리 후회 교토 기요미즈데라 근처 산넨자카 닌넨자카 사이 위치 곳 양 하나 추천 양념 닭튀김 가라아게 느낌 교토 길거리 구경 먹기 대신 상점 입장 주의 기요 미즈 산넨자카 미술관 옆 Local SAKE and BEER Stand 교토 로컬 사케 비어 바 코너 위치 분위기 스탠딩 사케 비어 바 주류 분 이면 테이 스팅 세트 주문 저희 수제 맥주 로컬 맥주 대한 설명 문화 체험 Shiraitocho Higashiyama Ward Kyoto 일본 Osaka Chuo Ward Shinsaibashisuji Chome Chome Nanbanaka Naniwa Ward Osaka Chome Namba Chuo Ward Osaka Chome Dotonbori Chuo Ward Osaka Local SAKE and BEER Stand Shiraitocho Higashiyama Ward Kyoto,오사카,[]
구 오사카 교토 오사카 여행 도톤보리 여행 스타 그램 오사카 쇼핑 쇼핑 오사카 쇼핑 리스트 오사카 쇼핑 샷 일본 쇼핑 리스트 돈키호테 돈키호테 쇼핑 스고이 쿄호 젤리 곤약 젤리 로이스 비 오레 마트,오사카 시,"['#대구', '#오사카', '#교토', '#오사카여행', '#도톤보리', '#오사카쇼핑', '#쇼핑', '#오사카쇼핑리스트', '#오사카쇼핑샷', '#일본쇼핑리스트', '#돈키호테', '#돈키호테쇼핑', '#스고이', '#쿄호젤리', '#곤약젤리', '#로이스', '#마트털기']"
오사카 곳 실바 안 패밀리 파크 난바역 이내 곳 아이 어른 곳 베스트 오카 Hachigamineji Minami Ward Sakai Osaka 일본 Hachigamineji Minami Ward Sakai Osaka,ハーベストの丘,[]
여름 가을 사이 낭만 오사카,오사카,[]
말 막상 가면 그냥 못 포토 존 오사카 도톤보리 글리코,,"['#오사카', '#도톤보리']"
햅 파이브 관람차 안 척 고소공포증 옆 걸 절대 함 진욱 소리 더 스트레스 바로 사과 함 진짜루,오사카 도톤보리,[]
날씨 편 장마 대비 일본 하루 종일 해,JAPAN OSAKA,[]
지금 오사카 날씨 숙소 물가 후다닥 것 다만 흠 항공권,大丸心斎橋店　Daimaru Shinsaibashi,[]
EVENT 올여름 역대 더위 지지 위해 도쿄바나나 준비 선물 이벤트 몸 나 길 이벤트 하자 친구 퀴즈 질문 일본여행 예정 선물 도쿄바나나 제품 퀴즈 이벤트 참여 방법 hello tokyobanana 공식 인스타 팔로우 게시 글 댓글 답변 마음 보너스 점수 지인 태그 해당 게시 물 리그 램 공유 경품 총 신제품 도쿄바나나 x 이토 큐 몬 콜라보 말차 케이크 도쿄바나나 한정판 캐리어 임 택정 답 댓글 랜덤 추첨 통해 선물 참여 기간 월 일 목요일 당첨 발표 월 일 목요일 개별 DM 팔로우 조건 이행 및 비공개 계정은 당첨 선정 제외 Welcome To TOKYOBANANA 응모 전 반드시 확인 응모 자격 대한민국 거주 경품 배송지 대한민국 내인 분 당첨 분 도쿄바나나 해시태그 달 과자 맛 소감 당첨 발표 심사 당첨 결정 당첨 신분 공식 Instagram 계정 다이렉트 메시지 이하 DM 로 연락 당첨 발표 DM 은 경 예정 캠페인 기간 종료 전 계정 당첨 메시지 계정 캠페인 사칭 계정 DM 등 주의 주 시기 경품 발송 당첨 확정 후 상품 발송 상품 발송 초 순경 예정 사정 배송 수 양해 사항 응모 전 꼭 확인 응모 만 또한 다음 경우 모든 응모 및 당첨 권리 무효 처리 응모 여러 계정 사용 응모 것 확인 경우 부정행위 당사 판단 경우 통신 환경 당첨 통지서 도착 경우 당첨 통지서 기재 수취 정보 수취 정보 입력 경우 경품 수령 등록 내용 미비 점 경 우주소 거주지 불분명 장기 부재 등 상품 배송 못 경우 추첨 연락 시 계정 팔로우 및 게시 물 대한 댓글 상태 계속 유지 것 확인 경 우본 캠페인 응모 시점 주의 사항 및 Meta 사가 정 이용 약관 동의 것 간주 미성년 경우 친권자 동의 응모 주 시기 캠페인 응모 기간 및 당첨 선정 완료 하순 경 인스타그램 사용자 이름 변경 말 주 시기 계정 비공개 설정 경우 추첨 대상 제외 재 추첨 기업 계정 응모 경우 추첨 대상 제외 당사 직원 그 가족 및 관계자 응모 경품 재판매 금지 또한 반품 및 교환 양해 또한 당첨 권리 당첨 본인 귀속 제 자 양도 수 캠페인 참여 시 발생 인터넷 접속 료 및 통신 료 당첨 연락 DM 기재 절차 진행 시 발생 제반 비용 본인 부담 추첨 방법 응모 접수 확인 당첨 낙선 배송 시 사고 파손 등 대한 질문 문의 캠페인 대한 응모 자의 응모 내용 및 이 관련 문제 대해 당사 책임 지지 캠페인 Meta 사의 제 공 협찬 것 캠페인 예고 중단 변경 수 또한 변경 경우 변경 내용 즉시 적용 당첨 절차 취득 개인정보 캠페인 실시 이외 목적 사용 취득 개인정보 경품 발송 후 시점 즉시 삭제 당 사의 개인정보 취급 방침 아래 URL 확인 httpswwwgrapestonecojppolicyprivacypolicyhtml EVENT hello tokyobanana x DM Welcome To TOKYOBANANA Instagram DM DM DM Meta DM Meta URL httpswwwgrapestonecojppolicyprivacypolicyhtml,,"['#EVENT올여름', '#도쿄바나나']"
자가 비 이빨 손가락 사이 울버린 가루비 자가 비 나눔 이벤 광고 각 지방 수 한정판 자가 비주 각 지역 공항 역 고속도로 기념품 매점 등 구입 가능 감자 껍질 채 때 입안 감자 식감 각각 맛 중독 느낌 일본 한정 자가 비 개 드림 풋콩 즌다맛 토호쿠 지방 도쿄 카레 맛 칸토 지방 와사비 간장 맛 신슈 지방 닭 날개 바 사키 맛 토카이 지방 타코야끼 맛 간사 방유 명란 맛 규슈 지방 이벤트 참여 방법 맛 가루비 기대 댓글 DM 성함 연락처 주소 블로그 동시 진행 네이버 딸기 소 보루 블로그 당첨 명 이벤트 기간 주간 당첨 발표 예정 누 여행 이벤트 DM,,['#과누']
Hep five 시원 다시 간 시간 안 비밀 겁 시원 머쓱타드 오사카 첫날 밤 인생 스시 집 마무리 요기 다음 여행 무조건 또 Hep five,"Osaka, Japan",[]
만 바오 바오 꼼데 바오 물건 당황 오사카 바오 바오 약간 팁 오사카 바오 바오 매장 신사이바시 파르코 우메다 큐 텐노 킨테츠 곳저 큐 백화점 주로 이용 외국인 쿠폰 때문 가격 가장 파르코 물건 편이 중국인 킨테츠 여행 동선 분리 곳 pass pass,한큐백화점,[]
오사카 데판 끼 KURA 오사카 콘래드 호텔 층 데판 키 오사카 야경 식사 수 곳 경치 분위기 호텔 레스토랑 서비스 음식 한가지 점 라면 일본 데판 끼 절제 불쇼 것 미국 데판 끼집 볼 수 퍼포먼스 칼 불쇼 가끔 음식 먹기 등 볼 수 KURA Teppanyaki Chome Nakanoshima Kita Ward 가격 KURA KURA Teppanyaki Chome Nakanoshima Kita Ward,Conrad Osaka コンラッド大阪,[]
개국 여행 때 오사카 성 오사카 성 요 날 벚꽃 여름 감성,Osaka Castle,['#99개국을여행할때까지오사카']
오사카 쇼핑 재미 해리포터 마법지팡이 일본여행 우정 여행 여행,,"['#오사카쇼핑', '#마법지팡이', '#일본여행', '#우정여행', '#20대여행']"
일본 꼭 맥도날드 해피밀 쁘띠 팬케이크 애플 크림 JMT 헬로키티 장난감 득템 JMT,"Osaka, Japan",[]
오사카 날 여행 실시간 피드 업뎃하 스탈 인스타 시간 없넹 때 캐리어 하나 더 쇼핑 코은 리오 사카,Orange Street,['#코은리오사카']
카드 뉴스 과자 체인점 오 카시노 마치 오카 소개 대부분 도쿄 근처 오사카 분 로부터 문의 오늘 오사카 가격 과자 살 수 곳 소개 참고 여행 자랑 사람 태그 tokyopass 를 해쉬태그 도쿄 패스 로 사진 꼭 공유 일본여행 오사카 여행 tokyopass tokyopass tokyopass,Ōsaka Station,"['#도쿄패스', '#일본여행', '#오사카여행', '#tokyopass']"
,Tsutaya Books,[]
옥수수 과자 일본 과자 오사카 쇼핑 난바 구입 맥주 안주 또 일본 역시 옥수수 옥수수 짭쪼롬,海遊館　OSAKA AQUARIUM KAIYUKAN (JAPAN),"['#옥수수과자', '#일본과자', '#오사카쇼핑', '#난바에서구입', '#맥주안주', '#또', '#생각난다', '#일본은역시', '#옥수수', '#옥수수먹고싶다', '#짭쪼롬', '#냠냠']"
포켓몬 카페 꿀팁 포켓몬 카페 도쿄 오사카 각각 오사카 기준 위치 신사이바시 역 다이마루 백화점 층 총알 장전 번화가 난바 내 날짜 사이트 오픈 광 해도 컷임 패널 티 취소 입장 예정 달 며칠 전 오후 연습 시간 따위 여유 자리 시간 캐치 빡셈 부터 입력 땡 하자 마자 클릭 클릭 미리 입력 후 전송 튕겨 요령 피카츄 녀석 중간 일어 대충 눈 대중 가능 유치원 애 수준 음료 메뉴 음료 난 질색 콜라 포켓몬 카페 옆 포켓몬 센터 탕진 훨 결과 식사 개 약 비쥬 얼 난 콜라 먹기 음애 포켓몬 센터 아래층 쇼핑 천지 임 포켓몬 센터 결제 때 은 미텼텍스리펀되 밀봉 안 애 징징 거릴때 입 용 하나 구매 손 디엠 주 세 욤 답 포켓몬 카페 포켓몬 센터 포켓몬 센터 오사카 아이 여행 오사카 여행 오사카 쇼핑,,"['#포켓몬카페', '#포켓몬센터', '#포켓몬카페', '#포켓몬센터', '#포켓몬센터오사카', '#아이와여행', '#오사카여행', '#오사카쇼핑']"
일본여행 지금 한국 산리오 열풍 산리오 고장 일본 신상 산리오 제품 츄파춥스 산리오 콜라보 판매 기간 한정 콜라보 더욱 의미 요소 장용 선물 용 강력 추천 혹 산리오 신사이바시 점 기억 폐점 난 카이 난바역 근처 산리오 기프트샵 여행 시간 헛걸음 노노 산리오 기프트 게이트 구글 검색 주소 Chome Nanba Chuo Ward Osaka am pm 오사카 여행 오사카 쇼핑 난바 쇼핑 산리오 헬로키티 쿠로 시나몬롤 폼폼 푸린 일본여행 선물 일본 선물 일본 선물가게 츄파춥스 Chome Nanba Chuo Ward Osaka am pm,,"['#일본여행지금', '#오사카여행', '#오사카쇼핑', '#난바쇼핑', '#산리오샵', '#시나몬롤', '#폼폼푸린', '#일본여행선물', '#일본선물', '#일본선물가게', '#츄파춥스']"
오사카 쇼핑 잔고 털,,"['#오사카쇼핑', '#잔고탈탈털이']"
오사카 여행 차,,[]
덕후 오사카 여행 필수 코스 주술 회전 굿 우메다 키디 랜드 이 캐릭터 사토 루 너 타 도리 방구 굿 이 체인소 맨 스파이 패밀리 짱 구 도쿄 리 스 하이큐 나쯔 인장 등등 애니 종합 선물 세트 굿 샵 애니 덕후 라면 꼭 한번 오사카 여행 우메다 키디 랜드 영업 시간 연중 무 오사카 우메다역 큐 지하 층 여행가 주희 협찬 체험 광고 DM 환영 DM,일본 오사카 우메다,[]
이제 장염 오사카 인스타 주 동안 도톤보리 타코야끼 맛 생강 식당 웨이 팅 쩌렀다 오사카 여행 도톤보리 야경 타코야끼 녜 맛집 오사카 쇼핑 돈키호테 일본여행 장염 여행 시바 루,,"['#오사카여행', '#도톤보리', '#야경', '#타코야끼', '#녜지맛집', '#오사카쇼핑', '#돈키호테', '#일본여행', '#장염여행', '#시바루쨩']"
도톤보리 역시 밤 최고 오사카,오사카 도톤보리,[]
오사카 여행 쇼핑 빼 수 드럭스토어 것 것 것 만전 다이마루 백화점 신사이바시 점 쇼핑 반나절 게 다이마루 백화점 여개 브랜드 입점 키 SK 시슬리 디올 샤넬 등 뷰티 브랜드 일본 대표 패션 브랜드 포켓몬 센터 JUMP SHOP 도 쇼핑 것 매장 디저트 카페 맛집 지하 층 HARIJYU GURILL 은 전통 쿠로 게 규 전문점 층 카페 TUFFE 디저트 맛집 외 오사카 맛집 치보 다이키 수산 미슐랭 르망 소개 우동 맛집 BULE 등유 맛집 쇼핑 매장 별로 여권 할인 쿠폰 곳도 본관 층 위치 면세 카운터 면세 혜택 수 이마루 백화점 신사이바시 점 가기 전 여권 꼭 매장 수도 볼거리 즐 길거리 먹거리 모두 소개 못 정도 요 더 매장 정보 알 다이마루 백화점 한국어 페이지 확인 오사카 쇼핑 오사카 여행 오사카 곳 다이마루 백화점 오사카 다이마루 다이마루 백화점 다이마루 오사카 쇼핑 리스트 오사카 맛집 오사카 카페 다이마루 신사이바시 점 SK JUMP SHOP HARIJYU GURILL TUFFE BULE,大丸心斎橋店　Daimaru Shinsaibashi,"['#오사카쇼핑', '#오사카여행', '#오사카가볼만한곳', '#다이마루백화점', '#오사카다이마루', '#다이마루백화점', '#다이마루', '#오사카쇼핑리스트', '#오사카맛집', '#오사카카페', '#다이마루신사이바시점']"
einiai oskshopguide BREMENS YouTube bremens 오사카 오사카 여행 오사카 쇼핑 오사카 생활 einiai oskshopguide BREMENS YouTube bremens,Bremens - 旅と暮らしの雑貨店,"['#einiai', '#오사카', '#오사카여행', '#오사카쇼핑', '#오사카생활']"
마르지 엘라 려고 마르지 엘라 농림 회관 마르지 엘라 오사카,,"['#마르지엘라', '#마르지엘라오사카']"
개국 여행 때 도톤보리 글리코 오사카 도톤보리 상징 수 글리코 맨 식품 회사 광고 판이 부터 자리 광고 판 설치 지금 자리 도톤보리 명물 내일 일본 다른 나라 사진,Dotonbori,['#99개국을여행할때까지도톤보리']
EVENT 봄봄봄 봄 뭐 제일 먼저 도쿄바나나 에디터 봄 벚꽃 벚꽃 봄 그 마음 여러분 나누기 위해 이벤트 준비 이벤트 질문 여러분 이번 봄 일본 여행 장소 이유 정성껏 이벤트 참여 방법 hello tokyobanana 공식 인스타 팔로우 게시 글 댓글 답변 마음 보너스 점수 지인 태그 해당 게시 물 리그 램 공유 경품 총 신제품 도쿄바나나 벚꽃 향 바나나 커스터드 맛 도쿄바나나 한정판 파우치 세트 발송 참여 기간 일요일 당첨 발표 월요일 개별 DM 팔로우 조건 이행 및 비공개 계정은 당첨 선정 제외 정답 댓글 랜덤 추첨 통해 선물 Welcome To TOKYOBANANA 응모 전 반드시 확인 응모 자격 대한민국 거주 경품 배송지 대한민국 내인 분 당첨 분 도쿄바나나 해시태그 달 과자 맛 소감 당첨 발표 심사 당첨 결정 당첨 신분 공식 Instagram 계정 다이렉트 메시지 이하 DM 로 연락 당첨 발표 DM 은 경 예정 캠페인 기간 종료 전 계정 당첨 메시지 계정 캠페인 사칭 계정 DM 등 주의 주 시기 경품 발송 당첨 확정 후 상품 발송 상품 발송 초 순경 예정 사정 배송 수 양해 사항 응모 전 꼭 확인 응모 만 또한 다음 경우 모든 응모 및 당첨 권리 무효 처리 응모 여러 계정 사용 응모 것 확인 경우 부정행위 당사 판단 경우 통신 환경 당첨 통지서 도착 경우 당첨 통지서 기재 수취 정보 수취 정보 입력 경우 경품 수령 등록 내용 미비 점 경 우주소 거주지 불분명 장기 부재 등 상품 배송 못 경우 추첨 연락 시 계정 팔로우 및 게시 물 대한 댓글 상태 계속 유지 것 확인 경 우본 캠페인 응모 시점 주의 사항 및 Meta 사가 정 이용 약관 동의 것 간주 미성년 경우 친권자 동의 응모 주 시기 캠페인 응모 기간 및 당첨 선정 완료 하순 경 인스타그램 사용자 이름 변경 말 주 시기 계정 비공개 설정 경우 추첨 대상 제외 재 추첨 기업 계정 응모 경우 추첨 대상 제외 당사 직원 그 가족 및 관계자 응모 경품 재판매 금지 또한 반품 및 교환 양해 또한 당첨 권리 당첨 본인 귀속 제 자 양도 수 캠페인 참여 시 발생 인터넷 접속 료 및 통신 료 당첨 연락 DM 기재 절차 진행 시 발생 제반 비용 본인 부담 추첨 방법 응모 접수 확인 당첨 낙선 배송 시 사고 파손 등 대한 질문 문의 캠페인 대한 응모 자의 응모 내용 및 이 관련 문제 대해 당사 책임 지지 캠페인 Meta 사의 제 공 협찬 것 캠페인 예고 중단 변경 수 또한 변경 경우 변경 내용 즉시 적용 당첨 절차 취득 개인정보 캠페인 실시 이외 목적 사용 취득 개인정보 경품 발송 후 시점 즉시 삭제 당 사의 개인정보 취급 방침 아래 URL 확인 httpswwwgrapestonecojppolicyprivacypolicyhtml EVENT hello tokyobanana DM Welcome To TOKYOBANANA Instagram DM DM DM Meta DM Meta URL httpswwwgrapestonecojppolicyprivacypolicyhtml,,['#도쿄바나나']
Acne 오사카 오사카 쇼핑 리스트 오사카 쇼핑 오사카 여행 신사이바시 우메다 아크네 스튜디오 아크네 쇼핑 샷 플로시 flossy osaka acnestudios 브랜딩 사진 보정 맞팔 선팔 환영 반사 Acne flossy osaka acnestudios,Acne Studios,"['#오사카', '#오사카쇼핑리스트', '#오사카쇼핑', '#오사카여행', '#신사이바시', '#우메다', '#아크네스튜디오', '#아크네', '#플로시', '#osaka', '#담백한브랜딩', '#사진보정', '#맞팔선팔환영', '#좋아요반사']"
제작 지원 오사카 차 일본여행 에디터 오사카 햅 파이브 꿀팁 오사카 여행 필수 코스 중 하나 이자 고래 관람차 상징 우메다 랜드마크 햅 파이브 HEP FIVE 이상 면세 일부 매장 제외 관내 무료 와이파이 층 인포 메이 션 여권 제시 할인 쿠폰 증정 이상 구 입시 사용 층 인포 메이 션 간 앙케이트 대답 주시 선물 햅 파이브 관람차 티켓 제시 점포 별 할인 등 특전 햅 파이브 화장실 포토 존 층 여성 전용 파우더 룸 TAMLO 이름 리뉴얼 오픈 F 식당가 통 유리 너머 햅 파이브 관람차 보이 감성 인테리어 식도락 휴식 인생 샷 수 공간 추천 식당 UMEYOSHI 돈카츠 정식 돈부리 전문점 겉바 속 촉 진수 세트 구성 매우 훌륭 한국어 메뉴판 모형도 추천 식당 MOON and BACK 계절 과일 듬뿍 사용 파르페 칵테일 및 까눌레 비롯 디저트 만날 수 곳 지금 밀푀유 파이 샤인 머스켓 파르페 시즌 메뉴 요거트 스무디 인기 만점 햅 파이브 관람차 세계 최초 빌딩 일체 대관람차 m 높이 도시 풍경 볼 수 에어컨 블루투스 스피커 설치 여름 수 오사카 Epass 주 유패스 무료 탑승 가능 햅 파이브 HEP FIVE 주소 Kakudacho Kita Ward Osaka 위치 지하철 미도스지선 우메다역 도보 운영 시간 식당가 관람차 관람차 최종 승차 관람차 영업 시간 변경 수 사항 공식 사이트 관람차 매표소 확인 httpsumedascjpkohepfivehep five HEP FIVE TAMLO F UMEYOSHI MOON and BACK m Epass HEP FIVE Kakudacho Kita Ward Osaka httpsumedascjpkohepfivehep five,"Umeda Osaka, Japan",['#TAMLO']
,𝐂𝐚𝐟𝐞 𝐇𝐮𝐬𝐡,[]
효고 여행 추천 키 모토 상점 주소 주 소 효고현 코베시 모토 마치 도리 이전 오픈 주소 수정 완료 일본 규격 컨 버스 전문 판매 컨 버스 성지 가게 꽉 채운 컨 버스 안 나 픽 재미 더 고베 주변 정보 도쿄 패스 고베 더 효고 여행 정보 도쿄 패스 효고 linzkooo 사진 제공 여러분 일본여행 공유 사람 태그 tokyopass 를 해쉬태그 일본여행 로 사진 주말 꼭 공유 일본여행 효고 여행 tokyopass 도쿄 패스 linzkooo tokyopass tokyopass,柿本商店,"['#도쿄패스', '#도쿄패스', '#일본여행', '#효고여행', '#tokyopass', '#도쿄패스']"
Couple look garden usedclothing Couple look garden usedclothing,,[]
