chunked_content,place,relevant_hashtags
JUSTDOIT NIKE X OSAKA 소 장각 패키지 노예 필수 템 기프트카드 미니미 신발 박스 자동 오픈 instagood daily giftcard Niketown 일상 데 일리 나이키 오사카 오사카 쇼핑 오사카 여행 JUSTDOIT NIKE X OSAKA instagood daily giftcard Niketown,오사카 시,"['#OSAKA', '#소장각', '#패키지노예', '#필수템', '#미니미', '#자동', '#꺅', '#일상', '#데일리', '#나이키', '#오사카', '#오사카쇼핑', '#오사카여행']"
가면 완전 손해 오사카 교토 쇼핑 꿀팁첫 돈키호테 외곽 매장 도톤보리 메인 거리 매장 오히려 종류 재고 별로 돈키호테 간다 외곽 두번째 드럭스토어 가격 비교 마츠모토 키 요시 다이코 쿠처 럼 드럭스토어 보시 돈키호테 가격 세번 캐릭터 쇼핑 스팟 추천 신사이바시 파르코 백화점 추천 지하 나가노 마켓 층 층 캐릭터 가챠샵 네 의류 신발 쇼핑 재고 가격 체크 제품 가격 한국 차이 꼭 체크 해외 직구 일본 직구 로이 도쿄 일본 해외 직구 일본 일본여행 여행 해외여행 일본 해외여행 일본 오사카 오사카 오사카 여행 도쿄 일본 도쿄 도쿄 여행 일본 쇼핑 오사카 쇼핑 도쿄 쇼핑 드럭스토어 돈키호테 캐릭터 쇼핑 일본 캐릭터 쇼핑,,"['#일본직구', '#이로이로도쿄', '#일본', '#일본여행', '#여행', '#해외여행', '#일본해외여행', '#일본오사카', '#오사카', '#오사카여행', '#도쿄', '#일본도쿄', '#도쿄여행', '#일본쇼핑', '#오사카쇼핑', '#도쿄쇼핑', '#돈키호테', '#캐릭터쇼핑', '#일본캐릭터쇼핑']"
오사카 가면 꼭 맛집 설 은 처음 안 파가 비주 얼 맛 비주 얼 더 설 추가 육회 김밥 샤또 브리앙 대창 주 문해 하이 볼 한국 돈 둘이서 배 움 만약 가게 설 샤또 브리앙 사또 브리앙 입살녹 요 거 한국 움 오사카 오사카 맛집,오사카 시,"['#우설', '#먹고싶지', '#오사카맛집']"
일본 환절기 품절 상품 httpsbitlyjapan season item 일본 정보 아이템 재팬 정보 정리 httpsbitlyjapan season item,,[]
일본여행 기념품 드럭스토어 돈키호테 쇼핑 리스트 도움 꾹 장도 일본여행 일본여행 기념품 돈키호테 쇼핑 리스트 돈키호테 오사카 여행 나고야 여행 도쿄 여행 후쿠오카 여행 후쿠오카 도쿄 일본여행 선물 카루 이미라,,"['#일본여행', '#일본여행기념품', '#돈키호테', '#오사카여행', '#나고야여행', '#도쿄여행', '#후쿠오카여행', '#후쿠오카', '#도쿄', '#일본여행선물', '#아카루이미라이']"
소비 오사카 캐릭터 투어 친구 쇼핑 열정 SNS 핫 레이스 트리플 여행자 김윤아 오사카 난바 캐릭터 쇼핑 일 정치 카 농담 곰 짱구 등 인기 캐릭터 쇼핑 스팟 한국 구 굿 를 샵 구경 캐릭터 투어 오사카 여행 중 잠시 둘러보기 상세 여행 일정 스토리 모음 확인 triplekr 프로필 링크 클릭 SNS triplekr,,['#친구와']
여름방학 오사카 교토 간다 오사카 여행 경비 너 수 투 어비스 교통 쇼핑 맛집 특 선물 쇼핑 맛집 관광 오사카역 쇼핑 맛집 관광 오사카역 LUCUA GORMET EKI MARCHE 우메다 공중정원 프랑 프랑 디즈니 스토어 무인양품 컨 버스 룰루 레몬 등 의류 잡화 샤브샤브 초밥 장어 등 맛집 우메다 근처 관광지 LUCUA 쇼핑 센터 큐 백화점 신 백화점 일본 쇼핑 햅 파이브 대관람차 밤 오사카 야경 눈 나카 자키 초 카페 거리 일본 감성 카페 거리 JR 하루 간사이 공항 오사카 직행 교토 이동 수 특급 열차 부터 오사카역 우메다 정차 시 작 공항 오사카 교토 특 JR 특급 하루 카 프로모션 JR 하루 카간 사이 공항 오사카 편도 쇼핑 식사 쿠폰 기간 한정 특 최대 할인 투 어비스 특 하루 카 쇼핑 식사 상품 구매 가능 이용기 구 매 일로 내 투 어비스 tourvis 여행지 추천 LUCUA GORMET EKI MARCHE LUCUA JR JR JR tourvis,,['#여행지추천']
일본 폭염 주의,오사카 시,[]
안 사람 한번 사람 도쿄 여행 선물 끝판 도쿄바나나 남녀 노소 바나나 커스터드 빵 과자 기 맛 것 사실 종류 일본 간다 친구 공유 선물 쪼르기 더 일본 쇼핑 정보 도쿄 패스 쇼핑 내 여행 자랑 사람 태그 tokyopass 를 해쉬태그 도쿄 패스 로 사진 주말 꼭 공유 일본여행 일본 과자 tokyopass tokyopass tokyopass,東京駅 (Tokyo Station),"['#도쿄패스', '#도쿄패스', '#일본여행', '#일본과자', '#tokyopass']"
오사카 여행 전 필수 확인 요즘 도톤보리 간다 가면 안 여행 정보 interparktour 팔로우 tip 인터파크 투어 일본 오사카 interparktour tip,,['#오사카']
일본 드럭스토어 가면 항상 상품 구매 신 상품 드럭스토어 추천 템 가지 소개 Acnes 컬 크림 성인 여드름 효과 여드름 케어 템 로토 골드 눈 전자 기기 눈 효과 비타민 등 유효 성분 가득 로토 리세 로우 일본 핫 신상 렌즈 착용 사용 만능 안약 바파린 A 일본 위 부담 효과 진통제 라보 시로 쥰 프리미엄 피부 성분 피부 스킨 케어 제품 메라 노 CC 효소 세안 일본 화제 그 상품 비타민 C 피부 엑시브 W 사이 케어 젤딥 크림 여름 무좀 고민 라면 번 효과 직방 무좀 치료 제 퀵 H 골드 여름 두피 각질 습진 고민 라면 꼭 이 제품 시미 토리 레스 큐 수용성 지용성 얼룩 모두 사용 만능 얼룩 제거 제 런 페 브릭 미스트 닉 향 인위 룸 스프레이 도 사항 홈페이지 참조 이미지 출처 official sitejapaholic 재패홀릭 일본 japan Acnes A CC C W H official sitejapaholic japan,,"['#japaholic', '#일본', '#japan']"
오사카 도톤보리 근처 오뎅 바 일본 여행 중 번은 오뎅 바 한국 어묵 또 다른 매력 일 오뎅 바 테이블 인 테이블 개 조그만 공간 여기 저기 영화포스터 분위기 아주 굿굿 못 오뎅 냄비 고레 것 외치 끝 무조건 주문 외 식감 재료 선택 듯 이유 육수 때문 맛 추천 실 곤약 버섯 쑥갓 떡 인상 건 바로 하이 볼 수제 과일 청 잔 하이 볼 만 자극 지도 인위 지도 더 고춧가루 착착 감칠맛 제대로 난 매 움 한국 때 마트 생각 도톤보리 근처 술집 곳 수 오사카 여행 마무리 여기 서하면 BAR NiCOLE Chome Higashishinsaibashi Chuo Ward Osaka 도톤보리 근처 건물 층 위치 매일 오후 새벽 BAR NiCOLE Chome Higashishinsaibashi Chuo Ward Osaka,"오사카 도톤보리 중심가거리, Japan",[]
여행 포인트 경비 절약 앱 일본여행 N 번차 얀스맘 오사카 여행 절약 트래블 콘텐츠 앱 하나 포인트 모 아유 버셜 간사 이조이 패스 하루 카 특급 열차 구매 가능 적립 포인트 쇼핑 맛집 할인 뿐 앱 내 할인 쿠폰 쇼핑 시 할인 사람 포인트 트래블 콘텐츠 내 하단 체크 클릭 포인트 공항 가장 극장 쇼핑몰 백화점 랜드마크 이벤트 설문조사 친구 초대 등 포인트 적립 포인트 사용 처 맛집 정보 혜택 포인트 사용 맛집 할인 적립 포인트 결제 금액 최대 결제 곳도 할인 쿠폰 혜택 내 전체 쿠폰 쿠폰 다운로드 돈키호테 빅 카메라 킨테츠 백화점 등 할인 쿠폰 쇼핑 시 혜택 최고 알 당장 트래블 콘텐츠 앱 다운 한국 부터 포인트 일본여행 때 트래블 콘텐츠 로부터 여행 원금 진행 travelcontentskr 오사카 여행 오사카 필수 코스 오사카 여행 코스 오사카 곳 트래블 콘텐츠 오사카 쇼핑 아이 해외여행 아이 일본여행 아이 오사카 트래블 콘텐츠 travelcontents 오사카 여행 꿀팁 N travelcontentskr travelcontents,우메다,"['#오사카여행', '#오사카필수코스', '#오사카여행코스', '#오사카가볼만한곳', '#오사카쇼핑', '#아이와해외여행', '#아이와일본여행', '#아이와오사카', '#오사카여행꿀팁']"
오사카 쇼핑 곳 정리 쇼핑몰 곳 추천 이중 곳 도장 travelcontents 팔로우 일본 현지 마케터들 전달 정보 일본여행 오사카 여행 일본 쇼핑 오사카 쇼핑 travelcontents,,"['#일본여행', '#오사카여행', '#일본쇼핑', '#오사카쇼핑']"
글리코 앞 단독 샷 법 줌 글리코 사람 다나 Credits danbileee k se yeo wishmyThank you very much 오사카 오사카 여행 일본 일본여행 오사카 맛집 오사카 카페 오사카 정보 일본 추천 오사카 추천 오사카 카페 오사카 후기 일본 쇼핑 리스트 돈키호테 일본 드럭스토어 오사카 쇼핑 도톤보리 글리코 글리코 포토 존 리코 스냅샷 여행사진 여행 스타 그램 gliko dotonbori osakajapan Credits danbileee k se yeo wishmyThank you very much gliko dotonbori osakajapan,Dotonbori Osaka,"['#오사카', '#오사카여행', '#일본', '#일본여행', '#오사카맛집', '#오사카카페', '#오사카정보', '#일본추천', '#오사카추천', '#오사카카페', '#오사카후기', '#일본쇼핑리스트', '#돈키호테', '#일본드럭스토어', '#오사카쇼핑', '#도톤보리', '#그리코상', '#gliko', '#osakajapan']"
호다닥 대마도 여행 얼른 봄 옷 하나 촬영 고양이 고 넉 마을 분위기 매번 뮤젯 일본 것 신상 드릴 코디 셋업 베스트 치마 핏 브이넥 스카프 니트 지금 봄 쭈욱 착용 가능 코디랍 업데이트 조금 것 선 주문 분 디엠 대마도 당일치기 대마도 여행 오사카 쇼핑 후쿠오카 쇼핑 셋업코디 서면 카페 투어 전 포 사진관,대마도 히타카츠항,"['#대마도당일치기', '#대마도여행', '#오사카쇼핑', '#후쿠오카쇼핑', '#셋업코디', '#서면카페투어', '#전포사진관']"
진짜 아누 운 오사카,,[]
일본 쇼핑,오사카 신사이바시,[]
오사카 쇼핑 파르코 백화점 오사카 지브리 지하 층 농담 곰 층 스튜디오 지브리,,"['#오사카쇼핑', '#파르코백화점', '#오사카지브리샵지하']"
다시 새 또 항상 오사카,,[]
이번 일본여행 기전 알 아두 꿀팁 가지 전달 일본 정보 가요 일본여행 쇼핑 문화 등 소식 전 재팬 secondjapan 팔로우 정보 secondjapan,,[]
일본여행 사람 주목 여행사 직원 추천 일본 간식 제 최애 로만 먹거리 일 본가 꼭 쟁 오기 약 속 팔로우 정보 일본여행 일본 먹거리 추천 일본 편의점 일본 간식 추천 오사카 맛집 일본여행 선물 일본여행 코스 일본여행 준비 오사카 여행 후쿠오카 여행 대마도 여행 삿포로 여행 도쿄 여행 오사카 쇼핑 후쿠오카 쇼핑,,"['#일본여행', '#일본먹거리추천', '#일본편의점', '#일본간식추천', '#오사카맛집', '#일본여행선물', '#일본여행코스', '#일본여행준비', '#오사카여행', '#후쿠오카여행', '#대마도여행', '#삿포로여행', '#도쿄여행', '#오사카쇼핑', '#후쿠오카쇼핑']"
오사카 쇼핑 리스트 맘껏 진에어 수화물 빵빵 제공 부산 출발 오사카 항공권 부터 진에어 기내 수하물 KG 위탁 수하물 KG 기본 제 공 땡처리 항공권 가격 수하물 오사카 쇼핑 오사카 여행 오사카 쇼핑 리스트 오사카 항공권 진에어 진에어 수화물 진에어 땡처리 항공권 땡처리 항공권 땡처리 항공 땡처리닷컴 여행 여행 스타 그램 KG KG,,"['#오사카쇼핑', '#오사카여행', '#오사카쇼핑리스트', '#오사카항공권', '#진에어', '#진에어수화물', '#진에어땡처리항공권', '#땡처리항공권', '#땡처리항공', '#땡처리닷컴', '#여행']"
일본 마트 식료품 쇼핑 리스트 여행 수 마트 쇼핑 일본 마트 꼭 식료품 정리 지금 트리플 확인 triplekr 프로필 링크 클릭 triplekr,도쿄 도,[]
후쿠오카 도쿄 오사카 로컬 쇼핑 소개 개 뽑기 능 인 친분 추천 쇼핑 지도 MEGA 더 오사카 여행 정보 도쿄 패스 오사카 여러분 일본여행 공유 사람 태그 tokyopass 를 해쉬태그 일본여행 로 사진 주말 꼭 공유 일본여행 오사카 여행 tokyopass 도쿄 패스 MEGA tokyopass tokyopass,도쿄패스,"['#도쿄패스', '#일본여행', '#오사카여행', '#tokyopass', '#도쿄패스']"
오사카 난바역 위치 깡패 신상 호텔 피트 이용 면 여기 사랑 요즘 저 여행 적금 hafhkorea 이용 완전 오사카 숙소 하프 코인 축제 기간 경비 걱정 예약 왓 용 난바 파크스 오사카 쇼핑 난바 시티 스카 이오 등등 접근성 말모 타라 그랜드 오사카 호텔 centaragrand osaka 체크 체크아웃 난 카이 난바역 난바 파크스 옆 완전 고층 건물 눈 바로 통 유리창 시티 뷰 인증샷 필수 호텔 바로 옆 건물 로손 편의점 크게 가성 비 현지 맛집 쿠라 스시 라멘 집 도톤보리 어디 전철 이동 일본 다른 호텔 비교 정말 크기 객실 명 캐리어 수 호텔 투숙 객 라면 무료 이용 피트니스 난바역 전철 뷰 일본 성과 운동 한국인 직원 계시 기 때문 체크 인도 여유 체크아웃 성 급 호텔 다운 서비스 hafhkorea centaragrand osaka,오사카 난바,[]
원더 투어 오사카 여행 오사카 쇼핑 오사카 가면 꼭 오사카 소비 요정 거듭 나 핫 어디 여기 잠깐 일본 면세 제도 품목 총 구입 가격 이상 이면 일본 소비 세 를 면제 수 쇼핑 후 영수증 여권 꼭 환급 장소 것린쿠 프리미엄 아울렛 제대로 쇼핑 경험 린 쿠로 오라 신사이바시스지 아케이드 잡화 점 시장 스팟 치마 도구 야스 평소 요리 관심 흥미 시장 꼭 일정 필요 조절 것 닛폰바시 덴덴타운 B 급 감성 재기 숍 문화 발견 거리 내추럴 키친 소품 매장 분위기 때문 하루 종일 꿈 주방 프랑 프랑 주방 소품 인테리어 용품 관심 구두 옷 것 시간 보장 다오 사카 쇼핑 오사카 쇼핑 여행 오사카 명소 오사카 곳 일본 곳 오사카 쇼핑 리스트 쇼핑 스타 그램 오사카 그램 일 본스타 그램 여행 스타 그램 원더 투어 위메프 B,오사카 시,"['#원더투어와', '#오사카', '#린쿠프리미엄아울렛제대로', '#신사이바시스지길고', '#센니치마에', '#닛폰바시', '#내추럴키친아기자기한', '#프랑프랑주방', '#오사카쇼핑', '#오사카쇼핑여행', '#오사카명소', '#오사카가볼만한곳', '#일본가볼만한곳', '#오사카쇼핑리스트', '#오사카그램', '#일본스타그램', '#원더투어', '#위메프']"
드럭스토어 쇼핑 못 쪽곰 오사카 오사카 쇼핑 리 소 우소 우단 톤 니코 앤드 빔 베 이프 스 투시 엑스 leesousoudantonnikoandbeamsbapestussyxlarge leesousoudantonnikoandbeamsbapestussyxlarge,오사카 시,"['#오사카', '#오사카쇼핑', '#리', '#소우소우', '#빔즈', '#베이프', '#스투시', '#엑스라지', '#sousou', '#nikoand']"
달달 상큼 술 사람 오사카 가면 무조건 유자 술 유즈 사케 유자 상큼 홀짝 홀짝 먹기 복숭아 자두 알 사탕 맛 진저 뎁혀 유자 사케 얼음 온 더락 탄산수 하이 볼 꿀맛 미니미 사이즈 ml 한국 ml 약 일본여행 중이 시 라면 사이즈 꼭 한번 우리 거 tangerine 트래블 콘텐츠 트래블 콘텐츠 쇼핑 유즈 사케 유 즈슈 일본 쇼핑 리스트 오사카 여행 일본여행 정보 일본 쇼핑 일본여행 오사카 쇼핑 일본술 ml ml tangerine,,"['#유즈사케', '#유즈슈', '#일본쇼핑리스트', '#오사카여행', '#일본여행정보', '#일본쇼핑', '#일본여행', '#오사카쇼핑', '#일본술']"
일본 최소 세번 하브 스 편의점 개 명란 맛 과자,,[]
가면 완전 손해 오사카 쇼핑 꿀팁 추가 꿀팁 japan realtrip 프로필 링크 클릭 둥둥 마이 리얼 트립 커뮤니티 직접 작성 오사카 교토 쇼핑 꿀팁 매장 아이템 추천 워낙 정리 글 저 이번 여행 후회 이득 보기 이슈 공유 곧 일본 여행 예정 분 장해 꼭 참고 japan realtrip 프로필 링크 클릭 둥둥 소개 쇼핑 꿀팁 확인 수 japan realtrip japan realtrip,,[]
오사카 여행 오사카 쇼핑 우메다 큐 백화점,일본 오사카 우메다,"['#오사카여행', '#오사카쇼핑']"
SAKA 만 온 오사카 나 쫌 오사카 오사카 여행 오사카 쇼핑 오사카 슈프림 오렌지 스트릿 도톤보리 osaka dotonbori 은서 in 오사카 SAKA osaka dotonbori in,오사카 시,"['#오사카', '#오사카여행', '#오사카쇼핑', '#오사카슈프림', '#오렌지스트릿', '#도톤보리', '#osaka', '#은서in오사카']"
담 일본 양말 신고 왜 사이즈 우리나라 왜 일본여행 계획 분 운동화 미리 깅,Orange Street,[]
무조건 에디터 직접 점 라멘 맛집 식당 필수 일본어 저장 가세 메뉴 난데스까 메뉴 추천 일본어 경우 한국어 메뉴판 주문 요새 해외여행 출발 여행 무작정 오사카 교토 시리즈 북 더 알 수 라멘 로코 검색 Chome NanbanakaNaniwa Ward Osaka 추천 메뉴 시 오 라멘 라멘 볶음밥 세트 계획 형 지금 바로 팔로우 travelgilbut 라멘 친구 공유 해외여행 오사카 여행 일본 맛집 Chome NanbanakaNaniwa Ward Osaka travelgilbut,,"['#해외여행', '#오사카여행', '#일본맛집']"
일본여행 때 돈키호테 꼭 정도 산 일회용 필름 카메라 여기저기 길거리 친구 한장 거 인화 사진 일본여행 돈키호테 돈키호테 쇼핑 오사카 여행 오사카 맛집 오사카 쇼핑,"Namba Street,Osaka","['#일본여행', '#돈키호테', '#돈키호테쇼핑', '#오사카여행', '#오사카맛집', '#오사카쇼핑']"
오사카 아이 여행 숙소 이번 오사카 쿄토 세 개월 아기 여행 가장 깨 바로 이동 편이 최 단 거 리 로 최 선 의미 숙소 선택 아주 오사카 주요 관광지 모두 도보 가능 지하철역 개 유니 버셜 스튜디오 전 숙소 시간 여행 남편 정도 껏 곳 찾기 일임 남편 가성 비 최고 기준 내부 공간 내부 공간 분리 거실 용 공간 침실 미닫이 문 구분 가능 저희 부부 제일 애 우리 침대 슈퍼 싱글 더블 구비 물품 냉장고 전자렌지 커피포트 조리기구 세탁기 세탁 용품 수건 샴푸 린스 바디 솝 등 어메니티 드라이기 칫솔 wifi 등 주변 환경 주거 용 건물 장 를 근방 이내 편의점 약국 ATM 기 모두 음식점 몇 야식 낮 음식 맛 못 야식 꼭 추천 접근성 오사카 주요 관광지 모두 도보 이용 쿠로 몬 시장 도보 도톤보리 도보 난바 파크스 도보 돈키호테 도보 이외 니혼바시 오타쿠 로드 츠텐카쿠 텐노 신사이바시 모두 가능 개 노선 지하철역 모두 도보 거리 내 유니 버셜 스튜디오 전철 간사이 지역 내 당일치기 이동 가능 고베 쿄토 나라 모두 전철 이내 가격 일자 별 상이 제 기준 주말 포함 박 정도 일본 숙박 가격 이정 공간 이면 편 Kuromon Royal 에어비앤비 검색 수 상세 정보 분 댓글 해당 링크 오사카 오사카 여행 아이 일본여행 rosyarles overseastrip wifi ATM Kuromon Royal rosyarles overseastrip,"Dotonbori Street, Osaka","['#지하철역4개', '#유니버셜스튜디오20분', '#오사카', '#오사카여행', '#아이와일본여행', '#rosyarles']"
여행 맵시 일 일 쇼핑 리스트 드럭스토어 쇼핑 돈키호테 드럭스토어 일본 면세 혜택 구매 베스트 아이템 개 소개 travel mapsi 계정 팔로우 더 여행 정보 볼 수 여행 맵시 오사카 여행 오사카 쇼핑 일본 쇼핑 오사카 맛집 도쿄 맛집 일본 쇼핑 리스트 일본 입국 일본 드럭스토어 여행 스타 그램 일본여행 도쿄 여행 도쿄 쇼핑 travel mapsi,,"['#여행맵시', '#여행맵시', '#오사카여행', '#오사카쇼핑', '#일본쇼핑', '#오사카맛집', '#도쿄맛집', '#일본쇼핑리스트', '#일본입국', '#일본드럭스토어', '#맞좋튀', '#일본여행', '#도쿄여행', '#도쿄쇼핑']"
올해 로 일본 여행 정말 가시 계시 원래 일본 사면 브랜드 면세 백화점 할인 쿠폰 더 더욱 득템 수 기회 일본엔 우리나라 브랜드 공식 매장 수도 압도 물건 쇼핑 분 주목 백화점 할인 쿠폰 게시 물 속 QR 코드 링크 타고 발급 방법 네이버 스마트 스토어 최저 가격 설정 기준 때문 설정 결제 상세 페이지 속 내용 숙지 후 현지 백화점 카운터 면세 별개 볼 수 혜택 꼭 해 쇼핑 앞 스마트 스토어 통해 현재 쿠폰 이외 혜택 정리 볼 예정 관심 일본 여행 자주 분 알림 설정 해 두시 것 추천 QR,일본,[]
글리코 선생님 나 우리 제작 가디건,"Osaka, Japan",[]
일본 오사카 여행 쇼핑 리스트 민트 추천 여행지 일본 오사카 득템 물건 이 오 코시 덴마 기 리코 유리컵 시 오콘 부 주 염색 수건 사카이 모노 곤고 대나무 발 바쇼 바통 당신 여행 응원 일본 일본 오사카 오사카 오사카 여행 쇼핑 리스트 오사카 쇼핑 민트 투어 민트 투어 오사카 오사카 쇼핑 리스트 오사카 기념품 오사카 득템 득템 여행 정보 오사카 여행 정보,,"['#당신의여행을응원합니다', '#일본', '#일본오사카', '#오사카', '#오사카여행', '#오사카쇼핑', '#민트투어오사카', '#오사카쇼핑리스트', '#오사카기념품', '#오사카득템', '#득템', '#여행정보', '#오사카여행정보']"
오사카 간사이 공항 면세점 여행 마무리 쇼핑 스팟 워낙 여행객 재고 품절 경우 계산 어마 무시 쇼핑 햅삐 후쿠오카 공항 면세점 쇼핑 리스트 시로이코이비토 르 타오 치즈 케익 이치란 라멘 도쿄 밀크 치즈 팩토리 도쿄바나나 로이스 간사이 공항 간사이 공항 면세점 간사이 공항 면세점 쇼핑 오사카 쇼핑 오사카 쇼핑 리스트,,"['#간사이공항', '#간사이공항면세점', '#간사이공항면세점쇼핑', '#오사카쇼핑', '#오사카쇼핑리스트']"
샵 구경 재미 오렌지 스트릿 그 중 리 사이클링 제품 더 굿 랜드 마켓 꼭 라쿠텐 트래블러,THE GOODLAND MARKET,['#오렌지스트릿']
오사카 여행 쇼핑 리스트 여기 도톤보리 추천 쇼핑 스폿 돈키호테 위고 산리오 갤러리 샵쿠 오레 오사카 땡처리 항공권 httpsgooglPHzLe 땡처리닷컴 오사카 쇼핑 오사카 항공권 wwwttangcom httpsgooglPHzLe wwwttangcom,,"['#돈키호테', '#위고', '#산리오갤러리', '#390엔샵', '#쿠이다오레10만원대', '#땡처리닷컴', '#오사카쇼핑', '#오사카항공권www']"
보 컴뱃 봄버 일본 일본여행 오사카 쇼핑 발렌시아 스반 노튼 논 노드 streetvibes pauseshots streetvibes pauseshots,오사카 도톤보리,"['#일본여행', '#오사카쇼핑', '#발렌시아가', '#드리스반노튼']"
USJ 분 주목 혼잡 예정 작년 오사카 유니 버셜 알 번 USJ 입장 제한 심지어 입장 규제 입장 정도 유니버설 스튜디오 재팬 수 걱정 큐 재팬 공략 정보 제대로 면제 수 이번 꼭 체크 참고 저장 공유 오사카 유니 버셜 스튜디오 익스 프레 스 닌텐도 확약 유니 버셜 입장권 구매 큐 재팬 인스타 프로필 링크 구매 가능 큐 재팬 은 유니 버셜 공식 파트너 장해 일본 자유여행 시 참고 osaka japan 더 오사카 여행 정보 큐 재팬 오사카 지금 큐 재팬 팔로우 매일 실시간 일본여행 소식 Follow qjapankr USJ USJ osaka japan Follow qjapankr,일본오사카 유니버셜스튜디오,"['#오사카유니버셜', '#유니버설스튜디오재팬즐길', '#오사카유니버셜스튜디오', '#닌텐도확약', '#유니버셜입장권', '#큐재팬', '#일본자유여행', '#osaka', '#japan', '#오사카여행', '#큐재팬', '#큐재팬']"
오사카 오사카 여행 오사카 쇼핑 도톤보리 돈키호테,,"['#오사카여행', '#오사카쇼핑', '#도톤보리', '#돈키호테']"
만사,,[]
