chunked_content,place,relevant_hashtags
전부 품절 일단 봄 주차 만난 남자 얘기 그냥 거저 거 잡 소리 안 파리 지엔 패션 파리 쇼핑 파리 맘마 파리 맘마 가방 파리 여행,"Paris, France","['#파리지엔패션', '#파리쇼핑', '#파리맘마', '#파리맘마가방', '#파리여행']"
파리 대중교통 중심지 가장 지역 샤틀레 마레 지구 지역 이동 위치 교통 덕 상점 도서관 박물관 레스토랑 등 밀집 샤틀레 연결 마레 지구 낭만 도시 예술 도시 파리 가장 지역 볼거리 샤틀레 마레 지구 더 볼거리 인조 파리 확인,,[]
여행 느낌 파리 스냅 실제 촬영 마치 마지막 인사 가면 뒤 다시 컷 파리 스냅,"Paris, France",['#파리스냅']
merci 메르 시 김 러브 파리 kimluvtrip merci kimluvtrip,Merci,"['#merci나도', '#김러브파리', '#kimluvtrip']"
만하 나 유럽 여행기 모닝 라떼 꼬수우 방브 플리 마켓 못 잔 자꾸 쟈냐방브 플리 마켓,Puces De Vanves,['#방브플리마켓']
살림살이 관심 여자 라면 못 곳 엄마 파리 여행 분 추천 곳 파리 여행 파리 쇼핑,La Trésorerie,"['#파리여행', '#파리쇼핑']"
파리 여행 명 중 명 몽쥬 약국 쇼핑 리스트 BEST 무엇 투어 티 할인 쿠폰 최대 할인 면세 혜택 몽쥬 약국 쇼핑 각 담 거얏 지금 바로 할인 쿠폰 httpstourtiracomeventmonge BEST httpstourtiracomeventmonge,파리,[]
원래 계획 향수 룸 스프레이 파리 바로 구입 달동 안 파리 사용 제주도 파리 때 그 향기 선택 못 파리 향기 시간 파리 일주일 내일 파리 쇼핑 파리 향수 여행 테이블 파리 파리 여행 달 살기 그림 일러스트레이터 moooono drawing 메종 마르지 엘라 불리 로라 제임스 하퍼 선택 의기 moooono drawing,파리,"['#내일이라도가서', '#파리쇼핑', '#파리향수', '#무노여행2019', '#무노테이블', '#파리여행', '#파리한달살기', '#무노그림', '#일러스트레이터', '#메종마르지엘라', '#불리1803', '#로라제임스하퍼', '#선택의기로']"
I cant get enough 왜 여러 개 컬러 별로 가지 생각 또 다른 컬러 사고 아이템 저 실크 스카프 로퍼 베레모 아이템 것 파리 베레모 가게 제 가장 선호 곳 여기 H ritage par Laulh re 베레모 사실 파리 곳곳 판매 기념품 가게 판매 베레모 보풀 생기 이마 막 럭셔리 브랜드 판매 애 퀄리티 가격 부담 좀 이 브랜드 컬러 퀄리티 합리 가격 부담 마음 여러 컬러 구매 수 Made in France 매장 Rue Saint Honore 몽마르트 근처 저 몽마르트 근처 샾 더 추천 Rue Saint Honore 매장 멋 디자인 좀 저 걔네 좀 몽마르트 매장 컬러 별로 재고 더 즉석 머리 사이즈 모자 서비스 저 이번 몇개 더 돈 산 파리 쇼핑 I cant get enough H ritage par Laulh re Made in France Rue Saint Honore Rue Saint Honore,Montmartre,"['#내돈내산', '#파리쇼핑']"
MZ 안경 타일 오늘 아웃 핏 파리 파리 여행 파리 쇼핑 paris MZ paris,파리,"['#파리', '#파리여행', '#파리쇼핑', '#paris']"
파리 여행 기념품 고민 중이 라면 기념품 리스트 확인 저장 크렘드 마롱 파리 기념품 밤잼 안젤리나 밤잼 크렘드마롱 르봉 백화점 더 가격 구매 메르 풀 라르 쿠키 몽생미셸 쿠키 최근 한국 입점 판매 버터 기본 맛 초코 칩 애플 캬라멜 등 종이 박스 틴 케이스 패키징 선물 안 수 쿠키 루 쿠키 파리 살 쟁여놓 프랑스 국민 과자 LU 고급 빈츠 맛 계속 맛 누텔라 쿠키 쿠키 하나 하나 누텔라 식감 맛 한번 쿠키 아티 트러플 소금 트러플 전문 브랜드 소금 소금 하나로 음식 가득 고급 선물 추천 샴브르 르 콩피 튜 수 제 잼 마레 지구 위치 수제 잼 스토어 샴페인 산딸기 잼 가장 유명 산뜻 달달 맛 이외 망고 패션후르츠 살구 라벤더 등 맛 테이 스팅 가능 파리생제르망 에펠탑 축구 지인 주기 선물 파리생제르망 로고 이색 에펠탑 선물 메르 시 실 팔찌 파리 필수 코스 Merci 에코 뿐 여름 포인트 차기 팔찌 판매 시 그니 실 팔찌 색깔 종류 팔찌 판매 어린왕자 열 쇠고리 프랑스 어린왕자 에펠탑 열 쇠고리 이색 Le Petit Prince 열 쇠고리 추천 오르셰 책갈피 자석 셰 상징 시계탑 책갈피 자석 책 친구 책갈피 꼭 파리 파리 여행 파리 일상 파리지앵 파리 사진 파리 감성 파리 생활 파리 여행 파리 여행 준비 달살 파리 교환학생 파리 여행 추천 파리 여행 코스 파리 쇼핑 파리 쇼핑 리스트 파리 기념품 파리 선물 파리생제르망 에펠탑 셰 미술관 LU Merci Le Petit Prince,,"['#파리', '#파리여행', '#파리일상', '#파리지앵', '#파리사진', '#파리감성', '#파리생활', '#파리여행중', '#파리여행준비', '#파리한달살', '#파리교환학생', '#파리여행추천', '#파리여행코스', '#파리쇼핑', '#파리쇼핑리스트', '#파리기념품', '#파리선물', '#파리생제르망', '#에펠탑', '#오르셰미술관']"
처음 이 왜 신어 마지막 득템 양말 선물 파리 사람 왜 스윗 것 나 첫 살로 몬 살로 몬살로몬 xt 소비 기록 파리 파리 쇼핑 xt,파리,"['#살로몬', '#살로몬xt6', '#소비기록', '#파리', '#파리쇼핑']"
이백,파리,['#인마이백']
관리 날 with galerieslafayette 파리 여행 시 꼭 갤러리 라파예트 백화점 지하 Wellness 갤러리 거 알 코로나 이후 리뉴얼 공간 운동 수 공간 스포츠 의류 매장 네일아트 헤 게 마사지 뷰티 트리트먼트 수 샵 프랑스 뷰티 K 뷰티 제품 체험 구매 수 공간 여기 만 나볼 수 저 크리스마스 대비 seasonly 페이 셜 테라 피 glossupparis 네일아트 백화점 관리 볼 수 거 관리 후 agaskinbeauty 제 K 뷰티 스킨 케어 제품 체험 개인 애정 dear klairs 스킨 롬앤 등 입점 프랑스 뷰티 브랜드 약국 만 나볼 수 브랜드 테스트 구매 수 공간 라파예트 백화점 한번 구매 고택 스리 펀 것 추천 지금 라파예트 백화점 크리스마스 장식 수 트리 구경 B 위치 웰니스 갤러리 AD 파리 백화점 파리 쇼핑 galerieslafayette legrandmagasindetous lenoeldemesreves parisshopping skincare with galerieslafayette Wellness K seasonly glossupparis agaskinbeauty K dear klairs B AD galerieslafayette legrandmagasindetous lenoeldemesreves parisshopping skincare,Galaries Lafayette,"['#관리의날', '#파리여행', '#갤러리라파예트', '#라파예트백화점', '#파리백화점', '#파리쇼핑', '#galerieslafayette', '#legrandmagasindetous', '#lenoeldemesreves']"
파리 명품 아울렛 발레 저장 꼭 무조건 헤 애기 패딩 구찌 빽 프라다 패딩 막 스마라 코트 파리 정도 외각 가치 충분 저 진짜 득템 못 패딩 하나 겨우 지금 쇼핑 시즌 물건 편이 할인 지금 안 편 사이즈 귀신 힝돈 징조 파리 쇼핑 줄줄이 실패,,"['#돈아끼라는징조인가', '#파리쇼핑줄줄이실패']"
우리 집 지네 대장 parisparisstyleparisfashionfashionfashionistafashionstyledailylookparisshoppingdailyfashionhermessalomonxt outfitgucciadidasgazzelleootd 파리 파리 쇼핑 에르메스 구찌 아디다스 가젤 비비안 웨스트우드 살로 몬살로몬 xt 아웃 핏 티디데 일리 데일 리코 디데 일리 패션 parisparisstyleparisfashionfashionfashionistafashionstyledailylookparisshoppingdailyfashionhermessalomonxt outfitgucciadidasgazzelleootd xt,,"['#paris', '#parisstyle', '#parisfashion', '#fashionista', '#hermes', '#gucciadidas', '#gazzelle', '#파리', '#파리쇼핑', '#에르메스', '#구찌아디다스', '#가젤', '#비비안웨스트우드', '#살로몬', '#살로몬xt6', '#아웃핏', '#오오티디', '#데일리룩', '#데일리코디', '#데일리패션']"
프랑스 산지 이 Caf de Flore 은 처음 때 포기 날 cafedeflore paris 파리 파리 일상 파리 살이 파리 쇼핑 파리 카페 생 제 르망 데 프레 파리 카페 투어 카페 드플로르 프랑스 직구 파리 직구 에코 서점 에코 백 파리 에코 공구 에코 공구 봄 야스 초이스 민초 초 paris parisdaily parislife saintgermainenlaye saintgermaincafe pariscafe cafedeflore heeyaschoice Caf de Flore cafedeflore paris paris parisdaily parislife saintgermainenlaye saintgermaincafe pariscafe cafedeflore heeyaschoice,Café de Flore,"['#파리', '#파리일상', '#파리살이', '#파리쇼핑', '#파리카페', '#생제르망데프레', '#파리카페투어', '#카페드플로르', '#프랑스직구', '#파리직구', '#에코백', '#서점에코백', '#파리에코백공구', '#에코백공구', '#희야스초이스', '#민초아닌희초', '#paris', '#parisdaily', '#saintgermainenlaye', '#saintgermaincafe', '#pariscafe', '#cafedeflore']"
맨 사 언니 paris 파리 그릇 파리 쇼핑 파리 여정 시작 제일 그릇 가게 시작 파리 가장 곳 바로 marinmontagut 작년 메종투메종 보고 국내 판매 내 먼저 파리 갔드 상 공원 바로 근처 공원 모티브 고블렛 페인 팅 테마 글라스 웨어 용품 사고 첫 날 다음 날 공원 또 정말 아스티 드빌 라트 파리 매장 역시 필수 코스 한국 가격 택 스프 리 등 감안 게 이득 못 게 따름 종이 로만 포장 생각 집 데리 수하물 핸드 캐리 지고 파리 가면 두 곳 모두 꼭 추천 paris marinmontagut,Jardin du Luxembourg,"['#맨사언니paris', '#파리그릇', '#파리쇼핑', '#룩상부르공원', '#아스티에드빌라트파리']"
출장 몇번 도시 서치 몇 분 디엠 숙소 후기 네이버 저 인스타 정보 Citadines Les Halles Paris 여자 둘 마레 지역 반 화가 정 예약 호텔 줄 알 레지던스 냉장고 전자렌지 모닝커피 프리 카페 훨 맛 바닥 마루 아이 밤 자지 젊음 열기 제대로 수 레스토랑 너 어어 무 무엇 모닝 뷰 무엇 루브르 수 거리 위치 굿 지난 출장 때 에어 비엔비 동네 이번 번화가 청소 타 직접 요건 좀 무료 공항 픽업 괜 찮은것 King Jouet 아이 장난감 숙소 루브르 박물관 옆 장난감 가게 크게 거기 보드게임 종류 지난 출장 땐 상 젤리 제 거리 디즈니 거기 요기 누구 도움 길 파리 여행 파리 숙소 파리 쇼핑 inparis Citadines Les Halles Paris King Jouet inparis,파리,"['#파리여행', '#파리숙소', '#파리쇼핑', '#inparis']"
튈르리 정원 만난 오리 가족 튈르 리 정원,"Paris, France",['#튈르리정원']
Kith paris kith Kith paris kith,Kith Paris,[]
이번 파리 생활 기존 생활 조금 다른 패턴 첫 러닝 정도 길 잘못 기도 달리기 다리 알 처음 체력 살이 가내 몸 내 다른 사진 더 부디 이 기간 파리 혁명기념일 준비 때문 현재 트 상황 에펠탑 주변 도로 통제 및 인파 계획 일정 조금 다른 상황 수 참고 기우 사진 파리 스냅 파리 스냅 파리 여행 파리 맛집 유럽 여행,"Paris, France","['#기우사진', '#파리스냅', '#파리여행', '#파리맛집', '#유럽여행']"
파리 쇼핑 프랑스 브랜드 숙지 필수 이번 파리 올림픽 루이비통 성화 봉 트렁크 메달 트레 제작 쇼메 메달 제작 화제 비롯 명품 브랜드 프랑스 대표 브랜드 곳 정리 저장 현지 직접 쇼핑 더욱 파리 여행 거 파리 여행 프랑스 쇼핑 파리 쇼핑 파리 여행 파리 여행 준비 파리 여행 코스 파리 여행 추천 파리 여행 팁 파리 교환학생 파리 신혼여행 르띠 탱크 솔로 반 리프 앤 펠 디올 레이디 셀린느 트리 오페 에르메스 파리 파리 여행사진,,"['#파리여행', '#프랑스쇼핑', '#파리쇼핑', '#파리여행', '#파리여행준비', '#파리여행코스', '#파리여행추천', '#파리여행팁', '#파리교환학생', '#파리신혼여행', '#까르띠에탱크솔로', '#반클리프앤아펠', '#디올레이디백', '#셀린느트리오페', '#에르메스파리', '#파리여행사진']"
마카롱 은 역시 라뒤레 파리 근교 아울렛 발레 주변 아울렛 잠깐 뭐 사지 쿠폰 라뒤레 마카롱 개 파리 여행 중 아울렛 생각 네이버 오봉 파리 검색 꼭 라뒤레 쿠폰 참고 오늘 옷 핑쿠 맞춤 신발 요즘 아식스 세 실리 반 신고 세상 힙 매장 어디 선 배 택 붙이 마지막 컷 파리 근교 파리 아울렛 라뒤레 마카롱 ootd lavalleevillage parislife laduree ootd lavalleevillage parislife laduree,파리,"['#마카롱', '#라뒤레', '#라발레빌리지', '#파리여행', '#오봉파리', '#아식스세실리에반센', '#파리근교', '#파리아울렛', '#라뒤레마카롱', '#lavalleevillage', '#laduree']"
파리 쇼핑 파리 무엇 직업 직업 인지 리츠 호텔 마들렌 루이비통 초코렛 선물 포장 선물 용 거 marinmontagut 그릇 기념 가격 곧 한국 해 꿀 올리브오일 트러플 때 꼭 가격 한국 질 더 단 단점 와인 병 관세 안 꼭 한국 이상 한국 주류 세 가격 차이 한국 틀 책 도구 편이 데코 재료 요 외 식료품점 가면 요리 해먹 키트 향신료 소금 식초 자주 품목 식료품 사도 텍 스프 리 가능 모라 도구 곳도 가능 파리 이상 구입 텍 스프 리 식료품 일반 슈퍼 백화점 메 매장 꼭 구입 텍 스프 리 이강인 유니폼 샹젤리제 거리 가면 생제르맹 파리 매장 유니폼 종류 후드 점퍼 유니폼 사이즈 별로 각인 결제 각인 유럽 여행지 텍 스프 리다 스페인 경우 미니 멈 금액 모두 파리 여행 또 파리 여행 유럽 여행 parisfrance 파리 쇼핑 marinmontagut parisfrance,,"['#파리여행', '#파리', '#여행', '#유럽여행', '#paris', '#france', '#파리쇼핑']"
KITH PARIS KITH PARIS,Kith Paris,[]
이제 진짜 니트 자켓 계절 내 니트 parisparisstyleparisfashionfashionfashionweekfashionbloggerknitweartheabletheableknitoutfitootdtodaysoutfitfashiongramchanelclassic 파리 파리 쇼핑 데 일리 파리패션위크 패션 패션 스타 그램 아웃 핏 티디 샤넬 미니 에이 블에이블 니트 니트 추천 데일 리코 디 parisparisstyleparisfashionfashionfashionweekfashionbloggerknitweartheabletheableknitoutfitootdtodaysoutfitfashiongramchanelclassic,"Paris, France","['#니트', '#자켓의', '#몽글몽글한니트', '#paris', '#parisstyle', '#parisfashion', '#파리', '#파리쇼핑', '#데일리룩', '#파리패션위크', '#패션', '#아웃핏', '#오오티디', '#샤넬미니백', '#에이블', '#에이블니트', '#니트추천', '#데일리코디']"
커플 지갑 maisonmargiela maisonmargiela,파리,['#maisonmargiela']
파리 루프 탑 맛집 추천 칭구 비밀 맛집 시간 환상 에펠 뷰 비치 클럽 테마 뵈브 클리 코 클럽 프랭탕점 샴페인 브랜드 뵈브 클리 코 Veuve Clicquot 의 팝업 음료 음식 해도 다프 랭탕 백화점 명품 할인 쇼핑 루프 탑 시간 금상첨화 친구 시간 예약 방법 구글 Veuve Clicquot Sunclub Printemps 검색 후 날짜 시간 예약 운영 원래 랬 연장 듯 라스트 오더프랭탕 백화점 여성 관 층 루프 탑 Boulevard Haussmann Paris 예약 후 방문 음식 주문 필수 워 가능 추천 메뉴 랍스터 파스타 클럽 샌드위치 추천 음료 Veuve Clicquot RICH 잔 샴페인 로제 블 각 이 파리 파리 맛집 파리 쇼핑 Veuve Clicquot Veuve Clicquot Sunclub Printemps Boulevard Haussmann Paris Veuve Clicquot RICH,Printemps Rooftop,"['#이랑이랑파리', '#파리맛집', '#파리쇼핑']"
아디다스 것 못,,[]
cambonparisShopping Chanel in ParisThis is one of my bucket lists Today I achieved it What is your bucket list 지니 버킷리스트 중 하나 파리 샤넬 화이트 샤넬 미국 그랜드캐년 헬기 투어 다음 두번째 버킷리스트 여러분 버킷리스트 무엇 paris parischanel Shopping 파리 깜봉점 파리 샤넬 파리 쇼핑 파리 여행 파리 샤넬 매장 cambonparisShopping Chanel in ParisThis is one of my bucket lists Today I achieved it What is your bucket list paris parischanel Shopping,CHANEL,"['#버킷리스트', '#샤넬', '#화이트샤넬백', '#그랜드캐년', '#paris', '#parischanel', '#파리깜봉점', '#파리샤넬', '#파리쇼핑', '#파리여행', '#파리샤넬매장']"
요즘 필기체 캘리 런가 계속 머리 속 기어 코 사진 파리 불리 매장 모든 이니셜 DM paris OfficineUniverselleBuly 다브앙 여행 DM paris OfficineUniverselleBuly,Officine Universelle Buly,"['#paris', '#다브앙여행']"
파리 사진 찍 수 스팟 추천 에펠탑 비롯 주요 관광지 사진 수 장소 봄 초여름 여기 저기 보라색 등나무 꽃들이 개인 제일 인생 샷 기도 한국인 안 곳 Grand Mosquee de Pairs 생각 뭔가 파리 볼 수 국적 분위기 꽃 정말 에밀리 파리 촬영 룩셈부르크 공원 몽쥬 약국 라틴 지구 노트르담 볼거리 도 동네 한번 쯤 번 쫙 추천 그 다음 마레 지구 워낙 곳 여름 봄 저 말 파리지앵 정말 구역 랍 파리 여행 정보 도움 댓글 Grand Mosquee de Pairs,Paris 5ème,[]
선셋 코스 셔터 프레 소 파리 신데렐라 씬 맛집 shutterpresso official shutterpresso global shutterpresso jeju shutterpresso paris 제주도 스냅 제주도 셀프 웨딩 스냅 반지 추천 야외 스냅 야외 촬영 커플사진 파리 스냅 파리 숙소 추천 파리 여행 파리 쇼핑 shutterpresso official shutterpresso global shutterpresso jeju shutterpresso paris,"Paris, France","['#셔터프레소', '#제주도스냅', '#제주도셀프웨딩스냅', '#반지추천', '#야외스냅', '#야외촬영', '#커플사진', '#파리스냅', '#파리숙소추천', '#파리여행', '#파리쇼핑']"
ADE Edit Astier de Villatte adenewyork ADE Edit Astier de Villatte adenewyork,뉴욕,[]
파리 쇼핑 여름 입구 바닷가 놀르가,프랑스 파리,[]
집 때 캐리어 폭발 예정,,[]
파리 맘마 한국 최초 프랑스 전통 브랜드 네스 단독 판매 네스 칼 라거 펠트 뮤즈 지금 샤넬 쇼 VIP 로 참석 프렌치 여성 아이코닉 여성 인지 모델 이자 브랜드 오 너 요 샤넬 자켓 청바지 플랫슈즈 신어 프렌치 선도 그녀 자신 브랜드 런칭 브랜드 콜라보 이번 파리 맘마 눈 아우 터 소개 전부 timeless 아이템 정말 동안 손 갈수 개인 취향 제 선별 본사 한정 수량 진행 껀데 이번 시즌 제품 수량 방식 구 퀄러티 디자인 면 아이템 파리 맘마 가을 겨울 모습 동안 옷장 간직 라이브 오후 오픈 당일 오전 파리 맘마 프렌치 타임레스 파리 지엔 파리 쇼핑 VIP timeless,파리,"['#파리맘마', '#파리맘마', '#프렌치룩', '#타임레스', '#파리지엔', '#파리쇼핑']"
전 세계 패션 관계자 파리 곳 미술관 유서 카페 전 세계 트렌드 쥐락펴락하 콘셉트 스토어 패션위크 방문 차 파리 이 특색 로컬 숍 꼭 전 세계 패션 트렌드 흐름 유러 피 패션 때문 세계 최초 백화점 부터 동시 가장 트렌디 편집 숍 모두 만날 수 파리 온 큐 레이 션 도슨 트 출장 중 발견 장르 파리 편집 숍 곳 소개 하이엔드 브랜드 포 밀리터리 워 웨어 전 세계 대상 스타 일링 제안 곳 유럽 여행 계획 꼭 번 거치 낭만 도시 파리 그날 위해 꼭 숍 여러분 초대 The Broken Arm thebrokenarm Rue Perr e Paris 프랑스 Elevation Store elevationstore Rue Vieille du Temple Paris 프랑스 FrenchTrotters frenchtrotters Rue Vieille du Temple Paris 프랑스 Centre Commercial centre commercial Rue de Marseille Paris 프랑스 Royalcheese Turenne royalcheeseparis Rue de Turenne Paris 프랑스 Merci Paris merciparis Bd Beaumarchais Paris 프랑스 Shinzo Paris shinzo paris Rue tienne Marcel Paris 프랑 전문 프로필 링크 바로 가기 httpsbitly N AAyOoncuration 온 레이 션 프랑스 여행 추천 파리 쇼핑 유러 피안 파리 편집 프렌치 빈티 fortela orslow gant novesta vejasneakers The Broken Arm thebrokenarm Rue Perr e Paris Elevation Store elevationstore Rue Vieille du Temple Paris FrenchTrotters frenchtrotters Rue Vieille du Temple Paris Centre Commercial centre commercial Rue de Marseille Paris Royalcheese Turenne royalcheeseparis Rue de Turenne Paris Merci Paris merciparis Bd Beaumarchais Paris Shinzo Paris shinzo paris Rue tienne Marcel Paris httpsbitly N AAyOoncuration fortela orslow gant novesta vejasneakers,,"['#온큐큐레이션', '#프랑스여행추천', '#파리쇼핑', '#유러피안', '#파리편집샵', '#프렌치빈티지', '#fortela', '#orslow', '#gant', '#novesta', '#vejasneakers']"
아스티 드빌 라트 막상 가면 뭘 고민 한참 곳 사려 욕심 몇개 그릇 사도 사도 끝 paris 파리 여행 파리 쇼핑 astierdevillatte paris astierdevillatte,Astier de Villatte,"['#아스티에드빌라트', '#설렘paris', '#파리여행', '#파리쇼핑', '#astierdevillatte']"
오늘 파리 요기 꼭 SalonduVintage 및 팝업 open 진짜 디자인 가구 프랑스 빈티 패션 명품 주얼리 레트로 레코드 포스터 등등 등 개 부스 bgm 힙했던 곳 완전 어제 나 진짜 물 물고기 중간 영상 베 프랑 페탐한거 저 thebrokenarm 편집 막 사람 줄 럭키 발견 ofrparis 가면 동선 h hCarreau du Temple rue Eugene Spuller Paris eme 입장권 현장 구매 파리 파리 여행 파리 쇼핑 파리 빈티 parisvibes SalonduVintage open bgm thebrokenarm ofrparis h hCarreau du Temple rue Eugene Spuller Paris eme parisvibes,République,"['#SalonduVintage', '#ofrparis', '#파리', '#파리여행', '#파리쇼핑', '#파리빈티지', '#parisvibes']"
주뗌므 파리 파리 중심 위치 섬 프랑스 학문 중심지 시 테섬 지역 Cit Quartier Latin 시 테섬 파리 센강 중앙 섬 맨 처음 파리 시 테섬 시작 해 시 테섬 남쪽 센강 소르본 대학 중심 프랑스 학문 중심 지역 곳 라틴어 사용 지역 학문 중심지 관광지 시 테섬 지역 요 Cit Quartier Latin,,[]
파리 전체 품절 살 수 미우미우 부츠 운동화 사고 사이즈 신고 못 저 아주 인기 사이즈 파리 환공포증 환자 기절 레드 스터드 플랫슈즈 품절 메쉬 신어 샌더 백 짐 리모 캐리어 하나 사고 네임택 호텔 배달 서비스 부탁 스타 부츠 마르지 엘라 버건디 컬러 타비 이야기 파리 타비 안 수 요즘 안 질 샌더 셀린 엠블럼 매우 파리 쇼핑 파리 여행 파리 parisfashion parisparisvibesparistourism 디자이너 그램 틸 parisfashion parisparisvibesparistourism,,"['#파리쇼핑', '#파리여행', '#파리', '#parisfashion', '#paris', '#parisvibes', '#paristourism', '#디자이너그램', '#틸랄라']"
파리 서점 에코 공구 파리 가장 서점 프랑스 소설가 콜레트 사랑 서점 파리 구 갤러리 비비안 파사 쥬 Librairie Jousseaume 서점 에코 공구 부터 지금 무려 서점 것 Jousseaume 가족 처음 서점 직원 일 사장 이 서점 지금 유지 요전 엔틱 데코 처음 마음 고 서적 그림 서점 향기 조명 가게 정말 사장 사랑 곳 사장 얘기 야스 초이스 Librairie Jousseaume 에코 첫 초이스 총 가지 디자인 다그 저 원픽 제 마음속 여러분 마음 제 마음 공구 진행 DM 메세지 주시 설명 파리 파리 일상 파리 살이 파리 쇼핑 파리 쇼핑 리스트 파리 파사 쥬 갤러리 비비안 에코 서점 에코 파리 에코 백 공구 에코 공구 공구 봄 야스 초이스 흿템 민초 초 paris parisdaily parislife parisshopping passagegalerievivienne galerievivienne heeyaschoice Librairie Jousseaume Jousseaume Librairie Jousseaume DM paris parisdaily parislife parisshopping passagegalerievivienne galerievivienne heeyaschoice,"Paris, France","['#파리서점에코백공구', '#3월25일까지파리에서', '#파리', '#파리일상', '#파리살이', '#파리쇼핑', '#파리쇼핑리스트', '#파리파사쥬', '#갤러리비비안', '#에코백', '#서점에코백', '#파리에코백공구', '#에코백공구', '#3월공구', '#희야스초이스', '#흿템', '#민초아닌희초', '#paris', '#parisdaily', '#passagegalerievivienne', '#galerievivienne']"
파리 여행 홀딱 중이 제 사진 보아 효 파리 여행 paris paris,Partisan Café Artisanal,"['#파리여행중', '#paris']"
색감 정말 Sabre Paris 신상 컬러 조합 정말 가정 달 사브르 커트 러리 피스 구 입시 자동 할인 적용 분 선물 도 추천 가정 달 선물 감사 선물 커트 러리 커트 러리 세트 빠리 쇼핑 파리 쇼핑 wwwmilkandchatcom Sabre Paris wwwmilkandchatcom,,"['#가정의달', '#감사선물', '#커트러리', '#커트러리세트', '#빠리쇼핑', '#파리쇼핑']"
파리 방문 세 일 도착 땅 파리 여행 파리 파리 맛집 파리 아울렛 발레 파리 쇼핑 paris 여행 여행 코디 여행 핑크 코디 셀 스타 셀피 셀카 다이어트 pink fashion likesforlike followforfollowback f f traveler paris pink fashion likesforlike followforfollowback f f traveler,"Paris, France","['#파리여행', '#파리', '#파리맛집', '#파리아울렛', '#라발레빌리지', '#파리쇼핑', '#paris', '#여행', '#여행코디', '#여행룩', '#핑크코디', '#셀스타', '#셀피', '#셀카', '#다이어트', '#pink', '#traveler']"
