chunked_content,place,relevant_hashtags
황금 연휴 유럽 분 도 예전 프랑스 파리 방문 추억 새록새록 이번 프랑스 방문 분 완전 꿀 정보 파리 방문 꼭 명품 브랜드 아울렛 발레 할인 쿠폰 공유 발레 파리 차로 디즈니랜드 거리 곳 개 이상 럭셔리 명품 브랜드 최대 할인 가격 만 나볼 수 곳 게다가 일부 브랜드 추석 맞이 추가 할인 진행 거기 VIP 패스 다운로드 시 할인 쿠폰 수 구매 금액 유로 이상 꼬 달리 립밤 핸드 크림 유로 이상 라로슈포 크림 증정 구매 금액 별 사은 품 증정 선착순 진행 사은 품 소진 시 조기 종료 수 얼른 진짜 완전 꿀 정보 욧 프랑스 분 꼭꼭 해 트래블 맵 홈페이지 통해 VIP 쿠폰 알뜰 쇼핑 travelmapkr lavalleevillage 프랑스 여행 파리 여행 파리 명품 쇼핑 파리 쇼핑 아울렛 파리 아울렛 파리 쇼핑 유럽 여행 트래블 맵 travelmap 추석 파리 가을 여행 유럽 여행 유럽 쇼핑 파리 쇼핑 리스트 VIP VIP travelmapkr lavalleevillage travelmap,,"['#유럽', '#프랑스', '#파리', '#라발레빌리지', '#lavalleevillage', '#프랑스여행', '#파리여행', '#파리명품쇼핑', '#파리쇼핑아울렛', '#파리아울렛', '#파리쇼핑', '#유럽여행', '#추석', '#파리가을여행', '#유럽여행', '#유럽쇼핑', '#파리쇼핑리스트']"
가을 날씨 요즘 파리 여행 생각 민주 글 드부이 쇼핑 눈물 일 것 것 것 또 우리 inbp 동기 동생 결혼식 맘 왜 결혼식 가면 눈물 서울 김 성수동 소금 빵 일상 파리 여행 생각 드 빵 선생 일상 파리 쇼핑 추억 가을 수지 베이 킹 클래스 드부이 빵 수업 브런치 수업 준비 성수동 소금 빵 브래드 키친 inbp,,"['#일상', '#파리여행생각', '#드부이에', '#빵선생일상', '#파리쇼핑', '#가을', '#드부이에', '#브런치수업준비중', '#성수동', '#소금빵']"
프랑스 선물 C 로 시작 거 요기 사실 뭐 엄한거 모델 저 명품 크게 관심 관리 못 타일 늘 뭐 마침 프랑스 간다 디자인 취저 하나 했슈 생존 위해 파리 외출 개시 못 사진 집 티셔츠 요 거 프랑스 특산 품 텍 스프 리 요즘 유로 환율 국내 대비 저렴 셀린 가방 셀린느 트리 오페 전 아래 이 젤 보임 셀린느 클레 아베 사체 샤이니 카프 스킨 왜 쇼핑 두 다른 것 하나 더 뭐 유 자랑 요 그거 알 니 돈 돈 돈 돈 출장 또 언제 담 어디가 출장 주가 셀린느 가방 파리 쇼핑 프랑스 쇼핑 celine C celine,,"['#프랑스선물', '#셀린느트리오페', '#셀린느클레아베사체', '#샤이니카프스킨', '#출장또언제가', '#담엔어디가', '#출장자주가도될거같아', '#셀린느가방', '#파리쇼핑', '#프랑스쇼핑', '#celine']"
마레 지구 꼭꼭 시크릿 식당 La Table Cach e par Michel Roth 베아슈베 마레 BHV Marais 층 La table Cach e 불어 식탁 뜻 프렌치 가스트 노미 레스토랑 걸 리츠 호텔 시작 수 미슐랭 스타 레스토랑 유명 셰프 Michel Roth 수장 곳 아주 합리 가격 미슐랭 출신 프렌치 셰프 미식 세계 만 나볼 수 곳 시크릿 컨셉 답 눈 찾기 곳 위치 BHV 층 양말 코너 옆 문 겨우 대적 홍보 광고 위치 사람 알 입 소문 레스토랑 가요 문 인테리어 서비스 밖 파리 루프 탑 뷰 합리 가격 분위기 음식 곳 곳 정보 공유 아뮤즈 부쉬 엉트레 쁠 데쎄흐 와인 정말 La Table Cach e 오픈 시간 TueSat 주소 Rue de la Verrerie BHV Marais th Floor Paris 교통 Metro line H tel de Ville 추가 꿀팁 le bhv marais 쇼핑 때 오봉 파리 쿠폰 할인 수 백화점 내 Marlette 카페 무료 이용 이벤트 La Table Cach e par Michel Roth BHV Marais La table Cach e Michel Roth BHV La Table Cach e TueSat Rue de la Verrerie BHV Marais th Floor Paris Metro line H tel de Ville le bhv marais Marlette,LE BHV MARAIS,[]
자정 브랜드 저 할당 양 정도 파리 지금 인기 급부 상중 미팅 잡기 이 라운지 웨어 닉 코튼 부내 파리 맘마 다시 재기 파리 쇼핑 파리 프렌치 파리 언더웨어 추천 홈웨어 ootd ootd,파리,"['#파리맘마', '#다시재기중', '#파리쇼핑', '#파리다니꺼', '#프렌치', '#파리', '#언더웨어추천']"
발레 아기 옷 사진 스토리 가격 문의 사진 디자인 참고 아기 옷 발레 브랜드 중 아기 옷 가격 국내 대신 발레 디자인 찾기 하늘 별 잘만 사진 속 펜디 레깅스 후반 패딩 발레 버버리 키즈 티셔츠 더 몽테뉴 베이비 디올 한국 가격 요전 아기 구경만 아기 분 매 리트 가격 혜정 작년 함박 블라우스 러브 워니 샤 스커트 도 러브 워니 샤 스커트 정말 정말 인기 paris 파리 쇼핑 paris,"París, France","['#라발레빌리지', '#러브워니', '#샤스커트', '#paris', '#파리쇼핑']"
자기 신발 엄마 거 사라 너 껀 토즈 더 사기 꼬 르망 드라이빙 슈 야신 발 꼬 르망 드라이빙 슈즈 아기 여행 개월 파리 여행 파리 쇼핑 paris 조 축복 paris paris paris,파리,"['#신발', '#꼬르망드라이빙슈즈', '#아기와여행', '#파리여행', '#파리쇼핑', '#paris', '#조축복']"
파리 여행 중 비 걱정 파리 분위기 실내 수 곳 파사 쥬 말 파리 부르주아 계급 사람 비 날 쇼핑 수 개념 파 사주 파리 여러 군데 안 분명 실내 마치 파리 거리 느낌 랄 좀 묘 파리 특유 건축 형태 여행 중 눈 만해 그 중 하나 Galerie Jouffroy 게 스팟 소개 Librairie du Passage 파리 제일 서점 곳 중 하나 요 흉내 정말 서점 정말 고 넉 해 인테리어 소품 빈티 책 그림 등 사실 수 무조건 추천 곳 가격 합리 소품 사기 Paris est toujours Paris 구글 평점 선물 기념품 가게 세인트 제임스 티 찻잔 롤레 르 베레모 등 메이드 인 프랑스 제품 주 지인 선물 기념품 고급 진 엽서 갑자기 비올 때 우산 할인 쿠폰 겟해 가세 그냥 카운터 요 쿠폰 프로필 링크 La Maison du Roy 유럽 사람 크리스마스 진짜 진심 거 아시 크리스마스 용품 장식 판매 전문점 그 중 제일 곳 여기 한국 못구 크리스마스 오 너 먼트 소품 크리스마스 것 분 무조건 Le Valentin Jouffroy 티 살롱 요 모든 걸 홈 메이드 집 이 안 크루 상 부터 케익 디저트 류 쇼콜라 쇼 카푸치노 가을 겨울 파리 오시 분 꼭 내부 티타임 파리 길거리 사람 느낌 가면 관광객 거의 현 지인 저장 파리 오시 꼭 Passage Jouffroy Bd Montmartre Paris Galerie Jouffroy Librairie du Passage Paris est toujours Paris La Maison du Roy Le Valentin Jouffroy Passage Jouffroy Bd Montmartre Paris,"Paris, France",[]
다른 엄마 나 취향 것 성격 또 완전 다른 자켓 엄마 cm 의 보통 체격 착용 저 cm 여서 착용 나이 입 수 이 자켓 상큼 캐 주얼 훗뚜루 면서 스타 일리 엄마 좀 도 영하 감각 수 이 자켓 지퍼 팔 베스트 로만 연출 정말 하나 입 아이템 월요일 오후 오픈 선착순 은 무배 만원 적립금 혜택 라이브 월요일 오후 한국 시간 특별출연 여사 사 조견 및 스타 일링 드림 배송 파리 맘마 파리 쇼핑 ootd 패치 워 자켓 스터 일링 파리 패션 cm cm ootd,파리,"['#파리맘마', '#파리쇼핑', '#패치워크자켓', '#스터일링', '#파리패션']"
퀴즈 파리 퐁네프 다리 앞 건물 뭘 정답 사 마리 백화점 samaritaineparis 루이비통 과 디올 모엣샹동 의 모 기업 LVMH 그룹 이 갈고 재 오픈 사 마리 백화점 무려 동안 리노 베이 션 공사 코로나 전 파리 때 이 장소 공사 건물 오픈 건물 요 아르누보 아르데코 양식 외관 센강 퐁네프 다리 때 무척 눈길 끌 부도 웨딩사진 정도 구 조 랍 다그 래서 에밀리 파리 다른 영화 자주 등장 파리 신상 핫 레이스 사 마리 백화점 측면 모 기업인 루이비통 본사 퐁 네프 다리 근처 간다 쇼핑 꼭 추천 제작 지원 explorefrance francefr samaritaineparis LVMH explorefrance francefr,Samaritaine Paris Pont-Neuf,"['#사마리텐백화점', '#루이비통', '#디올', '#모엣샹동', '#제작지원']"
프랑스 여행 파리 파리 미슐랭 스타 picure 방문 점심 a la Carte 로 애 피타 메인 요리 투 코스 앞뒤 워낙 배 분위기 서비스 호텔 미슐랭 스타 레스토랑 와인 리스트 기대 안 종류 가격 예상 나름 picure a la Carte,Epicure,[]
PARIS EST TOUJOURS PARIS 파리 파리 뜻 파리 대표 파사 쥬 중 하나 Passage Jouffroy 파사 쥬 구경 기념품 쇼핑 곳 보통 관광지 기념품 가게 퀄리티 상품 곳 Emily in Paris 의 에밀리 모자 명품 베레모 브랜드 롤레 르 Laulhere 부터 나폴레옹 프랑스 명품 식기 브랜드 Gien 말 세인트 제임스 Saint James 의 스트라이프 티셔츠 유니크 아트 포스터 등 정말 프랑스 다운 기념품 지인 선물 사기 강추 거의 모든 제품 Made in France 핸드 메이드 점 프로필 링크 이 보물 가게 모든 제품 프로 구매 수 바 처 수 참고 PARIS EST TOUJOURS PARIS Passage Jouffroy Paris 메트로 호선 Grands Boulevards 역 PARIS EST TOUJOURS PARIS Passage Jouffroy Emily in Paris Laulhere Gien Saint James Made in France PARIS EST TOUJOURS PARIS Passage Jouffroy Paris Grands Boulevards,Passage Jouffroy,[]
당분간 촬영 포인트 중 하나 파리 후 올림픽 준비 보수 공사 습 다트 광장 분수 지금 상태 공기 알 못 스타일 금방 파리 스냅 예약 중 문의 카카오 톡 채널 기우 사진 기우 사진,"Paris, France",['#기우사진']
파리 라파예트 백화점 제대로 꿀팁 선물 이벤트 파리 제 제일 노을 스팟 중 하나 라파예트 백화점 무료 루프 탑 에펠탑 보고 사진 것 방문 가치 쇼핑 원데이 클래스 노 일정 걸 분 것 준비 라파예트 만끽 방법 선물 이벤트 꼭 쇼핑 선물 프랑스 관광 청 홈페이지 쿠폰 구매 금액 대별 키 딥 티크 란스 등 선물 수 꼭 액 티비 티 할인 라파예트 경험 할인 금액 이용 수 프랑스 셰프 직접 마카롱 클래스 최고 요리 학교 콜 페랑디 요리 클래스 파리 최신 트렌드 패션쇼 파리지앵 쇼핑 경험 패키지 Vip 라운지 이용 Vip 텍스리펀 짐 보관 프라이 빗 차량 지원 쇼핑 상품 배송 서비스 등 번 쿠폰 링크 httpbitly IHiRgk 스토리 하이라이트 고정 파리 여행 더 준비 이 작가 구 독자 이벤트 이벤트 마감 이벤트 상품 갤러리 라파예트 액 티비 티 인 이용권 상품 최대 상당 쿠킹 클래스 쿠킹 클래스 패션쇼 중 택 사용 기한 당첨 인원 총 팀 참여 기간 당첨 발표 참여 방법 댓글 하트 이모티콘 아무 거나 달기 프랑스 관광 청 뉴스레터 구독 당첨 확률 up 파리 마카롱 만들기 프렌치 쿠킹 클래스 꼭 galerieslafayette explorefrance 갤러리 라파예트 제 작 지원 갤러리 라파예트 파리 쇼핑 파리 여행 프랑스 관광 청 Vip Vip httpbitly IHiRgk up galerieslafayette explorefrance,Galeries Lafayette,"['#이벤트', '#갤러리라파예트', '#파리쇼핑', '#파리여행', '#프랑스관광청']"
Sacr Burger in Reims 프랑스 여행 샹파뉴 부르고뉴 날 샹파뉴 프랑스 음식 다른 걸 보고 버거 맛집 감 버거 뭔가 프렌치 움 와인 리스트 쭉 버거 집 리스트 리스트 내 아라하 생산자 로제 샴페인 가격 한잔 버거 폭풍 흡입 로제 색깔 Sacr Burger in Reims,SACRÉ BURGER,[]
파리 무조건 후회 백화점 VIP 서비스 꿀팁 파리 여행 필수 방문 지인 갤러리 라파예트 galerieslafayette 여러 혜택 정보 장해 파리 오시 모든 혜택 누리 갤러리 라파예트 쇼핑 더 유럽 여행 파리 여행 파리 여행 유럽 어디 파리 백화점 파리 쇼핑 오페라 프렌치 요리 마카롱 클래스 파리지앵 갤러리 라파예트 galerielafayette mondayshopping parisshopping parislovers 여행 꿀팁 promo VIP galerieslafayette galerielafayette mondayshopping parisshopping parislovers promo,파리,"['#유럽여행', '#파리여행', '#파리여행', '#유럽어디까지가봤니', '#파리백화점', '#파리쇼핑', '#오페라가르니에', '#프렌치요리', '#마카롱클래스', '#파리지앵', '#갤러리라파예트', '#galerielafayette', '#mondayshopping', '#parislovers', '#여행꿀팁', '#promo']"
에르베르 린넨 가방 정말 입 웰매 이드 린넨 가방 후 후 색상 손잡이 정말 에스 닉함 말 수 정도 이 가방 손잡이 핸들 안감 스웨이드 단 물건 어깨 부담 곧 파리 맘마 파리 맘마 픽 린넨 가방 추천 ootd 파리 쇼핑 ootd,파리,"['#파리맘마', '#파리맘마픽', '#린넨가방추천', '#파리쇼핑']"
수 바로 쇼핑 중 파리 아울렛 발레 무조건 꼭 곳 발레 안 레스토랑 브런치 대표 파리 디저트 마카롱 라뒤레 최고 시간 파리 쇼핑 위 꿀팁 방출 발레 때 VIP 쿠폰 다운 면세 일 미적 용 상품 대해 서도 할인 혜택 수 일부 매장 제외 라뒤레 마카롱 교환 쇼핑 중 꿀맛 또한 당일 쇼핑 금액 식 음료 금액 모두 포함 당 마일리지 대한항공 스카이 패스 마일리지 적립 쥬 아울렛 택 가격 추가 OFF 방법 매장 결제 전 QR 코드 제시 이상 구매 시 Amorino 젤라또 증정 방법 Concierge 방문 QR 코드 쇼핑 영수증 Amorino 교환 발레 내 Amorino 가게 방문 오봉 파리 계정 프로필 링크 할인 쿠폰 발레 클릭 La Vall e Village 주소 Cr de la Garonne Serris 지하철 RER A 선 Val d Europe 역 obonparis lavalleevillage 파리 여행 파리 쇼핑 발레 파리 아울렛 프랑스 여행 유럽 여행 코스 파리 쇼핑 리스트 파리 여행 코스 추천 파리 명품 쇼핑 프랑스 아울렛 프랑스 쇼핑 리스트 VIP OFF QR Amorino Concierge QR Amorino Amorino La Vall e Village Cr de la Garonne Serris RER A Val d Europe obonparis lavalleevillage,La Vallée Village Paris,"['#파리여행', '#파리쇼핑', '#라발레빌리지', '#파리아울렛', '#프랑스여행', '#유럽여행코스', '#파리쇼핑리스트', '#파리여행코스추천', '#파리명품쇼핑', '#프랑스아울렛', '#프랑스쇼핑리스트']"
파리 여행 책 저자 이자 프랑스 국가 공인 가이드 추천 파리 꼭 전시 가을 낙엽 전시 가요 은 누구 Art Basel Paris 달이 공사 Grand Palais 그 팔레 아트 바젤 파리 그 팔레 전시 뿐 파리 시내 곳 아트 바젤 수 Grand Palais Avenue du G n ral Eisenhower Paris 구 스타 브 이유 보트 사후 주년 전시회 오르셰 미술관 마르 모 땅 미술관 습작 파리 거리 날 작품 조우 수 정말 기회 이 전시 꼭 추천 요금 Musee dorsay rue de Lille Paris 퐁피두 센터 마르셀 뒤샹 상 명의 현 미술가 작품 볼 수 퐁피두 방문 이유 곧 레노 베이 션 현재 전시 surrealisme 전시 관람 맨 꼭대기 층 에펠 뷰 사진 찍기 추천 요금 centre pompidou Paris 스승 제자 만난 두 거장 로댕 부르델 점 달 작품 만날 수 전시 관람 후 층 cafe rhodia 커피 한잔 bourdelle 미술관 정원 산책 추천 부터 입장료 Musee Bourdelle rue Antoine Bourdelle Paris 파리 올림픽 개막식 센느강 퍼포먼스 기계 경주마 ZEUS 제우스 베르사유 궁전 만날 수 부터 Place dArmes Versailles 여행 준비 파리 날씨 파리 쇼핑 현 지인 추천 파리 가이드 파리 미술관 파리 파리 맛집 파리 쇼핑 리스트 아이 아이 파리 쁘띠 파리 프랑스 자전거 셰 투어 루브르 투어 루브르 로댕 베르사유 몽생미셸 와인 투어 프랑스 자전거 francebiketour Art Basel Paris Grand Palais Grand Palais Avenue du G n ral Eisenhower Paris Musee dorsay rue de Lille Paris surrealisme centre pompidou Paris cafe rhodia bourdelle Musee Bourdelle rue Antoine Bourdelle Paris ZEUS Place dArmes Versailles francebiketour,파리,"['#여행준비', '#파리날씨', '#파리쇼핑', '#현지인추천', '#파리가이드', '#파리미술관', '#파리', '#파리맛집', '#파리쇼핑리스트', '#아이와', '#아이와파리', '#쁘띠파리', '#프랑스자전거나라', '#오르셰투어', '#루브르투어']"
We are thrilled to include this exceptional design from maisonsaros into our TopBridalParis SelectionsIn Sanskrit literally means we are no longer mere spectators but participants immersed in the cosmic rehearsal experiencing the passage of timeMain fabric of the gown Satin A twopiece vintageinspired gown that exudes effortless elegance Though it may seem simple the design and craftsmanship are intricately complexWill arrive to Paris by the end of robedemariee 파리 웨딩 스냅 파리 쇼핑 파리 웨딩촬영 프랑스 결혼식 mariage weddinginspiration parisprewedding preweddingparis preweddinginparis parisstreetshooting frenchweddingstyle frenchcastle frenchcastlewedding We are thrilled to include this exceptional design from maisonsaros into our TopBridalParis SelectionsIn Sanskrit literally means we are no longer mere spectators but participants immersed in the cosmic rehearsal experiencing the passage of timeMain fabric of the gown Satin A twopiece vintageinspired gown that exudes effortless elegance Though it may seem simple the design and craftsmanship are intricately complexWill arrive to Paris by the end of robedemariee mariage weddinginspiration parisprewedding preweddingparis preweddinginparis parisstreetshooting frenchweddingstyle frenchcastle frenchcastlewedding,TopBridal Paris,"['#TopBridalParis', '#robedemariee', '#파리웨딩스냅', '#파리쇼핑', '#파리웨딩촬영', '#프랑스결혼식', '#mariage', '#frenchweddingstyle', '#frenchcastle', '#frenchcastlewedding']"
한국 것 것 천유 곳 최근 몇 년 사 집 쇼핑 수 한국 일본 손님 인지 나라 국적 직원 불어 안해 문제 포장 상태 기 내용 캐리어 내 바닥 한번 추락 킨츠기 잔뜩 심장 크리스마스 시즌 한층 크리스마스 오 너 먼트 진짜 눈 en 파리 en paris 파리 쇼핑 그릇 쇼핑 아스티 드빌 라트 astierdevillatte en 쇼핑 en en paris astierdevillatte en,Astier de Villatte,"['#킨츠기', '#en', '#en', '#파리쇼핑', '#그릇쇼핑', '#아스티에드빌라트', '#astierdevillatte', '#en']"
이번 여행 작고 모음 집 오 자마자 캐리어 풀 정리 이번 나 옷 뭘 안 옷 열 벌 삼,서울,[]
사브르 신상 컬러 쨍 컬러 믹스 앤 매치 재미 밀크 앤챗 바로 배송 가정 달 사브르 피스 주 문 시 자동 할인 적용 wwwmilkandchatcom 가정 달 쇼핑 인테리어 주방용품 커트 러리 파리 쇼핑 직구 wwwmilkandchatcom,,"['#가정의달쇼핑', '#인테리어', '#주방용품', '#커트러리', '#파리쇼핑', '#직구']"
일요일 아침 맛 마들렌 커피한잔 파리 초코 마들렌 슈퍼 봉지 사 걸 맛 당췌 수가 파리 커피 마들렌 초코 마들렌 파리 가시 꼭 사드 세 요 마들렌 다시 가야 하나 토요일 아침 달달 디저트 빵 빵 모닝 파리 쇼핑 파리 쇼핑 리스트,,"['#마들렌', '#초코마들렌', '#파리', '#토요일', '#달달한', '#디저트', '#빵', '#빵모닝', '#파리쇼핑', '#파리쇼핑리스트']"
휴식 책 프랑 스메르시 merci 마레 지구 마레 지구 쇼핑 프랑스 여행 파리 여행 파리 카페 메르 시 카페 메르 시 쇼핑 파리 쇼핑 여행 코디 핑크 코디 핑크 코디 추천 쇼핑몰 추천 르세 훈녀 관리 여자 merci,Merci,"['#프랑스메르시', '#마레지구', '#마레지구쇼핑', '#프랑스여행', '#파리여행', '#파리카페', '#메르시카페', '#메르시쇼핑', '#파리쇼핑', '#여행코디', '#핑크코디', '#핑크룩', '#코디추천', '#쇼핑몰추천', '#르세이지', '#훈녀', '#관리하는여자']"
파리 백화점 VIP 라운지 이용 방법 두 가지 꿀팁 파리 백화점 VIP 고객 한국 백화점 라운지 훨 씬 프라이 빗 라운지 이용 방법 것 분 galerieslafayette 백화점 라운지 이용 방법 크게 다음 개 이상 쇼핑 시 Obonparis 쿠폰 제시 CONCIERGE 컨 시어 지로 내 구매 이상 영수증 오봉 파리 바 처 폰 저장 그냥 직원 VIP 룸 수 내 음료 다과 부탁 수 딥 티크 등 선물 교환 짐 줄 서서 택스리펀 완전 꿀팁 컨 시어 층 캐롤 매장 층 맥퀸 신발 매장 옆 층 아동 구찌 매장 등 위치 바 처 obonparis 프로필 링크 갤러리 라파예트 쿠폰 다운 캡쳐 제시 쥬 Parisian Shopping Experience 이상 쇼핑 난 안 것 라운지 이용 Parisian Shopping Experience 패키지 추천 쇼핑 좀 더 줄 프라이 빗 서비스 포함 유료 패키지 가격 완전 혜자 패키지 포함 것 VIP 라운지 무료 이용 샴페인 커피 및 다과 프라이 빗 택스리펀 서비스 DALLOYAU 달라 마카롱 등 교환 바 처 귀가 택시 픽업 라파예트 에코 백 가격 인 인 여기 OBONPARISKR 코드 쓰시 할인 예약 수 이상 구매 시 더 더더 VVIP 라운지 이용 이 방법 또 다시 한번 다른 포스팅 공유 VIP VIP galerieslafayette Obonparis CONCIERGE VIP obonparis Parisian Shopping Experience Parisian Shopping Experience VIP DALLOYAU OBONPARISKR VVIP,Galeries Lafayette,[]
파리 맘마 니트 추천 메리노 울 메리노 함껏 이 하프 터틀넥 실 정말 오버 사이즈 니트 색상 비스킷 과 쉬 다크 오션 암스테르담 디자이너 시 그 니 처 이 니트 클래식 정말 베이직 손 자주 아이템 이애 슬리브 스 여성 움 앞판 뒤판 발란스 앳 메리노 울 몸 때 부드러움 울 주어 저 자주 요 파리 맘마 니트 사랑 픽 오늘 사이트 파리 쇼핑 파리 지엔 베이직 ootd 니트 코디 파리 여행 파리 ootd,파리,"['#파리맘마', '#니트추천', '#메리노울', '#파리쇼핑', '#파리지엔룩', '#베이직', '#니트코디', '#파리여행', '#파리']"
파리 아기 옷 쇼핑 정보 디엠 정말 환율 지금 국내 가격 차이 얼마 패스 먼저 사이즈 재고 진짜 별로 잘만 득템 수 발레 아기 옷 분 꼭 어른 껀 득템 곳 몇 년전 작년 올해 예 뿐거 사막 바늘 찾기 개인 몽클레어 펜디 버버리 이 베이비 라인 진짜 생각 이 브랜드 위주 구매 가격 한국 생각 진짜 추가 세 일 라스트 것 사이즈 디자인 제 여름 겨울 시즌 제품 구매 여름 오시 분 더 것 해 그게 파리 시내 백화점 매장 경우 국내 조금 더 텍스리펀 생각 패딩 살 함 봉쁘앙 은 관심 파리 자주 보이 또 파리 비교 다른 옷 제 구매 신생아 M 바디 수트 내의 가격 비교 한국 만족 핫 아뜰리에슈 경우 파리 시내 매장 곳 텍스리펀 생각 가격 이번 국내 매장 파리 더 오시 분 꼭 구매 추천 실물 배 블랭킷 기준 사이 이불 약 정도 텍스리펀 전 만족 쇼핑 트루 세리에 모빌 정도 국내 직구 것 것 정도 통관 비 더 국내 이제 루이비통 베이비 샹젤리제 매장 작 실물 볼 수 코트 갠 다른 브랜드 아가 옷 더 전 이번 백화점 아기 옷 용품 코너 전 파리 아기 용품 브랜드 워낙 아시 분 국내 직구 훨 득템 가능 이번 제 토 동이 더 태교여행 오시 분 꼭 시간 아기 쇼핑 paris 임산부 w d 토끼띠 맘 약속 함 토 이 자아 전 거 좀 얄 M paris w d,파리,"['#파리', '#라발레', '#봉쁘앙', '#아뜰리에슈', '#트루세리에', '#태교여행', '#paris', '#토끼띠맘', '#오빠랑', '#토동이자아가']"
파리 쇼핑 발레 꿀팁 제 작 원 맨 마지막 꿀팁 참고 유럽 대표 럭셔리 아울렛 비스터 콜렉션 계열 발레 할인 시즌 제 아울렛 아울렛 할인 텍스리펀 원래 소비 곳 곧 블랙프라이데이 할인 다음 크리스마스 할인 다음 겨울 빅세일 이 시기 파리 꼭 곳 처음 분 위해 몇 가지 정리 발레 꿀팁 텍스리펀 꼭 여권 발레 어플 지도 사용 종이 지도 안 아주 어플 통해 더 할인 제품 할인 제도 확인 가기 전 체크 체크 가면 더 발레 어플 멤버십 가입 후 큐알 코드 구매 때 구 매 적립 리 워드 제 때 이상 구매 시 바로 다시 사용 기프트카드 이상 구매 시 기프트 카드 지금 확인 거 적립 리 워드 제도 원래 저 선물 구 명품 스카프 구매 폴로 랄프 로렌 후드 티 원래 리 거의 구매 더 할인 브랜드 제품 발레 디즈니랜드 택시 약 거리 랍 낮 쇼핑 밤 불꽃놀이 법 파리 셔틀버스 RER A 선 대중교통 수 셔틀버스 홈페이지 예약 곳 Bercy 역 부근 성인 쇼핑 당 때 라뒤레 피에르 에르 메 아모 리노 마카롱 젤라또 디저트 나라 꼭 파리 브랜든 데 아울렛 안 효율 가까이 수 구 용 쇼핑 진심 라면 빈 캐리어 것 추천 총알 못 건 살 못 오늘 정도 정리 발레 부모님 선물 혈육 선물 애인 선물 내 선물 사기 할인 시즌 모두 쇼핑 La Vallee Village Cr de la Garonne SerrisBicesterCollection LaValleeVillage 비스터 콜렉션 이 파리 RER A Bercy La Vallee Village Cr de la Garonne SerrisBicesterCollection LaValleeVillage,La Vallée Village,"['#파리쇼핑', '#라발레빌리지', '#폴로랄프로렌', '#라뒤레', '#피에르에르메', '#아모리노', '#LaValleeVillage', '#비스터콜렉션', '#이랑이랑파리']"
