chunked_content,place,relevant_hashtags
파리 젤 순간 루브르 새소리 요가 온몸 대부분 동작 뭐 사 마리 백화점 와인 점심 쇼핑 LVMH 그룹 동안 투자 리 모델링 에펠탑 철근 구 조물 아르누보 양식 재현 아티 주제 벽화 세공 사 마리 자체 PB 상품 자이언트 팝콘 못 뿐 이제 파리 쇼핑 사 마리 파리 요가 클래스 파리 쇼핑 SAMARITAINE samaritaineparis LVMH PB SAMARITAINE samaritaineparis,"Paris,France","['#루브르', '#뭐어때', '#사마리텐백화점', '#사마리텐', '#파리에서', '#요가클래스', '#파리쇼핑', '#SAMARITAINE', '#samaritaineparis']"
블랙 옐골 진리 생각 골도 파리 마지막 득템 뗑 inparis 파리 여행 파리 쇼핑 파리 일상 에르메스 본점 파리 에르메스 데 일리 일상 줌마 그램 bk inparis bk,,"['#뗑inparis', '#파리여행', '#파리쇼핑', '#파리일상', '#에르메스본점', '#파리에르메스', '#데일리', '#일상']"
키 필수 Ps 전날 산 KITH 자켓 가기 Ps KITH,Kith Paris,"['#키뜨', '#KITH']"
지난주 인기 폭발 포 모빌 머그 메세지 에르메스 구 매 대행 듀블 파리,,"['#에르메스', '#구매대행은듀블랑파리']"
Jacques Selosse Lieuxdits La Cote Faron Blanc de Noirs Champagne Vall e de la Marne A 프랑스 여행 샹파뉴 자크 셀 로스 호텔 마지막 날 점심 여기 음식 분위기 와인 한잔 수 셀 로스 블 랑드 누 안 간만 역시 셀 로스 답 나이 불구 맛 누 솔 레아 방식 샴페인 좀 기분 산미 마시기 Jacques Selosse Lieuxdits La Cote Faron Blanc de Noirs Champagne Vall e de la Marne A,Domaine Jacques Selosse,[]
프랑스 사람 음식 편이 식사 외 시간 물 과일 음료수 과자 군것질 간식 플레인 요거트 다크 초콜릿 를 편이 프랑스 몇 년 전 바이오 운동 거리 바이오 매장 수 정도 유기농 재배 식 재료 생각 바이오 매장 외 아침 거리 시장 식 재료 구입 수 시장 컬러풀 과일 채소 구경 재미 프랑스 사람 식 재료 요리 것 선호 다이어트 위해 무가당 무 지방 등 가공 식품 섭취 약간 당 지방 자연 그대로 제품 섭취 편이 운동 몸 유지 비결 랍 여러분 오늘 시장 방문 식 재료 식사,파리,[]
내 한눈 반한 편집 샾 보고 바로 구매 이 에나멜 핸드 드로잉 소품 저 컬러 감 것 볼드 컬러 소 픔 식탁 분위기 트 레이 사실 벽 거 오브 제로 저그 꽃병 활용 식탁 터 파스 레트로 대세 전 요새 볼드 알록달록 느낌 지금 프로필 링크 구매 적극 홍보 벌써 주문 소 진시 품절 임 국내 배송 안 갑자기 파리 안내 파리 소 픔 집들이 여기저기 파리 사람 집 대한 취향 열정 정말 절대 세 일 고 취향 사지 제 친구 플라워 베이스 하나 자신 카우치 카페트 암 청 고민 고심 사 감각 그냥 것 센스 센스 타고 나 파리 곳곳 빈티 시장 소품 집 구경 파라 여행 묘미 CSAO Rue Elzevir ParisCARAVANE Rue Pav e Paris 제 자주 숖들 파리 사람 취향 분위기 구경 곳 추천 파리 맘마 파리 쇼핑 인테리어 파리 스타일 파리 여행 CSAO Rue Elzevir ParisCARAVANE Rue Pav e Paris,파리 9구,"['#갑자기파리안내파리는', '#파리맘마', '#파리쇼핑', '#인테리어', '#파리스타일', '#파리여행']"
NOT a business meetingJust two guys deciding which bottles to open for dinner lol 프랑스 출장 계약 성사 느낌 저녁 와인 중 NOT a business meetingJust two guys deciding which bottles to open for dinner lol,Saint Bonnet Le Froid Regis Marcon,[]
완연 가을 하반기 더욱 향기 의미 의미 오봉 파리 프랑스 향수 전문 브랜드 메종 당 상당 향수 Les beaux jours 를 선물 창립 파리 상류층 향수 매니아 층 메종 burdinparfums 클래식 향 참여 방법 이 게시 물 오봉 파리 계정 팔로우 사람 명 댓글 태그 이벤트 기간 당첨 발표 사람 마음 전하 니 치 향수 Obon Paris 의 쿠폰 parfumerieburdin paris 할인 가격 당 르 메르 에스티 로더 디올 샤넬 메종 마르지 엘라 등 럭셔리 뷰티 템 향수 쇼핑 쿠폰 프로필 링크 obonparis 몽쥬점 Parfumerie Burdin Monge 주소 Rue Monge Paris 파리 북 역점 Parfumerie Burdin Gare du Nord 주소 Boulevard de Denain Paris Les beaux jours burdinparfums Obon Paris parfumerieburdin paris obonparis Parfumerie Burdin Monge Rue Monge Paris Parfumerie Burdin Gare du Nord Boulevard de Denain Paris,,[]
파리 초여름 렌선 나들이 관광 살 아보 경험 여행 분 주변 빵집 테이크 아웃 레스토랑 잠봉뵈르 과일 샐러드 걸 사 분수 파리 공원 현지 일상 살 아보 일 유명 관광지 것 머리 속 추억 거,,[]
스 테디 셀러 콜베르 화병 아스티 드빌 라트 화병 인기 제품 아스티 드빌 라트 구 매 대행 듀블 파리,,"['#아스티에드빌라트', '#구매대행은듀블랑파리']"
Suenen CC Blanc de Blancs ChampagneMore champagne by the poolThe Champagne Blanc de Blancs CC by Suenen is exclusively Chardonnay from vineyards aged more than and located in C te des Blancs more precisely in the Grand Cru villages of Cramant and Chouilly Extra Brut dosage gl for this mineral and balanced Champagne Blanc de Blancs 수영장 걸터 샴페인 한잔 낮 저녁 먹기 전 샴페인 홀짝 빡센 여행 스케쥴 중간 하루 종일 아무 것 안 하루 게다가 프랑스 여름 해도 음 맛 Suenen CC Blanc de Blancs ChampagneMore champagne by the poolThe Champagne Blanc de Blancs CC by Suenen is exclusively Chardonnay from vineyards aged more than and located in C te des Blancs more precisely in the Grand Cru villages of Cramant and Chouilly Extra Brut dosage gl for this mineral and balanced Champagne Blanc de Blancs,프랑스,[]
파리 맘마 이태리 빈티 니트 빈티 박람회 만난 두 남매 시작 돤 인연 시작 이 이태리 니트 벨기에 손자 손녀 디자인 퀄러티 정말 니트 봉막쉐 얼마 전 입점 때 레트로 함 클래식 니트 종 지금 파리 맘마 프랑스 사이트 직접 판매 재고 소 진시 디자인 니트 더 이상 음 미리 셔츠 레이어 드 해도 이 니트 부터 주문 첫 런칭 과 파리 무료 배송 혜택 이 기간 적용 유로 로만 진행 이 점 유의 라이브 금요일 밤 파리 나 파리 쇼핑 파리 빈티 니트 메이드 이태리,"Paris, France","['#파리맘마', '#파리에서만나요', '#파리쇼핑', '#파리', '#빈티지니트', '#메이드인이태리']"
영업 방송 소개 안이 픽업 이모저모 파리 맘마 파리 쇼핑,16e arrondissement de Paris,"['#파리맘마', '#파리쇼핑']"
모자 모자 모 자미 챴 유 스탈 찍 어보 파리 맘마 파리 맘마 픽 파리 패션 파리 쇼핑 멋,"Paris, France","['#파리맘마', '#파리맘마픽', '#파리패션', '#파리쇼핑', '#찐멋']"
마린 몽 타구 유리 제품,,[]
광고 발레 유럽 여행 계획 거나 지금 여행 중이 라면 주목 프랑스 파리 명품 쇼핑 아울렛 발레 La Vallee Village 프로모션 정보 방법 확인 명품 프랑스 현지 디자이너 브랜드 약 여 개 매장 입 정해 실패 파리 여행 위 명품 쇼핑 번지 내내 최대 이상 할인 혜택 추석 맞이 트래블 맵 단독 프로모션 진행 트래블 맵 X 발레 할인 쿠폰 구매 금액 별 사은 품 증정 유로 이상 구매 시 꼬 달리 핸드 크림 립밤 듀오 유로 이상 구매 시 라로슈포제 시 카 러스트 당 대한항공 마일리지 스카이 패스 SKY PASS 마일리지 적립 가능 레스토랑 카페 식 음료 포함 운영 시간 매일 오전 오후 연중 무 이상 구매 시 면세 혜택 가능 발레 방법 차 파리 중심부 차로 파리 디즈니랜드 거리 리 샤를 드골 등 주요 공항 내 기차 RER 열차 파리 도심 발드 유럽 역 발드 유럽 역 도보 가능 디즈니 셔틀 서비스 이용 디즈니 리조트 호텔 제공 전용 셔틀 이용 Shopping Express 셔틀버스 파리 내 두 개 정거장 탑승 가능 발레 셔틀버스 탑승 장소 호텔 풀 파리 베르시 rue de Libourne Paris 지하철 호선 Cour St Emilion 역 번 출구 버스 번 노선 Terroirs de France 정류장 LaValleeVillage 프랑스 여행 파리 여행 파리 명품 쇼핑 파리 쇼핑 아울렛 파리 아울렛 파리 쇼핑 유럽 여행 트래블 맵 TRAVELMAP 추석 파리 가을 여행 발레 쿠폰 파리 명품 쇼핑 할인 파리 명품 파리 명품 꿀팁 La Vallee Village X SKY PASS RER Shopping Express rue de Libourne Paris Cour St Emilion Terroirs de France LaValleeVillage TRAVELMAP,,"['#광고', '#라발레빌리지가을', '#LaValleeVillage', '#프랑스여행', '#파리여행', '#파리명품쇼핑', '#파리쇼핑아울렛', '#파리아울렛', '#파리쇼핑', '#유럽여행', '#추석', '#파리가을여행', '#라발레빌리지쿠폰', '#파리명품쇼핑할인', '#파리명품', '#파리명품꿀팁']"
약국 아이돌 르봉 치약 인기 희귀 성분 아이돌 파리 약국 에펠 커머스 약국 몽쥬 약국 마이러브 파리 르봉 치약 lebon 파리 명소 파리 쇼핑 르봉 치약 로제걀레 핸드 크림 lebon,Pharmacie Eiffel Commerce,"['#파리약국', '#에펠커머스약국', '#몽쥬약국', '#마이러브파리', '#르봉치약', '#파리명소', '#파리쇼핑', '#르봉치약', '#로제걀레']"
It was a beautiful day to say I do and begin our forever Wedding Planner Designer encicaroline Photographers jnesaisquoistudioVideographer palinoiacommLocation abbayedelongpontCaterer reception prestige traiteurFloral ancolievagabondeMUAH sophiemuaparisDress nicolemilanoofficialShoes jimmychooRings and watch cartier It was a beautiful day to say I do and begin our forever Wedding Planner Designer encicaroline Photographers jnesaisquoistudioVideographer palinoiacommLocation abbayedelongpontCaterer reception prestige traiteurFloral ancolievagabondeMUAH sophiemuaparisDress nicolemilanoofficialShoes jimmychooRings and watch cartier,Abbaye de Longpont,[]
야스 초이스 꾸러미 세트 Parisienne Sucr e 파리 지엔 세트 입 세트 A la M re de Famille Chocolat 메르 드 파 유 초코렛 Maison Boissier BonBon 브 아시 사탕 Le B n fique Th 르 베니 피크 허브 티 제품 별 설명 heeya s choice officiel 참고 파리 파리 일상 파리 살이 파리 쇼핑 파리 쇼핑 리스트 프랑스 직구 파리 직구 공구 야스 초이스 공구 꾸러미 세트 돈 사기 그거 프랑스 선물 세트 메르 드파 유 브 아시 캔디 르 피크 허브 티 봄 야스 초이스 흿템 민초 초 chez paris parisdaily parislife parisshopping heeyaschoice Parisienne Sucr e A la M re de Famille Chocolat Maison Boissier BonBon Le B n fique Th heeya s choice officiel chez paris parisdaily parislife parisshopping heeyaschoice,"Paris, France","['#희야스초이스꾸러미세트', '#파리', '#파리일상', '#파리살이', '#파리쇼핑', '#파리쇼핑리스트', '#프랑스직구', '#파리직구', '#4월공구', '#희야스초이스4월공구', '#꾸러미세트', '#내돈으로사기엔아깝고그치만갖고싶었던그거', '#프랑스선물세트', '#아라메르드파미유', '#브아시에캔디', '#르베네피크허브티', '#희야스초이스', '#흿템', '#민초아닌희초', '#chez희야', '#paris', '#parisdaily']"
골동품 시대 안락 속 세련 언어 파리 동네 골목길 꼭 brocante march aux puces vide grenier 등 골동품 시장 것 볼 수 전 구 때 집 근처 주말 벼룩시장 덕분 소위 말 쓰레기 것 한창 때 벼룩시장 관심 이번 마이 리얼 트립 덕분 전문 가이드 투어 파리 최대 벼룩시장 생투 벼룩시장 방문 수 투어 영어 진행 파리지앵 가이드 프렌치 악센트 프랑스인 토비 아스 영어 파리 꽤 산 독일인 것 당일 알 수 투어 매력 투어 전 굳이 벼룩시장 거 가이드 생각 토비 아스 덕분 내 지금 생투 벼룩시장 것 여러 시장 중 하나 사실 알 메인 시장 모던 빈티 리폼 소품 앙트 르포 entrep t 수 또 가이드 추천 투어 때 내 취향 세기 프렌치 스타일 찻잔 파리 여행 계획 중 빈티 관심 분 생투 벼룩시장 역사 꼭꼭 보석 상점 나 기념품 수 파리지앵 생투 플리 마켓 투어 추천 빈티 거울 이면 거울 포스터 책 그림 의류 등 사고 걸 투어 시작 때 미리 가이드 말 걸 수 광고 마이 리얼 트립 마이 리얼 크루 brocante march aux puces vide grenier entrep t,Marché aux Puces de Saint-Ouen,"['#광고', '#마이리얼트립', '#마이리얼크루']"
시간 생각,Musée d'Orsay,[]
돈 벌 빠리 유혹 도시 구먼,Rue du Faubourg Saint Honoré,[]
더위 피해 파리 센느 강변 파리 플라쥬 Paris Plage 여름 파리시 코로나 잠시 계 행사 다시 개최 바로 파리 플라쥬 부터 파리 중심 센느강 주변 문화 및 스포츠 관련 이벤트 무료 진행 강변 전시 스포츠 수업 아이 위 장난감 대여 도서관 모두 위 체험 여름 나기 수 햇빛 피해 파리 여름 곳곳 준비 파라솔 아래 접이식 의자 기대 야자수 나무 뽕나무 등 녹지 조성 분무기 설치 더 파리 플라쥬 완성 더욱 파리 여름 위해 다리 주변 카페 caf 나 바 bar 역시 마련 mylittleparis Paris Plage caf bar mylittleparis,"Seine River, Paris, France",[]
제품 구매 확정 포인트 포인트 보시 껄 제 향수 할인 구입 구매 확정 시 거의 페이 네이버 포인트 금액 회원 별로 차이 불리 향수 구입 대박 가격 구 매 대행 못 향수 파리 현 가격 유로 약 향수 현재 진행중 모든 제품 이현지 가격 더 제 비교 진짜 가격 꼭 사시 심지어 가격 치약 품 미니 핸드 크림 요 데 안 것 사면 살수 록 돈 버 거 벼룩 구입 가격 정도 바디 제품 면세 해외 고 지고 사지 하루 이틀 이면 집 내일 자정 진행 불리 향수 핸드 크림 파리 쇼핑,,"['#불리', '#향수', '#파리쇼핑']"
프랑스 여행 파리 와인 리스트 기대 안 곳 은근 꽤 탑 생산자 탑 뀌베 빌라 쥐 프리 뤼 가격 종류 저희 주 문 건 부르고뉴 화이트 명 생산자 훌 시 그니 밭 Luchets 의 빈티 해외 정도 것 영빈 오프 빈티 지라 오히려 더 접근성 빌라 쥐 파워 농축 못 향 뿜뿜 마시기 점심 마시기 바틀 Domaine Roulot Meursault Luchets Bourgogne C te de Beaune Meursault Luchets Domaine Roulot Meursault Luchets Bourgogne C te de Beaune Meursault,Epicure,[]
자연 주의 예술 럭셔리 만남 쥬얼리 브랜드 chaumetofficial 쇼메 여름 파리 팔레 데 보 인수 자연 주제 전시회 이번 식물 움 학교 Vegetal School of Beauty 전시 예술 분야 융합 통해 식물학 프리즘 탐구 전 파리 국립 자연사 박물관 식물 표 본관 소장 이자 현재 마라케시 마조렐 정원 책임자 마크 진슨 이 전시 쇼메 주얼리 작품 속 영감 원천 부분 탈 즉 식물 음 큐 레이 팅 점 이상 그림 조각 사진 가구 및 기타 사운드 디자인 설치 쇼메 컬렉션 및 아카이브 개 주얼리 오브 제 수 전시 추천 쇼메 전시회 Exposition Chaumet V g tal L cole de la Beaut 부터 Palais des expositions des BeauxArts Quai Malaquais Paris 예약 httpswwwchaumetcomfr frvegetal chaumetofficial Vegetal School of Beauty Exposition Chaumet V g tal L cole de la Beaut Palais des expositions des BeauxArts Quai Malaquais Paris httpswwwchaumetcomfr frvegetal,,[]
마린 몽 타구 패 브릭 오 너 먼트 염려 아이 반려동물 크리스마스 블랑님들 주문 마린 몽 타구 구 매 대행 듀블 파리,,"['#마린몽타구', '#구매대행은듀블랑파리']"
드라마 에밀리 파리 에밀리 아침 출근 Savoir 의 사무실 곳 Place de Valois 카페 테라스 풍경 광장 갤러리 카페 테라스 매우 파리 분위기 점심식사 가격 합리 관광객 거의 현지 직장인 자주 곳 로컬 분위기 만끽 수 Bistrot Valois Pl de Valois ParisPM PM Savoir Place de Valois Bistrot Valois Pl de Valois ParisPM PM,,[]
오픈 파리 맘마 파리시 아침 한국 시간 오후 마무 본사 소량 확보 요청 레드 다시 요새 정말 파리 곳 곳 볼때 인터뷰 사진 패션 퀄러티 합의 파리 지엔 초이스 왜 인기 퀄러티 처음 가죽 염색 모든 과정 에르베르 애 진행 가죽 일 아버지 노하우 디자인 것 알곳 사실 데 일리 가방 찾기 심플 디자인 것 포인트 희소성 공장 듯이 막 장인 정말 정성 만들기 역시 수량 확보 못 누구 말 샤넬 에르메스 정말 그 뭔가 앳 하나 에르베르 파리 맘마 파리 맘마 픽 파리 맘마 가방 윤혜진 가방 파리 지엔 패션 파리 쇼핑 파리 일상,"Paris, France","['#파리맘마', '#파리맘마픽', '#파리맘마가방', '#윤혜진가방', '#파리지엔패션', '#파리쇼핑', '#파리일상']"
코지 타 벨리니 네이비 컬러 디저트 접시 소량 코지 타 벨리니 구 매 대행 듀블 파리,,"['#코지타벨리니', '#구매대행은듀블랑파리']"
브라운 색 테디베어 롱샴 마론 컬러 르 풀 미니 가방 리츠 파리 구 매 대행 듀블 파리,,"['#리츠파리', '#구매대행은듀블랑파리']"
Henri Giraud Blanc de Blancs Krug Grande Cuv e Edmond et Anne Vatan Sancerre Clos la N ore CocheDury PulignyMontrachet Les Enseign res Domaine du Comte LigerBelair NuitsSaintGeorges er Cru Clos des Grandes Vignes Amazing lineupThanks wine empire 프랑스 여행 집 초대 저런 와인 뽕뽕 친구 저 집 초대 여행 와인 몇 군데 프랑스 일반 와인 저런 바틀 구 앙리 지로 하우스 블랑드블 레스토랑 테이크아웃 바탕 감 프랑스 리스트 레스토랑 관건 Henri Giraud Blanc de Blancs Krug Grande Cuv e Edmond et Anne Vatan Sancerre Clos la N ore CocheDury PulignyMontrachet Les Enseign res Domaine du Comte LigerBelair NuitsSaintGeorges er Cru Clos des Grandes Vignes Amazing lineupThanks wine empire,프랑스,[]
주문 센스 조명 파리 맘마 안목 지금 프로필 링크 절찬 판매 조명 아이디어 파리 맘마 파리 쇼핑,,"['#조명아이디어', '#파리맘마', '#파리쇼핑']"
셀린 빈티 카카오 채널 파리 맘마 문의 파리 맘마 파리 쇼핑,서울,"['#파리맘마', '#파리쇼핑']"
껏 이 자켓 문의 라이브 일단 박 여사 사이즈 다운 주문 저 주문 워낙 크게 꼭 사이즈 다운 이번 파리 맘마 난리 상품 한국 시간 오픈 마감 대로 제 제작 미리 해논 상품 소 진시 끝 프로필 링크 참조 파리 맘마 파리 맘마 구 매 가능 파리 패션 코튼 퀼팅 자켓 지금 ootd 파리 쇼핑 파리 지엔 느 ootd,,"['#파리맘마', '#파리맘마에서만구매가능', '#파리패션', '#코튼퀼팅자켓', '#지금이딱', '#파리쇼핑', '#파리지엔느']"
파리 지엔 옷 컬러 과감 바지 원색 볼드 뉴트럴 컬러 사이즈 자켓 느낌 멋 특 느낌 머리 그냥 최대한 자연 부 엉켯 그냥 두기 가끔 부스스 일부러 자칫하면 정말 신경안 느낌 날 수 조절 파리 지엔 느 파리 맘마 파리 맘마 파리 쇼핑 파리 일상 스타 일링 팁 Photo by parismamma official Photo by parismamma official,"Paris, France","['#파리지엔느', '#파리맘마', '#파리맘마온리', '#파리쇼핑', '#파리일상', '#스타일링팁']"
테리 셔츠 테리 가방 담 테리 팬티 일단 테리 파리 맘마 한정 판매 프로필 링크 애 주문 바배 파리 맘마 파리니 파리 쇼핑 태리 셔츠 ootd ootd,파리,"['#파리맘마', '#파리니꺼야', '#파리쇼핑', '#태리셔츠']"
카키 드레스 이 볼륨 쉬 함 사파리 카키색 이태리 코튼 가지 드레스 지금 프로필 링크 파리 맘마 파리 맘마 픽 파리 쇼핑 ootd 파리 카페 스타 일링 ootd,"Paris, France","['#파리맘마', '#파리맘마픽', '#파리쇼핑', '#파리카페', '#스타일링']"
마린 몽 타구 플레이 트 리드 하나 늘 제품 지금 매장 제품 저희 고객 매니저 신제품 소식,파리,[]
이번 파리 여행 필수 코스 astierdevillatte 한국 무사 도착 파리 여행 코스 파리 아스티 드빌 라트 파리 쇼핑 여행 기록 여행 그램 astierdevillatte,,"['#astierdevillatte', '#파리여행코스', '#파리', '#아스티에드빌라트', '#파리쇼핑', '#여행기록', '#여행그램']"
에르메스 바운싱 스니커즈 알록달록 관 세부 과세 배송비 모든 금액 포함 문의 재고 가격 DM DM,Hermès,[]
셀린느 트레 오페 배송 완료 셀린느 귀걸이 파리 쇼핑 데 파리 지엔 느 프랑스 패션 직구 르 메르 직구 몽클레어 구 매 대행 몽클레어 로 몽클레어 롱패딩 몽클레어 직구 폴 렌느 가방 폴 렌느 파리 폴 렌느 생로랑 가방 생로랑 클러치 생로랑 크로스 백 루이비통 가방 루이비통 루이비통 숄더백르 메르 원피스 르 메르 가방 천안 서울 대구 대전 경주 제주 울산 전주,,"['#셀린느트레오페', '#배송완료', '#셀린느귀걸이', '#파리쇼핑', '#데파리지엔느', '#프랑스패션직구', '#르메르직구', '#몽클레어구매대행', '#몽클레어클로에', '#몽클레어롱패딩', '#몽클레어직구', '#폴렌느가방', '#폴렌느파리', '#폴렌느백', '#생로랑가방', '#생로랑클러치백', '#생로랑크로스백', '#루이비통가방', '#루이비통백', '#루이비통숄더백', '#르메르원피스', '#르메르가방', '#서울', '#대구', '#대전', '#제주', '#울산', '#전주']"
캐리어 물건 못 정말 파리 뭐 사진 보 일단 집 앞 마트 슈퍼 봉막쉐 진짜 꼭 가세 개미지옥 파리 여행 파리 파리 쇼핑 봉막쉐,,"['#파리여행', '#파리', '#파리쇼핑', '#봉막쉐']"
파리 백화점 이 백화점 내부 카페 사진 스팟 구 경 거리 쇼핑 볼거리 사 마리 백화점,Samaritaine,['#사마리텐백화점']
키츠네 때 여유 사람 구경이,Café Kitsuné Palais Royal,[]
광고 프랑스 파리 여행 준비 분 또 빼 수 파리 여행 코스 중 하나 가바 쇼핑 도 하루 날 잡고 하루 종일 파리 쇼핑 기억 나 저 파리 발레 명품 브랜드 합리 가격 쇼핑 완료 파리 발레 파리 시내 약 거리 위치 거리 부담 전혀 뿐 여개 패션 뷰티 라이프스타일 홈웨어 부띠 브랜드 입점해 저 이목 집중 이번 저 또한 이 곳 평소 럭셔리 브랜드 완전 득템 심지어 파리 발레 근처 볼거리 디즈니랜드 시 라이프 퐁텐블로 성 등 파리 여행 코스 짤 때 참고 현재 이벤트 파리 여행 준비 분 꼭 한번 방문 것 파리 발레 Event 방문 기간 및 대상 부터 방문 고객 VIP 패스 통한 내 쇼핑 간 할인 혜택 식 음료 바 처 파리 발레 방법 개인 차량 파리 중심지 차량 거리 디즈니랜드 공항 샤를 드골 공항 거리 기차 센트럴 파리 역 발드 유럽 역 거리 발드 유럽 역 발레 도보 내외 쇼퍼 서비스 통 개인 셔틀 예약 가능 트래블 바이 디즈니 셔틀 서비스 디즈니 리조트 호텔 행 셔틀 서비스 사용 가능 Event VIP,,['#광고프랑스']
프랑스 발레 블랙프라이데이 크리스마스 프로모션 허니문 리조트 고객 위 혜택 할인 EVIP 링크 Ladur e 마카롱 교환 프로모션 기간 부터 블랙프라이데이 기간 부터 그 이후 크리스마스 프로모션 혜택 적용 발레 어디 프랑스 파리 동쪽 약 km 샹파뉴 chanpagne 지역 자리 잡고 파리 시내 로부터 자동차 약 이 소요 접근 방법 추천 것 발레 전용 셔틀버스 성인 기준 반나절 종일 발레 입점 브랜드 구찌 펜디 프라다 버버리 생로랑 돌체앤가바나 보테가베네타 발렌시아 발망 몽클레어 아미 끌 겐조 토즈 등 하이엔드 브랜드 이외 라코스테 폴로 노스페이스 게스 캘빈 클라인 등등 무려 개 이상 명품 브랜드 입점 게다가 허니문 리조트 제공 할인 코드 이용 추가 할인 혜택 파리 신혼여행 허니 무 너 라면 꼭 추천 쇼핑 당 코드 이용 라뒤레 마카롱 당 충전 파리 파리 쇼핑 파리 쇼핑 정보 파리 쇼핑 리스트 발레 발레 아울렛 발레 할인 쿠폰 발레 할인 쿠폰 발레 쿠폰 파리 아울렛 EVIP Ladur e km chanpagne,허니문리조트,"['#파리', '#파리쇼핑', '#파리쇼핑정보', '#파리쇼핑리스트', '#라발레빌리지', '#라발레빌리지아울렛', '#라발레빌리지할인쿠폰', '#라발레빌리지할인쿠폰', '#라발레빌리지쿠폰', '#파리아울렛']"
무료 럭셔리 뷰티 메카 파리 파리 지엔 느 관리 파리 최대 백화점 galerieslafayette 웰니스 갤러리 를 런칭 구 독자 이벤트 준비 이번 년도 파리 방문 구 독자 중 분 선정 hydrafacial X innerskinfr 의 해당 고급 스킨 케어 수 기회 선물 고해 lawellnessgalerie 고급 스킨 케어 바디 마사지 네일 헤 게 사우나 명상 PT 요가 필라테스 뷰티 및 스포츠 제품 쇼핑 모두 한번 수 파리 지엔 느 가장 핫 공간 중 하나 요 여기 한번 요가 후 마사지 네일 후 웰빙 브런치 주말 것 진심 프렌치 백화점 야심 런칭 곳 답 정말 인테리어 스텝 서비스 최고 적극 추천 이벤트 참여 방법 obonparis 팔로우 이 게시 물 미모 친구 명 댓글 태그 사용 상품권 그 기간 동안 파리 분 사용 수 참고 웰 니스 갤러리 라파예트 Bd Haussmann Paris F galerieslafayette hydrafacial X innerskinfr lawellnessgalerie PT obonparis Bd Haussmann Paris F,Galeries Lafayette Opéra,['#lawellnessgalerie']
