chunked_content,place,relevant_hashtags
파리 SEPHORA 수정 쇼핑 출장 마지막 날 공항 한국 핫 화장품 가득 선물 몇개 출장 수 정이 열 일 오늘 화장 요 아이 블 레미 쉬 크림 세인트 프랑 베이스 gisou 립 로우 마무리 모 제 림 in CJparis sephora 세포 코덕 스타 그램 파리 쇼핑 출장 캐시미어 가디건 피플 오브 더 월드 롯데 론칭 SEPHORA gisou in CJparis sephora,,"['#gisou', '#paris', '#세포라', '#파리쇼핑', '#출장', '#캐시미어', '#가디건']"
파리 가장 역사 백화점 VIP 처럼 쇼핑 방법 코로나 규제 완화 분 파리 방문 계 세 요 프랑스 파리 쇼핑 패션 도시 파리 쇼핑 더 기억 줄 galerieslafayette VIP 쇼핑 익스 페리 언스 패키징 가격 이용 건 요 합리 가격 패키징 프라이 빗 VIP 라운지 액서스 택시 귀가 서비스 달 DALLOYAU 바 처 라파예트 에코 제공 수 라운지 가시 샴페인 커피 과자류 준비 줄 거 프라이 빗 룸 나 이용 수 VIP 서비스 수 것 오봉 파리 코드 사용 할인 가격 쇼핑 익스 페리 언스 예약 수 httpswwwobonpariscomkomagazinegalerieslafayetteparisianshoppingexperience 이상 쇼핑 오봉 파리 구 독자 제공 갤러리 라파예트 무료 선물 프로필 링크 확인 VIP galerieslafayette VIP VIP DALLOYAU VIP httpswwwobonpariscomkomagazinegalerieslafayetteparisianshoppingexperience,Galeries Lafayette,[]
자 다시 본업 네트 재 수량 확보 수 소진 보신 분 아주 네트 저번 진행 감쪽 본사 제 배송 다음주 프랑스 출고 구입 파리 맘마 사이트 파리 맘마 파리 쇼핑 파리 맘마 픽 파리 맘마 구 매 가능 네트,"Paris, France","['#파리맘마', '#파리쇼핑', '#파리맘마픽', '#파리맘마에서만구매가능', '#네트백']"
라코벳 은 제 파리 때 봉막셰 백화점 몽쥬 약국 쇼핑 템 꼭 구매 제품 마르세유 비누 선물 용 주변 어른 선물 곤 프랑스 마르세유 솝 아시 사실 스페인 올리브 비누 정말 바르셀로나 가면 구매 개인 제 것 것 구매 때 프랑스 라코벳 이 가장 유럽 에코 트 인증 진짜 아시 전 나 이안 용품 기초 제품 세제 유럽 제품 선호 유럽 유기농 인증 SINCE 라코벳 전통 프랑스 마르세유 솝 비롯 자연 유래 바디 홈 케어 제품 보유 프랑스 브랜드 검증 성분 식물 유래 성분 각종 인증 기관 검증 제품 전 성분 안전성 임 테스트 완료 가지 임 테스트 결과 일차 자극 노폐물 세 정력 보습 검증 완료 프랑스 인증 정품 단 개 업체 부여 전통 제조 방식 인증 공식 라벨 SAVON De MARSEILLE 라코벳 마르세유 올리브 비누 블럭 황제 비누 루이 세 지정 콜베르 칙령 단 가지 원료 로만 식물성 오일 명품 비누 자극 클렌징 속 후 피부 식물 유래 성분 거품 자극 비누 세안 후 이후 지속 수 분량 라코벳 유기농 세제 프랑스 산 칩 비누 원료 황제 비누 프랑스 왕족 귀족 수 백년 세월 동안 온 명품 비누 칩 비누 원료 식물성 오일 프리미엄 식물 유래 성분 세탁 세제 세척 기본 올리브오일 고 농축 세척 생활 오염 때 옷감 손상 줄 감촉 더욱 식물 유래 원료 올리브 코코넛 등 식물성 성분 식물 유래 원료 사용 국내외 기관 인증 식물 유래 성분 액 상형 고 농축 세제 물 액 상형 세제 손 빨래 드럼세탁기 일반 세탁기 모두 사용 가능 라코벳 세제 안전성 프랑스 설립 유기농 인증 단체 에코 트 인증 세제 동물 실험 및 동물성 원료 생 형광 증 백제 미세 플라스틱 불검 세탁 세제 함유 금지 물질 종 미사 용 인체 피부 자극 안정 테스트 완료 선물 용 올케 유기농 제품 코벳 꼭 유기농 비누 유기농 세 제 프랑스 쇼핑 템 SINCE SAVON De MARSEILLE,파리,"['#라코벳', '#프랑스쇼핑템']"
비행기 애 도착 못 푸틴 객끼,바르샤바,"['#아직도도착못함', '#멀다멀어', '#푸틴개객끼']"
파리 맛집 추천 auxartistes 사진 로컬 맛집 공유 위치 관광지 조금 만가 성비 서비스 무엇 프랑스 가정식 경험 무조건 추천 스타 터 메인 디저트 코스 구성 메뉴 낮 인 저녁 인 일부 메뉴 엑스트라 차지 사이 저렴 저희 에스 르 오리 스테이크 허니 요거트 토마토 카프레 소고기 스테이크 크림 브뤨레 음료 술 포함 총 프랑스 정도 가성 비음 모두 양도 영어 메뉴판 준비 김밥천국 메모 사장 사장 몇번 물어 설명 브레이크 타임 저녁 반 영업 시작 구글맵 예약 예약 명 이상 인 일경 직접 입장 현지 손님 캐 주얼 분위기 저 위치 전화번호 맨 마지막 사진 명함 확인 auxartistes,Aux Artistes Restaurant,"['#파리맛집추천', '#auxartistes', '#프랑스가정식']"
에펠탑 루브르 박물관 피라미드 유물 보관 때문 현 실세 부활 상징 파리 방문 저녁 루브르 야경 보고 근처 카페 맥주 센강 것 추천 파리 스냅 촬영 문의 기우 사진 기우 사진 파리 스냅,"Paris, France","['#기우사진', '#파리스냅']"
Au Rocher de Cancale 오 호쉐 드 깡 Montorgueil 길 비스트 로예 세기 파리 제일 명성 해산물 레스토랑 중 하나로 이 지금 그 자리 계속 그 전통 운영 식사 커피 맥주 가시 로컬 비스트 로 추천 외국 관광객 현 지인 고객 층 조금 더 파리 진 면모 수 거 Au Rocher de Cancale Rue Montorgueil ParisAM AM 이 길 이 비스트 로 티피 컬 파리 바 브라 스리 카페 루브르 오페라 마레 지구 퐁피두 센터 등 Au Rocher de Cancale Montorgueil Au Rocher de Cancale Rue Montorgueil ParisAM AM,Rue Montorgueil,[]
LAssiette Champenoise assiettechampenoiseReims Champagne 프랑스 여행 샹파뉴 샹파뉴 랭스 미슐랭 스타 LAssiette Champenoise 와인 리스트 가격 종류 Le Parc 좀 제 와인 여러 개 밖 식전주 식전 음식 안 이동해 메인 음식 여기 앞뒤 배 여 기도 식사 시간 체력 한계 시작 음식 분위기 서비스 나중 졸음 못 온 LAssiette Champenoise assiettechampenoiseReims Champagne LAssiette Champenoise Le Parc,L'Assiette Champenoise,[]
힙 엣지 프렌치 디자인 백화점 입구 애 부터 파리 지엔 인정 자캣 뭔가 것 자캣 하나로 또 끝 이나 간지 템 지금 절찬 리 판매 중유 프로필 링크 파리 맘마 뉴욕 파리 댁 ootd 파리 쇼핑 파리 ootd,파리,"['#파리맘마', '#뉴욕이그리운파리댁', '#파리쇼핑', '#파리']"
매력 다리 파리 파리 스냅 기우 사진 파리 스냅 파리 신행 파리 카페 유럽 여행 파리 여행 paris parisphotography 파리 맛집 paris parisphotography,"Paris, France","['#파리스냅', '#기우사진', '#파리신행', '#파리카페', '#유럽여행', '#파리여행', '#paris', '#파리맛집']"
뭐 이란 날씨 후 리스 집업 머스터드 블루 자켓 라이브 한번 주문 제 쥬 운동 때 캠핑 기온 차 요즘 필수 템 색상 바잉 지금 프로필 링크 판매 파리 가을 파리 쇼핑 파리 패션 티디 파리 파리 맘마 파리 맘마 픽,파리,"['#파리의가을', '#파리쇼핑', '#파리패션', '#오오티디', '#파리', '#파리맘마', '#파리맘마픽']"
영화 속 주인공 법 파리 간다 사진 파리 스냅 촬영 문의 카카오 톡 채널 기우 사진 기우 사진 파리 스냅,"Paris, France",['#기우사진']
Brought home some souvenirs 셀 로스 호텔 기념품 것 것 와인 못 프랑스 와인 샵 레스토랑 샵 가격 닥 샵 정도 시간 Brought home some souvenirs,서울,[]
주말 파리 기록 비록 준비 새벽 비행기 파리 도착 공항 밖 시간 오전 전이 라면 새벽 비행 신봉 수 처음 숙소 샹 제 리제 근처 체크 때 먼저 짐 아침 구글맵 통해 근처 별 점 식당 중 곳 꽤 식사 나오니 Azur 가게 상제 리제 근처 라면 추천 만하 음식사진 별로 가게 샷 대체 브런치 집 무방 아침 샹 제 리제 뉴욕 마이애미 kith 를 발견 Kith 를 면 생각 사실 나 kith 의 팬 것 매장 파리 이름 걸 뉴욕 마이애미 가장 아내 마음 모자 구입 세계 개 슈프림 매장 중 하나 파리 방문 수 스텝 댕댕 추정 녀석 자고 사실 나 슈프림 옷 모자 등 각종 서리 편 이번 비니 미니 슬링 선물 용 티셔츠 몇장 구매 점심 trois fois plus de poment 사천 식당 여기 탄탄 사실 우리 한식 제외 프라하 파리 더 맛집 알 전형 중식 매 움 단계 중 맵 속 단계 무난 클리어 꽤 서양인 한국인 자리 추천 이번 파리 방문 가장 목적 전시회 사실 주인공 파리지앵 아티스트 처제 처제 프랑스 미대 졸업 후 다시 비쥬 얼 테크놀로지 공대생 예술 테크 접목 심취 녀석 파리 이름 식당 생각 이드 백세주 마을 한식 집 족발 보쌈 막걸리 등 맛 무난 한국 온 여행객 굳이 가격 무난 이후 커피숍 그림 대한 것 인생 이야기 처음 처제 역시 나이 구나 생각 셋 야외 테이블 한참 순간 백세주 마을 역시 한국어 통 직원 다음 날 점 사누끼 꽤 전 디 한국인 꽤 평이 곳 동경 라멘 집 일해 경험 바탕 내 생각 말 이 곳 블로거 방문 맛 대해 오히려 평가 국물 면관 리도 세트 가성 비도 게다 시 토후 도 여기 마지막 식사 우버 공항 것 우리 루틴 인지도 아내 스카프 스카프 링 주황색 가게 왜인 거기 백 팩 내 눈 내 성격 핸드백 라면 버킨 이외 절대 시선 기지 이 녀석 아내 마음 시간 한국 가격 꽤 것 또한 메리 다한 역시 가격 더 살 마음 연말 아내 로부터 면죄부 수 묘 기 대감 설득 오빠 달 말 아내 정도 나 본래 물욕 거의 사람 미국여행 시작 여행지 구매 녀석 꽤 기분 것 이 맛 쇼핑 것 물건 하나 하나 나 기호 때문 인지도 이번 쇼핑 선물 사서 나 기호 기분 전 수 음 더 마음 여행 기록 파리 여행 파리 맛집 파리 쇼핑 Azur kith Kith kith trois fois plus de poment,프라하,"['#여행기록', '#파리여행', '#파리맛집', '#파리쇼핑']"
햇볕 크루아상 굽굽,Lemaire,[]
파리 가면 꼭 빈티 시장 희소성 엔틱 유럽 물건 정말 현금 꼭 악세사리 식기 거울 가구 의류 정말 추억 담 수 쇼핑 벼룩시장,파리,[]
박싱 기념 영상 보기,Tour Eiffel,[]
유럽 명품 쇼핑 명소 비스터 컬렉션 여행 경험 The Bicester Collection Night 유럽 여행가 수 명품 쇼핑 도 유럽 여행가 하루 정도 꼭 아울렛 방문 유럽 럭셔리 쇼핑 데스티네이션 비스터 컬렉션 유럽 중국 개 도시 자리 럭셔리 쇼핑 개 이상 세계 브랜드 최대 할인 가격 수 취향 먹거리 볼거리 거리 준비 쇼핑 아울렛 여행 쇼핑 가미 경험 수 런던 파리 밀라노 바르셀로나 마드리드 더블린 브뤼셀 앤트워프 뮌헨 프랑크푸르트 등 유럽 비롯 중국 상하이 동양 베니스 쑤저우 자리 이번 행사 각 도시 지역 로컬 느낌 반영 리지 소개 고급 지고 꼭 곳 방문 행사 분 대화 마술 쇼 보고 인생 컷 행사 때 생화 센터 피스 정말 뜻 뉴욕 오픈 예정 랍 비스터 컬렉션 못 여행 비스터 컬렉션 thebicsetercollecion 유럽 유럽 여행 유럽 쇼핑 유럽 아울렛 thebicsetercollecion 유럽 명품 유럽 명품 쇼핑 The Bicester Collection Night thebicsetercollecion thebicsetercollecion,Ananti at Gangnam - 아난티 앳 강남,"['#비스터컬렉션', '#유럽', '#유럽여행', '#유럽쇼핑', '#유럽아울렛', '#유럽명품', '#유럽명품쇼핑']"
제 작 원 프랑스 파리 여행 때 수 발레 쇼핑 아래 혜택 수 파리 여행 분 참고 오 프랑스 관광 청 준비 특급 혜택 기간 한국인 대상 추가 할인 라뒤레 스타벅스 아모 리노 중 택 쿠폰 증정 발레 방문 한국인 대상 럭 키드 로우 이상 쇼핑 시 프렌치 레스토랑 므뉘 팔레 모닝 세트 or 고 메 브레이크 세트 제공 기간 한국인 대상 추가 할인 라뒤레 스타벅스 아모 리노 중 택 쿠폰 증정 기간 익스 클루 시브 세 일 참여 매장 프랑스 관광 청 QR 코드 최대 할인 율 적용 프랑스 관광 청 홈페이지 국적 입력 VIP 패스 다음 QR 코드 형태 캡쳐 발레 게스트 서비스 컨 시어 쿠폰 줌 VIP 패스 httpsbitly Br Oujlavalleevillage explorefrance ExploreFrance 프랑스 파리 프랑스 관광 청 발레 or QR VIP QR VIP httpsbitly Br Oujlavalleevillage explorefrance ExploreFrance,La Vallée Village Paris,"['#제작지원프랑스', '#파리여행', '#프랑스', '#파리', '#프랑스관광청', '#라발레빌리지']"
진짜 에펠 뷰 내내 휴가 끝,파리,['#에펠뷰']
연한 바이올렛 방울 톡 핑크 색감 제작 자켓 코트,"Montmartre, Paris",[]
낭만 뭐 별거 낭만 도시 파리 라파예트 옥상 크레페 그게 낭만 뷰 Galeries Lafayette Looftop 프랑스 파리 월토 일 프랑스 여행 파리 여행 Galeries Lafayette Looftop,Galeries Lafayette,"['#프랑스여행', '#파리여행']"
파리 여행 시 쇼핑 추천 발레 아울렛 lavalleevillage 전 신혼여행 파리 때 발레 양 손 가득 쇼핑 파리 요즘 옷 사고 때 종종 방문 마쥬 산드로 끌 로디 피에로 파리 로컬 브랜드 신상 자주 국대비 저 말 구매 수 완전 추천 거기 더 핵 팁 전 적 오봉 파리 홈페이지 발레 할인 쿠폰 사용 수 obonparis 오봉 파리 홈페이지 QR 코드 생 성해 웰컴 센터 제시 추가 할인 쿠폰 라뒤레 마카롱 개 아모 리노 아이스크림 무료 쿠폰 볼 수 디저트 쿠폰 것 디저트 교환 구 매 금액 사용 수 개꿀저 이 날 프라다 패딩이랑마쥬 끌 로디 피에로 의류 몇 가지 구매 사실 어디 아울렛 쇼핑 은 그날그날 재고 쇼핑 성 패가 제 간 날 버버리 프라다 발렌티노 짐머 등 제품 지갑 방어 곧 크리스마스 크리스마스 선물 사기 것 파리 여행 계획 하루 파리 아울렛 방문 계획 보시 건 요 파리 쇼핑 파리 쇼핑 리스트 쇼핑 스타 그램 lavalleevillage parisshopping lavalleevillage obonparis QR lavalleevillage parisshopping,"La Vallée Village, Paris","['#파리여행', '#라발레빌리지', '#오봉파리', '#라발레빌리지할인쿠폰', '#아울렛쇼핑', '#크리스마스선물', '#파리아울렛', '#파리쇼핑', '#파리쇼핑리스트', '#lavalleevillage']"
빛 향연 아틀리에 데 뤼미 에르 전시 오봉 파리 구 독자 할인 부터 시작 이 사랑 온 파리 디지털 아트 센터 Atelier des Lumi res 이번 세잔 느 칸딘스키 테마 환상 빛 세계 구현 분 것 오봉 파리 할인 코드 준비 SOCOBONcezanne 를 예약 때 입력 할인 수 에밀리 파리 에밀리 곳 친구 그림 대화 장면 클래식 선율 생명 불어 것 예술 작품 사이 경험 정말 가족 친구 연인 파리 남녀 노소 수 문화 체험 아트 힐링 시간 가지 분 추천 방문 시 예약 필수 사이트 할인 코드 꼭 예약 바 요 예약 구글 atelier des lumi res 검색 오봉 파리 사이트 안내 수 LAtelier des Lumi res Rue SaintMaur Paris 월일 AM PM Atelier des Lumi res SOCOBONcezanne atelier des lumi res LAtelier des Lumi res Rue SaintMaur Paris AM PM,,[]
전반 한국 물건 가격 대도 저렴 해 관세 텍스리펀 계산 쇼핑 매 리트 곳 한국 구 제품 사이즈 구매 수 가격 이번 루이비통 신상 코트 기준 후반 파리 텍스리펀 조금 더 디올 한국 좀 그동안 니스 관광 쇼핑 못 오늘내일 쇼핑 예정 paris 파리 여행 파리 쇼핑 paris,"París, France","['#paris', '#파리여행', '#파리쇼핑']"
파리 빈티 샵 유튜브 업로드 한혜연 파리 빈티 샵 킬리 치 파리 라마 헬 파리 빈티 파리 쇼핑 여행 대한 기 대감 때문 요 요즘 부쩍 한혜연 파리 빈티 샵 검색 전체 영상 주소 유튜브 확인 빈티 고수 핫 킬리와치 라마 헬 parisvintage kiliwatchparis lamarelle parisshopping parisvintageshop parisvintage kiliwatchparis lamarelle parisshopping parisvintageshop,파리,"['#파리빈티지샵', '#한혜연파리빈티지샵', '#킬리와치파리', '#파리빈티지', '#파리쇼핑', '#한혜연', '#파리빈티지샵', '#킬리와치', '#parisvintage', '#kiliwatchparis', '#lamarelle', '#parisvintageshop']"
다른 사람 사진 사실 다른 사람 모습 파리 스냅 기우 사진,"Paris, France",['#기우사진']
광고 명품 쇼핑 득템 찬스 며칠 전 스토리 여행 파리 쇼핑 혜자 못 대박 쇼핑 기회 소식 백신 파리 여행 주목 온라인 직구 분 주목 발레 파리 가장 아울렛 프라다 버버리 몽클레어 마쥬 산드로 끌 등 입점 가을 발레 방문 할인 마카롱 상품권 쇼핑 가능 한국 발레 온라인 주문 추가 할인 몽블랑 롱샴 바쉬 폴로 랄프 로렌 빌레로이앤보흐 등 개 이상 브랜드 추가 할인 쇼핑 요 발레 추석 특별 할인 정보 오프라인 온라인 모두 발레 온 오프라인 쇼핑 시 프랑스 관광 청 VIP 할인 쿠폰 제시 추가 할인 적용 발레 웰컴 센터 프랑스 관광 청 VIP 할인 쿠폰 제시 라뒤레 마카롱 교환 최대 상품권 랜덤 봉투 증정 오프라인 발레 온 오프라인 쇼핑 시 프랑스 관광 청 VIP 할인 쿠폰 제시 추가 할인 적용 발레 웰컴 센터 프랑스 관광 청 VIP 할인 쿠폰 제시 라뒤레 마카롱 교환 증정 오프라인 온라인 쇼핑 일부 다행 진짜 제대로 역시 직접 방문 답 것 블랙프라이데이 크리스마스 때 할인 장난 저 파리 발레 쇼핑 때 할인 위해 프랑스 관광 청 쿠폰 스토리 하이라이트 저장 링크 캡쳐 사용 발레 온라인 쇼핑 링크 방법 스토리 고정 포스팅 프랑스 관광 청 지원 작성 후기 VIP VIP VIP VIP,La Vallée Village,"['#광고', '#명품쇼핑', '#득템찬스며칠', '#프라다', '#버버리', '#몽클레어', '#마쥬', '#끌로에', '#몽블랑', '#롱샴', '#바쉬', '#폴로랄프로렌', '#빌레로이앤보흐']"
Ramonet ChassagneMontrachet er Cru Les Ruchottes C te de Beaune ChassagneMontrachet 프랑스 여행 샹파뉴 와인 리스트 Le Parc 만큼 가격 내 아라하 화이트 생산자 빈티 지라 의 매력 기 조금 느낌 이 식사 시간 덕 점점 모습 맛 Ramonet ChassagneMontrachet er Cru Les Ruchottes C te de Beaune ChassagneMontrachet Le Parc,L'Assiette Champenoise,[]
덴마크 디자이너 드레스 폭 소재 말 소량 한정 파리 맘마 써머 드레스 파리 쇼핑 파리 맘마 픽 끝 내 만결 국 취향,파리,"['#파리맘마', '#써머드레스', '#파리쇼핑', '#파리맘마픽', '#어려워도끝까지', '#내가좋아하는것만', '#결국은내취향']"
도시 밤 도시 매력 것 여름 날씨 야외 테이블 이용 이 도시 밤 더 것 해 해지 불 파리 스냅 예약 중 카카오 톡 채널 기우 사진 기우 사진,"Paris, France",['#기우사진']
최고급 최상급 캐시미어 대량생산 자체 빗질 캐시미어 사용 캐시미어 정말 끝판 정말 캐시미어 숨 계절 입 수 말로 표현 이 니트 제 를 브루 언니 개인 구매 유명 세 가격 대가 제품 문의 요청 한번 시범 한번 직접 정말 감탄 감동 이 니트 부터 자정 때 주문 분 한해 만 올렁 제작 이태리 바로 선착순 특별 사은 품 금요일 한국 시간 시작 파리 맘마 평생 템퀄러티 승부 캐시미어 어디 캐시미어 니트 파리 쇼핑 ootd 파리 맘마 픽 파리 맘마 구 매 가능 ootd,"Paris, France","['#파리맘마', '#평생템', '#퀄러티로승부', '#캐시미어어디까지입어봤니', '#캐시미어니트', '#파리쇼핑', '#파리맘마픽', '#파리맘마에서만구매가능']"
영화 인셉션 촬영 지로 BirHakeim 다리 스냅 촬영 스팟 화보 촬영 영화 드라마 촬영 모습 수 가우 사진 파리 스냅 BirHakeim,"Paris, France",['#가우사진']
MADE IN ITALY 후디 반바지 후디 코트 후디 머플러 진짜진짜 따땃 여기 조기 연출 겨울 아이템 카멜 블략 피콕 그린 세 가지 색상 이구 아우 터 색상 매치 연출 수 지금 구 매 링크 바로 구매 바로 배송 파리 맘마 파리 파리 쇼핑 머플러 추천 후디 반바지 후디 머플러 데 일리 데 일리 패션 MADE IN ITALY,파리,"['#파리맘마', '#파리', '#파리쇼핑', '#머플러추천', '#후디에반바지', '#후디머플러', '#데일리룩', '#데일리패션']"
Emmanuel Brochet Les Hauts Chardonnays Champagne 프랑스 여행 샹파뉴 내 생산자 엠마누엘 브로 쉐 내 페이보릿 뀌베 오 샤 이 너 무 레어해 이제 샴페인 여기 리 스팅 아주 만 역시 기본 뀌베 르몽베누 더 깊이 더 숙성 권장 지금 마시기 견과류 파이 향 상큼 시 트러스 변사 뉘앙스 식전주 샴페인 나중 다시 Emmanuel Brochet Les Hauts Chardonnays Champagne,Domaine Les Crayères,[]
사진 찍기 전 저 스냅 사진 처음 접 것 가족사진 접 처음 쑥쓰럽 역시 찍기 순간 생각 가족 여행 온 저 부모님 모시 유럽 여행 생각 파리 스냅 예약 중 기우 사진,"Paris, France",['#기우사진']
파리 지엔 백 엔조 조 저 정신 분 추천 그냥 막 쓱 디자인 저 거저 거 가지 분 추천 작년 시작 엔조 시리즈 항상 바로 완판 또 하나 에르 배르 백 좀 루즈 느낌 흐물해 각 안 걱정 몸 자연 플라브 조 기 품절 엔조 요청 지금 사이트 미리 제작 상품 소 진시 역시 품절 파리 맘마 가방 파리 스타일 파리 쇼핑 파리 맘마 파리 ootd ootd,"Paris, France","['#파리맘마가방', '#파리스타일', '#파리쇼핑', '#파리맘마', '#파리']"
마린 몽 타구 노트 출시 소개 옆면 금박 처리 제품 총 가지 종류 스토어 나머지 확인,,[]
파리 라이프스타일 편집 merci 오덴세 입점 파리 가면 한번 것 곳 살 막 프랑스 브랜드 jars 플레이 트 몇개 골 저희 때 최우식 소년 뿜뿜 푸드 스타일 리스트 렌탈 렌탈샵 그릇 파리 쇼핑 그릇 쇼핑 푸드 팀 푸드 스타일 리스트 쇼핑 파리 merci jars,Merci,"['#푸드스타일리스트의렌탈샵', '#차리다빌리지', '#렌탈샵', '#그릇샵', '#파리쇼핑', '#그릇쇼핑', '#푸드팀', '#푸드스타일리스트', '#쇼핑', '#파리']"
파리 여행 가면 무조건 발레 파리 시내 거리 위치 디즈니랜드 파리 거리 가기 여행 코스 파리 명품 쇼핑 한번 가야 파리 발레 추석 맞이 트래블 맵 단독 프로모션 및 할인 쿠폰 기간 대한항공 마일리지 스카이 패스 적립 당일 구매 영수증 여권 스카이 패스 제시 당 마일 적립 추가 할인 쿠폰 제공 구매 금액 별 사은 품 증정 유로 이상 구매 시 꼬 달리 핸드 크림 립밤 듀오 유로 이상 구매 시 라로슈포제 시 카 러스트 추석 맞이 최대 추가 발레 내 부가 서비스 무료 와이파이 쇼핑 익스 프레 스 웰컴 센터 핸 프리 쇼핑 퍼스 널 쇼퍼 기저귀 교환 무료 주차 전기차 충전 휴대폰 충전 텍스리펀 서비스 파리 발레 VIP 쿠폰 및 추석 프로모션 QR 코드 스캔 해당 페이지 고고 httpswwwtravelmapcokrdiscountview travelmapkr 광고 발레 LaValleeVillage 프랑스 여행 파리 아울렛 파리 여행 파리 명품 쇼핑 파리 쇼핑 아울렛 파리 쇼핑 유럽 여행 트래블 맵 TRAVELMAP 추석 파리 가을 여행 TRAVELMAP 추석 파리 가을 여행 벨라 vip 패스 벨라 할인 쿠폰 추석 발레 프랑스 명품 쇼핑 VIP QR httpswwwtravelmapcokrdiscountview travelmapkr LaValleeVillage TRAVELMAP TRAVELMAP vip,파리,"['#라발레빌리지파리시내에서', '#광고', '#라발레빌리지', '#LaValleeVillage', '#프랑스여행', '#파리아울렛', '#파리여행', '#파리명품쇼핑', '#파리쇼핑아울렛', '#파리쇼핑', '#유럽여행', '#추석', '#파리가을여행', '#추석', '#파리가을여행', '#라벨라빌리지vip패스', '#라벨라빌리지할인쿠폰', '#추석라발레빌리지', '#프랑스명품쇼핑']"
벌써 파리 나름 생각 또 내년 멀리 여행 번 더 수,파리,[]
떡뽁 빠구리 미슐랭 뺨 맛 에펠 뷰 숙소 시 타 딘 투어 에펠 파리 파리 호텔 추천 호텔 장점 가격 에펠 뷰 사진 실제 크게 취사 가능 바로 코앞 지하철 입구 교통 매우 편리 에펠탑 도보 층 멕 도날드 스벅 바로 옆 대형 마트 몽쥬 약국 에펠 점 도보 컷 단점 리셉션 불친절 배수 수압 청소 안 정도,Tour Eiffel,"['#에펠뷰숙소', '#시타딘투어에펠파리', '#파리호텔추천이']"
파리 골목 백년 가게 신간 간 서울 국제 도서전 처음 실물 공개 파리 골목 백년 가게 간 곧 파리올림픽 파리 여행 계획 중이 시 라면 파리 맛집 기념품 포함 파리 시간 장사 특색 가게 소개 책 꼭 지금 바로 인터넷 서점 키다리 스마트 스토어 수 프랑스 파리 파리올림픽 백년 가게 파리 노포 파리 일상 파리 쇼핑 파리지앵 파리 생활,,"['#파리골목마다백년가게', '#서울국제도서전', '#파리올림픽', '#파리여행', '#프랑스', '#파리', '#백년가게', '#파리노포', '#파리일상', '#파리쇼핑', '#파리지앵', '#파리생활']"
alaia paris yoonyeojung wwwparisellesportercokr alaia paris yoonyeojung wwwparisellesportercokr,파리,"['#paris', '#yoonyeojung']"
