이름,주소,평점,위도,경도,리뷰,영업시간,카테고리,핫플레이스여부
Richmond Hotel Higashi Ōsaka,"1-chōme-3-16 Nagatanaka, Higashiosaka, Osaka 577-0013, Japan",4.1,34.6783011,135.5897897,"근처에 위치한 레스토랑과 슈퍼마켓이있는 지하철 역까지 5 분.방은 매우 깨끗하고 잘 관리되어 있으며 철, 슬리퍼 및 두 가지 유형의 베개와 같은 다양한 시설이 부드럽고 단단합니다.공기 청정기와 미니 냉장고도 함께 제공됩니다.직원의 도움에 가장 깊은 인상을받은 나는 주요 도로에 직면하지 않고 높은 층의 조용한 방을 요청했으며 그들이 찾고 있던 정확한 유형의 방을 할당 한 것을 알게되어 기뻤습니다.또한 손님이 청소 옵션을 선택하고 인근의 권장 식당을 찾을 수있는 내부 평면 패널도 있습니다.나는 나의 체재에 너무 만족한다. 오사카를 다시 방문한다면 확실히 돌아올 것이다!
서비스는 예외적입니다.우리는 금연 공간을 예약 할 수 없었지만 체크인 당일에 그들은 무료로 묻고 묻는 질문이없고 질문이 없을 때 우리에게 비 흡연실로 바뀌 었습니다.이제 1 명의 손님을 위해 2 개의 객실을 청소해야한다는 사실에 대해 조금 미안하다고 느꼈습니다.그 외에도 그들은 끔찍한 방과 시설, 좋은 상품, 좋은 모든 것을 얻었습니다.오사카에 들러서이 호텔에 기회를주십시오.
예상보다 크게 예약하기 전에 리뷰를 읽고 있었고 그들은 모두 작지만 방은 특히 일본에게는 완벽하게 괜찮습니다.직원들은 친절하고 환영하며 모든 질문을 도울 준비가되었습니다.2 층에는 멋진 음료와 알코올을 판매하는 자판기가 있으며 같은 방에 전자 레인지가있는 세탁기가 있습니다.그들은 매일 수건을 바꾸고 침대 등을 만듭니다.지하철은 나가 타 (Nagata)라고 불립니다. 출구 1을 통해 나가는 말 그대로 100 피트 떨어져 있습니다.너무 편리합니다.현장에 주차장도 있습니다.확실히 돌아올 것입니다.정말 감사합니다. 리치몬드!
위치, 숙박 시설, 서비스 및 가격에 상관없이 훌륭하지만 방을 제외하고는 특히 침대 크기에 약간 작습니다.우리는 성인 2 명과 어린이 두 자녀가 무료로 예약되었습니다.그러나 침대는 두 명의 성인에게만 충분합니다.그들이 그러한 문제를 개선 할 수 있다면, 나는 그들에게 5 개의 별을 확실히 주어야합니다.
숨겨진 보석.객실 크기는 평균 이상입니다.아침 식사는 괜찮습니다.리셉션이 도움이됩니다.비트 날짜가 있지만 제대로 개조되었습니다.지하철 노선은 바로 옆에 있습니다.",운영 시간이 없습니다,"하숙, point_of_interest, 설립",Yes
Natural Hot Spring Hanakaze-no-yu Onyado Nono Namba,"1-chōme-4-18 Nipponbashi, Chuo Ward, Osaka, 542-0073, Japan",4.3,34.667985,135.506326,"나는 최근에 머물면서 멋진 경험을했습니다.방은 좋았고 편안한 숙박을 제공했습니다.이 호텔의 독특한 측면은 로비에서 신발을 제거하고 사물함에 보관해야한다는 것입니다.전체 호텔에는 타타미 표면이있어 일본의 전통적인 느낌을줍니다.자연적인 수조는 하이라이트로 편안하고 활력있는 경험을 제공했습니다.아침 식사는 일본적이고 훌륭했으며, 우리가 진정으로 사랑하는 일본의 맛을 제공합니다.전반적 으로이 호텔은 전통적인 터치와 우수한 편의 시설에 대한 정통적이고 즐거운 일본 경험을 제공합니다.
전반적으로, 그것은 좋은 위치에있는 구식 호텔입니다.기차역과 도톤 부리가 매우 가깝습니다.위치는이 장소에서 유일한 좋은 것입니다.우리는 Chase Travel Portal을 통해이 호텔을 예약했습니다.분명히, 호텔은 우리가 예약을했을 때 주목되지 않은 객실 청소에 대해 추가 요금을 청구합니다.손님은 매일 방 밖으로 쓰레기통을 남겨 둘 것으로 예상되었지만 호텔은 추가 쓰레기 봉투를 제공하지 않았습니다..아침에 호텔 복도는 모든 쓰레기 봉지가있는 전쟁 지역과 함께 사용되었으며 잠옷을 입은 잠옷이 주변에 놓여 있습니다.벽은 매우 얇고 벽지가 벗겨졌습니다.우리는 10 층에 있었고 항상 교통량을들을 수 있습니다.집 청소는 오전 9 시경에 시작하여 내 방에서 진공 청소기가 크고 깨끗하게 들릴 수 있습니다.우리는 킹 침대를 예약했습니다.실제로 두 개의 침대가 함께 자고 잠을자는 것이 매우 불편했습니다.Socalled Welcome Beverage는 로비에서 자체 봉사를위한 Coffeetea 컨테이너 일뿐입니다.호텔 아침 식사는 1 인당 2300 년 이었지만 음식은 그다지 좋지 않았습니다.동일하거나 저렴한 비용으로 근처에 훨씬 더 나은 아침 식사 옵션이 있습니다.이 서비스는 미묘하고 조직화되지 않았습니다.일본의 환대에 대한 나의 기대를 충족시키지 못했습니다.
우리 가이 장소를 얼마나 좋아했는지 표현할 수는 없습니다.이것은 일본에서 한 달 동안 긴 여행에서 우리가 가장 좋아하는 체류였습니다.
객실은 훌륭하고 넓었습니다
Onsen은 우리가 일본에서 방문한 최고의 것이 놀랍습니다.
서비스는 훌륭했습니다
그들은 땅콩 알레르기가 있었을 때 내 생명을 구하고 직원 중 한 명이 구급차에 머물면서 필요한 모든 정보를 번역하는 데 도움을주었습니다.
우리는 일본으로 돌아올 때 마다이 장소를 방문하고 있습니다.
나를 위해 일본에서 최고의 숙박.큰 가치와 더 나은 체류.Kintetsu Nippombashi Station 근처에 위치합니다.많은 음식과 편리한 가게가 근처에 있습니다.밝고 편안한 방.모든 것이 좋았습니다.나는 아침 식사 뷔페 때문에 여기에 머물렀고 다시 돌아가고 싶다.나는 신발이없는 호텔 주위를 걷는 것을 좋아합니다.
좋은 위치, 평균 호텔.방은 벽에 깨끗한 얼룩, 바닥에 머리카락이 없었습니다.그들은 당신에게 지금까지 본 것 중에서 가장 아픈 베개 두 개를주고, 나는 목이 아픈 목으로 일어났습니다.외국인으로서 나는 그곳에서 매우 환영받지 못했습니다.손님의 대다수는 일본인이었고 나는 많이 쳐다 보았다.
Onsens No Tattoo 정책은 2024 년에 말도 안됩니다. 나는 여자가 발견되지 않은 문신으로 공개적으로 목욕하는 것을 보았고 아무도 그녀에게 아무 말도하지 않았으므로 정책이 얼마나 많은지 알지 못합니다.그들이 나에게 준 문신 덮개가 내 팔에 발진을 일으켰습니다.
Noshoes 호텔로서 나는 슬리퍼가 제공 될 것으로 예상했지만 양말 만 제공했습니다.다타미 매트가 미끄러 져서 거의 몇 번 떨어 졌기 때문에 조심하십시오.",운영 시간이 없습니다,"하숙, point_of_interest, 설립",Yes
Air Osaka Hostel,"2-chōme-9-19 Kitakagaya, Suminoe Ward, Osaka, 559-0011, Japan",4.5,34.6222589,135.4769605,"직원들은 매우 친절하고 도움이되었습니다.침대는 편안하고 깨끗했습니다.위치는 도심에서 조금 멀지 만 기차로 여전히 접근 할 수 있습니다.주인은 매우 시원했고 우리를 일부 지역 장소로 동반했습니다.생성 된 환경은 솔로 여행자가 친구를 쉽게 만들 수있게합니다.내가 가진 최고의 호스텔 경험.감사합니다 Tomo!
바쁜 중앙 오사카에서 너무 많은 동네에서 일본에서 첫 번째 정류장에 적합했습니다.호스텔은 친절한 직원들과 너무 편안했고 현지 음식에 대한 유용한 권장 사항!돌아올거야!
나는 에어 오사카에서보다 어딘가에 머물면서 집에서 더 안전하다고 느끼지 않았다.가장 친근한 직원과 전반적인 분위기는 온통 가장 친절한 영혼을 끌어들이는 것 같습니다!10010 여기에 머무르는 것이 좋습니다.
진정한 호스텔 경험.방은 사진이 사진처럼 보이는 것만 큼 좋은 곳이 없었습니다.벽은 그들이 무너지기 시작한 것처럼 보였습니다. 어떤 방법으로는 거래 차단기가 아니었지만, 우리가 바퀴벌레를 발견했을 때, 우리는 여기에 머물 수 없었습니다.주인은 매우 도움이되었고 밤 동안 우리를 상환하고 문제가 돌볼 수 있도록 보장했습니다.
세계 최고의 소셜 호스텔 중 하나.오사카를 즐기고 싶다면 이곳은 머무를 곳입니다.Yotsubashi 라인에 2 분 도보로 이용됩니다.호스텔의 바와 코타 츠 지역은 친구를 사귀고 긴장을 풀고 예술과 음악을 즐기기에 좋은 곳입니다.보스와 자원 봉사자들은이 장소를 따뜻하게 만듭니다.고양이는 침대를 따뜻하게 만들 수 있습니다!","월요일 : 3:00 - 10:00 pm
화요일 : 3:00 - 10:00 pm
수요일 : 3:00 - 10:00 pm
목요일 : 3:00 - 10:00 pm
금요일 : 3:00 - 10:00 pm
토요일 : 3:00 - 10:00 pm
일요일 : 3:00 - 10:00 pm","술집, 하숙, point_of_interest, 설립",Yes
Meander Osaka,"1-chōme-5-16 Motomachi, Naniwa Ward, Osaka, 556-0016, Japan",4.2,34.6645533,135.4970475,"이것은 깨끗한 호텔입니다.인기있는 Dotonbori까지 도보 거리.직원들은 매우 친절하고 아래층 로비는 편안합니다.객실은 작고 욕실은 매우 작습니다.AC는 계속 25로 재설정되어 아침에 매우 따뜻해졌습니다.그것은 돈에 대한 큰 가치이지만 당신이 많이 머물기를 원하는 방을 기대하지 않습니다.
호텔은 운송과 오사카에서 방문하고 싶은 곳과 가깝고 완벽하게 위치했습니다.
방은 우리에게 필요한 모든 것을 가지고 있었고, 직원들은 좋았으며 우리는 하루 종일 로비에서 무료 커피를 감사했습니다.돈을위한 큰 가치!
멋지고 깨끗한 방.편안한 침대.AC, TV, 미니 냉장고 등이 호텔은 훌륭하고 저렴합니다!나는 오사카에있을 때 확실히 여기에 머무를 것입니다.지하철과 JR 열차 라인까지 도보로 짧은 도보!
날짜를 다시 예약 할 때 찢어졌습니다.신선한 예약시 인터넷의 광고 요금보다 가격이 상승하는 방법.예산 가격에 좋은 옵션, 취소 가능한 옵션을 얻거나 계획이 변경되었다고 확신하십시오.
커튼에 피.글쎄, 그거 좋은 시작이야?방은 작습니다.솔직히, 이것을 준비하십시오.나는 일본의 많은 작은 방에 머물 렀지 만 이것은 케이크를 가져갑니다.쓰레기 캐러밴에 머무르는 것과 같습니다.방은 깨끗하지 않았고, 우리는 단지 2 박 후에 탈출하게되어 기뻤습니다.이 지역도 그리 좋지 않으며 큰 실망이었습니다.나는 누구 에게도이 호텔을 추천하지 않을 것입니다.모든 비용을 피해야하는 날짜가있는 호텔.",운영 시간이 없습니다,"하숙, point_of_interest, 설립",Yes
Agora Place Osaka Namba,"1-chōme-9-7 Sennichimae, Chuo Ward, Osaka, 542-0074, Japan",4.6,34.66730440000001,135.5038961,"당신이 내 메시지에 어떻게 응답하는지 재밌게 우리 방을 잘못 생각하지 않습니다!!!!예약이 정확하고 당신은 우리 방을 존중하지 않을 때 여행사를 비난합니다!!지금까지 환상적인 일본 휴가의 최악의 경험.여행 에이전트를 체크인 할 때 예약에 명확하게 표시된 2 배의 객실과 1 개의 트윈 침대 1 개를 예약했습니다.점검 I. 직원 엄청나게 무례한, 도어 키는 작동하지 않으며 방에 들어가면 두 방 모두 더블 침대가 있습니다!!우리가 명확하게 예약하고 쌍둥이를 지불했을 때.리셉션으로 돌아가는 메신저 나는 여행사 문제라고 들었고 그들은 완전히 예약되어 다른 일을 할 수 없었습니다!!나는 우리 여행 파티가 터무니없는 작은 이중 더블 침대를 공유 할 수 없다고 말했다.우리는 두 개의 방 1 개의 쌍둥이 침대를 예약 한 다음 나는 여행사가 문을 닫았을 때 일요일 밤에 항상 끔찍한 서비스를 항상 취소 할 수 있다고 들었습니다.여기에 예약하지 마십시오!!!객실은 작은 것보다 작습니다. 더블 침대는 왕과 같습니다. 지붕은 폐소 공포증이 너무 낮습니다!!!
일본에서 우리의 멋진 숙박으로 끔찍한 끝
호텔은 깨끗하고 방은 두 개의 큰 수하물로 여행하는 부부에게는 좋은 크기입니다.호텔은 칫솔, 치약, 헤어 넥타이, 로션, 메이크업 리무버, 면도기, 샤워 스폰지 등과 같은 잊을 수있는 모든 것을 제공합니다.매일 하우스 키핑은 오후 12시 이전에 문에 표시를 두는 게 손님의 요청에 의한 것입니다.위치는 놀랍습니다.지하철역은 호텔 바로 앞에 있습니다.Dotonburi Street는 호텔 뒤에서 짧은 도보 거리에 있습니다.일본 오사카에 머무는 경우이 호텔을 강력히 추천 할 것입니다.
위치는 굉장합니다.아케이드와 저렴한 길거리 음식에 가깝습니다.합리적인 가격의 숙박.아침 식사가 어떻게 작동하는지 약간 혼란스러워합니다.하지만 그들이 당신에게 그것을 제공한다면 좋습니다.더 많은 것을 요구할 수 없었습니다.샤워는 폭발이었다.넓은 것 같습니다.
우리는 4 박 동안 여기에 머물 렀습니다.위치는 모든 것의 중심에 있고 Dotonbori와 매우 가깝습니다.지하철과 택시 스탠드는 바로 바깥에 있습니다.방은 좋으며 욕실은 샤워기와 분리되어 있으며 샤워에는 강한 수압과 뜨거운 물이 있으며 AC가 훌륭한 AC가 있습니다.위치를 고려할 때, 객실 공간은 우리에게 좋았으며, 2 명의 성인 및 1 명의 유아가있었습니다.또한 헤어 넥타이, 면도기, 세탁소 등과 같은 손님에게는 무료 품목이 있으며, 모두 작은 팬과 다리미가있는 로비에 위치하고 있습니다.로비에서 계량 규모와 Money Exchange 기계를 사용할 수도 있습니다.우리를위한 유일한 단점은 아침 식사였습니다.매우 실망 스러웠습니다.4 개의 다른 빵과 사과 주스 만 얻는다는 것은 광고되지 않았으므로 예약하는 동안 우리가 가져야 할 것보다 더 많은 비용을 지불했습니다.로손은 바로 옆에 있으므로 빠른 식사를 원한다면 아침 식사를하는 것이 훨씬 저렴합니다.따라서 아침 식사를 미리 예약하지 않고 체크인 할 때까지 기다리는 것이 좋습니다.대체로, 우리의 체류는 좋았습니다.
아마도 그들이 당신에게주는 방에 따라 다르지만 6 층에 있지만 지하실에 사는 것처럼 느껴집니다.매우 어두운 방, 창문이 흐려졌지만 어쨌든 중요하지 않습니다. 10cm 만 열린 다음 1m 떨어진 콘크리트 벽을 봅니다.
방은 일본의 경우 넓지 만 실용적이지는 않습니다.예를 들어 입구 근처에 라이트 스위치가 없습니다.","월요일 : 24 시간을 엽니 다
화요일 : 24 시간 영업
수요일 : 24 시간을 엽니 다
목요일 : 24 시간 영업
금요일 : 24 시간 영업
토요일 : 24 시간을 열었습니다
일요일 : 24 시간 영업","하숙, point_of_interest, 설립",Yes
Hotel Keihan Yodoyabashi,"2-chōme-4-6 Kitahama, Chuo Ward, Osaka, 541-0041, Japan",4.1,34.6911923,135.5048505,"도시의 멋진 장소에있는 멋진 깨끗한 호텔은 모든 주요 도로에서 제거되어 멋지고 조용합니다.오사카 지하철에 쉽게 접근 할 수 있으므로 오사카의 놀라운 부분에서 20 분을 넘지 않습니다.호텔 자체는 깨끗하고 넓은 로비로 좋아 보입니다.직원들도 매우 도움이됩니다.세탁기 기계가 끔찍하기 때문에 나머지는 훌륭하기 때문에 서비스를 위해 별 4 개만 제공했습니다.
오사카에 중앙에 위치하고 있으며 여러 지하철역 및 관광지에 가깝습니다.호텔은 매우 깨끗하고 편안합니다.훌륭한 서비스.아침 식사 뷔페도 정말 좋습니다.향후 오사카 방문에 다시 머물 것입니다.
3 박 동안 여기에 머물 렀습니다.체크인하는 동안 프론트 데스크에 몇 가지 잘못된 계산이있었습니다.다시 계산하는 데 약 30 분이 걸렸습니다.우리는 3시에 손님을 확인하기 시작하고 330 ISH에서 우리 방에 들어갔다.체크인 할 때, 우리는 우리 자신의 무료 음료, 1 명당 1 명을 선택해야했습니다.나는 물 BC 만 얻었습니다. 나는 여름 더위에서 탈수되고 싶지 않았습니다.냉장고 옆에는 편의 시설 바가 있습니다.아침 식사는 맛있었습니다.나는 3x를 채울하게되었다!!아침 식사는 진정으로 내 기대를 초과했습니다!!방은 괜찮 았고 일본의 평균 크기였습니다
모든 기본 요구를 제공하는 예산 친화적 인 호텔을 찾고 있다면, 이것은 당신에게 완벽한 옵션 중 하나입니다.더 비싼 옵션이 있다면 망설이지 마십시오.세부 사항은 아래 또는 그 이상입니다.이 주요 내용에 더 많이 썼습니다.
손님, 로비의 도서관, 놀라운 아침 식사 및 직원들이 매우 친절하게 이용할 수있는 많은 편의 시설!아, 그리고 내 머리카락은 샴푸와 컨디셔너를 좋아했습니다.좋은 위치, Dotonbori 지역의 Twothree 지하철 방송국.확실히 복귀 할 것입니다, 놀랍습니다!","월요일 : 24 시간을 엽니 다
화요일 : 24 시간 영업
수요일 : 24 시간을 엽니 다
목요일 : 24 시간 영업
금요일 : 24 시간 영업
토요일 : 24 시간을 열었습니다
일요일 : 24 시간 영업","하숙, point_of_interest, 설립",Yes
Imano Osaka Shinsaibashi Hostel,"1-chōme-13-28 Kitahorie, Nishi Ward, Osaka, 550-0014, Japan",4.3,34.672901,135.4950431,"이 곳 중 하나는 그 높은 등급이 어떻게 일어 났는지 궁금합니다.긍정적 인 첫 번째, 위치는 좋고 직원은 매우 친절합니다.그러나 이미 기숙사의 침대는 끔찍합니다.매트리스는 매우 얇으며 기본적으로 야외 야외 캠핑과 같습니다.베개는 적어도 괜찮고 약간의 지원을 제공합니다.기숙사 이층 침대에는 간신히 선반이나 공간이 없습니다... 그리고 키가 185cm 이상이라면 편안하게 맞지 않을 수도 있습니다.화장실과 욕실 공간에서 전반적인 청결은 좋지 않습니다.또한 22 명의 사람들에게는 2 개의 화장실과 샤워가 매우 낙관적입니다.면봉조차도 제로 편의 시설이 있습니다.전반적으로 잘 계획되고 행해지지 않았으므로 다른 곳에서 돈에 대한 더 나은 가치가 있습니다.
이 호스텔은 일본 여행 중에 내가 머물렀던 최고의 호스텔 중 하나를 절대적으로 사랑했습니다.
조절 가능한 에어컨이있는 거의 조용한 객실.
여기에 머무르는 사람은 모두 친절하고 직원은 굉장합니다. 나의 유일한 단점은 무료 편의 시설이없고 당신은 그가 스스로 침대로 만들어야한다는 것입니다. 그러나 가격 때문에 나는 그것이 완전히 공정하다고 생각합니다.
많은 사랑!!
위치는 정말 대단하지만 제공되는 서비스는 일반적으로 호스텔에 가지 않기 때문에 이상합니다. 나는 비평가를 만들지 않고 오히려 관찰입니다.
당신은 자신의 침대를 만들어야합니다.
수건과 QTIP와 같은 물건은 제공되지 않습니다.
기숙사의 침대는 충분히 길지 않으며, 나는 180cm이며 발이 국경에 닿습니다.
사용 가능한 계단이 없습니까??
카페 공간에 머무르기 위해 음료를 사야한다고 슬프지만 왜 그렇지 않습니까?그래서 나는 이것에 대해 어떻게 생각 해야할지 모르겠지만 다시, 나는 그 장소를 좋아했습니다.
센터와 도톤 버리 근처의 좋은 위치에있는 훌륭한 호스텔.모든 객실은 깨끗하고 현대적이며 유용한 직원도 현대적입니다.아침에 아침 식사 비용을 지불하고 원한다면 가방을 약간 여분의 시간을 남겨 둘 수 있습니다.
그러나 공간을 잘 활용 해야하는 충분한 호스텔이지만, 이것은 모든 것이 모든 것을 만들어 낸 첫 번째 호스텔이었습니다. 매트리스 시트는 당신이 둘 다 이상하다고 생각했던 스스로해야 할 일을해야합니까?하우스 키퍼와 함께 돈을 절약하기 위해 나는 하나였습니다!!그리고 내가 있던 더 높은 이층에 대한 매우 불편한 점화는 수하물이 많을 때 좁고 까다로워서 다른 방의 소음을들을 수있었습니다.세탁 시설은 괜찮 았지만 마침내 400 엔을 마르려면 건조기에서 4 라운드를 가져갔습니다.또한 하나의 리프트와 계단이없고 비상 계단 만 있지 않아 피크 타임에 바쁠 수 있습니다.방의 공기 통풍구는 시끄럽고 욕실의 공기 콘은 전속 속도로 차가운 공기를 불고 있었으므로 4 월 초에 약간의 산들 바람이있었습니다.침대는 그렇지 않으면 편안했습니다.샤워는 좋았습니다.당신은 아래층 아래층에 공동 지역에 앉기 위해 음료를 사야했습니다.이틀 밤에 좋은 숙박 이었지만 도시에 다시 여행하는 경우 개인적으로 여기서 선택하지 않았습니다.",운영 시간이 없습니다,"하숙, point_of_interest, 설립",Yes
WELLSTAY難波,"2-chōme-8-10 Motomachi, Naniwa Ward, Osaka, 556-0016, Japan",4.4,34.6611837,135.4975514,"남바 지구의 좋은 위치.이자카야 레스토랑이 여러 개 있습니다.매일 U는 리셉션에서 새 수건을 요청할 수 있습니다. U는 벨 코즈를 누르지 않아야합니다.사용할 무료 세탁기가 있습니다.2 개의 자동 판매기가 있습니다.그리고 아이스 큐브.직원들은 도움이되고 친절합니다.추천.나는 이층 침대 2 개와 싱글 침대 1 개가있는 방을 예약했다.나에게 아주 친절합니다.그리고 btw 그들은 방을 청소합니다.
며칠 동안 여기에 머물 렀습니다.매우 깨끗하고 조용합니다.우리가 얻은 방은 가족이나 4 명의 그룹에게 좋았습니다.Dotonbori 지역까지 1015 도보로 위치합니다.레스토랑 거리 근처에 있습니다.
Namba는 놀라운 호텔이었습니다.방은 상당히 작았지만 훌륭한 경험을 허용했습니다.Well Stay Namba는 또한 여러 상점과 유명한 Dotonbori와 매우 가깝습니다.내가 기회를 얻으면, 나는 확실히 여기로 돌아올 것이다.
그것은 저렴하고 합리적으로 Dotonbori에서 600m 이내에 위치했으며, 첫 번째 사람이 담배 냄새를 맡을 때 우리 방을 바꾸는 것에 대해 꽤 좋았습니다.그러나 일찍 도착한 서비스는 꽤 열악했습니다.더 큰 여행 가방에 맞지 않는 500yen 사물함을 제외하고 수하물 보관소는 없었으며, 손님을위한 '보완적인'음료 스테이션은 순서 부족했으며, 리셉션 레이디는 나쁜 날을 보내고있었습니다.일본의 참을성없는 스타일의 사람, 다른 사람들과 대조됩니다.
Osaka Wellstay Hotel은 주요 위치, 현대 편의 시설 및 세심한 서비스를 제공합니다.방은 편안하고 깨끗했으며 사려 깊은 손길이있었습니다.아침 식사 뷔페는 맛있고 다양했습니다.전반적으로, 오사카에서 편리하고 쾌적한 숙박을 찾는 여행자에게 좋은 선택입니다.적극 권장됩니다.",운영 시간이 없습니다,"하숙, point_of_interest, 설립",Yes
