이름,주소,평점,위도,경도,리뷰,영업시간,카테고리,핫플레이스여부
Tanimachi Luxe Hotel,"8-8 Ikutamachō, Tennoji Ward, Osaka, 543-0071, Japan",3.9,34.665996,135.5135706,"Love Hotel District에 위치하고 있습니다.이것은 주위에 매달려있는 후커가 있다는 것을 의미하지는 않습니다.일본에서는 모든 것이 훨씬 미묘하고 예약되어 있으며 체재에 전혀 영향을 미치지 않습니다.그러나 외부의 거리가 밤낮으로 엔진이있는 엔진이있는 소녀의 운전자의 자동차로 흩어 질 준비를하십시오.다시 한 번 일본이므로 모든 위협이 아닙니다.보는 것은 호기심 일뿐입니다!호텔은 괜찮습니다.언젠가 그들은 아침을 먹었습니다.우리는 패턴을 알아낼 수 없었고 불행히도 직원의 영어는 일본어 한 마디 말을 할 수 있기 때문에 내 잘못을 제한했습니다!그래서 우리는 물어볼 수 없었습니다.그러나 그들은 매우 정중했다.다른 사람들이 객실은 작다고 말했듯이 서양 표준에 따라 책상이나 의자 등이 없습니다. 말 그대로 침대와 작은 공간이 있습니다.
Dotonbori에 가까운 훌륭한 위치.사랑스러운 직원, 예의 바르고 전문적이고 친절한 방은 뽀뽀했고 필요한 모든 편의 시설이 있습니다!, 사랑스러운 큰 욕조, 멋진 욕조, 편안한 거대한 침대가있었습니다..Japanosaka로 돌아올 때 확실히 다시 머물 것입니다.우리를 돕기 위해 여분의 마일을 갔고 우리의 요구가 충족되었는지 확인하고 우리가 일본에서 좋은 호텔로 스트레스가없는 시간을 보냈습니다.
그것은 Love Hotel 지역에 있지만, 일본인 때문에 개별적 인 성격으로 인해 눈에 띄지 않습니다.방은 깨끗하지만 약간 작습니다.한 사람에게는 좋지만 한 방에있는 2 사람은 딱 맞습니다.도움이되는 직원과 좋은 청소.욕실은 멋지고 넓습니다.
그것은 오사카 일본의 러브 호텔 지구에 위치한 호텔이 당신이 지불하는 돈의 가치가 있지만 객실은 비정상적으로 큰 욕실과 샤워 실이 약간 작습니다.나는 일본의 모든 객실이 아주 작아서 정말 큰 욕실과 샤워 실이 있다면 실제로 아주 좋습니다.직원은 정말 훌륭하고 시설은 발끝으로 진행됩니다.나는 이것을 머무를 곳으로 강력히 추천합니다.
매우 중앙에 위치하고 깨끗하며 소형 호텔.나는 일본 표준에서 객실이 너무 작지 않다고 생각합니다.Im 키가 큰 Big Westerner와 나와 내 아내가 4 개의 큰 수하물을 가진 아내는 OK에 맞습니다.
프론트 데스크 사람들은 매우 도움이되고 항상 웃고 있습니다.그들은 좋은 영어를 구사하므로 의사 소통 문제가 없습니다.객실 요금은 항상 저렴합니다.적극 권장됩니다.","월요일 : 24 시간을 엽니 다
화요일 : 24 시간 영업
수요일 : 24 시간을 엽니 다
목요일 : 24 시간 영업
금요일 : 24 시간 영업
토요일 : 24 시간을 열었습니다
일요일 : 24 시간 영업","하숙, point_of_interest, 설립",Yes
Dormy Inn Osaka Tanimachi,"2-chōme-1-9 Uchihonmachi, Chuo Ward, Osaka, 540-0026, Japan",4.3,34.6836052,135.5136917,"이것은 좋은 가격을위한 훌륭한 장소였습니다.그리고 당신이 사용할 수있는 온천도 있습니다.또한 음식은 훌륭합니다.
대부분의 경우 일본에서와 같이 문신은 큰 아니요입니다.개인 욕조가있는 료 칸에서 하나를 얻는다면 더 좋습니다.
속성은 멋지고 깨끗했습니다.낮에는 무료 요구르트 음료와 저녁에는 무료 소바 국수와 아이스크림과 같은 많은 편의 시설이있었습니다.저녁에 이것을 기다리는 사람들의 수에서 매우 인기있는 추가 측정.이 호텔의 무료 온센은 멋진 터치 였지만 매우 혼잡 할 수 있습니다.방은 깨끗하고 편안했습니다.가장 가까운 지하철로 상당히 걸을 수 있습니다.이 지역 주변의 멋진 식사 옵션.그들은 체크인하기 전에 수하물을 붙잡고 몇 시간 동안 체크 아웃합니다.오사카에있을 때 다시 머물 것입니다.좋은 경험.
매우 도움이되는 직원.헌신 한 이부키 토리 고 산에게 특별한 감사를드립니다.시설은 기대치, 본질적으로 스파, 무료 스낵 및 세척 건조기를 초과하고 있습니다.로비 지역의 무료 커피는 마실 수 없으며 FB 외부에서 즐길 수있는 일반적인 공간은 부가가치입니다.전반적으로 말하면, 근처 APA 호텔보다 훨씬 더 나은 곳입니다.확실히 다시 그들과 함께있을 것입니다.
4 월 말 3 박 동안 머물 렀습니다.하우스 키핑은 결코 우리 방을 서비스하지 않았습니다.그들은 새로운 수건 만 제공했지만 쓰레기통을 정리하기 위해 우리 방에 들어 가지 않았습니다.퍼블릭 욕조는 최상층 13에 위치하고 있으며 평균적으로 괜찮 았습니다.방과 침대의 청결은 괜찮 았지만 더 나을 수 있습니다.
큰 체류가 있었고 위치는 주요했습니다.그러나 가장 중요한 부분은 아침 식사 뷔페였습니다. 너무 좋았습니다.매일 아침 눈물을 흘렸다.또한 밤에 자유라면은 마약이었습니다",운영 시간이 없습니다,"하숙, point_of_interest, 설립",Yes
The Stay Osaka Shinsaibashi,"Japan, 〒542-0082 Osaka, Chuo Ward, Shimanouchi, 1-chōme−14−２９ THE STAY OSAKA 心斎橋",4.4,34.6733082,135.5077602,"나는 일본으로 여행하는 동안 호스텔에 머무르는 것을 두려워했지만 저렴한 비용 때문에 계속해서 스스로를 강요하기로 결정했습니다.우와!나는 더 감동 할 수 없었다.나는 내 여행 전체에 머물 수 있었다.직원은 친절하고 모든 것이 매우 깨끗하며 엄청나게 사적인 개인 저는 욕실에있는 사람을 거의 보지 못했습니다.공용 영역은 아름답고 실제로 긴장을 풀고 싶어합니다.많은 다른 여행자가 있으며, 모두 탁월한 경험입니다.또한 위치는 훌륭합니다.
나는 여기서 큰 숙박을했다.장소는 좋았고, 큰 주방으로 식사를 쉽게 요리 할 수있었습니다.직원들은 친절했고 항상 기꺼이 도와주었습니다.위치는 또한 Tomdori River Walk와 주요 시장까지 도보로 짧은 도보로 완벽했습니다.또한 지하철역은 불과 몇 분 거리에 도시를 돌아 다니는 것이 매우 편리했습니다.오사카를 방문하는 경우이 호스텔을 추천합니다!
이것은 호스텔에 머무르는 첫 번째 시간이었고 가장 좋은 경험이었습니다.직원들은 매우 친절하며 호스텔 자체는 다른 많은 고객들이 가족과 일본 현지인이기 때문에 매우 차가운 분위기를 가지고 있습니다.그것은 전혀 시끄럽지 않고, 나는 여성 기숙사에 머물렀고 항상 거기에서 매우 조용하고 존중했습니다.침대 자체는 편의 시설뿐만 아니라 매우 멋지고 깨끗하며 편안했습니다.Shinsaibashi와 Dotonbori의 도보 거리에있는 위치는 놀랍습니다.오사카에서 다음에 100이 다시 머무를 것입니다!
경험이 풍부한 여행자이며 신사이바시에서의 숙박은 뛰어난 여행자 호텔입니다.엄청나게 깨끗하고 효율적이며 편안하며 웰링.호텔은 비오는 날을 위해 빌릴 수있는 무료 우산, 우수한 샤워 제품과 같은 멋진 터치를 제공합니다.보안도 강력합니다.위치는 훌륭하고 가격은 조용하고 정중 한 손님 사이에서 경쟁이 치열하며 분위기입니다.
그들은 당신이 사용할 수있는 멋진 부엌을 가지고있었습니다.직원들은 정말 친절했고 우리는 이벤트에서 Takoyaki를 무료로 할 수있었습니다.기숙사에서 그것은 매우 조용했고 모든 손님은 존경했습니다.",운영 시간이 없습니다,"하숙, point_of_interest, 설립",Yes
Toyoko Inn Osaka Namba Nippombashi,"4-chōme-11-4 Nipponbashi, Naniwa Ward, Osaka, 556-0005, Japan",3.9,34.66004660000001,135.5055736,"영국에서 방문.Den Den Town 중심부에 위치한 환상적인 호텔.Namba 및 근처의 다른 관광지까지 도보로 짧은 도보.방은 조용했지만 가장 큰 것은 아니지만 일본에서는 깨끗하게 기대합니다.포함 된 아침 식사는 좋았습니다.우리의 기대를 완전히 능가했습니다.전반적 으로이 호텔은 환상적인 가치입니다.
오사카의 모든 것을 방문 할 수있는 꽤 좋고 아늑하고 훌륭한 위치 호텔.그것은 당신에게 지역에 머무르고 매일 아침 평범한 사람들의 삶을 볼 수있는 기회를 줄 것입니다.객실은 작지만 두 사람과 4 개의 배낭이 바로 맞아야합니다. 직원은 도움이되고 아침 식사는 충분합니다. 예, 이것은 일본 여행을 시작하기에 완벽한 호텔이었습니다.
가장 가까운 두 개의 열차 라인 사이에 어색하게 위치하지만 전혀 나쁜 산책은 아닙니다.그러나 나는 3 일 동안 여기에 머무는 동안 아무런 문제가 없었습니다.나는 하루 일찍 확인해야했고 프론트 데스크는 매우 수용 적이었고 그것을 번거 로움 과정으로 만들었습니다.
매우 친절한 직원.좋은 위치.합리적인 크기의 객실.
우리는 항상 Toyokoyinn에 머물지 만 이번에는 가장 무례한 리셉션입니다.",운영 시간이 없습니다,"하숙, point_of_interest, 설립",Yes
Dormy Inn Premium Namba Annex,"2-chōme-1-6 Higashishinsaibashi, Chuo Ward, Osaka, 542-0083, Japan",4.4,34.6712535,135.5060404,"나는 보통 더 많은 고급 숙박 시설을 선호하지만 여기서 우리의 Twonight Stay를 즐겼습니다.단순성에도 불구하고 호텔은 편안한 경험을 제공하며 하이라이트는 확실히 무료 스파였습니다.그것을 놓치지 마세요.
작은면에서는 훌륭한 서비스, 멋진 깨끗한 객실이지만 일본에 예상됩니다.이 지역에는 작은 식당이 가득 차 있으며, 도톤 보리와 매우 가까운 소수의 지하철역까지 도보 거리에 있습니다.
보자
1. 프론트 데스크에서 주문 택시 서비스 없음 밖으로 나가서 캐시 할 수 있다고 말했습니다.
2. 수하물 배달 서비스 없음
3. 침대는 재앙이 매우 힘들고 우리가 추가 요청을했을 때 편안하지 않습니다.
그들이 우리에게 매우 얇은 사람을 주었다
4. 베개는 3D 프린트 또는 그와 비슷한 것도 매우 거칠고 얇습니다.
5. 우리는 McDonalds를 주문하여 배달원이 내가 내려 가야 할 방으로 올라 오지 못하게했습니다.
6. 방은 먼지가 많기 때문에 우리는 더 이상 확인하고 더 이상 나를 위해 다른 곳을 찾을 것입니다. 그래서 나는 매우 실망했습니다.
그것은 일본에서 멋진 큰 침대가있는 더 큰 방 중 하나였습니다.유일한 것은 방이 방에 목욕을하지 않았다는 것이었다.그러나 13 층의 온천은 그것을 보충하는 것보다 더 많이 올라갑니다.직원들은 매우 친절했습니다.우리는 확실히 다시 여기에 머물 것입니다.위치는 여러 형태의 대중 교통에 가깝습니다.모든 용품을 위해 호텔 바로 옆에있는 Convilience Store.또한 주요 음식 및 근처의 사진 기회에 가깝습니다.무료 세탁기를 떠날 때 Icypoles와 음료와 함께 온천을 무료로 사용합니다.다음에 멋진 호텔을 뵙겠습니다.작은 방, 깨끗합니다.호텔에는 좋은 편의 시설과 서비스가 있습니다.취침 전에 도시 호텔과 무료 국수를위한 좋은 온천.아주 작은 방을 제외하고는 머무를 수있는 훌륭한 장소입니다.",운영 시간이 없습니다,"하숙, point_of_interest, 설립",Yes
White Hostel Shinsaibashi,"1-chōme-6-20 Higashishinsaibashi, Chuo Ward, Osaka, 542-0083, Japan",4.3,34.6722983,135.5046071,"나는 여행이나 일하기에 관련이없는 이유로 White Hostel에 와서 나와 같은 누군가가 잠시 동안 머물기로 결정한 것으로 밝혀졌습니다.처음에 나는 호스텔의 단순성에 대한 호스텔의 디자인에 깊은 인상을 받았지만 편리하고 깨끗하고 효율적으로 느껴졌습니다.특정 시간에 입장을위한 암호와 같은 몇 가지 불편한 것이 있지만 엘리베이터.그러나 개인적으로 나는 모든 손님이 함께 할 수 있도록 매우 중심적인 위치와 독립적 인 환경을 가진 잠시 동안 머무를 필요가있는 모든 사람들에게 정말 좋은 선택이라고 생각합니다.
마지막으로, White Hostel은 직원들이 다른 언어를 구사할 수 있기 때문에 더 많은 호흡 공간을 제공합니다. ""규칙""전통의 작업 스타일이 아니기 때문에 Hostellover는 내가 생각하는 이런 장소를 좋아할 것입니다.
정말 좋은 위치, 편의점, 레스토랑 및 지하철에 가깝습니다.나에게 인상은 사람들을 만나기에 좋은 곳이 아니라는 것이었다.모두가 자신의 일을하고 있습니다.객실은 괜찮 았고 욕실과 샤워가 놀랍습니다
위치는 완벽했고 직원들은 정말 친절하고 도움이되었습니다.내가 가진 유일한 문제는 내가 침대에서 뜨거웠고 룸메이트 2 명은 한밤중에 싸움을 가졌다는 것이었다.
완벽한!모든 것이 매우 깨끗하고 편안했습니다.비록 우리는 호스텔에서 저에게 처음이었던 우리 자신의 침대를 만들어야했습니다.좋은 위치
이 호스텔과 관련된 모든 것은 매우 시원했습니다.이 호스텔은 내 오사카 여행을 완전히 마술처럼 만들었습니다.그들의 프론트 데스크 남자는 매우 훌륭하고 친절합니다.식당에 앉아 먹거나 일할 수 있습니다.또한 무료 커피 등이 있습니다. 인터넷 연결은 매우 빠릅니다.위치는 Dotonbri와 America Nura에서 5 분입니다.내 다음 여행 여행을 위해 예약 할 것입니다!!","월요일 : 24 시간을 엽니 다
화요일 : 24 시간 영업
수요일 : 24 시간을 엽니 다
목요일 : 24 시간 영업
금요일 : 24 시간 영업
토요일 : 24 시간을 열었습니다
일요일 : 24 시간 영업","하숙, point_of_interest, 설립",Yes
Hotel Wan Osaka ebisu,"1-chōme-4-4 Ebisunishi, Naniwa Ward, Osaka, 556-0003, Japan",4.8,34.6549878,135.5038306,"내 남자 친구와 5 박을 머물 렀습니다.호텔은 지하철까지 도보 거리 2 분 거리에 있습니다.
7elven은 길 건너편에 있습니다.그리고 많은 팝업 상점과 카페 및 지역 사람들이 주도하는 기타 식사 기회.
우리가 만난 모든 사람은 매우 친절하고 도움이되므로 오사카를 경험하고 싶다면 좋은 영역입니다!
직원들은 매우 친절하고 우리가 나가서 우리가 길을 바라 보면 돌아올 때 우리를 맞이합니다.
방에는 작은 냉장고, 음료와 음식을위한 충분한 공간이 있습니다.그리고 에어컨, 신의 감사합니다.그것은 완벽하게 작동합니다.욕실은 작다는 것은 유일한 마이너스입니다.절대적으로 머무를 가치가있는 호텔.
멋진 서비스가있는 멋진 장소!Lin 씨는 체크인 중에 매우 도움이되었습니다.방은 깨끗했고 이상한 냄새가 없었습니다.또한, 근처에는 늦게 열린 슈퍼마켓이 있습니다. 환상적입니다.나는 확실히 돌아올 것이다!
나는 12 일 동안 호텔에 머물렀다.가장 편안한 숙박이었습니다.직원들은 Miura에 대해 훌륭하고 특별한 언급이며, 내가 확인한 시점부터 친절했고 필요한 거의 모든 것을 도와 줄 것입니다.나는 잠옷을 좋아하고 내 자신의 잠옷을 가져 왔지만 그들의 환상적이기 때문에 사용하지 않았습니다.호텔은 편의점, 작은 마트 및 2 개의 기차역에 가깝습니다.오사카스 열차 시스템을 탐색하는 방법을 배우면 관광지에서 몇 분 거리에 있습니다.내가 Novdec으로 돌아올 때 나는 그들과 함께 다시 머물 것입니다.필리핀 인에게 Miura는 필리핀 과이 호텔에 머무르는 선물 중 하나를 말합니다.
여기에 머무르는 것은 매우 운이 좋다.방은 작지만 깨끗하고 잘 관리되어 있습니다.위치는 매우 전략적입니다.또한 Shih Hotel 직원은 정말 도움이됩니다.감사합니다
훌륭한 위치, 매우 깨끗한 호텔 및 객실, 귀여운 공유 지역, 모든 것이 새롭고 친절하며 도움이되는 직원, 특히 Miura입니다!또한 수하물의 일부 자전거를 사용할 수있는 규모가 있습니다.
감사합니다, 우리는 다음에 오사카에 올 때 확실히 돌아올 것입니다!",운영 시간이 없습니다,"하숙, point_of_interest, 설립",Yes
Hotel Sanrriott Osaka Honmachi,"1-chōme-9-13 Bakurōmachi, Chuo Ward, Osaka, 541-0059, Japan",4.3,34.6785385,135.5066507,"바쁜 교차점 옆에 있었지만 소음은 잘 포함되어있었습니다.
일본의 전형적인 것은 방은 작지만 편안한 것 같습니다.
아침 식사시 채식 옵션은 매우 제한적이었습니다.
가까이 있지만 고맙게도 도시의도 톰 보리 지역에 너무 가깝지는 않습니다.
좋은 위치.객실은 촬영 된대로 빡빡하지만 기능적입니다.방은 매일 청소되지 않습니다. 5 박 숙박을 위해 1 번의 청소에 가입 할 자격이있었습니다.많은 사람들이 언급하지는 않았지만 침대는 매우 힘들었습니다.나는 집에서 매우 단단한 침대를 가지고 있지만 이것은 다음 단계였습니다.부드러운 침대가 필요한 경우 경고하십시오.내가 밤에 10k 엔 이상을 너무 많이 지불하지 않았다면 나는 별들과 더 관대 할 것이지만 가격은 예산보다 조금 더 예산을 느꼈습니다.나는 머무는 동안 아무런 문제가 없다. 내가 좋은 거래를했다면 아마 다시 머물 것입니다.
오사카에서 잠을 잘 수있는 큰 가치.객실은 작지만 깨끗하고 잠을 잘 수 있습니다. 위치는 오사카 주변을 쉽게 이동할 수있는 다른 라인의 두 기차역 사이에서 매우 좋습니다.2 층 WIRH 보완 스낵의 멋진 작은 라운지!
기본적으로 최악의 고객 서비스.직원은 당신이 즐거운 숙박을하고 관리자가 백 오피스에 숨어 있고 직면하지 않도록하는 것에 대해 전혀 신경 쓰지 않습니다.
우리는 완전히 기울어 진 침대가있는 방에 체크인했으며, 스프링스는 침대의 절반에 지원되지 않았습니다.리셉션에 말했고 그들은 모든 매트리스가 동일하다고 말했습니다.나는 그들을 만나러 오게했고 소년은 그것이 부러 졌다는 데 동의했고, 그때만 그의 감독자와 대화를 나 had습니다.그런 다음 그들은 우리를 전혀 사과하지 않은 다른 방으로 옮기기로 동의했습니다..그들이 우리를 옮긴 방은 눈에 띄게 작았으며, 온라인으로 이용 가능 여부에도 불구하고 다른 모든 방에서 예약했다고 말한 이유를 물었고 작은 방이나 부러진 침대를 선택했습니다.저는 호주에서 호텔 관리자로 일하고 있으며 직원이 이와 같은 고객과 대화를 나누면 사망 할 것입니다.
우리는 또 다른 매우 불편한 매트리스와 끔찍한 베개와 함께 방의 슈 박스로 이동했습니다.
자신의 쓰레기를 꺼내고 자신의 수건을 바꾸고 7 박 중에 침대 시트를 한 번만 바꾸도록 제공되는 호텔에 대한 비용을 지불 해야하는 말도 안됩니다.
서비스는 훌륭했고, 방은 매우 편안하고 깨끗했으며, 위치는 기차역 앞에 있기 때문에 완벽합니다.플러스는 Netflix를 가지고 있으며 3 일 이상 머무르는 경우를 포함하여 하나의 서비스 청소가 있습니다!!",운영 시간이 없습니다,"하숙, point_of_interest, 설립",Yes
BON Hostel,"3-chōme-1-3 Shikitsuhigashi, Naniwa Ward, Osaka, 556-0012, Japan",4,34.6562048,135.5018354,"슈퍼 가치가있는 곳은 훌륭하고 아늑합니다.직원들은 친절하고 영어를 구사합니다.지하철 열차 트랙 이이 체류 바로 위에 있기 때문에 낮에는 낮에 낮잠을자는 요일에 그 자리에 머물지 않는다고 말하고 싶습니다.객실과 욕실은 잘 관리되어 있습니다.적어도 식수를 제공 할 수 있습니다.이 장소에 도착하기 전에 편의점에서 물병을 받으세요
화장실과 욕실은 매우 깨끗합니다.침대는 편안합니다.나는 그들이 내가 더 낮은 침대를 가질 수있게 해주셔서 정말 감사합니다.나는 그것이 철도 바로 아래에 있다는 것을 알았을 때 충격을 받았기 때문에 기차가 지나갈 때마다 소리와 진동을 느낄 수 있습니다.그러나 나는 상관없이 아주 좋은 수면을 취합니다.남성 접수 원도 훌륭하고 도움이됩니다.그러나 나는 이메일에 오후 2시에 왔기 때문에 여성 접수 원 중 하나에 감사하지 않습니다.나는 종을 여러 번 밀고 아무도 오지 않았습니다.몇 분 후, 화난 톤을 가진 여성이 체크인이 오후 4시이고 일찍 체크인을하고 싶다면 1,000 엔을 지불해야한다고 말했다.오류가되어야한다고 말했습니다.나는 그녀의 말하기에 너무 무례하다고 느꼈다.나는 그녀가 더 많은 훈련을 받아야한다고 생각합니다!최근 일본 의이 호스텔에서의 나의 체류는 전반적으로 유쾌한 경험이었습니다.직원들은 내 시간 내내 환영하고 효율적인 서비스를 제공했습니다.내가 머물렀던 기숙사 방은 깨끗하고 아늑했으며, 좋은 밤의 휴식을위한 편안한 분위기를 제공합니다.나는 특히 대중 교통 옵션 근처와 다양한 명소의 도보 거리 내에 편리하게 위치한 호스텔의 위치를 ​​즐겼습니다.이로 인해 도시를 탐험하고 번거 로움없이 지역 문화에 몰입하기가 쉽습니다.시설이 잘 정비되었지만, 특히 성수기에는 공동 지역이 때때로 약간 혼잡해질 수 있다는 것을 알았습니다.그러나 이것은 호스텔의 전반적인 즐거움을 크게 떨어 뜨리지 않았습니다.전반적으로, 나는이 호스텔을 편리한 위치에서 예산이 우호적 인 숙박 시설을 찾는 동료 여행자들에게 추천합니다.럭셔리 호텔의 모든 종과 휘파람이 없을 수도 있지만 일본에서 편안하고 즐거운 숙박을 위해 필요한 모든 것을 제공합니다.
당신은 당신이 지불 한 것을 얻습니다.나는이 호스텔을 추천하고 다시 여기에 머물 것이지만 메모와 함께있을 것입니다.호스텔은 모두가 언급했듯이 기차 트랙 바로 아래에 있습니다.로비 라운지 경험은 바위가 많은 진동으로 매우 큰 소리로 크게 들릴 수 있습니다.그러나 방은 나에게 괜찮 았고 크고 바위가 아니었다.다시 말하지만, 모든 사람들의 표준은 다르고 나는 흰색 소리를 좋아하기 때문에 괜찮 았습니다.지적해야 할 또 다른 것.당신은 자신의 침대를 만듭니다.그들은 당신에게 시트 만 제공하고 당신은 그것을 직접 설정해야합니다.이 위치는 실제로 중앙에 있으며 Namba에서 떨어진 한 스테이션은 Dotonbori Glico Sign, Kuromon Market 및 쇼핑몰과 가장 가까운 스테이션입니다.몇 개의 스테이션에 가깝습니다.또한 비교적 Konbinis와 Restaurants Yoshinoya가 있습니다.나는 가격에 대해, 내가 얻는 위치는 그것을 가치가 있다고 생각합니다.직원들은 친절했습니다.장소는 깨끗했습니다.라운지는 아늑했고 일본어로 보드 게임을 받았습니다.결제 후 가방을 넣을 수 있습니다.
소음을 제외한 완벽한 호스텔.지하철 트랙과 기차 바로 밑에 위치한 51230 년부터 열차가 있습니다. 믿을 수 없을 정도로 시끄 럽습니다.불행히도 그 때문에이 장소를 추천하지 않을 것입니다.친절하게 제공된 이어 플러그는 전체 장소가 진동하고 흔들므로 도움이되지 않았습니다.",운영 시간이 없습니다,"하숙, point_of_interest, 설립",Yes
