이름,주소,평점,위도,경도,리뷰,영업시간,카테고리,핫플레이스여부
Backstage Osaka Hostel & Bar,"1-chōme-2-20 Kōzu, Chuo Ward, Osaka, 542-0072, Japan",4.5,34.6669785,135.5132987,"나는이 호스텔에서 일주일을 보냈고 그것은 놀라운 경험이었습니다!기숙사는 매우 깨끗하고 완전히 점유 된 경우에도 많은 프라이버시를 제공합니다.매트리스는 매우 편안했고 에어컨은 뜨거운 오사카 여름 동안 생명의 은인이었습니다.무언가가 필요할 때마다 리셉션과 바의 친절한 직원은 항상 도움을 줄 수있었습니다.바는 다른 여행자들과 연결하기에 좋은 장소이며, 지역 주민들은 종종 저녁에 들러 활기찬 분위기를 더합니다.바텐더 인 다니엘은 당신이 요청하는 모든 음료를 채울 수 있으며, 그들은 항상 최고였습니다!좀 더 프라이버시를 원했던 순간에, 나는 뒷 입구를 사용하여 막대 영역을 건너 뛰는 옵션에 감사했습니다.위치는 또한 지하철로 도보로 2 분 거리에 있으며, 슈퍼마켓과 모퉁이에서 먹을 곳이 있습니다.여기에 머무르는 것이 좋습니다!
솔직히이 장소가 너무 높은 평가를 받았다는 것은 솔직히 저를 당황하게합니다.침대가 편안합니다.일부 레스토랑과 바, 교통 수단까지 도보 거리 내에 있습니다.부정적인
AC는 12 명의 기숙사 방에서 작동하지 않습니다.내 방에있는 모든 사람들은 그것이 얼마나 더운지에 대해 이야기하고 있습니다.하나의 샤워, 1 개의 화장실, 12 명을위한 싱크대가 있습니다.싱크대의 물은 하루 종일 밤낮으로 얼마나 뜨겁다 고 고려할 때 매우 뜨겁습니다.
가방을 방에 전혀 넣을 공간이 없습니다.모두가 바닥에 물건을 흩어지게합니다.적절한 공통 영역이 전혀 없으므로 뜨거운 기숙사 방을 제외하고는 누구나 사교적이거나 식히는 곳이 없습니다.기술적으로 사교 공동체 지역의 역할을하는 바 아래층이 있지만 절대적으로 작으며 오후 3시에만 열립니다.말 그대로 하나의 테이블과 4 개의 의자가있는 바입니다.여기에 머무르기 전에 두 번 생각합니다.나는 4 박 동안 돈을 지불했고 나는 그게 나쁘기 때문에 머무르기 전에 떠날 것입니다.이 호스텔에 관한 모든 것이 오도하기 때문에 그들이 내 체류의 일부를 환불하기를 바랍니다.AC도없고 공동 실이 없습니다.
훌륭한 사람들과 훌륭한 음료와 함께 슈퍼 재미 바.나는 3 일 동안 그곳에 머무르는 것을 정말로 즐겼다.매우 편안한 침대와 깨끗한 시트가있는 세탁기와 건조기가 있습니다.나는 다음 휴가에 확실히 돌아올 것입니다.
오사카 최고의 파티 호스텔.나는 오사카에서 3 곳에 머물렀다. 그리고 이것은 내가 가장 좋아했다.훌륭한 위치, 직원들은 정말 재미 있고 침대는 훌륭했습니다.바는 또한 잘 고정되어 있으며 좋은 사람들로 가득합니다.내가 오사카로 돌아 오면 다시 여기 머무를 것입니다.
매우 친절하고 환영하며 현지 음식 제안과 일본을 탐색하는 더 나은 방법을 도왔습니다.친절한 바텐더와 후원자와 함께 뜨겁고 습한 비오는 날 후 시원한 맥주가 많이 필요했습니다.","월요일 : 오후 6시 - 오전 12:00
화요일 : 오후 6시 - 오전 12:00
수요일 : 오후 6시 - 오전 12:00
목요일 : 오후 6시 - 오전 12:00
금요일 : 오후 6시 - 오전 12:00
토요일 : 오후 6시 - 오전 12:00
일요일 : 오후 6시 - 오전 12:00","술집, 하숙, 카페, 가게, 음식, point_of_interest, 설립",Yes
Smile Hotel Osaka Yotsubashi,"1-chōme-4-12 Shinmachi, Nishi Ward, Osaka, 550-0013, Japan",4.1,34.6756964,135.4972626,"꽤 기본적인 프릴 호텔.체크인 아웃은 매끄럽고 쉬웠습니다.매일 아침 신선한 수건이 좋았습니다.직원은 영어가 매우 좋으며 친절하게 우리를 대했습니다.나의 유일한 불만은 호텔 방으로의 소리가 어떻게 새지 않는지입니다.우리는 우리가 자고있을 때 매일 아침 우리의 문 옆에 청소 직원을들을 수있었습니다. 또한 사람들이 그들의 방에서 논쟁하는 것을들을 수 있습니다.오사카 또는 다른 도시로 돌아가는 것은 여기에서 쉽습니다.당신은 그냥 호텔의 정문 바로 옆에있는 지하철을 타고 멀리갑니다.솔로 여행자 또는 저렴하고 깨끗하며 괜찮은 호텔을 찾고있는 커플에게 추천합니다.
지하철역 위에있는 편리한 위치와 비교적 조용합니다.그러나 침대와 베개는 매우 힘들어서 잠을 잘 수 없었습니다.예산이 있고 어려운 침대에서자는 데 어려움이 없다면 옵션입니다.
좋은 숙박.자신의 목욕 가운, 칫솔 등을 선택하십시오. 문제 없습니다.호텔에서 우회전하면 지하철로 향하는 지하 길로 곧바로 갈 수 있습니다.
방은 작지만 조용하고 깨끗했습니다.그것은 훌륭한 욕조와 함께 제공되었습니다.우리가 만난 모든 프론트 데스크 멤버들은 정말 좋은 영어를 사용했으며 항상 도와 드리겠습니다.위치는 Morinomiya와 Shinsaibashi 라인의 지하 입구에 가깝습니다.
Graveyard Shift 프론트 데스크 직원은 그들이 당신을 미워하고 하루 종일 직원처럼 당신을 환영하지 않는 것처럼 당신을 눈부신 것입니다.따라서 당신의 경험은 당신이 들어가는 사람들의 변화에 ​​따라 다릅니다.비행이 지연되어 묘지 눈부심을 얻었습니다.나는 비 흡연을 예약했지만 그들은 나를 담배를 피웠다.그런 다음 그들은 다음날 방을 바꾸겠다고 동의했지만 직원들 사이에 잘못된 의사 소통이 있었고 메모로 만들지 않았습니다.그런 다음 프론트 데스크는 그 변화를 부인하고 일본어로 나를 나쁜 입으로 나쁘게 시작했습니다.그들은 전형적인 외국인처럼 방 변화에 대해 거짓말을해야한다고 서로에게 소리를 냈다.그래서 나는 그에게 내가 전화했을 때와 내가 말한 사람과 내가 거짓말 쟁이가 아니었다는 것을 정확히 알려주었습니다.그는 물론 당신이 말하는 것에 대해 예의 바르게 대답했습니다.일부는 뱀이 아닙니다. 일부는 미친 듯이 공손했지만 뱀이 있으므로 조심하십시오.그는 유창한 영어 사용자 일지 모르지만 일본어로 당신을 쓰레기로 만들 때 영어로 공손합니다.따라서 영어를 사용하는 직원이 필요하다면 당신은 당신이 운이 좋은 행운을 느끼는 것을 결코 알지 못할 것입니다!",운영 시간이 없습니다,"하숙, point_of_interest, 설립",Yes
GUEST HOUSE MATSU,"1-chōme-2-20 Matsu, Nishinari Ward, Osaka, 557-0034, Japan",4.2,34.6405285,135.4951355,"나는 약 2980 엔을 위해이 장소를 얻었고 솔직히 나는 불평 할 수 없다.직원 특히 Jen과 Honoda는 지금까지 일본에서 만난 가장 친근한 사람이었습니다.그리고 호스텔의 직원은 그것이 좋든 나쁘 든다면 모든 차이를 만듭니다.그것에 의지하지 말고 내가 거기에 있었을 때 그들은 우리에게 가벼운 간식과 음료를 제공했습니다.샤워, 욕실 및 휴식 지역과 같은 시설은 모두 깨끗했습니다.그리고 휴식 지역은 당신을 압도하지 않는 적당한 양의 침대처럼 느껴졌습니다.솔직히 말해서 내 침대 커튼이 약간 떨어졌지만 아마도 햇빛을 내버려 두는 것이 더 나을 것입니다. 나는 두 가지 불만이 있었는데, 그로 인해 별을 잃어 버렸습니다.1, 수면 공간은 깨끗하지만 이상한 이상한 냄새가 났을 것입니다.나도 일어 났을 때 코가 답답 해졌다.이것은 정말 큰 일이 아니 었습니다. 나는 침대가 굉장합니다.그러나 굉장한 점은 필사적으로 직원들에게 베개입니다.이 베개는 내가 술집에서 잤던 최악의 베개입니다.나는 그 아래에 큰 담요를 그 아래에 놓아 밤을 수면을 견뎌낸 다음 작은 담요로 잠을 잘 수 있습니다.여기서 자고 있다면 여분의 두 명에게 물어보세요. 나중에 감사합니다
내가 틀렸을 때 나는 그곳에 머물렀을 때 호스텔을 사랑했다. 정말로 나를 괴롭힌 유일한 것은 그녀가 유대인이고 이스라엘 출신이기 때문에 그녀가 정말로 부적절했던 노동자라는 스무어라는 것이었다.
내가 호스텔 소유자라면 나는 처음에 그녀를 고용하지 않을 것입니다.
이층 침대 옆 바닥에 두꺼운 먼지 층, 코골이 및 손톱 깎기.언더 레이어 매트리스에 뚜렷한 크기의 드라이브 업 구토 패치.아고다의 가격이 약 2400 명 이었지만 직원조차도 3000 엔을 사기를 시도한 사람조차도 좋았습니다. 대체로, 클래식 오사카 경험, 1010은 결코 돌아 오지 않을 것입니다.그래도 침대에서 돈을 절약 할 수있는 괜찮은 곳입니다.
친구와 나는 일본 전체를 한 달 동안 여행하고 있습니다.이곳은 내가 우리가 얼마나 좋아했는지에 대한 리뷰를 작성해야한다고 생각한 유일한 곳이었습니다.우리는 3 박 동안 머물렀고 실제로 우리가 가장 좋아했기 때문에 더 오래 머물기를 바랐습니다.모든 호스텔 중에서 가장 깨끗한 마일로 가장 쉬웠습니다.직원들은 매우 친절하고해야 할 일을 찾는 데 도움이되었습니다.그곳에서 일한 2 명의 호주인 Kyle과 Calem은 환상적이었습니다.훌륭한 음식 조언은 특정 일이 할 가치가 있는지 여부에 대해 정직했으며 엄청나게 친절했습니다.다음 여행에 100이 돌아올 것입니다!
나는 그 장소에서 밤을 보냈고 행복했다.나는 체크인 시간을 말하는 것을 잊었을 때에도 집주인이 예약을 유지하게되어 기쁩니다. 몇 시간 늦었습니다.객실은 깨끗하고 잘 통풍이 잘되었습니다.
이 장소는 지하철역 근처에서 도보로 710 분 거리에 있지만 찾기가 쉽습니다.솔로 여행자에게는 좋은 숙박입니다.",운영 시간이 없습니다,"하숙, point_of_interest, 설립",Yes
karaksa hotel Osaka Namba,"2-chōme-9-13 Nishishinsaibashi, Chuo Ward, Osaka, 542-0086, Japan",4.4,34.6705808,135.4989305,"훌륭하고 매우 도움이되는 직원과 넓고 깨끗한 객실이있는 놀라운 호텔.창문이 열리지 않고보기가 없지만 우리가 편안한 잠을자는 곳이 필요했기 때문에 우리에게는 문제가되지 않았습니다.로비 247에서 무료 청량 음료, 커피, 심지어 말차와 아이스 말뚝 라떼와 작은 간식을 얻을 수 있습니다!세탁기도 있습니다.위치도 매우 좋습니다.오사카에서 놀라운 숙박에 감사드립니다!추신 : 방금 다른 리뷰를 읽었고 엘리베이터의 선물을 대가로 좋은 리뷰를 할 수 있다고 엘리베이터의 표지판을 읽지 않았습니다. 이것은 호텔에 대한 나의 정직한 의견입니다.매우 이상적인 위치에있는 간단한 호텔로, 모든 상점과 식당이있는 오사카 도톤 부리, 남바 센터, 신사이바시 등의 중심부에 걸어 다니고 있습니다.또한 오사카 기차역에서 도보 거리에 있습니다.호텔은 깨끗하고 침대는 편안하며 객실은 일본 표준에 상당히 좋은 크기입니다.우리는 또한 방 안에 별도의 샤워 시설과 화장실이 있습니다.그들은 로비와 세면 도구에서 무료 음료를 제공합니다.도움이되는 직원.
다른 위치와 서비스는 여기에 머물기를 선호하지 않습니다.그 가치는 다른 도시에서 우리가 즐겼던 것보다 훨씬 적습니다.리뷰가 높았던 내 잘못이지만 호텔은 실제로 3 성입니다.단점은 차단 된 창, Akwardtight 화장실 문, 낮은 대기 질이었습니다.전문가는 위치와 서비스였습니다
자신에게 호의를 베풀고이 호텔을 예약하지 마십시오.우리가 본 첫 번째 붉은 깃발은 엘리베이터의 광고는 선물과 대가로 5 개의 스타 리뷰를 작성하는 것이 었습니다.우리 방에 들어가면 너무 심하게 제련되었고 가습기가 켜져 있더라도 공기는 극도로 곰팡이가 많았습니다.AC를 켜면 AC에서 방출되는 냄새가 오랫동안 청소되지 않은 것처럼 냄새가 악화되었습니다.우리 방의 벽은 내려졌고 우리가 3 성급 호텔이 아닌 모텔에 머물고있는 것처럼 정직하게 느꼈습니다.그들은 우리가 다른 호텔이 일본에 머무르는 것처럼 전체 병이었을 것이라고 생각했던 무료 간식과 음료를 광고하지만, 물이 묻힌 음료가있는 단일 소다 분수였습니다.간식은 작은 단일 포장 간식으로 매우 오래되고 의심 ​​스러웠습니다.나는이 호텔에 다시 머물지 않을 것입니다.
우리 방의 airconditioner는 매일 냉각을 멈췄습니다.당신은 창문을 열 수 없어서 너무 뜨거워 질 수 없습니다. 나는 리셉션에 갔고 그들은 실내 온도를 원격 제어하는 ​​것처럼 보였고 그들은 고정되었다고 말했습니다.나는 매일 다양한 Timessometimes Midnight에서 이것을해야했다.그렇지 않으면 좋은 아침 식사와 항상 모든 음료 기계에 무료로 접근하기에 좋은 곳입니다.","월요일 : 24 시간을 엽니 다
화요일 : 24 시간 영업
수요일 : 24 시간을 엽니 다
목요일 : 24 시간 영업
금요일 : 24 시간 영업
토요일 : 24 시간을 열었습니다
일요일 : 24 시간 영업","하숙, point_of_interest, 설립",Yes
Hotel Nikko Osaka,"1-chōme-3-3 Nishishinsaibashi, Chuo Ward, Osaka, 542-0086, Japan",4.2,34.6739002,135.4997105,"나는 일반적으로 Hotel Nikko Osaka에서 어색한 서비스를 경험했으며, 언어 장벽으로 인한 것인지 아니면 사람들이 여기에서 덜 친절한 지 확실하지 않습니다.한 가지 재미있는 사례는 리셉션이 도시 세금을 요청한 시점이 불편한 것처럼 보였을 때, 우리가 거절하기를 기대하는 것처럼, 우리가 돈을 지불 할 준비가되어 있었지만 경험이 풍부한 관광객이었던 것입니다.세탁실이 없다고 설명했을 때 서비스는 이상했습니다.또 다른 이상한 순간은 내가 여분의 클렌징 폼을 요청했을 때였고 대신 클렌징 크림을 건네주었습니다.그것은 영어를 이해하는 데 문제가 아니 었습니다. 제품은 명확하게 표시되어 있습니다.이 어색한 순간에도 불구하고, 우리의 체류는 멋진 경험으로 구속되었습니다.객실과 침대는 매우 편안했으며 오사카 최고의 거리를 환상적인 전망을 제공하며 호텔 건너편에 브랜드 상점이 있습니다.아침 식사 뷔페는 놀랍습니다. 아마도 우리가 일본으로 여행하는 동안 우리가 가진 최고 일 것입니다.또한, 다른 외국인 직원들은 좋은 영어를 말하고 우리의 필요에 잘 참석했습니다.
정말 사랑스러운 호텔과 오사카에있는 장소 인 Dotonbori와 매우 가깝습니다.10 층에있는 우리 방은 일본 표준에 정말 큰 것이었고, 멋진 전망을 가졌으며, 걸어 다니며 돌아 다니면서 시간을 보낸 후 휴식을 취하기에 멋진 장소였습니다.포인트와 오프 코스에서도 매우 친절합니다.
호텔의 주요 매력은 신사이바시와 도톤 보리의 중심부에 위치하여 쇼핑, 식사 및 다양한 활동에 쉽게 접근 할 수있는 위치입니다.다른 중요한 지역과 가까운 도심에 편리하게 위치하고 있습니다.그러나 객실은 구식과 작고 매우 쾌적하지 않았습니다.서비스와 직원은 예의 바르고 도움이되었으며, 그와 관련하여 불만이 없었습니다.나는 또한 그들의 아침 식사를 즐겼다.나는이 호텔을 객실 품질이나 사치보다 우선 순위를 정하는 사람들에게 추천합니다.
호텔에는 지하철 바닥에 직접 엘리베이터가 있습니다.여행은 매우 편리합니다.직원은 매우 친절하고 서비스는 매우 좋습니다.우리는 7 일 동안 머물렀다.며칠 동안 비가 내렸다.직원들은 우산을 우리에게 가져 왔지만 그날 우리는 교토에 갔기 때문에 비가 아닙니다.매일 청소 직원이 있습니다.Dotonbori까지 약 5 분, America Mura까지 2 분.기회가 있다면, 확실히 돌아가서 다시 여기 머무를 것입니다.나는 친구가 친구에게 추천하는 것처럼 진심 으로이 장소를 추천합니다.훌륭한 서비스와 방은 컸습니다.모든 쇼핑 및 식사 요구에 완벽한 위치.또한 플러스 인 기차역에 부착되어 있습니다.",운영 시간이 없습니다,"하숙, 식사 _takeaway, 식당, 가게, 음식, point_of_interest, 설립",Yes
HOTEL FORZA OSAKA KITAHAMA,"2-chōme-2-21 Imabashi, Chuo Ward, Osaka, 541-0042, Japan",4.4,34.690275,135.5061942,"우리는 Forza에서 좋은 숙박을했습니다.입구는 주요 도로의 옆으로 떨어져 있으므로 놓칠 수 있습니다.직원들은 매우 좋고 친절했고, 우리에게 좋은 방향과 식사에 대한 추천을주었습니다.우리를위한 공간은 충분히 편안했고, 리셉션에는 무료 커피, 핫 초콜릿 냉수 및 온수가 있습니다.레벨 2에는 2 개의 세탁기와 2 개의 건조기가 사용할 수 있습니다.우리는이 가격대를 위해 넓은 객실이있는 사랑스러운 호텔 감사합니다.방은 깨끗하고 항상 냄새가났다.그들은 또한 긴 하루의 관광 후에 훌륭한 마사지 쿠션을 가지고 있습니다.훌륭한 위치.그들은 잠자기를 제공하며 로비에 욕실 편의 시설 뷔페가 있습니다.그들은 또한 로비에 커피 머신과 찻집을 무료로 가지고 있습니다.돈과 편안한 숙박을위한 전반적으로 탁월한 가치.
전반적으로 머물기에 좋은 장소입니다.호텔 객실이 식히는 데 시간이 걸렸지 만 일단 호텔 방은 차가워졌습니다.도보 23 분, 호텔에서 도보로 약 8 분 거리에있는 갈색 선 스테이션이 있었기 때문에 위치는 꽤 괜찮 았습니다.근처의 음식 선택은 많지 않지만 조금 여행을하지 않으면 더 많은 선택을 찾을 수 있습니다.방 크기는 괜찮 았지만 호텔은 방에 물을 제공하지 않았습니다.그들은 로비에서 무료 커피와 물을 제공합니다.옷장 공간이 없거나 침대 공간 아래에 수하물을 배치 할 수 있으므로 사용 가능한 제품으로 인해 만들어야합니다.
방은 매우 넓고 깨끗하며 깔끔했습니다.방에는 마사지 쿠션이 있었고 밤에는 휴식을 취하기에 좋았습니다.직원들은 친절합니다.아침 식사 뷔페가 좋았습니다.호텔의 위치는 기차역에서 약간 멀리 떨어져 있었지만 도보로 510 분 이었지만 여전히 허용됩니다.
좋은 장소, 꽤 좋은 아침 식사.이상한 것은 공간 청소를 요청할 때 컵을 씻지 않는다는 것입니다.매우 느린 리프트.","월요일 : 24 시간을 엽니 다
화요일 : 24 시간 영업
수요일 : 24 시간을 엽니 다
목요일 : 24 시간 영업
금요일 : 24 시간 영업
토요일 : 24 시간을 열었습니다
일요일 : 24 시간 영업","하숙, point_of_interest, 설립",Yes
Dormy Inn Premium Osaka Kitahama,"1-chōme-6-7 Kōraibashi, Chuo Ward, Osaka, 541-0043, Japan",4.4,34.689312,135.5079474,"호텔은 실제로 시설과 위치입니다.그러나 일본 여성 직원 중 한 명이 너무 무례하고, 나는 이미 그녀에게 일본어로 말하고 그녀의 태도는 너무 나쁘다.그녀는 온천 지역의 포스터에 언급 된 온천을위한 특수 목욕 욕조가 있다는 것을 알지 못하며 호텔 손님은 프론트 데스크에서 그것을 얻을 수 있습니다.그러나 그녀의 태도는 제가 일본 친구에게 그녀에게 물어달라고 요청했을 때 180도 바뀌 었습니다.이것은 말도 안됩니다.그래서 당신이 외국인을 환영하지 않는다면, 당신은 당신의 웹 사이트에 우리가 환영받지 못한다고 말하는 것을 게시하고 우리는 분명히 여기에 머물지 않을 것입니다.
우리 2 명의 성인과 2 명의 아이들이 4 월 초에 일주일 동안 머물 렀으며 우리는이 호텔을 좋아합니다!아이들은 매일 온천과 무료 아이스크림을 좋아합니다.또한 945pm 이후의 자유라면도 훌륭했습니다.그러나 우리는 저녁 식사 후에 매일 너무 가득 차 있었고 무료라면을 두 번 먹었습니다.지하철역 근처에는 멋진 슈퍼마켓이 있었고 편리했습니다.메인 스트리트 근처의 커피 숍도 좋았습니다.이 호텔은 가장 관광지에 있지 않지만 조금 조용했기 때문에 좋아합니다.
이곳은 대접이었다!조용한 온천과 세탁 건조기와 같은 Lotsa Freebies는 100yen이지만 2 라운드, 2 개의 마사지 의자, 아침에는 무료 야만식 음료, 오후 저녁에는 무료 아이스크림 및 아이스크림 바, 오후 9시 30 분 후 무료라면을 수행해야합니다.우리는 2 개의 침대가있는 방을 예약했습니다.넓고 편안했습니다.위치는 최고는 아니지만 우리는 여전히 우리의 체류를 즐겼습니다.좋은 레스토랑은 많지 않으며 비즈니스 지구가 더 많습니다.고급 간식을 구매하고 싶다면 많은 멋진 상점.Kitahama 역과 편리한 상점에서 단계.
객실은 훌륭합니다.우리는 두 개의 더블 침대를 가지고있었습니다.방에는 작은 냉장고가 있습니다.호텔은 최상층에 온천이 있으며, 두 개의 뜨거운 욕조, 하나는 내부와 외부, 사우나 및 차가운 욕조가 있습니다.나의 유일한 불만은 낮 시간 동안 음식 옵션의 lacj입니다.근처에 몇 개의 편의점이 있지만 대부분의 식당은 530pm까지 열리지 않습니다.스테이션이 가까워지기 때문에 큰 거래가 아니었고 단순히 다른 정거장으로 갈 수 있습니다.전반적으로 훌륭한 호텔.
음식은 시아트 베드 매트리스 Airweave가 바위만큼 단단합니다.저렴하고 서브 파 품질.나는 내 개 조차도이 정크 매트리스에 누워있는 시간을 낭비하고 싶지 않다고 생각합니다. 베개는 5 박으로 예약 된 것처럼 얇습니다.이 두 번째 밤이지만 즉시 허리 통증과 목 통증을 원한다면 주저하지 마십시오.여기에 밤을 예약하십시오.1 박 만 있으면됩니다.예약은 이제 4 일 밤에 잠을 잘 수 없어서 아침에 238am에 글을 쓰고 나서이 두 번째 입장 시간을 통해 힘을 줄 수 없으며, 마침내 힐튼 오사카에서 남은 밤을 예약하기로 결정했습니다.그들은 세타 베드 매트리스가 있습니다",운영 시간이 없습니다,"하숙, point_of_interest, 설립",Yes
