이름,주소,평점,위도,경도,리뷰,영업시간,카테고리
Villa Cha Cha Banglamphu Hotel,"36 Tani, Khwaeng Talat Yot, Khet Phra Nakhon, Krung Thep Maha Nakhon 10200, Thailand",3.7,13.760585,100.4976431,"Location is good. Lots of places around. The rooms are very cheap for a reason. They suck. The room and floor smells. My guess app the bird poo. Beds are not great. The pool is tiny and dirty. It looks like they haven't cleaned it for a month. The entry is dumb has stairs while your wheeling your luggage in. Just make it a ramp. Our window is covered is bird poo so is our entire view out our window. Which is unsanitary and dangerous as that carries diseases.
The walls are falling apart even. Big cracks through the concrete.

Also bugs crawling around in the room. Lovely... Overall this hotel could have much better service. The location was good and the rooms were ok value for the money, however walls and doors are very thin and you can hear every noise during the night. Also the staff was just not friendly. Wouldn't say hi or even make eye contact. Could not be bothered to help me figure out public transit to the airport. Also DO NOT pay for the included breakfast. It's 6 which is a lot by Thai standards, and it's basically just 2 eggs and a piece of toast. They won't even give a second cup of coffee. Save the 6 and just go to any restaurant in the area. Fantastic hotel stay! The rooms were clean, comfortable, and wellequipped. The staff was exceptionally friendly and attentive, ensuring a pleasant experience. The location was convenient, and the amenities were topnotch. Highly recommend for a relaxing and enjoyable stay! Our room here was excellent for the price. Fantastic budget option if you want to be really close 2 min walk to Khao San Road, but also want to be able to sleep at night! The room was clean and theres a nice pool area downstairs with a pool table and drinks available. The staff were friendly and the room was clean. Our room had armchairs for seating, a television, a mini fridge and a kettle which was great. An endless amount of restaurants, bars, and shopping in the area around this place and the restaurant at the ground floor of this building does good food and lets you cut through to get from the hotel to Khao San even quicker The rooms are a big contrast to what the lobby is, allready the 3rd hotel in similar price range, but this one doesnt meet its standars!! Airconditioning not working properly half of a window is missing, so cant cool down the room. Worst hotel for now","Monday: Open 24 hours
Tuesday: Open 24 hours
Wednesday: Open 24 hours
Thursday: Open 24 hours
Friday: Open 24 hours
Saturday: Open 24 hours
Sunday: Open 24 hours","lodging, point_of_interest, establishment"
The Pattern Boutique Hotel,"547 553 Soi Krung Thonburi 6, Banglambhoolang, Khet Khlong San, Krung Thep Maha Nakhon 10600, Thailand",4.3,13.7179223,100.5013149,"Wow, seriously, its like finding a hidden gem in the middle of a neighborhood. The vibe here is just greatcomfy, modern, and super clean! The best part? It's close to 7Eleven and all the snack spots, plus the skytrain is nearby. My first time in Bangkok, and I already got a spot thats totally recommended! I stayed here during after getting a hair transplant at the nearby Absolute Clinic 15 min walk. The rooms were clean and well stocked I had a fridge, balcony with sink, and a couch. It was more like an apartment room. Laundry was very easy and cheap. Breakfast every morning was the highlight Handcrafted coffee drinks with a variety of breakfast options, in a nice cafe setting. Plenty of food and convenience store options nearby. Quiet area and only 10 minute walk to Krong Thon Buri BTS station. Staff very helpful, friendly and respectful. Would absolutely stay again. This hotel exceeded my expectations in so everything.

Let's start with the core and soul of this establishment ITS STAFF 
If you read this review, I want each of you yo know you're doing an excellent job. Joyfully helpful, provide clear and accurate information. Second, the hotel itself. It is very well maintained and efficiently designed. You can tell it required an architect Bravo. Minimalist and stylish.
It is my first visit to Thailand. So, it is also important for me to stay in an authentic neighborhood, close to transit infrastructures. It did exactly this. I walked to everything even when the train or bus were available.
I will come back, for sure! Affordable price and close to BTS Krungthonburi which you can take the BTS golden line to Icon Siam, the room is fairly small but its worth for paying compared to any other hotels in the same area. If youre looking for a hotel thats in the heart of the city, then this is not for you. You might find the 1520 minute taxi ride going downtime too far. If you want to stay at somewhere quiet, away from the hustle and bustle of the city, then this should be okay.
Located in a residential alley, it can really be quiet in the evening. However, there are 3 711 nearby incase you get hungry in the middle of the night.

Stayed here for 4 nights with kids. Checked in at their family room. The room is small, but it did fit us comfortably. The bathroom is really white, we loved the minimalist design and the fact that it doesnt smell, and has good water pressure and a bidet made us happy.

Cant say much about the breakfast since we only had 2, since some days we had to leave really early. The first breakfast we had was on the salty side. The latte though was great.

The staff are also courteous and accommodating of our needs. I left my earbuds there and they are so far helpful in helping me get it back ","Monday: 6:00 AM – 12:00 AM
Tuesday: 6:00 AM – 12:00 AM
Wednesday: 6:00 AM – 12:00 AM
Thursday: 6:00 AM – 12:00 AM
Friday: 6:00 AM – 12:00 AM
Saturday: 6:00 AM – 12:00 AM
Sunday: 6:00 AM – 12:00 AM","cafe, lodging, clothing_store, store, food, point_of_interest, establishment"
Prince Theatre Heritage Stay Hostel - Silom,"441/1 Charoenkrung Road, Si Wiang, แขวงสีลม เขตบางรัก กรุงเทพมหานคร 10500, Thailand",4.5,13.7206253,100.5166393,"This hostel has a great location and honestly had really nice rooms! The bed was comfy, and each bed is enclosed for privacy in the dorms. The only issue i had was the bathrooms. I stayed in two different rooms over a week and both had very unclean bathrooms, especially the shower. The walls and curtain had mold all over them and just look like they dont routinely get a thorough clean. Same with the floors. The shower drain in both rooms backed up and sometimes would flow over and get water everywhere. Cleanliness could definitely be improved here. Other things to note theres no communal kitchen, they dont let outside food on the main floor, they dont let you sit in the theatre which is the restaurant unless buying food, which leaves only a couple tables and couches for everyone to use. Basically there isnt a great hangout spot. However for a nights sleep, it was great and the rooms were quiet, beds were comfortable! The location is fantastic. That's probably the only positive. The reception staff are hopeless. During checkin, they requested the passports of all the people checking in. That's fine, so we gave them all the passports. They then gave us an intrusive form to fill out, asking for our home address, where we had been before arriving in Thailand, and where we would be going next. We were still okay with this, even though it seemed completely unnecessary for them to know. What frustrated me was that we also needed to fill in the passport numbers. We left that section blank because we didn't have the passportsthey had taken them to make copies. When they asked why we hadn't filled out that part, I pointed to the passports on the table. It seemed they couldn't fill it out for us. The most frustrating part was when we asked for our passports back. It took a full minute of internal discussion before they returned them. It might seem like a small thing to get upset about, but that's not all.

Its the overall ineptitude of the reception staff in dealing with guests. For example, when I went down to question why there was no housekeeping done on the first day, I found that the room was still not clean at 3 pm. When I went to the reception, they gave the standard excusebusy, no staff, etc. Then they asked if we wanted it cleaned now. We had just returned and hoped to have a quiet rest, so I suggested we schedule a time. They said no, as housekeeping finishes at 6 pm. Well, if they had cleaned it, like most hotels do, before 12 pm, they wouldn't have to deal with a guest asking about it later. The reception staff need to be trained on how to talk to guests, especially the gentleman with the black nail polish. You might not be able to solve a problem immediately, but don't make matters worse by staring back and repeating the same response. It doesnt help and only makes the person you are talking to more upset. Great place, rooms have storage space for bags and a included towel. Movies most weeknights with popcorn 20baht. Movies seem very random and probably something you've never seen before. Close to the train, great atmosphere. Food options after kitchen is closed are good, I'd gotten the chicken bites and sweet potato fries.

Breakfast option seems kinda steep for what it is buffet eggs, toast, cereal, fruit on a small table for 200bahtperson. Keycard stopped working on second day of 2 night stay. Not sure why, but was able to get fixed quickly with reception still open. The stay was nice overall. Huge theatre screen is a major feature. The bed was in own designated room providing more safety but this also means there is only one stall for toilet and showers for 6 or 8 people.Lucky to have less occupants in September. The curtain needs to be cleaned or replaced. The water may spill out to other area of washroom. The water pressure goes down if the tap is open for long in the cleaning jet at toilet.More cleaning attention is needed .Maintenance needs more attention... had a little leaking water in shower.
The bed partitions are made of plastic sheet which is not 100 opaque.It is nice that upper section beds are not via steep ladder. Great location for connections to the BTS and river boats.
The staff were helpful and friendly with great English.
The theme of the hotel is so cool and unique.
The superior dorms were good. Beds comfy and clean. The dividers between beds don't block out any light which is challenging at times.
The place isn't very social so if you're looking to meet backpackers probably not great. But for digital nomads it seemed good. Lots of working areas.",no operation time,"cafe, lodging, bar, food, point_of_interest, establishment"
Shangri-La Bangkok,"89 Soi Wat Suan Phlu, Khwaeng Bang Rak, Khet Bang Rak, Krung Thep Maha Nakhon 10500, Thailand",4.6,13.7209803,100.5140562,"Nice and elegant hotel with comfortable room. The bed is a little bit hard, but is tolerable. The fitness center is nice. The outdoor pools are quite small, which are suitable for kids. Breakfast served at the first floor is great, including some traditional Thai foods and a variety of choices. I like homemade ice cream a lot. The main build of the hotel is not quite easy to access via public transport. The hotel had ferry taking guests to the mall across the river, 6 times daily. Fantastic hotel!

Comfortable rooms. Amazing shower and bathroom!

The breakfast  so much choice. Literally anything you could wish for!

Mostly the wonderful staff here need a mention. So warm, kind, friendly and cannot do enough for you!!

Travelled for my friend's birthday and they went the extra mile! Fantastic hotel with plenty nearby IF you want to leave the hotel!
I say IF as the hotel is perfect so you may not even want to leave! 2 night here and with an incredible view of the river and fantastic facilities we will be back for sure!
Service from the moment we arrived until we left was immaculate and the hotel itself has so many spaces to chill and explore we were very happy. Our personal favourite was sitting beside the pool on the sun beds looking at the river watching to boats fly by! Very happy customers Best location, best friendliness.
Breakfast is delicious.
Staff very diligent and friendly.
River view rooms are recommended.
Pool is not very large, but adequate for the number of guests. The hotel is well maintained and there are many places to take photos. Lovely stay, comfortable a lounge and rooms. The staff are well trained and offer great service. I enjoyed the almost secret lap pool, which was virtually my private oasis during our trip.
Decore a little tired, but priced as such.","Monday: Open 24 hours
Tuesday: Open 24 hours
Wednesday: Open 24 hours
Thursday: Open 24 hours
Friday: Open 24 hours
Saturday: Open 24 hours
Sunday: Open 24 hours","lodging, point_of_interest, establishment"
Grande Centre Point Ploenchit,"100 Thanon Witthayu, Khwaeng Lumphini, Pathum Wan, Krung Thep Maha Nakhon 10330, Thailand",4.4,13.7422712,100.5469778,"I would love to sharing our experiences about the hotel reception in this morning  0610 . First of all, our customers are laying over here and they are booked for rent a van with driver. Of course, we are standby before timing and our customers from another country. We were dealing with them that if we are there, we will be informing our lovely customers by letting hotel staff calling

But yeah, the hotel staff not really nice and ignored when we needed help to connecting with the customers

We are not really happy about it! We are expecting and hoping that the hotel will be considering this situation and improving your reception to be nicely in next time

We hope to see the first impression in this hotel in next time, many thanks! Huge clean rooms with nice view.
Free drinks and snacks also were helpful.

Gave it 3 stars because of 2 points
1. Toilet too old flush takes 3 times to make water clear
2. Shower is fixed and too tight space. Bathtub also has shower but problem is no shower curtains and also other side has windows going to room that makes both sides wet The Hotel is very nice we booked this with my Family , 2 Adults 2 Children , The rooms are very good and huge we booked 1 BR suite , it have separate kitchen with Washing machine , Micro , Fridge Etc . Its near Us Embassy and Very near by Nana Station and Central Plaza Mall and major Shopping Area , with In 10 Mins you can reach main shopping area . The staff is very nice and helpful . Overall experience is very good and yeah breakfast was also good. Pics are attached Thanks I like that the TB has a hightech Japanese toilet. The room is clean and nice, and the balcony is an added nice touch. The lobby is small and usually crowded. The breakfast spread is OK with many options, such as Japanese and Chinese dishes. I like that everything in the mini bar is free. Thai staff are fantastic, Foyer area modern and very nice. Daily breakfast was  continental with the usual trims perfectly acceptable. The room was dated and in need in need  of a refurbishment, comfortable enough.
Sky train is close and the best way to get around in BKK. The room is quite noisy, very busy street below, and there are no double glazed windows or doors.
 Nothing to do with the hotel , but beware of ""FAKE"" policeman out front.","Monday: Open 24 hours
Tuesday: Open 24 hours
Wednesday: Open 24 hours
Thursday: Open 24 hours
Friday: Open 24 hours
Saturday: Open 24 hours
Sunday: Open 24 hours","lodging, point_of_interest, establishment"
Tori Prestige Bangkok Hotel,"57 34 Soi Phetchaburi 15, Khwaeng Thanon Phaya Thai, Khet Ratchathewi, Krung Thep Maha Nakhon 10400, Thailand",3.9,13.7554161,100.5385185,"Review for Tori Prestige Hotel, Bangkok
Stayed September 512, 2024

Our group of students and teachers stayed at Tori Prestige Hotel while attending an academic competition in Bangkok. Despite initial concerns based on some negative reviews, we were pleasantly surprised by the experience. While the rooms were small and lacked certain amenities like shower caps and toothbrushes, the cozy setup actually helped our group bond, as the students interacted more closely.

The hotel staff was attentive and accommodating, cleaning the rooms daily and always providing fresh towels. Although the 1000 Baht noise fine initially worried us, we were never penalized, even with lively middle school students. Breakfast offered light, tasty options in a comfortable setting.

Overall, while the hotel is basic, the friendly service and bonding atmosphere made our stay enjoyable. I'd recommend it for groups looking for simple accommodations with great hospitality. The area is within walking distance to a 711, food, and shopping areas. The room is comfortable and cleaned every day, with coffee, water, and toiletries replenished daily. John is of a kind staff very accommodating and welcoming. They are easy to contact and very helpful with anything we needed. also with milyn and mac.  I will definitely recommend this place to my friends. The location is hard to find even drivers got it really difficult to reach. When I arrived they asked for a deposit and ID card which I find totally unreasonable. The ambience is horrible and ridiculously hot inside. I find the staff really difficult to comprehend and impolite as I sit on the lobby and watch them talk with Thai customers as I wait for my door key card and noticed they give just one even if you're in a group. I picked my luggages and nobody else assisted me. The lift is really small and I experienced sharing the lift with their cleaner which I find really inconvenient. When I arrived and opened the room, the smell from the toilet bombarded my nostrils for real. I don't know which cleaning materials they use and it's really strong scent. When I turned on the lights the room is not same as shown online the bedsheets and towels torn and stained, I opened the airconditioning and it's been a long while I didn't felt cold at all. I talked with the front desk and reported about the room condition they said the room attendant and maintenance are unavailable. I stayed for long hours in the room it's completely a bad experience. If you're looking for a place to stay I don't suggest staying here. Its really careless for manage. Bad smell in bath room, Very bad feeling after stay and dirty, very expensive if comparing with quality. Noisy, No choose if have more choice. Its shouldnt be have low quality hotel like this in famous city with high cost. First bad expert feeling. 1. Room is really tight and small. Dont have enough place for you to keep your big luggage. The blankets are dirty and bed sheets have a lot of stains. The fridge is not cold and a lot of ants all over the rooms. The toilet is too small and the shower area has a funny design and too tight, if you are the big side person there will be too uncomfortable for you to move around. The rubbish bin is broken and small as well.
2. There will be 1000 as deposit on the first day which never be mentioned on the app before booking. The service is terrible, they seem very helpful but they dont help at all. Their staffs are not local and the way they treated you is depends on their mood especially the woman with the long hair. On the first day I overheard the local customer is asking the reception woman about the parking, she replied that she did not speak Thai and ignored the customer or trying to help. The next day I have complained about the ants and she said will checked and asked the housekeeper to monitor on it. But their housekeeper service is terrible. They just came in the keep the blanket and changed towers only. No vacuum and no mopping or cleaning anything. The ants still all over the wall which really annoying me. During check out day, I do complained about everything to the reception manhe is not local as well as I look at him like trying to find some excuse to take my deposited. After I done complained then only he gave back me the deposit and ignored me.
3. This hotel location is only convenient if you want to go for shopping because is near to the platinum mall. But its very difficult for you to call a taxi yourself to go somewhere else unless you get the non meter taxi which more expensive than the normal taxi, even if I order from grab its hard to get the taxi as well due the location the too complicated and small road, most of taxi will refuse to accept the order or come in. You may need to walk to the main road to get it, normal day is fine but not will all of your luggages. Others hotel will have buggy car service provided but this hotel have non. Not recommended for family with small kids.
I would say this is my worse experience ever, Im not gonna stay in this hotel again. Whatever you see in the app or pictures, nothing same as it shown. Thank you","Monday: Open 24 hours
Tuesday: Open 24 hours
Wednesday: Open 24 hours
Thursday: Open 24 hours
Friday: Open 24 hours
Saturday: Open 24 hours
Sunday: Open 24 hours","lodging, point_of_interest, establishment"
Chatrium Residence Sathon Bangkok,"291 Soi Naradhiwas Rajanagarindra 24, Khwaeng Chong Nonsi, Khet Yan Nawa, Krung Thep Maha Nakhon 10120, Thailand",4.5,13.7025459,100.5371709,"It's different from other places I've used the service before. The beautiful swimming pool is set in a garden covered with various trees.    There is a playground. There is a slide for children as well. Including activities on Saturday and Sunday from 3 to 4 p.m. The fitness section has a lot of equipment. The stream room and sauna are spacious and comfortable.  There is a restaurant on the lobby level as well. Thank you Khun Bee for welcoming us with a smile and providing friendly service like family friends every time we use the service. We stayed a week in a 1 bed suite. Good value for money and apartment is big and comfortable. Hotel comes with coin laundromat downstairs. Large gym and resortstyle pool.

As hotel has 7 towers, the need to transfer lifts was a tad annoying. Gym is also open to gym members and swimming pool is too small to accommodate number of residents. Pool depth is also 1m very shallow so much better for kids but not possible to do any laps or swim.

Not possible to walk to any sky train so grab taxi is best bet. Close to a few malls so easy access to food and service options. Grab taxi to Siam shopping district takes 3040min depending on traffic.

Coffee club cafe downstairs serves all day meals and open till 2am. I stayed in 1bed suite.

Very good hotel and residence for long term stay. Super family friendly and away from bustle of city center.
Rooms are furnished well, and responsiveness of staff is excellent, truly. All my requests were honored and within time. They have shuttle vans to the nearest points as well.

I stayed here for 4 months for work and would do it again when I get a chance in the future.

The best part of this hotel is the gym for me. Truly kickass and excellent. All compound exercise machines, cardio machines, steam, sauna and super friendly staff. Pool is kickass as well.

Recommend for family, kids and for people who prefer less busy and relaxed vacations. Location is both a hit and miss.
Hit for being less busy which I prefer and miss for the connectivity for BTS. But taxis are plenty and can always use grab or bolt. Gym facilities are amazing. Staff is very helpful and friendly. The play area needs a bit more activity for kids. Maybe a play area for football. The lady in the gymBeeis absolutely lovely and kind. Room was specious
Function room was good.
Services from the staff at Front Desk very nice and helpful.
Meet the Manager Mr. Nutanai , hes so gentle and supportive.
Services from Bell team is perfect
For sure will try to be back again !
Fantastic pool even night time, day time is like Oasis is real","Monday: Open 24 hours
Tuesday: Open 24 hours
Wednesday: Open 24 hours
Thursday: Open 24 hours
Friday: Open 24 hours
Saturday: Open 24 hours
Sunday: Open 24 hours","lodging, point_of_interest, establishment"
