이름,주소,평점,위도,경도,리뷰,영업시간,카테고리
Bangkok Natural Spa & Resort,"1148 Soi Muban Panya, Khwaeng Suan Luang, Khet Suan Luang, Krung Thep Maha Nakhon 10250, Thailand",3.9,13.7362551,100.6192678,"Terrible spa in bangkok
New experience  Spa using one hand and the other hand on mobile phone for 2 hours !!!!  First time in my life how they treat staff like this !!!

Sunday 4 feb 2024 1320 Good massage. Old school is the best, forget all the modern luxurious blingbling.
I don t know why this place got bad reviews. Be kind and they will also be kind.
I was planning to stay there to pamper myself, but it didn t happen. Hope i will someday. Before flight good place for relax and shower. Most masseuses are insincere and just trying to kill time.
Those who have time left...
Those who have money left over...
Even though it's expensive, I only recommend it to those who don't have anywhere to kill time.
There is no investment in facilities in this good location.
They don't even take care of the masseuse...
Are you leaving it like this?
It's just a shame It's a wonderful time!
Be careful because security is at risk !
Please use caution as security is risky.

It's a beautiful day.
What is the meaning of the story? There are 2 people in the group.
In the last few years, we have gathered together a group of young people. There are no such things as old people, so there are no such things as people in the world.
There are many things that will happen in the future.

I used it for sauna.
I had put my valuables and belongings in a locked locker, but someone opened the lock and stole my two credit cards.
I noticed this when I received a usage notification from my credit card company's app, so I called my credit card company and stopped using it. We also reported it to the nearby police station.
When I asked the sauna and hotel staff for assistance, they did nothing.

I use it in the sauna.
I keep my valuables and belongings in a locked locker. But someone opened the lock and stole two credit cards.
I noticed this when I received a usage notification from my credit card company's app. So I called the credit card company and put a hold on it. We also filed a report at the nearby police station.
When I asked for help from the sauna and hotel staff. They didn't do anything.","Monday: 10:00 AM – 10:00 PM
Tuesday: 10:00 AM – 10:00 PM
Wednesday: 10:00 AM – 10:00 PM
Thursday: 10:00 AM – 10:00 PM
Friday: 10:00 AM – 10:00 PM
Saturday: 10:00 AM – 10:00 PM
Sunday: 10:00 AM – 10:00 PM","spa, lodging, point_of_interest, establishment"
Barefeet Naturist Resort,"85 ซอย ประเสริฐมนูกิจ 29 แยก 7 Khwaeng Lat Phrao, Khet Lat Phrao, Krung Thep Maha Nakhon 10230, Thailand",4.7,13.8417488,100.6163118,"This place is incredible! The pools, sauna, food, massage roomeverything is awesome. The restaurant prices were great, and the food was delicious. The owner is a super friendly guy who made me feel welcome as soon as I got there. Checking in was easy and simple. I can't wait to go back next time I'm in Bangkok. Its like my 2nd home. Been coming here many times for a few years.

The uniqueness of this place is that it feels like a home, its cozy and you can meet other people both locals  internationals. The rooms are nice too with Netflix.

A very laid back atmosphere with good vibes. Wonderful hosts and staffs. Breakfast is personally prepared by the hosts themselves which is lovely. Have stayed in the accommodation previously however this time visited as a day visitor . Love what Dau and Gregers have created . However the best part is to enjoy a fabulous massage from Pen . Every day I went I always had a 2 hours massage . Pen provides a first class service . I have had many massages in Thailand however she is the best . Great sense of humour, great hands and technique. So if you are visiting BKK and would like to try something very unique and special then ring The Barefeet Resort and make a 2 hour massage booking with Pen  You wont regret it . Best wishes to all Tony Gday For many years the Barefeet has been our stopover in Bangkok both when we arrive from Europe or when we have to return.
We appreciate the kindness of the owners and staff, the breakfasts taken together, the swimming pool and its facilities.
Note that a new metro line now passes near the resort and greatly facilitates access to the city center. I had a really great time here.
Everything about it is awesome.
The beds are very comfortable. It has AC.  Two pools one cold and one warm.  I preferred the cold one but others gravitated to the warm one.  Probably cause it was close to lounge area.  Staff were great the owners awesome. Free breakfast every morning.  They even saved me mine when I slept in.  Highly recommended.","Monday: 9:00 AM – 9:00 PM
Tuesday: 9:00 AM – 9:00 PM
Wednesday: 9:00 AM – 9:00 PM
Thursday: 9:00 AM – 9:00 PM
Friday: 9:00 AM – 9:00 PM
Saturday: 9:00 AM – 9:00 PM
Sunday: 9:00 AM – 9:00 PM","lodging, spa, point_of_interest, establishment"
QiSS Residence by Bliston,"3803 Soi Rubai Road, Road 4, Prakanong, Klong Toey, Bangkok 10110, Thailand",4.3,13.7139614,100.586632,"I was attending to a seminar there and the facility was great. Seems to be nice crew. Even we are not residents there the crew always great us, smile with us etc... There is a place like 7eleven even. There is a nearby market on Saturday, but not on Sunday. I'm not sure about other days since I was not there on week days. Very comfortable  quiet area  free shuttle tuktuk to ekamai bts  shopping centre room was extremely dusty and there was a moldy smell. location wise is not ideal and far Good service and specious room. Nice place to stay. Clean and comfortable place!! Absolutely five stars","Monday: Open 24 hours
Tuesday: Open 24 hours
Wednesday: Open 24 hours
Thursday: Open 24 hours
Friday: Open 24 hours
Saturday: Open 24 hours
Sunday: Open 24 hours","lodging, point_of_interest, establishment"
VIE Hotel Bangkok - MGallery,"117 39, 40 Phaya Thai Rd, Khwaeng Thanon Phetchaburi, Khet Ratchathewi, Krung Thep Maha Nakhon 10400, Thailand",4.5,13.7505658,100.5320207,"I had a great stay in VIE Hotel. The room was spacious and very well equipped incl. iron facilities. The bed was comfortable, maybe would just ask to have also some smaller pillows.
The room service worked also well and the food was quickly prepared and it was delicious.
Breakfast was the best I have ever had.
Last but not least, I had a massage  recommend to everybody!
The stay was perfect and will come back when I am in Bangkok. Great location. Easy to get to and from the airport with a train station meters from the hotel.
The hotel is luxurious, clean and the staff are friendly and helpful!
The breakfast has a great selection of food and the dinning room is lovely.
The pool was refreshing and the gym was well equipped. I thought the hotel was in a great location, close to lovely shopping centres. I only stayed one night but wish I stayed longer, and would definitely stay here again. All of the staff were so helpful and polite. Dinner at La Vie restaurant was very nice. Unfortunately we got to breakfast just before it closed so had to rush it down, but it was of a high standard, better than most other hotels We had a very positive experience at VIE Hotel. Great location in Central Bangkok, close to the main shopping centres. Easy to reach via BTS. Friendly and helpful staff.
The bed was very large and comfortable, and could've easily accommodated another person on the bed. Location was super convenient gym also had lots of equipment which was good although difficult to book for classes due to limited spaces.

Room was very spacious and clean.

Had a hiccup when we checked in but service was excellent and they resolved it promptly.

The bar food was really good, and morning breakfast buffet was up to standard.",no operation time,"lodging, point_of_interest, establishment"
Tuscany Land Resort,"Soi Song Prapha 1, Khwaeng Si Kan, Khet Don Mueang, Krung Thep Maha Nakhon 10210, Thailand",4.1,13.9235248,100.5972801,"Very affordable prices with great location. The location just behind wat Donmueng  opposite to DMK airport Song Prapa soi 1
They provided toilet items  soap, shampoo
The Breakfast is excellent

The only thing i deduct is because the sound but may be because the building material its self so it also affect the temperature during the day but if you stay out whole day it is fine. Otherwise, i would say it is perfect. For what I needed. A one night walking distance to the old dom. Airport in Bangkok... Clean quiet enough hot shower and working internet. Very cool small boutique hotel made from containers. Great value and overall the room is good but you can tell there's a smell from the bathroom. So I covered the drain for the shower and hopefully that will stop the smell. Acceptable if you're only staying for one night and need to be close to the airport.

Rooms are shipping containers with individual stairs no elevator and staff will not help you with your luggage.

Room seemed reasonably clean, except for the tea kettle which still had old water in it I never use hotel kettles anyway because they're almost always dirty and the bathroom had a strong sewage smell. There was a rip in the bedsheets that they put a tissue under to try and hide but they were otherwise clean.

There is a 500 baht deposit cash only that they require as a key deposit, which seems pretty outrageous, especially since no other hotel I've stayed at in Thailand has required this. They will refund it upon checkout.

Don Mueang Place Hotel is right down the street and 100 times nicer stay there instead. Acceptable if you are only staying for one night after before your flight.  There are dogs in the resort which will bark loudly at night, and may also bark at guests it wont be a big problem if you are okay with dogs, but if you are not that much okay with dogs, think twice.

My room is old but still acceptably clean.  Lack of privacy as the entrance is also the window for most rooms floor to ceiling glass  door.  If you open the curtains, people can see everything in your room including bed but except toilet.  If you close the curtains, then you have no light from the outside at all.   This wont be an issue for one night, but may be if more than that.","Monday: Open 24 hours
Tuesday: Open 24 hours
Wednesday: Open 24 hours
Thursday: Open 24 hours
Friday: Open 24 hours
Saturday: Open 24 hours
Sunday: Open 24 hours","lodging, point_of_interest, establishment"
Banyan Tree Bangkok,"Located in: Thai Wah Plaza Co.,LTD, 21/100 S Sathon Rd, Khwaeng Thung Maha Mek, Khet Sathon, Krung Thep Maha Nakhon 10120, Thailand",4.7,13.7236317,100.5397691,"I recently visited Vertigo Too restaurant to celebrate my anniversary, and the experience was nothing short of exceptional.

The food quality was outstanding, with generous portions and exquisite taste that truly highlighted the authentic design of each dish, from the appetizers to the main course.

There was an abundance of food, each dish beautifully crafted and delicious.

The service was excellent, with the staff demonstrating a friendly and attentive demeanor, making it one of the best luxury dining experiences I've had in Bangkok.

A special mention goes to Nu and Film, who took remarkable care of us on our special day, ensuring everything was perfect.

Their attentiveness and warm hospitality made the evening even more memorable.

I highly recommend Vertigo Too for a special occasion or a luxurious night out.

If you visit, I hope you're lucky enough to be looked after by Nu and Filmthey truly enhance the experience. Enjoy your time here!"" We came here for a special occasion and we are glad to say that this is the best experience we could ever imagine, since the beginning of our evening the stuff was on their best performance, no lies here!
Chet and Jack we highly appreciate all your effort and service made on this unbelievable day
View was perfect even on a rainy day.
Talking about service, everything is made on time, the stuff thinks about the comfort of the clients!
Good is amazingly delicious, highly recommend to try appetizers and main dishes, the desserts will surprise you too, we liked the one with lemon sorbet 
Thank you again, you made our evening memorable, especially the picture professionally taken on iPhone on a dark room
Music is not loud, which makes us able to talk and hear each other, genre is also chosen correctly. Incredible hotel overall but it is their staff that make the whole experience five star. We stayed three nights with our 7 year old child with club level access. The hotel itself is spectacular, our room was large, spacious and very comfortable. All the bars and restaurants offer a unique experience, all should be tried and the food is wonderful in each. The amenities such as the pool, gym and spa are beautiful and elegant and serve their purpose well. The club lounge drinks, food and service is second to none and the staff have nothing but smiles on their faces and want nothing but to make your experience with them the best it can be.
The personalized service, kindness and genuine interest in their guests in second to none. The team in club level looked after us in a way we didn't know we even needed. They could foresee our needs before we knew them. They cared greatly for our child and gifted her many personalized gifts that are very unique and meaningful that she will keep for many years to come. The team could not do any more to make this experience at this hotel any more special. I highly recommend this hotel and thank all that work there for their kindness. The hotel is quite nice.
Welcoming culture, the flowers, decorations, aromatics, color ensemble, everything is neat and in place.

However, the hotel seems a little older and might need a fresh up.
In our room were bugs, especially on the walls
Still not sure, what kind of bugs, very small tiny bugs.. unfortunately, we had to switch rooms, which meant packing again and was time consuming..

The staff were very friendly and helpful.
Special thanks to Annie Park, who took great care of us and was very attentive to manage the situation in the best manner possible.

Pool seemed a little smaller than expected, but I lived the Banyan tree products from the shop, which are great present items for friends and family. A Memorable Birthday Celebration on Saffron Cruise!

We recently celebrated a birthday on the Saffron Cruise by Banyan Tree, and it was an unforgettable experience. Our server, B, along with Uncle Lek, took such great care of us throughout the evening. They were incredibly attentive, ensuring that every detail was perfect, from the delicious food to the beautiful setting. Bs warm service and Uncle Leks thoughtful hospitality truly made our celebration extra special. We couldnt have asked for a better team to help make our day so memorable. Highly recommend for anyone looking for a unique and delightful experience on the river!","Monday: Open 24 hours
Tuesday: Open 24 hours
Wednesday: Open 24 hours
Thursday: Open 24 hours
Friday: Open 24 hours
Saturday: Open 24 hours
Sunday: Open 24 hours","lodging, point_of_interest, establishment"
4M Pratu Nam Hotel,"45, 6-7 Phetchaburi Rd, Khwaeng Thanon Phaya Thai, Khet Ratchathewi, Krung Thep Maha Nakhon 10400, Thailand",4.1,13.7543014,100.5375965,"The room is nice with very low prices. Located at a very convenient place that is close to everything within walking distance. Tofu skincare, platinum mall, pratunam market. Safe place. The best thing about this place is the hospitality of the owner. They truly went up and above in ensuring you get the best experience. They changed my room immediately and upgraded the room due to aircond problem. They let us rest in the lobby while waiting for our evening flight. Truly the best place. Recommended! The location is best for shopping and near to center. But the room they offer you at more than 1100 Thai Bhat is not worth the money. The room is very small and has less facilities no wardrobe, no fridge. Only the location is woth staying here. Else, the room was small. No fridge. They switch off power to your room if they realize you have left duing the day and may not turn it on once you return back. The standard room was a lil bit small but still have windows. The service was good. The location was quite far from BTS station but close to central mall complex. It surrounded with night market and food court, which was so convenient. Tye Location of our hotel is so convenient. No need to ride ehailing to Platinum Mall, central world, Big C, and Pratunam Market. Very near to key locations. I also love the place where food from street foods to restaurants are nearby. A very nice massage place are located just beside the hotel so convenient.",no operation time,"lodging, point_of_interest, establishment"
Ploykhumthong Boutique Resort,"1194/5 Soi Latkrabang 40/2 Latkrabang Road Latkrabang Krung Thep Maha Nakhon 10520, Thailand",3.7,13.7167152,100.7641792,"a little bit run down but good rooms and a garden setting. i suggest getting what they call a big room. reasonable pricing around 1200 bhat. 10 minutes from the airport 200 bhat in a cab. Literally the nicest staff of all times. I had a weird situation with my flight not being confirmed and first they let me check in well in advance, then they let me check out in the evening and come back in later if I missed my flight which I did and on top of that they let me spend 5 hours at the pool after check out.
The room was basic but cosy and everything was working fine. Bed was comfy and actually very quiet inside the room considering how close to the airport. Will definitely come back here next time in Bangkok! Fairly close to BKK airport and is easy to find. Not offering airport transfer right now but short distance taxi was easy to get. We had a budget room so quite small. The air conditioning took most of the night to cool it down. Bed was comfortable and having the adjoining private bathroom was nice. Everything was reasonably clean and toiletries and water were provided. Coffee pot and fridge in the room. A good night. Pleasantly surprised by this hotel! I was a bit scared when I read some of the previous reviews but this hotel is actually perfect if you need to stay next to the airport and the price is very competitive.
We arrived late due to a delayed flight, did our check in around 1am and then left the next day early around 5am.
Room is nice, clean, bathroom works perfectly. It was quite even if you can hear some aircraft..but since you are near the airport it is expected. Reception was perfect and smooth.
It takes around 10min by cab to reach the hotel. You will find a 7Eleven a few meters away.
I recommend 100 This hotel was perfect for my first night in Bangkok. My flight arrived at 1am so I needed somewhere close to the airport for the first night. The room was clean and cooly air conditioned. The staff were lovely and really helpful, they even help me set up my Thai SIM card the next morning!","Monday: Open 24 hours
Tuesday: Open 24 hours
Wednesday: Open 24 hours
Thursday: Open 24 hours
Friday: Open 24 hours
Saturday: Open 24 hours
Sunday: Open 24 hours","lodging, point_of_interest, establishment"
BRB Hostel Bangkok Silom,"5/8-9 Soi Pipat, Silom Rd, แขวงสีลม เขตบางรัก กรุงเทพมหานคร 10500, Thailand",4.0,13.7266184,100.5310257,"One of the best hostels I've ever stayed in.

Not a chatty hostel  quite reserved and quiet. But the facilities are really nice and clean.

Overall a 55 experience. we stayed in a private room and a mixed dorm too. Everything is not nice even we stayed the private room the smell make us very dizzy and . The bedsheet also very old and its broken so many places this woman also not nice to talk with the customers . Shoes also need take off that place very disgusting smelly . I never write bad reviews to any hotels in my life but this place make us . Stay away from this hostel. The fat lady in front desk not good . They charge extra money for the bedsheets even can remove  scars . The room is as what they described. I paid 1008 THB for 2 nights, king bed still bunk bed is spacious for 2 people. Except the smell of shoes and toilets which actually contributed by all the guests including us, then it's fine regarding the price. You have a bed in a center, the staffs are nice and helpful once you ask for help, i do not ask more for what i paid. Me and my friend are staying only one night, for me the good quality of sleeping is number one but then youll know why i give pro cons below

Pro
super convinience location
communal space
have electric kettle and cuttleries

Cons 
That isnt bed!! its based bed without Mattrass and very hard. my back as hurt as i was stay in room  102  They charge 2 times 1000 bath deposit if you stay 2 people in the room its going to be difficult with just one key.
 not having refil mineral water
 the towel one is clean one is kinda old one Very uninterested staff, when I arrived there, I politely asked to the receptionist about possibility for early checkin, she said no, fully booked last night, immediately even before thinking. Bedding was reallystained yellow all over the pillow, oh well they put the pillow into the pillowcase 2hrs later I checked in. Staircase on the ground floor smells like a cat litter box, shower was almost about to flooded when I took a shower. Only pros of this hostel would be affordable price and location I guess.","Monday: Open 24 hours
Tuesday: Open 24 hours
Wednesday: Open 24 hours
Thursday: Open 24 hours
Friday: Open 24 hours
Saturday: Open 24 hours
Sunday: Open 24 hours","lodging, point_of_interest, establishment"
Sawatdee Guesthouse the Original,"71 Thanon Si Ayutthaya, Khwaeng Wachira Phayaban, Khet Dusit, Krung Thep Maha Nakhon 10300, Thailand",4.4,13.7719374,100.5035607,"Sawatdee Guesthouse is a family run hotel with lovely staff who are always there to help. The room was nice and cozy and the fan was just enough to keep us cool.
Would definitely stay again when we next return to Bangkok, would definitely recommend. Cleanest hostel we have ever stayed at! Staff is kind as well. Hostel cafe also had plant based milk options and was delicious. Great experience for 3 nights in Bangkok! Great place to stay in Bangkok. The staff are very friendly and the cafe attached to the hotel is great for breakfast. Only downside is the distance from the city attractions. However we were able to get grab rides to go there Fun and cozy Hostle style housing. Our room was cozy and clean. Beautiful carved furniture with King size bed. Shower with warm water, toilet and sink with air conditioning and free WiFi. Bathroom came with 2 mini bars of soap, toilet paper and 2 mini shampoos. We felt welcomed. Main Staff is friendly, kind and speaks good English. Private room with AC was fine. Not a social vibe here. Host was very insistent I provide a five star review right there and then in front of here.. coupled with the high price I wouldn't stay there again","Monday: Open 24 hours
Tuesday: Open 24 hours
Wednesday: Open 24 hours
Thursday: Open 24 hours
Friday: Open 24 hours
Saturday: Open 24 hours
Sunday: Open 24 hours","lodging, point_of_interest, establishment"
HEYYYY BANGKOK,"2485 Phatthanakan Rd, Khwaeng Suan Luang, Khet Suan Luang, Krung Thep Maha Nakhon 10250, Thailand",4.7,13.7359932,100.6394542,"This hostel exceeded my expectations! There are a few adorable cats in the shop, which make the place feel really cozy. The environment is very quiet, and theres no noise at night, making it perfect for a restful sleep. Privacy is great, with curtains for each bed, so you wont be disturbed. They also provide lockers for storing valuables, which is a thoughtful touch. The space is clean and comfortable, and considering the price, its definitely great value for money. Highly recommend! I consider myself lucky to have picked this place. Most convenient is that they offer luggage locker the size of a large backpack, with an extra tray on top for commonly used stuff. It was nice to leave my backpack there while I adventured. Also the locker key ring has a keycard to open the front door after hours. The bunk area is Extremely quiet and they have curtains in each bunk for complete privacy. Light and outlet in each bunk too. Showers and bathrooms were cleaned everyday, and each day I noticed someone sweeping and taking care of the floors. It is an amazing place, and their dedication and service is beyond compare. Good WiFi too. The cat is cute also. We've had a lovely 3 night stay here in both the king size bedroom and the 2bed bedroom. We got the first room by mistake and had to switch on the second night, but the host apologized a lot and gave us free coffee. Both rooms were clean and nicely decorated. The shared bathrooms were also fresh. Staff was super friendly and accommodating. Overall a really nice stay for a good price, highly recommended!
P.s great curry Good hotel The bedroom is clean, the price is reasonable, and the staff is friendly. Good safety. The food is clean and delicious. The drinks are tasty. Have Halal food. Near Suvarnabhumi Airport, near the airport link to Suvarnabhumi Airport. Fantastic halal cafe and hostel. The food was tasty. The service was great. Prayer room was provided. Parking was scarce.","Monday: 10:00 AM – 8:00 PM
Tuesday: 10:00 AM – 8:00 PM
Wednesday: 10:00 AM – 8:00 PM
Thursday: 10:00 AM – 8:00 PM
Friday: 10:00 AM – 8:00 PM
Saturday: 10:00 AM – 8:00 PM
Sunday: 10:00 AM – 8:00 PM","cafe, lodging, store, food, point_of_interest, establishment"
