이름,주소,평점,위도,경도,리뷰,영업시간,카테고리
Rest@Ratchada hotel,"252/3 Thanon Ratchadaphisek, Khwaeng Huai Khwang, Khet Huai Khwang, Krung Thep Maha Nakhon 10310, Thailand",4.3,13.7852611,100.5762557,"I had stayed in RestRatchada for 2 days and I would say that this was the best Hotel I ever stayed. Everything in the room was present. The room was clean and bing and had all the facilities in a very affordable price. I would definitely recommend this Hotel Excellent budget hotel! The rooms are a little dated, but very clean and spacious. The WiFi worked well enough for video calls.  The staff friendly and check in seamless. It's about 10 mins walk from Sutthisan MRT station from where you can take MRT to Airport Rail Makasan, Asok or further to Chinatown etc. There is a market on the way from MRT to the hotel where you have a lot of street food selection and no tourists so you get local experience. The market closes quite early though, around 830pm, as it mostly seem to cater to office workers around. We stayed at this hotel and it was a pleasant stay. The rooms are very good, spacious, clean and comfortable. They have a king size bed and one small bed or bed of kids or can say a sofa for sitting and putting your items over there.
The washroom is also very clean and has 24 hour water facilities. From the room window, you can see the big buildings of Bangkok any time.
The staff is very helpful, Miss Pat and Miss Eye helped us in finding the right local train and bus to reach the Chao Paya River.
They have water dispenser as well, so if you need hot water, cold water or warm water, you can take it from there. Although they provide you water bottles in the room and electric kettle but still if you need more water, use a dispenser.
The location is very good and it is very close to the Suttishan MRT. Easily you can take a Grab or Bolt ride as well as a local bus  train ride.
The more appropriate location is the Meung Thai Life Insurance building and near Cafe Amazon.
Best way to reach 
Take the train from the Airport, reach Makkasan, then move to the MRT station using over bridge, take a train to Suttishan and then walk and reach Restratchada.
My recommendation  if you need budgeted hotel, I would say RestRatchada Hotel. I stayed 2 days quiet place at night which I really liked
the staff behind the desk are great
which even made it better place to stay
good place to stay at a very reasonable price Service is good , but have many Muslim, very dangerous, afraid","Monday: Open 24 hours
Tuesday: Open 24 hours
Wednesday: Open 24 hours
Thursday: Open 24 hours
Friday: Open 24 hours
Saturday: Open 24 hours
Sunday: Open 24 hours","lodging, point_of_interest, establishment"
Amara Bangkok,"180, 1 Surawong Rd, Khwaeng Si Phraya, Khet Bang Rak, Krung Thep Maha Nakhon 10500, Thailand",4.4,13.7290243,100.5274582,"We had a very nice stay at this hotel. We were upgraded to one of the Club rooms which was huge, with big bathtub with very nice views of the city which after a long flight from Japan was a plus. The staff were really friendly. The location is close to a street food street where we could have something to eat even after arriving quite late at night and well connected with public transport with other main tourist spots and airport.We would recommend this hotel if visiting Bangkok. The room was clean and comfortable, with a nice 120degree view of the cityscape.

Service was impeccable and the staff really go the extra mile to please you.

Location is good, with nice restaurants in the vicinity. If not for the occasional terrible traffic jams in Bangkok! Staff very friendly and helpful. Location good as most popular destinations are a short taxi journey. Room very clean and service was great  especially June, Cream and Sandy who were very welcoming throughout our stay. Would recommend The hotel is lovely, but what really makes it special is the amazing staff, especially Champ and June. They made my stay so welcoming and enjoyable. I highly recommend Amara Hotel for anyone looking for a friendly and unforgettable experience. Ill definitely be coming back! I had an amazing time at the Amara Hotel in Bangkok! The staff was extremely polite, helpful, and nice. Even tho I checked in as a backpacker, they didn't treat me any different from the other guests. The rooms are big, clean and have an amazing view!! I can recommend it to everyone who travels to Bangkok and prefers nice hotels!","Monday: Open 24 hours
Tuesday: Open 24 hours
Wednesday: Open 24 hours
Thursday: Open 24 hours
Friday: Open 24 hours
Saturday: Open 24 hours
Sunday: Open 24 hours","lodging, restaurant, food, point_of_interest, establishment"
The Salil Hotel Riverside - Bangkok,"2052, 7-9 Soi Charoen Krung 72/-1, Khwaeng Wat Phraya Krai, Khet Bang Kho Laem, Krung Thep Maha Nakhon 10120, Thailand",4.8,13.7079308,100.5073483,"I loved everything about this cute little hotel.  I was surprised to learn it's only been in operation a couple of years.  However, it gives off 5 star energy.
My wife and I stayed here for 4 nights and had ZERO issues with the staff or its facilities.
But here's my suggestions
1.  You can't charge the room if you want bar or food service like other hotels.
2.  I wish the concierge had better travel options for tours.
3.  While the shuttle boat was terrific, I wish the shuttle van service was available all week long and to more locations and for pick up, not just drop off.
4.  The pool... I wish it didn't look like I was swimming in a fountain, lol.

Still, my wife and I were very happy with this place and will most likely return with our kids.

I highly recommend this place to anyone seeking worldclass treatment at affordable prices. Mint, she is awesome who works over time to provide a spectacular Thai Dress photo experience.  We had such a great time and she is very patient and pleasant during the whole process. From beginning of putting on the dresses and walked us out to pool and river side for perfect backdrop. We took so many great pictures. Complementary service from hotel has never been so excellent.  I love it. Lacking 5star details!

Checkin they failed to inform about a 30minute complimentary foot massage, luckily I went to the spa a day before my appointment when they informed me of this.

Room generally ok, clean, bright...but slightly paranoid throughout the stay of having my curtains completely open, rooms across  can look into each others rooms, bathroom too. The basin was very small, hardly any space to store your toiletries, the cabinet door below, nothing there  just a hollow space. Toilet seat, seemed very small, not your average size. Shower floor extremely slippery, that's got to be fixed!

Service for a 5star hotel in Bangkok and having stayed at many of the bigger 5stars, the level of English was pretty poor, had to repeat myself several times to many staff  even asking basic things. Getting a towel by the pool, then get asked for your room number, fine  I got back 30 seconds later for an extra towel, get asked for room number AGAIN and name...
I asked for a glass of ros and someone comes over with a menu. I ask for a sparkling water and someone comes over with a menu  all seems a bit ""difficult"". Several staff do not know the property  again lack of English, but asking basic directions to certain restaurants for example seemed to be difficult and had to ask 3x different staff, not acceptable.

Mobile App several technical issues throughout stay and although communication through app was generally efficient, I was addressed as Mr.  you have my record, you know I'm not a Mr. Again, details.

Room service somewhat disappointing offer  so many menus across the property, but small selection for room service only. Also, why no breakfast room service available? Pretty standard for a 5star hotel.

Pool DJ in afternoon...don't have a DJ play and then leave the background music on  speakers behind the loungers poolside. Listening to 2 different types of music is very annoying. I had to mention this to staff to fix.

Spa THE highlight of this hotel, superb! Soundproof rooms, great massages and facials, excellent service and friendly.

Overall If you're looking to pay a little less for a 5star and don't mind certain details lacking then this is a great spot. Based on this visit, I will not return here. very good place to rest. they have very good facilities, the design of the hotel and the room is very eye pleasing. the breakfast provided is quite good but it is a bit unfortunate that there are not many choices of original Thai food. very good for a family vacation.

special shoutout to the staff named Bew. She is very kind and accommodating. from checking in to helping to provide a special free photo experience in traditional Thai clothes. even with a sudden request she is happy to help and take good photos! She also helped when we left our room cards in the room.

we will definitely come back when we travel to Thailand again. I'd like to highlight some of their services. The Thai Dress photoshoot. The lady was super nice! I gave her 10 out of 10.

Their boat service is also benefit to those planing to go to some touristy spots.",no operation time,"lodging, point_of_interest, establishment"
"Mandarin Hotel Bangkok, managed by Centre Point","662 Thanon Rama IV, Khwaeng Maha Phruttharam, Khet Bang Rak, Krung Thep Maha Nakhon 10500, Thailand",4.4,13.7331487,100.5271586,"Rooms clean and comfortable. The service staff were conscientious about cleaning the room daily.
Service beyond expectation. We did not have an electrical converter and called the concierge. A service staff brought 2 to our room within 5 minutes.
Food The breakfast buffet boasted a huge spread. And there were daily variations to the food in the buffet, something we do not find in some hotels in South East Asia.
Convenience The hotel was right opposite a mall, which made shopping and food extremely convenient. There are 2 convenience stores on the left of the hotel as well as a Starbucks. So good! We originally booked another hotel turned out to be more of a hostel but wasn't in a location we liked, so we were able to book the Mandarin last minute for 3 nights at a very good price late Sept. Rainy season and moved. Wonderful, beautiful upscale hotel. Great service, location on a main street with restaurants and shopping to walk to. Porters for luggage and transportation help, great breakfast buffet for anyone's choices. My only issue was the hair dryer. You have to hold down the power button the whole time using it I'm sure it's a safety feature and on high temp it quits after a minute of use. I would recommend and stay here again if the opportunity arises. Enjoyed and loved our stay in this hotel. The hotel has great service and is spacious inside. The rooms are a little bit outdated but it gets the job done. The beds are comfortable. There is a premium Lets Relax Spa in the lobby of this hotel which is great if you need to relax after a long day of shopping. The hotel has one way service also to certain areas and attractions Overall extremely nice. Disliked being charged for ice! You feel clean as the maid service was great. Location to the MRT train was fantastic. Close to two malls for any items you need, minutes walk away. I recommend this hotel with a solid 4.5 to 4.7 rate out of 5. We have arrived to Bangkok for one night stay connection flights
We decided to stay in the central of the city.
We chose location and Mandarin was the right place,
We chose quality and Mandarin Did Not disappoint  us,
We chose Mandarin from our experience in hotels around the globes and not around the price.
We were delighted with the service the minute we have arrived to the hotel.
Staff are very professional and polite.
Front desk assist us the seconds we arrived to the desk,
Our room was ready to go in 2 hours before we were due1400 it was a big plus since we only had only 24 hours in the capital.
Room 949 was very clean and refreshing after a long flight.
The following day we were told that we can check out later then usual which was helpful however we wanted to check early do we could take a tour of the town.
We would like to thank the call Concierge staff the lady in the front desk and everyone else who was eager to assist.
Free shuttle to the Siam Paragon was great curtsy of the hotel.
And since it was a low season we got our room for fraction of the price. Highly recommend 1010",no operation time,"lodging, point_of_interest, establishment"
Bangkok City Inn,"43/5 Rajdamri Road Khwaeng Lumphini, Pathum Wan, Bangkok 10330, Thailand",3.5,13.7486888,100.5416279,"The corridors are clean and shiny. The rooms are in  satisfactory. However the lobby hall looks outdated . Consider renovating it with modern design to create a fresh atmosphere and enhance  the  guest experience, making them feel proud to stay at the hotel. Bangkok City Inn is all about location. Situated near CentralWorld and Pratunam Market, its perfect for shopping enthusiasts. However, the hotel itself is quite average. The rooms are basic and a bit dated, offering just the essentials. The service is fine, but nothing exceptional. If youre looking for a nofrills, budgetfriendly place to crash after a day of exploring, it does the job. But dont expect luxury or modern amenities. Overall, its a decent choice if location is your top priority. 3 stars. Good location. Hot shower is good. Thought there's a bathtub. Breakfast was OK for the price. Good location but nearby was a bit dodgy massage place. Its just a old hotel around the area which is super convenient for people like to shopping around Platinum and Pratunam DayNight market. However, the rooms are not very clean as we found some tiny cockroaches coming out of nowhere. Other than that, hotel staff are very friendly and helpful. With tight budget, this hotel will suit ones needs if you dont mind some shortcomings in cleanliness. Good to stay.
But no toilet spray
and no breakfast if you booked from Agoda.","Monday: Open 24 hours
Tuesday: Open 24 hours
Wednesday: Open 24 hours
Thursday: Open 24 hours
Friday: Open 24 hours
Saturday: Open 24 hours
Sunday: Open 24 hours","lodging, point_of_interest, establishment"
The Davis Bangkok,"88 Soi Sukhumvit 24, Klongton Khet Khlong Toei, Krung Thep Maha Nakhon 10110, Thailand",4.1,13.7209618,100.5660131,"My husband and I have had the pleasure of staying at the Davis Hotel multiple times, and it never disappoints. The hotel has a charming, oldschool feel, yet its impeccably maintained. The rooms are generously sized, making for a comfortable and relaxing stay. Despite the presence of a nightclub on the lobby level, the soundproofing is excellentyou cant hear a thing from the rooms.

The hotel is located on a lovely street lined with several charming cafes, and its just a stones throw from the malls, making it a perfect spot for both relaxation and shopping. The staff at the Davis are incredibly friendly and always ready to help, which adds to the warm atmosphere. One of our favorite features is the rooftop pool, which is both charming and full of character. Its the perfect spot to unwind. We look forward to our next stay at this lovely hotel. Highly recommended! Very bad service. My friend in Vietnam forgot her airpod while she stayed here a few days.

But the hotel wasn't having a service to store  keep it safe. I ended up back and forth to ask for my friend airpod. The first time I was here, they said that it's too late and had to come next time, not mention about making appointment. The second time I was here, they said why I didn't make appointment. It took me 40' to wait and the receptionist kept telling me to wait for what and don't lemme know the ETA?

 If you have a good system to store things, this issue will not happen.
 On top of it, they didn't agree to support to send the airpod home.

Very shady and not trustworthy. It is a nice hotel with a busy architecture from an old building. It made finding my room an adventure. It was a busy hotel but the park where it is located has a good atmosphere. The breakfast was a typical buffet which didnt impress me and the bar at night was quite busy and a bit pretentious.  Staff attending the bar not very friendly either, but by contrast the recepcionista were quite nice and went out of their way to help The receptionist at the hotel is very rude and treated the customers that we cant afford the rooms. Give us annoyed face when we asked the questions about breakfast. She replied all the questions we asked in a very rude way. I talked to the manager and she said sorry only. The hotel should give the better training to the staffs. Me and my family are in Thailand for vacation and it doesnt deserve the money to stay at Davis Hotel. We got annoyed and terrible experience while we are here because of what happened. The hotel doesnt even take the proper action about how their staffs are treating to their customers. Really terrible service!!!! The toilet, shower room and drainage are terrible, which is hard to believe for a 4star hotel. I was worried it would overflow. I stayed there for 2 weeks and it was dusty and not well cleaned. There was always something forgotten, like toilet paper or a bath mat. The only good thing was that there was a cheap and delicious Peking duck restaurant nearby.","Monday: Open 24 hours
Tuesday: Open 24 hours
Wednesday: Open 24 hours
Thursday: Open 24 hours
Friday: Open 24 hours
Saturday: Open 24 hours
Sunday: Open 24 hours","lodging, point_of_interest, establishment"
Retro39 - Hotel in Bangkok,"1, PHJC+86W, 10 Soi Sukhumvit 39, Khwaeng Khlong Tan Nuea, Watthana, Krung Thep Maha Nakhon 10110, Thailand",3.6,13.7308149,100.5705184," SCAM WARNING  Retro39 and its employees are a disgrace to Thai culture and buddhist tradition

As a longterm expatriate residing in Thailand for over five years, I have come to love and respect the rich culture and warm hospitality that this country offers. However, my recent encounter with Retro39 has drastically tainted this image, showcasing a level of fraudulence and unethical behavior I've never experienced before in Thailand.

I initially booked a 9night stay at Retro39, drawn by their seemingly appealing facilities and location. However, due to unforeseen changes in my schedule, I needed to modify my reservation. This is where the nightmare began. Despite the hotel appearing mostly vacant, the staff refused to accommodate any changes to my booking. In an attempt to resolve the issue, I cancelled my reservation with the intention of rebooking. Shockingly, once I cancelled, they barred any rebooking options, refused to undo the cancellation, and, most astoundingly, retained the full 400 payment without providing any services or a room.

So to summarize  I was charged for 9 nights, and then after cancelling and trying to rebook, they decided not to give me anything, they didn't want to give me any nights, or none of the money back, so I was left without a room AND without the money.

After talking with Booking.com about this which they agreed was completely outrageous, they said they have nothing they can do, and I need to work directly with the property.

Faced with this blatant scam, I reached out to various avenues for help, including the local police and the Thai embassy, both of which have now initiated a thorough investigation into the property. My suspicions about the hotel's integrity deepened given the presence of a drug store within the building's premises, hinting at potentially more sinister undertakings possibly even linked to criminal activities.

The unprofessionalism didn't stop at just their booking policies. The staff's behavior was juvenile and dismissive throughout the ordeal. They demonstrated a complete lack of empathy and professional conduct, which is not only disappointing but alarming, considering they are part of an industry that significantly contributes to the countrys image and economy.

This establishments fraudulent practices seem to be a recurring theme, as evident from numerous similar complaints by other guests. These include unauthorized charges, refusal to issue refunds, and a general lack of accountability. Their responses to online reviews are superficially polite, yet consistently deceptive, further indicating their manipulative tactics.

To potential visitors, I strongly recommend steering clear of Retro39. The risk of falling prey to their scams far outweighs any potential benefits of a stay. This hotel is a disgrace not only to Thai hospitality but also to the peaceful and ethical principles of Buddhist culture that Thailand is renowned for. Their actions reflect a deepseated greed and moral bankruptcy that should prompt serious introspection among the management and staff.

As a parting note, I've attached screenshots of my conversations with the property, which serve as indisputable evidence of their deceptive practices. Let my unfortunate experience serve as a cautionary tale to all. It is disheartening to see such an establishment operate, and I sincerely hope that justice through legal and social avenues will soon put an end to their unscrupulous operations. Thankfully, karma has a way of addressing such gross misconduct.

BEWARE OF HARRY AND THE THAI GIRL THAT WORKS IN THE PROPERTY  I pray they will make peace with god, and understand that the path they are taking goes against Thai and Buddhist culture

EDIT As per the business responses  I added proof of their 400 charge on my card and removed an image of their employee  their response at the end can prove to you that they and cannot take valid critizism, and automatically resort to the fact that its ""defamation"" and ""hate speech"" shows you what type of business they really are. If you want a no frills hotel in the heart of Sukhumvit at a cheap price this is the best choice!

This hotel basically functions as a place to sleep and not much more. Rooms were clean. Location was actually pretty quiet considering how much is around it. Hotel staff were friendly. 2 minute walk from BTS station, shopping malls, and tons of street food vendors.

Some cons Bed was very firm I like firm beds, but this was too firm. Has AC but it can struggle to keep up during summer.

Highly recommend if you want to be in the thick of things on the cheap. Noise 24 hours, old dirty towels and bedding, hard bed. Nothing worth , only good thing is its near  Emporium
No lobby, never allowed you to check in before 200 pm A very basic hotel at a super convenient location. Room is simple but nice. Hot water is good. Great location to start ur exploration in bkk. Do note, there's a Cannabis store right infront of the hotel, so it not a ideal location for family with kids. In this hotel, there are only two pros 1 its proximity to the metro and a very good shopping center, and 2 initially, the cleanliness is perfect. However, during the three days of our stay, the room was not cleaned at all. One of the drawbacks is its location on a very noisy street. Even in the deep night, there is no silence here. The noise from the hotel neighbors is also perfectly audible. Opening the window is impossible because locals barbecue meat all day below, and the smell goes straight into the rooms. Consequently, there is no fresh air either.

Upon checkin, they take a deposit of 1000 baht. When checking out to retrieve the deposit, the hotel staff goes to check your room to ensure you haven't stolen their kettle, towel, or anything else. This entire procedure takes a lot of time, so keep that in mind when checking out. Frankly, we encountered such nonsense for the first time.

But in this area, it's difficult to find a clean hotel with a window at a reasonable price. So, I can still recommend staying here. However, if the location is not crucial for you, by moving 1015 minutes into the depths of Bangkok away from the center, you can find a much better hotel for the same money, with breakfast included, or even cheaper.","Monday: Open 24 hours
Tuesday: Open 24 hours
Wednesday: Open 24 hours
Thursday: Open 24 hours
Friday: Open 24 hours
Saturday: Open 24 hours
Sunday: Open 24 hours","real_estate_agency, lodging, point_of_interest, establishment"
