title,chunked_description,postdate
오사카 근교 가볼만한곳 일일버스투어 와쿠와쿠 내돈내산 ,오사카 여행 계획 이번 오사카 여행 꼭 곳 바로 고베 오사카 아리마 온천 전경 금탕 이동 핫 탄산 센베 동네 제일 탄산 센베,20240918
8월말 비수기 삿포로 3박 4일 여행,교토 오사카 삿포로 뭔가 사람 제일 느낌 쇼핑 때 오 도리 공원 숨 일본어 척 다행 저녁 숙소 길 오 핫 발견,20240918
5년만에 극적 상봉한 Andrea와의 만담,건대 핫 만큼 식당 인생 컷 류작 그 중 뽀짝해 스페인 교환학생 때 얘기 멕시코 한국 문화 차이 얘기 다음주 오사카 또 여행,20240918
오사카 뭐라도 좀 남겨봐야지 싶어 남기는 패키지여행기,한국 오사카 해자 안팎 개 후루룩 도 도미 것 거의 세계 핫 듯 평일 정도 날 날 아랑곳,20240918
여의도 이자카야 분위기 좋은 룸술집 시카바단단,여의도역 이자카야 핫 시 카바 여의도 점 여의도역 은근 이자카야 것 오사카 야끼소바 도미 머리 조림 얼 바지락 술찜 한우 스 조림 차슈 철판 구이,20240918
서울 잠실 롯데월드 자유이용권 티켓 가격 할인 구매 ,데이트 핫 플로 기능 잠실 곳 추천 베테 여행 작가 활동 세계 각지 테마 파크 방문 인 올해 해도 오사카 유니버셜 스튜디오 도쿄 디즈니랜드 도쿄,20240918
오사카 후지야 호텔 Osaka Fujiya Hotel AGODA 아고다 ,오사카 숙소 호텔 추천 여행 추천 오사카 여행 호텔 리뷰 여행 스타 그램 호텔 투숙 기 오사카 관광 호텔 디자인 여행사진 오사카 여행 팁 호텔 숙박 여행 에세이 오사카 핫 호텔 투어 오사카 숙소 추천 후지야,20240918
오사카 신사이바시 아티 인 Osaka Shinsaibashi Arty Inn ,호텔 추천 여행 추천 오사카 여행 호텔 리뷰 여행 스타 그램 호텔 투숙 기 오사카 관광 호텔 디자인 여행사진 오사카 여행 팁 호텔 숙박 여행 에세이 오사카 핫 호텔 투어 오사카 숙소 추천 신사이바시 호텔,20240918
오사카 비즈니스 호텔 니세이 Osaka Business Hotel Nissei ,호텔 추천 여행 추천 오사카 여행 호텔 리뷰 여행 스타 그램 호텔 투숙 기 오사카 관광 호텔 디자인 여행사진 오사카 여행 팁 호텔 숙박 여행 에세이 오사카 핫 호텔 투어 오사카 숙소 추천 니 세 이 호텔,20240918
암요 하루전에 표끊어서 일본가는 거보면 회피형이 맞는거겠죠,연어 다시 오사카 때 여기 저기 바루 핫 함바 그 맛집 저 브레이크 타임 쯤 대기,20240918
오사카 여행_난바 파크스 맛집 모츠나베 오오야마,난바 파크스 맛집 모츠 베 야마 위치 난바 파크스 F 난바 파크스 점심 모츠 베 야마 체인점 요긴 입구 모습 매장 분위기 쯤 방문 손님 거의 한국어 F,20240918
망원데이트 핫플 기린생맥주와 야끼교자가 있는 미스타교자 ,오늘 댕뇨 커플 자주 방문 레전드 가성 비 술집 일본 중화요리 이자카야 망원 데이트 핫 플로 래서 일본 오사카 도쿄 후쿠오카 여행 때 중화요리 식당 느낌,20240918
찐 오사카같았던 사당역 대표 이자카야 토모 재방문 후기,오사카 이자카야 온 것 실내 안주 맛집 전 쯤 이자카야 토모 카페 오 거북이 수프 링 등 사당 감성 핫 지역 차로 가기 위치,20240917
오사카 가볼만한곳 아메리카무라 스트리머커피컴퍼니 카페,오사카 여행 기록 오사카 여러 번 처음 아메리카무라 또 막상 느낌 기도 난바역 수 빈티 옷가게 곳,20240917
240324 오사카 오꼬노미야끼 맛집 강추 후쿠타로  도톤보리 ,역시 핫 닷 사이 오사카 나고야 어디 서도 구 수 지금 가격 좀 물량 박 나고야 amp 오사카 여행 빙자 쇼핑 끄읕 gtlt 간만 온 일본 역시 amp gtlt,20240917
,국내 세계 핫 맛집 취미 헬로 내 여행 메이트 오늘 정말 주제 해외 라면 일본 오사카 타코야끼 추천 거기 바로 타코야끼 한국 것,20240917
여행으로 채우는 결핍,지역 핫 반드시 가야 문화 요 물건 소유 것 경험 소유 아이폰 이후 여행 도 오사카 교토 고베 교토 곳,20240917
교토걸,오사카 여행 차 교토 걸이 아라시 야마 치 나무숲 향 길 오늘 해 일본 음식 것 나무숲 신사 발견 교토 핫 신사 신사,20240917
자유여행 일정 마스터 프렌즈 오사카 솔직후기,오사카 여행 항공권 우리나라 가장 선호 관광지 오사카 일본 정말 한국인 핫 도착 순간 한숨 어쨋 방지 수 진짜,20240917
오사카,이번 오사카 여행 비행기 예매 일본 지진 발생 전 뉴스 역대 대지진 것 다음 핫 이동 때 차 시비 발생 난 분명 길막 안 한쪽 신호 일본인,20240917
오사카여행_우메다 오코노미야키 맛집 사쿠라 너무맛있어,오사카 우메다 맛집 사쿠라 Sakura 오코노미야키 amp 야끼소바 우메다 역 발견 사쿠라 사실 근처 우동 집 금일 휴업 여기저기 뭔가 맛집 스멜 Sakura amp,20240917
광주 첨단 감성 일본식 술집 이자카야 오이시호르몬 불꽃,핫 거리 조금 골목 위치 일본 외관 눈 오사카 오뎅 꼬불 오뎅 떡 오뎅 등 가지 종류 오뎅 술 한잔 더,20240917
낮과 밤의 분위기가 달라지는 성수 맛집 카린지린가네스낵바 ,바로 시작 바로 서울숲 핫 quot 카린 스낵바 성수 본점 quot 내부 일본 느낌 인테리어 도쿄 오사카 복판 선술집 분위기 생방송투데이 방송 맛집 quot quot,20240917
일본 오사카 유니버셜 스튜디오 재팬 입장권 가격 할인 예약 꿀팁,일본 오사카 유니버셜 스튜디오 재팬 입장권 가격 할인 예약 꿀팁 다음 달 동생 일본 여행 가면 요즘 유니버셜 스튜디오 재팬 핫 바로 닌텐도 월드 게임 속 세상 온,20240917
용산 이색데이트 맛집 일본감성 분위기에서 하이볼을 즐길 수 ,곳 일본 오사카 자 곳 오늘 제 방문 용산 삼각지 핫 파친코 주소 도로명 서울 용산구 한강대로 길 지하 층 지번 한강로 호선 신용산역 번 출구 m m,20240917
트립닷컴 트립모먼트 여행기 올리고 할인 포인트받자,후쿠오카 오사카 그 외 홍콩 마카오 대만 발리 등 글로벌 국가 여행기 우리나라 오토바이 여행 핫 인피니티 풀 분위기 등 컨셉 카테고리 별로 포스트 수,20240917
부산가볼만한곳 요즘 핫플 쇼핑은 신세계사이먼 부산 프리미엄 ,요즘 핫 히트 뚜 신세계 사이먼 부산 프리미엄 아울렛 리뉴얼 새 단 장해 미니 유니버설 스튜디오 오사카 달 포토 존 인생 샷 미니 인증샷,20240916
특별한 일상 추석편,곳 집앞 일본 늘 사람 핫 속초 동경 오사카 글리코 상이 속초 오사카 이 밍 별로 엄마 언니 나 셋 인 메뉴 세 개,20240916
구월동이자카야 구월동핫플 하나마토구월점 감성적인 분위기에 ,구월동 핫 구월동 오뎅 바 하나 마토 하나 마토 구월 점 구월동 응 예전 오사카 여행 때 음식 맛 안 재료,20240916
교토여행 day1,오사카 교토 티켓 발권 어쩐지 왜 시간 승무원 핫 가성 비 곳 생각 큰일 여행 후 크게,20240916
서울술집  루프탑이 있는 압구정로데오술집 quot난바스낵quot,취할 요 소리 저희 메뉴 난 반 치킨 오사카 난바 지역 스낵 압구정 핫 오늘 그 이유 감성 공간 안주 음악,20240916
분당 서현역 생마차 내돈내산 솔직 후기일본 술집 느낌 낭낭,일단 요즘 핫 사람 테이블 링 웨이 팅 오락실 앞 내 오사카 지하상가 맛 담 야끼소바 너 어어,20240916
오사카에는 중국인이 너무 많아,혼자 키키 오 사 커피 데 여기 핫 웨이 팅 포기 오사카 커피 오사카 카페 가기 공항 중 일찍 도착 과자,20240916
시흥사거리 이자카야 쏘시지요 2차 술집 추천,닭 날개 튀김 오사카 가격 혹 왕창 곳 사람 내부 보지 못 여기 시사 핫 노 키즈 아가,20240916
광안리포차 압구정편의점  부산시 오사카구 포차감성 술집,신상 핫 또 제인 호소 못 예 광안 리 포차 바로 읍 도톤보리 오사카 안 여기 도톤보리 뭐꼬 담 또 법규 이 글 업체,20240916
2491013 3박 4일 오사카amp교토 여행기  1일차,메인 더더 더 핫 진짜 사람 엄마 엄마 손 꼭 잡고 도톤보리 도톤보리 강 amp 구 리코 네온 매우 사람 평생 볼 사람 여기 듯 정말 이 곳 오사카 amp,20240916
성수 맛집 카린지린가네스낵바 성수본점 이색적인분위기속 ,서울숲 핫 플로 워낙 곳 피크타임 사람 웨이 팅 뚝섬 도쿄 오사카 복판 선술집 분위기 바 테이블 형식 좌석 인,20240916
UH 스위트 더 강남 호텔 서울 자쿠지 호텔 숙소 UH SUITE ,지점 일본 오사카 개 지점 UH Suite The Gangnam UH 스위트 더 강남 강남역 거리 위치 강남역 핫 메인 거리 위치 배달 음식 주문 가능 근처 맛집 UH Suite The Gangnam UH,20240916
오사카 도톤보리 여행 리버크루즈 구경 2박 3일 주유패스,오사카 도톤보리 유명 핫 도착 사람 촬영 리버 크루즈 주변 이 때 날씨 서울 수준 평소 국내 야외 활동,20240916
대구신매광장 핫플 신상맛집 오렌지봉봉 펍술집,조만간 오사카 간다 팻두 오사카 로맨스 신청 노래 정말 띵곡 혹시 구 신 매 광장 핫 신상 맛집 오렌지 봉봉 펍 술집 구 신 매 광장 핫 신상 맛집 오렌지 봉봉 펍 술집 술집,20240916
내돈내먹일본 도톤보리 갬성 낭낭한 대전 둔산동 이자카야 ,핫 대전 어쩌면 노잼 도시 문 갑 일본 정신 배친 것 나름 색감 배열 소품 오사카 그 감성 테이블 인,20240916
쏘시지요 동대구점 일본식 이자카야 닭날개 990원 솔직후기,오픈 핫 이자카야 구점 방문 돈내 솔직 후기 일 목 라스트 금토 라스트 주차 불가 단체 이용 가능 오사카 느낌,20240916
압구정도산공원핫플 가마쿠라 일본전통디저트 와라비모찌상륙 ,떡 데 오사카 교토 명물 도쿄 가마쿠라 명물 comnccr 압구정 핫 도산 공 원 핫 가마쿠라 일 전통 디저트 라비 모찌 고사리 전분 comnccr,20240916
서산일식집 오마카세 예천동핫플 quot리보quot,예천동 핫 요즘 일식집 분위기 분위기 정말 제대로 스시 오 마카 세 서산 일식집 리보 부부 운영 분다 일본 오사카 아베 노 츠지 조리사 전문학교,20240916
오사카교토 당일치기 여행지 루트 추천  기요미즈데라 ,오사카 고베 하루 자유시간 당일치기 교토 일본 교토 전통 가옥 지은 스타벅스 핫 핫 가옥 현대 카페 느낌 한번,20240915
부산 아이와 가볼 만한 곳 신세계사이먼 부산 프리미엄 아울렛,배 확장 여 개 브랜드 추가 런칭 부산 프리미엄 아울렛 요즘 핫 무려 포토 존 인생 샷 유니버설 스튜디오 오사카 당첨 선정 이벤트 진행 중이 미니,20240915
일본 규슈 여행  가고시마 가볼만한곳 텐몬칸 쇼핑,형태 오사카 도톤보리 보시 규슈 여행 기간 텐몬칸 방문 여행 핫 텐몬칸 거리 사람 마치 새벽 모습 요즘,20240915
오사카 워홀러의 나고야 여행기  1일차,오사카 나고야 버스 버스 것 껄껄 껄 최고 핫 추정 이자카야 나 어디,20240915
블챌일상 9월 2주차 강씨s 라이프,오사카 여행 강씨 김 수 없쥬 야근 강씨 돈 움 그냥 핫 못 분위기 진짜 도시 속 고요함 다른 세상 온 거 문 하나 분위기,20240915
오사카 여행 1편,스페셜 시작 오사카 여행 레쭈꼬 출발 비 우산 핫 저 반대편 뭐 오히려 여기 사람 더 꿀,20240915
대구 텍폴 가성비술집 쏘시지요현풍점일본온듯한 분위기 ,현풍 텍폴 핫 quot quot 매번 눈 간판 가격 sausageyo hyeonpung 구 술집 현풍 술집 테크노 술집 추천 현풍 회식 현풍 데이트 오사카 quot quot sausageyo hyeonpung,20240915
교토 여행 오사카 간사이 공항에서 교토 하루카 특급열차 ,생각 안 일본 여행 가게 오사카 가기 교토 가게 위치 아주 핫 바로 앞 여요 Ramen Uroko Kyoto Sanjo Shop 라멘 유로 코 교토 산조 주문 문 앞 Ramen Uroko Kyoto Sanjo Shop,20240915
성수 맛집 일본감성 서울숲 핫플 카린지린가네스낵바 성수본점,성수 맛집 일본 감성 서울숲 핫 카린 스낵바 성수 본점 업체 카린 스낵바 도쿄 오사카 복판 선술집 분위기 곳 주류 종류 연인,20240915
오사카 교토 가족여행 1일 버스투어,MZ 핫 sns 성지 신토 츠 냉 우동 맛집 냉 우동 세트 메뉴 새우 튀김 닭고기 튀김 오픈 우리 교토 오사카 출발 중간 우메다 차 하차 우리 아침 장소 저녁 쯤 MZ sns,20240915
일본 간사이 여행 4Day 오기마치 상점가 탐방 우메다 오피스 ,comhellohello amp 우메다 오피스 지하상가 낮술 우메다 오사카역 앞 제 빌딩 위치 오사사 마츠다 부장 추천 오피스 낮술 핫 가시 우메다역 여기 comhellohello amp,20240915
일본 간사이 여행 4Day 오사사 추천 우메다역 오사카앞 ,현지 핫 여행 마지막 장식 오사카 마 빌딩 오피스 정말 지하 주점 돈 메 주변 점포 여러 곳 터 곳 규모 제일,20240915
오류 난 포스트읽지마세요,감회 요 상 지경 오사카 교토 향 여행 또 치도 왜 말 거 쫌 생각 덩 교토 왜캐 핫 어제 진짜,20240915
경주 황리단길 핫플 오마카세동을 먹을수있는 경주동,경 주 핫 경주 카이센동 경 주 오 마카 세 경 주동 경 주 황리 밥집 경주 일식 저 황리 일본 오사카 방문 때 것 재료 질 좀,20240915
교토호텔 더 게이트 호텔 교토 다카세가와 바이 ,호텔 라마 치 역 단 m 정도 거리 오사카 국제공항 단 km 정도 거리 가장 핫 위치 교통 맛집 초등학교 리 모델링 m km,20240915
부산 아이와가볼만한곳 부산랜드마크 신세계사이먼 부산 ,미니 메인 포토 존 인증샷 인스타그램 업로드 유니버셜 스튜디오 오사카 부산 곳 아이 곳 부산 핫 기장 아울렛 부산 아울렛 부산 데이트 추석 선물 명절 선물,20240915
포항 영일대 술집 다양한 하이볼이 있는 오스테리아57 방문후기,포항 영 일대 해수욕장 야경 영 일대 핫 오스 테리 방문 포항 영 일대 맛집 일본 오사카 타코야끼 여기 더 엄지 척 요리 하나 하나 포항 영 일대,20240914
친구랑 우정여행 함께 여행하기 좋은 해외여행지 추천 TOP 3,일본 오사카 일본 일본 오사카 꼽 이유 밤 방비 핫 사쿠라 바 방비 야시장 때문 취향 껏 놀 수 낮,20240914
말이 필요 없는 성수동 맛집 오코노미야끼  죠죠,일본 오사카 미슐랭 오코노미야키 성수 오코노미야끼 맛집 성수 핫 성 폭발 웨이 팅 기본 핫 핫 핫 레이스 진수 죠죠 성수 영업 시간 매일 성수역 번 출구 m m,20240914
240914,오사카 마이 멜로디 키링 버즈 귀 여 움 케이스 멜로디 더 카페 핫 자리 근처 아틀리에 빈 와플 토스트 집,20240914
오사카 일상  현지인이 추천하는 맛집 amp 명소 1일 완벽 가이드,오늘 오사카 현 지인 자주 장소 구성 여행 코스 소개 오사카 매력 이 코스 하루 여유 여행 거,20240914
신세계사이먼 부산  프리미엄아울렛 1미니언즈팝업스토어 ,부산 핫 아이 곳 인 신세계 사이먼 부산 프리미엄 아울렛 신규 확장 오픈 이벤트 미니 매장 주차장 맞은편 어른 아이 누구 여기 오사카,20240914
부산 기장 신세계 아울렛 리뉴얼 나이키 세일 득템후기 아기랑,핫 요 정이 따봉쮸입 오늘 지금 부산 가장 핫 부산 기장 신세계 무려 상품 유니버셜 스튜디오 오사카 입장권 밤 도 전체 느낌,20240914
일본  오사카 비프동 맛집 레드락,gt 오사카 아메무라 비프 맛집 소개 레드 락 레드 락 고베 본점 오사카 아메무라 점 방문 위치 아래 지도 참고 영업 시간 gt,20240914
대전 봉명동 술집 오꼬노미야끼가 맛있는 덕희하이볼클럽,위치 봉명동 핫 매드 블럭 위치 대전 유성구 문화 원로 영업 시간 매일 제 인생 세번 오 꼬 노미 끼 그 중 번은 오사카 거 저 여기,20240914
오사카 도톤보리 가성비 숙소 난바 근처 일본 여행 호텔 추천,오사카 도톤보리 글리코 무조건 보고 핫 오사카 도톤보리 숙소 웰리 호텔 체크 시간 프런트 데스크 운영 때문 시간 도착,20240914
일본 도쿄 긴자 도버스트리트 마켓 꼼데가르송 스투시 슈프림 ,MZ 핫 긴자 도버 스트리트 포스팅 시작 긴자 도버 스트리트 위치 위치 Chome Ginza Chuo 꼼데가르송 반 팔 티셔츠 저번 달 오사카 후쿠오카 꼼데가르송 방문 시 오픈 런 MZ Chome Ginza Chuo,20240914
홍대오코노미야끼 맛집 추천 오코메이드,오 코 메이드 메뉴 홍대 오코노미야끼 테이블 오사카 오코노미야끼 집 홍대 야끼소바 오코노미야끼 맛집 홍대 술집 koreanfood seoultravel 야끼소바 홍대 핫 오 코 메이드 happyhour koreanfood seoultravel happyhour,20240914
오사카 여행일본색 가득한 하려면 오사카역 근처 ,여행 자주 오사카 도톤보리 신사이바시 등 핫 그닥 매력 못 상태 누구 것 것 것 계속,20240914
후쿠오카 3박 4일 여행 3 모모치 해변 후쿠오카 타워,후쿠오카 핫 좀 수 것 저희 곳 태교여행 기념 사진 좀 후쿠오카 효 스시 오사카 카 메스 시 제 계속 기억 스시 집 그,20240914
할리스 전주한옥마을점 바닐라 딜라이트 아직 안 마셔보신 분은 ,준비 오사카 여행 역시 퇴사 백수 여유 다른 나라 카페 재미 것 프랜차이즈 카페 개인 핫 카페,20240914
httpsblognavercomseeejin_223583577088,오사카 정말 핫 이군 그림자 영상 중독 끼니 무한리필 집 가성 비 움 뽕 진짜 끼니 돈 안 추천 일본 밤 사람 완전 움 밤,20240914
여행 일본 오사카 amp 나고야 4박 5일 여행 후기  나고야 여행 ,오사카 편 마치 이번 나고야 여행 편 바로 시작 나고야 차 잠깐 겸 나고야 핫 오아시스 카페 게 줄,20240914
모두가 말렸지만 결국 해버렸다,X X 친 또 택시 여기 무슨 핫 길이 쥰 X 나 임 진짜 못 여기 달라 중국 아저씨 막 머 머 임 난 못 알 일행 서로 X X X,20240914
일포덤2  2,오사카 브루스 아주 요약 생일 파티 마냥 핫 상상 못 말 사진 칭구,20240914
신당 캐맛있는데 힙함 신당 로타리클럽 미국물 먹은 이자카야,일본 이자카야 미국 분위기 접목 핫 입장 자마자 힙하 온 동네 힙스터 오사카 롤 캘리포니아 롤 오사카 롤 로투스 아이스크림,20240914
Osaka_1 올 여름 3번째 일본은 오사카,오사카 여행 결정 이유 도쿄 여행 정산 내 생일 대구 게 중 현 타 거 무 아모 어디가 핫 눈 귀가 최정은,20240913
파주야당역 이자카야 오코노미야키 맛집  철판오사카야 ,야당 역 안주 식사 이자카야 철판 오사카 조심 추천 야당 데이트 야당 이자카야 야당 핫 야당 역 이자카야 야당 역 술집 야당 오코노미야키 야당 야키소바,20240913
오사카 난바 에비스바시스지 상점가에서 글리코상까지,오사카 핫 바로 글리코 유명 간판 창업 주가 일본 신사 방문 소년 달리기 골인 포인트 양팔 크게 모습,20240913
도쿄 3박 4일 여행 2일차  도쿄 근교 야마나시 후지산 투어 ,오사카 글 도쿄 글 온 사람 이번 박 중 차 여행 기록 핫 곳 사람 꽤 래서 여기 교통 정리 분도,20240913
카린지린가네스낵바 성수본점 일본식 선술집 분위기 성수 맛집,일본 감성 서울숲 핫 해 일본 느낌 나 인테리어 도쿄 오사카 복판 듯 선술집 분위기 인 찌석 석 테이블 석 총 명의 인원 수용,20240913
홍대 이자카야 술집 MZ성지라고 불리는 홍대 핫플 ,데리야끼 소스 감칠맛 매우 눈 깜짝 새 오사카 추천 꼬치 종 당일 손질 재료 최고급 참숯 추천 종 꼬치 구이 닭 무릎 연골 닭 껍질 염통 명란 가슴 살 등등,20240913
오사카맛집 도톤보리 스시맛집 타치스시 앗치치 도톤보리 ,핫 살인마 오늘 오사카 여행 때 스시 맛 도리 타치 스시 리뷰 사실 처음 옆 가게 웨이 팅 저희 방문 식당 평점 더 한번 도전,20240913
오사카성  현지인 스시하야타  도톤보리  현지인 핫플 ,오늘 저번 포스팅 작성 오사카 박 중 차 편 포스팅 나라 공원 거의 핫 진짜 사람 한국 여기 다시,20240913
미후 오사카 기타하마  오코노미야키 현지인 맛집메뉴 대기,대학교 학년 때 개별 테판위 직원 오코노미야키 요리 집 당시 핫 상수역 오픈 이제 체인 듯 오사카 도착 날,20240913
간술하기 좋은 교동 야키니쿠 센  대구에서 느낄 수 있는 일본,야키니쿠 소개 퇴근 후 수 술 수 공간 중 대구 젊은이 핫 교동 야키니쿠 집 야키니쿠 오사카,20240913
202405 일본여행 2일차 파르코백화점  츠텐카쿠  오사카 ,오빠 계획 일본 쇼핑 내 진짜 볼 브랜드 오사카 정돈 데 도쿄 가면 울 오빠 맛집 술집 당황 오사카 핫 인정,20240913
대구가볼만한 곳 도심속의 놀이동산 스파크랜드 레드존 관람차 ,처음 곳 아예 건물 자체 핫 그 자체 대구 스파크 랜드 지하 오사카 햅 파이브 관람차 게 스파크 랜드 레드 존 관람차 또 타 에어컨 안,20240913
시원한 야장 맛집 광안리포차 압편 압구정편의점 광안리점,원래 서울 핫 압구정 편의점 입구 오사카 느낌 뿜뿜 인테리어 진심 느낌 골목 안 위치 파란 조명 눈 낮 밤 조명 때문 더 것,20240912
일본 도쿄 시부야 쇼핑리스트 GU지유 HampM 러쉬 텍스프리 면세,도쿄 핫 시부야 옷 쇼핑 유니클로 GU HampM 브랜드 러쉬 메 돈키호테 등 전 오사카 땐 퀄리티 디자인 그닥 관심 온 김 쇼핑 GU HampM,20240912
부산 광안리술집 추천압구정 편의점 방문기맛있는 하이볼 ,압구정 편의점 광안 리점 부산 광안 리 일본 감성 수 힙합 오사카 퓨전 포차 핫 더욱 마지막 광안 리 포차 압구정 편의점 층 층 층 구성,20240912
광안리술집 압구정편의점 포차에서 분위기 한잔,오사카 글리코 패러디 광안 리 술집 바다 보고 한잔 오기 한잔 쩐다 던데 핫 나 럭키 테라스 석 술 커플 낭만,20240912
감성교육의 현장 여수무료 전시회 ,여 수 핫 전 남학생 교육 문화 회관 은 전남 교직원 의 개인 전 전시 여 수 동호 전시회 오사카 갤러리 초 대전 명가 명작 초 대전 전남 여성 미술 작가 회전,20240912
도쿄 메트로 패스 지하철 노선 24시간 가격 할인구매 교환방법,핫 관광지 추천 도쿄 지하철 노선 도쿄 우리 상상 츠키시마 몬자 끼 거리 오사카 가면 오코노미야끼 도쿄 사람,20240912
일본 오사카 텐마역 이색 이자카야 산마 현지인 맛집꽁치 ,꽁치 초밥 양념 죤맛 꽁치 영양 그냥 날 꽁치 날 총 평 오사카 직장인 핫 꽁치 한잔 이자카야 산 마로 Chome Tenjinbashi Kita Ward Chome Tenjinbashi Kita Ward,20240912
친절한 공간에서 맛있는 쿠시카츠를 즐길 수 있는 합정이자카야 ,comkushi ojisang 오사카 대표 음식 꼬치 튀김 쿠시카츠 수 쿠시카츠 오지 나 아스파라거스 gt 명란 가지 gt 고구마 변경 쿠시카츠 오지 상의 주류 메뉴판 핫 comkushi ojisang gt gt,20240912
도쿄에서 혼자 생일 보내기,핫 카페 창가 석 카운터 맞은편 사장 얼굴 얼 끼니 번 정도 거 진짜 인생 오사카 끼니 김치 진짜 개 에바,20240912
신사역 맛집 가로수길 맛집 도톤보리서울,이 맛 요리 맥주 모금 오늘 자신 우리 부모님 서로 위로 도톤보리 서울 신사역 핫 이유 오사카 현지 느낌 물씬 안주 퀄리티,20240912
오사카 느낌이 물씬 나는 구디이자카야 이다삐루  구디역 맛집,일본 안 간지 진짜 것 오사카 진짜 집 구 디 안 빵 퇴근 후 구 디역 구경 완전 핫 이자 너 인터넷,20240912
청주 맛집  타코야끼 짱 크고 찐 겉바속촉 병정문어볼,갬성샷 못 블로거 뒤 오사카 도톤보리 타코야끼 오 리지 널 전단지 분위기 용암동 맛집 동남 지구 맛집 동남 지구 술집 용암동 술집 타코야끼 맛집 청주 핫 병정 문어 볼,20240912
창원 상남동 맛집 추석에도 모임장소로 딱 좋은 lt좋은 오후 ,전 어회 창원 맛집 창원 이자카야 창원 데이트 창원 핫 창원 술집 창원 상남동 창원 오사카 창원 창원 헬스 창원 횟집 상남동 맛집 상남동 단체 모임 오사카 맛집 창원 상남동 횟집 창원 상남동 맛집 창원 런치,20240912
오사카 여행 부모님과 함께 하는 고베 여행 DAY3,오사카 여행 계획 오사카 근교 여행 어디 고민 교토 워낙 핫 사진 찍기 분 가면 곳 건물 색 약간 동화 느낌 기도,20240912
