title,chunked_description,postdate
오사카 신사이바시역 핫플 오사카 라멘 더라멘 워 면리필 무료,요즘 핫 플로 오사카 라멘 맛집 여행 동생 주어 덕분 보통 우리 알 일본 라멘 집 인테리어 면리필 번 무료,20240826
한큐백화점 오사카 현지인 핫플 덴마 난바 야끼니꾸 현지인 ,오사카 젊은이 간다 핫 덴마 이동 젊은이 성지 우리 끼니 오사카 핫 덴마 안녕 짐 숙소 짐 보관 길 끼니 양 손,20221228
우치다 오사카  일본 5박6일 여행 우메다 나가자키초역 핫플 ,우메다 맛집 호르몬 우치다 웨이 팅 일본 오사카 오사카 여행 일본 끼니 맛집 오사카 끼니 맛집 오사카 설 오사카 설 맛집 우메다역 맛집 우메다 핫 오사카 핫 오사카 끼니 웨이 팅,20241014
오사카 핫플 나카자키초 카페거리 살롱드아만토 추천,오사카 핫 나카 자키 초 카페 거리 몇 년 전 가야 가야 시간 안 못 이번 레트로 거리 분위기 취저 카페 앞 오사카,20240201
오사카 핫플 몬자야끼 맛집 웨이팅 방문 모지오,오사카 핫 몬자 끼 맛집 웨이 팅 방문 모 지오 하니 몬자 끼 전체 솔직 후기 다음 오사카 또 간다 모 지오 다시 방문 메뉴 도전,20241012
요로이케 교동점 오사카 우메다 핫플 이사비리를 그대로 ,오사카 우메다 핫 사 비리 그대로 온 전통 로 바다 끼 방식 요 로이 케 교 동점 차 차 수 교동 핫 플로 혼술러 연인 지인 방문 교동 핫,20240812
오사카난바도톤보리 오사카 핫플에 있는 체인점 퐁포콩테이 ,이번 오사카 여행 숙소 도착 자마자 바로 숙소 근처 오코노미야키 amp 야키소바 음식점 알 오사카 핫 꽤 체인점 우메다 덴노 지구 등 지점 위치 맨 밑 amp,20240823
kitte 키테 오사카 핫플 맛집 솔직 후기  화이트 코지 white ,실제 도 일본 사이 핫 맛집 쇼핑 거리 오사카 여행 가면 한번 것 kitte osaka 키테 오사카 kitte 오사카 kitte osaka kitte,20240909
Maruya  키즈도매시장 현지인 핫플  오사카 야장 추천,숙소 일본 SNS 틱톡 인스타 핫 가게 일본 키즈 도매시장 오사카 핫 오사카 현 지인 오사카 맛집 오사카 맛집 추천 오사카 이자카야 후기 SNS,20240613
Gariguette 오사카 우메다 디저트 핫플 밀푀유 체리블러썸,우메 키 타 셀러 오사카 우메다 umekitacellar OSAKADESSERT GARIGUETTE 오사카 여행 일본 오사카 맛집 오사카 밀푀유 오사카 카페 일본 간식 오사카 핫 일본 디저트 오사카 디저트 트 오사카 점 umekitacellar OSAKADESSERT GARIGUETTE,20240408
오사카 여행 핫플 여행 일정 여행 계획 교토 버스 투어 나라 여행,DAY 오사카 성 일본 결혼식 참석 오사카 성 오사카 여행 핫 오사카 성 자연 유산 인척 콘크리트 안 에스 컬러 터 현대 건물 벚꽃 시즌 DAY,20240201
우메다역 로바다야끼 이사리비 오사카 핫플,오픈 시간 걸 추천 오사카역 우메다역 로 바다 끼 핫 사리 비 저희 오후 정도 도착 저희 앞 팀 정도 저희 뒤 팀 정도 역시 오사카 핫 답,20240621
오사카3박4일 츠텐카쿠 타워슬라이드 오사카 핫플 주유패스 ,오사카 박 츠텐카쿠 타워 슬라이드 오사카 핫 주 유패스 후기 Day 쓰텐카쿠 점 심야 카츠 덴 시바 공원 하루 카스 우메다 저녁 이즈모 루쿠아 햅 파이브 야경 신세카이 핫 쓰텐카쿠 Day,20240619
오사카여행 우메다역 이자카야 이사리비점 인스타핫플 맛집,오사카 여행 우메다역 이자카야 로바타야키 사리 비점 인스타 핫 맛집 오사카 여행 Day 츠쿠 모 우동 청수사 산넨자카 니 넨 카 키 요산 포 헵 파이브 대관람차 로칸 로바타야키 사리 비점 오사카 여행 Day,20240908
오사카 여행코스 핫플 호리에 카페 탐방,우리 오사카 여행 끝 마치 여행 프로그램 살짝 소개 오사카 핫 호리 오사카 여행 코스 호리 핫 휘 둘 시야 카페,20240723
일본 오사카 여행 가볼만한곳 오사카쇼핑 핫플 카페 맛집,운영 시간 일요일 목요일 오전 오후 금요일 토요일 오후 오사카 핫 카페 신사이바시 역 근처 위치 요즘 인기 오사카 카페 핫 카페 요즘 오사카,20240930
오사카 볼거리와 맛집 쇼핑 핫플 우메다 한큐백화점에 다 있어,오사카 핫 정말 볼거리 오사카 쇼핑 스폿 바로 시장 가방 일본 가방 구매 오사카,20230526
일본 오사카 교통최고 핫플 주변 신사이바시 그랜드호텔 오사카 ,사 진과 외출 문 고리 수건 일회용품 주변 핫 위치 copy 신사이바시 그랜드 호텔 오사카 그랜드 호텔 오사카 호텔 오사카 숙소 오사카 숙소 추천 오사카 핫 copy,20240528
오사카 쇼핑은 이곳에서 오렌지 스트리트 오사카 핫플,오사카 꽤 여행 이번 소개 곳 오사카 핫 플로 오렌지 거리 OSAKA ORANGE STREET SHINEBISUBRIDGE 도 오사카 여객선 터미널 쇼핑 OSAKA ORANGE STREET SHINEBISUBRIDGE,20240625
오사카여행 신상핫플  사진찍기 좋은 오사카 온천  소라니와 ,나 세번 오사카 지난번 핫 바로 소라 니 온천 후쿠오카 때 꼭 오사카 여행 오사카 온천 오사카 핫 오사카 인스타 장 의지 밖 한참,20230215
오사카 2박3일 여행코스 교토 포함  신상 핫플 관광지 추천,오사카 여행 처음 때문 기존 한국 필수 코스 핫 탐방 오사카 교토 박 일정 마무리 오사카 핫 위주 여행 일정,20231007
오사카 SNS 핫플 카츠오지 귀여운 다루마 천국,교토 여행 차 코스 가시 혼 간지 카츠 오지 카 메스 시 본점 닌텐도 오사카 점 오사카 만구 카츠 오지 SNS 핫 답 여러 관광객 기념 사진 남편 SNS,20240216
오사카 핫플 투어 도톤보리글리코상돈키호테이치란라멘,일본여행 오사카 여행 도톤보리 글리코 에비스 다리 돈키호테 대관람차 이치란 라멘 타코야끼 오사카 여 행시 도톤보리 패키지 코스 포함 첫째 날 저녁 옴 우리 버스 타고,20241001
교토오사카 100년 넘은 경양식집오사카핫플 나가자키초 ,교토 오후 일정 리뷰 스타트 니 넨 카 야스 곤피 궁 Kikusui 경 양식 오사카 우메다역 계산 때 컷 이제 오사카 열차 고 강 옆 사람 Kikusui,20231229
lt리뷰gt 외국인은 우리뿐이었던 오사카 현지인 핫플 정보 ,거기 로컬 감성 오사카 로컬 맛집 요즘 핫 스시 맛집 오사카 가기 전 완전 최신 오사카 핫 현지 감성 꼭 위치 찍기,20240405
일본 오사카 여행 amp 오사카 핫플 부터 맛집탐방 까지 완벽했던 ,고베 gtgtgt 오사카 지하철역 초콜릿 직원 가격 안산 살짝 후회 요기 초콜릿 고급 지고 오사카 엄망 gtgtgt,20240428
교동 228 공원에 숨은 오사카 핫플 이자카야 요로이케,오늘 교동 일본 오사카 우메다 핫 사 비리 그대로 이자카야 방문 공원 건너편 위치 현 프리 대구 번 출구 바로 건너편,20240427
오사카 여행코스 2박3일 3박4일 일정 오사카 핫플 쇼핑,오사카 여행 코스 박 박 핫 위주 오사카 분 저 직접 경험 바탕 여행 가이드 공유 오사카 여행 박 박 일정 가장 것,20231023
일본 오사카 여행 5편 유니버셜스튜디오 재팬 오사카핫플,이번 포스팅 오사카 여행 편 유니버셜 스튜디오 디즈니랜드 버금 세계 테마 파크 오사카 핫 수 평일 도 역시 사람,20231215
일본 오사카 핫플 와인샵 타카무라 와인 앤 커피,이번 글 오사카 핫 관 글 일본 오사카 여행 핫 안 수 방문 곳 오사카 와인 타카 무 와인 amp 커피 로스 터스 amp,20221117
호텔 한신 오사카 핫플선술집관광지 아고다 할인코드 예약팁,호텔 한신 오사카 핫 선술집 관광지 아고다 할인 코드 예약 팁 릭 위 링크 합리 가격 자동 할인 적용 이용 수 할인 혜택 꼭 손해,20240421
오사카 핫플 이자카야 사케너드sake nerd,현지 핫 맛집 오사카 맛집 분 적 격인 곳 호항 가게 사람 역시 오사카 핫 인정 대부분 여성,20230226
오사카핫플 오카와강 카페 코바토빵공장,오사카 핫 오카 강 카페 코바토 빵 공장 오사카 맛집 카페 벚꽃 시즌 오사카 여행 벚꽃 정말 규모 꼭 포인트 우리,20240501
오사카 맛집 교토 핫플 쇼핑 명소들  교토 오사카여행 패스로 ,카카오 톡 발송 오사카 맛집 교토 맛집 교토 여행 오사카 여행 게이 패스 게이 전철 오사카 쇼핑 교토 쇼핑 오사카 핫 교토 핫 오사카 교토 게이 케이 케이 전차 케이 패스,20240621
오사카 우메다 핫플 Le Comptoir 와인바,일본 Osaka Kita Ward Sonezaki Chome 오사카 와인 바 우메다 와인 바 우메다 핫 오사카 핫 오사카 맛집 우메다 성비 와인 바 오사카 분위기 와인 바 Osaka Kita Ward Sonezaki Chome,20230112
오사카 우메다 핫플 데이트 코스 나카자키초 카페거리 야트 YATT,이상 오사카 우메다 나카 자키 초 카페 거리 핫 추천 야트 YATT 후기 총 평 오사카 우메다 후기 일본여행 오사카 여행 오사카 카페 오사카 핫 오사카 MZ 오사카 카페 거리 우메다 여행 YATT MZ,20240413
대전 대흥동 술집 오사카데스 2차로 좋은 일본 감성 핫플 추천,오늘 대전 대흥동 술집 추천 오사카 데스 대흥 점 리뷰 영업 정보 월목 일 새벽 라스트 금토 새벽 라스트 새벽 외부 대흥동 오사카 데스 핫,20240806
일본 오사카 현지인 핫플 텐마 이자까야 추천 오단나 ,오사카 난바 우메다 현 지인 핫 레이스 텐마 방문 완전 추천 텐마 이자 오 단 텐마 혼텐 방문 해 추천 오사카,20240514
오사카 핫플 디저트 카페 우메다 가리겟토 Gariguetto,토 Gariguetto 오사카 가기 전 오사카 핫 토 토모 토모 파이 핫 파이 여러 맛 생각 하프 앤 하프 가지 맛 일단 딸기 Gariguetto,20240115
오사카 교토 고베 일본 MZ 핫플 오사카 코스 추천 가볼 만한 ,하루 카스 전망대 입장권 예매 오사카 덴포잔 오사카 가장 수족관 가이유칸 비롯 대관람차 레고랜드 MZ 핫 플로 급부 중인 덴포잔 덴포잔 중심 MZ,20240529
오사카 크림밀푀유파이 디저트 핫플  그루니에,오늘 오사카 핫 디저트 맛집 grenier 소개 글 기본 정보 grenier 테이크아웃 우메다역 도보 큐 백화점 도보 글 오사카 여행 grenier grenier,20240222
장인의 나라 일본 오사카핫플 빠 추천 GREEN SPOT,내 간 여행 오사카 볼거리 먹거리 것 것 와중 느낌 핫 성 맛집 한번 때,20240514
오사카 맛집_가리겟토 현지에서 유명한 우메다역 디저트 핫플 ,오사카 핫 토 추천 메뉴 트 추천 메뉴 토모 토모 맛집 토모 토모 일본 추천 일본 맛집 추천 우메다 카페 추천 우메다 카페 오사카 카페 오사카 카페 추천 일본여행 맛집 오사카 여행 우메다 핫,20230509
교토 유학 D179180  오사카 핫플 텐마天満슈쿠가와 ,킹 어학 교 프린트 물 오늘 저녁 사만 시리 오사카 텐마 역 날 밀 술 입 안 대서 술 셋 옴 텐마 핫 메 과연 대충,20230403
핫플투어오사카 라멘 맛집  이치란 라멘별관,오사카 핫 다른 곳도 구경 오사카 맛집 오사카 라면 오사카 라멘 오사카 맛집 오사카 한국인 한식당 오사카 한국인 맛집 오사카 라면 맛집 돈 산 오사카 맛집 투어 오사카 식당 추천,20230120
오사커피osacoffee오사카핫플나카자키초카페거리우메다핫플,혼 오사카 여행 일정 목 토 박 무기 토 스케 라멘 바로 후식 후기 오사카 핫 나카 자키 초 사실 한국 망원동 크게 다른 느낌 날씨 날 산책,20230621
일본여행 오사카 34일차 오사카핫플 도톤보리 난바역 ,만요 교토 수 하루 카 열차 다시 타고 오사카 이동 난바 핫 도톤보리 교토 감성 또 다른 난바 도톤보리 거리 모두 사진,20240105
사람이 많아도 너무 많은 오사카 핫플 드러그스토어돈키호테 ,오사카 도톤보리 도톤보리 글리코 사인 드러그스토어 돈키호테 오사카 방문 첫날 저녁 왜 돈키호테 Wife 직접 도톤보리 거리 야경 서울 Wife,20240730
간사이 자유여행 오사카 근교 당일치기 숨은 스팟 일본 핫플 ,핫 카츠 오지 꼭 놀 용 일본 오사카 자유여행 친구 마카 세로 다루마 상이 카츠 오지 카츠 오지 여기 일본 사이 오사카 핫,20240725
오사카 핫플 도톤보리 리버 크루즈 비 오는 날에 타고 온 썰ㅋ ,From 블로그 모처럼 간의 꿀 휴일 주말 내 핫 어디 사진 소개 휴일 오사카 여행 중 도톤보리 리버 크루즈 From,20230529
홍대 가성비 술집 추천 일본 오사카 느낌 가득한 핫플 압편 ,오늘 소개 곳 홍대 위치 압편 압구정 편의점 요즘 압구정 편의점 오사카 느낌 뿜뿜하 핫 술집 압구정 본점 중심 여러 지점 생기 홍대 점,20240408
오사카 핫플 CAFE ANNON 수플레 먹고 프리쿠라 찍고 ,교토 오사카 박 이야기 차 이야기 시작 벌써 삼일 거의 일본 마지막 완전 핫 때 즈음 줄 서고 사람 완전 꽉 난바파크스 난 카이 난바역 근처,20221206
오사카 핫플가볼만한 곳 나만 알고 싶은 오사카 숨겨진 ,일본 오사카 바로 빈티 핫 사실 알 바로 오사카 랜드마크 오사카 와이파이 오사카 핫 오사카 카페 우메다 카페 나카 자키 초 나카 자키 초 카페 거리 오사카 감성,20240604
오사카 우메다 가볼만한 곳 없는 현지인 핫플 카페거리 찐추천,오사카 여행 분 적극 추천 오사카 현지 핫 오사카 여행 준비 분 관광객 현지 핫 나카 자키 초 방문 추천 오사카 우메다 만,20240705
오사카 여행일정 지금오사카 교토 고베 나라 맛집과 핫플까지,지금 오사카 소개 오사카 핫 맛집 곳 등 모두 구글맵 연동 수 이 책 오사카 쇼핑 핫 레이스 지역 특산 품 구매 수 장소 맛집 감성,20240225
오사카 핫플 GARIGUETTE 당충전 제대로인 우메다 가리겟토,곳 오사카 MZ 핫 장점 강의 달달 함 왜 자꾸 단점 먹기 부스러기 살짝 가격 오사카 핫 토 MZ,20231116
APA 호텔 난바 신사이바시 오사카 핫플가볼만한곳자유여행 ,아래 릭 자동 할인 적용 APA 호텔 난바 신사이바시 오사카 핫 곳 자유여행 아고다 할인 코드 예약 팁 APA 호텔 난바 신사이바시 오사카 핫 곳 자유여행 아고다 할인 코드 APA APA,20240808
일본오사카카페 오사카 우메다 나카자키초 카페거리 핫플 ,핫 다른 카페 손님 별로 사람 계속 옴 나카 자키 초 카페 거리 오사카 카페 추천 오사카 핫 우메다 카페 오사카 MZ 오사카 여행 오사카 곳 MZ,20230728
오사카 핫플 도톤보리 거리 글리코상 위치 유래 점등 소등시간,오사카 핫 오사카 도톤보리 거리 만난 한국인 버스커 이 날씨 버스킹 목소리 감미 타국 한국 노래 더,20230126
오사카  캐릭터 천국 키디랜드 amp 오사카 핫플 파이 카페 ,Kiddy Land Umeda 키디 랜드 오사카 우메다 점 httpswwwkiddylandcojpumeda 타노시이 오사카 컨디션 난 호소 톰 혼자 호텔 휴식 여행 Kiddy Land Umeda httpswwwkiddylandcojpumeda,20230724
대전봉명동핫플 일본감성 뿜뿜 술집 오사카데스,전 봉명동 핫 일본 감성 뿜뿜 술집 오사카 데스 전 봉명동 핫 오사카 데스 외관 일본 현지 느낌 낭낭함 봉명동 핫 골목 찾기 사람 이분 술 잔뜩 취하 신,20230924
핫플투어오사카에서 가장 유명한 치즈케이크 가게  리쿠로 ,오사카 도톤보리 맛집 추천 오사카 핫 오사카 도톤보리 핫 오사카 디저트 오사카 디저트 가게 오사카 식당 추천 오사카 식당 곳 오사카 식당 곳 오사카 도톤보리 치즈케이크,20230122
울산 매곡 술집 오사카로맨스 핫플 이자카야 맛집,울산 매곡 술집 오사카 로맨스 핫 이자카야 맛집 울산 북구 당 수골 길 층 월요일 토요일 일요일 정기 휴무 토요일 남편 퇴근 시간 저녁 겸 술 한잔 아이 모두,20240818
유성 봉명동 핫플 오사카데스,마지막 봉명동 핫 오사카 데스 퇴근 직장인 글리코 전광판 대전 맛집 대전 봉명동 술집 대전 봉명동 맛집 오사카 데스 봉명동 핫 대전 유성구 술집 봉명동 오사카 데스 전유성 일본 술집 이,20240203
오사카 쇼핑 핫플 추천 오렌지스트리트 후기 슈프림 바이오탑 ,한국 사기 제품 일본 종류 오렌지 스트리트 오사카 여행 오사카 쇼핑 오사카 쇼핑 핫 오사카 핫 오렌지 스트릿 오렌지 스트리트 일본 슈프림 일본 베 이프 트래비스 스캇,20230616
핫플투어오사카 맛집 도톤보리 가츠동 치요마츠,오사카 핫 다른 곳도 구경 오사카 맛집 오사카 돈카츠 밥 오사카 맛집 오사카 인기 식당 오사카 맛집 투어 오사카 한국인 추천 식당 오사카 핫 오사카 한국인 인기 곳,20230119
오사카여행 3일차  오사카 핫플 나카자키초 카페골목 카야카페,우리나라 카페 골목 오사카 우메다 나카 자키 초 카페 골목 가게 요즘 핫 저희 우메다 역 것 것 구 경도,20240202
아메리카무라 오사카핫플 힙한카페 ,가기 오사카 이번 처음 아메리카무라 힙 카페 빈티 부터 시작 의류 쇼핑 신 사이 바지 거리 아메리카무라 카페 오사카 핫 스트리머 커피 컴퍼니 카페,20240709
대전 신상 술집 봉명동 핫플 오사카데스,때 웨이 팅 봉명동 핫 오사카 대전 봉명동 술집 오사카 요즘 일식 이자카야 자주 방문 오사카 시간 인테리어 일본 음식,20231109
오사카 헌팅 술집 일본 현지인 핫플 여자 무료 JIS NAMBA ,오사카 현지 헌팅 핫 JIS NAMBA 지스 난바 영업 시간 오후 부터 새벽 오사카 난바 중심 인접 오사카 헌팅 술집 지스 난바 오사카 중심지 난바 찾기 위치 JIS NAMBA,20240925
일본 오사카 핫플 카페거리 나카자키초 인생샷 가능한 ,걷기 일본 오사카 골목 골목 걷기 일본 오사카 카페 거리 핫 나카 자키 초 사진 SPOT 인생 샷 포토 스팟 거리 곳곳이 고 넉 분위기 카페 SPOT,20240205
일본 오사카 여행 가볼 만한 곳 데이트 핫플 산책 코스 추천 ,료쿠치 현지 온천 유 모토 슈이센 일본여행 오사카 여행 오사카 아이 곳 오사카 곳 오사카 공원 츠루 미료 쿠치 공원 오사카 벚꽃 오사카 산책 곳 오사카 데이트 코스 오사카 핫,20240428
한국 포차 문화와 일본 오사카가 합쳐진 서면 핫플 술집 압편 ,부산 서면 압구정 편의점 서면 중심 오사카 퓨전 이자카야 서면 MZ 핫 만남 장소 서울 강남 신사동 한국 포차 문화 일본 오사카 스타일 결합 술집 MZ 세대 중 안 사람 MZ MZ,20240927
핫플투어오사카 회전초밥 원조 맛집 겐로쿠스시,오사카 스시 오사카 스시 맛집 오사카 도톤보리 스시 맛집 오사카 도톤보리 맛집 오사카 도톤보리 맛집 추천 오사카 핫 오사카 도톤보리 핫 오사카 식당 추천 오사카 식당 곳 오사카 식당 곳,20230122
오사카 와인샵 핫플 타카무라 와인 앤 커피 로스터스 일본 ,여행 핫 플로 다카 무 와인 앤 커피 로스 터스 꼭 방문 추천 amp 일본 오사카 여행 오사카 자유여행 오사카 곳 오사카 핫 오사카 카페 오사카 위스키 오 사 카리 샵 amp,20240223
요즘 관광객들 몰린다는 오사카 핫플 추천  글리코상 포토스팟 ,만점 오사카 핫 곳 오사카 여행 계획 주목 요즘 SNS 등 통해 사람 핫 이 글리코 인증샷 히든 포토 스팟 공개 SNS,20230430
일본여행 오사카 맛집 난바 있는 오사카핫플 브루클린 로스팅 ,이번 오사카 여행 혼자 숨통 시간 수 허락 곳 커피 향 빵 버터 미가 그윽해 마음 CALM 오사카 난바 커피 성지 브루클린 로스팅 컴퍼니 Brooklyn Roasting Company CALM Brooklyn Roasting Company,20240205
핫플 따라하기  오사카 핫한 그 집  quot NEW louvre quot 의 핫한 ,그 핫 오리 사진 요긴 데 상호 quotNEW Louvrequot 오사카 분 참조 요 거 계란말이 토스트 와사비 마 newlouvre 오사카 핫 오사카 카페 quotNEW Louvrequot newlouvre,20240210
오사카 여행  도톤보리 핫플 라멘 워Ramen War 추천 Feat ,도톤보리 핫 라멘 워 Ramen War 오사카 핫 라멘 집중 곳 오픈 런 제외 웨이 팅 발생 집 분 오픈 런 살포시 추천 오사카 운영 시간 Ramen War,20230418
2024년5월 방문 오사카 핫플 도톤보리 amp Intex 국제전시장,간지 작렬 여행 이야기 업무 차 오사카 도톤보리 amp Intex 국제 전시장 기능 소재 박람회 오사카 간사이 국제공항 간사이 국제공항 도톤보리 숙소 운하 amp Intex,20240726
오사카여행 우메다 근처 핫플 카페거리 나카자키 추천하는 이유,한국인 별로 오사카 현지 핫 추천 카페 거리 나카 자키 나카 자키 오사카 핫 오사카 여행 오사카 현지 추천 카페 거리 오사카 카페 거리 오사카 인스타 카페 일본 인스타 카페,20230619
오사카  모지오  오사카 타베로그 예약 오사카 핫플맛집,모 지오 영업 시간 토 일요일 일본 맛집 사이트 타 베 로그 예약 가능 구글 평점 다시 온 오사카 여행 이번 여행 전,20240322
서면핫플 오사카 긴리코상 분위기 좋은 술집 quot압구정 편의점quot,오사카 글리코 이 곳 소개 압구정 편의점 서면 점 주소 부산 완전 핫 느낌 사람 술 먹기 여러분 서면 핫 술집,20240625
서면핫플 오사카 감성 핫한 압구정편의점 서면점,오사카 감성 수 핫 곳 서면 핫 인 압구정 편의점 서면 점 방문 오픈 얼마 안 벌써 서면 핫 답 손님 인테리어 굿 감성 굿,20240625
오사카 여행 3일차 오사카 핫플 투어  기타하마 카페 거리 ,오사카 여행 차 기록 내 lt 달 오사카 gt 책 가장 등장 내 사진첩 가장 자주 등장 숙소 앞 놀이터 모습 저 푸른 나무 전부 벚나무 온통 분홍 빛 말 lt gt,20240823
봉명동 신상핫플 술집 오사카데스 솔직후기유세윤도 다녀 간 곳,봉명동 술집 오사카 데스 타코야끼 봉명동 핫 오사카 데스 타코야끼 속도 안 문어 안 요건 정말 맛 봉명동 술집 오사카 데스 끼 교자 봉명동 신상 술집,20230907
ltFoodgt일본 오사카 핫플 quot하브스 난바파크스quot,직접 사비 작성 리뷰 글 일본여행 오사카 여행 하브 스 난바파크스 난바 맛집 오사카 맛집 오 카핫 크레이프 케이크 난바파크스 맛집 httpsyoutubevszFaJCCjrw httpsyoutubevszFaJCCjrw,20240418
부산서면 일본갬성 뿜뿜 서면핫플  오사카리카이쿠,서면 일본 분위기 마음껏 수 곳 오사카 리카 이쿠 면직 영점 오사카 리카 이쿠 서면 안주 맛집 서면 이자카야 운영 시간 라스트 연중 무,20231011
오사카 핫플 도톤보리 글리코상 글리코사인 낮과밤 원더크루즈 ,오사카 가면 한번 그 곳 오사카 핫 도톤보리 글리코 저 또한 이번 여행 때 가면 아시 푸쳐핸섭 낮 방문 글리코 역시 인파 북적 거려 우리 손,20240202
오사카 핫플카페 브루클린로스팅컴퍼니,말 오사카 카페 키 타 하마 쪽 꽤 핫 카페 날 비 실내 로 일본 일본여행 오사카 오사카 여행 오 사가 카페 오사카 카페 추천 키 타 하마 키 타 하마 카페,20240911
오사카교토 여행 3박 4일 일정 ppt 및 경비 총 정리핫플 주소 ,오사카 핫 구글 지도 주소 오사카 맛집 쇼핑 교토 관광지 핫 싹 구글지도 링크 보관 PPT 블로거 아주 작성 포스팅 링크 또 PPT,20220919
오사카 MZ들이 가는 핫플 텐마역 생맥주가 100엔,추천 오사카 MZ 핫 플로 이동 사람 못 구글맵 사진 캡쳐 역 오사카 핫 원래 곳 만석 포기 하이 보루 타임 MZ,20240518
오사카 유니버셜 스튜디오 재팬 입장권 예약 방법 amp 아기랑 ,개월 아기 오사카 여행 이번 여행 중 온천 료칸 amp 유니버셜 두 가지 제대로 야간 가도 줄 오사카 핫 유니버셜 스튜디오 재팬 짐 검사 안 고고 amp,20240925
202405 일본여행 2일차 파르코백화점  츠텐카쿠  오사카 ,오빠 계획 일본 쇼핑 내 진짜 볼 브랜드 오사카 정돈 데 도쿄 가면 울 오빠 맛집 술집 당황 오사카 핫 인정,20240913
오사카 핫플 카페 아지토 Cafe Azito,일본 생활 오사카 여행 오사카 카페 지난달 오사카 여행 이제 보따리 풀다 박 여행 둘째 날 오사카 핫 카페 소개 카페 아지 토 Cafe Azito 오사카 노 Cafe Azito,20210724
오사카 타코야끼 맛집 쿠레오루 도톰보리 핫플,오사카 타코야끼 맛집 쿠레오루 저번 때 줄 서서 온 오사카 핫 계속 이번 오사카 상징 글리코 아저씨 네온 사인 밤 이 곳 아주,20171012
울산맛집 매곡맛집 amp 매곡핫플 오사카로맨스,술 안주 맛 다음 방문 때 저 대리 각오 술 지금 매곡 맛집 이자 핫 이자카야 오사카 로맨스 매곡 점 포스팅,20190810
