title,chunked_description,postdate
오사카 맛집 도톤보리 오사카 츠루동탄 메뉴 위치 웨이팅 후기,오사카 맛집 도톤보리 오사카 츠루 동탄 메뉴 위치 웨이 팅 후기 글 사진 by 둔켈 추석 연휴 전 인천공항 출발 일본 오카 잠시 바로 바로 부산 김해 공항 박 일정 by,20240917
오사카 맛집 다카시마야 백화점 동양정 메뉴 방문 후기,오사카 맛집 오사카 양정 오사카 맛집 양정 오사카 양정 메뉴 양정 메뉴 양정 대신 맛집 웨이 팅 생각 것 못 꼭 양정,20241008
오사카 우메다 야키니쿠 맛집  만복현지인 추천,오사카 우메다 야키니쿠 맛집 메뉴판 일본말 나 진짜 오사카 맛집 인정 탕 것 말 육회 일본 말 육회 나 그냥 육회 줄,20240924
오사카 자유여행 골프 용품점 그리고 하이볼 맛집강추,요즘 엔화 강세 한국 오사카 자유여행 맛집 Genrokuzushi Shinsaibashi 오사카 맛집 하이 볼 개존맛 BAR HIGHBALL BAR BAR 오사카 자유여행 Genrokuzushi Shinsaibashi BAR HIGHBALL BAR BAR,20240914
오사카 구로몬시장 맛집 여행 야키니쿠 히후미 현지인 ,가격 살짝 편이 퀄리티 곳 양보 질 우선 시한 면 오사카 현지 맛집 히후 기억 오사카 맛집 오사카 자유여행 오사카 여행 오사카 야키니쿠 맛집 오사카 야키니쿠,20240922
오사카 현지 맛집 부장님 추천 로바다야끼 이사리비 후기 ,오사카 맛집 사리 비 후기 오사카 맛집 오사카 사리 비 오사사 부장 추천 맛집 운영 정보 주소 Chome Shibata Kita Ward Osaka 일본 영업 시간 번호 Chome Shibata Kita Ward Osaka,20240907
오사카 도톤보리 이자카야 신사이바시 야키토리 꼬치 맛집 추천,오사카 야키토리 맛집 대부분 닭 요리 내부 인테리어 내부 닷 찌 카운터 석 제 것 중 하나 걸 정도 오사카 맛집 제일,20240923
아직도 눈에 아른거리는 인생 야끼니꾸 맛집 오사카 만료,오사카 끼니 맛집 만료 소개 예약 구글 운 제일 영업 오사카 맛집 만큼 메뉴판 겉 내공 일본 혼 를 위해 공부 가타카나,20241006
202405 일본여행 1일차 오사카 호텔  오사카 신사이바시 맛집,호텔 오사카 숙소 가격 지하철 역도 바로 앞 맥 호텔 조 식도 오사카 맛집 패스 이번 관광 맛집 투어,20240910
오사카 맛집 도톤보리 가볼만한곳 오사카 스시 라멘 쿠시카츠 ,오사카 곳 도톤보리 근처 숙소 게 인기 맛집 일본 오사카 여행 때 꿀팁 오사카 곳 오사카 맛집 오사카 스시 오사카 라멘,20241004
오사카 야끼니꾸 무한 잭 우메다역 맛집,굿 오사카 맛집 예산 가성 비 코스 고급 코스 무한리필 코스 가성 비 런치 코스 우메다역 맛집 고민 추천 해 오사카 끼니 잭 우메다 점,20240822
W 오사카 호텔 오마카세 오사카 신사이바시 맛집,신 사이 바지 맛집 W 오사카 호텔 이번 여행 방문 오사카 맛집 중 가장 식사 곳 재료 하나 퀄리티 정성 다해 요리 수 열정 설명 W,20241001
일본 오사카 맛집 이치란라멘 타코야키 사카에스시 코리안바 ,일본 오사카 맛집 일본 타코야키 맛집 다음 일본 오사카 맛집 일본 타코야키 맛집 오사카 도톤보리 강 쪽 부분 기간 동안 운영 기도 경쟁력,20241001
오사카 여행 코스 오사카 맛집추천,오사카 초밥 맛집 추천 오사카 후쿠 요시 오사카 초밥 맛집 오사카 자유여행 오사카 여행 오사카 쇼핑 오사카 숙소 추천 오 사 카일 루미 네이션 기간 오사카 이자카야 추천 오사카 days 교토 오사카 우메다 도착 days,20240825
오사카 쿠시카츠 맛집 산다이메 도톤보리 익큐,오사카 맛집 쿠시카츠 산다 메 도톤보리 익큐 위치 투숙 숙소 맛 직원 셰프 거 오사카 도톤보리 맛집 여러 곳,20240830
오사카 난바 오코노미야끼 현지인 맛집 맘보,추천 오사카 오코노미야끼 맛집 소개 전 잠깐 분명 지난번 고베 양조장 투어 포스팅 고베 당일치기 여행 벌써 오사카 맛집 네 제 표정 감,20240908
일본 오사카 난바역 맛집 초밥 우오신 스시 미나미점 가격 예약,난바역 맛집 오사카 시내 중심 난바역 근처 위치 대중교통 방문 초밥 맛집 오신 분위기 신사이바시 점 오신 방문 바로 다음 날,20241008
오사카 맛집 우메다 하나다코 신사이바시 이치무안,오사카 맛집 Best 하나 코 타코야키 포장 amp 이치 무안 치킨 커리 오믈렛 오사카 이유 유니버설 스튜디오 방문 맛집 투어 가장 거 저 엄마 자유여행 박 하루 Best amp,20240723
오사카 3대 라멘 맛집 카무쿠라  이치란  킨류 어디갈래,보 오사카 첫 라멘 맛집 카무 쿠라 선택 이치란 알보 밖 대기 오사카 맛집 정도 무난 맛 바로 근처 영업,20241006
오사카 난바역 맛집 0도 스테이크하우스 돈까스 덮밥 맛집,스테이크 하우스 영상 보기 오사카 난바역 맛집 오사카 맛집 오사카 스테이크 맛집 오사카 밥 맛집 오사카 돈까스 오사카 돈까스 맛집 오사카 밥 오사카 스테이크 비니 여행 도감,20240920
아묻따 오사카 난바 맛집 추천  스시 사카바 사시스 난바,오사카 맛집 중 어디 멀리 굳이 오 마카 세 가시 오사카 난바역 지하 이 스시 사 카바 사 시스 난바 무조건 맛집 리스트 후회 안해 오픈 런 추천,20240907
오사카 신사이바시 이자카야 나카이 생선구이 맛집 도톤보리 ,오사카 맛집 신사이바시 이자카야 생선 구이 나카이 여행 인 플루 에이 풋 저 오사카 자유여행 때 주로 난바 신사이바시 쪽 숙소 잡고 쇼핑 맛집 카페 이자카야,20240920
오사카 도톤보리 맛집 인생 오코노미야키 폰포코테이,오사카 도톤보리 맛집 도톤보리 오코노미야키 오사카 인생 맛집 오사카 맛집 오사카 도톤보리 맛집 폰 포코 테이 위치 Chome Shimanouchi Chuo Ward Osaka Japan 도톤보리 거리 사라사 호텔 Chome Shimanouchi Chuo Ward Osaka Japan,20240908
오사카 난바 카페 빵집 일본 자유여행 맛집 추천 사키모토 ,오사카 맛집 오카 사 난바 카페 오사카 빵집 추천 오사카 빵집 오사카 카페 일본 맛집 일본 오사카 맛집 오사카 사키 모토 오사카 사키 모토 베이커리 오사카 베이커리 오사카 베이커리 맛집 일본 자유여행,20240923
일본 오사카 맛집 이치란라멘 도톤보리 별관 메뉴 가격 ,라멘 맛집 오사카 대표 관광지 도톤보리 이치란 도톤보리 점 본점 난 근처 별관 오사카 맛집 답 웨이 팅 좀 라멘 주문 약,20241006
오사카맛집 붓카게우동 맛집 가마타케 우동釜たけうどん,다른 집 우동 하나 또 이집 맛집 가게 이름 포스팅 안 일본 일본여행 일본 맛집 오사카 오사카 맛집 우동 맛집 붓카 맛집 붓카 우동 맛집,20241013
오사카 스테이션 시티 다이마루 우메다맛집 덴푸라 긴자 하게텐,제철 재료 갓 끼 식사 손색 재 방문 의사 오사카 여행 오사카 맛집 오사카 튀김 일본 자유여행 다이마루 우메다 맛집,20240924
32 오사카 맛집 여행  카무쿠라 라멘  덴가차야 쿠시카츠 ,오사카 여행 오사카 박 덴 가차 덴 가차 역 맛집 덴 가차 맛집 추천 고 신사이바시 카무 카라 신사 이바 지점 오사카 컬 맛집 오사카 쿠시카츠,20241002
오사카 미슐랭 라멘 맛집 무기토멘스케 웨이팅 메뉴 맛 후기,이번 오사카 여행 중 가장 기억 오사카 맛집 저 인생 라멘 맛집 무기 토 스케 웨이 팅 메뉴 맛 등등 후기 겸사겸사 나카 자키 카페 거리,20240922
오사카 우메다 맛집  일본 가정식 우동이 맛있는 우동야키스케,오사카 우메다 오사카 맛집 오사카 맛집 우메다 맛집 오사카 여행 타코야끼 타코야끼 맛집 하나 타코 오사카 우메다 맛집 우동 키스케 오사카 우메다 맛집 우동 키스케 입구 일 공 돌이,20240924
일본 오사카 맛집 도톤보리 킨류 라멘 마늘 부추김치,일본 맛집 오사카 맛집 추천 이유 중 하나 오사카 라멘 곳 김치 라멘 간 마늘 곳 저 거의 못 거,20240910
오사카 도톤보리 맛집 츠루동탄 추천 메뉴 영업시간 웨이팅,quot quot 글 준비물 체크 리스트 에피 인 플루 홈 오사카 맛집 오사카 도톤보리 오사카 도톤보리 맛집 도톤보리 츠루 동탄 오사카 츠루 동탄 츠루 동탄 메뉴 츠루 동탄 영업 시간 quot quot,20240921
오사카 난바 야끼니꾸 맛집 특선 와규 무한리필 298PREMIUM,PREMIUM 영상 보기 끼니 오사카 끼니 오사카 난바 맛집 끼니 무한리필 오사카 난바 오사카 맛집 오사카 난바 규 오사카 난바 야키니쿠 비니 여행 도감 그린 빈 PREMIUM,20240918
오사카 가성비 맛집 야키토리 전메뉴 370엔 토리키조쿠 후기,오늘 우리 빈 언니 오사카 가성 비 맛집 를 소개 해 언니 뭐 가격 편이 관광객 현 지인 방문 오사카 맛집 참고 모든,20240919
오사카 도톤보리 맛집 이치란 라멘 내돈내산 주문,국물 맛 계속 오사카 라멘 맛집 오늘 오사카 맛집 이치란 라멘 돈코츠 라멘 소개 돈 산 다음 여행 이치란 라멘 타 지점,20240917
일본 오사카 도톤보리 맛집 니쿠야 와규 난바 현지인 찐맛집,예약 필수 한국어 예약 가능 낮 예약 한해 할인 이벤트 중이 오사카 여행 꼭 예약 방문 오사카 맛집 예약 한국어 사이트 도톤보리 현지 맛집,20240911
일본 오사카 맛집 호라이만두다카시마야 백화점,일본 오사카 맛집 호 만두 다카시마야 백화점 HORAI Takashimaya Osaka Store 영업 시간 오전 오사카 한번 볼 만하 정도 우리 다른 메뉴 보고 얘기 HORAI Takashimaya Osaka Store,20240922
일본 오사카 여행 쇼핑 오렌지스트릿 오사카 카레 맛집 추천,일본 오사카 여행 오사카 맛집 오사카 카레 맛집 키친 바 클로버 Kitchen Bar Clover 영업 시간 목요일 일요일 휴무 난바 숙소 오렌지 스트릿 도보 이면 수 Kitchen Bar Clover,20241004
오사카 태교여행 첫째날 우메다 현지인 맛집,오사카 키 키 맛집 우메다 맛집 우메다 키 야키니쿠 우메다 야키니쿠 오사카 맛집 생애 첫 경험 말 육회 일본 소 사료 달라 육질 우리나라 때문,20240922
일본 오사카 여행 야키니쿠 맛집 텐노지 현지 무제한 카니그릴,야키니쿠 맛집 공간 방법 것 오사카 여행 경험 고기 실컷 수 오사카 맛집 식사 제한 시간 마지막,20241008
오사카 맛집 내돈내산 난바 잇푸도 라멘 브루클린 로스팅 ,오사카 경우 맛집 정말 여행 때 오사카 맛집 검색 이번 포스팅 난바 맛집 라멘 브루클린 로스팅 컴퍼니 소개,20241001
오사카 도톤보리 맛집 겐로쿠스시 회전초밥 맥도날드 스벅,도로 한쪽 방향 일방 통행 길이 좀 곳임 다음 일본 여행 도쿄 도톤보리 겐로쿠 스시 도톤보리 맛집 오사카 맛집 일본 회전초밥 도톤보리 스타벅스 오사카 맥도날드,20240924
오사카 신세카이 맛집 츠텐카쿠 이자카야 제니야 쿠시카츠,실내 금연 오사카 유니버셜 스튜디오 입장권 예약 후기 일본 일본여행 오사카 오사카 맛집 오사카 여행 오사카 쿠시카츠 신세카이 신세카이 맛집 제니 오사카 이자카야,20240924
오사카 무한리필 맛집 우메다 야키니쿠 카르비 또 탄우설 가격,오사카 쿠로 게 규 무한리필 코스 오사카 맛집 우메다 무한리필 카르 비 또 우선 설 비빔밥 위 쿠로 게 규 더 수 오사카 우메다 맛집 여기,20240912
일본 오사카 맛집   우라야 일본가정식,우리 아들 정식 돼지고기 간장 볶음 밑반찬 정식 아이 주 메뉴 어른 모두 식사 일본 가정식 오사카 난바역 맛집,20241002
오사카 난바 맛집 난바역 근처 초밥 우오신 미나미점,오 신 스시 영상 보기 오사카 맛집 오사카 난바 맛집 난바 맛집 난바역 맛집 난바역 근처 맛집 오사카 초밥 맛집 난바 초밥 맛집 오 신 미나미 점 비니 여행 도감 그린 빈,20240916
오사카 우메다 규카츠 맛집 현지인 바글한 교토가츠규 추천,오사카 맛집 우메다 맛집 오사카 규 카츠 맛집 우메다역 두 개 규 카츠 교토 츠규 둘 중 구글 평점 현지 바글 바글 교토 츠규 요도 바시 우메다 점 번 방문 위치 우메다 점,20240911
오사카 타코야끼 맛집 해산물 이자카야 쿠레오루 도톤보리 본점 ,이자카야 도톤보리 맛집 오사카 대표 관광지 도톤보리 먹거리 볼거리 놀 거리 향 곳 네온사인 길거리 음식 상점 랜드마크 도톤보리,20241010
일본 오사카 우메다 맛집 키타로스시 가족여행 식당 추천,분위기 오사카 스시 맛집 키타로 스시 것 가격 가족 여행 금연 오사카 맛집 한국어 예약 내부 분위기 입구 쪽 가운데 화로 중심 카운터,20241002
죽기 전에 꼭 먹어야할 오사카 장어덮밥 맛집 쿠로몬시장 노포 ,오사카 여행 첫 버킷리스트 바로 쿠로 몬 시장 안 민물장어 밥 맛집 lt 오토 오토 오사카 맛집 오사카 여행 쿠로 몬 시장 장어 밥 민물장어 밥 버킷리스트 lt,20240917
오사카 난바 맛집  맛 최고 불친절도 최고인 난바 아지노야 후기,오사카 난바 오사카 맛집 난바 맛집 아지 노야 오 꼬 노미 끼 야끼소바 난바 노야 일본여행 오사카 여행 오사카 난바 맛집 난바 아지 노야 후기 오사카 난바 거리,20240930
오사카 현지인 라멘 맛집 더라멘워 The Ramen War,일 오늘 점심 동생 오사카 라멘 맛집 동생 이 집 오사카 맛집 라멘 워 쇼유라멘 곳 갠 저 돈코츠 라멘 쇼유라멘 살짝,20240903
일본 오사카 맛집 타코야키 10엔빵 도톤보리 간식 추천,일본 오사카 맛집 타코야키 빵 도톤보리 간식 추천 일본 여행 지역별 간식 오사카 도톤보리 맛집 일부 길거리 사 수 간식 고민,20240831
오사카 여행 도톤보리 맛집 규카츠 가츠규,여하튼 규 카츠 개인 다시 오사카 가면 한번 정도 더 볼 음식점 맛집 추천 오사카 여행 오사카 맛집 오사카 규 카츠 규 카츠 츠규 도톤보리 맛집 난바 맛집,20240821
오사카 덴덴타운 아부라소바 맛집 키린지 가라아게 필수,오사카 덴덴타운 아부 소바 맛집 키린지 가라아게 필수 만 오사카 맛집 시리즈 이번 소개 곳 오사카 덴덴타운 위치 아부 소바 맛집 키린지 사실 곳 현지,20240912
오사카 신사이바시 맛집 일식 오마카세 요사쿠라 추천,코스 오사카 신사이바시 맛집 오사카 맛집 오사카 맛집 요 사쿠라 오사카 난바 신사이바시 내 호리 바 시 역 번 출구 도보 거리 요 사쿠라 오사카 신사이바시 호리 바시 중간,20240930
일본 오사카 여행 오사카 맛집 도톤보리 오코노모야끼 후쿠타로,오사카 도착 인스타 보고 오사카 온 걸 지인 맛집 보 거기 바로 웨이 팅 수도 일단 오사카 맛집 오사카 오 꼬 노모 끼 후 쿠타 역시,20240912
난바역 근처 예약가능 분위기 좋은 오사카 맛집 ,하필 생일 날 랜딩 오사카 외식 정도 남편 식당 예약 걱정 오사카 맛집 다리 메뉴 종이 그림 보기,20240920
오사카 신사이바시 맛집 대왕초밥 참치 우오신,재료 워낙 커서 둘이서 피스 더 것 오신 신사이바시 점 영상 보기 오사카 신사이바시 맛집 오사카 맛집 신사이바시 맛집 오사카 초밥 맛집 오사카 초밥,20240828
오사카 맛집 리스트 5 여행  도톤보리 가볼만한곳 정리,다이마루 백화점 도 동선 추천 오사카 맛집 리스트 생각 곳 역시 여행 맛집 오사카 맛집 리스트 오사카 여행,20240903
일본 오사카 우메다 맛집 야키니쿠 잇쇼 와규 예약 추천,내부 인테리어 일본 오사카 맛집 매장 꽤 인석 단독 룸 등 여러 타입 농사 정도 음식 진심 오사카 우메다 맛집 인정 오사카 야키니쿠 추천 일본 오사카,20240909
오사카 도톤보리 맛집 오코노미야끼 타코야끼 맛집 ,쿠레오루 영상 보기 오사카 도톤보리 맛집 오사카 맛집 도톤보리 맛집 오사카 타코야끼 맛집 오사카 오코노미야끼 맛집 오사카 이자카야 도톤보리 타코야끼 맛집 도톤보리 오코노미야끼 맛집,20240921
오사카 맛집 실패 없는 이치란 우메다시바타점,오사카 우메다 맛집 이치란 라멘 이치란 라멘 본점 후쿠오카 저 일본 라멘 중 돈코츠 라멘 가장 이치란 라멘 돈코츠 라멘 대표 라멘 집,20240930
오사카맛집 카메스시 저녁에 웨이팅 적은 맛집,이번 오사카 맛집 방문 때 집 오사카 일본 맛집 오사카 맛집 초밥 맛집 스시 맛집 웨이 팅 웨이 팅 맛집 카 메스 시 카 메스 총 본점 서이추,20241001
오사카 혼자 여행 혼밥 가능 오사카 맛집 리스트,혼밥러 오사카 맛집 리스트 JR 난바역 오사카 난바역 근처 혼밥 일본 가정식 식당 제 땐 주방 중간 양쪽 신발 좌석 안 좌석 구조 JR,20241014
오사카맛집 쿠라KURA스시 일본에 프랜차이즈 회전초밥 맛집,체인점 분위기 카 메스 시설 쿠라 스시 더 일본 맛집 오사카 맛집 회전초밥 초밥 맛집 가성 비 초밥 프랜차이즈 맛집 서이추 환영,20241003
오사카 맛집 난바 스키야키 맛집 샤브쵸 가성비 런치,다음 또 오사카 맛집 난바 근처 샤브쵸 소개 오늘 포스팅 여기 에피 인 플루 홈 오사카 맛집 오사카 난바 맛집 오사카 스키야키 오사카 스키야키 맛집 샤브쵸,20240622
오사카 도톤보리 맛집 난바 라멘 규카츠 일본 여행 오사카 ,소개 오사카 맛집 도톤보리 맛집 난바 라멘 규 카츠 일본여행 오사카 날씨 오사카 여행 일본 오사카 여행 지난 업무 차 일본 오사카 여행 여름 날씨 한낮,20241003
오사카 도톤보리 맛집 오코노미야키 타코야키 보테쥬본점 ,lt 원조 오사카 맛집 찾기 gt 원조 오사카 오코노미야키 맛집 난바 오사카 쥬 이름 가게 수 분위기 음식 서비스 등 전혀 lt gt,20240926
일본 오사카맛집  함박스테이크맛집 동양정 신오사카점,함박스테이크 맛집 양정 우메다 지점 맛집 답 웨이 팅 정보 저희 신 오사카 점 우리 가족 모두 인정 맛집 양정 배 불리 히나타 노유 온천 출발 함박스테이크 오사카 맛집,20240928
오사카 자유 여행 코스 츠텐카쿠 오사카 신세카이 맛집 ,오사카 자유여행 코스 츠텐카쿠 오사카 맛집 신세카이 맛집 쿠시카츠 카 치 오사카 여행 오사카 츠텐카쿠 Tsutenkaku Tower 신세카이 거리 파리 에펠탑 비유 기도 하늘 통 건물 Tsutenkaku Tower,20240919
오사카 여행 오사카 도톤보리 대게 맛집 코스 예약 카니도라쿠 ,본점 오사카 여행 오사카 맛집 도톤보리 맛집 오사카대 코스 오 사 카카니 쿠 상상 리 올해 여름 휴가 이열치열 베트남 더 오사카 여행 더위 투어 with 맛집 여행 with,20240925
오사카 찐 라면맛집 규슈라멘 키오,면 롤 밀 류맛 토마토 난 면 국물 드링킹 고추 개 속 오사카 라멘 맛집 키오,20241012
오사카 맛집 추천  토라니츠노 야끼니꾸,오사카 끼니 맛집 추천 오늘 끼니 맛집 추천 난바 마찬가지 웨이 팅 끼니 집 여기 이 곳 인스타 디엠 예약 여기,20240923
일본 오사카 우메다 맛집 오코노미야끼 유카리 오사카 먹방 여행,간만 식도락 진심 먹방 여행 포스팅 여기 에피 인 플루 홈 오사카 맛집 우메다 맛집 오사카 우메다 맛집 오사카 우메다 오사카 우메다 오코노미야끼 오사카 오코노미야끼,20240704
오사카맛집 가이세키요리 theKappo,오사카 맛집 일본요리 전문점 오사카 사람 마츠다 부장 추천 The Kappo 가이세키 요리 유튜브 quot 오사카 사람 quot 채널 운영 마츠다 부장 추천 맛집 The Kappo quot quot,20241013
오사카돈테키 우메다 맛집일본인 추천 메뉴  Osaka ,오늘 만 오사카 맛집 소개 이번 소개 드릴 곳 우메다 일 지인 오사카 돈테키 아무 데 일정 근처 곳,20240929
오사카 맛집 최고였던 미슐랭 후쿠타로 오코노미야끼,오사카 맛집 최고 미슐랭 후 쿠타 오코노미야끼 친구 정처 저녁 호텔 오사카 오코노미야끼 맛집 꼭 추천,20240906
일본 오사카 난바 맛집 와쿠라 스키야키 이자카야 추천,스키야키 맛집 오사카 난바 이자카야 추천 일본 오사카 맛집 와쿠 난바 점 주소 일본 Osaka Chuo Ward Namba Chome GEMS Namba F 영업 시간 난바역 번 Osaka Chuo Ward Namba Chome GEMS Namba F,20240908
오사카 난바역 맛집 551 호라이 난바워크점 만두 존맛,오사카 난바역 맛집 호 라이 난바워크 점 만두 존맛 일본 여행 때 눈길 호 라이 방문 오사카 맛집 호 라이 난바워크 점 규모 편이 안쪽 자리 일본어,20240912
일본 여행 오사카 맛집 551 호라이 만두 군만두와 왕만두 맛 비교,일본 오사카 여행 맛집 세 여자 하루 보 이상 하루 세 끼 중간 중간 간식 오사카 간식 먹기 호 라이 만두 포기,20241001
오사카 극한 돈카츠 카츠키 난바파크스 오사카맛집,극한 돈카츠 카츠 키 난바파크스 오전 오후 LO 연중 무 테이크아웃 가능 httpswwwkirakugcojpshoptonkatsu 난바파크스 맛집 오사카 돈카 LO httpswwwkirakugcojpshoptonkatsu,20240920
오사카 혼마치 맛집 현지인 많은 돈테키 함박스테이크 맛집 ,사루쇼쿠 오사카 맛집 혼 마치 맛집 함박스테이크 맛집 근처 현 지인 관광객 줄 메뉴 요런 밥 갓 지은 밥 양도 아아 주 혜자 로움 오사카 가나 쌀밥,20240914
일본여행 오사카 난바역 우동 맛집 난바우동NambaUdon ,난바 우동 오사카 난바역 맛집 오사카 난바역 우동 오사카 난바 맛집 오사카 난바 우동 맛집 오사카 난바 노포 맛집 오사카 난바 노포 우동 맛집 일본여행 일본 맛집 오사카 맛집 오사카 난바 우동,20240920
오사카 철판요리맛집 MOEGI모에기 오꼬노미야끼와 ,이번 여행 맛 일본 철판요리 모에 기 MOEGI 아주 추천 오사카 도톤보리 맛집 이 유 오사카 철판요리 오사카 모에 기 오사카 맛집 오사카 MOEGI 도톤보리 오 꼬 노미 끼 오사카 오 꼬 노미 끼 맛집 MOEGI MOEGI,20241001
일본여행 오사카 난바 야키니쿠 맛집 히후미 예약 메뉴 단체 가능,네임카드 클릭 후 팬 더 오사카 여행 정보 확인 수 일본여행 일본 오사카 여행 오사카 여행 오사카 맛집 일본 맛집 일본 야키니쿠 오사카 야키니쿠 오사카 야키니쿠 맛집,20240913
일본 오사카 우메다 스시 맛집 키타로스시 로바타야키 예약,예약 오사카 스시 오사카 스시 맛집 우메다 스시 오사카 우메다 스시 로바타야키 한자리 수 키타로 스시 최근 리뉴얼 오사카 맛집 원래 스시 전문점 곳,20241002
오사카난바 추천 로컬 맛집 호타루쿠시카츠 꼬치집,쿠시카츠 오사카 컬 맛집 호타루 오사카 컬 오사카 여행 오사카 맛집 난바 맛집 난바 컬 맛집 일본 맛집 오사카 명소 일본 명소 일본여행 오사카 튀김 꼬치 일본 쿠시카츠 오사카 쿠시카츠,20240901
오사카 여행 오사카 신사이바시 장어덮밥 맛집 에도야키 ,오사카 여행 오사카 맛집 오사카 장어 밥 신사이바시 맛집 신사이바시 장어 밥 도톤보리 맛집 난바 맛집 도톤보리 장어 오사카 도야 키아네 코 우지 도야 키아네 코 우지 오사카 여행 오사카 신사이바시,20240926
오사카 무한리필 야끼니꾸 맛집 야끼니꾸 리키마루,오사카 맛집 무한리필 끼니 야끼니쿠 니키 마루 끼니 니키 마루 끼니 쿠니 키 마루 도톤보리 남바 근처 고기 불고기 무제한 술 고기 집 솔직 후기 가격 메뉴,20241013
일본 오사카 도톤보리 맛집 카니도라쿠 런치 메뉴 예약x 후기,에피 인 플루 홈 오사카 맛집 오사카 도톤보리 맛집 일본 오사카 오사카 오 사 카카니 쿠 카니 쿠 카니 라쿠아 미모 토 별관 카니 라쿠아 미모 토 별관 카니 쿠런 치,20240822
오사카 여행 오사카 쿠로몬시장 맛집 쿠로몬 산페이,쿠로 몬 시장 맛집 쿠로 몬 산 페이 오사카 맛집 오사카 구로 몬 시장 오사카 쿠로 몬 시장 구로 몬 시장 맛집 쿠로 몬산 페이 상상 리 일본 재래시장 간 쿠로 몬 시장 쿠로 몬,20240903
오사카 맛집 리스트 여기 있어요  도톤보리 근처,황보 오사카 도톤보리 근처 맛집 리스트 여기 주변 추천 준 맛집 리스트 오사카 뭐 우동 츠 제 준비 오사카 맛집 리스트,20241007
