title,chunked_description,postdate
오사카 도톤보리 맛집 야키니쿠 카메다 웨이팅 유무,야키니쿠 맛집 추천 보아 오사카 도톤보리 맛집 오사카 맛집 오사카 야키니쿠 맛집 야키니쿠 카 도톤보리 웨이 팅 도톤보리 야키니쿠 오사카 야키니쿠,20240322
오사카 여행 도톤보리 맛집 카스야KASUYA 우동,저희 근처 구글 평이 사진 보고 여기 정말 만족 후기 카스 KASUYA 호젠 지점 일본여행 오사카 맛집 Chome Namba Chuo Ward Osaka 일본 KASUYA Chome Namba Chuo Ward Osaka,20240508
오사카 여행 우메다 맛집 이치란 라멘ft 이치란라멘 주문 ,라멘 맛집 오사카 라멘 맛집 이치란 라멘 주문 메뉴 오사카 맛집 역시 웨이 팅 메뉴판 토핑들 미리 스캔 이치란 라멘 내부,20240606
오사카 맛집 죠네츠호르몬 사쿠라가와점 곱창 야끼니꾸,오사카 맛집 츠 호르몬 사쿠라 점 곱창 끼니 오사카 여행 중 숙소 아비 타 레 난바 웨스트 호텔 츠 호르몬 후기 옆 대형 마트 발견 곳 교토 당일,20240416
오사카여행 나라갈 땐 일본 라멘 맛집 이치란 아베노점,얼마 전 기사 난 킨류 라멘 다시 보고 이번 별로 확인 이치란 라멘 오사카 이치란 오사카 맛집 오사카 라멘 맛집 이치란 아베 노점 덴노 맛집 오사카 여행 일본여행,20241002
오사카 스위소텔 난카이 난바호텔근처 맛집 추천해요,오사카 호텔 추천 난바 호텔 스위소텔 카이 난바 스위소텔 오사카 난바 근처 맛집 오사카 맛집 오사카 카페 탑 카페 텐동 마키 노 야키니쿠 야키니쿠 맛집 조카 간사이 여행 선택,20240329
오사카 츠텐카쿠 맛집 쿠시카츠 다루마 ㅡ 주유패스로 놀기 ,더 기전 맛집 밥 오사카 츠텐카쿠 맛집 쿠시카츠 다루마 날 츠텐카쿠 맛집 오사카 맛집 본격 츠텐카쿠 정작,20240512
오사카이소마루수이산 이자카야신사이바시오사카 맛집02,오사카 때 맛집 정리 httpsmapsappgooglhScX th BS gH za 난바 미도스지 점 일본 Osaka Chuo Ward Dotonbori Chome FA httpsmapsappgooglSwe M JtxSJDDhg 난바 난카이도 리점 httpsmapsappgooglhScX th BS gH za Osaka Chuo Ward Dotonbori Chome FA httpsmapsappgooglSwe M JtxSJDDhg,20240712
오사카 맛집 신사이바시 스트리머커피컴퍼니 카페,커피 맛집 곳 오사카 수 커피 수 커피 마니아 곳 랍 오사카 맛집 신사이바시 스트리머 커피 컴퍼니 카페 사진 글,20240413
오사카 우메다 야키니꾸 현지인 맛집  쿠로게와규 도야마 ,여분 호두 다이소 쇼핑 마치 뚜 준 오사카 끼니 맛집 오사카 고리 미리 오사카 맛집 조금 허름하 일단 아빠 때 호두 그 옆 건물 계단,20240705
오사카 맛집 모헤지  루쿠아 몬자야끼가 맛있는 우메다 맛집,우메다 맛집 중 루쿠아 안 몬자 끼 오사카 맛집 모 헤지 먼저 매장 위치 오사카 우메다 쪽 루쿠아 백화점 층 식당가 위치 금방 수 오사카 맛집 중 루쿠아,20240521
오사카 여행 오사카성 근처 현지인 맛집 페코페코우동,맛 양도 직원 오사카 모리 노미 역 근처 한번 오사카 맛집 오사카 성 맛집 오사카 성 근처 맛집 페코페 코 우동 오 사 카페 코페코 오사카 우동 맛집,20240404
오사카 스시 맛집 스시 신노스케 오마카세,오사카 맛집 배웅 사진 직원 여운 오사카 초밥 맛집 오사카 여행 오사카 여행 오 마카 세 오사카 스시 맛집 스시 신노스케,20240314
일본 오사카 여행 일정 주유패스 오사카성 맛집 오사카 5월 ,지난 일본 오사카 여행 일정 주 유패스 이용 오사카 나들이 맛집 오사카 날씨 옷차림 소개 일본 오사카 여행 일정 주 유패스 오사카 오사카 맛집 오사카 날씨,20240508
오사카 스시 맛집 추천 덴마역 하루코마 스시,목 오사카 온 바로 다음 날 동생 우리 젤 오사카 스시 맛집 하루 코마 스시 지난 하루 코마 스시 오늘 역시 오픈 런 오픈 런 줄,20240914
일본 오사카 키타하마 맛집 홋쿄쿠세이 오므라이스 추천,호텔 체크 전 방문 키 타 하마 맛집 홋쿄쿠 세이 키 타 하마 홋쿄쿠 세이 오사카 최초 오므라이스 식당 전통 오사카 맛집 일본 오사카 신 시바이 시 본점 난바 점 우메다 점 등,20241007
오사카 맛집 오사카 여행 곳 오사카 현지 맛집 추천 오사카 ,오사카 맛집 라멘 코산 오사카 현 지인 맛집 오사카 라멘 타이쇼 구 맛집 돈코츠 라멘 오사카 여행 오사카 곳 오사카 맛집 추천 오사카 자유여행 오사카 맛집,20240921
오사카 우메다역 맛집 야키니쿠 비리짱 가성비 현지인 와규 ,오사카 규 맛집 설 식감 육즙 방울 게 역시 설 is 최고 계란 노른자 푹 is,20240927
오사카 우동 맛집 카마타케우동 붓카케우동 우메다,현지 인도 줄 서서 오사카 우동 맛집 입 그 이유 지금 오사카 맛집 인정 카 마타 케 우동 주소 일본 Osaka Osaka,20230901
오사카 타코야끼 맛집 비교  우마이야 vs 히로코,오사카 가면 수 간식 타코야끼 오늘 그 중 저희 타코야끼 맛집 곳 오사카 여행 오사카 맛집 오사카 타코야끼 우마 타코야끼 오사카 우마 오사카 히로 키 타코야끼,20241004
오사카 현지인 이자카야 맛집 추천 시티플라자 오사카 호텔 ,위 일본여행 일본 골프 오사카 여행 오사카 골프 오사카 골프 자유여행 오사카 현 지인 맛집 오사카 이자카야 오사카 이자카야 맛집 오사카 맛집 오사카 꼬치 튀김 맛집 오사카 오뎅 맛집 오사카 사시미 맛집,20240512
오사카 맛집 모토무라 규카츠 난바 분점 솔직 후기,오사카 난바 도착 자마자 저녁 방문 규 카츠 맛집 모토 무 분점 방문 후기 위치 도톤보리 반대편 난바역 시장 골목 근처 위치 본점 빅 카메라 매장 앞쪽,20240502
오사카성 맛집 오사카 현지인 스시 초밥 추천,오사카 맛집 오사카 현지 스시 초밥 추천 지난 여름 오사카 여행 톈진 마츠리 보고 스시 가게 발견 현지 맛집 곳 소개 해 오사카 근처 덴마 바 시 역,20241012
일본 오사카 맛집 야키니쿠 고베규와규 키타마츠 신사이바시,일본 오사카 맛집 신사이바시 최고급 고베 규 규 수 야키니쿠 키 타마 츠 하니 이용 오사카 야키니쿠 맛집 오사카 규 맛집 오사카 신사이바시 맛집 일본 맛집,20230913
라멘quot_일본 맛집_이치란 추천조합_웨이팅 후기_오사카 라멘,전 솔직 후기 계세 포스팅 돈 산 후기 이치란 라멘 일본 맛집 일본 라멘 맛집 이치란 추천 조합 이치란 웨이 팅 후기 오사카 라멘 오사카 맛집,20241003
일본 오사카 맛집 난바 우메다 지역 4곳 리스트,내 저장 amp 직접 오사카 맛집 리스트 오사카 여행 맛집 오사카 여행 가시 곳 웨이 팅 진 경험 저 이번 플랜 A B C 를 계획 웨이 팅 번 안 amp A B C,20230808
일본 오사카 여행 현지인 맛집 몬자야끼 모지오 もじお,오사카 여행 무려 번 오사카 맛집 소개 사실 곳 제 진짜 구글링 현지 가득 맛집,20240411
우메다 라멘맛집  오사카 쇼핑리스트,우메다 맛집 추천 우메다 라멘 맛집 오사카 쇼핑 리스트 오사카 쇼핑 추천 우메다 리무진 버스 시간표 오사카 자유여행 하카타 라멘 맛집 진짜 차 마지막 일정 그랜드 오사카 days 노스쇼어 식사 days,20240827
일본 이타마에 오사카 난바 현지인 야끼니꾸 맛집 추천,타마 오사카 맛집 오사카 끼니 오사카 맛집 추천 구글 맛집 오사카 현 지인 맛집 끼니 끼니 맛집 오사카 난바 맛집 난바 마집 난바 끼니 lt 영업 시간 gt 목화 수요일 정기 휴무 사진 lt gt,20240324
오사카 나니와멘지로 라멘맛집 난바역 미슐랭가이드,오사카 난바역 맛집 나니 방법 이노 월드 푸드 투어 오사카 맛집 나니 라멘 집 가기 위해 quot 난바역 quot 도착 티켓 구매 때 quot 플랫폼 티켓 quot 선택 지하철 탑승 quot quot quot quot,20240928
신사이바시 맛집 야끼니꾸 미츠루 일본 오사카 여행코스 필수,저녁 시간 웨이 팅 대부분 오사카 맛집 저 이전 방문 바로 수 오사카 여행 코스 계획 때 참고 대기 신사이바시 맛집,20240425
오사카 맛집 대기수산회전초 쪽에 유명한 오사카 스시 맛집,우리 부부 오사카 도톤보리 쪽 스시 맛집 여기 저녁 먹기 결정 오늘 포스팅 곳 오사카 맛집 중 도톤보리 쪽 오사카 스시 맛집,20240525
오사카 여행 맛집 쿠시카츠 다루마 도톤보리점 웨이팅 후기,오사카 오사카 여행 쿠시카츠 다루마 쿠시카츠 다루마 도톤보리 쿠시카츠 맛집 쿠시카츠 다루마 웨이 팅 오사카 맛집 도톤보리 근처 키 차 어디 가면 고민 사람 추천,20241009
오사카 규카츠 맛집 토미타 웨이팅,웨이 팅 호 달달 만족 오사카 난바 맛집 규 카츠 토미 타 리뷰 작성 규 카츠 토미 타 Osaka Naniwa Ward Nanbanaka Chome Osaka Naniwa Ward Nanbanaka Chome,20240911
오사카 여행 도톤보리 야키니쿠 현지인 추천 맛집 미츠루,평일 도 사람 곳 요 현 지인 외국인 곳 미츠루 도톤보리 본점 오사카 맛집 오사카 야키니쿠 도톤보리 맛집 도톤보리 키 오사카 가족 여행,20240420
내 마음속 오사카 교토 맛집 top 3,마카오 여행기 갑자기 작년 일본 오사카 교토 여행 음식 중 top 오사카 맛집 교토 맛집 카 메스 시 월 휴무 화토 일 오사카 첫 음식 우메다 top,20240207
오사카 초밥 맛집 일본 여행 현지인 추천 스시 다이마루 ,오사카 초밥 오사카 초밥 맛집 오사카 스시 오사카 스시 맛집 일본여행 일본 오사카 맛집 일본 오사카 스시 맛집 일본 오사카 여행 오사카 다이마루 백화점 오사카 다이마루 백화점 맛집 오사카 신사이바시,20240521
오사카 난바 맛집 난카이난바역 야키토리 텟판 타로,포스팅 업체 로부터 제 작 지원 작성 콘텐츠 오사카 맛집 난바 맛집 오사카 난바 맛집 난 카이 난바역 맛집 오사카 카이 난바역 오사카 난바 오사카 야키토리 난바 야키토리,20240321
일본여행 오사카맛집 이치란라멘 평일방문 웨이팅 소요시간,이치란 라멘 밀키 공항 차슈 또 돈 산 일본여행 오사카 여행 오사카 맛집 일본 맛집 도톤보리 맛집 난바 맛집 이치란 라멘 라멘 맛집 일본 점심 추천 여행 블로그,20240930
오사카 우메다 맛집 일본 여행 공중정원 근처 카레 푸짐한 ,오사카 맛집 오사카 우메다 맛집 우메다 맛집 오사카 카레 오사카 카레 맛집 일본여행 맛집 일본 맛집 일본 오사카 맛집 오사카 공중정원 맛집 우메다 공중정원 맛집 상등 카레 오사카 상등 카레 우메다 상등 카레,20240520
오사카 우메다맛집 하나타코 강추,오사카 우메다 정말 타코야끼 집 하나 타코 우메다역 큐 백화점 근처 위치 찾기 아주 오픈 시간 저희 시간 불구 줄 살짝,20241007
오사카 이색 맛집 점보 낚싯배 츠리키치 재미있고 맛도 좋아,맛집 추천 직접 낚시 낚시 비용 오사카 골프 여행 후기 오사카 오사카 맛집 오사카 이색 맛집 점보 낚싯배츠 리키 치 오사카 회집 오사카 여행,20240325
오사카 우메다 현지인 맛집 오코노미야끼 유카리 소네자키 본점,오사카 우메다역 근처 맛집 분 대부분 큐 백화점 지하상가 현 지인 웨이 팅 정도 맛집 번 걸 추천 우메다역,20241013
오사카 여행  오사카 맛집 우메다 가성비 이자카야 ,구글 평점 꽤 바로 욤 오사카 여행 오사카 맛집 우메다 이자카야 야키토리 맛집 추천 현지 이자카야 맛집 Kaisenyataiokuman Umeda 위치 영업 시간 제 방문 Kaisenyataiokuman Umeda,20241009
신사 오꼬노미야끼 맛집 치보 오사카 맛 그대로,오사카 엄두 내지 오 꼬 노미 끼 맛집 그 치 보가 한국 오픈 좀 소문 덜 난건 주말 저녁 널널 치보 강남 신사 점 화 수 목 금 토 일,20241012
Hakugintei오사카카레맛집메뉴추천직장인맛집 ,옆 외국인 반 틈 이상 카레 맛 진짜 카레 방문 추천 hakugintei 쿠 오사카 맛집 오사카 카레 맛집 일본 맛집 일본 카레 맛집 hakugintei,20241013
오사카 야키니쿠 맛집 우메다 죠네츠 호르몬 혼밥 혼술,오사카 야키니쿠 맛집 우메다 죠네츠 호르몬 혼밥 혼술 글 사진 에피 오늘 오사카 야키니쿠 맛집 우메다 죠네츠 호르몬 혼밥 혼술 온 후기 준비 오사카 맛집,20230930
일본 오사카 현지인 맛집 난바시장 310엔 우동,일본 오사카 맛집 알 난바 시장 때 마다 난바 우동 자꾸 눈 가게 우동 오사카 난바 시장 현지 맛집 무조건 추천 만사 형통 Blog Tip Insta luvand Blog Tip Insta luvand,20240220
오사카 우메다 맛집 하나타코,전 오늘 오사카 여행 우메다역 하나 타코 오사카 맛집 우메다역 하나 타코 진정 맛집 인정 오사카 우메다역 하나 타코 위치 우메다역 번 출구 쪽 오사카 하나 타코,20241010
오사카 난바 여행 맛집 호텔 놀거리 도톤보리 총정리,피트 보기 오사카 난바 맛집 오사카 여행 이번 오사카 여행 곳 중 난바 맛집 두 곳 야키토리 테 오사카 여행 일본 꼬치 구이 판매 테,20240911
일본 오사카 난바 맛집 데판야끼 이세에비 스테이크 전문점 ,계정 링크 통해 이용 일본 오사카 맛집 난바역 맛집 일본 오사카 난바 맛집 오사카 스테이크 맛집 일 이세 비 오사카 이세 비 츄나곤 chunagon 일본 고급 요리 철판 구이 히카리 chunagon,20230926
오사카 현지인 맛집 모모타로 오꼬노미야끼,오사카 현지 맛집 생맥주 매실주 콜라 하이 볼 오사카 맛집 일본인 친구 단골 오 꼬 노미 끼 맛집 모모타로 모모타로 화 일 브레이크 타임,20240311
오사카 난바역 맛집 토미타 규카츠 주말 오픈런 웨이팅 후기,제 방문 곳 오사카 규 카츠 맛집 토미 타 규 카츠 토미 타 규 카츠 맛집 역시 맛집 bb 제 규 카츠 중 가장 오사카 맛집 중 저 bb,20241007
오사카 가성비 야키토리 맛집 이자카야 토리키조쿠 다이코쿠쵸점,오사카 야키토리 맛집 답 소스 수 양념 안 소금 야키토리 주문 개인 덜 제 입맛 더 두 가지 야키토리,20240923
가로수길 맛집 오사카 도톤보리의 오코노미야끼를 맛볼 수 ,오코노미야끼 맛집 치보 이번 오사카 히로시마 금방 또 신사역 가로수길 오코노미야끼 분 치보 추천 신사동 맛 치보,20240926
블챌 일본 오사카에서 먹었던 맛집amp노맛집,그 인정 곳 정말 인정 만 곳 내 추천 맛집 포스팅 블챌 블로그 린지 일본 오사카 오사카 맛집 오 사 카노 맛집 오사카 식당 추천 오사카 당비 추천 간사이 공항 음식점,20241001
오사카 맛집 쿠이야_정육왕 야키니쿠 추천 식당일본여행 리뷰,국 할머님 손맛 고기 인지 술 아주 쭉쭉 오사카 야키니쿠 맛집 정육 야키니쿠 추천 가게 인기 평소 현지 것,20240930
lt일본 오사카gt 아기와 가기 좋았던 맛집들  난바 동양정 ,개월 아기 오사카 여행 방문 맛집 기록 난바 맛집 양정 토 테이 지인 적극 추천 아기 다시 곳 것 오사카 맛집 저장 amp 기록 amp,20240710
오사카 신사이바시 맛집 토리소바자긴 닭고기 라멘,현 지인 오사카 맛집 맛 국물 맑은 육수 우엉 라멘 사이드 끼 스시 별미 오사카 신사이바시 맛집 오사카 라멘,20240322
오사카 오코노미야끼 맛집 찐 로컬 현지인 맛집 텐마 치구사,오코노미야끼 대부분 도톤보리 난바 쪽 오사카 맛집 진짜 로컬 감성 현 지인 부터 맛 텐마 오사카 오코노미야끼 맛집 치 구사 한번,20240818
일본 오사카 오마카세 도톤보리 니쿠야 와규 맛집 찐추천예약 ,모두 일본 여행 일 오 사 카오마 일 오 마카 세 오 사 카오마 도톤보리 오 마카 세 도톤보리 맛집 오사카 맛집 니쿠 오사카 규 맛집,20240425
일본 오사카 우메다 공중정원 오꼬노미야끼 맛집 lt키지きじgt,오사카 맛집 요 오사카 우메다 공중정원 맛집 키 우메다 스카이 빌딩 점 후기 기록 끝 오사카 맛집 오사카 오 꼬 노미 끼 오사카 야끼소바 오사카 모 단 끼 오 사카키 키 스카이 빌딩 점,20241007
일본 오사카 와규 맛집 흑모와규 야키니쿠 미츠루みつる 새벽 ,심야 새벽 영업 저녁 식사 가능 현지 인과 관광객 모두 곳 A 등급 품질 규 타캣 식도락 여행 미츠루 소개 영상 오사카 규 맛집 미츠루 특징 A,20240815
오사카 난바  가성비 맛집 미야모토 무나시 24시간 영업,amp 오사카 여행 오사카 맛집 가성 비 맛집 모토 무 나시 일본 가정식 식당 가성 비식 일본 만원 이하 식당 오사카 오픈 오사카 가성 비 리얼 맛집 클릭 amp,20240923
오사카 신사이바시 맛집 A5 등급 와규 오마카세 니쿠야,오사카 신사이바시 맛집 규 때 여기 가세 니쿠 글 사진 여행 인 플루 오사카 규 분 가성 비 고기 예약 오사카 맛집 니쿠,20240331
오사카 혼자여행 시리즈 현지인 야키니쿠 맛집 만노 호텐 후기,오사카 맛집 시리즈 정리 해 중 오늘 오사카 현지 맛집 야키니쿠 호텐 추천 포스팅 한번 목차 가게 정보 위치 내부 메뉴 식사 후기 가게 정보 주소 일본,20241004
오사카 모미지 もみじ 도톤보리 근처 예약 없이 방문 찐 맛집 ,일본 오사카 맛집 모 미지 SNS 상 오사카 전여친 맛집 핫 모 미지 도톤보리 바로 앞 숙소 소테츠 그랜드 프레 사 호텔 도보 정도 소요 곳답 웨이 팅 SNS,20240627
오사카 간사이공항 맛집 551호라이만두메뉴 가격 추천메뉴,호 만두 간사이 공항 점 소개 오사카 간사이 공항 맛집 호 만두 위치 Kansai 가능 오사카 맛집 호 라이 만두 간사이 지방 전통 중국 만두 전문점 요 위치 Kansai,20240928
오사카 맛집 모음이치란라멘 모토무라규카츠 레드락 덴뿌라 ,계획 이번 여행 완벽 오사카 맛집 웨이 팅 지옥 아시 쥬 저 이번 모토 무 규 카츠 맛집 저번 오사카 여행 웨이 팅 포기,20241004
일본오사카 우메다 오코노미야끼 맛집 야마모토 네기야키,오사카 맛집 오사카 현 지인 맛집 오사카 야마모토 기 키 오사카 우메다 맛집 오사카 야끼소바 맛집 오사카 오코노미야끼 맛집 오사카 오코노미야끼 존맛 오사카 현 지인 추천,20240923
오사카여행 도톤보리 난바 오코노미야끼 맛집 아지노야 본점 ,점심 라멘 초밥 오코노미야끼 저녁 걸 추천 오사카 오코노미야끼 오사카 맛집 도톤보리 맛집 난바 맛집 아지 노야 본점 오사카 노야 오코노미야끼 맛집 오사카 여행 일본여행,20241004
오사카 맛집 도톤보리 강뷰보며 쿠시카츠 다루마 메뉴 튀김꼬치 ,오사카 맛집 도톤보리 강뷰 쿠시카츠 다루마 메뉴 튀김 꼬치 맥주 오늘 포스팅 오사카 튀김 꼬치 쿠시카츠 다루마 오사카 도톤보리 맛집,20240508
오사카 츠루동탄 비추천 도톤보리 우동 맛집 글쎄,유명 맛집 차라리 맛집 것 여행 도움 오사카 맛집 비 추천 후기 우메다 스시 맛집 추천 후기,20240416
오사카 맛집 지도 3탄 위스키샵 추천 위스키를 좋아하신다면 ,오늘 추천 드릴 곳 오사카 위스키 맛집 저 위스키 오사카 위스키 오사카 오사카 여행 오사카 맛집 오사카 드럭스토어 오사카 드럭스토어 추천,20241004
오사카 맛집 모미지 헤어진 오코노미야끼 야끼소바 맛집,오사카 맛집 허리 정도 웨이 팅 간 곳 중 가장 곳 중 군데 한번 꼭 맛집 임 모 미지 오사카,20240623
일본 여행quot카메스시 총본점quot_오사카 맛집_오사카 초밥 맛집추 ,전 솔직 후기 계세 포스팅 돈 산 후기 카 메스 총 본점 오사카 맛집 오사카 초밥 맛집 추천 우메다 스시 우메다 초밥 서이추 이웃 추가,20241005
일본 오사카 교토 맛집 라멘 미야코 기온점,위치 주소 F Gionmachi Kitagawa Higashiyama Ward Kyoto 일본 전화번호 영업 시간 일 목 금토 일본 맛집 오사카 맛집 일본 오사카 맛집 교토 맛집 오사카 교토 F Gionmachi Kitagawa Higashiyama Ward Kyoto,20240223
오사카 맛집 후쿠노마이 신사이바시 복어코스요리 예약,후쿠 노마 오사카 맛집 예약 꼭 곳 httpsbegopancomfukunomaishinsaibashihonten 생애 첫 일본 여행 야키니쿠 스시 저 오사카 신사이바시 맛집 httpsbegopancomfukunomaishinsaibashihonten,20230821
텐만바시점  오사카성 근처 토마토라멘 맛집 오사카맛집 추천,F 오사카 근처 맛집 만 카이 오픈 요 전 도착 앞 의자 수 메뉴 스캔 친구 추천 메뉴 의미 F,20240929
오사카 현지인 맛집 톤테키 난바워크점,오 조 억만년 일본 오사카 밥 매우 현지 맛집 리뷰 오사카 톤테키 난바 워쿠점 Osaka Chuo Ward Sennichimae Chome Osaka Chuo Ward Sennichimae Chome,20240904
오사카 맛집 우메다 카메스시 총본점 메뉴 추천,일본 오사카 맛집 우메다 맛집 카 메스 시 영업 시간 수 금요일 토 월요일 화요일 다른 오사카 스시 맛집 방문 못 비교 분석 웨이 팅 이유,20240924
오사카 맛집 야끼니꾸 마루 신사이바시 본점 웨이팅 없이 방문,오사카 끼니 맛집 마루 꼭 한번 방문 오사카 맛집 오사카 신사이바시 끼니 마루 신사이바시 마루 신사이바시 맛집 신사이바시 끼니 오사카 끼니,20241007
lt오사카 맛집gt 생맥주가 정말 맛있는 오사카 현지인 추천 ,lt gt 오사카 맛집 오사카 생맥주 오사카 생맥주 맛집 우메다 맛집 우메다 스시 오사카 스시 오사카 일심 스시 일심 오사카 스시 일심 오사카 곳 오사카 스시 맛집 lt gt,20240321
오사카 난바 맛집 난바역 이자카야 우라난바 교자 카와사키,오사카 난바 맛집 난바역 이자카야 난바 교자 카와사키 오사카 여행 마지막 날 친구 마지막 밤 그대로 오사카 난바 맛집 소고기 교자 이자카야 카와사키 난바역 이자카야,20240921
일본 오사카  츠텐카쿠 쿠시카츠 맛집 Kushikatsu ,httpsmapsappgooglPGfYLippLef fy i g stcomgooglemapspreviewcopy 일본 일본여행 일본 오사카 오사카 여행 도톤보리 맛집 오사카 맛집 오사카 여행 일정 KushikatsuBenkei 츠텐카쿠 츠텐카쿠 타워 슬라이더 httpsmapsappgooglPGfYLippLef fy i g stcomgooglemapspreviewcopy KushikatsuBenkei,20241004
오사카 여행 맛집 추천 도톤보리 이치란 라멘 별관 후기,도톤보리 치즈케이크 맛집 리쿠 오지 오사카 여행 도톤보리 도톤보리 맛집 이치란 라멘 이치란 라멘 도톤보리 도톤보리 이치란 라멘 별관 오사카 맛집 추천 도톤보리 맛집 추천 오사카 라멘 도톤보리 라멘,20240920
오사카 우메다 모츠나베 맛집 오오야마,예약 방문 매장 앞 워 웨이 팅 해도 수 모츠 베가 야마 우메다 점 추천 돈 산 오사카 태교여행 우메다 맛집 모츠 베 맛집,20241006
오사카 쿠시카츠맛집 다루마 신사이바시점,다루마 쿠시카츠 쿠시카츠 다루마 일본 쿠시카츠 오사카 쿠시카츠 오사카 쿠시카츠 맛집 난바 쿠시카츠 도톤보리 쿠시카츠 신사이바시 쿠시카츠 오사카 맛집 난바 맛집 도톤보리 맛집 신사이바시 맛집,20241011
오사카 맛집 떠먹는 말차 티라미수를 먹을 수 있는 곳 ,일본 오사카 후카 오카 지하철역 연결 쇼핑몰 지하 매장 편 것 친구 소개 맛집 바로 MACCHA HOUSE 맛차 하우스 말차 하우스 MACCHA HOUSE,20240711
오사카 맛집 지유켄 난바 본점 다시 찾은 명물카레,영업 명물 카레 맛집 저 재 방문 일본 여행 분 추천 오사카 맛집 지유 켄 오사카 명물 카레 지유 켄 카레,20240307
오사카 우메다 스시 맛집 마루만스시 소네자키점,마루 스시 소 네 자키 점 우메다 스시 맛집 추천 포스팅 httpsblognavercomjay 오사카 맛집 오사카 스시 우메다 맛집 우메다 스시 마루 스시 httpsblognavercomjay,20230625
일본 오사카 맛집 신사이바시 야키니쿠 와규 오마카세 니쿠야 ,오사카 규 오 마카 세 ya 일본 소 규 등급 숫자 것 가장 등급 A 오사카 신사이바시 A 등급 규 합리 가격 오 마카 세 코스 수 곳 바로 ya A A,20240422
오사카 맛집  호불호 없는 도톤보리 근처 오코노미야끼 전문점 ,오사카 여행 꼭 음식 중 하나 오코노미야끼 한국 호불호 맛집 강추 웨이 팅 오픈 런 거나 저녁 베스트,20241010
오사카 맛집 이치란라멘 오사카 우메다점,이치란 우메다 일본 Osaka Kita Ward Shibata Chome B F 매일 오사카 맛집 이치란 라멘 오사카 우메다 점 지하철 우메다역 근처 위치 오전 Osaka Kita Ward Shibata Chome B F,20240204
