title,chunked_description,postdate
오사카우메다 루쿠아 쇼핑몰 맛집 몬자야끼 모헤지 웨이팅,오사카 몬자 끼 맛집 모 헤지 우메다 루쿠아 쇼핑몰 맛집 층 지난번 도쿄 몬자 끼 도쿄 또 음식 오사카 핫 우메다 다행 또 우메다역,20240213
일본오사카 코하쿠 루쿠아오사카  오사카 프렌치 레스토랑 ,일본인 친구 여기 요즘 오사카 핫 핫 거 못 이름 코하쿠 glpfh NfxGwHEhzyB 코하쿠 루쿠아 오사카 Osaka Osaka wwwgooglecom 주문 자리 곳 테블릿 glpfh NfxGwHEhzyB Osaka Osaka wwwgooglecom,20240519
오사카 하루카스 300 전망대 입장권 가는법 헬리포트 오사카자 ,오사카 하루 카스 전망대 현지 핫 오사카 자유여행 온 사람 비롯 가족 끼리 연인 끼리 방문 경우 제 방문 날 비 후 구름 가득,20240521
오사카 간사이공항에서 교토 가는법 하루카 티켓 예약 자유석 ,일본인 친구 추천 오사카 맛집 amp 호텔 amp 핫 후기 구경 quot 여행 필수 템 일본 로밍 오사카 맛집 리스트 quot quot 오사카 쇼핑 리스트 quot quot 오사카 핫 리스트 amp amp quot quot quot quot quot,20240401
오사카여행 아부리야 한큐 예약방법 오사카 야키니쿠 ,층 인터넷 예약 필수 안뇽 오사카 맛집 오사카 키 오사카 야키니쿠 아부 리야 오사카 아부 리야 오사카 핫 오사카 맛집 추천 야키니쿠 일본여행 가족 여행 오사카 아기 아기 오사카,20231205
일본 오사카 아담한 까눌레가게 아기자기 예쁘고 ,눌 레드 재팬 오사카 까눌레 오사카 빵 순례 오사카 디저트 오사카 맛집 오사카 카페 오사카 핫 까눌레 맛집 오사카 빵 오사카 여행 사쿠라 역 사쿠라 오사카 구 움 과자 빵 순례,20240812
ENTP의 4일 간의 혼자 떠난 일본 여행 오사카  난바 ,오사카 핫 이 난바 바로 옆 도톤보리 PM 도톤보리 숙소 짐 도톤보리 오사카 곳 꼭 사진 곳 PM,20240821
구디 이자카야오사카 술집을 그대로 재연한 핫플 노군 꼬치,정보 주소 서울 구로구 디지털로 층 호 영업 시간 일요일 정기 휴무 단체 이용 가능 구 디 이자카야 오사카 술집 그대로 재연 핫 꼬치 포스팅,20240308
202405 일본여행 5일차 오사카 교토이동  카와라마치호텔 ,일본여행 포스팅 대장정 간다 오사카 교토 여행 중 교토 차 start 처제 가방 카 라마 치역 핫 교토 도착 자마자 예약 숙소 체크 일단 체크 시간 start,20241012
나만의 컵라면 만들기 오사카 컵라면박물관,오늘 하루 오사카 여행 오사카 핫 오사카 컵라면 박물관 닛 신 컵라면 박물관 나 컵라면 만들기 오사카 기념품 오사카 기념품 추천 닛 신 컵라면 오 사 카아 곳,20230724
오사카 여행1일차 난바도톤보리  간사이 공항 하튼 호텔 ,오사카 쇼핑 오사카 스테이크 오사카 밥 오사카 꼭 곳 오사카 우정 여행 오사카 포토 스팟 오사카 핫 비지 트 재팬 웹 간사이 공 항우 법 우메다역 숙소 오사카 디즈니 오사카 산리오,20230224
오사카 현지인 핫플 덴마평점 4점 이상의 야끼니꾸 가게스시 ,오사카 여행 중 가장 곳 덴마 역 근처 야타이 거리 포장마차 거리 오사카 덴마 다음 무조건 방문 도톤보리 주변 덴마 유 Chome Chome,20221110
일본 오사카 우메다맛집 이사리비 마부장추천 바로 구워주는 ,사리 비 솔직 후기 오사카 이자카야 우메다 이자카야 오사카 오픈 그릴 로 바다 끼 로 바다 키 오사카 곳 오사카 유명 맛집 우메다 유명 맛집 우메다 핫 오사카 핫 사리 비시 사리 비 오픈 시간,20231220
딸과 둘이 떠나는 오사카여행 글리코상 포토스팟 amp 도톤보리 ,오사카 여행 사진 글리코 이 글리코 왜 것 오늘 리뷰 오사카 핫 플로 도톤보리 글리코 상의 포토 스팟 정보 글리코 상의 유래 대해 리뷰,20240416
일본여행 오사카 2박3일 여행_1일차3 현지인맛집 추천 ,오사카 박 여행 일정 차 간사이 국제공항 오사카 시내 이동 숙소 도착 옛날 오사카 핫 밤 쯤 주변 가게 거의 분위기 생각,20240512
신상 광안리핫플 일본 감성의 분위기 좋은 술집 오사카 리카이쿠,날 손님 북적 북적 신상 광안 리핫 분위기 술집 등장 전 얼른 오사카 리카 이쿠 영업 시간 매일 라스트 위치,20230520
일본 여행 3 오사카 한인타운 VS 차이나타운,차이나타운 블로그 위 한국어 해시태그 개 추천 오사카 차이나타운 오사카 여행 일본 차이나타운 도톤보리 오사카 맛집 일본 길거리 음식 오사카 탐방 일본여행 오사카 핫,20130208
범계 맛집 오사카 전통 카츠 환상적인 핫플 이자카야 쿠시카츠 ,일요일 오사카 전통 쿠시카츠 일등 맛집 가격 퀄리티 최상 주문 메뉴 쿠시카츠 가지 애호박 마늘 시샤 모 돈카츠 까망베르 치즈 단호박 미소라멘 쿠시카츠 채소 때,20240409
12월 오사카 날씨 옷차림 실시간 여행 패딩 코트 어그,안 산책 날씨 아아 수 정도 오사카 날씨 수 세상 힙 오사카 핫 알 더 오늘 귀국 날 여기,20231204
오사카 도톤보리 이치란라멘 주문방법 황금레시피,오사카 핫 도톤보리 숙소 바로 앞 더 도톤보리 도톤보리 맛집 정말 라멘 집 건물 역시 오사카 핫 답 수란 등장 수 맥주,20230224
대전봉명동 오사카데스 글리코상 유성 핫플 술집 일본 ,대전 봉명동 이자카야 신상 핫 솔직 후기 오늘 가게 lt 오사카 데스 gt 식당 위치 오사카 데스 봉명 점 봉명동 우산 거리 한가운데 위치 유성온천역 lt gt,20240216
퇴사여행  한달살기 오사카 여행 코스 추천 카페거리 장미 ,코스 예 뷰 뷰 나카 자키 초 카페 거리 요즘 핫 오사카 나카 자키 초 카페 거리 차카 차카 차카 초 내내 간 기대 달리 날,20240608
오사카 맛집 카메스시 총본점히츠마부시 빈쵸겐키,식사 일본 오사카 맛집 카 메스 시 카 메스 총 본점 히츠 마 부시 츠마 부시 빈 장어 밥 야끼소바 오코노미야끼 문어 튀김 오사카 안주 오사카 맛집 오사카 식당 오사카 핫,20230429
오사카 신상카페우메다 나카자키초 카페 닐 neel가츠산도 ,오사카 핫 플로 자키 쵸카 페 거리 를 문 카페 앞 일본인 자키 쵸카 페 자키 쵸맛 집 키 쵸핫 오사카 여행 오사카 카페,20230612
오사카 워홀 오사카 맛집 핫플  소노다ソノダ,기다림 탓 당시 대기 시 간정 기억 더 후회 가득 다음 오사카 오사카 바이스 츄몬 시 마스,20210913
일본 가족 자유여행 3일차 오사카성 도톤보리맛집글리코상 핫플,아침 일찍 오사카 구글 앱 지도 찾기 오사카 성 일본 명성 글리코 사진 핫 글리코 상이 곳 오른쪽 나노하 화장품 가게 거기 옆,20230901
오사카 여행2일차 유니버셜 스튜디오 재팬  할리우드 드림 ,일본여행 오사카 여행 오사카 박 오사카 쇼핑 오사카 꼭 곳 오사카 우정 여행 오사카 포토 스팟 오사카 핫 오사카 유니 버셜 유니 버셜 스튜디오 유니 버셜 스튜디오 재팬 유니 버셜 스튜디오 식당,20230422
일본카페 교토핫플 오사카자유여행 중 발견한 ,여행 첫 날 블루 보틀 교토 이후 소우 소우 상점가 구경 발견 코 도넛 교토 별 생각 사람 꽤 알 우리나라 노티 드 도넛 MZ 세대 인기 MZ,20221112
일본 오사카 도톤보리 호텔  홀리데이 인 오사카 난바,오사카 묵 호텔 오사카 핫 도톤보리 한국인 숙박 호텔 홀리데이 인 오사카 남바 예약 실제 우리 때 한국인 위치 도톤보리 크루즈,20230515
일본 오사카 여행 숙소 호텔 추천 젠티스 오사카 조식,젠 티스 오사카 호텔 진짜 주변 나무 활용 푸릇푸릇함 호텔 창 통해 호텔 조식 온 어디 오사카 핫 곳 온 것 착각 저 총 두,20230829
일본 오사카 자유여행  츠케멘 つけ麺 먹고 도톤보리 道頓堀 ,오 일 오사카 곳 일 오사카 핫 방문 곳 곳 도보 이동 코스 정 때 방문 듯 오사카 여행 계획 중이 라면 루트,20240117
오사카 남바맛집 라이프마트 아직도 편털,축복 오 제 키 마루 사케 한잔 모듬 사시미 여행 마무리 이제 편의점 좀 털 좀 라이프 마트 오사카 맛집 오사카 마트 오사카 핫 오사카 힙플,20231216
오사카 나카자키초 카페거리 투어  오니기리 고리짱 ,라떼 푸딩 오사카 핫 이자 레트로 감성 자키 초 카페 거리 오사카 분 추천 완벽 그 자체 자키 초 식사 디저트 코스 소개,20240225
홀리데이인 오사카난바난바 위치최고 호텔 오사카 여자셋 ,홀리데이 인 오 사타 난바 홀리데이 인 오사카 남바 Holiday Inn Osaka Namba 주소 Soemoncho Chuoku Osaka 체크 체크아웃 오사카 명물 오사카 핫 오사카 포토 죤 Holiday Inn Osaka Namba Soemoncho Chuoku Osaka,20240724
오사카 기타하마의 주말_나카노시마 공원 산책,오사카 중앙 공회당 동네 분위기 더 멋 줌 쪽 나카노시마 공원 가기 전 광장 어르신 젊은이 비율 거 여기 오사카 핫 사람 곳 골,20230829
17개월 아기랑 오사카 여행아카짱혼포 오사커피 메이지켄,나고야 일정 마치 오사카 오사카 당일치기 일정 아기 모닝커피 오사카 핫 카페 한국인 건 핫 방증 자리,20231106
오사카 osaka 쇼핑 쇼핑 핫플 오렌지스트리트 orange street,지난 오사카 빈티 투어 오사카 쇼핑 메 오렌지 스트리트 를 소개 오렌지 스트리트 길 번화가 도톤보리 입구 입구 보아,20231220
부산 핫플 술집quot오사카리카이쿠quot,오사카 리카 이쿠 영업 시간 라스트 회사 마치 불금 제대로 만끽 광안 리 이자카야 술 한잔 광안역 번 출구 근처 찾기 내부,20230401
오사카여행3일차4 도톤보리 철판구이 야끼소바 맛집 테판,위치 도톤보리 근처 맛집 오사카 맛집 난바 맛집 오사카 철판요리 오사카 핫 오사카 한국인 맛집 오사카 구글 맛집 오사카 야끼소바 오사카 오 꼬 노미 끼 일본 맛집 일본 철판요리 맛집,20230806
일본 오사카 패키지 여행 먹부림 1일차,일본 오사카 고베 교토 나라 일 월 화 박 금액 저 이제 오사카 핫 신사이바시 도톤보리 출발 도톤보리 다리 앞 도착 도톤보리 크루즈,20240627
오사카 우메다 현지 직장인들 핫플 lt장어덮밥gt 이즈모 루쿠아 ,오사카 우메다역 루쿠아 백화점 지하 층 식당 쭈욱 그 중 장어 밥 고고 평일 쯤 바로 입장 지나 일본 직장인 데이트 장어 밥 메뉴,20230131
천안핫플  쌍용동 맛집 오사카 훈와리 치즈케이크,천안 핫 쌍용동 맛집 오사카 훈 와리 치즈케이크 일본 치즈케이크 오사카 훈 와리 치즈케이크 천안 일본 디저트 일단 생각 때문,20170602
일상홍대 홍대이자카야 오사카오야붕 가기,나 D 둘이서 곳 바루 홍대 핫 오사카 오야 붕 층 바로 위치 오사카 오야 붕 밖 바로 일본 느낌 홍대 맥주 집 홍대 술집 완조 추천 층 거 보고 D,20240724
일본 오사카 교토여행 2일차 기요미즈데라  철학의 길,올해 벚꽃 만 일본 마음 교토 향 전날 오사카 핫 구석구석 핫 첫 방문 기요미즈데라 사진 곳 안,20240625
교토 금각사 봄꽃 가득한오사카성 여행,포토 존 오사카 오사카 천수각 층 전망대 도심 뷰 오사카 핫 물빛 오사카 천수각 묘 기분 오사카 광고 잠깐 보시 httpsmblognavercomn httpsmblognavercomn,20230228
오사카 덴마 야끼니꾸  히시메키야 텐만본점,도톤보리 난바 교통 중심지 우메다 현지 핫 덴마 오사카 먹방 여행 라면 덴마 지역 방문 오사카 덴마 맛집 시메 키 본점 오사카 여행 동선,20230606
일본 오사카 교토 4박 5일 자유여행 일정 공유,오사카 코 구경 것 수족관 관리 더 구경 수 바로 근처 정말 장인 맛집 료 스시 집 야경 핫 하루 카스 하루 카스,20241006
울산명촌핫플이자까야 오사카로맨스,명촌 곱창 차로 명촌 이자 오사카 로맨스 입구 오사카 로맨스 인테리어 테이블 저희 좀 시간대 조금 사람 별로,20190212
일본오사카 호텔 만족도 100 닛코오사카 숙박한 찐 찐찐 ,역 오사카 주요 핫 위치 공항 버스 오사카 핫 중심 위치 매우 간사이 공항 리무진 버스 최고,20240106
난바초밥맛집 쿠라스시 글로벌 난바점 일본가족여행 오사카여 ,난바 초밥 맛집 쿠라 스시 글로벌 난바 일본 가족 여행 오사카 여행 꿀팁 일본여행 오사카 여행 일본 기념품 교토 기념품 친구 여행 오사카 핫 일본여행 경비 여행지 추천 오사카 곳,20240103
구미이자카야 핫플 가성비 추천 구미술집_오사카데스,안주 오늘 구미 봉곡 구미 이자카야 오사카 데스 방문 완전 구미 봉곡핫 사람 분위기 안주 하나 하나,20240211
오사카 워홀 워홀러가 말아주는 나카자키초 카페와 빈티지샵 ,igshidMTNiYzNiMzkwZA D Damputm sourceqr 나카 자키 초 나카 자키 초 카페 거리 오사카 카페 거리 오사카 핫 나카 자키 초 카페 나카 자키 초 맛집 나카 자키 초오 사 커피 osacoffee neel ourlog 오 사 카빈 티 샵 igshidMTNiYzNiMzkwZA D Damputm sourceqr osacoffee neel ourlog,20231205
오사카 클럽 정보 일본에서 활동하는 한국인 DJ가 오사카 ,오사카 클럽 상황 이해 영업 암 모나 이용 더욱더 전략 오사카 클럽 문화 실 수 생각 오늘 오사카 핫 클럽 암 모나,20240713
울산 삼산 밥집 오사카멘치 울산 삼산 돈까스 맛집 남구 핫플 인정,밥집 오사카 멘치 주말 웨이 팅 기본 생각 돈까스 맛집 왜 핫 플로 음식 입 순간 바로 납득 수 정도 음식 퀄리티 맛 식당 메인 외,20230908
오사카 가족끼리 첫 해외여행  이번엔오사카로 가다,건강 하자 오사카 오사카 유카타 햅 파이브 관람차 도톤보리 글리코 가족 여행 해외여행 오사카 여행 오사카 여행 코스 오사카 곳 오사카 핫 블챌 체크 린지 서이추 서로 이웃 추가,20230609
쿠시카츠 다루마 메뉴 14종 후기 오사카 도톤보리 맛집,도톤보리 맛집 도톤보리 술집 도톤보리 쿠시카츠 오사카 맛집 오사카 술집 오사카 쿠시카츠 오사카 쿠시카츠 맛집 쿠시카츠 다루마 메뉴 쿠시카츠 다루마 도톤보리 쿠시카츠 다루마 오사카 핫 도톤보리 핫,20230513
오사카여행  난바파크스 프랑프랑크리스마스소품,크리스마스 프랑 프랑 오사카 여행 오사카 프랑 프랑 난바파크스 난바파크스 쇼핑 난바 핑크 덕후 도라에몽 토토 인형 오사카 핫 오사카 곳 일본여행 오사카 관광 서이추 환영,20221225
일본 오사카 여행  핫플 유니버설 스튜디오 재팬 워터 월드 쇼 ,사람 무리 속 앞 닌텐도 월드 표 구입 패스 워터 월드 향 사실 워터 월드 볼거리 줄 사람 자리,20230201
오사카여행 가볼만한곳 츠텐카쿠 타워슬라이더 전망대 주유패스,오늘 오사카 핫 관광지 츠텐카쿠 통천각 소개 전망대 자체 전망대 게다가 주 유패스 무료 오사카 여행 방문 곳 츠텐카쿠 주소 Chome Chome,20240110
분위기 좋은 오사카 도톤보리 리버뷰 카페 호시노커피,lt 오사카 핫 다른 곳도 구경 오사카 카페 도톤보리 카페 오사카 도톤보리 카페 추천 오사카 카페 추천 오사카 브런치 카페 오사카 브런치 오사카 리버 뷰 카페 오사카 뷰 카페 lt,20230120
대전봉명동핫플 신상술집 일본분위기 낭낭한 오사카데스 ,연말 친구 술자리 모임 손색 곳 봉명동 핫 신상 술집 안주 곳 오사카 데스 s ming all rights reserved s ming all rights reserved,20231128
오사카 오므라이스 원조 맛집  북극성 훗쿄쿠세이 ,추천 오사카 핫 다른 곳도 구경 오사카 맛집 오사카 오므라이스 오사카 오므라이스 맛집 오사카 현 지인 추천 맛집 오사카 맛집 오사카 성비 맛집 오사카 도톤보리 맛집,20230120
오사카여행 관광지 추천 하루카스300전망대 솔직후기 입장료 ,더 핫 레이스 함 기 이상 완전 관광지 지인 오사카 간다 난 신세카이 통천각 일몰 멍에 야경 멍 오사카 핫 관광지 오른쪽 바로 하루 카스,20240622
천안 쌍용동 맛집  오사카 훈와리치즈케이크 핫플 ,천안 쌍용동 맛집 오사카 훈 와리 치즈케이크 핫 요즘 천안 핫 쌍용동 맛집 오사카 훈 와리 치즈케이크 쌍용동 서브웨이 바로 옆쪽 위치 찾기 영업 시간 참고 단체 주문,20170512
오사카 맛집 아지노야 솔직 후기 및 웨이팅 꿀팁,아지 노야 일본 일본여행 오사카 오사카 여행 일본 맛집 오사카 맛집 오사카 데이트 오사카 밥집 오사카 술집 야끼소바 오코노미야키 철판요리 이색 맛집 오사카 핫 미쉐린 오코노미야키 야키소바,20230807
오사카 도톤보리 가성비 숙소 난바 근처 일본 여행 호텔 추천,오사카 도톤보리 글리코 무조건 보고 핫 오사카 도톤보리 숙소 웰리 호텔 체크 시간 프런트 데스크 운영 때문 시간 도착,20240914
일본 오사카 DAY 5  이치란라멘 본점 글리코상 신사이바시 ,일본 여행 DAY in 오사카 금 여행 일기 구경 매우 솔직 후기 일본 여행 in 교토 오사카 핫 일본 이색 카페 도착 아메리카무라 위치 mipig cafe DAY in in mipig cafe,20240224
오사카 쿠라스시 신세카이 쓰텐카쿠점 125엔 스시 가성비 최고,오사카 핫 답 볼거리 먹거리 아주 여행지 난바 전혀 다른 느낌 살짝 입구 앞 숫자 왜인 쿠라 스시 체인점 스시 집 몇개 안남,20230627
일본 오사카 교토 여행 가볼만한 곳 코스,알 오사카 교토 신상 핫 바로 신 칸 우체국 곳 일본 유명 건축가 켄고쿠마 손 복합 쇼핑 문 화공 탄생 곳 브랜드 샵 카페 식당 입점,20231017
오사카 교토사케논키빙고酒呑気びんご_교토핫플 현지인추천 ,최고 오사카 여행 오사카 이자카야 교토 이자카야 교토 맛집 오사카 현 지인 맛집 교토 현 지인 맛집 서이추 교토 여행 교토 술집 교토 핫 교토 분위기 술집 교토 예약 맛집 오사카 술집,20231031
성수맛집 죠죠 오사카 감성의 철판요리로 데이트코스 핫플,퇴근 자마자 곳 늘 웨이 팅 정도 핫 성수 맛집 죠죠 요 바로 소개 성 수 맛집 만끽 오사카 매력 줄 시간,20230920
오사카 숙소 추천 도톤보리 근처 호텔_본 콘도 난바 닛폰바시,오사카 가족 여행 숙소 때문 두 번 위치 도톤보리 오사카 핫 도보 지하철역 닛폰바시 역 난바역,20230925
호텔 뉴 한큐 오사카 Hotel New Hankyu Osaka,위치 정말 최고 직원 약간 추움 와이파이 좀 호텔 뉴 큐 오사카 Hotel New Hankyu Osaka 공항 버스 바로 숙소 앞 오사카 핫 숙소 근처 진짜 위치 Hotel New Hankyu Osaka,20240124
오사카 여행 3  오사카 가성비 이자카야 미즈가케차야 ,오사카 여행 오사카 박 여행 오사카 여자 명 여행 이치란 도톤보리 점 오사카 핫 오사카 클럽 도톤보리 클럽 오사카 더 핑크 오사카 THEPINK 클럽 더 핑크 오사카 무료 입장 클럽 오사카 주말 클럽 오사카 빵 맛집 THEPINK,20240320
오사카 후지야 호텔 Osaka Fujiya Hotel AGODA 아고다 ,오사카 숙소 호텔 추천 여행 추천 오사카 여행 호텔 리뷰 여행 스타 그램 호텔 투숙 기 오사카 관광 호텔 디자인 여행사진 오사카 여행 팁 호텔 숙박 여행 에세이 오사카 핫 호텔 투어 오사카 숙소 추천 후지야,20240918
서면술집 서면맛집 압구정편의점서면점 오사카 도톤보리 느낌 ,서면 술집 서면 맛집 압구정 편의점 서면 점 오사카 도톤보리 느낌 물씬 서면 핫 압구정 편의점 서면 점 외관 마치 오사카 도톤보리 구 리코 간판 것 여러가지,20241003
일본 오사카 맛집일본 오사카 라멘 맛집 토리소바 자긴 ,오사카 곳 오사카 핫 오사카 맛집 해외여행 토리 소바 웨이 팅 주소 Torisoba Zagin Niboshi Chome Minamisenba Chuo Ward Osaka 일본 영업 시간 매일 전화번호 Torisoba Zagin Niboshi Chome Minamisenba Chuo Ward Osaka,20231119
광안리핫플_광안역근처 일본술집 오사카리카이쿠 후기,오사카 리카 이쿠 수영구 수영로 번길 운영 시간 매일 주차장 광안 리 오사카 리카 이쿠 광안역 근처 위치 핫 술집 오픈 곳 광안 리 컬 주민 안 수 핫,20230527
일본오사카 오사카 도톤보리 카레맛집 하리쥬 카레숍 ,포스팅 오사카 여행 첫날 저녁 유 첫날 체력 도톤보리 오사카 핫 사람 진짜 거의 모든 식당 웨이 팅 터,20230414
압구정본점압구정로데오압구정 핫플 일본 오사카 갬성 ,압구정 수산시장 주소 서울 강남구 압구정로 길 층 영업 시간 매일 테이블 비도 운치 창가 자리 내심 기분 수박 볼 복숭아 볼 각,20230918
오사카 여행 룰루,오사카 여행 기록 용진 캐리어 내 캐리어 배 캐리어 감 다시 오사카 핫 플로 길 카메라 보고 사진 우리,20240520
오사카 닌텐도 스토어 아이와 함께 가면 좋은 우메다 ,Nintendo OSAKA 매일 오사카 닌텐도 스토어 우메다 다이마루 백화점 층 오사카 핫 포켓몬 센터 바로 옆 그 외 우메다 다이마루 백화점 층 원피스 토미카 Nintendo OSAKA,20240125
야당역 이자카야 철판오사카야 야당점 싸고 맛있는 데이트핫플 ,철판 오사카 야당 점 돼지 꼬리 볶음 부 이루 파인애플 아이스 디저트 파인애플 야당 핫 레이스 이자카야 출처 네이버 레이스 경기도 파주시 소리,20240602
3박4일 교토 오사카 부모님과 여행 DAY4 오사카성 도톤보리 ,교토 간의 여행 마치 귀국 날 엄마 오사카 처음 시 오사카 찍 밤 글리코 앞 사진 그때 저 멀리 오사카 핫,20240518
오사카카페 신세카이카페 일본 MZ 핫플 옛 다방 느낌이 그대로 ,오사카 카페 신세카이 카페 일본 MZ 핫 다방 느낌 그대로 레트로 카페 킷사텐 도레미 Chome Ebisuhigashi Naniwa Ward Osaka 일본 화일 월요일 휴무 MZ Chome Ebisuhigashi Naniwa Ward Osaka,20240305
대전 봉명동 핫플 일본간 줄 알았던 오사카데스,오사카 데스 봉명 점 위치 그 술집 거리 안 절말 일본 온 느낌 대전 봉명동 핫 우리 거의 오픈 자마자 점점 사람 나중 거의 정도,20231211
오사카 클럽 밤비 BAMBI 게스트 쿠폰,오사카 클럽 일본 클럽 오사카 클럽 밤비 난바 클럽 도톤보리 클럽 오사카 헌팅 오사카 핫 일본 여자 헌팅 오사카 지라 프 오사카 밤비 오사카 bambi 오사카 울 오사카 헌팅 포차 오사카 암 모나 bambi,20240710
오사카 3박4일 자유여행 히요리 호텔 난바 스테이션 위치 추천,도톤보리 수 오사카 난바 핫 명소 여행 가능 야식 아침 조식 제공 레스토랑 저녁 야식 제공 낮 개별 공간 카페 운영 곳 숙박 고객,20231127
울산 북구 매곡 분위기 좋은 술집 오사카로맨스,울산 울산 맛집 울산 북구 맛집 울산 매곡 이자카야 울산 북구 이자카야 호 술집 매곡 술집 호 핫 매곡 핫 오사카 로맨스 오사카 로맨스 매곡 점 매곡 맛집,20240617
자매 일본여행 희망편3_오사카amp교토우메다역 하나다코 ,파 싹싹 먹음 꾸리 꾸리 오사카 우메다 날씨 헵 파이브 어디 백화점 볼 거리 동생 요즘 오사카 핫 나카 자키 초 소품,20240702
오사카1일차5 오사카돈카츠 맛집 일본현지맛집 뉴베이브 ,유투브 돈까스 일본 돈카츠 오사카 돈까스 맛집 히레 카츠 오사카 로스 카츠 오사카 뉴베 이브 웨이 팅 뉴베 이브 예약 일 가면 곳 일본여행 코스 오사카 여행 코스 오사카 추천 오사카 맛집 오사카 핫,20230704
오사카 난바 야키도리 난반테이 꼬치구이 구글 47 가성비 ,오사카 여행 돈 산 정말 가격 식당 알 저 이웃 추가 공감 버튼 오사카 핫 쇼핑 리스트 로컬 맛집 위주 쭉 소개 월화 휴무,20240720
오사카 여행 8월 4박 5일 오사카 여름 여행 3일차  카페 ,요즘 오사카 핫 입장 마감 오사카 또 다른 전망대 하루 카스 내 야경 걸 인스타 핫 명성 한국인 사진 쩐잉,20231030
일본 오사카 자유여행  대길 大吉에서 술 한 잔 ,일 오사카 곳 일 오사카 핫 오키나와 나고야 교토 오사카 동안 총 개 도시 아주 힐링 여행 오 블로그 카테고리 일본 동안,20240312
일본 오사카 유니버셜스튜디오 맛집 최근 후기 오픈 입장 ,워낙 엔화 일본 분 중 본격 겨울 성 수기 주변 여행 준비 정말 오늘 요즘 오사카 최고 핫 오사카 유니 버셜 스튜디오,20231204
일본여행 오사카 도톤보리 돈키호테 쇼핑 할인쿠폰,숙소 오사카 핫 도톤보리 도보 컷 개꾸르 오사카 동안 매일 이 거리 숙소 링크 확인 멀리 서도 돈키호테 저 통 건물 쇼핑 타운,20231212
