title,chunked_description,postdate
여행이야기일본② 미식의 도시에서 이븐하게 먹지 않았어요,교토 박 트리오 캐리어 끌 오사카 난바 향 빗방울 맛집 이 세 군데 못 내일 또 일정 마음,20241013
일본 오사카 여행 3박 4일 1일차 날씨는 덥고 비오고 맛집도 ,오사카 차 맛집 모두 실패 차 즉흥 내 위치 맛집 결과 매우 성공 일본 오사카 차 맛집 다음 포스팅 첫날 저녁 비,20241013
여자 곽준빈 일상 공개,모츠 베 저 역시 한국인 추천 맛집 입맛 오마이갓 알바 또 제 맘 서비스 정신 백 점 만점 점 오사카 박람회 공원,20241013
오사카,교토 오사카 체크아웃 후 짐 호텔 쇼핑 데이 가짐 몽블랑 맛집 나 정망 밤친놈 조금 곳 미리 가격 말,20241013
혼자 간 오삭하는 벚꽃 만발,오사카 만구 마츠리 때 사람 더 이모 혼자 컴백 도톤보리 여기 탕후루 인기 짱 숙소 우산 혼자 서도 야끼니쿠 나 옹 웨이 팅 맛집 입장,20241013
반려견 동반 가능한 선택적 고립 캠핑장,유명 관광지 아침 고요 수목원 곳 맛집 편 그 중 구경 오사카 때 사서 고 고온 스노우 피크 도 코트 우리 캠핑 용품 스노우 피크,20241013
20242025 최신판 싱가포르 여행 가이드북 영진이의 매력적인 ,프렌즈 오사카 중앙 북스 정꽃 나래 정꽃 보라 오늘 핫딜 Best 이 가이드북 싱가포르 주요 관광지 문화 행사 맛집 추천 등 포함 한국인 위 Best,20241013
오사카 난바역 도톤보리 텐동 맛집 마키노 먹어봄,기본 상차림 오사카 난바역 텐동 맛집 마키 노 기본 상차림 구성 테이블 위로 테이블 매트 수저 물티슈 생강 준비 생강 텐동 때 적당 량,20241013
오사카 3박4일 자유여행3,오사카 박 차 숙소 뷰 방충 망 밤 모기 절대 외국인 맛집 느낌 포스팅 때 어묵 계절 아침 회,20241013
일본 여행 오사카 도톤보리 근처 호텔 후지야 호텔 스튜디오 ,새벽 낮 계속 울림 위치 도톤보리 맛집 근처 호텔 양옆 호스트 바 가게 유흥가 듯 오사카 후지야 호텔 도톤보리 스튜디오 트윈 난바 역 후기 방음,20241013
오사카오꼬노미야끼맛집모에기MOEGI오사카초밥맛집,지나 오사카 예정 교토역 오사카 난바 법 이제 JR 타고 교토역 오사카 난바 법 Moegi 모에 기 오 꼬 노미 끼 맛집 또 진 하이 볼 저희 메뉴판 기 끼 번 토핑 추가 파 JR Moegi,20241013
오사카 교토 아라시야마 맛집 다이쇼 하나나 오픈런 도미오차즈케,오사카 교토 아라시 야마 맛집 다이쇼 하나 오픈 런 도미 오차즈케 주소 Sagatenryuji Setogawacho Ukyo Ward Kyoto 일본 전화번호 영업 시간 교토 아라시 야마 첫 끼 버스 투어 Sagatenryuji Setogawacho Ukyo Ward Kyoto,20241013
오사카 여행 2일차 일정 유니버셜 신세카이  숙소는 욕탕 있는 ,저녁 초밥 머것 오 초밥 초밥 현지 맛집 여러가지 것 오사카 여행 계획 분 거 보고 체력 계획 것 안뇽,20241013
일본 오사카 여행 블로그 12일차_ 사실 뭐하러 간지 ,손수건 맛집 발견 요 우메다 햅 파이프 앞 사 람보 여기 시부야 날 일요일 참고 전 예전 오사카 고베 교토 박 로 관광 안,20241013
오사카 콘래드 데판야끼 Kura 쿠라 후기 입도 눈도 즐거웠던 ,이제 크리스마스 휴일 오늘 마지막 콘래드 오사카 맛집 데판 끼 철판요리 후기 오사카 콘래드 데판 끼 철판요리 맛집 쿠라 후기 Kura 오사카 콘래드 층 데판 끼 Kura,20241013
블챌 뒤늦은 라멘앓이,양말 오사카 여행 때 남편 거 거 하나 구입 비비안 웨스트우드 양말 남 엔화 마포 줄 라멘 맛집 남 라멘 라멘 때 우리 부부 일본 진짜,20241013
낭만을 찾아서 ,웃기 오사카 딸내미 선물 기여 버 딸내미 수업 때 보라 함 너 너 거 사람 맛집 찾기 열성 막 학기 대학생 몰타 추억 몰타,20241013
2019년의 오사카 규슈 여행,오사카 규슈 사진 못 단 SNS 스토리 사진 쿠시카츠 맛집 진짜 쿠시카츠 중 최고 배 세트 주문 모든 맛 SNS,20241013
컴백홈 한국인의 한국 적응기,오사카 여행기 막 우리나라 계란 김밥 김밥 집 발견 김태희 맛집 김태희 김태희 맛집 사장 성함,20241013
포토덤프 10월 7일  10월 13일,동대사 킨류 라멘 오사카 복판 김치 라멘 심지어 라멘 넥스트 시 카쿠 이번 여행 원픽 맛집 쇼핑 를 못 흑백 요리사,20241013
성수동 핫플 오꼬노미야끼 맛집 죠죠 성수점ft웨이팅 팁,계속 세 개 싹 비운 우리 예전 오사카 오코노미야끼 맛집 곳 별로 죠죠 성 수 점 일본 세트 외 다른,20241013
도쿄여행 혼자서도 잘 놀아요 Part1,일본도 원래 도쿄 오사카 생각 전혀 도시 도쿄 막상 한창 구경 카페 구글 지도 검색 닛포리 빵 맛집 요기,20241013
대문자 P의 베트남 나트랑 여행준비 및 항공권 숙소예약 ,치앙마이 오사카 유투브 정독 어디 뭐 데 공부 부산 티라미수 맛집 이름 여행지 정 일 다한 우리,20241013
들썩들썩 나홀로 오사카교토 여행,올해 출국 감 생심 일 정도 정신 공항 번 못 줄 대뜸 오사카 댕겨 출근 직전 오사카 여행 면접 준비 병행 정신 조합 여행 후기 항공권 진에어,20241013
교토 근교 여행 미호박물관 가는 법 맛집 추천 꿀팁 ,라이 연 오사카 교토 여행 박 의 차 이 여행 꽃 미호 박물관 방문 기입 니 차 오사카 여행 차 교토 시내 여행 여기 확인 미호 박물관 법 소요 시간,20241013
천사가 된 악마간코  오사카 마츠요시다이한텐 파기름시오라멘,도쿄 간코 풍경 혹시 오사카 관련 점포 진짜 대체 오사카 차슈 참기름 의정부 칼국수 맛집 밀 가마 고기 고명 미가,20241013
생크림 롤케이크의 매력에 빠지다  맛집 추천 레시피 팁,맛집 추천 레시피 팁 도지 마롤 생크림 롤케이크 유혹 맛 향연 도지 마롤 생크림 롤케이크 식감 맛 한번 헤어 수 말 일본 오사카,20241013
율량동술집 일본현지감성 이자카야 압구정편의점 율량점,율량 술집 일 현 감성 이자카야 압구정 편의점 율량점 오사카 감성 한국 메뉴 헌팅 맛집 명 수용 대형 술집 단체 모임 및 회식 공간 메뉴,20241013
연극 관람 후 데이트 코스추천 오코노미야키 맛집  우와 대학로점,테이블 철판 끝 수 오코노미야키 야끼소바 맛집 대학로 야마 이모 마 오코노미야키 오사카 전통 소스 오사카 클래식 시 그 니 처,20241013
일상 포토덤프 6회차_일주일 하루로 요약,일주일 순삭 후기 사진 날 하루 요즘 정신 수요일 분명 휴일 뭐 기절 곧 일본여행 간다 맛집 추천 오사카 교토 주말 서울 나들이,20241013
오사카 우메다 호텔 이비스 우메다 ibis osaka umeda hotel,오사카 우메다 위치 이비 스 우메다 호텔 리뷰 위치 복잡 위치 오사카 죽 일 위치 일단 길 건너 세븐일레븐 편의점 주변 맛집 음식점 정말,20241013
오사카 신사이바시 카페 스트리머 커피 컴퍼니 라떼 맛집,라멘 맛집 오사카 후기 아래 체크 메뉴판 영 어로 주문 수 신사이바시 카페 오사카 라떼 맛집 더니 메뉴판 가장 위 라떼 메뉴,20241013
슬기로운 덕질생활,타르트 맛집 담 또 가야 와우 홍대 오타쿠 투어 옴챠 혼돈 팟 오사카 숙소 정 겸 거 때 해도 나 진짜 거 지원이,20241013
아프냐 나도 아프다,하인성 오사카 남자 대체 왜 너 영 이 언니 나 해 이유 생각 움 연속 프랑 제리 슈크림 빵 정말 스마일 찹쌀 꽈배기 성연 추천 맛집,20241013
율량동술집 압구정편의점 율량점,헌팅 맛집 명 수용 대형 술집 단체 모임 오사카 감성 한국 메뉴 판매 한국 일본 두 가지 감정 퓨전 이자카야 간단 메뉴 일식,20241013
숨겨진 보석을 찾아 떠나자  가까운 지역의 해외 여행지 3곳 ,밤낮 활기 도시 분위기 만끽 맛집 투어 야시장 탐험 역사 유적지 방문 도쿄 오사카 교토 일본 대표 도시 볼거리 거리 제공 중국,20241013
일본해외여행 오사카 3박 4일 중 3일차2 우메다 유니클로,오사카 여행 박 중 차 유니 버셜 스튜디오 이후 오후 일정 진짜 체감온도 말 벌벌 마침 한국인 직원 다행 이후 인스타 맛집,20241013
압구정편의점 율량점 일본 도톤보리 현지감성술집인 율량동술집,오사카 감성 한국 메뉴 판매 한국 일본 가지 감성 퓨전 금토 청주 이자카야 율량 술집 청주 맛집 율량 맛집 청주 압구정 편의점,20241013
22세 오사카 또 가다,나리 두번째 일본여행 또 가게 게다가 또 오사카 이번 교토 감 여행 계획 유튜브 블로그 통해 알 맛집 구글 예약,20241013
17 짱 더웠던 여름일기,간 오사카 바론 짝궁 걸 건 여름 능선 맛집 게 강아지 능선 인생 샷 노력 지붕 자기 집 애,20241013
방이동고기집  가성비 좋우 한우 야끼니꾸 맛집 일월애오사카,일본 성 낭낭 끼니 집 고해 방이동 고기 집 일월 애 오사카 방이동 맛집 송파 맛집 방이동 골목 맛집 일월 애 오사카 방이 골목 위치 월요일 휴무 영업 시간 브레이크,20241013
삿포로 3박4일 여행1일차오타루도미인프리미엄호텔오타루 ,스시 맛집 와라쿠 gt 오타루 운하 야경 gt 호텔 야식 소바 서비스 인천공항 출발 스타 항공 일전 오사카 때 간다 위탁 수하물 항공권 예약 기 내 반입 kg 라서 무게 gt gt kg,20241013
10월 둘째주,오사카 실바 안 가든 고민 아이 첫 가족 여행 만큼 제일 코스 달빛 구 운 고등어 집앞 맛집 가야 가야 이번 처음 폭풍 흡입 과식,20241013
오사카밤도깨비 여행기 4  2일차 아침 라멘,외침 길 원조 한국어 간판 보고 둘 오 저기 원조 곳 곳 라멘 집 안쪽 우리 자리 꽉 띠용 맛집,20241013
먹방이 하고 싶었던 나약한 인간들의 부산행,오사카 설 야키니쿠 더 원래 현지 맛집 메뉴 메뉴인 지라 어르신 대부분 현지,20241013
도쿄여행 디즈니씨 어트랙션  판타지스프링스 오픈런 ,디즈니 맛집 casbah 카레 집 판타지 스프 링스 오픈 날 사람 못 오사카 유니버셜 스튜디오 개 정도 판타지 스프 링스 덕분 그날 casbah,20241013
월간9月 월간일기_9월  꽤 괜찮았던 한달,화가 날 알콜 대신 논 알콜 탕수육 후추 향 우리동네 맛집 탕수육 설빙 오사카 근교 바다 고베 스마해수욕장 매우 물멍,20241013
10월 2주 평범한 한 주의 일상들,소금 빵 맛집 솔트 바 맛 몇 번 더 알 사장 언니 만 간 오사카 꼭 편의점 낫또 김밥 임 헤헤 금요일 교 오픈 날 교 스리 모임,20241013
뿌듯 한 주,오사카 숙소 완류 계획 빵 사 달라 구 거려 빵 완두 앙금 빵 맛집 악 마루 마루 층 언니 금방 간다 기적 별 계단,20241013
분기에 한번씩은 일본가는 사람의 일본맛집 스페셜  5탄 ,오사카 교토 회사 워크샵 패키지 감 도쿄 인생 맛집 전제 모든 것 시간 순 내 입맛 맛집 임 각 편 대표 사진 제 일 맛집 인내심,20241013
일포덤 14,초 맛집 이름 페 피스 곧 콩 슐랭 가이드 호 등재 예정 관심 격려 오사카 간 보 차 비행기 타고 밥 좀 안 야외 테니스장,20241013
오사카 우메다 맛집 우메다역 루쿠아 모토무라 규카츠 메뉴 ,한국 규 카츠 가짜 진짜 오사카 맛집 여태 일식 맛 깨 충격 충격 충격 오사카 우메다역 맛집 샐러드 또 조합 또 소스,20241013
10월 ➁,떡볶이 맛집 바로 집 떡 반 집 바로 집 내 노 곳 조금 거리 관계 오사카 이후 이제 사람 성심당 정말 장난 사람,20241013
오사카 여행,저 맛집 첫 간 곳 대기 수산 도톤보리 점 초밥 사케 역시 해산물 하나 이상 맛집 탐방,20241013
멋쟁이토마토랑 서울구경,뽕 사진 다운 타우 너 한남동 맛집 여행 항상 우리 살 여행 다음 번 여행 오사카 아이러브유,20241013
나랑 눈 오는 날 삿포로에 갇힐래,여름 오사카 욤 뿌뿌 겨울 눈 펑펑 삿포로 제목 숙소 근처 아무 곳 현지 맛집 글 뱅이 너구리 하나 거,20241013
10월 일상 조각 1,짝꿍 오사카 만 닭 요리 댕존맛 회 먼저 고기 목 뎅 고기 서울 맛집 투어 그냥 파티 룸 칭구덜 서울 애 술,20241013
초딩1 아들과 여행 초1 여름방학 특집 일본 오사카교토에서 ,초딩 학년 여름방학 일본여행 초딩 아들 오사카 교토 여행 오사카 한여름 찜통 더위 오사카 맛집 초밥 집 편의점 생맥주 최고 오사카 줄 서서 타코 맛집 타코 오사카 타코 맛집,20241013
여행후유증으로 일주일 뚝딱,언니 꼭 오사카 진짜 맛집 리스트 아침 응떡 진짜 맛 도리 임 소 이 자식 만화방 영화 일요일 줌 이제 내일 현생,20241013
국내도 맛집 투어의 매력  여행 덕후의 취미는 바로 맛집 ,세계 국내 맛집 투어 매력 여행 덕후 취미 바로 맛집 탐방 헬로 오늘 내 진짜 뿐 일본 오사카 수 오사카 뭐 뭐 해도 초밥 타코야끼,20241013
발산역 맛집 amp 카페 일품 amp 소카크,회 속 용 주신 것 특 사시 미동 올해 도쿄 오사카 교토 이 디저트 때 교토 이 디저트 맛집 카 사키 교토 방문 때,20241013
오사카 여행 도미 인 프리미엄 난바 아넥스 내추럴 핫 스프링 ,밥상 저절로 느낌 기분 탓 내일 조식 또 오사카 호텔 조식 오사카 미인 프리미엄 난바 넥스 내추럴 핫 스프링 호텔 조식 오사카 여행 오사카 쿠시카츠 맛집,20241013
찍먹하고 온 2박 3일   ,첫 일본 여행지 오사카 갑자기 가기 말 박 이지 실질 맛집 만큼 외국인 관광객 정말 내 땐 모든 테이블 한국인,20241013
후쿠오카 모츠나베 하카타역 벤텐도 1인 곱창전골 가능한곳,구글 리뷰 한국인 이 날 모두 일본 현지 맛집 오사카 교자 후쿠오카 식당 미니 교자 겨,20241013
오사카 도톤보리 호텔 가족여행 추천 대욕장 도미인 프리미엄 ,부산 김해 공항 국제선 주차장 주차 요금 및 편의점 식당 맛집 난 카이 난바역 도톤보리 맛집 호 라이 만두 오사카 도톤보리 가족 향 호텔 도미 프리미엄 난바 넥스 호텔 lt 난 카이 난바역 택시 숙소 lt,20241013
율량동술집 청주이자카야 압구정편의점 율량점,곳 율량동 위치 가장 핫 술집 오사카 감성 수 곳 금토 율량 술집 청주 이자카야 청주 압구정 편의점 청주 맛집 율량 맛집,20241013
 오키나와 둘째날  흐린동굴과 흐린사진,맛집 데 시간대 웨이 팅 바로 입장 거 일 반 맛 남친 거 난 크게 관심 오사카 유닛 멤버 대신 구경 입구,20241013
일본오사카 상등카레 본점 맛이 매력적인 우메다 카레 맛집,오사카 우메다 맛집 상등 카레 본점 추천 일본 카레 전문점 매콤 카레 판매 상등 카레 경험 것 내 돈 산 다음,20241013
대구 교동 술집 네이바훗도  대구 교동 이자카야 맛집,네이바 훗 대구 교동 술집 대구 교동 이자카야 맛집 만 대구 핫 교동 후쿠오카 오사카 기본 밑반찬 세 팅 자릿세 기본 한국 공짜,20241013
맛집 포스팅 신신라멘 텐진본점 らーめん ShinShin 天神店 ,맛집 강탈 중 당신 데 나 또한 대체로 이해 후쿠오카 오사카 도쿄 라멘 집 다른 가지 위 게시 총 가지 소스,20241013
오사카 교토 여행 가성비 숙소 오리엔탈 호텔 교토 로쿠조 ,비 오지 우려 것 오사카 날 동안 날씨 아주 아주 아침 커튼 하늘 맛 여기 교토 뷰 맛집,20241013
일본 여행 1탄 부모님과 오사카 여행 준비  항공권 숙소 ,맛집 식당 정보 것 내 보지 후기 식당 몇 가지 아부 리야 도톤보리 끼니 맛집 내 친구 추천 끼니 무한리필 끼니 히후,20241013
일본 2일차 여행,말 바야흐로 살때 첫 일본여행 오사카 그때 발견 맛집 이자카야 역시 맛집 웨이 팅 첫 오사카 여행 때 주일 여행 동안 저녁 여기 그,20241013
친구들이랑 오사카 3박 4일 여행기 3일차우지 당일치기 녹차 ,차 여행기 차 여행기 일본여행 오사카 근교 여행 오사카 근교 추천 우지 마을 오사카 녹차 우지 맛집 교토 우지 맛집 교토 우지 말차 녹차 소바 녹차 우동 우지 녹차 우지 말차,20241013
오사카 우메다역 에키마르쉐 현지인 오차즈케 맛집 위치 ,오사카 오사카 여행 오사카역 맛집 오사카역 오사카 현 지인 맛집 오차즈케 오차즈케 맛집 다시 차즈케 마르 쉐 민쥬 미팅 때 이사 추천 오사카역 오차즈케 맛집,20241013
등촌역 야키니꾸 맛집 숯 SOOT 일본식 소고기 구이 맛집,메뉴 끼니 맛집 숯 메뉴판 공개 단일 메뉴 아우라 오사카 정통 끼니 재현 위해 셰프 노력 저희 성인 인 기준 소 g 선택 g,20241013
오사카 오사카에서 하카타라멘 하카타무스메 博多っ娘,오사카 하카타 라멘 하카타 무스 메 오사카 맛집 오사카 라멘 초역 가게 앞 전경 라멘 전문식 자판기 주문 종이 쪼가리 전달 것,20241013
전주 서신동 술집 숯마카세 세트가 최고인 이자카야 숯토리,전주 서신동 술집 전주 서신동 맛집 전주 서신동 이자카야 전주 이자카야 서신동 이자카야 서신동 술집 오사카 후추 테바 사키 SET 오사카 후추 가라아게 SET 종류 SET SET,20241013
맛집후쿠오카 맛집 추천2,후쿠오카 한국어 더 것 모토 무 규 카츠 다른 지역 도쿄 오사카 등등 맛집 너 무 곳 다음 후쿠오카 또 먹방,20241013
오사카 자유여행 츠텐카쿠 전망대 신세카이 거리 후기야경 ,츠텐카쿠 에펠탑 개선문 모방 오사카 랜드마크 이 거리 진짜 골목 사진 맛집 골목 타워 우뚝 이 거리 건,20241013
을지로 유카네에비스 생맥주가 있는 을지로의 작은 일본,일본 생맥 오사카 링크스 층 에비스 bar 거리 맛집 분위기 더 것 대세 듯 유카 근처 오락실 농구 한판 bar,20241013
2024 OSAKA  KYOTO  DAY 1,한창 업무 문자 공항 도착 내 오사카 간다 얘기 기억 미스터리 자신 오사카 맛집 링크 공유 걸 전 그,20241013
교토 여행 가는 길 시치조역 쇼유라멘 맛집 멘야 에디션 교토본점,교토 여행 길 시 치조 역 쇼유라멘 맛집 에디 션 교토 본점 오사카 박 의 두 날 이 날 교토 당일치기 날 박 의 일정 맛집 방문 동선,20241013
도쿄 그 순간이 네가 도쿄에 빠지는 순간이다,로컬 맛집 메뉴판 손글씨 체 좀 손님 일본인 몰루겠다 도 달라 싹싹 빎 정말 우히힛 무사 탑승 이제 오사카,20241013
오키나와 3박4일 페러세일링 모토무라 블루씰 돈키호테 ,오사카 극한 웨이 팅 다시 오리온 맥주 수 맛집 튀김 바삭 고급 진 맛 한가지 점 음식,20241013
일상포토덤프 1071013,나라 나카타 도 나라 쑥떡 맛집 완전 맛집 나라 무조건 팩 이상 오사카 장어 나카쇼 신사이바시 점 오픈 한지 얼마 맛집 사람,20241013
오사카여행 비 오는 날 도톤보리 글리코상 타코야키 맛집 ,오사카 e 패스 권 구 입처 httpsmyrealtrip usl 오사카 여행 도톤보리 도톤보리 맛집 도톤보리 여행 도톤보리 타코야키 도톤보리 타코야끼 도톤보리 뮤 지엄 뮤 지엄 미키 도톤보리 킨류 라멘 e httpsmyrealtrip usl,20241013
2024 4월 오사카amp교토 벚꽃여행,OSK 다시 방문 오사카 이번 봄 키 맛집 리스트 가격 조금 부위 별로 선택 곳 인생 맛집 OSK,20241013
20241013 오오니시류세이 웹일기,만 오사카 로케 통천각 당장 한국 쭈꾸미 맛집 진짜 쭈꾸미 류쩨 임 돗 치하 진짜,20241013
10월 2주차 일상,이번 추석 때 일본 오사카 칼디 메론 스프레드 도전 무늬 떡볶이 맛집 떡볶이 꼭 공항 구경 좀 자개 악세사리 좀 맘 급,20241013
구구콘 9월9,보 나중 남 구 쥐 일단 오사카 유니버셜 먼저 혜화 맛집 여기 진짜 짱 분위기 펍 내 선택 칵테일 진,20241013
오사카여행 4일차 가족여행 교토아라시야마기모노숲,사과 맛집 봉 사서 교토역 지하 상가 카레 우동 전문점 카레 우동 그닥 선호 편 일본 한번 마음 그릇 주문 맛집 인정,20241013
오사카 맛집 3일차 점심 카레 맛집은 도쿠마사,일본 오사카 맛집 차 점심 오사카 방문 계획 처음 일본 지하철 이용 때문 오사카 주변 카레 맛집 도쿠 마사 추천 덕분 일본 카레,20241013
성수 따뜻한 오뎅이 생각날땐 성수 오뎅바 성수오뎅,검색 도중 오사카 오뎅 바 곳 성수 오뎅 가기 결정 서울 오뎅 바 성수 이자카야 성수 술집 성수역 맛집 성수역 성수역 술집 성수역 이자카야 성수역 오뎅 바,20241013
내돈내산 줄 서서 먹는 오사카 도톤보리 타코야끼 맛집ㅣ ,오사카 도톤보리 맛집 오사카 도톤보리 타코야끼 오사카 타코야끼 오사카 타코야키 오사카 타코야끼 맛집 도톤보리 타코야끼 도톤보리 타코야키 오사카 여행 쥬 하치 방 주 하치 방 쥬 하치 방 도톤보리 점,20241013
오사카근교여행 긴테츠 나라역 맛집 돈카츠 간코 とんかつ ,땐 오사카 숙소 당일치기 일정 지난번 늦가을 초겨울 것 다음 날 오사카 때 JR 선 이용 킨테츠 역 도착 좀 시각 일단 JR,20241013
오사카맛집 가이세키요리 theKappo,오사카 맛집 일본요리 전문점 오사카 사람 마츠다 부장 추천 The Kappo 가이세키 요리 유튜브 quot 오사카 사람 quot 채널 운영 마츠다 부장 추천 맛집 The Kappo quot quot,20241013
후쿠오카여행1일차오호리공원후쿠오카타워,첫 느낌 오사카 도시 공항 뭔가 대도시 후쿠오카 시골 공항 강릉공항 양양공항 모 모치 해변 카 함바 오코노미야끼 니 시진 맛집 니 시진 역 후쿠오카타워 도큐 레이 하카타,20241013
오사카 교토 4박 5일 여행 코스 일정 할 만한 것 맛집 총정리,타코야끼 오코노미야끼 다른 지역 맛집 쿠시카츠 꼭 오사카 해 저 항상 쿠시카츠 다루마 방문 부모님 입맛 하나 안,20241013
후쿠오카 돈돈 야끼니꾸 맛집 추천,일본 끼니 집 면 요리 맛집 듯 육수 새 콤 시원 오사카 때 여기 역시 실망 심지어 동생 고기 때 내 생각,20241013
광주 쌍촌동 파티 술집 정스트하우스 운천점 분위기 최고,오사카 오뎅 탕 일단 주문 술 마시기 온 언니 술 못 쌍촌 술집 파티 술집 정 스트 하우스 운천 점 정 스트 하우스 쌍촌점 정 스트 하우스 호점 쌍촌 안주 맛집,20241013
오사카맛집추천 오사카 현지인 맛집  일본 닭요리 맛집 ,돈 산 맛집 오사카 맛집 오사카 맛집 추천 일본 맛집 오사카 닭 요리 신사이바시 맛집 오사카 현 지인 맛집 난바 맛집 난바 저녁 오사카 닭다리 구이 닭 요리 맛집 일본 닭다리 구이 신상 맛집 오사카 여행,20241013
25개월아기랑오사카여행 숙소 카락사호텔 오사카난바 ,도톤보리 맛집 위주 때문 크게 비교 무료 취소 카락 사 호텔 오사카 난바 예약 해 거리 열차 타고 난바역,20241013
 4일차,정리 오사카 일정 거 슴 인스타 강가 주변 가지 못 But 카레 맛집 건 밥 양 수 점 나 S 오빠 M L But S M L,20241013
오사카 루쿠아 맛집 라뒤레 마카롱 에코백 가격,우리 결혼기념일 주년 케이크 라뒤레 스파 케이크 둘 못 것 엄마 에코 손 오사카 카페 마카롱 맛집 오사카 기념품,20241013
스시야미 천호본점 천호초밥맛집 천호로데오거리 스시추천,골목 스시 집 오사카 뒷골목 여행 맛집 기분 천호동 영업 곳 맛 보장 스시 내부 모습,20241013
서울 약수역 쿠시카츠맛집 쿠시바 오사카 안가도 되는 ,쿠시바 쿠시카츠 마제 소바 맛집 약수역 쿠시바 쿠 시가츠 오사카 필요 약수역 맛집 쿠시바 바삭 존뜩 간도 쿠시카츠 매콤 마제 소바 달달 하이 볼 한잔 하루,20241013
남영역amp숙대입구역 맛집 2차로 방문하기 딱인 이자카야 ,남영역 amp 숙대입구역 맛집 요 이 땅 남영 요 이 땅 남영은 남영 돈 옆 차로 쿠시카츠 오사카 시작 고기 채소 꼬치 튀김 옷 기름 꼬치 amp,20241013
부천 호윤  후회 없는 메뉴 숙성회 감태후토마끼 추천,부천 호윤 리뷰 호윤 부천 호윤 숙성 회 감태 후 토마 끼 맛집 예 약 DM 가능 주 사진 대왕 와사비 진짜 존맛 고요 게살 크림 고로케 명란 감자 오사카 DM,20241013
매력적인 도시 오사카,야키니쿠 맛집 세 군데 오사카 한국인 가장 일본 도시 만큼 관광지 도톤보리 유니버셜 스튜디오 재팬 오사카 성 우메다 스카이 빌딩 시텐노지,20241013
