title,chunked_description,postdate
오사카 꼬치 맛집현지인 야키토리amp이자카야일본 MZ 핫플,다시 오사카 맛집 포스팅 오늘 일본 현지 야키토리 맛집 소개 나루토 평일 다시 오사카 여행 가게 더 식당 접 저 재 방문 계획 현지 MZ MZ,20230820
오사카 교토 5박 6일 여행 스케줄 핫플부터 숨겨진 맛집까지 ,오사카 도톤보리 글린코 앞 사진 여러분 저 MBTI ENFJ 남 핫 핫 전부 감성 사진 맛집 성 맛집 여행 시간 금 최대한 효율 루트 MBTI ENFJ,20230215
오사카 주유패스 예약 1일권 2일권 구입 사용 오사카여행코스,지금 오사카 주 유패스 대해 정리 횟수 제한 지하철 버스 이용 핫 관람 포함 이보 더 효율 준비물 여러 번 방문 사람 위 소개,20240818
오사카 스카이빌딩 우메다 공중정원 카페 가는법 입장료 주유패스,저 오사카 방문 때 핫 우메다 우메다 공중정원 오사카 우메다 만인 출장 오사카 겸사겸사 일정 다음 관광 투어,20240609
대문자 P의 오사카 여행 1일차  한큐리스파이어호텔 ,비지 트 재팬 오사카 여행 꿀팁 오사카 여행 핫 오사카 간사이 공항 간사이 공항리무진 일본 꿀팁 돈토 보리 이자카야 난바 술집 난바 회전초밥 도톤보리 회전초밥 난바 현 지인 맛집 티웨이항공 오사카,20231220
오사카여행 비 오는 날 도톤보리 글리코상 타코야키 맛집 ,오사카 여행 차 나라 고베 여행 오사카 여행 날 오사카 e 패스 오사카 인증샷 핫 플로 곳 이동 비 혼자 셀카 봉 인증샷 찍기 e,20241013
오사카여행 프랑프랑 방문 우메다역쇼핑,제 이야기 그 핫 wego 보지 못 다음 여행 핫 먼저 오사카 지역별 공략 다시 wego,20181022
오사카 난바역 맛집 스시로바타 키타로 스시 예약 방법 후기,핫 때 정말 일본인 분위기 정말 화로 구이 구경 재미 음식 오사카 맛집 완전 추천 곳 저,20241011
봉명동 술집 오사카 감성 낭낭한 압구정편의점,대전 유성구 문화 원로 층 호 매일 인스타그램 얼핏보 일본 오사카 핫 안쪽 힙 실내 포차 분위기 바깥쪽 야장 분위기 취향,20240420
오사카 여행 gtgt 나카노시마 미술관과 덴마크 인테리어 ,현 지인 핫 레이스 공기 기분 나카노시마 미술관 앞길 헤이 오사카 헤 오사카 HAY 오사카 오픈 카페 오사카 카페 추천 오사카 나카노시마 카페 오사카 맛집 오사카 핫 HAY,20230422
남자 혼자 오사카 여행 코스  오사카 가볼만한 곳 추천 5곳,안녕 일본여행 일본 혼자 여행 오사카 여행 오사카 혼자 여행 오사카 여행 코스 오사카 곳 오사카 핫 오사카 추천 코스 오사카 코스 추천 오사카 명소 오사카 관광지 추천 오사카 관광,20230330
나혜석거리맛집 오끼에서 오사카 분위기 가득한 데이트 ,내부 마치 오사카 포장마차 것 조명 매력 가게 수 원 핫 일본 분위기 술집 수원 나혜석 거리 가챠 뽑기 인계동 핫 수원 맛집 추천 가성 비 맛집,20241010
괴정 맛집 일본가정식 파는곳 오사카,오사카 부산 사하구 낙동대로 번길 괴정 핫 오사카 제 대학생 때 인기 만 하단 점심 십년 방문 것,20230914
홍대술집추천 일본 분위기 낭낭한 오사카오야붕 홍대본점,홍대 핫 오사카 오야 붕 메뉴 특징 쿠시카츠 다루마 마지막 간 언제 오사카 가격 역시,20240726
일본여행 클룩 오사카 주유패스 가격 지하철 관광지 덴포잔 ,주요 오사카 명소 여기 해당 패스 소지 이 핫 방문 오사카 천수각 우메다 공중정원 햅 파이브 관람차 츠텐카쿠 전망대 덴포잔 관람차 등 여기 해당,20240616
오사카 한신백화점 우메다 닷사이 23 일본 가격 사케 종류,이번 일본 간사이 지역 여행 때 오사카 시작 교토 박 일정 쭉 핫 신 백화점 우메다 신 백화점 닷 사이 마침 짝꿍 생일 기념 여행,20240604
2024061120240615 나홀로 런던,타칭 핫 캠든 캠든 마켓 핫 고스 청년 머리 채 잡기 사실 오사카 유니버셜 스튜디오 곳 더 진짜 살짝 직접,20241014
율량동 핫플 대형 술집 압구정편의점 율량점 율량동술집,압구정 편의점 율량점 가장 매력 한국 일본 두 가지 감성 동시 수 퓨전 이자카야 스타일 요 일본 오사카 도톤보리 현지 분위기 그대로 듯 인테리어 간판,20241014
교토_이즈미야초 와구리 전문 사오리  밤 몽블랑 ,별 또밥 오사카 일정 교토 일 정도 비주 얼 디저트 가게 한번 주위 오사카 교토 간다 추천 집 교토 방문 꼭,20241014
우치다 오사카  일본 5박6일 여행 우메다 나가자키초역 핫플 ,우메다 맛집 호르몬 우치다 웨이 팅 일본 오사카 오사카 여행 일본 끼니 맛집 오사카 끼니 맛집 오사카 설 오사카 설 맛집 우메다역 맛집 우메다 핫 오사카 핫 오사카 끼니 웨이 팅,20241014
부산 광안리 핫플 간빠진새 일본의 생맥을 그대로,박 간의 부산 여행 요즘 sns 핫 간 꼭 생각 무 계획 삿포로 생맥 잔 오사카 치킨 배 간 간 남친 안주 sns,20241014
구월동 로데오거리 한우대창전골 맛집 호랑이굴,저희 오사카 쿠시카츠 표고버섯 오징어 콘 어묵 아보카도 튀김 아주 바삭 맥주 핫 호랑이 굴 꼭 방문 웨이 팅 보람,20241014
오사카 여행기 3편 교토 당일치기 여행 카만자 장어덮밥 맛집 ,오사카 차 시작 By 부 리몬 오사카 여행 뭐 교토 대도시 역시 교토 핫 답 후 시미 이나리 신사 사람 정말 저희 성수 기인 벚꽃 By,20241014
구미 산동 맛집 우마이 일본 야키니쿠 감성을 그대로 느낄 수 ,최근 핫 플로 아주 늘 손님 오픈 바로 예약 제 후쿠오카 오사카 여행 때 일본 야키니쿠 여기 잠깐 야키니쿠 일본,20241014
안국 인사동맛집 추천 한 접시 2200원으로 이안초밥에서 ,줄 핫 네네 이안 초밥 회전초밥집 날 해산물 또 도요새 오사카 때 기억 새록새록 매장 전반 우드 톤 가구,20241014
2024年 9月,츄 일기 사진 일기 데 일리 유학생 일상 도쿄 유학생 일본여행 제 일리 일기 일상 도쿄 맛집 도쿄 핫 도쿄 여행 울 핫 교토 여행 오사카 여행 치보 오코노미야끼 교토 맛집 오사카 맛집,20241014
일본 오사카 교토 버스투어 유투어버스 당일치기 여행 ,일본 오사카 교토 버스 투어 유투 버스 당일치기 여행 아라시 야마 금각사 청수사 인연 연애 신 신사 노노 신사 방문 교토 핫 관광지 답 사람 정말,20241014
압구정편의점 일본의 감성을 담다 꼭 가봐야 할 핫플레이스,일본 감성 경험 수 장소 압구정 편의점 압구정 맛집 서울 맛집 오사카 감성 숙성 회 핫 레이스 친구 데이트 장소 울 핫,20241014
8월 도쿄 극성수기 8월 도쿄 4박5일 여행 후기,오사카 때 타워 시내 적 도쿄 관광지 핫 사람 물레방아 가이드 진짜 사람,20241013
11월  오사카 2박 3일 카메스시 나카자키초 카페거리 ,핫 정말 일본 만화 법 동네 느낌 오사카 관광지 중 여기 제일 오 사 커피 도착 후쿠오카 HUK COFFE 어디가 본점 모름 당시 첫 정우성 HUK COFFE,20241013
홍대입구 룸술집 2차로 추천 야키토리잔잔 홍대직영점 분위기 ,오사카 추천 꼬치 종 마늘 은행 소금 구이 닭 껍질 교자 말리부 오렌지 유즈 볼 하이 볼 먼저 동반 가능 홍대 룸 술집 홍대 단체 술집 홍대 분위기 술집 홍대 핫 술집 홍대 야키토리 맛집 홍대역 술집,20241013
일본 오사카 자유여행 4박 5일 장어덮밥 오사카성 도톤보리 ,박 일본 오사카 자유여행 차 기록 교토 일일 투어 후기 먼저 사진 인스타 핫 오토 장어 밥 먹기 발 우버 이용 우리,20241013
체인소맨 주술회전을 찾아서 후쿠오카 점프샵 애니메이트 ,Chome B Sumiyoshi Hakata Ward Fukuoka 일본 후쿠오카 쇼핑 핫 캐널 시티 도쿄 오사카 지점 후쿠오카 파르코 백화점 층 위치 Chome B Sumiyoshi Hakata Ward Fukuoka,20241013
양천향교 일본 현지식당 분위기를 그대로 옮겨담은 362키친 ,마치 오사카 식당 온 듯 기분 창가 쪽 혼밥 인 좌석 구비 핫 법 곳 동네 자주 방문 것 밤 이자카야,20241013
성수동 핫플 오꼬노미야끼 맛집 죠죠 성수점ft웨이팅 팁,계속 세 개 싹 비운 우리 예전 오사카 오코노미야끼 맛집 곳 별로 죠죠 성 수 점 일본 세트 외 다른,20241013
멋쟁이토마토랑 서울구경,종로 핫 아저씨 쩜프 북 술집 이름 기 억 안나 하여튼 우리 살 여행 다음 번 여행 오사카 아이러브유,20241013
오사카 출국 전 일상2,관리 거위 대구 카페 구 핫 카페 카페 개인 엮 자식 때문 진짜 가지 고민 쓰레기 때문 내 안 이유,20241013
대구 교동 술집 네이바훗도  대구 교동 이자카야 맛집,네이바 훗 대구 교동 술집 대구 교동 이자카야 맛집 만 대구 핫 교동 후쿠오카 오사카 기본 밑반찬 세 팅 자릿세 기본 한국 공짜,20241013
후쿠오카여행 왇더요 맛집 포스팅 신신라멘 텐진본점 ,뭐 나 핫 무조건 하루 종일 알 꽉 찬 오사카 도쿄 라멘 집 다른 가지 위 게시 총 가지 소스 만두,20241013
오사카여행 비 오는 날 도톤보리 글리코상 타코야키 맛집 ,오사카 여행 차 나라 고베 여행 오사카 여행 날 오사카 e 패스 오사카 인증샷 핫 플로 곳 이동 비 혼자 셀카 봉 인증샷 찍기 e,20241013
오사카 도톤보리에서 유명한 타코야끼 핫플 맛집 앗치치혼포,핫 이 번 방문 것 듯 도톤보리 타코야끼 오사카 타코야끼 오사카 맛집 도톤보리 맛집 타코야끼 맛집 도톤보리 혼포 혼포 오사카 혼포,20241013
Fukuoka blog,후보 오사카 도쿄 후쿠오카 세 곳 고민 제 인스타 모 모치 해변 사진 보고 웨이 팅 드 고요 뭐 해 핫 심지어 때 일본,20241013
241001241004 상하이 3일차장원 정안사 치바오 양꼬치,봉은사 핫 한가운데 무게 감 사찰 사실 사진 미리 때 별 감흥 인민 광장 임 오사카 우메다 로마 테르미니 이 바로 앞 상하이역 사 박물관,20241013
DAY 1나고야 여행 근데 교토와 오사카를 겯들인 4박 5일 ,교토 오사카 겯들 여행 파워 J 이동 여행 만큼 계획 미리 지하철 타구 핫 플로 이동 원래 나고야 Exit nishiki 생각 사람 가게 J Exit nishiki,20241013
스페샬나잇트 대구교동점  대구 교동 이자카야 맛집,나 베가 인기 메뉴 오사카 탄탄 베 오니기리 구이 주문 수저 물통 교동 맛집 교동 술집 교동 이자카야 교동 핫 교동 곳 교동 분위기 스페샬나잇트 교 동점,20241013
Tokyo 여행이라 쓰고 쇼핑이라 읽는다,사이 핫 홍대 병 아침 미니 오기 오사카 오코노미야끼 도쿄 몬자 끼 몬자 끼 첫 경험 명란 치즈 몬자 끼,20241013
도쿄여행 3일차  사쿠라트램 이케부쿠로 선샤인시티 ,괜차 오사카 카 돈까스 길 미스트 리트 핫 인 밥 양 중소 양배추 중소 수 밥 중 양배추 소,20241013
호치민 맛집 여행 1군 레탄톤 일본인 거리 가볼만한 이자카야 ,군 핫 글 사진 원안 별 돈 산 원안 별 나트랑 곧 오사카 달 살기 예정 호찌민 군 레탄톤 더 이유 일본,20241013
김현준은 내게 5타수 5안타 경기를 선물하라,존나 핫 것 사진 왜 여 깃 일기도 맛 기 이상 비장 바보 진짜 유니 줌 굿 쌀 통닭 생각 삐 내 오사카 갓 온 벌써,20241013
아기랑 해외여행 오사카 도톤보리 원더크루즈 리버크루즈 ,도톤보리 리버 크루즈 현 장발 오사카 도톤보리 원더 크루즈 공홈 예약 핫 시간대 꼭 예약,20241013
신사역 가로수길 맛집 도톤보리서울,신사역 핫 신사 맛집 신사역 가로수길 맛집 도톤보리 서울 주차 신사역 가로수길 맛집 도톤보리 서울 먹방 영상 야시장 사 카야 오사카 도톤보리 입구,20241012
솔직후기 건대술집 일본 감성 가득한 요즘 MZ 핫플 ,굳이 멀리 가지 일본여행 것 느낌 물씬 오사카 거리 술 듯 느낌 기분 술 술술 분위기 뿐 안주 핫 술집 답,20241012
부산 광안리핫플 간빠진새 국내 최고의 삿포로 생맥주,부산 광안 리핫 간 새 소개 단연 코 제 생맥주 중 원 탑 말 수 오사카 치킨 닭 껍질 튀김 매콤 달콤 교자 버터 문어 구이 햄 카츠 삿포로 생맥주,20241012
일본 여행  오사카 1 DAY,각 게 내 스탈 사이드 미러 위치 박 동안 숙소 핫 바로 앞 접근성 최공 짐 바로 초밥 길 왜 오사카 인기 키키 한국 치면 그냥,20241012
초록 초록한 여름의 기요미즈데라,교토 오사카 자유여행 차 일출 날씨 허락 주지 아침 사람 곳 핫 박 이 길이 아주 느낌 숙소,20241012
도쿄 케익 맛집 하브스  일본갈때마다 먹는 최애 하브스 ,보고 오사카 첫 혼 여행 때 완전 그때 이후 일본 때 중 도쿄 아자부 힐스 하브 스 재개발 삐 뻔쩍 최근 도쿄 제일 핫 이자,20241012
오사카 핫플 몬자야끼 맛집 웨이팅 방문 모지오,오사카 핫 몬자 끼 맛집 웨이 팅 방문 모 지오 하니 몬자 끼 전체 솔직 후기 다음 오사카 또 간다 모 지오 다시 방문 메뉴 도전,20241012
,말 오빠 오사카 한식 우리 숙소 교토역 기차 편의점 숙소 근처 핫 플로 가게 만석 용산 고 생맥주 종류 별로 마시기 마지막 조식,20241012
202405 일본여행 5일차 오사카 교토이동  카와라마치호텔 ,일본여행 포스팅 대장정 간다 오사카 교토 여행 중 교토 차 start 처제 가방 카 라마 치역 핫 교토 도착 자마자 예약 숙소 체크 일단 체크 시간 start,20241012
시청역 맛집 점심 핫플 카이센동 오복수산참치 광화문점,뷰리 날씨 지난 주말 시청역 맛집 점심 핫 카이센동 잠시 고민 메뉴 이번 일본 오사카 여행 때 비제 못 민물장어 계란 밥,20241012
 당일치기 대구맛기행 투어 개좋대구,좀 대구 핫 동성로 무슨 일본 오사카 햅 파이브 관람차 마냥 관람차 놀람 타 동성로 카페 카페 내부 사진,20241012
수원인계동술집 숯토리 수원인계점 꼬치 전문 이자카야주차 ,매장 외관 및 주차 정보 수원 나혜석 거리 맞은편 인계동 핫 위치 인계동 술집 숯 토리 쿠시카츠 꼬치 여러가지 일본 요리 오사카 명물 말,20241012
오사카여행 먹거리 볼거리 가득한 도톤보리신사이바시,다리 핫 중 하나 정말 사람 이유 오사카 포토 스팟 글리코 때문 요 과자 회사 간판 토너 형상 도톤보리 중심지 자리 가장 상징 곳 해,20241011
당일치기 같은 24시간 후쿠오카 1박2일 여행기 맛집 코스,오사카 당일치기 본인 항공권 가격 리즈 너 블 추진 후쿠오카 체류 기 일정 안 핫 라면 맛 기대 안 편 생각 도너츠 기분 노티 드,20241011
좌충우돌 사진여행기간사이지방오사카여행 2편 노제팬 ,약간 해운대 구 옆 해운대 구청 거리 랄 핫 바로 옆 밤 산책 겸 한국 시선 카메라 오사카 여행 가게 닛폰바시 역쪽 숙소 추천,20241011
일본 오사카 우메다 맛집 웨이팅 필수 인기 초밥 맛집 ,약간 오사카 술집 맛집 골목 초밥 집 직장 퇴근 길목 것 구 용 핫 느낌 낭낭 요즘 한국 일본 감성 분위기 술집 맛집,20241011
교토윤음 1,감회 요 상 지경 오사카 교토 향 여행 또 치도 왜 말 거 쫌 생각 덩 교토 왜캐 핫 어제 진짜,20241011
신당핫플 난바스낵 신당본점,힙당동 이자카야 스낵바 신 당 핫 난바 스낵 뚜리 힙당동 진출 시 그 니 처 치킨 반 오사카 유명 음식 바삭 위 일본 수제 간장 소스,20241011
202407 교토오사카 2,연남동 핫 프렌치토스트 가기 함 못 좀 동생 오사카 이동 산리오 못 조카 워낙 하나 더,20241011
오사카 난바역 맛집 스시로바타 키타로 스시 예약 방법 후기,핫 때 정말 일본인 분위기 정말 화로 구이 구경 재미 음식 오사카 맛집 완전 추천 곳 저,20241011
아이랑 해외여행 교토 4박 5일 코스 일정 가볼만한곳,세인트 레 지스 오사카 체크아웃 기차 택시 이용 이동 요도 바시아 역 이웃 핫 때 웨이 팅 감안 구글맵 평점 검색 통해 선택,20241011
행궁동 맛집 배키욘방 행궁동점 덮밥과 우동이 맛있는 곳,모두 핫 수원 화성 방화 수 류정 도 매우 소품 카페 매우 인테리어 오사카 가게 느낌 메뉴 시 그 니 처 메뉴 누 라이스 메뉴 메뉴 구성,20241011
대구 교동 신상 이자카야 술집 스페샬나잇트,요즘 핫 신상 핫 스페샬나잇트 교 동점 방문 후기 스페샬나잇트 교 동점 내부 메뉴 오사카 탄탄 베 항정 수육 숙주 텐진 육즙 만두 비빔 닭 껍질 만두 복숭아,20241011
창원 진해 맛집 겐쇼심야라멘 바질라멘 추천,타코야키 오사카 타코야키 맛 문어 쫄깃쫄깃 중 핫 겐쇼 심야 라멘 노 브레이크 타임 언제 방문 가능 새벽 운영 야식,20241011
말 마카오 여행 꿀팁 대방출,원래 오사카 일본 지진 이슈 때문 마카오 거의 준비 여행 등 핫 대중교통 버스 택시 함 내 숙소 마카오 호텔 근처 셔틀 번,20241011
24오사카여행 오사카카페 카페테일스 CAFE TALES  브레드 ,구글맵 후기 인스타 핫 왜인 현 지인 줄 타이밍 카페 회전 율 우린 이 뒤 도 계획 브런치 메뉴 대신,20241011
동탄 24시 카페 노벰버  밤에도 빛나는 나만의 힐링 스팟,삼천포 아이템 도라에몽 도쿄 바나나 오사카 길 도라에몽 도쿄 바나나 도쿄 동탄 카페 카페 카페 추천 동탄 카페 동탄 카페 투어 동탄 핫 동탄 데이트 경기도 카페 카페,20241011
2024 10 경주gt대구  대릉원  향미사  가마솥족발  최영화빵 ,여기 핫 quot 대구 결정 간송 미술관 생각 httpsblognaver 오사카 별거 허리케인 요 정 포 장완 스타 처음 요 정 quot httpsblognaver,20241011
대구 교동 신상 술집 조용한 분위기 스페샬나잇트 추천,트렌드 핫 교동 대구 청춘 교동 메뉴 메뉴 테이블 주문 lt 나베류 gt 후쿠오카 모츠 베 오사카 탄탄 베 lt gt,20241011
대전 괴정동 맛집 맛과 분위기 모두 잡은 가리비술찜 맛집 ,역시 내 최애 메뉴 가리비 술찜 amp 파스타 주 규 가시 꼭 야끼소바 오사카 방식 괴정동 분위기 전 핫 대전 롯데 백화점 술집 용문동 회식 괴정동 모임 대전 술집 대전 안주 맛 amp,20241011
뚝섬역 맛집 2차로 가기 좋은 토리키치 성수점 야끼토리 내돈 ,오사카 음식 닭다리 살 쿠시카츠 튀김 바삭 함 아주 성수역 맛집 뚝섬역 맛집 성수동 맛집 성수동 핫 성수동 데이트 성수 끼 토리 성수 쿠시카츠,20241011
아이와 일본 여행 오사카 도톤보리 오코노미야키 맛은 쏘쏘,그냥 아주 핫 속 만세 곳 사람 속 핫 속 외국인 정말 내 지금 다른 나라,20241011
오사카에서 꼭 방문해야 할 유명 랜드마크 7곳,오사카 꼭 방문 유명 랜드마크 곳 역사 문화 즐거움 도시 여행 활기 도시 오사카 곳 일본 대표 상업 중심지 이자 먹거리 천국 그 이면 역사,20241011
일본 오사카 여행기 1,인스타 핫 사진 저희 때 사람 점심 선택 오사카 가기 위해 이동 이번 여행 날씨 사진 것,20241011
블챌 10월 일상 쇼핑 맛집 여행,상공 핫 가야 나 이제 가을 옷 남친 오사카 도 안주 벌써 언니 동생 거제도 야행 직접,20241010
김포  도쿄 하네다 JAL 일본항공 이코노미 후기 feat ,면세점 롯데 면세점 레스토랑 오사카 키친 일본음식 전문점 입점 일본 김포 국제공항 줄 서서 최고 핫 파스쿠찌 우리 커피 한잔 탑승 준비 JL JL,20241010
10월 11월 삿포로 여행 추천 삿포로 일일 버스 투어 비에이 ,핫 일정 내내 가이드 이번 삿포로 여행 통해 알 건 저 여름 가을 삿포로 제 여행 오사카 후쿠오카 교토 유후인,20241010
4월 오사카 언제이런무지성발사라이프를살아볼까,유니버셜 핫 닌텐도 월드 진짜 것 레전드 임 사람 퍼스 널 스페이스 따위 개 수 용인 때문 아무 것 제대로 못 그 입구,20241010
TAKOPA 유니버셜시티의 타코야키 천국 p,유니 버셜 시티 가면 유독 북적 거리 식당가 눈 바로 타코야키 애호가 천국 타 코파 Takoyaki park 유니 버셜 시티 층 위치 Takopa 의 매력 포인트 Takoyaki park Takopa,20241010
나혜석거리맛집 오끼에서 오사카 분위기 가득한 데이트 ,내부 마치 오사카 포장마차 것 조명 매력 가게 수 원 핫 일본 분위기 술집 수원 나혜석 거리 가챠 뽑기 인계동 핫 수원 맛집 추천 가성 비 맛집,20241010
신촌 맛집 추천 신촌 오코노미야끼 일본데이트 느낌 ,핫 냄새 입구 부터 솔솔 더니 실제 일본 처럼 저 내년 쯤 오사카 갈고 욘 먹방 찍 미래 계획 찡긋,20241010
오사카 근교 소도시 시라하마 여행 키 테라스 호텔 해중전망대 ,사실 오사카 근교 소도시 여행 준비 크게 비중 반전 여기 시라 핫 동글동글 창문 바 닷 속 관찰 수 수족관 사람,20241010
함께할 계절의 반짝임을 본 기분의 색깔은 뭘까,오사카 거 오사카 가시 제발 사서 유 업로드 주기 캡쳐 듯 숙소 앞 마트 더 함 참고 예약 숙소 객사 완전 핫 곳,20241010
한남동 핫플 한남동 이자카야 타키 한남점 하이볼 데이트 후기,이자카야 핫 추천 분위기 amp 하이 볼 음식 타키 한남 점 후기 짝꿍 평소 자주 철판 식감 향 오사카 여행 온 것 맛 해산물 amp,20241010
9월 비행 일기 인생 노잼 구간에 맞닥뜨리다,날씨 무슨 일 내 매달 중국 오지 날 또 처음 중국 핫 lt KIX gt 의 마지막 레이 오버 오사카 스탠바이 운 미리 스케줄 변경 오히려 아침 lt KIX gt,20241009
오사카 텐마 현지인 타치노미 이자카야 맛집 참치 회 3엔 ,텐마 핫 오사카 골목 맛집 텐마 술집 추천 일 현 지인 맛집 오사카 직장인 오사카 한잔 일본 타치 노미 텐마 성비 텐마 주문 QR 텐마 직장인 오사카 외국인 곳 텐마 곳 텐마 맛집 추천 QR,20241009
오사카 도톤보리 웨이팅 없는 두툼한 돈카츠 맛집 0도 숙성 ,오사카 도톤보리 돈카츠 맛집 도 숙성 스테이크 글 사진 잉 여행 초보 블로거 핫 쪽 살짝 접근성 별 점 점 일본 Osaka Osaka,20241009
일본 워킹홀리데이 1주 차,오사카 비 외국인 일 군 고구마 음료 일본인 핫 나 보지 못 그냥 옆,20241009
20240904  간사이공항 초밥 amp 메리어트 대구 어반키친,오사카 먼저 도착 주문 아가 도착 하윽하윽 메리어트 대구 메리어트 반 키친 대구 맛집 현풍 맛집 현풍 핫 월 하주 간사이 공항 맛집,20241009
오사카 우메다 나카자키초 카페거리 분위기 맛집 당고가 ,자리 협소해 우리나라 사실 못 일본 MZ 세대 분 요즘 핫 하니 오사카 분 추천 MZ,20241009
오사카 타코야끼 맛집 앗치치 도톤보리 본점 웨이팅후기 ,바로 핫 웨이 팅 편이 타코야끼 식당 특성 편입 니 사람 한국인 중국인 오사카 도톤보리,20241009
유니버셜스튜디오 재팬 슈퍼닌텐도월드 키노피오카페,키노피오 카페 예 약 제로 운영 저희 예 약 신청 자리 예약 메뉴 가격 USJ 내부 다른 레스토랑 조금 USJ,20241009
진짜 올만근래 핫이슈 손석구님 울뱅기탐ㅠ 사진유,나 날 오사카 퀵턴 머리 감고 바 로 이태원 실화 며 내 체력 죽지 와중 핫 네오 언니 맘 도 사진 찍 냄갸봅,20241009
거대한 사랑을 담은 오래된 예언,박 의 유럽 여정 기록 독일 DE 프랑크푸르트 바이마르 라이프치히 베를린 포츠담 체코 CZ 프라하 오스트리아 AT 빈 잘츠부르크 차 독일 베를린 체코 프라하 DE CZ AT,20241009
오사카 여행 난바에서 히메지성 히메지에서 아리마온천온센 ,날짜 오사카 여행 날씨 맑음 제목 난바 히메지성 히메지 아리마 온센 방법 도착 곳 핫 이 곳 저녁 곳 사람,20241009
일본 오사카 난바 가볼만한곳 난바역 맛집 이타리안 ,난바 원래 오사카 핫 플로 지역 구 경 거리 놀 거리 갸 일렬 횡대 종대 집합 여행 중 제일 급선무 식생활 해결 가성 비 맛집 일,20241008
세종49층카페 360도 시티파노라마뷰 대한민국최고층카페 ,빵류 듬뿍 오사카 루카스 층 서울시 니엘 롯데 타워 전망대 층 세종 핫 층 시티 뷰 카페 플레져 자리 빼곡 도 전망 정도 카페 층 사람 금방 금방 매진 각,20241008
오사카에서는 사람이 녹아내려2,도톤보리 못 핫 열기 내 오사카 신세카이 노 것 것 꼭 서면 남포동 번화가 느낌 복 고풍 거리 구경 것,20241008
Osaka blog1,자판기 앞 사진 거 국룰 교 숙소 핫 쪽 것 오사카 글리코 사진 곤 국룰 황성현 표정 왜 웃교 표정,20241008
