title,chunked_description,postdate
우연히 갔는데 줄서는 식당 오사카역 맛집 가마타케 우동,일본 일본여행 일본 맛집 오사카 맛집 오사카역 오사카역 우동 역전 우동 치쿠 오뎅 어묵 튀김 맛집 오뎅 맛집 오사카 어묵 맛집 오사카역 마타 케 우동 osaka japan trip osaka japan trip,20240214
대구맛집 오사카 맛집 대구신상맛집 대구노포oldies ,오사카 캐 쥬얼 프렌치 레스토랑 두 곳 무우 마법 콩 포르치 코하쿠 파르코 점 맛 볼거리 프렌치 오사카 빌딩 지하 일 층 후렌치 맨 의,20240523
오사카 닛폰바시 맛집 모에기 Moegi  예약 필수인 찐 맛집 ,예약 맛집 향 한국 관광객 분 인기 곳 모에 기 곳 Moegi 수요일 휴무 예약 필수 실내 흡연 가능 오사카 맛집 모에 Moegi,20240411
오사카여행 맛집 가족끼리 가기 좋은 무한리필 샤브샤브 ,타 베 로그 예약 가능 단 주말 공휴일 불가 주소 일본 Osaka Kita Ward Shibata Chome B F 영업 시간 매일 오사카 여행 맛집 오사카 여행 오사카 맛집 Osaka Kita Ward Shibata Chome B F,20240308
오사카 맛집 난바파크 회전초밥 가성비맛집 쿠라스시 강추,오사카 맛집 오사카 스시 오사카 회전초밥 오사카 초밥 오사카 초밥 맛집 오사카 스시 맛집 오사카 쿠라 스시 쿠라 스시 오사카 맛집 쿠라 스시 오사카 맛집 추천 오사카 추천 맛집 오사카 곳,20231124
일본 오사카 맛집  장어덮밥맛집 우나토토,우리 아들 우나기 제일 먼저 일본어 quot 우나기 구다사이 quot 일본 오사카 여행 장어 밥 꼭 메뉴 장어 밥 폭풍 검색 후 맛집 현지 맛집 quot quot,20240611
오사카 맛집  킨류라멘 금룡라멘 후기,오늘 오사카 라멘 맛집 이치란 라멘 쌍벽 킨류라멘금룡 라멘 포스팅 해 오사카 맛집 킨류 라멘 금룡 라멘 오사카 맛집 킨류라멘금룡 라멘 이치란 라멘 마찬가지 저희,20230927
오사카 우메다 맛집 이자카야 이소마루수이산 예약 회 해물 ,오사카 우메다 맛집 이자카야 소 마루 수 이산 예약 회 해물 조개 구이 밥 도둑 게장 밥 세트 여러분 오사카 맛집 것 해도 정도 랍 오징어 통 게장 불,20240406
오사카 맛집 인디안카레와 모토무라 규카츠,왜 포스팅 또 다음 도쿄 비행기 좀 요 오사카 맛집 교토 맛집 규 카츠 맛집 모토 무 규 카츠 인디안 카레 일본 카레 맛집 오사카 카레 INDIANCURRY 인디안 커리 INDIANCURRY,20221209
오사카 맛집 오사카 야키니쿠 야키니쿠 신 焼肉真,유지 저 대식 가인 경우 한국 고깃집 배 건 번 저 보상 생각 오사카 야키니쿠 맛집 야키니쿠,20240109
오사카 맛집 잇푸도 라멘IPPUDO,glmapsCwoC m ynpjP Ti 오사카 기타구 카 쿠다 초점 httpsgooglmapsNETSgvTtu a swa 오사카 맛집 오사카 라멘 맛집 오사카 맛집 추천 오사카 라멘 오사카 도톤보리 맛집 일본여행 오사카 여행 glmapsCwoC m ynpjP Ti httpsgooglmapsNETSgvTtu a swa,20221112
오사카 우메다 규카츠 맛집 추천 교토가츠규 요도바시 우메다점,교토 츠규 오사카 교토 츠규 우메다 교토 츠규 우메다 맛집 우메다 공중정원 맛집 오사카 현 지인 오사카 부림 오사카 여행 오사카 맛집 우메다 신혼 쀼 우메다 카츠 추천 우메다 교토 츠규,20240913
오사카 우메다 맛집  그랜드 프론트 오사카 킨키대학 ,우메다 그랜드 프론트 오사카 맛집 킨키 대학 수산 연구소 우메다 오사카 번화가 맛집 우메다 숙소 잡고 저녁 곳 숙소 그랜드 프론트,20240530
오사카 난바 토미타 규카츠 재방문 맛집 내돈내산,이상 단점 오사카 난바 맛집 돈 산 후기 끝 토미 타 규 카츠 오사카 태교여행 오사카 오사카 여행 오사카 맛집 난바 맛집 규 카츠 토미 타 난바 규 카츠 맛집,20240912
오사카맛집 아메리카무라에 위치한 이자카야 이이다야,모츠 베 오사카 모츠 맛 이야기 기대 안 이틀 동안 이자카야 아쉬움 여행 오사카 박 마지막 저녁 끝,20240601
오사카 도톤보리 맛집 야끼니꾸엔닝구 본점 솔직후기,오사카 여행 중 방문 도톤보리 맛집 끼니 닝구 본점 방문 정말 정말 오사카 맛집 끼니 닝구 후기 직원,20240125
일본 오사카여행 오사카맛집 부모님모시기 좋은 우동치리 혼케 ,양도 오사카 여행 일본여행 오사카 맛집 일본 맛집 우동 치 리혼 케 시야 본점 우동 맛집 오사카 우동 맛집 도톤보리 맛집 신사이바시 역 맛집 서이추 서이추 환영,20240919
오사카 맛집 리스트 우메다편 재방문하고 싶은 곳,오사카 맛집 우메다 맛집 오사카 여행 중 수 맛집 투어 오사카 맛집 못 곳 위주 소개 해 점심 저녁 먹기 전 아침 꼭 아침식사,20231111
오사카 맛집 여행  오사카 야키니쿠 지다이야 야끼니꾸 대정복,오사카 맛집 여행 오사카 키 지다이 끼니 정복 글 사진 락주 오사카 맛집 여행 뿐 비 수 여행 느낌 낭낭 식당 맛집 투어 것 오사카 여행,20230309
오사카 난바 찐맛집 규카츠 모토무라,참고 분점 본점 거의 오사카 맛집 일본 오사카 여행 난 카이 난바역 맛집 난바역 맛집 오사카 규 카츠 난바 맛집 규 카츠 모토 무 난바 난바역 맛집 오사카 난나 오사카 맛집 오사카 돈 산 맛집,20240814
오사카맛집 디저트투어 알시온gt 프랑스감성 크레페 맛집,오사카 맛집 난바 디저트 카페 크레프 리 알 시온 Creperie Alcyon 프랑스 감성 크레페 이번 오사카 여행 총 평 오사카 맛집 디저트 맛집 난바 도톤보리 식사 달달 거 Creperie Alcyon,20230514
일본 오사카 라멘 맛집 Torisoba Zagin Niboshi,위치 주소 Chome Minamisenba Chuo Ward Osaka 일본 전화번호 영업 시간 마지막 주문 일본 맛집 오사카 맛집 일본 오사카 맛집 일본 라멘 맛집 오사카 라멘 맛집 Chome Minamisenba Chuo Ward Osaka,20230905
오사카 맛집 오사카오뎅 오뎅토슈사이 おでんと酒菜,이번 소개 드릴 맛집 오뎅 전문 오뎅 바 오사카 텐진 바 시스 지로 쿠 역 도보 거리 위치 오뎅 토슈 사이 오사카,20231225
23 12 오사카맛집 오사카 라면 맛집  텐카잇핑 천하일품 ,나 카스 역 도보 거리 운영 시간 월 토요일 일요일 오늘 포스팅 다음 포스팅 라면 라면 맛집 라멘 라멘 맛집 오사카 라면 일본 라면,20240221
일본 가이드가 추천하는 오사카 오코노미야끼 맛집 미츠키,일본 가이드 추천 오사카 도톤보리 타코야끼 맛집 혼포 오코노미야끼 란 무엇 오사카 맛집 미츠키 오코노미야끼 야키소바 전문 집 오후 오픈 자마자,20240109
일본오사카 우메다 가성비 좋은 초밥 맛집 추천 lt스시사카바 ,오사카 맛집 오사카 초밥 맛집 우메다 초밥 맛집 란드 프론트 맛집 오사카 우메다 맛집 우메다 초밥 맛집 우메다 스시 일본여행,20240916
오사카 나라맛집 이자카샤 로바타 우오겐 구루나비 예약,오사카 나라 맛집 로 바타 우오겐 구루 나비 예약 괌 손님 오사카 맛집 나라 맛집 근처 이자카야 검색 후기 이도 일본 여행 가면,20231219
오사카 스시 맛집 도톤보리 우오신 미나미점,대왕 스시 오사카 스시 맛집 도톤보리 오신 미나미 점 바다 소년 Benjamin 전 번 곳 얼마 전 오사카 맛집 검색 정준하 마츠다 상의 Benjamin,20221108
일본 오사카 여행 가볼만한곳 난바 오사카 맛집 리스트 5 라멘 ,여기저기 맛집 천국 먹거리 곳 일본 오사카 여행 곳 난바 오사카 맛집 리스트 라멘 쿠시카츠 참복 겐지 레스토랑 등 곳 추천 일본 오사카 여행 오사카 곳,20240218
오사카 현지인 맛집 미슐랭 이자카야 나가호리,현지 맛집 호리 바다 소년 Benjamin 후쿠오카 오사카 여행 후쿠오카 달리 방문 검색 눈 이색 오사카 맛집 Benjamin,20221217
오사카 맛집 추천 도톤보리하면 쿠시카츠  쿠시카츠 다루마,돈 산 도톤보리 맛집 오사카 도톤보리 맛집 도톤보리 맛집 추천 도톤보리 여행 도톤보리 술집 오사카 여행 오사카 맛집 오사카 자유여행 오사카 곳 일본 오사카 여행 오사카 맛집 추천,20231227
간사이공항 551 호라이 메뉴 추천 후기 오사카 맛집,간사이 공항 호 라이 메뉴 추천 후기 오사카 맛집 오늘 오사카 간사이 공항 맛집 호 라이 소개 해 호 라이 만두 오사카 간사이 전역 위치 프랜차이즈,20240805
도쿄 여행 오사카 맛집 현지인처럼 내방식대로 찾는 꿀팁,이번 제 얼마 전 오사카 여행 점 공유 도쿄 맛집 l 오사카 맛집 l 삿포로 맛집 l 교토 맛집 l l l,20230821
일본 오사카 우메다 오코노미야키 야키소바 맛집 유카리 ,오코노미야키 맛집 유카 리 소 네 자키 본점 방문 위치 오사카 우메다 맛집 오코노미야키 맛집 유카 리 소 네 자키 본점 소 네 자키 상점가 맛집 소 네 자키 오사카 맛집 우메다 맛집 야키소바 맛집 일본 맛집,20240909
오사카 도톤보리 맛집 카니도라쿠 대게 코스요리,다음 또 혹 나 오사카 것 꼭 다시 생각 포스팅 또 입 침 고이 오사카 도톤보리 맛집 카니 쿠 대게 코스 도톤보리,20240806
신사역 가로수길 맛집 오사카의 느낌을 담은 도톤보리 서울,신사역 도보 약 거리 위치 일본 오사카 분위기 이자카야 quot 도톤보리 서울 quot 이름 여기 신사역 맛집 경우 일본 오사카 도톤보리 연상 음식 quot quot,20240924
일본 오사카 여행 일정 경비 우메다 맛집 가볼만한곳,오사카 여행 일정 관광명소 맛집 효율 오사카 경험 수 원 우메다 오사카 우메다 오사카 맛집 오사카 여행 일본 오사카 여행 오사카 여행 일정,20240918
2312 일본오사카 오사카 난바 돈까스 맛집 센즈 솔직후기 ,도보 난바역 도보 거리 위치 오늘 포스팅 다음 포스팅 오사카 난바 도톤보리 일본 일본 맛집 난바 맛집 도톤보리 맛집 오사카 맛집 돈까스 맛집,20240216
일본 여행 ㅣ 오사카 맛집 야끼니꾸 호르몬 우치다,현 지인 오사카 야키니쿠 현지 맛집 예약 안 웨이 팅 테이블 운 수 혹시 분 구글 예약 밥 가도,20240911
오사카 JR난바 일본 가정식 현지인 맛집 우라야 난바 본점,오사카 JR 난바 맛집 꼭 여기 가세 더 맛집 방문 글 보기 오사카 맛집 JR 난바 맛집 난바 가정식 라야 난바 가정식 맛집 오사카 가정식 오사카 현 지인 맛집 오사카 여행 일본 가정식 맛집 JR JR,20241004
오사카 맛집 사카나야 로큐센 신세카이 시장 맛집 추천,저희 가족 명 맛 오사카 맛집 강 츠텐 카구 전망대 바로 앞 꼭 길 저 이 만 오사카 맛집 오사카 신세카이 시장 맛집 신세카이 맛집,20231119
오사카여행 맛집 오사카성 부근 점심메뉴로 오코노미야키 추천 ,타 베 로그 핫페퍼 예약 가능 주소 일본 Osaka Chuo Ward Tanimachi Chome 영업 시간 매일 돈 산 오사카 여행 맛집 오사카 여행 오사카 맛집 Osaka Chuo Ward Tanimachi Chome,20240323
오사카 우메다 가성비 회전초밥 맛집 사카에스시 우메다,결제 것 것 언제 잉 관련 게시 글 보기 오사카 맛집 우메다 맛집 우메다 회전초밥 사카 스시 가성 비 스시 오사카 스시 오사카 성비 맛집 우메다 스시 우메다 회전초밥 추천,20241003
오사카 현지인 맛집 가성비 좋은 미츠루 야키니쿠 도톤보리 ,O S A K A 미츠루 야키니쿠 도톤보리 미츠루 야키니쿠 오사카 현 지인 맛집 오사카 맛집 오사카 필수 코스 오사카 야키니쿠 도톤보리 맛집 오사카 맛집 리스트 오사카 일본 오사카 맛집 오사카 여행 O S A K A,20240910
일본 오사카 난바역 맛집 키타타케우동 필수로 가야 하는 곳,오사카 난바 맛집 키 타 타 케 우동 글 사진 일본 여행 포스팅 남아 중 오사카 맛집 키 타 타 케 우동 소개 해 워낙 한국인 오사카 맛집,20240110
오사카 쇼유라멘 맛집 킨구에몬 도톤보리 오사카 블랙 ,오사카 맛집 베스트 라멘 연속 위 오사카 라면 패 결정전 준우승 수상 도쿄 라면 쇼 제 막 매출 그릇 수 위 간 약 그릇 판매 등 상 간사 대표 쇼유라멘 집,20230606
오사카에서 먹은 가장 맛있었던 음식  오사카 텐동맛집 ,오사카 텐동 맛집 오사카 꼭 음식 텐동 마키 노 오사카 부부 오사카 여행 모토 무 난바 빅 카메라 기준 텐동 마키 노 모토 무 규 카츠 마주 보고 오사카 맛집,20230606
오사카 다니마치 텐동 초밥 맛집 이자카야 이치미젠,메뉴 한자리 수 오사카 텐동 맛집 이치 젠 소개 위치 마치 쿠초메역 번 출구 도보 거리 위치 오사카 성과 박물관 혼 마치 거리 등,20240809
오사카 맛집 3일차 아침 정식 추천 신파치 식당 난카이도오리,차 아침 숙소 전날 검색 보고 오사카 맛집 저희 부부 밥집 아침 정식 신파 치 식당 난카이도 오리 외관 층 건물,20241006
일본 오사카 여행 맛집 추천 난바 야키니쿠 맛집 돈돈,오사카 돈돈 야키니쿠 수 오사카 맛집 이구 난바 야키니쿠 맛집 곳 답 이번 포스팅 덕이 돈돈 후기 D 오사카 야키니쿠 맛집 D,20231109
오사카 맛집 도톤보리 와규 예약 니쿠야 후기,오사카 여행 도톤보리 규 맛집 분 니쿠 꼭 걸 추천 작년 올해 후회 선택 위치 오사카 맛집 니쿠 위치 도톤보리 신사이바시,20231112
일본 여행  오사카 3박4일,아이 오사카 자유 여행 일본 간사이 공항 도착 전 바다 위 모습 저녁 도착 호텔 짐 우동 맛집 블로그 보고 숙소 근처 quot 이마이 우동 맛집 한국 시판 quot,20241014
시드니에서 여름을,오사카 블로그 못 채 일상 내팽겨 기억 전 시드니 여행 기록 민수 차이나타운 시드니 몇 맛집 마막 방문 꼬치 나 그냥 그,20241014
오사카 4박5일 여행 유니버셜 스튜디오 재팬 꿀팁을 담은 후기,구글 리뷰 완전 로컬 맛집 곳 향 맘보 오코노미야키 현지 맛집 맛집 유니 버셜 스튜디오 오사카 여행 일정 오사카 맛집 오사카 여행 코스 유니버설 스튜디오 재팬 입장권,20241014
8월 LOG,일 만배 아리랑 보쌈 등촌 점 대기 맛집 동네 있엇구 브리 살수 육이 데 오사카 여행 계획 오늘 호두 오늘 입술 뷰러 고무 오늘 그로 밋 탐색,20241014
교토 맛집 추천 이치조지역 조용한 분위기의 가정식이 맛있는 ,오사카 분위기 교토 분위기 식사 분 이치 지역 근처 바메 추천 일본여행 교토 여행 교토 맛집,20241014
교토 은각사 철학의길 입장료 난젠지 수로각 블루보틀,오사카 교토 박 여행 일지 은각사 교토 로컬 맛집 현 지인 맛집 교토 근교 소도시 여행 우지 후 시미 이나리 신사,20241014
 후쿠오카 태교여행  대기 없이 먹을수 있는 이치란라멘 텐진점,이치란 라멘 오사카 대기 엄두 후쿠오카 대기 텐진 맛집 텐진 밥집 텐진 곳 후쿠오카 필수 코스 대기 이치란 라멘 먹기 후쿠오카 돈코츠 라멘,20241014
바쁘다 바빠 더쿠 여행,지난번 교토 차이 오사카 전날 곳 가기 위해 일찍 저녁 오사카 시내 발견 함 체인점 굳이 교토 수 체험,20241014
오사카 근교 소도시 추천  히라오카 오사카 3대 마츠리 ,저 지금 오사카 은 도 늦 여름 속 아침 바람 기침 인스타 블로그 등 여행지 맛집 포토 존 수 왜인 저,20241014
오사카 파르코 백화점 지하2층 현지인 맛집 뉴 츠루마츠 ,오사카 파르코 백화점 현지 맛집 뉴 츠루 마츠 오늘 파르코 백화점 지하 층 위치 뉴 츠루 마츠 후기 해 이자카야 느낌 나 곳 점심 런치 메뉴 튀김,20241014
홍대입구역 라멘 세상끝의라멘 찐 후기,뭔가 입구 라멘 맛집 냄새 나 곳 리뷰 중 오사카 라멘 맛 단골 것 보고 여기 OSAKA 한쪽 제 기도 신뢰 x 주방 OSAKA x,20241014
오사카 APA 호텔 난바 신사이바시 후기 정보 예약팁,개인 탕 오사카 난바 루프 탑바 신사이바시 맛집 오사카 조식 추천 APA 호텔 조식 온천 오사카 수영 호텔 오사카 신사이바시 스위트룸 오사카 체크 돈키호테 오사카 오사카 여행기 APA 호텔 스파 APA APA,20241014
 일본오사카  대형버스 오사카 출발 교토 1일 버스투어 ,오사카 교토 버스 투어 번 부모님 모 시 고가 상황 점심 예약 문제 미리 예약 못 현장 대기 맘 박 인화 가이드 맛집 추천 해주시 손수,20241014
국밥 느낌 오사카 난바 도톤보리 라멘 맛집 킨류라멘 ,오사카 난바 도톤보리 라멘 맛집 킨류 라멘 치마 점 라멘 취향 맛 짠맛 듯 데 일단 이치란 곳 웨이 팅 웨이 팅 시간 다른 곳,20241014
오사카워홀  197일차  맥주가 땡길 수 밖에,오사카 워홀 일본 워홀 일본 워킹홀리데이 갓파 스시 일본 스시 일본 초밥 일상 공감 일상 공유 토리 메로 일본 비루 생맥주 맛집 오사카 이자카야 일상 블로그 워홀 블로그 오사카 워홀 일상 워홀 서이추,20241014
후쿠오카 하우스텐보스 입장권 입장료 지도 가는법 11월 ,시내 맛집 투어 쇼핑 근교 여행 계획 분 정말 보통 디즈니 오사카 유니버셜 일본 테마 파크 유명 곳 후쿠오카 하우스텐보스 란 이름 숲,20241014
후쿠오카 하우스텐보스 입장권 나가사키 여행 테마파크 필수 코스,오늘 도쿄 디즈니랜드 오사카 유니버셜 스튜디오 일본 테마 파크 이상 맛집 여성 아이 가장 인기 곳 온통 피로 나인 체,20241014
10월 오사카 4박5일 오사카여행1  난바 교토 우지,토 수 일본 오사카 비행기 새벽 부랴부랴 김해 공항 울 엄빠 라멘 맛집 웨이 팅 듯 안 생각 회전 율 일단 생맥 한잔 쭈우욱,20241014
후쿠오카의 여행 일기,스포 오사카 가기 위 비행기 표 줄 갑자기 간다 당황 맛집 것 것 대해 말씀 아주 것 운전 기사,20241014
ㅣ일본 마쓰야마ㅣ일본 소도시 2박 3일 여행 1일차 ,오사카 또 다른 느낌 마쓰야마 느낌 도큐 레이 호텔 정도 현지 맛집 진짜 마쓰야마 여행 꼭,20241014
 8월 일상 ,뚱 시간 오사카 출국 당일 내 수은 위해 이 맛집 점심 여기 왜 맛집 앞 근처 때 여기,20241014
일본 오사카 최고의 쇼핑 명소들,쇼핑 남바 맛집 쇼핑 후 길거리 음식 레스토랑 휴식 취 타코야키 오코노미야키 라멘 등 오사카 음식 수 전통 공예품 현대,20241014
와구리 전문 사오리  밤 몽블랑  인생디저트  디저트 맛집,별 또밥 오사카 일정 교토 일 정도 비주 얼 디저트 가게 한번 주위 오사카 교토 간다 추천 집 교토 방문 꼭,20241014
2024년 떠나기 좋은 베스트 해외여행지 10곳,도쿄 오사카 교토 등 대도시 최첨단 기술 문화 체험 수 고 넉 전통 이탈리아 또한 세계 와인 음식 맛집 탐방 통해 이탈리아 맛 경험,20241014
오사카 여행 도톤보리 난바 오카루 오코노미야키 캐릭터 맛집 ,영업 시간 매일 브레이크 타임 휴무 일 목요일 체크 사항 현금 가능 카드 결제 위치 이번 오사카 여행 맛집 진짜 즉흥 우리 뭘,20241014
도톤보리 도보 가능 체크인 짐맡기기 조식 no cleaning ,오사카 박 내내 우리 숙소 숙소 개중 고민 온천 온천 오사카 온 사람 무조건 도톤보리 곳 숙소 하라 최고 선택,20241014
먹보 셋의 2박 3일 목포 여행 ,목포 카페 창고 여기 오 려고 목포 일수 에그타르트 맛집 명성 빠싹 노 삼제 작년 오사카 이후 여행 잼 목포 진짜 해도 과언,20241014
오사카 2박3일 여행 2일차,하이 하이 오늘 오사카 여행 차 기분 용 가이드 한국인 시기 때문 의사소통 꿀팁 맛집 정보 공유 덕분,20241014
오사카여행 찐스시맛집 추천 Kitasushi honten 키타스시 ,지금 일본여행 우메다 밥집 스시 맛집 참고 오사카 여행 우메다 맛집 오사카 맛집 오사카 스시 오사카 스시 맛집 오사카 맛집 오사카 초밥 오사카 곳,20241014
JP 향기로운 일본일기  7 비장했던 여행의 끝,오사카 지브리 굿 샵 거기 좀 더 느낌 여담 나 개인 여기 스포츠 덕후 꽤 장비 맛집 때 오타 야구선수 잼민,20241014
⑨월   ,우동 맛집 아시 공유 점 무슨 현 미술관 안 우동 집도 인생 컷 국 현미 오사카 여행 편 일본여행 내내 칼국수 오 자마자 지원 칼국수 푸파,20241014
타이베이 여행 241078 직장인 1박2일 여행 입국 동먼 ,미정 아악 오사카 여행 마지막 여름 여행 저 가품 양주 위스키 동먼역 알 동먼역 누가 크래커 맛집,20241014
해외 맛집 일본 오사카 맛집Dotombori Nikugekijo ,오늘 제 소개 맛집 바로 오사카 도톤보리 Dotombori Nikugekijo 가족 패키지 여행 자유여행 당일 부모님 집 맛집 고기 밥 Dotombori Nikugekijo,20241014
이태원용산 야키토리와 이자카야를 한번에 쿠시노리 ,롤 맛집 닭 껍질 튀김 언니 닭 껍질 요건 별도 튀김 옷 바로 오사카 오늘 쯤 계속 손님 구석 진 곳,20241014
오사카 자유여행 오사카 자유여행 유니버셜스튜디오제펜 ,오사카 카레 맛집 도쿠 마사 우메다 햅 파이브 우메다 공중정원 유니 버셜 스튜디오 제 펜 오사카 때 몇번 오사카 오사카 랜드마크 기두 오사카 벗꽃 성지 구 곳 쥬 우리,20241014
연산 키리츠 나의 N번째 또간집 소개 숙성회가 미쳤고 튀김이 ,처음 감동 숙성 회 이자카야 맛집 연산동 골목 곳 사진 테이블 키 리츠 모 듬 사시미 기본 도쿄 amp 사천 차슈 등심 카츠 산도 오사카 amp,20241014
일본 고베 3박 4일 여행 계획,차 도착 및 시내 탐방 오전 오사카 고베 이동 오사카 JR 고 속 열차 이용 고베 일본 풍경 일본 문화 일본 일상 일본 맛집 일본 카페 일본 쇼핑 일본 축제 일본 전통 일본 역사 일본 관광 JR,20241014
오사카 신사이바시 파르코 백화점 가성비 스시 맛집 뉴 ,일본 오사카 신사이바시 파르코 백화점 가성 비 스시 맛집 뉴 스시 센터 New Sushi Center 블하 오늘 일본 스시 전문점 가성 비도 맛 정말 만족 신사이바시 파르코 백화점 New Sushi Center,20241014
오사카 호텔 트렌드 니시 신사이바시 유용한 정보 및 후기,클릭 숙소 위치 호텔 트렌드 시 신사이바시 HotelTrendNishiShinsaibashi 오사카 숙소 추천 가성 비 호텔 도톤보리 신사이바시 조식 체크 박 숙소 추천 신사이바시 맛집 추천 오사카 여행 HotelTrendNishiShinsaibashi,20241014
오사카 도심 2박 3일 36홀 코스,일정 차 오사카 도착 후 관광 및 쇼핑 맛집 투어 or 홀 라운딩 차 오전 호텔 골프장 이동 내외 소요 오전 첫 골프 라운드 홀 오후 오사카 or,20241014
도쿄여행 2일차  야마나카코 가와구치코 후지산 백조,호우 토우 코사쿠 가와구치 코 맛집 검색 제일 곳 호우 토우 코사쿠 이 지역 향토음식 가부키초 오사카 영업 곳 몬자야키 보기 명란 몬자 떡 치즈 선택,20241014
5일차 생일기념 일본여행뉴라이트 Canelita Sweets ,봄 오사카 벽돌 느낌 건물 층 상가 주상 복합 타코야끼 맛집 도톤보리 다시 집 저녁 부모님,20241014
오사카 맛집 토미타 규카츠 牛かつ 冨田,여러분 오사카 토미 타 규 카츠 저 오사카 여행 계획 중이 시 토미 타 규 카츠 번 별 점 재 방문 의사,20241014
오사카 구로몬시장 맛집우오토요 장어덮밥 먹거리,새우 조 개구 거 선택 바로 먹거리 볼거리 구로 몬 시장 오사카 여행 가시 한번 오사카 장어 밥 맛집 오토 요도 한번,20241014
한남동 이자카야  한남오거리 인근 음식 맛있는 이자 카야 타키한,예전 오사카 느낌 비슷 그냥 비행기 안타 일본 온 느낌 미혼 라면 데이트 분위기 맛집 철판요리 맛집 나 생 과일 베이스 하이 볼 머신 사용 초 탄산 하이 볼,20241014
일본오사카 난바 도톤보리 야키니꾸맛집 야키니꾸 지다이야,끼니 맛집 시작 오사카 맛집 난바 맛집 도톤보리 맛집 끼니 지다이 일본 더 오사카 끼니 오사카 끼니 맛집 가게 일본 특징 것,20241014
교토 오사카  Kyoto Osaka 동심가득 동물탐방기,맛집 인증 재 방문 의사 랄루 우산 케이스 랄루꺼 간만 동심 가득 힐링 여기 카페 뭐 야경 맛집 라며 비 아무 것 안보 오렌지 주스,20241014
오사카사카사카  _ 1일차,만 일본 여행 일기 이번 다시 오사카 사카 비행기 이용 오사카 제 터미널 혼자 일본 처음 터미널 린다 것 저,20241014
오사카 2박 3일 나라,카레 맛집 보고 교정 초기 오빠 배려 나 혼자 장어 맛집 것 요 기 오디 더 터미널 무슨 호텔 곳 쪽 더,20241014
