title,chunked_description,postdate
파리 쇼핑  kith 키스 매장 구매한 발렌시아가 선글라스,파리 시차 주 적응 만 집 푹 초저녁 잠 새벽 것 여 파리 쇼핑 것 하나 발렌시아 선글라스,20220829
파리 쇼핑리스트 약국 할인쿠폰 받아가세요,때 파리 구매 제품 즉 파리 쇼핑 리스트 후기 이탈리아 프랑스 정도 친구 여행 저 코 노미 때문 수화물 제한 쇼핑 최대한,20180323
파리의 트러플 No3 트러플 쇼핑 봉마르셰 ,트러플 쇼핑 봉 마르 셰 갤러리 라파 트 Signorini Tartufi 아티 잔드 트러플 메종드 트러플 오늘 파리 여행 중 파리 쇼핑 파리 쇼핑 리스트 파리 트러플 파리 트러플 쇼핑 트러플 쇼핑 Signorini Tartufi,20220714
파리쇼핑화장품 알뜰구매 노하우,파리 쇼핑 유럽 여행 유럽 배낭 파리 화장품 파리 쇼핑 화장품 알뜰 구매 노하우 파리 유럽 여행 여자 만 브랜드 쇼핑 제품 곳 바로 파리 유럽 여행,20131121
파리 쇼핑 맵 아울렛도 포함,파리 마레 지구 쇼핑 맵 제 동생 carven 덕후 저 carven 덕후 저 남자 옷 항상 쇼핑 남동생 취향 여자 옷 carven carven,20150710
파리 약국 쇼핑리스트 프랑스 화장품 브랜드 내돈내산 추천템,파리 약국 쇼핑 리스트 프랑스 화장품 브랜드 돈 산 추천 템 글 사진 by 붐붐 ParisSunny 프랑스 여행 파리 쇼핑 리스트 꼭 두기 저 역시 피부 사람 그 효과 확인 계속 by ParisSunny,20240922
프랑스 쇼핑리스트  파리 몽쥬약국 사야할것들 모두 ,무엇 파리 몽쥬 약국 제 사랑 곳 프랑스 쇼핑 리스트 체크 파리 쇼핑 리스트 하나 소개 프랑스 백화점 타 상가,20160827
파리마지막날 여행 셔터프레소 스냅 개선문 파리쇼핑,파리 롱샴 파리 롱샴 가격 사실 내 쇼핑 계획 루이비통 목도리 몽클패딩 렁섬 가방 셀린느 벨트 일단 먼저 롱샴 구매 좀 보부상 스타일 미니 못 s 사이즈 구매 색 사이즈 등 모든 s,20240929
파리쇼핑  갤러리 라파예트 VIP 쇼핑 엑스페리언스  파리 ,프랑스 파리 쇼핑 패션 도시 쇼핑 목적 파리 오시 분 것 파리 여러 백화점 그 중 갤러리 라파예트 가장 규모 대표 백화점,20220504
파리 쇼핑 라발레 빌리지 아울렛 3월 4월 할인 쿠폰 세일 꿀팁,파리 쇼핑 계획 꼭 보고 모든 혜택 La Vall e Village La Vall e Village 발레 HAPPY DAYS 특별 세 일 토요일 월요일 La Vall e Village La Vall e Village HAPPY DAYS,20230307
파리 쇼핑리스트 담고 파리 여행 덤 파리 라파예트 백화점 ,파리 쇼핑 리스트 파리 여행 덤 파리 라파예트 백화점 쇼핑 꿀팁 가지 선물 쿠폰 첨부 벌써 전이 겨울 파리 여행 파리 겨울 분위기 촬영 여행,20191202
파리 라파예트 백화점 식품관 쇼핑 리스트 추천,파리 쇼핑 수 갤러리 라파예트 중 선물 용 기념품 디저트 디저트 쇼핑 중이 라면 꼭 피에르 에르 메 곳 라뒤레 산맥 파리 마카롱,20240729
파리쇼핑 1  파리현지 Merci 편집샵 쇼핑 떼샷 메르시팔찌 ,파리 쇼핑 파리 현지 Merci 편집 쇼핑 떼샷 메르 시 팔찌 어제 약 속 대로 오늘 파리 쇼핑 떼샷 포슷팅 사진 정리 쇼핑 물품 사진 꽤 로 중 Merci,20140520
파리 여행 마들렌 쪽 상점 마이유 머스터드 파리 쇼핑,사실 뭐 제 파리 데 파리 계속 가게 가도 박 워낙 뭐 파리 때 것 정말 거,20240501
파리 쇼핑 꿀팁 파리 한복판에서 만나는 노르망디,쇼핑 쿠폰 GET 가세 파리 쇼핑 성지 갤러리 라파예트 Galeries Lafayette 오페라 위치 갤러리 라파예트 파리 오스 만점 연간 백만 명의 방문객 곳 파리 주요 관광지 GET Galeries Lafayette,20190705
lt파리여행파리 쇼핑gt몽쥬약국 Pharmacie Monge,lt 파리 여행 파리 쇼핑 gt 몽쥬 약국 PHARMACIE MONGE 말로 몽쥬 약국 크리스마스 이브 쇼핑 수 내 거기 가면 하루 종일 시간 엄마 저 혼자 lt gt PHARMACIE MONGE,20140106
lt파리여행파리쇼핑gt 라파예트 백화점 Galeries Lafayette,lt 파리 여행 파리 쇼핑 gt 라파예트 백화점 Galeries Lafayette wwwgalerieslafayettecom 메트로 바로 연결 여행 첫날 쇼핑 좀 저 여정 다행 lt gt Galeries Lafayette wwwgalerieslafayettecom,20140110
파리 쇼핑 라파예트 LA MAISON LE GOURMET,현재 파리 여행 중 분 백화점 쇼핑몰 꼭 생각 득템 수 엊그제 파리 다시 급 현재 기온 웃 다음주,20170707
 파리쇼핑 파리백화점  르봉마르쉐 Le Bon Marché ,Le Bon March 파리 백화점 르봉 마쉐 파리 가장 쇼핑 장소 이름 Le Bon March 도보 거리 에르메스 세브르 매장 쇼핑 최적 곳 이 날 마감 반 터 Le Bon March Le Bon March,20190608
파리 프랭땅 백화점 쇼핑 할인쿠폰 셀린느 텍스리펀 방법 서류,라파예트 파리 쇼핑 기전 검색 쁘렝땅 할인 쿠폰 라파 예 FTA 를 바로 숙소 귀가 아주 파리 프랭땅 쇼핑 일기 여기 FTA,20240802
파리쇼핑Tip 파리 대표 슈퍼마켓 모노프리Monoprix,파텔 partell 파리 쇼핑 팁 슈퍼마켓 모노 프리 편입 니 파리 브랜드 입구 사람 옷 쇼핑 곳 모노 프리 일반 브랜드 partell,20140726
파리 쇼핑 오픈한지 3주차 신생매장 더 핫해지기 전에 ,Julie 오늘 소개 드릴 파리 쇼핑 핫 레이스 바로 파리 마레 지구 정말 쇼핑 핫 레이스 파리 스 투시 매장 바로 편 칼 하트 매장 바로 왼쪽 Julie,20241011
파리 쇼핑 파리에서 사온 것들,화장품 니스 또 막 사실 아래 하나 더 스페인 옷 쇼핑 정말 파리 바르셀로나 구간 쇼핑 여행 최적 코스 또,20140227
파리 쇼핑 모음ㅣ갤러리라파예트 까르푸 샤를드골 면세점,물욕 가득 쇼핑 중독 파리 쇼핑 후기 파리 출장 방문 거 여기저기 쇼핑 못 시내 틈틈이 쇼핑 흐흐 Monopirx Masion 출장 다른 과장 Monopirx Masion,20240702
파리쇼핑 라발레빌리지 무료 셔틀버스와 아울렛 VIP쿠폰 ,기분 파리 쇼핑 묘미 유럽 여행 어찌 쇼핑 수 며 D 왜 겨울 파리 가야 대한 개인 강추 파리 여행 필수 코스 발레 아울렛 VIP 쿠폰 D VIP,20200110
파리 쇼핑 브랜드 슈프림 모자 스투시 메종키츠네 꾸레쥬 ,이번 포스팅 파리 마레 지구 쇼핑 편 파리 쇼핑 브랜드 편 슈프림 스 투시 꾸레쥬 등등 소개 포스팅 편 편집 편 포스팅 참고 파리 슈프림 Supreme Paris 영업 시간 오전 오후 일요일 Supreme Paris,20240105
파리쇼핑  파리 시내 쇼핑 거리 TOP 5,파리 쇼핑 때 정보 정리 어디 브랜드 미리 알 여행 파리 시내 쇼핑 거리 군데 소개,20160202
유럽 쇼핑리스트와 선물용 총 정리 파리뮌헨비엔나 ,생각 때문 생각 뭘 도시 별 제 구매 유럽 쇼핑 리스트 공유 파리 쇼핑 리스트 파리 가장 한국인 필수 몽쥬 약국 저,20231103
프랑스 파리 여행 쇼핑리스트 2편  쉐르soeur ,총 총총 파리 쇼핑 리스트 편 바로가기 몽마 르뜨 근처 아페쎄 아울렛 바로가기 파리 쇼핑 마레 지구 쇼핑 파리 쇼핑 리스트 파리 에르메스 에르메스 에르메스 트 윌리 쉐르 soeur 라샴브르 오 콩피 튜 트러플 soeur,20230901
파리 쇼핑리스트  파리쇼핑 떼샷  파리쇼핑후기,파리 쇼핑 리스트 파리 쇼핑 리스트 를 파리 쇼핑 사실 뭐 명품 제 나름 쇼핑 몽클레어 런던,20171030
유럽여행 식료품상점 쇼핑 포숑 파리,파리 쇼핑 포숑 티 선물 용 포숑 파리 사기 아이템 국내 매장 판다 게 함정 포숑 파리 사면 선물 돈 생색 낼 수 차,20170611
파리 쇼핑 Le Bon Marche  La Grande Epicerie Paris,이후 론 파리 백화점 쇼핑 무조건 봉막쉐 가을 Fred le Chevalier 콜 봉막쉐 파리 쇼핑 정말 개인 취향 글 듯뭐 보고 또 Fred le Chevalier,20161010
파리 쇼핑쿠스미티 파리 마트 모노프리monoprix 여행 ,가격 대형 슈퍼 마트 분 파리 시내 여러 지점 모노 프리 소개 저희 간 곳 쁘렝땅 백화점 바로 옆 지점 매장 규모 제법 파리 쇼핑 식료품 구입,20150404
파리쇼핑  몽트뢰유 벼룩시장 MARCHE MONTREUIL,파리 빈티 쇼핑 lt 파리 벼룩시장 편 몽트뢰유 벼룩시장 gt 아마 유럽 파리 여행자 가장 곳 꼽으 바로 벼룩시장 플리 마켓 요 벼룩시장 lt gt,20151103
프랑스파리 쇼핑 쁘렝땅 백화점 할인쿠폰 사용법 텍스 리펀 ,파리 리옹 역 거기 서도 오늘 프랑스 파리 쇼핑 쁘렝땅 백화점 할인 쿠폰 사 용법 여행 전 알 아두 텍스 리펀 꿀팁 프랑스 파리 명품 쇼핑,20240929
파리쇼핑  파리약국 대표 상품들,파리 쇼핑 파리 약국 대표 상품 파리 쇼핑 리스트 신혼부부 구매 제품 가방 화장품 중 파리 약국 판매 화장품 기존,20140701
파리여행 필수 몽쥬약국 파리쇼핑리스트,파리 쇼핑 리스트 결과물 쇼핑 위해 파리 여행 쟁 저 것 쟁여 여행 후,20150313
파리약국쇼핑 할인 캬레 오페라 약국 10 할인 바우처 안내 ,프랑스 여행 때 쇼핑 이야기 수 비용 만족 약국 파리 쇼핑 중심부 쁘렝땅 백화점 라파예트 백화점 인근 위치 약국 파리,20240111
파리 쇼핑리스트 피크닉 준비 하기 좋은 파리 슈퍼 monop,파리 쇼핑 리스트 살 것 파리 슈퍼 monop 구매 듯 서유럽 여행 때 피크닉 숙소 한식 수도 숫 가락 젓가락 포크 monop,20240523
Paris 파리여행 유럽여행 유럽한달여행 파리쇼핑 박물관 ,안녕 시바 쇼핑 늘 무거워 저녁 분위기 곳 파리지앵 만 이 양파수프 바게트 달팽이 요리 무슨 고기,20231212
파리 쇼핑 후기 쁘렝땅 백화점 할인부터 텍스리펀까지 샤넬 ,파리 샤를 드골 공항 면세점 쇼핑 후기 gtgt 파리 마레 지구 쇼핑 후기 요기 gtgt 파리 쇼핑 프랑스 쇼핑 프랑스 쇼핑 추천 파리 쇼핑 아이템 파리 쁘렝 땅 파 리프 랭탕 할인 외국인 할인 프랑스 관광 청 할인 gtgt gtgt,20240723
파리 쇼핑 샤넬 깜봉점 가는 방법 파리 샤넬 쇼핑,파리 쇼핑 기 다시 원래 얼마 남지 히히히 파리 샤넬 깜봉점 방법 역시 파리 샤넬 쇼핑 진리 한국 가격 차이 카드 한도 팔고,20130812
프랑스 파리쇼핑 2019 파리 쇼핑리스트 파리 쇼핑추천템,파리 화장품 쇼핑 파리 쇼핑 프랑스 에스테 브랜드 No Guinot 포스팅 참조 httpsblognavercomminahan Guinot 완전 강추 이번 구입 모두 No Guinot httpsblognavercomminahan Guinot,20200316
프랑스파리 파리쇼핑 라발레 빌리지 쇼핑하기,안 매장 쇼핑 시간 정도 중간 휴식시간 포함 온 사람 후기 좀 우린 다시 파리 간다 발레 아울렛 꼭 듯,20150201
프랑스 파리 쇼핑 폴렌느 가방 솔직한 후기,파리 쇼핑 템 분 집중 주시 것 폴렌느 브랜드 소개 폴렌느 파리 폴렌느 가방 쇼핑 꿀팁 파리 폴렌느 가방 쇼핑 꿀팁 재고 경우 직원 다른 매장,20240428
프랑스 여행 파리 포럼 데 알 쇼핑센터  파리 놀거리,프랑스 파리 여행 후기 글 포럼 데 알 파리 아이스크림 맛집 파리 쇼핑 센터 등 포럼 데 알 모습 쇼핑 수 장점 파리 쇼핑,20240611
블라블라  주말일기  파리쇼핑 추천템 3탄  랜서 추가설명,아침 창문 밖 풍경 그림 이 집 나 왜 파리 개 고생 파리 쇼핑 템 추가 잼 하나 더 추천 파인애플 잼 요게 제일 제일 뭔가,20230923
파리쇼핑  10프로 적립  봉마르쉐 백화점 프리빌리지데이 후기,또 다음 제대로 준비 세금 폭탄 면 더 스마트 쇼핑 제 정리 파리 쇼핑 백화점 팁 정리 파리 시내 백화점 비교,20191121
프랑스 파리 여행 쇼핑리스트 아울렛 라발레 빌리지 할인 쿠폰 ,사실 쇼핑 만큼 파리 여행 때 파리 쇼핑 리스트 여러분 추천 듣기 해도 소리 나 삐 뻔쩍 명품 브랜드 보고 선물 용,20231028
파리쇼핑 마리아쥬프레르  라뒤레  포숑  사브르  바질약국,정도 파리 약국 쇼핑 한국 화장품 것 구입 담배 얘 루브르 구입 플라스틱 접시 파리 쇼핑 포스팅 여기 끄읏,20150403
파리 쇼핑 마레지구 컨셉스토어 메르시,쇼핑 구경 커피한잔 시간 식사 등 곳 메르 시 안 뭐 마레 지구 현지 느낌 여유 고스 란 곳 랄 에펠탑 개선문 못 파리 여행 오시,20170719
파리여행 파리 쇼핑 리스트 공유해요feat 몽쥬약국,거기 전문 인솔 자도 이동 중간 중간 파리 쇼핑 리스트 여행 팁 현 지인 더 스마트 쇼핑 관광 수 올해 다시 파리 여행 여기 트래블,20220421
라발레빌리지 파리 아울렛 쇼핑 꿀팁  추석맞이 특급 행사 ,오늘 며칠 전 방문 발레 쇼핑 생생 후기 한정 특급 할인 행사 기간 더욱 파리 쇼핑 수 꿀팁 공유 오봉 파리 X 발레 한정 X,20220909
파리여행  몽쥬약국 쇼핑파리카페 에펠탑 일몰야경 감상,파리 카페 문화 경험 쇼핑 정말 것 파리 쇼핑 리스트 프랑스 화장품 수가 워낙 화장품 브랜드 아벤느,20190103
파리여행 쇼핑 필수 코스  마레지구 편집샵 Merci 메르시 ,외 파리 여행 기념품 프랑스 대표 디저트 마카롱 맛집 라뒤레 피에르 에르 메 비교 후기 amp 파리 여행 파리 쇼핑 메르 시 merci 파리 기념품 마레 지구 마레 지구 쇼핑 파리 여행 코스 amp merci,20240904
신혼여행 DAY 62  파리 마레지구 쇼핑 스투시 산드로 ,프로 우리 마레 지구 온 이유 스 투시 스 투시 파리 파리스 투시 파리 쇼핑 마레 지구 쇼핑 마레 지구 스 투시 매장 보고 봄 파리 꼭 것 하나 스 투시,20240920
파리 여행 선물 쇼핑하기 좋은 갤러리 라파예트 백화점,FRANCE 갤러리 라파예트 백화점 쇼핑 파리 여행 선물 갤러리 라파예트 백화점 질 프랑스 제품 택스리펀 공항 가기 전 바로 수 쇼핑 천국 말 오페라 FRANCE,20240909
프랑스 파리약국 화장품 말고 덱시릴 크림 파리 쇼핑리스트 공유,프랑스 파리 약국 화장품 것 템 현지 추천 아벤느 히알루젤 덱 크림 파리 쇼핑 리스트 공유 글 사진 붐붐 Paris Sunny 파리 여행 수 것 중 하나 바로 약국 쇼핑 입 Paris Sunny,20241007
파리 세인트제임스 쇼핑 후기 나발II amp 메르디앙,파리 세인트제임스 쇼핑 후기 요 근래 몇개 파리 쇼핑 아이템 글 블로그 유입 것 것 검색 네이버 블로거 도움 터 파리 여행,20170828
파리 쇼핑 샤를드골공항 택스리펀 정리,유럽 파리 out 모든 택스리펀 서류 샤를 드골 공항 파리 쇼핑 택스리펀 개요 샤를 드골 공항 처리 방법 현금카드 일반 카드 out,20240812
파리쇼핑 꿀팁 라발레빌리지 아울렛 할인쿠폰 amp 무료셔틀,파리 쇼핑 꿀팁 파리 최대 쇼핑 아울렛 라빌레 혜택 확인 꼭 한번 이번 여름 프랑스 파리 로맨틱 여행 계획 꼭 혜택,20190706
해외 직수입의류 쇼핑몰 스타일파리에서 화이트수트 겟,해외 수입 의류 쇼핑몰 스타일 파리 파티 복 스타일 원피스 데 일리 스타일 파리 쇼핑몰 모델 컷 디테일 컷 모두 리얼 더 구매 것,20190414
파리 쇼핑 3  몽테뉴 셀린느 트리오페 선글라스  화이트,메사 파리 몽테뉴 거리 가도 쇼핑 것 셀린느 것 것 구경 파리 셀린느 매장 왜 게 소품,20220831
파리여행 쇼핑  새로생긴 몽쥬약국 3호점 가본 후기,파리 여행 가시 대부분 파리 약국 쇼핑 파리 역시 화장품 파리 쇼핑 리스트 선물 용 고민 보통 몽쥬 약국 쇼핑 해,20190122
파리여행 마레지구 구경하기 좋은 메르시 쇼핑,파리 쇼핑 메르 시 파리 여행 초 저희 파리 메르 시 쇼핑 간날 날 비 좀 메르 시 때 살짝 비 기억 날짜 갑자기 그때 더 새록새록,20170905
파리여행 파리쇼핑 프랭땅백화점 꿀팁  프랑스관광청 쿠폰,파리 쇼핑 곳 꽤 유서 백화점 아울렛 샹젤리제 거리 등등 이 중 제 앞 더 파리 쇼핑 것 파리 프랭땅 백화점 x 프랑스 관광 청 제공 x,20221208
파리 쇼핑 10유로대 가격 파리 여자 선물 기념품 추천 ,파리 기념품 추천 프랑스 살 것 파리 살 것 파리 쇼핑 리스트 프랑스 쇼핑 리스트 프랑스 화장품 파리 약국 화장품 파리 프랑스 파리 여행 프랑스 여행 프랑스 곳 paris france londoner 런더너 paris france londoner,20240903
파리 쇼핑  파리 1월 날씨 amp 겨울 패션 쇼핑 팁,파리 쇼핑 파리 겨울 쇼핑 리스트 르봉 치약 LEBON 몽쥬 약국 가격 개 구입 시 개 증정 행사 중 천연 유기농 성분 치약 에르메스 르봉 치약 무 불소 무 파라 LEBON,20171228
파리니스 쇼핑리스트 추천,파리 쇼핑 리스트 니스 쇼핑 리스트 파리 기념품 추천 니스 기념품 추천 프랑스 기념품 추천 파리 쇼핑 리스트 구매 기념품 마트 살 마들렌 종류 별 구매 추천 한국,20240909
파리쇼핑Tip 파리지엔느가 사랑하는 패션브랜드 마쥬Maje,파텔 Partell 파리 쇼핑 팁 파리 지엔 느 사랑 패션 브랜드 마쥬입 마쥬 또한 매장 악세사리 옷 매치 때문 쇼핑 때 이용 수 Partell,20140614
튈르리 정원 파리 쇼핑 아라비카 커피 ARABICA COFFEE,루브르 박물관 튈르히 정원 튈르 리 정원 파리 여행 파리 날씨 옷차림 하트 거리 풍경 깜봉 오늘 오빠 쇼핑 날 난 탕진,20220805
프랑스여행정보 파리 신발 쇼핑을 할 수 있는 곳,파리 쇼핑 경험 위해 효율 갤러리 라파예트 Galerie Lafayette 원스톱 신발 쇼핑 수 갤러리 라파예트 파리 전역 가장 신발 볼 수 Galerie Lafayette,20181123
파리 쇼핑  2017년 프랑스 겨울 세일 일정 및 파리 쇼핑 스팟,봉 마르 셰 백화점 파리 쇼핑 프랑스 겨울 세 일 일정 및 파리 쇼핑 스팟 르 봉 마르 셰 백화점 파리지앵 가장 사랑 백화점 봉 마르 셰 쇼핑 거리 오페라 지구 약간 파리,20161228
파리 여행 샤넬 파리 쇼핑 파리 샤넬 쇼핑팁,파리 쇼핑 팁 맘 팁 파리 샤넬 쇼핑 팁 샤넬 모델 사진 장해 요즘 얼마나 인터넷 발달 매장 가면 정신 사람 장난 줄,20130717
아이쇼핑만으로도  즐거운 파리 쇼핑 거리,우리 쇼핑 거리 요 아이쇼핑 파리 쇼핑 거리 파리 쇼핑 거리 쇼핑 도시 파리 시내 곳곳 눈 마음 상점,20170824
파리 쁘렝땅 백화점에서 명품쇼핑 샤넬 및 셀린느 구입 후기,파리 쇼핑 필수 코스 쁘렝땅 백화점 샤넬 및 셀린느 구입 후기 쁘렝땅 파리 명품 쇼핑 팁 소개 파리 쁘렝땅 백화점 쇼핑 팁 할인 쿠폰 웨이 팅 프랑스 파리 여행 명품 쇼핑,20240515
프랑스파리 파리에서 쇼핑하기 파리 쇼핑리스트 1,Shopping in Paris 파리 쇼핑 필수 코스 몽쥬 약국 및 약국 라파예트 백화점 외 통째 꼬 달리 디바인 오일 사실 홈쇼핑 꼬 달리 디바인 오일 판매 거의 살뻔 파리 여행 Shopping in Paris,20130806
파리 쇼핑리스트 총정리 득템 기회 라발레빌리지 아울렛 추석 ,파리 쇼핑 리스트 총 정리 파리 여행 곳곳이 쇼핑 득템 기회 발레 아울렛 추석 축제 특별 쿠폰 무료 셔틀버스 파리 여행 의 즐거움 중 하나 파리 쇼핑 도 포함 사실 그다지 쇼핑,20190904
파리쇼핑 라발레 빌리지에서 득템하기D,파리 시내 쇼핑 백화점 샹젤리제 때문 여기 더 나 고민 파리 쇼핑 마치 메트로 역 짐꾼 차 된장 샷,20141230
2014 파리 여행파리 쇼핑 파리에서 샤넬백 CHANEL 구입 ,파리 여행 파리 쇼핑 파리 샤넬 CHANEL 구입 후기 하이라이트 세관 통과 보이 샤넬 BOY CHANEL BAG 보이 샤넬 클래식 캐비어 가죽 금 점보 사이즈 파리 여행 파리 쇼핑 하이라이트 샤넬 CHANEL BOY CHANEL BAG,20140826
비행일기  봉쥬르 파리2탄  그릇쇼핑 주방용품 승무원의 ,파리 첫 밤 아예 날 밤 새 워 라면 프로 틴바 견과류 등등 재끼 호텔 비 호주 승무원 산 파리 쇼핑 리스트 정리 엠브리오 리스 제품 정말,20240928
요니여행 파리 여행 5박 6일 코스8  파리 쇼핑리스트,파리 박 코스 파리 쁘렝땅 백화점 몽쥬 약국 마레 지구 쇼핑 공항 쇼핑 데이 차 오전 일 정이 미술관 이후 본격 쇼핑 시작 쁘렝땅 백화점 인포 메이 션 여권,20240916
파리 마레지구 쇼핑 메종키츠네 니트 반값득템  메르시 ,파리 파리 마레 지구 마레 지구 마레 지구 쇼핑 파리 쇼핑 파리 메종 키츠네 메종 키츠네 마레 구 메종 키츠네 밥 구경 마레 지구 가게 하나 하나 사진 계속 내 폰 용량,20200109
파리 명품 쇼핑   쇼핑하고 백화점 VIP 프라이빗 라운지 ,파리 갤러리 라파예트 백화점 최고 쇼핑 경험 수 파리 쇼핑 메카 곳 보고 구입 차원 쇼핑 나 공간 라운지 경치,20230427
파리쇼핑 벼룩시장에서 득템한 두 가지,파리 쇼핑 벼룩시장 득템 두 가지 만 파리 여행 이야기 여행 마지막 날 공항 시 간전 부랴부랴 일요 마켓 향 우버 정도 거리,20151207
파리쇼핑  몽쥬 명품관 PARFUMERIE MONGE,파리 쇼핑 몽쥬 품관 Bon Shopping 오봉 파리 할인 쿠폰 이용 더 할인 가격 향수 구매 수 사실 오봉 파리 몽쥬 명품 관 할인 쿠폰 다운 주소 Rue Monge Paris Bon Shopping Rue Monge Paris,20160123
파리 여행 쇼핑리스트 마레지구 메르시 기념품 선물 총정리,오늘 파리 여행 쇼핑 리스트 총 정리 마레 지구 메르 시 파리 여행 기념품 선물 구경 방문 파리 쇼핑 파리 여행 글,20231113
파리쇼핑Tip 프랑스 유명명품가방 브랜드 롱샴매장 ,좀더 파리 롱샴 가방 쇼핑 위 몇 가지 팁 첫 롱샴 매장 이따 파리 대표 백화점 갤러리 라파예트 등 곳 입점 백화점 내,20150222
파리 여행 갤러리 라파예트 백화점 쇼핑 택스리펀 방법 및 ,파리 쇼핑 곳 인기 곳 중 곳 갤러리 라파예트 백화점 요 저 역시 파리 쇼핑 장소 가장 곳 바로 갤러리 라파예트 백화점 이번 파리,20180630
2024 프랑스 파리 아울렛 라발레빌리지 쇼핑하기,곳 쇼핑 주 목적 라면 여기 시간 더 추천 막 살 파리 여행 파리 아울렛 파리 발레 프랑스 여행 파리 쇼핑,20240618
프랑스 파리 여행 마레지구 쇼핑 메르시 및 가볼만한곳,프랑스 파리 마레 지구 쇼핑 맛집 길 야외 테이블 식당 카페 한국인 법 케이크 패스츄리 샌드위치 베이커리 외 맛집 포진,20240803
파리 마레지구 쇼핑ㅣ산드로 아울렛 가격 슈프림 반팔 스투시 ,파리 쇼핑 저희 파리 쇼핑 해도 과언 정도 정말 작정 쇼핑 날 근로자의날 쇼핑 수 백화점,20240627
파리 빈티지샵 vintage desir 프리피스타  매드빈티지 쇼핑,파리 여행 파리 쇼핑 파리 빈티 샵 파리 빈티 쇼핑 마레 지구 마레 지구 쇼핑 킬로 프리 피 스타 매드 빈티 파리 빈티 샵 여행 전 코스 맘 에드 코트 재질,20200113
파리 쇼핑리스트 약국 화장품 세포라 초콜릿 쿠스미티,유럽 도시 쇼핑 나 파리 정말 쇼핑 것 것 사람 파리 쇼핑 리스트 달리도 파리 유럽 여행 마지막 도시 기도,20161027
프랑스파리쇼핑샤넬지갑캐비어중지갑샤넬카드지갑,파리 쇼핑 샤넬 지갑 욤 이제 왜 전 파리 여행 구입 나 지갑 샤넬 얘기 파리 샤넬 매장 번은 인지상정 그냥,20151113
세잔Sézane  파리 세잔 쇼핑  팁  세잔에서 산 청 셔츠,그 전 폴렌 polene 방문 폴렌 퀄리티 생각 상대 효과 일 수도 결제 후 쇼핑 파리 안내 브로 슈 인상 뭐 하나 허투루 게 내 만약 polene,20240501
파리쇼핑Tip파리의 또다른 쇼핑명소 시타디움,파텔 파리 쇼핑 명소 시 타 디움 citadium 주소 rue de caumartin 시간 월토 파리 시내 안 또 다른 시 타 디움 파리 시청 부근 매장 크기 지금 citadium rue de caumartin,20140827
파리 쇼핑 아크네스튜디오 머플러 목도리 울스카프 핑크 구매 ,구매 쇼핑 가지 커서 빠이 파리 구매 다음 날 아크네 울 목도리 아크네 스카프 파리 쇼핑 파리 백화점 택스리펀 파리 택스리펀 파리 여행 파리 아크네,20230418
파리 에르메스 에서 트윌리 쇼핑 뚜르비옹 실패 ㅜㅜ,것 영국 스위스 프랑스 순서 모든 순서 프랑스 파리 쇼핑 여윽시 쇼핑 체 고시 파리 신혼여행 이후 두번째 방문 그때 이탈리아 피렌체 더 아울렛,20180109
프랑스파리 파리 쇼핑 후 카드 택스리펀글로벌 블루 플래닛 ,저 풰이보릿 백화점 Le Bon march 유럽 여행 아웃 도시 쇼핑 수 곳 거의 국룰 저 매번 프랑스 파리 마지막 도시 정합 니 프랑스 곳 이상 결제 Le Bon march,20241003
파리 쇼핑  파리 니치 향수 브랜드 매장 BEST 6  르 라보 ,오늘 파리 만날 수 니 치 향수 브랜드 매장 소개 르 라보 Le 아마 여러분 인생 향수 발견 수 거 몽쥬 약국 필수 쇼핑 템 Le,20200708
프랑스 파리 쇼핑명소 라발레 빌리지 무료셔틀  VIP 카드 혜택,럭셔리 쇼핑 선택 폭 파리 구입 명품 브랜드 비행기 값 덕분 파리 쇼핑 리스트 검색 고민,20190626
