title,chunked_description,postdate
240725 Journey  파리 혼자 그리고 런던파리 쇼핑샷,제 런던 여행 파리 여행 결과물 쇼핑 떼샷 주로 런던 러쉬 정도 뿐 프랑스 라파예트 산 트러플 라인 마그넷 약국 물품 트러플 라인 보이,20240911
파리 몽쥬약국 쇼핑리스트 위치 가격 파리여행 기념품 추천,오늘 파리 몽쥬 약국 위치 및 제 구매 파리 기념품 추천 쇼핑 리스트 가지 대해 공유 파리 쇼핑 리스트 구매 도움 오늘 포스팅,20241010
파리여행 쇼핑 아울렛 필수 코스 라발레 빌리지 방문 후기,파리 쇼핑 명소 발레 발레 파리 시내 약간 대표 파리 아울렛 쇼핑몰 그냥 아울렛 고급 브랜드 제품 구입 수 곳 쇼핑,20240822
파리 여행 마레지구 쇼핑 메르시 편집샵 맛집 오베르마마,프랑스 여행 파리 여행 마레 지구 파리 마레 지구 쇼핑 맛집 파리 마레 지구 인기 브랜드 곳 카페 CARETTE 추천 파리 마레 지구 파리 맛집 파리 곳 프랑스 파리 쇼핑 CARETTE,20240702
파리 라발레빌리지 아울렛 쇼핑 셔틀 가는법 쿠폰,쇼핑 시간 저희 쇼핑 제대로 하루 일정 발레 쿠폰 발레 셔틀 발레 법 파리 아울렛 파리 쇼핑,20240322
파리 샤를드골 국제 공항 쇼핑 기념품 프랑스 라뒤레 마카롱,참고 프랑스 쇼핑 파리 쇼핑 프랑스 마카롱 파리 기념품 파리 공항 라뒤레 마카롱 우리나라 브랜드 프랑스 마카롱 파리 기념품 구입 거 맛,20240805
파리 신혼여행 4일차 쇼핑데이 바토무슈 파리 밤야경 구경하기,파리 신혼여행 차 쇼핑 데이 바토 무슈 파리 밤 야경 구경 파리 신혼여행 파리 쇼핑 파리 비르 켐 다리 파리 바토 무슈 파리 야경 넷째 날 시간 슉슉 신혼여행 진짜 하루하루,20240515
파리 여행 쇼핑 명소 라발레빌리지 amp 쿠폰 공유,여행 기분 정도 낼 수 수준 눈치 안 보고 쇼핑 할인 율 곳 대체로 중 저가 브랜드 할인 파리 쇼핑 파리,20240629
프랑스 파리 몽쥬약국 쇼핑리스트 추천 위치 할인 쿠폰 공유해요,프랑스 파리 여행 그 여행 끝 백화점 아울렛 몽쥬 약국 하루 가열 쇼핑 것 마무리 하루 파리 쇼핑 리스트 완전 정복 목적 가지,20240905
파리 프랑스 쁘렝땅 오스만 백화점 쇼핑리스트 feat 명품 쇼핑,파리 쁘렝땅 오스만 프랑스 문화유산 파리 쇼핑 천국 쁘렝땅 오스만 백화점 주소 Bd Haussmann Paris 프랑스 트립 쿠폰 혜택 할인 세금 환급 루이비통 고 야드 제외 제 이번 프랑스 쇼핑 Bd Haussmann Paris,20240528
스투시 반팔 티셔츠 파리 쇼핑리스트 매장 구매 가격 후기 착용샷,gt 여행 분 기념품 고민 파리 쇼핑 리스트 추천 파리 마레 지구 쇼핑 보기 편집 메르 시 포스팅 gt,20240805
파리 몽쥬약국 쇼핑리스트와 함께 본점방문 할인쿠폰 정보 추천,이번 파리 몽쥬 약국 쇼핑 리스트 정리 파리 기념품 지인 선물 몽쥬 약국 파리 쇼핑몰 점 정말 가성 비 제 이번 알 몽쥬 약국,20240916
프랑스 파리 쇼핑 아울렛 라발레빌리지 할인쿠폰 공유해요,아이템 쇼핑 안성맞춤 곳 여기 할인 율도 프랑스 파리 쇼핑 질 명품 구매 분 안성맞춤 프랑스 파리 아울렛 랍 위치 파리 중심 차로,20241003
파리 쇼핑 아울렛  라발레빌리지 가는법 amp 쿠폰,파리 쇼핑 아울렛 파리 발레 발레 법 amp 쿠폰 유럽 여행 DAY 파리 쇼핑 아울렛 발레 날 구찌 폴로 등등 쇼핑 꾸벅 파리 아울렛 amp DAY,20240726
파리 아울렛 라발레빌리지 트래블맵 추석맞이 할인쿠폰 쇼핑,파리 아울렛 발레 할인 쿠폰 여기 발레 파리 명품 쇼핑 파리 쇼핑 아울렛 이 포스팅 트래블 맵 소정 원고료 지급 직접 경험 후기,20241003
프랑스 파리 아울렛 라발레빌리지 쇼핑리스트 추석 할인쿠폰 공유,저 쇼핑 매니아 파리 현지 구매 명품 한번 파리 쇼핑 리스트 스팟 시내 라파예트 백화점,20240916
파리 쇼핑 라발레 빌리지 할인 구입 리스트 공유  VIP 혜택 및 ,파리 쇼핑 명소 발레 파리 곳 유럽 최대 규모 아울렛 발레 여가 브랜드 최대 할인 텍스리펀 혜택 누리 쇼핑,20240912
파리 3대백화점 쁘렝땅 라파예트 롱샴 쇼핑,PARIS 파리 백화점 프랑스 세계 쇼핑 스팟 중 파리 쇼핑 뿐 그 건축 움 감상 겸 온 이유 곳 PARIS,20240819
프랑스 파리 쇼핑  셀린느 트리오페 틴 구입 가격,셀린느 쇼핑 파리 구입 박스 더스트 백 새 제품 상태 확인 컨디션 제품 파리 셀린느 매장 직원 가격,20230314
프랑스여행 파리 쇼핑명소 라발레 빌리지에 가서 쇼핑하자,마다 대한항공 마일리지 마일 적립 가능 발레 프랑스 파리 프랑스 여행 파리 여행 프랑스 파리 쇼핑 파리 쇼핑 파리 쇼핑 명소 비스터 콜렉션 파리 근교 쇼핑,20241007
파리 라발레빌리지 가는법 프랑스 여행 파리 쇼핑리스트,매번 디즈니랜드 이번 여정 시간 파리 발레 탐방 쇼핑 파리 쇼핑 리스트 창고 파리 쇼핑 리스트 가운데 의류 아이템 제대로 구입 무조건 발레,20240623
프랑스 파리 쇼핑리스트 몽쥬약국 할인쿠폰 및 후기,파리 온전 마지막 날 마지막 날인 첫 일정 몽쥬 약국 것 약 전 파리 이상 구매 총 할인 택스리펀 할인 수 완전 몽쥬 약국 쇼핑 끝,20240918
프랑스_파리 마리아쥬 프레르 본점에르메스 본점_파리 쇼핑 ,이번 포스팅 파리 쇼핑 것 포스팅 세계 여행 정말 쇼핑 호주 Tim Tam 외 마그넷 정도 아내 딸 하나 부탁 것 곳 파리 딸 Tim Tam,20241012
파리 쇼핑  라 발레 빌리지 최대 25 할인 쿠폰 추석 프로모션 ,파리 여행 쇼핑 파리 쇼핑 리스트 필수 명품 쇼핑 발레 몽클레어 팬디 생로랑 프라다 구찌 버버리 로에베 막 스마라 아마 명품 마쥬,20240913
파리 기념품샵 쇼핑몰에서 알찬 구매를 원하면 몽쥬약국으로 ,생각 쇼핑 리스트 작성 게 것 파리 기념품 왜 제 말씀 안 파리 쇼핑몰 자리 현지 사람 뿐,20240909
파리 여행 8일차 르봉마르셰봉막쉐 식품관 쇼핑 파리 쇼핑 ,bistrot des vosges 구글 평점 임시 휴업 구글맵 확인 방문 파리 여행 파리 쇼핑 파리 품관 쇼핑 파리 쇼핑 리스트 파리 쇼핑 추천 템 르봉 마르 셰 봉막쉐 르봉 마르 셰 백화점 봉막쉐 품관 bistrot des vosges,20240907
파리 라발레 빌리지 명품쇼핑하기 좋은 곳 다양한 혜택 ,추억 또한 주변 관광지 맛집 더욱 여행 계획 파리 명품 쇼핑 파리 여행 쇼핑 발레 파리 명품 파리 쇼핑 파리 발레,20241011
파리 쇼핑 지도 5대 백화점갤러리라파예트 봉마르쉐 ,근처 마레 지구 방문 지하 층 다른 백화점 루프 탑 좀 더 여유 카페 잔 파리 대형 백화점 위치 쇼핑 장해 두시,20240818
파리 여행 쇼핑리스트 기념품은 라발레빌리지에서 ,파리 발레 파리 발레 현 지인 파리 쇼핑 위해 쇼핑 메카 이자 근교 아울렛 요 시내 정도 거리 저 여행 파리 기념품,20240624
파리 여행 마레지구 쇼핑과 카페 맛집,파리 마레 지구 인기 컨템포러리 브랜드 로드 쇼핑 사람 성지 직원 매우 영어 파리 여행 파리 마레 지구 파리 곳 프랑스 파리 쇼핑,20240503
프랑스 여행 파리 쇼핑리스트 콩당세 화장품 세럼 크림 BEST4 ,승무원 크림 승무원 세 럼 정말 파리 쇼핑 리스트 랍 파리 콩 당세 구매 처 몽쥬 약국 등 파리 시내 약국 라파예트 백화점 쁘렝땅 백화점 구매 수 한국 직구 도,20240610
파리 라발레빌리지 추석프로모션 및 할인쿠폰으로 명품쇼핑 꿀팁,발레 LaValleeVillage 프랑스 여행 파리 여행 파리 명품 쇼핑 파리 쇼핑 아울렛 파리 아울렛 파리 쇼핑 유럽 여행 트래블 맵 TRAVELMAP 추석 파리 가을 여행 라벨 vip 패스 LaValleeVillage TRAVELMAP vip,20240930
파리 쇼핑 라발레빌리지 쿠폰 택스리펀파리 쇼핑리스트,할인 알렉산더 맥퀸 할인 산드로 자딕애놀테르 디젤 마이클 코 어스 지방시 바카라 파리 발레 쇼핑 유명 브랜드 카베 네타 구찌 막 스마라 프라다 롱샴 질 샌더 등 파리 쇼핑 리스트,20240928
파리 마레지구 쇼핑 카페 및 에펠탑 야경 코스,스 투시 칼 하트 등 여러 매장 가장 신상 트렌드 볼 수 파리 마레 지구 쇼핑 필수 코스 저장 파리 쇼핑 시 택스리펀 매장 이상 시 신청 여권 참고,20241006
프랑스 파리 여행 쇼핑리스트 콩당세 화장품 미백 세럼,오늘 프랑스 파리 여행 때 사 기념품 쇼핑 리스트 이야기 해 프랑스 기념품 파리 쇼핑 리스트 수 화장품 바로 콩 당세,20240603
파리여행 후 공항으로 캐리어 짐배송 하는법 amp 파리 쇼핑,파리 쇼핑 파리 백화점 쇼핑 갤러리 라파예트 설계도 백화점 마치 박물관 온 듯 기분 수 백화점 몇 시간 쇼핑 때 우버 타고,20240802
파리여행 명품 쇼핑 라발레 빌리지 10 할인 받는 트래블맵 ,발레 LaValleeVillage 프랑스 여행 파리 여행 파리 명품 쇼핑 파리 쇼핑 아울렛 파리 아울렛 파리 쇼핑 유럽 여행 트래블 맵 TRAVELMAP 추석 파리 가을 여행 파리 명품 여행 파리 명품 구매 LaValleeVillage TRAVELMAP,20240922
프랑스 파리 명품 쇼핑 여행 코스 쇼핑리스트 채워 가요,이상 쇼핑 고객 La Roche Posay 라로슈포제 리페 크림 혜택 만약 파리 쇼핑 리스트 것 파리 여행 코스 발레 포함 번 La Roche Posay,20240911
파리 약국 쇼핑과 비상약 구입하는 방법,파리 쇼핑 비상 약 처방 관 정보 외국 달 살기 몇 가지 문제 생기 때 택스리펀 이외 이야기 파리 약국 쇼핑 및 정보 약 처방 쇼핑 파리 약국 약 구입,20240910
파리쇼핑 gt 트래블맵 X 라발레 빌리지 VIP 패스 다운 받아가세요,httpswwwtravelmapcokrdiscountview 포스팅 홍보 위해 작성 것 소정 고료 음 명시 발레 LaValleeVillage 프랑스 여행 파리 여행 파리 명품 쇼핑 파리 쇼핑 파리 여행지 httpswwwtravelmapcokrdiscountview LaValleeVillage,20240524
파리 쇼핑 마레지구 스투시 stussy paris 8볼 티셔츠 재고 ,파리 마레 지구 스 투시 쇼핑 stussy paris 볼 티셔츠 재고 가격 택스리펀 가능 유무 글 사진 하이 부부 파리 마레 지구 쇼핑 메카 여러 유명 브랜드 입점 인기 마레 지구 stussy paris,20241006
파리 명품 쇼핑 라발레 빌리지 추석 여행 한국인 할인 혜택,파리 명품 쇼핑 추천 발레 La Vall e Village Cr de la Garonne Serris France 매일 RERA 라인 VAL DEUROPE 하차 파리 디즈니랜드 정거장 차이 파리 시내 유료 셔틀버스 이용 파리 La Vall e Village Cr de la Garonne Serris France RERA VAL DEUROPE,20240910
파리 기념품 몽쥬약국 쇼핑리스트 위치 쿠폰 공유,제 정리 파리 몽쥬 약국 쇼핑 리스트 및 본점 위치 정보 쿠폰 파리 기념품 쇼핑 몽쥬 약국 쿠폰 여기 gtgt httpscafenavercommoomge gtgt httpscafenavercommoomge,20240915
프랑스 파리 쇼핑 쁘렝땅백화점 5 쿠폰 명품 쇼핑 택스 리펀 방법,보통 프랑스 파리 쇼핑 분 명품 쇼핑 목적 것 한국 때 세금 신고 파리 저 정말 일일이 검색 편 프랑스 관광 청 쁘렝땅 백화점,20240826
부담 없는 파리 쇼핑 리스트 몽쥬약국부터 선물용으로 좋은 ,몽주 약국 쇼핑 리스트 브랜드 별 정리 유리아 쥬 파리 대표 쇼핑 장소 몽주 약국 구매 파리 살 수 최고 가성 비 선물 탬 생각 제품 마망 버터 마들렌 파리 쇼핑,20240616
파리 쇼핑 리스트  파리 기념품 가족 친구 510만원대 ,약국 화장품 파리 쇼핑 약국 화장품 쇼핑 필수 코스 요즘 한국 구매 수 제품 가격 파리 구매 때 제일 것 저 파리,20240905
파리 쇼핑 프랑스 파리 쇼핑리스트 채우기 좋은 아울렛 추천,파리 쇼핑 아울렛 비스터 컬렉션 하나 발레 유럽 중국 주요 도시 개 비스터 컬렉션 실외 쇼핑 명소 중 곳 파리 정도 안 인기,20240830
파리 여행 쇼핑 명소 갤러리 라파예트 백화점 옥상전망대 테라스,백화점 파리 쇼핑 명소 전망대 추천 여행 앞서 갤러리 라파예트 백화점 소개 바야흐로 쇼핑 성지 파리 파리 여행 경험 분 쇼핑 위해 백화점 중 가장 곳 중,20240920
파리 쇼핑리스트 1  마트 과자 추천 파리기념품 APC ,안녕 Bliss of Travel 이번 파리 여행 쇼핑 테마 쇼핑 과연 제 얼마나 수 파리 쇼핑 리스트 부터 시작 Bliss of Travel,20241010
프랑스 파리 쇼핑 추천 세잔느 Sezane,파리 쇼핑 고 환율 상황 불구 국내 가격 비교 분명 메리트 뭔가 사면 단위 별것 카드 값 그 중 프랑스 파리 쇼핑,20240115
파리 쇼핑리스트 들고 가야하는 파리 아울렛 라발레빌리지,그냥 길거리 평소 파리 쇼핑 해도 추억 파리 아울렛 구경 것 경험 요 쇼핑 거 풍경 곳 조금 더 할인,20240830
파리 향수 쇼핑 프라고나르향수 추천,날씨 파리 쇼핑 기념품 구입 것 꼭 PARIS 살 수 것 것 아주 생각 그 중 향수 분 파리 향수 쇼핑 PARIS,20240924
프랑스 여행 파리 유럽 명품 쇼핑 추천 라발레 빌리지 VIP패스 ,유럽 명품 쇼핑 LaValleeVillage 파리 여행 파리 명품 쇼핑 파리 쇼핑 파리 여행지 파리 쇼핑 유럽 여행 트래블 맵 TRAVELMAP 라벨 vip 패스 프랑스 명품 쇼핑 파리 여행 추천 유럽 명품 쇼핑 LaValleeVillage TRAVELMAP vip,20240521
할인 혜택 및 아모리노 달콤세트 증정 파리 쇼핑 파리 아울렛,일단 발레 위치 파리 중심 디즈니랜드 거리 위치 아이 가족 여행객 라면 쇼핑 디즈니랜드 동시 수도,20240705
프랑스 파리 가볼만한곳 명품쇼핑 아울렛 라발레빌리지,파리 명품 쇼핑 이 크게 몫 거 꼭 명품 중 저가 프랑스 브랜드 파리 쇼핑 곳 추천 민트 빛 라뒤레 매장 그냥 수,20240916
파리 쇼핑리스트 마레지구 슈프림 편집샵 메르시 가격 택스리펀,파리 쇼핑 리스트 기념품 자주 포함 메르 시 에코 L 메르 시 에코 M 한국 네이버 쇼핑 기준 라지 정도 파리 게 L M,20240921
파리 몽쥬약국 할인쿠폰 위치 쇼핑 후기까지,몽쥬 약국 할인 쿠폰 위고 카페 마련 다운 주소 아래 파리 쇼핑 쇼핑 gtgt 파리 몽쥬 약국 할인 쿠폰 httpscafenavercommoomge gtgt httpscafenavercommoomge,20240412
파리 쇼핑 2024 몽쥬약국 추천 쇼핑리스트 택스리펀 ,파리 쇼핑 Day 몽쥬 약국 추천 쇼핑 리스트 택스리펀 할인 쿠폰 르 봉 마르 쉐 식품 관 결제 시 할인 코드 OBONPARIS 입력 할인 적용 몽쥬 약국 추천 쇼핑 리스트 오봉 파리 파리 꼭 Day OBONPARIS,20240804
여름세일 파리 쇼핑  백화점 기념품 파리올림픽 굿즈 구매,실감 나 파리시청 파리 쇼핑 여름 세 일 저번 주 시작 파리 여름 세 일 세 일 기간 제품 파리 기념품 사기 황금 쇼핑 기간 BHV 층 So French 매장 별로 베레모 BHV So French,20240706
파리 몽쥬약국 쇼핑리스트 화장품  파리 쇼핑 기념품 프랑스 ,나 프랑스 고급 뷰티 브랜드 쇼핑 리스트 파리 구 수 프리미엄 안티 이징 제품 총 정리 시중 안티 이징 제품 믿음 안,20240814
프랑스 파리 쇼핑몰 라발레빌리지 쿠폰과 함께 알뜰살뜰 쇼핑,정도 파리 쇼핑 구 저 맘 쇼핑 예정 파리 발레 정말 구 거기 내 게 하나 보기 옆,20240805
파리 몽쥬약국 쇼핑 쇼핑리스트 추천해요,여러 개 구매 오시 걸 추천 파리 쇼핑 해 마트 약국 구매 것 인기 몽쥬 약국 쇼핑 쿠폰 사용 이용 파리 여행 중 각종,20240421
파리쇼핑아울렛 트래블맵 X 라발레 빌리지 명품 쇼핑 할인쿠폰 ,프랑스 명품 쇼핑 명품 아울렛 파리 쇼핑 여행 유럽 여행 파리 쇼핑 리스트 프랑스 쇼핑 리스트 파리 여행 추천 라벨 vip 패스 라벨 할인 쿠폰 유럽 아울렛 유럽 쇼핑 성지 파리 여행 vip,20240930
파리 쇼핑 프랑스 샹제리제 거리 쇼핑   모로 파리 ,파리 여행 파리 샹젤리제 쇼핑 파리 골목 여행 파리 론진 쇼핑 모로 파리 MoreauParis 파리 오랑 주리 미술관 파리 샹젤리제 아이쇼핑 파리 서론 진시 체인 사기 수 시계 론진 MoreauParis,20241006
리에스튜디오 lie studio  파리 쇼핑,파리 톰 그레이하운드 쇼핑 줄 마레 지구 쇼핑 마치 호텔 테라스 언박싱 사진 종이 박스 혹 스턴 호텔,20230329
파리쇼핑 폴렌느 르봉마르셰봉막쉐 백화점 가격,파리 여행 수 쇼핑 아이템 중 하나 폴렌느 가방 한국 가로수길 팝업 스토어 연 폴렌느 파리 쇼핀 파리 쇼핑 리스트 프랑스 파리 쇼핑 파리 폴렌느 매장 봉막쉐 백화점 와봉마르쉐 가방,20240924
파리 쇼핑 리스트가성비10유로 ,파리 미만 지인 선물 수 선물 누구 제품 오늘 미만 파리 쇼핑 리스트 best 소개 유리아 쥬 립밤 과거 비 가격 best,20240911
파리 마레지구 쇼핑  메르시 Merci 에코백,블로그 후기 보시 분 에코 구매 쓰기 모네 집 출발 바로 쇼핑 고고싱 파리 쇼핑 메르 시 위치 파리 메르 시 Merci 라이프스타일 컨셉 Merci,20240821
파리 방브 벼룩시장 거리 쇼핑 리스트 그릇과 기념품 추천,파리 기념품 쇼핑 고민 방브 벼룩시장 추천 주말 아침 쇼핑 하루 시작 보시 건 요 파리 쇼핑 추천 방브 벼룩시장 방문 이용 팁 주말 운영,20241009
파리여행 쇼핑 위시리스트  파리 3번째 방문 꼭 사오고 싶은 ,파리 쇼핑 리스트 파리 쇼핑 파리 몽쥬 약국 애플스토어 롱샴 리츠 파리 해헤 이제 가족 여행 얼마 원래 여행 돈 지랄 쇼핑 행복 탕진 습 꽈,20240929
프랑스 파리 기념품 쇼핑 가볼만한곳 라발레빌리지 추천,아크네 스튜디오 발렌시아 가나 버버리 끌 구찌 등 명품 쇼핑 최고 파리 쇼핑 향수 구매 분 발레 강추 파리 곳,20240915
프랑스 명품쇼핑 파리 라발레 빌리지 아울렛 쿠폰 공유해요,프랑스 명품 쇼핑 파리 발레 아울렛 쿠폰 공유 유영 파리 여행 행복 그 자체 그동안 여행지 기분 관광 거,20240927
파리 여행 필수코스 라발레 빌리지 아울렛을 방문해 쇼핑해요,동안 파리 아울렛 쇼핑 구 저 맘 파리 쇼핑 내 게 생각 친구 자기 쇼핑 리스트 음 저,20240707
파리 쇼핑 파리 명품 시계 쇼핑  부티크  HOJO 갤러리 ,파리 여행 오시 명품 쇼핑 필수 코스 요즘 명품 시계 주얼리 구매 파리 이 모든 것 한번 쇼핑 수 곳 소개 해 명품 시계,20240906
파리 몽쥬약국 쿠폰으로 알차게 쇼핑하기,패션 쇼핑 아주 파리 의 마음 김 패션 쇼핑 메카 답 무료 제공 중이 한번 이용 트립 쿠폰 파리 쇼핑 쿠폰 및 할인 혜택,20240411
파리 여행 4일차1 파리 근교에서 즐기는 명품 쇼핑 ,일월 파리 쇼핑 파리 근교 아울렛 파리 근교 발레 아울렛 파리 근교 아울렛 파리 아울렛 발레 파리 발레 발레 법 발레 쇼핑 파리 쇼핑 파리 명품 쇼핑,20240827
파리 쇼핑   갤러리 라파예트 파헤치기 amp 파리 와인 쇼핑,com codayo 오페 백화점 밀집 파리 가장 번 곳 쇼핑 파리 여행 파리 쇼핑 파리 백화점 라파예트 갤러리 라파예트 파리 택스리펀 파리 선물 오페라 com codayo,20240713
30대 여자 샤넬 향수 추천 오드 빠르펭 파리 쇼핑 후기,여자 샤넬 향수 추천 오드 빠르펭 파리 쇼핑 후기 뷰 스타 유지 지난번 파리 여행 길거리 쇼핑 중 향 곳 못 샤넬 코 코마 드 젤 오드 빠르펭,20240822
파리 쇼핑명소 추천 라발레 빌리지  아울렛 쿠폰 사용기,파리 쇼핑 명소 추천 발레 아울렛 쿠폰 사 용기 프랑스 파리 관광 지로 쇼핑 최고 도시 프랑스 아이템 여행 내내,20240708
파리 가볼만한곳 쇼핑리스트 마레지구 메르시 merci,메르 시 에코 팔찌 파리 쇼핑 리스트 꼭 인기 아이템 Merci 헤헤 파리 쇼핑 진짜 파리 사랑 Merci,20240404
파리 에펠탑 개선문 여행코스 가볼만한곳 카페 쇼핑 파리지하철,파리 에펠탑 개선문 여행 코스 곳 카페 쇼핑 파리지하철 올림픽 썩 파리 파리 카페 맛 곳 더 기억 밀크 티 쫍쫍 빈티 맛집 구 파리 쇼핑,20240725
파리 쇼핑 Day 9  마레지구 편집샵 추천 Paperboy Merci ,파리 쇼핑 Day 마레 지구 편집 추천 Paperboy Merci 메르 시 슈프림 파리 유러 피안 비엔 다음 전적 쇼핑 위해 파리 캐리어 워낙 파리 메르 시 Merci Day Paperboy Merci Merci,20240728
파리 폴렌느 심 미니 FTA  파리 쇼핑 POLENE CYME MINI,파리 여행 쇼핑 리스트 폴렌느 Polene 분 파리 여행 필수 코스 파리 가면 무조건 곳 파리 폴렌느 웨이 팅 쇼핑 후기 심 미니 Cyme Mini 착용 샷 재고 구매 일로 Ilo Polene Cyme Mini Ilo,20241009
파리 마트 기념품 쇼핑리스트 모노프릭스 Monoprix ,파리 쇼핑 파리 마트 쇼핑 파리 기념품 파리 식료품 저 명품 쇼핑 식품 쇼핑 진심 분 도움 쇼핑 리스트 공유 파리 쇼핑 리스트 프랑스 기념품 프랑스 파리 쇼핑 먼저,20240215
2023 프랑스 여행  7 파리  쇼핑데이,스위스 쇼핑 거의 안 파리 잔뜩 자제 소금 좀 사 껄 방사 능 때문 소금 마지막 밤 대형 삽질 해 TMI 집 열쇠 TMI,20240514
파리 쇼핑 추천 가성비 좋았던 몽마르뜨 옷가게 Jade,파리 명품 쇼핑 여행 중 쇼핑 몽마 르뜨 언덕 길 한번 파리 쇼핑 추천 몽마 르뜨 옷가게 Jade 포스팅 여기 모두 Jade,20240209
프랑스 파리 쇼핑 아페쎄 매장,프랑스 파리 아페쎄 매장 오 려고 계획 다예 곳 사람 쇼핑 프로 사면 바보 정도 세 일 제품 곳,20241006
파리 쇼핑 아울렛 라발레빌리지 추천 쿠폰 공유,파리 쇼핑 아울렛 발레 추천 쿠폰 공유 유영 파리 여행 중 쇼핑 제대로 분들껜 아울렛 정말 추천 저 파리 여행 두 번 처음 관광지,20240512
오간자백 내돈내산 리뷰 국내 구입처 정보 파리 필수 쇼핑템,스뚜핏 마린 몽 타구 브리 짓 카 브리 짓 카파 우치 오 간자 파리 쇼핑 파리 추천 템 파리 또 가야 댐 cm eql 파리 선물 컴퓨터 자수 자수 가방 에펠탑 cm eql,20240924
파리 여행 6일차1 파리 3대 백화점 종류 및 쇼핑 할인팁 ,Galeries Lafayette Le Gourmet 영업 시간 일 파리 쇼핑 파리 명품 쇼핑 파리 백화점 파리 백화점 파리 갤러리 라파예트 갤러리 라파예트 오스만 갤러리 라파예트 갤러리 라파예트 품관 Galeries Lafayette Le Gourmet,20240902
SK스토아 7월 이벤트 레디쇼핑파리 시작 경품 찬스까지,쇼핑 파리 준비 쇼핑 지원 금도 금빛 경품 골드바 이제 곧 아이 방학 시작 여름 휴가 준비 여행 때 물건 사고 그동안 찜 제품,20240722
파리  런던 여행에서 사온 쇼핑 리스트 미술관 굿즈선물 추천,개인 이제 포스팅 끝 파리 쇼핑 파리 선물 런던 선물 런던 굿 파리 굿 파리 과자 파리 세 쇼핑 마사지 기 시 가드 목 베개 에펠탑 xo 에펠탑 술 에펠탑 꼬냑 LU 과자 xo LU,20240418
메종드파리 네이버 쇼핑 라이브에서 만나요,메종드 파리 대해 관심 분 인테리어 소품 대해 메종드 파리 네이버 쇼핑 라이브 오후 라이브 방송 링크 amp 메종드 파리 쇼핑 라이브 amp,20240220
우리아이도 파리지엔느 스타일로 ㅣ파리쇼핑,파리 소식 전달 quot 프랑스 자전거 나라 quot 프랑스 자전거 옷 신발 가방 파우치 등등 쇼핑 현재 봉막쉐 팝업 현장 즉석 quot quot,20240926
파리 쇼핑_아페쎄 아울렛 APC Surplus_매장 방문 후기,파리 아페쎄 일반 매장 APC Surplus 아페쎄 아울렛 매장 파리 시내 아페쎄 이 매장 점 한국인 직원 쇼핑 수 점 APC Surplus 물품 APC APC Surplus APC Surplus APC,20240904
파리 쇼핑 추천 아스티에 드 빌라트 Astier de Vilatte,Astier de Villatte 파리 쇼핑 추천 아스티 드 라트 파리 쇼핑 아이템 추천 아스티 드 오 나먼 정말 가격 기도 파리 뭘 고민 분 쇼핑 Astier de Villatte,20240202
파리 추천 쇼핑템 Sezane 세잔 가을 신상,amp amp 파리 곳곳 매장 근처 번 길 수 평일 오전 세잔 직구 세잔 가디건 파리 쇼핑 리스트 프랑스 추천 브랜드 amp amp,20240825
paris day4 드디어 쇼핑데이 걷고 또 걷고 파리 바게트 맛집 ,본격 쇼핑 한국말 보 cos 원피스 블라우스 바지 등등 옴 텍스리펀 한국 파리 슈프림 파리 쇼핑 내 목적 난 슈프림 나 cos,20240830
파리 쇼핑 5유로 미만 직장 동료를 위한 파리 선물 파리 ,프랑스 과자 파리 쇼핑 파리 슈퍼마켓 쇼핑 파리 슈퍼마켓 선물 파리 선물 파리 슈퍼마켓 기념품 까르푸 AUCHAN 모노 프리 파리 쇼핑 리스트 프랑스 쇼핑 리스트 파리 선물 파리 기념품 파리 투어 AUCHAN,20241014
