title,chunked_description,postdate
챗gpt로 파리에서 출발하는 당일치기 계획짜기,위치 파리 생트 샤펠 근처 예산 경비 경비 이동 때 비용 식사 비용 카페 비용 모두 고려 계산 비교 최대한 합리 여행 목적 취향 스타일 난 쇼핑,20241014
KBPay 퀴즈 10월14일 정답,KBPay 오늘 퀴즈 정답 공개 정답 다음 중 KB Pay 펫 케어 라이트 매월 제공 쇼핑 할인 쿠폰 사용 처가 곳 어디 요 정답 파리 바게뜨 쿠폰 매 KBPay KB Pay,20241014
부에노스아이레스 숙박을 위한 최고의 호텔 추천 BEST 8,남미 파리 매혹 도시 부에노스아이레스 탱고 열정 유럽 건축물 시장 쇼핑 즐 기기 호텔 호텔 최저 가로 바로 예약 수 아래,20241014
2024 남프랑스여행 10년만에 아비뇽 레얄마켓 아비뇽교황청,쇼핑 스트릿 카페 레스토랑 코너 돌때 풍경 를 밤 혼자 자기 산 조명 열흘 잘썻다 다음 날 파리,20241014
kb pay 리브메이트 오늘의 퀴즈 한국사 매일 퀴즈 정답 ,P 다음 중 KB Pay 펫 케어 라이트 매월 제공 쇼핑 할인 쿠폰 사용 처가 곳 어디 일 준법 감시인 심의 필 HMV G 마켓 쿠폰 매 이마트 쿠폰 매 파리 바 P KB Pay HMV G,20241014
78일의 세 번째 유럽여행파리21,익 이름 삼순 식당 보고 픽셀 캐릭터 보고 공사 오페라 보고 피라미드 역 메종 키츠네 파리 아카이브 뭐 쇼핑 한바탕 결제 길거리,20241014
기업공부 토비스  KUVIC리포트 정리,산업 분석 아시아 및 북미 시장 호텔 쇼핑몰 컨벤션 공연장 카지노 융합 복합 리조트 위인 파리 간 명 달함 일본 마찬가지 태국 카지노 산업 성공,20241014
프랑스 파리 겨울 필수 여행 코스 꼭 가봐야 할 명소와 ,프랑스 파리 겨울 여행 낭만 분위기 고급 미식 동시 수 기회 날씨 속 파리 매력 장소 미슐랭 스타 레스토랑 식사 수 기억,20241014
유럽여행 뮌헨 16일차 113117,뮌헨 쇼핑 보고 며 말 한국 하니 손흥민 어쩌구 그 얘기 재형 누나 선물 바이에른 뮌헨 파리 생 제 르망 머플러 때 해도 김민재,20241014
유럽의 상가 부동산과 상가 중개는 어떠할까요  양주 옥정동의 ,대도시 경우 고급 브랜드 숍 부티크 밀집 쇼핑 거리 특징 예 파리 샹젤리제 거리 프라하 바츨라프 광장 거리 럭셔리 브랜드 취급 상가 파리,20241014
제니 로제 픽 Brandy Melville ㅣ 파리 쇼핑,파리 소식 전달 quot 프랑스 자전거 나라 quot 프랑스 자전거 나라 미술관 파리 외방 전 교회 몽생미셸 투어 와인 투어 상품 소개 제니 로제 픽 Brandy quot quot Brandy,20241014
상해 여성 여행객을 위한 맞춤 가이드  상해 여자 도감 쇼핑 ,상해 여성 여행객 위 맞춤 가이드 상해 여자 도감 쇼핑 맛집 데이트 여행 정보 상해 동방 파리 매혹 도시 스카이라인 것 공존 매력 도시 여성,20241014
20246 SpainMadrid 14,파리 차 마지막 파리 아침 신발장 앞 우버 중 바로 줄 취소 쇼핑 잠깐 아가 앞 허세 김 도윤 씨 산 미구엘 시장 과일 안달,20241014
Sep 2024 _ 추석,퇴근 기흥 롯데 아울렛 쇼핑 전 서브웨이 로 배 기흥 롯데 아울렛 무신 사 스탠다드 입점 인스타 파리 사진 추석 당직 대구 엄마 또리 아델 리카르도 뇨끼 스테이크,20241014
주방살림 필수템 키친크로스 김나영행주 숙희 안국 ,슬픔 잠시 전 슬픔 쇼핑 마지막 제품 때 파리 감성 것 그냥 재고 때 쟁 브런치 때 툭,20241014
파리 하루 여행 완벽 가이드 관광 명소 현지 음식 쇼핑 필수 ,이 지역 현 지인 상점 카페 발견 수 쇼핑 파리 일상 더욱 깊이 볼 수 파리 식사 크루아상 바게트 파리 아침 갓 구 운 크루아상,20241014
홍콩 여행기,유럽 랜드마크 그대로 재현 구 용 여기 런던 파리 이탈리아 때 중간 ifc 바샤 커피 쇼핑 아부지 일 커피 때문 이쯤 ifc,20241014
캐시워크 돈버는퀴즈 10월14일 정답,최종 혜택 월간 십 일절 초특 쇼핑 최대 장바구니 할인 베스트 OOO 인기 상품 구경 혜택 쇼핑 요 OOO 단어 OOO OOO,20241014
로레알파리 엑셀랑스 크림 염색제 630호 골드 브라운 ,로레알 파리 엑셀 랑스 크림 염색 제 호 골드 브라운 온라인 쇼핑몰 쿠팡 번가 G 마켓 등 오프라인 마트 롯데 마트 이마트 홈플러스 등 구매 또한 올리브영 왓슨스 롭스 등 G,20241014
유럽 3주 여행 다녀온 여자 1인의 유럽여행 경비 공유 총 ,여행 코스 파리 박 인터라켄 박 뮌헨 박 체 스키 크롬 로프 프라하 박 비엔나 박 부다페스트 쇼핑 제외 쇼핑 안 유럽 언제 면서 좀,20241014
게스트할인카드 파리 디올 쇼핑 루브르박물관 뛸리히 정원 ,파리 날 아침 오늘 쇼핑 파리지앵 아침 역시 빵 당 뿌왱 뒤 빵 파리지앵 빈 가게 우리 가면 뒤 손님 북적 한국,20241014
관평동 KT 직영점 커피 및 다이소 5000원 무료 쿠폰 받는 방법,가성 비 쇼핑 분 기회 커피 쿠폰 다이소 파리바게트 뚜레쥬르 네이버 페이 CU 이중 택 가능 다이소 쿠폰 무료 CU,20241014
여행지 싱가포르 _ 싱가포르,대형 쇼핑몰 백화점 편의 시설 레스토랑 및 상점 곳 당시 한국 생으로 파리 대교구 신부 서품 중국 선교 일단,20241014
노윤서 첫사랑같은 풋풋한 우영미 알파카 크롭니트 가디건 ,이 브랜드 파리 거지 국제 브랜드 중 하나 Wooyoungmi 원산지 대한민국 제작 발매 및 쇼핑 팁 한국 발매 해당 사이트 네이버 Wooyoungmi,20241014
파르코백화점  파리생제르망니들스NEEDLES,난 수 외국인 시부야 국룰 파르코 백화점 사라 꼬셨 앞 쇼핑 위해 일단 패스 오빠 요청 파리생제르망,20241014
지수 인 파리 1,쇼핑몰 스타벅스 실내 도 비둘기 기겁 함 파리 시청 센강 다리 위 런닝하 사람 에밀리 인 파리 그 자체 노트르담 성당 센강 유람선 타고,20241014
파리여행3 파리에서 만난 사람들 여행이 주는 기쁨은 ,이번 여행 저 나라 개 안 나라 개 파리 여행 도시 여행자 오늘 쇼핑 데이 봉막쉐 그녀 자전거 나 버스 이 바로 in 여행 in,20241014
중학생 고등학생 위한 2025년 스위스 겨울 방학 캠프 안내,터보건 쇼핑 스키 스노우보드 저녁 티비 티 화요일 랭기 비즈니스 amp 호스 피 티 아이스 comuhakstar 리츠 파리 호텔 설립 세자르 리츠 소개 httpsblognavercom amp comuhakstar httpsblognavercom,20241014
팬심저격템 이제서야세일 산천어 낚시 준비물과 필수 아이템 ,계곡 피라미 카 파리 피 래미 도깨비 피리 줄 낚시 낚시 카드 채비 바늘 월척 조구 WB 개 세 일 기간 신뢰 수 쇼핑몰 미리 확인 것 질문 필수 아이템 외 다른 추천 장비 WB,20241014
241014_카톡뉴스_스타트업위클리_10월3주차,술 쇼핑 키햐 전통주 라인업 종 입점 체형 별 코디 추천 서비스 베타 런칭 파트 너드 뉴욕 파리 싱가포르 등 곳 지사 개설 구글 딥 마인드 허사 비스 CEO 노벨 화학상 수상 AI 선구자 CEO AI,20241014
중국 상하이 3박4일 여행지 코스 일정 추천 맛집 꿀팁까지,와이탄 거리 관광 쇼핑 음식점 상해 동양 파리 별명 와이탄 아편전쟁 이후 외국 세력 양식,20241014
NE 9년만에 다시 암스테르담,파리 암스테르담 의 비행 전날 잠 거의 못 어서 자고 파리 때 교통 RER 영 문 앞 RER,20241014
에프킬라 모기 스프레이 500ml 구매 가이드 내추럴 후레쉬 ,세계 판매 위 에프킬라 파리 모기 살충제 에어로졸 킨 ml 살충 효과 개 대형 온라인 쇼핑몰 마트 약국 등 접근 가격 또한 편입 니 대개 경우 ml,20241014
241008  241012  초딩들이랑 상해 갔다 온 썰 푼다  상해 ,계속 진자 식 쇼핑 오오오 동방명주 맞은편 인증 사진 감 건물 하나 두 가까이,20241014
라라츄 이거 정말 강추 이지찹 밴드 마스크팩 포어 ,이지 특징 부착 부위 파리 접착 수 이동 중 이 제품 주로 온라인 쇼핑몰 구매 수 할인 행사 진행 그 기회,20241014
Février,파리 가기 전 간장 비빔국수 해 맛 감격 블로그 이 후기 안 research question 시간 참여 안 함 옷 쇼핑 한국 저녁 약속 오샹 research question,20241014
하루 이내로 갈 수 있는 해외 여행지 5가지,빌뉴스 리투아니아 그랜드 성과 거리 환상 도시 발트해 파리 홍콩 문화 대용 광 서양 문화 곳 세계 수준 쇼핑 식사 문화 체험,20241014
파피루스에서 전자책까지,마치 쇼핑 온 듯 권 국가 처럼 한주 대한민국 내 조국 동양 영향 파리 궁정 수도 경제 이탈리아 상업,20241014
Un jour de malheur,Sweet French 사람 내 신발 것 추억 쇼핑 도 연 언니 승연이 비밀 알 정말 하루 내일 파리 가지 Sweet French,20241014
2박 3일 해외여행 패키지 추천 나에게 딱 맞는 여행 찾기 ,예 쇼핑 미식 밤 문화 활동 여행객 라면 홍콩 태국 베트남 등 아시아 유럽 프랑스 파리 이탈리아 로마 스페인 바르셀로나 등 시간 동안 핵심 관광 수,20241014
팔달구 KT인터넷 1년약정 2년 3년 약정,또한 샹젤리제 거리 상점 카페 쇼핑 맛집 탐방 동시 수 파리 여행 가면 기억 순간 세빌리아 광장 스케치 클래스 곳 현지,20241014
늘 배고파요,기로로 무화과 파리 친구 한번 카 쬐그맣 귀엽드 동생 줌 다마고치 겜 똥 것 사과 다이소 쇼핑,20241014
파리 쁘렝땅 백화점 샤넬 카드지갑 클래식 똑딱이 쇼핑 후기 ,파리 쁘렝땅 백화점 샤넬 카드 지갑 클래식 똑 똑 구매 후기 파리 제일 사고 쇼핑 템 중 하나 샤넬 카드 지갑 클래식 똑 똑 한국 파리 구 소문,20241014
5월 떠나기 좋은 해외 여행지 BEST 10  휴양 문화 액티비티 ,세부 가든 쇼핑몰 얄라 쇼핑몰 등 쇼핑 시설 쇼핑 즐 기기 은 파리 프랑스 로맨틱 분위기 문화 체험 파리 사랑 도시 만큼 로맨틱 분위기 문화,20241014
파리 봉마르쉐 백화점 봉막쉐 식품관 마트 쇼핑 리스트,전 저 파리 마트 쇼핑 리스트 르 봉 마르 셰 백화점 파리 봉 마르 쉐 백화점 명품 관 리빙관 식품 관 등 리빙관 구경 한국 가지 식 재료 구입,20241014
파리 아울렛 라발레 빌리지 방문 후기 및 가격버버리 구찌 ,파리 아울렛 발레 방문 후기 또 계획 사람 무슨 물건 아울렛 아주 편 쇼핑 뜻 이상 정도 듯 셔틀 버스,20241014
프랑스여행기5,이제 파리 기차 길 전날 그랜빌역 잠시 정차 아시안 마트 포럼 데알 대형 쇼핑몰 요 길 일수,20241014
1037 숭답성수동 맛집 다반올드문 네컷사진소인수서울 ,오늘 엄마 날 아침 빵 파리바게트 빵 룰루 젤리 느낌 스타 필드 돈돈 놀 수 공간 쇼핑몰 중 가장 가기 매드 포 갈릭 급 칼국수,20241014
우리동네구경 평택 고덕 어반그로브 입점매장,어반그로브몰 저희 동네 유일 아파트 주상 복합 대형 쇼핑몰 예정 대형 매장 자연 과일 전자담배 포토 마임 파리바게트 거의 공사 것 곧 오픈 것,20241014
싱가포르 창이공항 가볼만한곳 싱가포르 쥬얼창이 폭포 분수 ,대규모 쇼핑 공간 실제 출국 입국 관광객 싱가포르 곳 손 꼽는데 애플 스타벅스 나이키 쉑쉑 파리바게트 등 식 음료 시설 쇼핑 시설 복합 입점,20241014
로레알 파리 매직 리터치 75ml 브라운 다크 브라운 색상별 ,로레알 파리 매직 리터 온라인 쇼핑몰 오픈마켓 백화점 드럭스토어 등 판매 처 구매 수 판매 처별 가격 때문 최저 정보 확인 구매 것,20241014
키스 서울 플래그십 스토어 성수동 명물,미국 럭셔리 라이프스타일 브랜드 키스 성수동 쇼핑 필수 코스 키스 서울 총 층 구성 공간 한국 최초 플래그 스토어 영국 런던 프랑스 파리 일본 도쿄 은 키스,20241014
유럽 세미 패키지 여행 2030 유럽여행 일정 루트,때문 꿈 동유럽 여행 스위스 인터라켄 파리 수 맛집 쇼핑 리스트 전부 이대 로만 성공 유럽 여행,20241014
일상_9월_파리 2,홀려 파리 물가 치킨 텐더 각 박스 거의 임 사람 줄 얼른 쇼핑 거의 원샷 쇼핑 메종 키츠네 가디건 사고 메르 시 모자 삼,20241014
모기와 벌레 벌레 퇴치의 명품 스카이원 ,끈끈이 장 증정 스카이 에프 파리 모기 벌레 해충 퇴 치기 유인 업 소용 포충 기 포충 등 스카이 인터넷 쇼핑몰 대형 마트 등 채널 통해 입수 수 자주 이용 판매 처 구매,20241014
인천공항 장기주차장 예약 비용 내돈내산 이용 후기,사실 파리 기간 동안 모든 걸 보기 아쉬움 도시 이번 여행 파리 주요 관광지 쇼핑 먹거리 주 목적 계획 오전 출국 오후 귀국 일정 정도,20241014
20241014 심심해서 쓰는 일상 기록  인데 그냥 먹는 얘기,우리 집 amp 오빠 집 생일 파티 남현 쇼핑 함 이 날 오빠 마시모 띠 가디건 사조 베이글 마켓 컬리 브레드 비건 프로 틴 베이글 파리바게트 번쫄깃 베이글 단백질 amp,20241014
정답  파리바게뜨5천원 제공되는 쇼핑 할인쿠폰 ,KBPay 리브 메이트 오늘 퀴즈 정답 파리 바게뜨 쿠폰 매 다음 중 KB Pay 펫 케어 라이트 매월 제공 쇼핑 할인 쿠폰 사용 처가 곳 어디 요 KBPay KB Pay,20241014
인천공항 장기주차장 예약 방법 및 비용 발렛 후기,덕분 시간 여유 웠 일찍 공항 도착 짐 부 면세점 쇼핑 여유 시간 수 파리 여행 한국 도착 고객 센터 전화 셔틀 타고,20241014
쿠알라룸푸르 여행 튠 호텔 KLIAKLIA2 후기 추천하는 ,호텔 내 쇼핑 수 상점 정원 휴식 취할 파리 객실 내 파리 때문 불편 수 총 평 튠 호텔 KLIA 공항 근처 KLIA,20241014
okay oct,s 고 파리 n 미국 n 이면 게 올리브영 법카 샴푸 쇼핑 온 여자애 세 녹 베스트 향 시 향 경험 not good 이 향 갓 성인 때 시 트러스 s n n not good,20241014
렌터카예약 10월 할인코드 유럽카 허츠 식스트 아비스 11월 ,하와이 파리 바르셀로나 돌 미티 로마 밀라노 오키나와 개인 이동 교통 수단 미국 지역 및 쇼핑 여행 우리 모두 다시 또한 여름 휴가 시즌 미리 가을 단풍 축제 시즌 유럽,20241014
롯데백화점 대규모 아우터 페어로 겨울 대비 쇼핑 트렌드 선도,소비자 쇼핑 열기 더욱 해당 이미지 가상 생 것 실제 부터 소프 움 알레 르망 코지 네스트 엘르 파리 등 인기 침구 브랜드 구스,20241014
11월 영업하는 일요일 안내 구 몽쥬약국 에펠타워 파리15구점,파리 최저 약국 약국 쇼핑 성지 매달 프로모션 할인 행사 팝업 이벤트 바네사 주최 아픔 이웃 나눔 에펠 커머스 약국 달 국경일 일요일 영업,20241014
장줄리앙의 종이세상 전시 관람 후기 ㅣ 퍼블릭가산 전시 ,실제 파리 국가 번호 여기 디테일 색감 어디 사진 여러분 전시회 인생 샷 쇼핑 종이 인간,20241014
10월 T데이 혜택 가보자구,파리 바게뜨 빵 덕후 주목 혜택 당 할인 최대 할인 빵 케이크 컬리 스마트 쇼핑 방법 혜택 이상 구매 시 할인 첫 구매 최근 개월,20241014
갤럭시 Z 플립5 Galaxy AI 브라우징 어시스트 완벽 활용 ,예 quot 파리 여행 계획 quot 검색 때 Galaxy AI 브라우징 어시스트 quot 파리 여행 quot 관련 예 quot 서울 강남 quot 입력 순간 AI quot 서울 강남 맛집 quot quot 서울 강남 카페 quot quot 서울 강남 쇼핑 quot quot Galaxy AI quot quot quot quot AI quot quot quot quot quot,20241014
씨드비 케시워크 10월 14일 정답,온라인 쇼핑몰 닥터 바리스타 앵커 버터 위메프 장바구니 롯데 온 온 앤더 키즈 노티 프 온라인 쇼핑몰 닥터 바리스타 앵커 버터 신 마이카 제휴 사 인증 하티 브 의료기기,20241014
파리 신혼여행 스플렌디드 에뚜알 amp 풀만 파리 타워 에펠 후기,파리 신혼여행 숙소 대표 두 곳 스플렌디드에뚜알 풀 파리 타워 에펠 두 곳 개선문 폭풍 쇼핑 후 다시 호텔 우선 방이 찍 캐리어 개 충분 인테리어,20241014
일상_9월_파리 1,공원 쇼핑 쁘렝땅 라파예트 아침 쯤 거리 면서 어제 산 빵 과자 출발 지하철 거의 첫째 날 모든 즐거움 대학생 때 파리 한번,20241014
롯데온 케시워크 10월 14일 정답,온라인 쇼핑몰 닥터 바리스타 앵커 버터 신 마이카 제휴 사 인증 하티 브 의료기기 쇼핑몰 부업 프롬 바이오 자연 늘 컷슬린 바나바 잎 팬 마음 중복 신 마이카 개인 회원,20241014
2409파리런던 ① 프랑스 파리 쇼핑  백화점,난 걸 보고 정말 이 사람 감탄 쇼핑 광고 최고 길거리 홍보 수단 시작 것 파리 쁘렝땅 백화점 방문,20241014
9월 일기 3편,요기 파리크라상 브런치 카페 샌드위치 잠 픠곤 몸 개 쇼핑 몽벨 완즈 나 얼굴 거 땀 도쿄 왜 백 패킹용,20241014
kbpay 오늘의퀴즈 정답확인하세요 10월 14일,오늘 퀴즈 다음 중 KB Pay 펫 케어 라이트 매월 제공 쇼핑 할인 쿠폰 사용 처가 곳 어디 요 정답 파리 바게뜨 쿠폰 매 kbpay 퀴즈 정답 오늘 퀴즈 포인트 리 퀴즈 포인트 리 KB Pay kbpay,20241014
제공되는 쇼핑 할인쿠폰 1매 파리바게뜨5천원1매,다음 중 KB Pay 펫 케어 라이트 매월 제공 쇼핑 할인 쿠폰 사용 처가 곳 어디 요 G 마켓 쿠폰 매 이마트 쿠폰 매 파리 바게뜨 쿠폰 매 정답 KB Pay G,20241014
블로그 질문 36선 쪼랭ver,파리바게트 무한 빵 정리 빵 포장 알바 친구 시간 내 최애 옷 브랜드 or 쇼핑몰 노멜렛 바온 가장 카페 맛집 소개 진짜 카페 or,20241014
일본 쇼핑리스트 추천음식_ 후쿠사야 카스테라 후기,오늘 만 일본 쇼핑 리스트 추천 글 사실 저번 후쿠오카 쇼핑 리스트 중 뚜레쥬루 파리바게트 카스테라 맛 좀더 맛,20241014
159차 도쿄여행 2일차  늦잠 푹자고 텐노즈아일 강변 산책 ,로손 쇼핑 어제 그 장소 호텔 셔틀버스 탑승 출발 도착 방 먼저 전 비스켓 샌드 먹음 파리 파리 언제 발견 아이 리 광고,20241014
결기여행호치민 4,빵 파리 노보텔 호텔 무 호치민 또 빵 마지막 기념품 쇼핑 전날 뱅기 지연 카톡 갓 당일,20241014
10월14일 KB Pay KB페이 오늘의 퀴즈,KBPAY 퀴즈 KB 페이 퀴즈 KBPAY 퀴즈 정답 KB 페이 퀴즈 정답 리브 메이트 KBPAY 오늘 퀴즈 정답 리브 메이트 오늘 퀴즈 정답 KB 페이 오늘 퀴즈 정답 KBPAY 펫 케어 라이트 쇼핑 할인 쿠폰 G 마켓 이마트 파리 바게뜨 KBPAY KB KBPAY KB KBPAY KB KBPAY G,20241014
닌자고 아동용 71822 근원의 모션 드래곤 레고 혼합색상 세일 ,웹쇼핑 강화 급 색상 화이트 화면 보기 가지 윈도우 pc 레고 파리 노트르담 혼합 색상 개 디테 조립 난이도 전 시 용 pc,20241014
5월 아이와 함께 떠나는 해외 여행지 추천,파리 에펠탑 도시 전경 미술관 유명 작품 탐험 디즈니랜드 파리 수 공예품 쇼핑 미국 뉴멕시코 주 산타페 부에블 인디언 문화 스페인 식민지 건축,20241014
보부상은 아닙니다 그런데 보부상 가방 쇼핑하기,여섯 발자국 Mon Fashion Journey 사진 출처 라이즈 앤톤 이번 블로그 주제 제 쇼핑 COS 커브 드 레더 가방 라코스테 백 팩 스컬 프터 데님 더 백 각종 에코 백 파리 산 브랜드 Mon Fashion Journey COS,20241014
제공 되는 쇼핑 할인쿠폰 사용처가 아닌 곳은 어디일 까요 ,문제 다음 중 KB Pay 펫 케어 라이트 매월 제공 쇼핑 할인 쿠폰 사용 처가 곳 어디 일 정답 아래 정답 파리 바게뜨 쿠폰 매 kbpay kbpay 퀴즈 kbpay 퀴즈 정답 KB Pay kbpay kbpay kbpay,20241014
다음 중 KB Pay 펫케어 라이트에서 매월 제공되는 쇼핑 ,다음 중 KB Pay 펫 케어 라이트 매월 제공 쇼핑 할인 쿠폰 사용 처가 곳 어디 요 준법 감시인 심의 필 HMV G 마켓 쿠폰 매 이마트 쿠폰 매 파리 바게뜨 KB Pay HMV G,20241014
합천글램핑추천 황매산글램핑 별보다글램핑B3호,완 쇼핑 첫 경험 무척 민서 하리보 젤리 벌레 저 분 생각 동안 파리 모기 날씨 선선,20241014
앱테크 어플 추천  아무것도 안 해도 되는 캐시런 ,쇼핑 부분 편의점 카페 베이커리 상품권 부분 사용 수 편의점 경우 CU GS 카페 및 베이커리 경우 이디야 커피 파리 바게뜨 해 피콘 던킨 배스킨라빈스 등 나 CU GS,20241014
KB pay 오늘의 퀴즈 2024년 10월 14일 문제 및 정답,제 쇼핑 할인 쿠폰 사용자 곳 어디 요 KB pay 오늘 퀴즈 문제 및 정답 quot 정답 파리 바게뜨 처누 쿠폰 매 KB pay 오늘 퀴즈 문제 및 KB pay quot KB pay,20241014
쇼핑은 즐거워,엄마 쇼핑 깅 원래 파리 샤넬 플랫슈즈 선물 사이즈 안 디쟌 맘 안 교환 환불 안 그냥 신세계 미리 사드 리기 이유,20241014
레모니 신혼여행 레모니 파리에 가다 시즌2,지옥 월요일 위해 프랑스 파리 사진 저 레모 입 그냥 디저트 오빠 백화점 쇼핑 열정 쇼핑 사진,20241014
10월 14일 리브 KBPAY 케이비페이 오늘의 퀴즈 정답,제공 쇼핑 할인 쿠폰 사용 처가 곳 어디 요 G 마켓 쿠폰 매 이마트 쿠폰 매 파리 바게뜨 쿠폰 매 정답 파리 바게뜨 쿠폰 매 꼭 확인 오늘 퀴즈 G,20241014
퇴사 후 환승이직 30대 어렵다 그리고 혜옹이의 일상들,쇼핑 뱅기 파리지앵 마냥 의 휴가 여자 혼자 파리 진짜 긴장감 시 작 햇 무사 귀환 매일 걱정 잠도 저희 엄마 매일 길마,20241014
밤이 아름다운 부여 시리즈 냠냠후기,카카오 톡 쇼핑 메세지 중 단연 눈 바로 밤 부여 시리즈 이번 겨울 친구 결혼식 파리 그때 이 과자 소개 예정 모두,20241014
프리미엄 삼성 비스포크 냉장고 RF91DB98J1AP01 코타화이트 ,온라인 쇼핑몰 쿠폰 프로모션 또한 마무리 결론 삼성 비 스포크 냉장고 RF DB J AP 코타 화이트 모델 그 자체 도쿄 고급 레스토랑 파리 유명 카페 RF DB J AP,20241014
제공되는 쇼핑 할인쿠폰 사용처가 아닌 곳은 ,준법 감시인 심의 필 HMV 다음 중 KB Pay 펫 케어 라이트 매월 제공 쇼핑 할인 쿠폰 사용 처가 곳 어디 요 준법 감시인 심의 필 HMV 케이 비 페이 오늘 퀴즈 정답 파리 바 HMV KB Pay HMV,20241014
아울렛73 쟈딕아울렛 Robe Raya 강추 하늘하늘 너무 예뻐요,말 초 파리 한국 배송 예정 배송 기간 참고 주의 사항 각 매장 이월 상품 상태 안 수 구멍 일부 오염,20241014
천년지기낚시대 당신의 낚시 파트너를 찾아보세요  낚시대 ,플라이 낚시 플라이 낚시 인공 파리 fly 루어 이용 낚시 낚시 낚시 낚시 용품 점 온라인 쇼핑몰 구입 수 직접 낚시 용품 점 방문 실제 fly,20241014
메종 키츠네 더블 적립 안내,Maison Kitsune 파리 질다 로 마사 쿠로 키 설립 메종 키츠네 패션 하우스 쇼핑 중 내용 방문 전화 쇼핑 도움 Maison Kitsune,20241014
전원실적 없는 체크카드 추천  케이뱅크 MY 체크카드 300원 ,맘스 터치 파리 바게뜨 뚜레주르 던킨도너츠 이삭 토스트 베스킨라빈스 설빙 지그재그 할인점 쇼핑몰 공항 철도 역사 푸드 코드 등 입점 임대 매정 경우 캐시 대상 제외 수,20241014
10월 14일 홈쇼핑 의류 실시간 인기 방송 상품 리뷰,최대 할인 가격 원 백화점 판매 동일 FW 에꼴드 파리 리츠 블라우스 종 쇼핑 티 방송 원래 가격 할인 가격 할인 율 농협 추가 할인 FW,20241014
롯데백화점 아우터 페어 와 롯데아울렛 다코페,엘르 파리 등 인기 침구 브랜드 구스 소재 침구 할인 가격 판매 아울렛 쇼핑 리뷰 콘텐츠 유명 세 유투 버 협업 특 상품 단독 할인 판매,20241014
여행 싱가포르 음식디저트 순위,디저트 류 음식점 메인 메뉴 남자친구 나 파리 바게뜨 아메리카노 쉑쉑 버거 콜드 브루 바닐라 쉐이크 마리나 베이 쇼핑몰 쪽 길 발견 자판기 임 시원 새 콤 달달 나 위로,20241014
2024 파리 여행 넷째 날 팔레 루아얄 정원 라파예트 ,파리 선물 사 가야 미리 생각 가족 프랑스 트러플 오일 트러플 소금 오랑 주리 미술관 예 약 시간 인터 쇼핑,20241014
KB Pay 리브메이트 오늘의 퀴즈 정답은10월 14일 월요일,제공 쇼핑 할인 쿠폰 사용 처가 곳 어디 요 G 마켓 쿠폰 매 이마트 쿠폰 매 파리 바게뜨 쿠폰 매 정답 무엇 요 파리 바게뜨 쿠폰 매 오늘 G,20241014
리브메이트 정답 오늘의 퀴즈 10월 14일,다음 중 KB Pay 펫 케어 라이트 매월 제공 쇼핑 할인 쿠폰 사용 처가 곳 어디 요 준법 감시인 심의 필 HMV G 마켓 쿠폰 매 이마트 쿠폰 매 파리 바게뜨 KB Pay HMV G,20241014
5랜만,영어 땡큐 옆 파리바게트 샐러드 존맛 임 보 세영 오늘 주영 생일 파티 양말 쇼핑 함 커피 오늘 사촌언니 사촌언니 친언니 오빠,20241014
