title,chunked_description,postdate
 아일이네 제주여행2  ,기념품 쇼핑 테마 파크 온 기분 김 일 갱 풍선 머리띠 풍선 마음 샌드 바로 옆 파리바게트 박스 캐 집 간다 헤드폰,20241013
나야 셔츠민경,자취 생 집 멜론 처음 봣어 선물 그릇 보고 감동 배 무슨 쓰레기 파리 공부 백 팩 공부 진짜 하나 안 수다 쇼핑 주 구 장창 하루,20241013
월요일 미친거 또 왔네,파 리뷰 쇼핑 샷 모르모트 미니 쉘 느낌 안 초코 여요 두바이 초콜릿 사진 임 모양 미니 쉘 추억 열변 토 친구,20241013
밀라노 여행 밀라노 1박 2일 여행일정_워킹투어 판제로띠 ,바로 앞 마트 누텔라 비스켓 후 존맛이쥬 초코 가득 이탈리아 쇼핑 리 밀라노 사실 보고 것 밀라노 대성당 파리 다른 도시 성당,20241013
 이탈리아 08 피렌체 오스테리아 파스텔라 20230930,쇼핑 평일 미리 미리 하자 오전 쇼핑 타임 무려 달 전 예약 파리 것 이태리 것 스페인 산일 확률 고장 납 복은 증맬루 최고,20241013
paris paris paris,오늘 쇼핑 잔뜩 집 귀가 집 항상 안 다시 집감 사실 파리 저녁 진짜 혼자 저녁 체력 이슈 반나절,20241013
2024년 10월 14일 홈쇼핑 방송 편성표,쇼핑 티 백화점 판매 동일 FW 에꼴드 파리 리츠 블라우스 종 신세계 홈쇼핑 삼성 카드 할인 FW 신상 블루 핏 NEW 후드 니트 풀 오버 종 FW FW NEW,20241013
날벌레 포집망 한빛 포충기부터 플라이포커스까지   포충기 ,구매 파리 포 집기 트랩 포집망 벌레 퇴치 축 사용 해충 포충 기 걸이 그물 망통 포충 온라인 쇼핑몰 대형 마트 철물 점 등 구매 수 제품 종류 가격 브랜드 AS 등 AS,20241013
프랑스 파리 하루 투어 쇼핑 휴식 에펠탑,에펠탑 튈르리 공원 파리 쇼핑 메르 롤레 르 로 비비 구찌 본격 튈르리 공원 휴식 튈르리 공원 쇼핑 거리 바로 도보 거리 튈르리 공원 파리 아마 가장,20241013
9월을 지나 10월 중순이구나비스터아울렛 가격정보,파리 런던 여행 마치 둘 잠시 노팅엄 노팅엄 스시 sushiyoka 한식 집 디그 리 카페 둘둘 도 다시 가구 집 거 더 쇼핑 sushiyoka,20241013
브라우니쿠키세트와 마드레느대 선물용 쇼핑백 증정 신라명과 ,마드레느대 선물 용 쇼핑 백의 마드레느대 파리 패스트리 그 이름 우리 향수 감정 이 디저트 겉 바삭 속 입,20241013
스페셜 포토덤프 시즌2 태국 파타야 터미널21 농눅빌리지,파리 온 듯 느낌 에펠탑 이태리 피사 탑 시간 구경 아이쇼핑 아이스크림 마카롱 재미 솔솔 파타야 랜드마크 농눅빌리 농눅빌리,20241013
프랑스 파리 여행 코스 3박4일 계획표 공유 꿀팁과 기념품 소개,파리 박 일정 공유 봄 파리 여행 총 정리 일기 등장 말 방문 파리 여행 포스팅 기념품 쇼핑 일정 때문 혹시 짐 숙소 짐 다음 일정,20241013
책방 운영 분투기 85 노벨문학상 수상을 진심으로 ,기분 쇼핑 기분 요즘 시간 헤 이방인 파리 장소 소진 시도 아빠 나 기적 모순 셀마 비,20241013
1071013 대림동여름옷정리산책여행준비,점심 실컷 산책길 요 거 이름 뭐더 파리 똥 보리수 적 엄마 우리 통째 그냥 입 오버 카톡 쇼핑 개 행사 미리 삼 유통 기한 엊그제 못,20241013
lt미국 서부 패키지여행 15gt 샌프란시스코 시내 오전 관광 ,쇼핑 샌프란시스코 시내 도보 여행 출발 지로 곳 광장 비둘기 세상 파리 셰익스피어 앤드 컴퍼니 만큼 시티 라이트 서점 중반 샌프란시스코,20241013
10월 2주 대학생 지출기록 생활비 절약 챌린저스 라이프집 ,카카오 쇼핑 첫 구매 할인 쿠폰 사용 마늘 주문 디자인 밀 풀무원 파리바게트 빵 한번 더 빙수 시킴 오늘 것 펀블 나무 cu 천원 cu,20241013
낭테르 프랑스 파리 근교 도시 소개  낭테르 파리 근교 여행 ,파리 보석 낭테르 프랑스 파리 근교 도시 소개 낭테르 파리 매력 파리 로맨스 낭테르 쇼핑 만 곳 어디 답변 낭테르 쇼핑몰 상점 쇼핑,20241013
사는 얘기  크리스타세야 유겐 맨틀 꼼데가르송,당분간 코트 쇼핑 아예 듯 크리스타 JM 웨스 통과 듯 유겐 Heugn 의 꼼데 가르송 셔츠 포에버 셔츠 프랑스 도쿄 파리 열망 레이 JM Heugn,20241013
Day18  요르단 vs 한국 월드컵예선 직관하기,압달 리 몰이 쇼핑몰 내 줄 이어폰 사고 점심 해결 함 httpsmapsappgoogl 납작 복숭아 달달 담 꼭 파리 신라면 최고 httpsmapsappgoogl,20241013
1년 전 오늘의 파리,길 라파예트 란셀 보기 라파예트 쇼핑 전망 우린 샹젤리제 거 패쓰 점원 한국어 인사 아이스 아메리카노 파리 디즈니랜드 파리,20241013
온천장역 KT LG SK브로드밴드 인터넷 TV,쇼핑 거리 등 관광지 골목길 속 현 지인 레스토랑 가게 발견 더욱 도시 매력 방문 장소 프랑스 파리 습,20241013
영국 런던 여행 경비 4박 5일 일정 유럽 여행 예산 총정리,인 파리 아웃 아시아나 직항 이용 인 예약 항공권 기념품 쇼핑 사용 소호 옷 쇼핑 유럽 여행 예산 총 정리 개인 기념품,20241013
헝가리 2 부다페스트 2  10번 선착장 유람선 국회의사당 ,양심 지하철 부다페스트 편 오 띠 파리 반성 아키라 네오 도쿄 스타일 부다페스트 쇼핑 x 아이쇼핑 코스 균일 코너 사냥 감 발견 김지 김지 것 x,20241013
론리플레이스투다이 어디서 무엇을 해야 할까요  혼자 여행 ,유럽 파리 로맨틱 분위기 예술 도시 파리 혼자 여행객 낭만 추억 사원 시장 쇼핑몰 등 태국 문화 경험 가격 태국 음식,20241013
이동하고 쇼핑하고 맛집가고  시타딘레알파리호텔 ,파리 여행 최대 장점 포토 스팟 성 일단 입 떡 쇼핑 하서 의 리스트 눈 사 것 둘,20241013
1883 바닐라 시럽과 루틴 바닐라향의 모든 것 250ml 1L 2L ,먼저 서울 강남구 위치 카페 드 파리 바닐라 시럽 활용 커피 메뉴 인기 바닐라 시럽 온라인 쇼핑몰 일부 오프라인 매장 구매 수 대형 마트 커피,20241013
서유럽 여행기 7편 feat파리 귀국,파리올림픽 홍보 처음 택스리펀 신청 출국 거의 자동화 스무 스 처리 귀국 후 달이 모두 마지막 쇼핑,20241013
서촌 가볼 만한 곳 서점 및 편집샵  ofr 서울,서울 파리 마레 지구 본사 한국 지사 개념 소품 층 주택 개조 촌 방문 예정 시 소품 쇼핑 지금,20241013
일본 도쿄 커플 여행 코스 갈만한곳 핫플 명소 추천 BEST 8,쇼핑 거리 이자 미식 가의 천국 로맨틱 분위기 세계 레스토랑 명소 파리 마을 그림 분위기 은밀 비스트 로 로맨틱 저녁 에비스,20241013
징징거림 근데 일상을 곁들인,승 쇼핑 자라 코디 누구 생각 못 상황 마무리 준비 나 목표 뒤 파리 곡 응원 쇼,20241013
동유럽발칸 여행 6,옵션 선택 안 우리 어제 못 슈테판 대성당 보고 dm 발레 림밤 쇼핑 오늘 하이라이트 다뉴브강 유람선 타고 국회의사당 것 파리 에펠탑 야경 dm,20241013
0916  0922,사랑 파리 페이지 안 책 그냥 다현 쇼핑 메가박스 특전 열루 옴 팝콘 영화 후기 무언가,20241013
디올 레이디백 스몰 정품 가품 차이점,작년 파리 여행 때 기념 산 명품 가방 사 온 명품 가방 나름 스몰 사이즈 가지 분 추천 가지 분 참고 쇼핑 참고,20241013
디즈니 크루즈 여행 완벽 가이드 코스 추천부터 예약까지 ,로마 콜로세움 파리 에펠탑 런던 빅벤 등 유럽 명소 직접 보고 그 역사 속 시간 또한 종류 레스토랑 음식 수 쇼핑 수 디즈니 크루즈,20241013
민정이의 호평 페니체 여행용 캐리어 잠금 스트랩 및 가죽 ,페니 체 여행 용 도시 별 도쿄 뉴욕 서울 파리 베를린 캐리어 스트랩 벨트 브랜드 제품 특성 수 소비자 직접 상점 온라인 쇼핑몰 통해 비교 후,20241013
아스트로 ASTRO 정규 3집 Drive to the Starry Road 버전 ,디스 이즈 파리 THIS IS PARIS 김민준 박영희 윤유림 임 현승 정희 태 온라인 쇼핑몰 및 팬 사이트 예약 구매 진행 한정판 버전 확률 커뮤니티 내 THIS IS PARIS,20241013
비오는 날에도 즐거운 데이트 서울 비오는 날 가볼 만한 곳 ,카페 드 파리 프랑스 감성 카페 낭만 분위기 선사 디저트 쇼핑 힐링 동시 백화점 amp 쇼핑몰 비 날 실내 쇼핑 서울 대표 amp,20241013
2020 롤랑가로스와 윔블던을 위한 위너 윌슨 테니스 가방 완벽 ,프랑스 파리 롤랑 로스 영국 런던 윔블던 테니스 팬 가장 주요 스포츠 용품 매장 온라인 쇼핑몰 구매 수 롤랑 로스 윔블던,20241013
파리 3일차,아침 일찍 일어나서 화장실 아침 파리 라이프 미라클 모닝 여행 힘 바 아침 힘 날 나름 쇼핑 데이 수만 언니 마레 지구 가요,20241013
ヱビスビール,메이지 파리 만국박람회 출품 개국 중 금 수상 메이지 판매 호조 마차 배송 감당 수 화물역 메이지 세인트루이스,20241013
한글 하루만에 다 만든거 아니잔아ㅜ,역시 쇼핑 저녁 한글날 기념 소주 감 차 법 아시 분 날 해장 파리올림픽 기념 티켓 접 실망 일요일 슬라슬,20241013
일본 도쿄 여행  202410,걸 직접 구매 쇼핑 거 구경 첫째 날 끝 노숙 완전 진심 사방 에노덴 캐릭터 프린트 코팅 다음 정성 귀 여우 심 살짝 파리,20241013
10박 12일 4개국 서유럽여행ㅡ5일차파리 루브르 박물관,백화점 쇼핑 내부 인상 리옹 역 쯤 스위스 바젤 리옹 역 길 파리 시청 오늘 무슨 행사 인파 퐁네프 다리 멀리,20241013
겨울 파리스페인 여행 일정,파리 스페인 헬싱키 여행 일정 차 일요일 파리 도착 및 시내 계산 예 상치 못 지출 쇼핑 비용 포함,20241013
로레알파리 엑셀랑스 블리치 슈프림 셀프 탈색제 용량별 ,로레알 파리 엑셀 랑스 블리치 슈프림 셀프 탈색 제 할인 정보 로레알 파리 엑셀 랑스 블리치 슈프림 셀프 탈색 제 할인 행사 통해 구매 수 할인 정보 온라인 쇼핑몰,20241013
2024 미국 서부 여행  LA 2,KM LA 동네 가끔 스레기들 마주 똥파리 이번 미국 여행 쇼핑 계획 터 이동 저 분수 앞 KM LA,20241013
일산호수공원 불꽃축제 불꽃놀이 포토덤프 소소한 일상,곧 출발 프랑스 파리 여행 대비 샤오미 스마트워치 구입 기 종이 뭘 네이버 쇼핑 구입 샤오미 밴드 가격 포인트 혜택 무려 이나,20241013
비자 없이 떠나자 6월 7월 여름 휴가 딱 맞는 해외 여행지 ,유럽 역사 문화 살 숨 곳 프랑스 낭만 도시 파리 지중해 연안 와인 쇼핑 음식 엔터테인먼트 등 거리 곳 가든 스 바이 더 베이 마리나 베이,20241013
프랑스 여행파리 베르사유 궁전 짐 맡기는 곳,프랑스 파리 여행 베르사유 궁전 생각 듭 베르사유 짐 곳 위치 제 사진 첨부 Chateau de Verssailles 쇼핑몰 안 때 조금 헤멜 수 Chateau de Verssailles,20241013
 86_파리 4일차,새 거 하나 사려 옴 거 둘 중 골랏어 엄마 제일 무난 거 거 하나 사고 진짜 기 쫙 빨림 점원 분 완전 그냥 쇼핑 적성 안 거,20241013
유칼립투스 나무의 매력적인 효능과 활용법  천연 오일 건강 ,게다가 유칼립투스 오일 모기 파리 등 해충 효과 자연 친 적 해충 방제 약국 건강 식품 전문점 화장품 매장 등 판매 온라인 쇼핑몰 종류 유칼립투스,20241013
아넬형 안경 스타일과 기능 모든 것을 만족시키는 선택 ,Montague 몽테뉴 프랑스 파리 탄생 안경 브랜드 프랑스 특유 빈티 넬 안경 매력 선택 수 온라인 쇼핑몰 중고 거래 플랫폼 합리 Montague,20241013
예비부부의 로스앤젤레스 칸쿤 신혼여행 숙소 항공권,저희 예비 부부 선택 신혼여행 바로 미국 칸쿤 LA 로스앤젤레스 칸쿤 휴양 쇼핑 둘 고민 고민 끝 LA 칸쿤 가기 사실 맨 처음 스위스 파리 거의 확정 LA LA,20241013
파리 루브르 아트쇼핑,파리 루브르 아트 쇼핑 전시 기간 금 일 전시 장소 루브르 박물관 내 까루젤관 부스 NO B 자미 갤러리 로 루브르 아트 쇼핑 작품 출품 말 그 이름 NO B,20241013
파리 맛집 파리 맛집 추천  Brasserie Lutetia  봉막쉐 ,위치 Brasserie Lutetia Hotel Lutetia 안 위치 레스토랑 이구 르 봉막쉐 백화점 에르메스 세브르 점 바로 옆 쇼핑 바로 식사 보통 파리 레스토랑 오픈 Brasserie Lutetia Hotel Lutetia,20241013
3월 봄맞이 해외여행지 BEST 10 따스한 햇살과 설렘 가득한 ,파리 에펠탑 배경 낭만 사진 수 루브르 박물관 몽마 르뜨 언덕 등 도쿄 현대 도시 전통 문화 동시 수 오사카 음식 쇼핑,20241013
ELLE PARIS 링클프리 루즈핏 롱 윈드점퍼 신뢰도 높은 ,엘르 파리 링클 프리 루즈 핏 롱 윈드 점퍼 거 진짜 레전드 템 자칭 패 절대 가격 바람막이 사서 기분 쇼핑 막 입,20241013
일상 10월 2주 직장인일상블로그 빈둥빈둥 레전드,응원 융 gtlt 차로 마녀 주방 뿌시 웬일 막내 호랑이 샘 사진 함 파리 출퇴근 용 입 맨 투맨 개 후드 개 니트 개 치마 개 바지 개 쇼핑 내 월급 gtlt,20241013
연경이의 명품 같은 퀄리티 사각코 롱부츠 정보 N  리얼소가죽 ,N 파리 감성 세 바스 롱 부츠 리얼 소 가죽 오늘 핫딜 Best 최대 착용 감 중요성 쇼핑 우리 적지 시간 신발 소비 패션 N Best,20241013
부동산 커뮤니티에 들어가서 공부하면 돈 못버는 이유,공인 중개사 파리 땐 사람 명 잠재 고객 이기 때문 노력 개무시 것 저 뉴스 기사 속 매물 백화점 아이쇼핑 듯,20241013
런던 외곽으로 가보다  런던의 또다른 면모,파리 클래스 프라이 빗 런던 외곽 투어 진행 정말 돈 산 먼저 비스터 내 상황 쇼핑 개 마을 가게 신 Bibury 동네 정말 Bibury,20241013
온갖 일기들,책 파리 파리 곳 퐁피두 센터 미술관 프랑스 여의도 쇼핑 or 편집증 흔적 아리 상 연락 or,20241013
솔솔솔코 스위스 여행 Day4,오늘 Tgv 를 타고 파리 스위스 바젤 날 아침 기차 쯤 두번째 쇼핑 센터 빅토리녹스 맥가이버칼 과도 시계 설명 잠깐 엄마 과도 왕창 삼 칼 Tgv,20241013
아직도 더운 10월이랍니다,파리 오사카 고민 중 파리 행 특 기 너므 잠깐 쇼핑 중 진짜 주말 스타 필드 가면 남편,20241013
제주 동화마을 미스터 밀크 송당 아이스크림,앞 파리 바게뜨 여기 매장 제주 송당 동화 마을 진짜 안 곳 제주 여행 때 필수 코스 힐링 산책 맛 아이스크림 쇼핑 잔뜩,20241013
파리 오페라 가르니에 예약 프랑스 여행 가볼만한곳,파리 여행 쇼핑 수 구 위 방문 정말 샤를 드골 공항 루아 시 버스 탑승 도 짐 출국 일 입국 일 것,20241013
2024년 수입금지 생과실류 특별검역 실시 불법 반입 차단을 ,온라인 쇼핑몰 통한 불법 유통 감시 활동 계획 명예 물감 시원 협력 과실 파리 등 병 해충 국내 과수 산업 피해 줄 수 생 과실 등 금지 절대,20241013
소민이의 흔치않은 제품택제작 소시민 시리즈 세트와 박용택의 ,파리 마카롱 수수께끼 오늘 핫딜 Best 별 점 총 점 온라인 쇼핑몰 옵션 할인 혜택 제공 상품 수 Best,20241013
 프렌치 시크 바쉬BAampSH 재입고 트위드 자켓 결혼식 ,최근 파리 여 행시 현지 쇼핑 필수 아시 분 더 선호 브랜드 저 트 위드 자켓 생명 소재 감 바쉬 트 위드 자켓,20241013
가까운 곳에서 즐기는 78월 해외 여행지 순위,바르셀로나 가우디 건축 쇼핑 해변 병 매력 파리 로맨스 패션 역사 깃 암스테르담 운하 박물관 자전거 문화 런던 역사 예술 문화 채,20241013
Day 2167camp5 쿠알라룸푸르 클라이밍 원데이클래스,샤워실 물 샤워 환복 아빠 모름 옛날 쇼핑몰 이어도 벼 오 금고 웅장 스 파리바게트 살몬 샌드위치 딸기 소프트,20241013
고양이들과 봄방학,쇼핑 피트 눈썹 라미 네이션 아주 사람 뚜비 파리 털 꼬미 만 수학,20241013
짧은 해외 여행을 위한 5가지 매력적인 목적지,유럽 매력 매력 파리 런던 유럽 매력 매력 파리 런던 서울 한국 활기 대도시 서울 고 전적 궁전 사찰 세계 수준 음식 쇼핑,20241013
포스코미술관 Popping 살아있는 책들 센터필드역삼 부산여행 ,센터 필드 웨스트 Wine amp More 도 쇼핑 곳 랍 방 베이커리 센터 필드 점 승무원 시절 런던 파리 뉴욕 Pop up 페이지 타임머신 타고 그때 그 Wine amp More Pop up,20241013
파리 퇴치 세영이의 초강력 끈끈이 트랩 6종 세트 활용법  파리 ,온라인 쇼핑몰 대형 마트 구매 수 여러 판매 처가 가격 비교 후 선택 또한 곳 묶음 구매 할인 혜택 제공 참고 파리 퇴치,20241013
프랑스 파리 신혼여행 일정 코스 가볼만한곳 명소 추천 BEST 10,파리 상징 이자 사랑 상징 랜드마크 Eiffel Tower 샹젤리제 쇼핑 식당 카페 명품 거리 패션 움 천국 샹젤리제 거리 탐험 패션 움 Eiffel Tower,20241013
10월 2주,만 파리바게트 치즈케이크 먹음 한글날 칭구 집들이 이틀 연속 치즈케이크 이 글 순간 깨달음 코스트코 빵 쇼핑 네 카페,20241013
파리 여행 코스 추천 3박 4일 완벽 가이드  프랑스 파리 여행 ,오후 쇼핑 천국 샹젤리제 거리 쇼핑 파리 분위기 만끽 명품 브랜드 매장 상점 쇼핑 객 발길 또한 샹젤리제 거리,20241013
유럽 여름 휴가 놓치지 말아야 할 베스트 3 여행지  유럽 여행 ,유럽 여행 대표 여행지 런던 웅장 성곽 박물관 쇼핑 등 볼거리 거리 도시 파리 니스 등 여행객 스페인 바르셀로나 마드리드 등 활기,20241013
여행도 하고 맛집도 즐기고 세상은 너무 넓어,내 리스트 중 하나 프랑스 파리 가기 전 상상 해도 에펠탑 앞 사진 하라주쿠 카페 찾기 시부야 쇼핑 마지막 스시 하루 마무리,20241013
 부산 이승기 특집 ,부산 쇼핑 떼샷 타 낫 택배 타 낫 매 장웅 니 파리 뒤 사람 나 입 집중 꽃,20241013
프랑스 신혼여행 2년만에 다시 방문한 오페라극장 ,듀잉 만 신혼여행 쇼핑 이야기 관광 이야기 가지 거렸어 전 방문 때 테라스 수 저희 방문 파리올림픽 전,20241013
미국여행크루즈카탈리나 amp 엔세나다 멕시코 기항지 투어,탐험 쇼핑 스포츠 액 티비 티 골프 투어 승마 스노클링 등 액 티비 티 포함 파인애플 스낵 판매 숍들 주변 음료 쓰레기 파리 환경,20241013
2493 프라하에서 자유롭게,그 문 트 프로이트 의 작품 잠시 보고 파츠 제스카 거리 프라하 명품 쇼핑 에르메스 샤넬 구찌 시간 유람선 못 탈 뻔 저 파란색 코인 스파클링 와인 교환 파리,20241013
놀기만하는 영국 어학연수 일상,펌킨 스파이스 라떼 크라운 어쩌곤데 이름 기억 안 날씨 급 쇼디치 쇼핑 가방 무거워 염 아하 칼 하트 리폼 가방 하나 겟햇 Paulo 파리 Paulo,20241013
영국 런던 피쉬앤칩스 맛집 런던 소호거리 현지인 추천 ,런던 파리 여행 중 가게 글 해 그 식당 중 소호 거리 쇼핑 마치 동선 위치 방문 마침 점심시간 웨이 팅,20241013
말레이시아 쿠알라룸푸르 경유 당일치기 여행,오 자마자 이마트 이제 일 스토어 줌 도대체 무 어란 말임 파리바게트 쇼핑몰 내부 중국 쇼핑몰 혼란 쿠알라룸푸르 서호주 자랑 돔 카페,20241013
2024 런닝화 계급도 정리zip 입문용부터 전문가용까지,러닝 쇼핑 참고 구매 거 바로 아디다스 아디 제로 아디오스 프로 아식스 메타 스피드 스카이 파리 코 엔돌핀 프로 세 가지 모델,20241013
유럽에서 배낭여행자를 위한 저렴한 호스텔 추천,음식 문화 쇼핑 또한 수 즐거움 런던 대중교통 발달 예 런던 The Generator London 파리 The People Hostel Paris 바르셀로나 The Hostel One Barcelona 등 The Generator London The People Hostel Paris The Hostel One Barcelona,20241013
백문백답,노래 듣기 멍 인터넷 쇼핑 현재 내 이상형 언제 이상형 일 뿐 내 분 얼굴 해외 영국 런던 프랑스 파리 일본 도쿄 후쿠오카 오사카 홍콩 마카오 꾸밈 단계 단계 안경,20241013
친구랑 다녀온 제주도 여행 후기 3박 4일 코스 호텔스닷컴 ,다음 파리바게트 제주 볼 수 빵 근처 국내 최대 문 시장 쇼핑 디저트 시내 여러 기념품 가게 선물,20241013
9월 일기,엄마 쇼핑 해도 아기 원래 뭔가 거 남편 다시 드라마 파리 연인 남편 절친 준 결혼식 축가 사랑 요,20241013
벨바채니 가을날의 기록,채원 너 쇼핑몰 말 정말 저 제 스타일 독보 게 지금 네 앞 종종 청담동 카페 드 파리 우리 루비 요 맘때 서울,20241013
가계순저축률 현명하게 미래를 준비하는 방법,외식 쇼핑 변동 지출 자신 얼마나 절약 수 대한 성찰 나 나 역시 파리 여행 위 저축 그 과정 긍정 경험 내 삶 영향,20241013
아고다 마스터카드 할인 25 쿠폰 할인코드 총정리,최근 숙박 예약 사이트 아고다 agoda 프랑스 파리 숙소 예약 요즘 또한 쁘렝땅 백화점 라파예트 백화점 도보 수 쇼핑 최적 장소 호텔 agoda,20241013
여성을 위한 프리미엄급 파리게이츠 토트백 선택 가이드  파리 ,골프장 용품 수납 수 일상 쇼핑 여행 용 활용 매우 상황 스타일리시 사용 수 백 질문 파리 게이츠 토트 관리,20241013
우리 가족 유럽여행기 2편파리,남편 워낙 커피 감성 파라 한국 프랑스 파리 브런치 브런치 후 개선문 근처 아이쇼핑 카페 파란,20241013
오늘의 주간일기 20241006  1012,쇼핑 동안 계속 집 기절 저녁 이마트 닭강정 라면 먹음 라면 밥 간식 파리바게트 마들렌,20241013
프랑스 여행기 1,와리 오늘 파리 여행기 레츄 런던 유로스타 타고 파리 슝슝 연어 냄새 마레 지구 것 것 구경 사실 나 오프라인 쇼핑,20241013
농협상품권 어디서 쓸 수 있을까 사용처 완벽 가이드,또한 GS CU 세븐일레븐 등 편의점 롯데리아 KFC 버거킹 등 패스트푸드 점 던킨도너츠 파리 바게뜨 등 베이커리 CGV 롯데 시네마 등 영화관 등 제휴 사 사용 수 온라인 쇼핑몰 GS CU KFC CGV,20241013
수원부동산전망 최고의 아파트 입지2024 10 수원아파트 ,롯데 마트 쇼핑 수원역 앞 장보 게 스트레스 일 수도 스타 필드 바로 옆 편의 숙지 공원 마치 양천구 목동 파리 공원,20241013
대구 더현대 여성의류 쇼핑몰 플랫퍼 팝업  방문후기,습 댜 쇼핑 분도 거 파리 세트 거 제 키 cm 테 맥시 기장 짱구 팝업 때 치마 cm,20241013
자취 필수템 리스트 가성비 가구 브랜드 종류 추천 10,가구 쇼핑 안성맞춤 NoBrand 고 품질 가구 가격 제공 번개 할인 시장 Sky Furniture 집안 파리 매력 불어 영감 Roche Bobois 최고급 가구 고 품질 편안함 약속 전설 NoBrand Sky Furniture Roche Bobois,20241013
6월 해외여행 어디로 갈까   Best 6곳 추천 휴양 도시 ,문화 역사 쇼핑 유럽 도시 추천 프랑스 파리 낭만 예술 도시 에펠탑 루브르 박물관 등 랜드마크 부티크 쇼핑 수 이탈리아,20241013
사랑을 위한 여행 잊지 못할 추억을 만들기 위한 완벽한 가이드 ,프랑스 파리 사랑 도시 추억 파리 예술 사랑 도시 낭만 분위기 도시 쇼핑 미식 대도시 선택 것 또한 여행 예산,20241013
대만 여행 타이베이 자유여행 코스 항공권 가격,박물관 크게 관심 분 대만 국립 고궁 박물관 파리 루브르 영국 영 박물관 방문 쇼핑 대형 마트 도 시내 곳곳 위치 접근성 편이 시먼딩,20241013
우연히 마주친 소소한 일상의 행복feat Pays de l ,요 며칠 사이 파리 날씨 블로그 시작 불면증 고통 날 쇼핑 타운 Bercy Village httpswwwbercyvillagecom 와인 창고 의류 매장 Bercy Village httpswwwbercyvillagecom,20241013
즐거운 베트남 하노이하롱베이 패키지여행 마지막 날 베트남 ,파리 오페라 베트남 하노이 시내 눈 노란색 건물 볼 수 짱 띠 백화점 이 거리 짱 띠 거리 쇼핑 나라고 나 피 서지,20241013
초등 남아를 위한 최고의 장우산 모음 파리생제르맹 포켓몬스터 ,초등 남아 위 최고 장 우산 모음 파리 생제르맹 포켓몬스터 마블 캐릭터 우산 아동 우산 장 우산 여러 온라인 쇼핑몰 오프라인 매장 구매 수 디자인 가격 비교,20241013
유럽한달살기 ep10  몽마르뜨 언덕 근처 한식 쇼핑 ,파리 지하철 조금 그냥 파리 조금 도시 유럽 한식 쇼핑 라면 김치 햇반 등 몽마 르뜨 언덕 길 마트 한국 라면 종류 별로,20241013
세계의 전통 시장 탐방 삶의 숨결이 깃든 공간을 만나다,일본 도쿄 아메야요코초 시장 먹거리 쇼핑 수 곳 갓 구 운 센베 프랑스 파리 생투 시장 유럽 최대 규모 벼룩시장 골동품 빈티 의류 예술 품 등,20241013
