chunked_content,place,relevant_hashtags
가을 센트럴 파크 Photography Collection Booking available Please check out the official website wwwmaisondenyccom or visit the link in bio and DM for linkmaison de nycmaison de weddingmaisondestudiomaison de family 메종드 뉴욕 시선 감성 성 수기 촬영 예약 경우 수 날짜 촬영 위해 문의 카카오 톡 메종드 뉴욕 채널 검색 추가 상담 maisondenyc newyorkphotographer nyc newyork 뉴욕 뉴욕 여행 뉴욕 스냅 뉴욕 일상 뉴욕 여행 스냅 뉴욕 생활 뉴저지 일상 뉴저지 미국여행 미국 웨딩 nycweddingphotographer 뉴욕 스냅 메종드 뉴욕 센트럴 파크 centralparkwedding Photography Collection Booking available Please check out the official website wwwmaisondenyccom or visit the link in bio and DM for linkmaison de nycmaison de weddingmaisondestudiomaison de family maisondenyc newyorkphotographer nyc newyork nycweddingphotographer centralparkwedding,뉴욕,"['#메종드뉴욕따뜻한', '#newyorkphotographer', '#newyork', '#뉴욕', '#뉴욕여행', '#뉴욕스냅', '#뉴욕일상', '#뉴욕여행스냅', '#뉴욕생활', '#뉴저지일상', '#뉴저지', '#미국여행', '#뉴욕스냅메종드뉴욕', '#센트럴파크']"
슬슬 캐롤 계절 오늘 푸른 투어 에디터 날씨 크리스마스 발 컨텐츠 준비 유럽 크리스마스 못 뉴욕 매년 대규모 크리스마스 마켓 사실 알 크리스마스 진심 도시 뉴욕 말 크리스마스 마켓 크리스마스 항상 우리 친구 나 홀로 집 케빈 홀로 집 편 세계 가장 트리 록펠러 센터 트리 뉴욕 여름 성 수기 항공 료 호텔 반값 이상 여행 수 겨울 뉴욕 물가 항공 료 뉴욕 여행 분 연말 여행 크리스마스 낭만 뉴욕 가요 더 뉴욕 여행 정보 알고싶다 미국 최대 여행사 푸른 투어 팔로우 prttour official prttour official,뉴욕,[]
NYFW COS AW STREET STYLECOSAW NYFW 코스 NYFW COS AW STREET STYLECOSAW NYFW,Newyork,['#NYFW24']
오직 뉴욕 볼 수 전도 유망 디자이너 쇼 SS 뉴욕 패션위크 마무리 코스모 뷰 포착 브랜드 소개 JANEWADE 오피스 과감 변신 나이키 협업 슈즈 더욱 완성 컬렉션 JANE WADE 쇼 컷 아웃 디테일 제인 수 헤드 피스 백 액세서리 키치 매력 KATEBARTON 컬렉션 뉴욕 패션위크 성공 데뷔 쇼 케이트 바튼 쇼 눈 어항 시작 런웨이 금붕어 가방 드레이핑 미래 지향 드레스 만 나볼 수 MelittBaumeister 쇼 시작 전 댄서 무브먼트 집중 리타 바 우마 이스터 첫 패럴림픽 단거리 선수 스카우트 바셋 옐로 화이트 블랙 브랜드 컬러 리츠 네오프렌 패디드 요소 활용 입체 구조 디자인 모두 시선 군더더기 음악 선정 역시 이 브랜드 매력 안성맞춤 Digital Editor 최아름 COSMO NYFW 코스모 패션위크 ShotoniPhone iPhone ProMax SS JANEWADE JANE WADE KATEBARTON MelittBaumeister Digital Editor COSMO NYFW ShotoniPhone iPhone ProMax,,['#JANEWADE']
부자 여 성 삶 체험 맨하탄 차 MET 간 것 처음 미슐랭 쓰리스타 레스토랑 대가 기분 흑백 요리사 보고 더 미술 내 가도 모마 MET 그림 보고 작품 영상 물이 태반 모마 디자인 스토어 MOMA MET 뉴욕 여행 MET MET MOMA MET,MoMA The Museum of Modern Art,['#뉴욕여행']
페리 내내 둣 풍경 뉴욕 뉴욕 여행,,"['#뉴욕', '#뉴욕여행']"
뉴욕 여행 날씨 중,New York City,['#뉴욕여행']
Red Paper Clip 뉴욕 프렌치 타이 니 미슐랭 원 스타 레스토랑 Red Paper Clip 대만 맛 프렌치 테크닉 요리 맛 맛 XLB Agnolotti 가장 인상 Agnolotti 라비올리 파스타 반죽 안 Stuffing 이 파스타 요 이 곳 Agnolotti 속 돼지고기 생강 돼지고기 육즙 마치 이탈리안 샤오롱바오 느낌 위 트러플 육즙 때 맛 정말 스촨 카르파치오 고수 대추 메뉴 맛 선사 스촨 매콤 함 킥 정말 매력 Hainanese Chicken Roulade 치킨 역시 밥 감칠맛 대만 식당 답 수저 세팅 모습 볼 수 Red Paper Clip 프렌치 타이 니 를 경험 쑹 맛있쑹 뉴욕 뉴욕 RedPaperClip RedpaperClipNYC 뉴욕 맛집 뉴욕 여행 뉴욕 미슐랭 미슐랭 스타 레드 페이퍼클립 NewYorkeats NYCeats westvillagenyc nycmichelin Red Paper Clip Red Paper Clip XLB Agnolotti Agnolotti Stuffing Agnolotti Hainanese Chicken Roulade Red Paper Clip RedPaperClip RedpaperClipNYC NewYorkeats NYCeats westvillagenyc nycmichelin,Red Paper Clip,"['#뉴욕', '#뉴욕맛집', '#뉴욕여행', '#뉴욕미슐랭', '#NewYorkeats', '#NYCeats']"
follow your 스무 장 뉴욕 여행 follow your,뉴욕,['#뉴욕여행']
뉴욕 여행 기억 음식 꼽으 베이글 가게 아이스크림 가게 곳 완전 완전 강추 테리 음식점 맛 분위기 기억 남고 뉴욕 가면 꼭 eleven madison park 의 비건 코스 빈티 와인 구글 사진 보고 생각 이스트사이드 동네 카페 취향 쌩뚱맞 혼자 매우 당황 정도 번 건안 비밀 윌리엄스버그 소금 꿀 소프트아이스크림 햄버거 알 노랑 색 뉴욕 햄버거 맛집 맞닥들 이탈리아 네 푸드 축제 홀린 듯 구 운 옥수수 치즈 콘 브래드 꿀맛 뉴욕 여행 뉴욕 맛집 eleven madison park,New York,"['#뉴욕여행', '#뉴욕맛집']"
뉴욕 스냅 올드제 센트럴 파크 기록 우리 무드그저 자연 뉴욕 만삭 스냅 본식 스냅 반려견 스냅 가능 뉴욕 아이폰 스냅 가능 예약 인스타그램 DM 은 확인 모든 문의 카카오 톡 esssssri 연락 Photographer esssssri DM esssssri Photographer esssssri,"Central Park, New York",[]
김 음악 일주 뉴욕 피드 리기 여러 개 전망대 중 탑 오브 더 락 건 요즘 핫 엠파이어 스테이 트 빌딩 볼 수 전망 센트럴 파크 보이 엠파이어스테이트 빌딩 보이 허드슨 강도 보이 영화 허드슨 강의 기적 더 신기 여기 진짜 뉴욕 를 곳,Top of the Rock NYC,[]
일 기 쌀 쌀 인생 현재 진행형 일상 또 기록 진짜 분 감사 응원 메세지 덕분 침 앞 번더 원산지 소비자 해 애니 웨이 며칠 전 날씨 날 만 덤보 브루클린 츠 여름 내 덤보 오른쪽 흉물 푸른색 가림 막 늘 사람 정말 정말 단돈 동심 수 회전 목마 탈지 말 고민 burr w 일본 디저트 카페 쉬 부스트 퐁신 크림 디저트 진짜 처음 cava 의 피타 칩 진짜 그 lappartement f 사람 진짜 브루클린 하이 츠 낮 다시 번 생각 매력 동네 뉴욕 뉴욕 일상 뉴욕 여행 뉴욕 맛집 뉴욕 커피 burr w cava lappartement f,"DUMBO, Brooklyn","['#브루클린하이츠', '#뉴욕', '#뉴욕일상', '#뉴욕여행', '#뉴욕맛집', '#뉴욕커피']"
뉴욕 여행,,['#뉴욕여행']
미술 최고 것 추구 가도 멋대로 삶 에너지 덕분 것 전시장 인적 곳 세잔 점 이온 힘 다해 다양성 작품 중심 마지막 사진 줏대 삶 예술가 삶 삶 예술 뉴욕 여행 모마 moma ny 투어 뉴욕 moma ny,MoMA The Museum of Modern Art,"['#뉴욕여행', '#ny', '#오그림투어', '#오그림뉴욕']"
가을 분위기 물씬,,[]
뉴욕 아이폰 스냅 뉴욕 아이폰 감성 스푼 더하기 뉴욕 곳곳 낭만 뉴욕 스냅 endr m 뉴욕 스냅 예약 진행중 촬영 안내 네이버 블로그 확인 예약 문의 카카오 톡 드롬 endr m,,[]
한글날 맞이 뉴욕 월스트리트 태극기 월스트리트 중 태극기 장면 검색 이 나라 국기 게양 장소 우연 의도 한글날 시기 겹 태극기 게양 기분 NewYork USA 한글날 월스트리트 뉴욕 뉴욕 여행 한글 hangul hangulproclamationday korean koreanphotographer koreanphotography newyork newyorkcity travelusa travelnyc nyc wallstreet NewYork USA hangul hangulproclamationday korean koreanphotographer koreanphotography newyork newyorkcity travelusa travelnyc nyc wallstreet,"Wall Street, New York","['#월스트리트', '#뉴욕', '#뉴욕여행', '#newyork', '#newyorkcity']"
뉴욕 여기 화덕 피자 맛집 추천 Lombardis Spring St New York NY 추천 메뉴 마르 리타 피자 Johns of Bleecker Street Bleecker St New York NY 추천 메뉴 클래식 페퍼로니 피자 Julianas Pizza Old Fulton St Brooklyn NY 추천 메뉴 마르 리타 피자 화이트 피자 Grimaldis Pizzeria Front St Brooklyn NY 추천 메뉴 하프 마르 리타 하프 화이트 피자 뉴욕 여행 타 미스 Lombardis Spring St New York NY Johns of Bleecker Street Bleecker St New York NY Julianas Pizza Old Fulton St Brooklyn NY Grimaldis Pizzeria Front St Brooklyn NY,뉴욕,[]
자전거 풍경 newyork 파크 하얏트 호텔 무료 자전거 팍 반 바퀴 glacenyc 아이스크림 bluestonelane 아아 충전 소호 인생 타코 글 로시 키링 미션 완료 am pm 일정 완료 뉴욕 여행 nyc centralpark 센트럴 파크 soho newyork glacenyc bluestonelane am pm nyc centralpark soho,Newyork,"['#newyork', '#뉴욕여행', '#센트럴파크']"
,"New York, Central Park",[]
뉴욕 여행 계획 중이 라면 꼭 빈티 샵 도버 스트릿 마켓 DOVER STREET MARKET doverstreetmarketnewyork 탠저린 TANGERINE tangerinenyc 키스 KITH kith 카페 포갓 Caf Forgot cafe forgot 큐어 스 리프트 숍 Cure Thrift Shop curethrift 뉴욕 여행 미국여행 빈티 샵 뉴욕 빈티 빈티 카페 뉴요커 뉴욕 일상 구제 뉴욕 쇼핑 미국 쇼핑 DOVER STREET MARKET doverstreetmarketnewyork TANGERINE tangerinenyc KITH kith Caf Forgot cafe forgot Cure Thrift Shop curethrift,,"['#뉴욕여행', '#미국여행', '#뉴욕빈티지', '#뉴요커', '#뉴욕일상', '#뉴욕쇼핑', '#미국쇼핑']"
뉴욕 날씨 인지 팬츠,"USA, New York",[]
Broadway musical 캐나다 뉴욕 온 저 배 다른 자매 제시카 브로드웨이 뮤지컬 뉴요커 특 친구 때 관광 함 Cabaret 뮤지컬 카바레 완전 추천 아메리칸 아이돌 출신 가수 아담 램버트 남자 주연 노래 연기 퍼포먼스 완전 대박 감동 기도 스토리 극장 내부 완전 그때 당시 타임머신 타고 베를린 기분 연출 그것 경험 실내 촬영 금지 사진 백장 브로드웨이 뮤지컬 할인 티켓 tip 이 몇개 것 호 오 옥시 분 댓글 뮤지컬 면제 정리 뉴욕 뉴욕 여행 브로드웨이 뮤지컬 아담 램 버트 카바레 카바레 뮤지컬 브로드웨이 뉴욕 일상 Broadway musical Cabaret tip,August Wilson Theatre,"['#뉴욕', '#뉴욕여행', '#브로드웨이뮤지컬', '#브로드웨이', '#뉴욕일상']"
선 안 뉴욕 페스티벌 뉴요커 에디터 산 제나 축제 소개 부터 뉴욕 맨해튼 이탈리아 리틀 이태리 대규모 페스티벌 산 제나 축제 푸드 트럭 퍼레이드 공연 축제 현장 축제 주변 디저트 맛집 쇼핑 템 확인 필수 The Feast of San Gennarosangennaronyc 뉴욕 여행 친구 공유 The Feast of San Gennarosangennaronyc,리틀이털리 (맨해튼),[]
며칠 전 더월 소개 글 로시 glossier 의 PR 박스 기억 자물쇠 비밀번호 전 내용물 볼 수 그 주인공 공개 바로 글 로시 향수 Doux R ve 의 출시 소식 요 이 두 가지 향수 출시 예정 영국 기준 가격 한화 약 Doux 고요한 우디 향수 머 스키 앰브 록스 베이스 스윗 바이올렛 팔로 산토 프랑 킨 센스 유향 미르 몰약 R ve 몽환 향수 머 스키 앰브 록스 베이스 버터크림 자두 구 운 아몬드 아이리스 크리미 백 단 향 Remember the Glossier glossier PR box introduced by Click the World a few days ago It was securely locked and you couldnt see the contents until you received the passcode Well the secret has finally been revealed Glossier is launching two new fragrances Doux and R ve Both will be released on October rd priced at in the UK Doux A soft and serene woody fragrance with a musky Ambrox base Notes of sweet violet palo santo frankincense and myrrh R ve A dreamy fragrance with a musky Ambrox base Features notes of buttercream plum toasted almond iris and creamy white sandalwood glossier 해외 뉴스 클릭 더 월드 더월글 로시 런던 여행 뉴욕 여행 엘에이 여행 향수 추천 glossierdouxreve glossier PR Doux R ve Doux R ve Remember the Glossier glossier PR box introduced by Click the World a few days ago It was securely locked and you couldnt see the contents until you received the passcode Well the secret has finally been revealed Glossier is launching two new fragrances Doux and R ve Both will be released on October rd priced at in the UK Doux A soft and serene woody fragrance with a musky Ambrox base Notes of sweet violet palo santo frankincense and myrrh R ve A dreamy fragrance with a musky Ambrox base Features notes of buttercream plum toasted almond iris and creamy white sandalwood glossier glossierdouxreve,,"['#런던여행', '#뉴욕여행']"
뉴욕 여행 맛집 투어 제일 힘 미국 지정 맛집 생각 내 기준 맛 입맛 주관 날 소호 거리 피자 가게 앞 사람 무언가 마음 당장 구글 검색 함그 당시 네이버 후기 별로 프린스 스트릿 피자 뭐 여기 완전 현지 맛집 별 점도 후기 대박 서서 진심 인생 피자 바삭 쫄깃 도우 소스 뭐 왜 맛 뉴욕 피자 곳 더 최근 검색 사이 규모 역시 사람 맛집 흐흣그 뉴욕 저 꼭 입술 부자 패밀리 뉴욕 흑백 요리사 진짜 대체 뭐 이 프로 백종원 안 성재 목소리 수트 빨 진심 최현석 재 발견 임꼭 븐 타이 트 흑백 요리사 분 유행어 오늘 갑자기 급 급 가을 날 시크릿 오픈 진심 귀 귀 템 귀 하디 가격 이상 할인 할인 브랜드 절대 마감 자마자 블로그 글 전부 삭제 함 본사 당부 사항 수량 차고 수준 그냥 스토리 로만 예고 임산부 신생아 위 끝판 제품 눈 진심 순삭 품절 장담,,[]
베이글 BEST 뉴욕 베이글 정말 직접 반죽 베이글 쫀득 크림 치즈 환상 조합 뉴요커 요즘 제일 핫 베이글 집 BEST 소개 리 온스 베이글 Leons Bagels Thompson St Suite B New York NY Mulberry St New York NY 유토피아 베이글 Utopia Bagels E th St New York NY Utopia Pkwy Whitestone NY 본점 팝업 베이글 Popup Bagels Thompson St New York NY popupbagels utopiabagels leonsbagelsnyc BEST BEST Leons Bagels Thompson St Suite B New York NY Mulberry St New York NY Utopia Bagels E th St New York NY Utopia Pkwy Whitestone NY Popup Bagels Thompson St New York NY popupbagels utopiabagels leonsbagelsnyc,뉴욕,[]
가을 역시 책 개구리 인생 뉴욕 서점 나들이 뉴욕 뉴욕 일상 nomad 뉴욕 여행 뉴욕 책방 nomad,Rizzoli Bookstore,"['#뉴욕', '#뉴욕일상', '#뉴욕여행', '#뉴욕책방']"
Angelina Angelina,Angelina Paris USA,[]
Night Kayaking NYC newyorkcitytour newyorkcitytravel newyorkcityview newyorktough newyorktourist ninjagirls nycsights oculusnyc oneworldobservatory oneworldtradecenter oneworldtradecentre saturdaymorning 뉴욕 뉴욕 여행 뉴욕 여행 색감 Night Kayaking NYC newyorkcitytour newyorkcitytravel newyorkcityview newyorktough newyorktourist ninjagirls nycsights oculusnyc oneworldobservatory oneworldtradecenter oneworldtradecentre saturdaymorning,뉴욕,"['#newyorkcitytravel', '#newyorktough', '#newyorktourist', '#뉴욕', '#뉴욕여행', '#뉴욕여행중']"
뷰 깡패 호텔 뉴욕 여행 뉴욕 숙소 ludlowhotel newyork nyc dirtyfrench ludlowhotel newyork nyc dirtyfrench,The Ludlow Hotel NYC,"['#뉴욕여행', '#뉴욕숙소', '#newyork']"
달라스 트레 생활 때 둘 이번 두번째 덕분 뉴욕 여행 뉴욕 여행 new york new york,New York City,['#뉴욕여행']
뉴욕 뷰 친구 뉴욕 데리 두 곳 Panorama Room 맨해튼 이스트 눈 좌 라락 퀸스 보로 브릿지 케이블 카 빌딩 술집 먹거리 핑거 푸드 몇 개 다임 곳 뷰 칵테일 잔 걸 추천 발레 파킹 가능 Time Out Market New York 층 포인트 식사 수 식당 굳이 안 쉬 브루클린 브릿지 맨해튼 마천루 수 모두 데이트 커플 곳 뉴욕 야경 뉴욕 뉴욕 셀프 트래블 뉴욕 여행 Panorama Room Time Out Market New York,맨해튼,"['#뉴욕야경', '#뉴욕', '#뉴욕셀프트래블', '#뉴욕여행']"
브루클린 감성 보기,"DUMBO, Brooklyn",[]
미국여행 뉴욕 여행 빌딩 숲 USA nyc streetphotography skylinephotography USA nyc streetphotography skylinephotography,New York City,"['#미국여행', '#뉴욕여행', '#빌딩숲', '#USA']"
옷장 화장품 절대 공유 못 친구,SUMMIT One Vanderbilt,[]
나 오늘 또 공짜 스냅 사진 너 어어 무 이뽀 GantryPlazaStatePark 겐트 리 플라자 공원 뉴욕 여행 GantryPlazaStatePark,Gantry Plaza State Park,['#뉴욕여행']
Photo by kkangni Photo by kkangni,"New York City , USA",[]
Hi new yorkIm Eunbong a tattoo artist from KoreaIll be working in New Yorkfrom October to NovemberIf you like cute and clean designs with vibrant colors check out my Instagram feed and contact meSlots fill up quickly so reach out soon to book your preferred date and timeTo make a reservation please DM me with the following details Desired date Preferred design and color or black If you have a specific design in mind please describe it Custom designs are also available at no extra charge Size and location of the tattooCheck out eunbong dr where I showcase the designs Ive createdYou can also make a reservation there so take a lookyou might find your perfect design Lets capture your unique story and personality on your skin Hi new yorkIm Eunbong a tattoo artist from KoreaIll be working in New Yorkfrom October to NovemberIf you like cute and clean designs with vibrant colors check out my Instagram feed and contact meSlots fill up quickly so reach out soon to book your preferred date and timeTo make a reservation please DM me with the following details Desired date Preferred design and color or black If you have a specific design in mind please describe it Custom designs are also available at no extra charge Size and location of the tattooCheck out eunbong dr where I showcase the designs Ive createdYou can also make a reservation there so take a lookyou might find your perfect design Lets capture your unique story and personality on your skin,"Newyork, USA",[]
Good morning from new york city Good morning from new york city,맨해튼,[]
Early morning metmuseum at the MET Roof Garden themet metropolitanmuseumofart roofgarden floral themetropolitanmuseumofart NYC NewYork art newyorkcity newyorknewyork 뉴욕 메트로폴리탄 뮤 지엄 더멧 루프 탑 정원 조경 뉴욕 여행 옥상정원 예술 Early morning metmuseum at the MET Roof Garden themet metropolitanmuseumofart roofgarden floral themetropolitanmuseumofart NYC NewYork art newyorkcity newyorknewyork,"The Metropolitan Museum of Art, New York","['#metropolitanmuseumofart', '#themetropolitanmuseumofart', '#NYC', '#NewYork', '#newyorkcity', '#newyorknewyork', '#뉴욕', '#뉴욕여행']"
Autumn Newyork 가을 뉴욕 뉴욕 여행 맨해튼 소호 센트럴 파크 뉴욕 newyorkmanhattansohonyccentralpark Autumn Newyork newyorkmanhattansohonyccentralpark,New York City,"['#뉴욕여행', '#맨해튼', '#센트럴파크', '#뉴욕', '#newyork', '#manhattan']"
뉴욕 나름 두 손 정도 때문 이번 뉴욕 밍교이 무 계획 포기 수 단 하나 바로 tinysnyc 무슨 메뉴 분홍색 외벽 리본 보고 방문 아주 맘 자 우리 과연 엄마 자질 확인 위해 디즈니 애기 마리 입양 나 하루 종일 덤보 품 끼 둥가둥 반면 밍교이 바로 쇼핑 스티치 박아 뭐 어차피 남편 밍교이 도착 첫 날 밤 호텔 끙끙 약 밤 겨우 기어 날 날 애 착 완전 섹시 맵시 핫 스파이 시 칠리 라피 뇨 칭찬 사진 업땨뚜뚜 X 뉴욕 tinysnyc X,Tiny's & The Bar Upstairs,[]
닝 가득 연말 뉴욕 곳 TOP 추천 세계 가장 도시 뉴욕 겨울 뉴욕 크리스마스 볼드랍 행사 사람 모이 그 때 뉴욕 어디 가야 저장 여행 때 참고 뉴욕 공립 도서관 브라이언 트 파크 엠엔엠즈 스토어 타임스퀘어 탑 오브 더락 전망대 브루클린 브릿지 덤보 메모 리얼 박물관 원 월드 트레이드 센터 록펠러 센터 트리 뉴욕 뉴욕 여행 뉴욕 맛집 타임스퀘어 뉴욕 공립 도서관 센트럴 파크 미국여행 미국 일상 여행 여행 미국 어학 연수 미국 워홀 브루클린 브루클린 브릿지 덤보 탑 오브 더락 브라이언 트 파크 여행 스타 그램 여행 맞팔 여행 소통 협업 협찬 nyc nyctravel nytravel usa 록펠러 센터 자유의여신상 TOP nyc nyctravel nytravel usa,,"['#뉴욕', '#뉴욕여행', '#뉴욕맛집', '#뉴욕공립도서관', '#센트럴파크', '#미국여행', '#미국어학연수', '#브루클린', '#브루클린브릿지', '#탑오브더락', '#브라이언트파크', '#nyctravel', '#nytravel']"
인간 것 곳 자연 곳 이동 작품 공간 그 감동 자연 벗 것 더욱 중력 거 스르 배열 Arlene Shechet 내 사랑 Alexander Calder 호수 나위 Roy Lichtenstein 여름 가을 공존 이 계절 뉴욕 여행 arleneshechet alexandercalder roylichtenstein 투어 뉴욕 Arlene Shechet Alexander Calder Roy Lichtenstein arleneshechet alexandercalder roylichtenstein,Storm King Art Center,"['#뉴욕여행', '#오그림투어', '#오그림뉴욕']"
아토 믹스 저녁 만찬 배 산책 겸 장보 던 날 CVS 차로 영 양제 건강 식품 홀 또 미국 정말 영 양제 종류 눈 멜라토닌 구미 사 가끔 잠 안 때 푹 데 도움 담 가면 쟁여 에너지 반대 릴 렉스 초콜렛 숙취 해소 제도 하나 뉴욕 여행 홀 뉴욕 허드슨 야드 newyork groceryshopping CVS newyork groceryshopping,Hudson Yards New York,"['#뉴욕여행', '#뉴욕', '#newyork']"
뉴욕 googleNYC Hudson 건물 하나 나무 맨해튼 화물 터미널 증축 햇빛 실내 강전 망 각 층 식물 테라스 테라스 식물 외부 동영상 사진 휘트니 미술관 근처 도로 변 길가 변신 Madison aveMidtown East 고층 빌딩 사이 광장 정원 피 날씨 구애 수 피 통해 빗물 곳 모든 식물 관수 컬 커피 샾 다시 간다 저기 커피 한잔 꼭 뉴욕 개인 소유 땅 정원 조 성해 공공 광장 개방 세금 혜택 고우리 흉물 조각 건물 법 듯 조각품 건물 몇 듯 fordfoundationbuilding 가든 행사 못 곳도 다음 기회 마지막 사진 안 센트럴 파크 뉴욕 여행 정원 투어 사진 정리 googleNYC Hudson Madison aveMidtown East fordfoundationbuilding,,"['#뉴욕', '#센트럴파크', '#뉴욕여행', '#정원투어']"
뉴욕 가을 기록 시작 스튜디오 감성 영화 속 장면 가을 겨울 뉴욕 스냅 예약 예약 및 상품 확인 프로필 링크 확인 뉴욕 스냅 뉴욕 웨딩 뉴욕 여행 뉴욕 웨딩 스냅 뉴욕라이프 뉴욕 일상 뉴욕뉴욕 스냅 사진,,"['#뉴욕스냅', '#뉴욕웨딩', '#뉴욕여행', '#뉴욕웨딩스냅', '#뉴욕라이프', '#뉴욕일상', '#뉴욕', '#뉴욕스냅사진']"
더 리 뉴욕 행복 거지 사랑 이번 커플 이 순간 추억 뉴욕 여행 뉴욕 풍경 더 리 패키지 현재 이벤트 진행 중 신청서 확인 촬영 문의 카카오 톡 ID sky 로 홈페이지 포트폴리오 고객 리뷰 패키지 등 정보 눈 확인 수 검색 창 thehurycom 입력 ID sky thehurycom,Greenwich Village NYC,"['#뉴욕여행', '#뉴욕풍경']"
꼬까 옷 Babydoll tops Babydoll tops,뉴욕,[]
American Style Brunch Skylight Diner 뉴욕 뉴욕 여행 브런치 American Style Brunch Skylight Diner,Starlight Diner,"['#뉴욕', '#뉴욕여행']"
Wanna leave 뉴욕 뉴욕 여행 미국 미국여행 미국 뉴욕 여행 스냅 Wanna leave,"DUMBO, Brooklyn","['#뉴욕', '#뉴욕여행', '#미국', '#미국여행', '#미국뉴욕']"
미국여행 뉴욕 여행 빌딩 숲 USA nyc streetphotography skylinephotography USA nyc streetphotography skylinephotography,New York City,"['#미국여행', '#뉴욕여행', '#빌딩숲', '#USA']"
런던 뉴욕 레오 다시 온 뉴욕 뱅기 도착 후 타임스퀘어 네이버 런던 잡화 점 영국 살이 뉴욕 여행 메모 타임스퀘어 아이 여행 기록 시간여행 시간 순삭,"Times Square, New York City",['#뉴욕여행']
Midtown NYCDinner filled with gratitudeThank you dana wine danaestateswine for flying into NYC with EXTENSIVE Dana collections and thank you bom nyc bskimoiji for executing the perfect partner for a great wineI learned about how great and fatty Kinmedai fish is and Onda and broke a certain imperative idea that fish cannot be eaten with a redBite of the nightGetting a taste of Helms Rutherford was an honor I wouldnt be mad to try once more 오웬 eationarynyc eationarymidtown bomnyc 보고서 뉴욕 뉴욕 맛집 뉴욕 여행 danaestates Midtown NYCDinner filled with gratitudeThank you dana wine danaestateswine for flying into NYC with EXTENSIVE Dana collections and thank you bom nyc bskimoiji for executing the perfect partner for a great wineI learned about how great and fatty Kinmedai fish is and Onda and broke a certain imperative idea that fish cannot be eaten with a redBite of the nightGetting a taste of Helms Rutherford was an honor I wouldnt be mad to try once more eationarynyc eationarymidtown bomnyc danaestates,bōm,"['#먹어보고서뉴욕', '#뉴욕맛집', '#뉴욕여행']"
햄보쿠,맨해튼,[]
어디 서나 쇽 찰캌찰캌했더 reminisce yds reminisce yds,America,[]
뉴욕 여행 기록 Day 연장전 호텔 근처 레스토랑 맛 음식 실컷 뉴욕 가을 밤 분위기 흠뻑 날 파리 마리 선선 날씨 리하 준 식사 댱 리하 보리차 한잔 꿈나라 뉴욕 여행 newyork bryantpark Day newyork bryantpark,,"['#뉴욕여행', '#newyork']"
newyorktripbagel 뉴욕 여행 뉴욕 스타 그램 newyorktripbagel,"Central Park, New York","['#newyorktrip', '#뉴욕여행', '#뉴욕']"
