chunked_content,place,relevant_hashtags
해리포터 덕후 꼭 뉴욕 해리포터 스토어 작년 예약 입장 인원 제한 지금 예약 방문 가능 입장 시 마스크 필수 시 제공 줌 세계 최대 규모 해리포터 스토어 답 굿 종류 샵 스튜디오 느낌 구경만 해도 스토어 외관 뉴욕 해리포터 결합 비주 얼 그냥 수가 엘레베이터 플루 가루 벽난로 컨셉 마지막 영상 유니 버셜 가야 수 버터 비어 판매 중 bynmnustudio 여행자 이야기 공유 공간 여행 제보 여행 이유 태그 여행 이유 해외여행 이유 미국 해외여행 해외여행 추천 여행 뉴욕 해리포터 뉴욕 harrypotternewyork 해리포터 해리포터 덕후 뉴욕 여행 뉴욕 곳 미국여행 코스 미국여행 뉴욕 핫 미동 부 미동 부 여행 여행 스타 그램 여행사진 여행지 추천 bynmnustudio harrypotternewyork,Harry Potter New York,"['#뉴욕', '#해리포터뉴욕', '#뉴욕가볼만한곳', '#뉴욕핫플']"
뉴욕 얼마 증맬루 핫 플사 람 제대로 못 것 아쉬움 써요듀욕듀욕 차,SUMMIT One Vanderbilt,['#뉴욕']
뉴욕 추수 감사 절 퍼레이드 Macys Thanksgiving Day Parade 목 오전 진행 미국 유명 백화점 메이시스 주최 행사 매년 넷째 주 목요일 진행 거대 풍선 퍼레이드 음악 공연 등 이벤트 퍼레이드 보기 위해 명 사람 정도 인기 축제 뉴욕 여행 계획 참고 NBC News waltdisneyarchives newyorkcitykopp Macys Thanksgiving Day Parade NBC News waltdisneyarchives newyorkcitykopp,,[]
appleju nyc 온 더 테이블 먹방 스타 그램 디저트 핫 핫 레이스 핫 맛집 맛스타 소통 appleju nyc,The Terrace and Outdoor Gardens,"['#핫플', '#핫플레이스', '#핫플맛집']"
libraebakery Cooper Sq New York NY 빵 무조건 가세 사람 추천 베이커리 피스타치오 크로와상 밥 순이 빵 순이 맛 평일 오전 전 방문 기준 웨이 팅 좀 금방 편 but 매장 안 테이블 재 방문 의사 jihoinnewyorkcity libraebakery Cooper Sq New York NY but jihoinnewyorkcity,Librae Bakery,[]
리보 저리 보고 jimini newyork jimini newyork,Solomon R. Guggenheim Museum,[]
What a cool casting spot 캐스팅 땜 곳 publichotelnyc 뉴욕 주말 뉴욕 일상 뉴욕 핫 퍼블릭 뉴욕 일요일 nyclifestyle nychotels nycmodels What a cool casting spot publichotelnyc nyclifestyle nychotels nycmodels,Public Hotels,"['#뉴욕일상', '#뉴욕핫플', '#퍼블릭뉴욕', '#nychotels']"
Legit Chinese hotspot with cute bear seasoning Todays MVP was the potato noodles chinatown hotpot Legit Chinese hotspot with cute bear seasoning Todays MVP was the potato noodles chinatown hotpot,Xiang Hotpot,['#hotpot']
무한도전 안 내 예능 이방인 이방인 보고 드뎌 레인보우 베이글 플레인 크림 치즈 궁합 찰떡 지연 inNYNYNYCnewyorknewyorkcitybrooklynthebagelstorerainbowUSAnyclife 뉴욕뉴욕 여행 뉴욕 핫 브루클린 브루클린 맛집 브루클린 핫 더 베이글 스토어 뉴욕 가을 미국 미국여행 미국 동부 여행 여행 스타 그램 부부 여행 데 일리 inNYNYNYCnewyorknewyorkcitybrooklynthebagelstorerainbowUSAnyclife,The Bagel Store,"['#NY', '#NYC', '#newyork', '#brooklyn', '#뉴욕', '#뉴욕핫플', '#브루클린', '#브루클린맛집', '#브루클린핫플', '#뉴욕의가을']"
뉴욕 브런치 요긴 벌써 여름 뉴욕 핫 뉴욕 레스토랑 추천 뉴욕라이프,RH Rooftop Restaurant,"['#뉴욕핫플', '#뉴욕레스토랑추천', '#뉴욕라이프']"
두번째 리테일 라운딩 마켓 레이스 타임 아웃 마켓 뉴욕 폐공 리뉴얼 트렌디 푸드코트 루프 트탑뷰 브루클린 핫,Time Out Market New York,"['#타임아웃마켓뉴욕', '#브루클린핫플']"
Photo by Robert Photo by Robert,"The Vessel-Hudson Yards, NY",[]
덤보 바로 옆 루프 탑 뷰 추천 뉴욕 여행 뉴욕 핫 애인 뉴욕 hotelbrooklynbridge hotel hotelbrooklynbridge hotel,1 Hotel Brooklyn Bridge,"['#뉴욕핫플', '#지애인뉴욕', '#1hotelbrooklynbridge']"
뉴욕 차 뉴욕 핫 LADUREE 에그베네딕트 오믈렛 프렌치토스트 마카롱 뉴욕 브런치 맛집 뉴욕 브런치 맛집 뉴욕 맛집 뉴욕 소호 뉴욕 핫 nyc newyorksoho laduree LADUREE nyc newyorksoho laduree,Ladurée,"['#뉴욕브런치맛집', '#뉴욕맛집', '#뉴욕소호', '#뉴욕핫플', '#newyorksoho']"
요즘 뉴욕 핫 레이스 Vessel 베슬 Vessel,,[]
ABC 마트 ABC 키친 뉴욕 핫 버섯 못 남자 머쉬룸 피자 연어 샐러드 를 연어 스테이크 우리 리딩 실수 리스닝 실수 ABCKitchen ABC ABC ABCKitchen,,['#뉴욕핫플']
Finally made it to Ralphs Coffee 입구 곰돌이 Finally made it to Ralphs Coffee,Ralph's Coffee,[]
City of Art 예술 일상 이 곳 그릇 영수증 화장실 예술 처 레스토랑 City of Art,The Whitby Hotel,[]
이제 금빛 사랑 은설 공 쥬 듕 인기 폭발 나 홀로 뉴욕 뉴욕 여행 이안 애 뉴욕 봄 뉴욕 핫 RHnewyork nyc rhrooftoprestaurant RHnewyork nyc rhrooftoprestaurant,,"['#나홀로뉴욕', '#뉴욕핫플']"
RH fancy fancy Dec ilovenewyork RH fancy fancy Dec ilovenewyork,RH Rooftop Restaurant,[]
별 개 thenomad 더 노마드 더 노마드 호텔 레스토랑 미슐랭 스타 뉴욕 맛집 브런치 ny nyc manhattan travel 뉴욕 핫 낼 생각 thenomad ny nyc manhattan travel,The Nomad,"['#더노마드호텔', '#뉴욕맛집', '#manhattan', '#뉴욕핫플']"
Im on cloud nineMake a wish 이보 브루클린 뉴욕 편의 유화 선셋 별빛 뉴욕 야경 말 해무 엇 노을 속 자유의여신상 소원 빌어 보기 슈퍼문 은덤 뉴욕 여행 뉴욕 핫 뉴욕 여행 추천 브루 릿핫플브쿠 클린 명소 brooklynbridgebrooklynnycnewyorkcitysunset 미국여행 일 반 카메라 뉴욕 경 뉴욕 경 맛집 브루클린 브릿지 여행 스타 그램 nyc 추석 여행 끝 사진 안 문제 Im on cloud nineMake a wish brooklynbridgebrooklynnycnewyorkcitysunset nyc,브루클린,"['#브루클린', '#뉴욕한편의유화같았던선셋과별빛처럼반짝이는뉴욕의야경은말해무얼하나', '#뉴욕핫플', '#뉴욕여행추천', '#브루클릿핫플', '#brooklynbridge', '#brooklyn', '#뉴욕야경', '#뉴욕야경맛집', '#브루클린브릿지']"
웨이 팅 못 나이 곳 클림트 황금 빛 그림 위해 오 롯 이 것 위해 금색 이 곳 대한 이야기 livingsense 호 수 심사숙고 음료 오이 주스 원샷 만족 얼굴 이정보 그냥 살 livingsense,Neue Galerie New York,[]
Perfect date night dinner spot in West Village boucherienyc Such a romantic spot and our mussels chicken were on point Oh everyone was so friendly too great service 프렌치 감성 뉴욕 웨스트 레스토랑 로맨틱 분위기 데이트 저 홍합 치킨 맛 서비스 Perfect date night dinner spot in West Village boucherienyc Such a romantic spot and our mussels chicken were on point Oh everyone was so friendly too great service,Boucherie,[]
일명 말 스테이크 접시 고기 겉 살짝 스킬 또한 레이디 inNYCpeterlugersteakhouse inNYCpeterlugersteakhouse,Peter Luger Steak House Est. 1887,[]
척 건 규 귀가 귀 도리,Bryant Park,[]
희전 추천 연화 과장 뉴욕 아침 르 쿠쿠 lecoucou nyc 브런치 치즈 맛 홀란데 소스 듬뿍 베네딕트 프렌치 토스트 페이스트리 커피 뉴욕 가을 굿모닝 노매드 호텔 못 수준 브런치 곳 호 워드 층 NY racines racinesny soho restaurant neobistro bar wine winebar naturalwine onthetable 술 스타 그램 brunch 뉴욕 브런치 lecoucou french 뉴욕 맛집 뉴욕 여행 뉴욕 핫 핫 먹방 맛스타 그램 와인 스타 일링 와인 화이트와인 내추럴 와인 뉴욕 nyclife yh fongfong lecoucou nyc NY racines racinesny soho restaurant neobistro bar wine winebar naturalwine onthetable brunch lecoucou french nyclife yh fongfong,,"['#NY', '#뉴욕', '#뉴욕맛집', '#뉴욕핫플', '#핫플', '#뉴욕커']"
Ok this was Do I think the coffee was worth it Maybe not But the experience was worth it The feeling that I felt when I was watching it made into a cup of art was worth it When we are paying for something we buy the feelings And if I had fun isnt that all it matters 불 굳이 막상 거 보고 생각 사람 내 거 듯 또 그 가격 생각 사람 심리 newyork nyc nyccoffeeshop nycbucketlist nyceats prettynyc latte hickerylatte tooexpensive felixroasting coffee marshmallow foodie 뉴욕 커피숍 뉴욕 뉴욕 핫 조금 바가지 커피숍 라떼 마시멜로 먹방 스타 그램 커피 스타 그램 Ok this was Do I think the coffee was worth it Maybe not But the experience was worth it The feeling that I felt when I was watching it made into a cup of art was worth it When we are paying for something we buy the feelings And if I had fun isnt that all it matters newyork nyc nyccoffeeshop nycbucketlist nyceats prettynyc latte hickerylatte tooexpensive felixroasting coffee marshmallow foodie,Felix Roasting Co.,"['#newyork', '#뉴욕커피숍', '#뉴욕', '#뉴욕핫플']"
얼마나 살 사진 것 명성 만큼 예약 만큼 정말 Don Angie 날씨 실크 슬립 드레스 저녁 이보 기분 수가 올해 남자친구 퍼펙트 여기 이유 보통 처럼 헤비 마늘빵 조화 환상 그 다음 날 정말 그냥 하나 더 집 다음 날 만큼 정말 거 또 Don Angie,Don Angie,[]
미국 뉴욕 핫 돌진 황소 미국 뉴욕 월 금융 중심 뉴욕 증권 거래소 근처 돌진 황소 Charging Bull 이 핫 레이스 자리 잡고 황소 금융가 상징물 증권 시장 장기간 상승 불 마켓 Bull Market 장기간 약세 마켓 Bear Market 두 짐승 공격 법 황소 뿔 이용 상대 황소 장세 위로 상승 의미 반면 곰 상대 땅 때문 하락 의미 주식 시장 상승 뜻 황소 상징 때문 동상 뿔 급소 등 만 지면 재운 이 속 설 매년 관광객 몰리 월 가의 상징 이자 뉴욕 랜드마크 이 동상 건 이탈리아 조각가 아르 투 디 모 디카 고해 개인 재산 달러 약 여 만 황소 제작 무게 톤 길이 미터 달 이 황동 주가 폭락 블랙 먼데이 사태 시작 고해 세계 자본주의 총 산 월 가가 걸 모 디카 미국 경제 회복 상징 조형 물 생각 밤 모 디카 친구 여 명과 크레인 황소 기습 설치 당국 허락 고해 그 올해 초 이탈리아 언론 레푸블리카 인터뷰 작전 시간 단 몇 차례 정찰 결과 경찰 번 순찰 사실 알 당시 회고 고해 뉴욕시 허가 불법 설치 철거 뉴욕 시민 반대 황소 현재 지역 명물 이탈리아 뉴욕 사랑 모 디카 투병 전 뉴욕 때 예술가 그 아버지 반대 세 집 피렌체 미술 고해 후반 영국 대표 조각가 헨리 무어 예술 활동 무어 모 디카 미켈란젤로 극찬 이후 소호 부근 미술 스튜디오 뉴욕 본격 활동 올해 조각가 모 디카 세 나이 고향 시칠리아 세상 해 미켈란젤로 극찬 모 디카 세상 그 황소 미국 자본시장 번영 약속 징표 글 수고 주 월요일 시작 오늘 아침 기온 쭈욱 이제 본격 여름 시 작 된거 날씨 건강 유의 고시원 일 하루 선물 하루 미국여행 뉴욕 월스트리트 돌진 황소 뉴욕시티 뉴욕 핫 뉴욕 랜드마크 newyouktravelchargingbull 주식 상승 unitedstatestravel unitedstates 여행 맛 여행 기억 면 여행 미국 shallwetravel 여행 시작 여행 여행 코디 주 일 시 작 충전 매 일 매일 오늘 오늘 화이팅 Charging Bull Bull Market Bear Market newyouktravelchargingbull unitedstatestravel unitedstates shallwetravel,,"['#뉴욕시티', '#뉴욕핫플', '#뉴욕랜드마크']"
Goodbye summer Goodbye summer,,[]
뉴욕 여행 마지막 날 의 뉴욕 핫 은 바로 스팟 비주 얼 저절로 카메라 를 댐 주니어스 나 매그놀리아 더 커피 음료 스텀 프타 운 이나 블루 보틀 더 한국 지점 생기,,"['#뉴욕핫플', '#스텀프타운']"
뉴욕 수 덤보 비수 쯤 앞 팀 평소 쯤 가야 엄마 분명 덤보 한국인 만 인기 오픈 런 결사 반대 막상 가보 한국인 외국인 제 전세계 곳 딸램 못 울 엄마 DUMBO Photo point Washington St Brooklyn NY USA 맨해튼 브리지 사이 엠파이어스테이트 빌딩 뽀인트 부루 클린 브릿지 다리 위로 성조기 바람 거리 데 기분 묘 자유 느낌 랄 동생 이제 우리 자유 미국 온 콩트 눈보라 타임 아웃 마켓 기도 포토 명소 사 베이글 연어 베이글 분명 맛 좀 베이글 맛집 체인점 길 보이 한번 DUMBO Photo point Washington St Brooklyn NY USA,"DUMBO, Brooklyn",[]
오늘 위스키 aubiandramsa 뉴욕 핫 칵테일 아이스크림 바 aubiandramsa,Aubi & Ramsa,['#뉴욕핫플']
Avant Gallery 흥미진진 전시 작가 생기 매력 작품 고스 란 jinatelier newyork avantgallery gallery NYC trip hudsonyards luxury art washingtondc DC healing design skylergrey 지나 뉴욕 갤러리 허드슨 야드 뉴욕 핫 뉴욕 여행 럭셔리 여행 스타 그램 워싱턴 디씨 여행 신혼 새댁 힐링 인테리어 핫 레이스 소 확행 Avant Gallery jinatelier newyork avantgallery gallery NYC trip hudsonyards luxury art washingtondc DC healing design skylergrey,Avant Gallery Hudson Yards NYC,"['#newyork', '#NYC', '#뉴욕', '#뉴욕핫플', '#핫플레이스']"
electriclemon 정말 환상 디너 일 렉 트릭 레몬 레몬 오일 파스타 사진 못 모든 메뉴 정말 최고 와인 페어 링 어쩜 퍼렐 뒤 대도 뉴욕 만찬 또 디저트 맛 말 플레이 팅 정말 최고 Electric Lemon a truly fantastic dinnerI couldnt take a picture of the lemon oil pasta because we are fall in love it It was so so so delicious All the menus were really the best in my lifeEven the wine pairing is like this We didnt even know Pharrell Williams was behind me A happy great wonderful dinner in New York All dessert that comes to mind Not to mention the taste the plating was so lovely really the best I will go and enjoy everytime going to NY 일 렉 트릭 레몬 electriclemonnyc nydinnerparty 뉴욕 핫 뉴욕 시 그 니 처 perfectdinner electriclemon Electric Lemon a truly fantastic dinnerI couldnt take a picture of the lemon oil pasta because we are fall in love it It was so so so delicious All the menus were really the best in my lifeEven the wine pairing is like this We didnt even know Pharrell Williams was behind me A happy great wonderful dinner in New York All dessert that comes to mind Not to mention the taste the plating was so lovely really the best I will go and enjoy everytime going to NY electriclemonnyc nydinnerparty perfectdinner,"The Edge, Hudson Yards","['#뉴욕핫플', '#뉴욕의시그니처']"
in Hudson Yards 크리스마스 시즌 코 X 나 이루 두번째 시즌 해 뉴욕 더더 크리스마스 분위기 허드슨 야드 열기구 트리 장식 크리스마스 시즌 촬영 수 스팟 지금 뉴욕 여행 중이 라면 꼭 사진 뉴욕 여행 스냅 도전 nystylesnapDM for inquiries booking K E I G R A P H Y S T U D I O 진행중 DM 뉴욕 스냅 니 스타일 스냅 케이 작가 뉴욕 여행 크리스마스 시즌 뉴욕 크리스마스 허드슨 야드 베슬 핫 레이스 뉴욕 핫 베슬 열기구 트리 뉴욕 트리 뉴욕 포토 스팟 뉴욕 스냅 사진 뉴욕 여행 스냅 in Hudson Yards X nystylesnapDM for inquiries booking K E I G R A P H Y S T U D I O DM,Hudson Yards New York,"['#핫플레이스', '#뉴욕핫플', '#뉴욕트리', '#뉴욕포토스팟', '#뉴욕스냅사진']"
Yam waiting 쩌 곳 rubyscafe 스타 그램 스타 맛집 맛집 스타 그램 뉴욕 맛집 추천 뉴욕 핫 돼지 런 파스타 맛집 일상 일상 소통 반 친친 shirimp shirimppasta pasta foodstagram newyorkcity newyorkrestaurant likeforlikes fff Yam waiting rubyscafe shirimp shirimppasta pasta foodstagram newyorkcity newyorkrestaurant likeforlikes fff,Ruby's NYC,"['#뉴욕맛집추천', '#뉴욕핫플', '#newyorkrestaurant']"
moma thinkcoffee brooklynbrige coffeebrunchjfkairportmanhattan newyorknycnewyorkcity newyorkgram travelertriptravel 뉴욕 숙소 뉴욕 게 한인 민박 뉴욕 한인 민박 뉴욕 게스트하우스 뉴욕 숙박 뉴욕 숙소 추천 모마 뉴욕 박물관 뉴욕 맑음 뉴욕 혼자 여행 뉴욕 핫 별 이빛나 밤 moma thinkcoffee brooklynbrige coffeebrunchjfkairportmanhattan newyorknycnewyorkcity newyorkgram travelertriptravel,MoMA The Museum of Modern Art,"['#brooklynbrige', '#manhattan', '#newyork', '#뉴욕숙소', '#뉴욕한인민박', '#뉴욕숙박', '#뉴욕숙소추천', '#뉴욕박물관', '#뉴욕혼자여행', '#뉴욕핫플']"
규 맛집,Salt+Charcoal,[]
DarlingRooftopDarling 달링 ParkLaneHotel 파크 레인 호텔 루프 탑 뉴욕뉴욕 핫 darlingnewyork 층뷰 센트럴 파크 뷰 darlingrooftop 뉴욕 핫 파크 레인 호텔 층 달링 DarlingRooftopDarling ParkLaneHotel darlingnewyork darlingrooftop,Darling Rooftop,"['#파크레인호텔루프탑', '#뉴욕', '#뉴욕핫플', '#47층뷰', '#센트럴파크뷰']"
뉴욕 간다 꼭 치즈 케익 맛집 소호 분 꼭 한번 개 먹기 가능 사이즈 먹기 가능 Eileens Special Cheesecake Cleveland Pl New York NY 뉴욕 여행 뉴욕 맛집 소호 nyc newyork soho Eileens Special Cheesecake Cleveland Pl New York NY nyc newyork soho,Eileen's Special Cheesecake,"['#뉴욕맛집', '#newyork']"
부띠 호텔 창시자 이안 슈 레거 에어 비앤비 경쟁 블릭 호텔 publichotels 처음 에어비앤비 선풍 인기 때 사람 호텔 침몰 예상 또 사람 대안 문제 해결 진화 간다 이안 슈 레거 기존 호텔 프릴 제거 표현 사용 것 군더더기 비용 절감 호텔 것 에어비앤비 제공 수 차별 포인트 기분 실용 공용 제공 럭셔리 경험 제공 정말 크리에이티브 리셉션 데스크 대신 인건비 절감 아이패드 셀프 체크 데스크 공용 부 대리석 대신 합판 등 재료 사용 디자인 디 테일로 럭셔리 구현 구현 건물 앞 조경 뷰 옥상 라운지 적극 활용 매력 호텔 원래 수 십년 전 뉴욕 Hudson nyc Hotel 이 그 호텔 에스컬레이터 포인트 디자인 공용 부 디자인 정말 퍼블릭 호텔 얘기 바 뭔가 현대 오마주 작품 느낌 살 때 그 기분 충격 고스 란 Design 건 포장 게 컨셉 본질 직관 오감 전달 작업 다음 여기 디자인 만세 뉴욕 호텔 publichotels Hudson nyc Hotel Design,Public Hotels,['#뉴욕호텔']
더 리사 연인 브 루블린 브릿지 순간 서로 손 잡고 브루클린 브릿지 꽃 두 눈 마주 로맨틱 영화 주인공 느낌 수 브루클린 브릿지 분위기 찰떡 해바라기 준비 사진 저희 더 리 촬영 시간 동선 착 소품 여러분 고민 뉴욕 스냅 준비 분 언제 상담 오늘 하루 뉴욕 커플 스냅 newyorksnapIf you are an English Speaker we can still proceed booking in English for Jeju Snap So feel free to contact usIf you are an English Speaker we can still proceed booking in English for Jeju Snap So feel free to contact us 더 리 패키지 현재 이벤트 진행 중 신청서 확인 촬영 문의 카카오 톡 sky 홈페이지 포트폴리오 고객 리뷰 패키지 등 정보 눈 확인 수 검색 창 thehurycom 입력 더 리 제주 지점 스튜디오 촬영 진행 클래식 스튜디오 컨셉 사진 문의 newyorksnapIf you are an English Speaker we can still proceed booking in English for Jeju Snap So feel free to contact usIf you are an English Speaker we can still proceed booking in English for Jeju Snap So feel free to contact us sky thehurycom,Brooklyn Bridge,"['#뉴욕커플스냅', '#newyorksnap']"
Date night in NYC starting with aperitivos at this cute little gem in West Village barpisellino Highly recommend to get quick drinks before heading out to dinner 뉴욕 데이트 나이트 시작 저녁 먹기 전 페리 티보 웨스트빌리지 이 곳 분위기 유럽 감성 물씬 Date night in NYC starting with aperitivos at this cute little gem in West Village barpisellino Highly recommend to get quick drinks before heading out to dinner,Bar Pisellino,[]
요 피드 후회 막심 이번 뉴욕 여행 하일 라이트 틴 빌딩 소개 올해 South Seaport 쪽 eataly 곳 좀 더 현대 Jean George 의 기획 개 층 레스토랑 카페 리테일 대거 입점 마켓 레이스 고 메 식 재료 그릇 다다 집 소 환각 이번 여행 쇼핑 금지 눈 에피 뉴욕뉴욕 여행 신상 핫 천국 성비 맛집 뉴욕 맛집 뉴욕 핫 jeangeorges tinbuilding South Seaport eataly Jean George jeangeorges tinbuilding,Tin Building by Jean-Georges,"['#에피뉴욕', '#신상핫플', '#뉴욕맛집', '#뉴욕핫플']"
브루클린 발견 곳,윌리엄스버그,[]
치비 티비 글로벌 혼방 편 유튜브 치비 티비 통해 뉴욕 생활 전 곳 가면 뉴욕 핵인 수 상단 프로필 영상 확인,맨해튼,[]
뷰 맛집 뉴욕 댁 nyanna j 느무 우리 꼭 능력 여자 신여 똑띠 나혜 항상 응원 덕분 원데이 뉴요커 nyc manhattan via hudsonriverview 뉴욕 리버 뷰 대구 레이크 뷰 뉴욕뉴욕 뉴욕 일상 뉴욕 뷰 맛집 맨하탄 뷰 허드슨 강뷰 뉴요커 일상 뉴욕 부동산 뉴욕 여행 뉴욕 핫 뉴욕 맛집 nyanna j nyc manhattan via hudsonriverview,맨해튼,"['#manhattan', '#뉴욕에선리버뷰', '#뉴욕뉴욕', '#뉴욕일상', '#맨하탄뷰', '#뉴요커일상', '#뉴욕핫플', '#뉴욕맛집']"
자기야 우리 오늘 둘 사진 좀 찍 어보 쟈 마침 동네 형님 사진 부탁 사진 간 막 몇장 지금 생각 난 이쑤시개 만물 완벽 주윤발 레이디 inNYC inNYC,뉴욕,[]
,Park Hyatt New York,[]
에코 곳 여행 용 파우치 정줄 십상 A cute shop with bags and more bags PiaInNYbagall bagallnyc bagallsoho bagallsohonyc ny newyork soho sohonyc nyc shoppingnyc 소호 뉴욕 뉴욕 소호 소호 쇼핑 에코 뉴욕 쇼핑 뉴욕 핫 소호 핫 소호 탐방 백 A cute shop with bags and more bags PiaInNYbagall bagallnyc bagallsoho bagallsohonyc ny newyork soho sohonyc nyc shoppingnyc,,"['#newyork', '#뉴욕', '#뉴욕소호', '#뉴욕쇼핑', '#뉴욕핫플', '#소호핫플']"
Why bother choosing a certain chair Because that chair says something about you David Bowie 갤러리 The Future Perfect 전시 중인 The Chair 르 코르뷔 미스 반 데 로 마셀 브루어 등 건축가 의자 대체 왜 의자 대한 질문 항상 이번 이 전시 나름 답 의자 디자인 요소 기능 형태 동시 내포 행위 위 물체 형태 다양성 디자이너 그 세계 표현 최적 거기 하나 더 의자 우리 일상 신체 심리 지지 역할 우리 노곤 몸 마음 의자 잠시 간다 디자인 또 다른 요소 감성 물체 데이비드 보위 말 내 특정 의자 데 분명 그 이유 thechair thefutureperfect nycxdesign nycxdesign sohodesigndistrict nycgallery nycexhibition chairdesign lecorbusier miesvanderrohe marcelbreuer whychair oneofkind sculpture art design furnituredesign interiordesign spatialdesign designtravel 뉴욕 디자인 위 뉴욕 디자인 디자인 여행 뉴욕시티 디자인 라이프 의자 뉴욕 핫 뉴욕시티 뉴욕 생활 뉴욕라이프 Why bother choosing a certain chair Because that chair says something about you David Bowie The Future Perfect The Chair thechair thefutureperfect nycxdesign nycxdesign sohodesigndistrict nycgallery nycexhibition chairdesign lecorbusier miesvanderrohe marcelbreuer whychair oneofkind sculpture art design furnituredesign interiordesign spatialdesign designtravel,The Future Perfect,"['#뉴욕디자인위크', '#뉴욕디자인', '#뉴욕시티디자인라이프', '#뉴욕핫플', '#뉴욕시티', '#뉴욕생활', '#뉴욕라이프']"
루비 차 christmaseve at Atlantic city 낮잠 자고 아울렛 쇼핑 정글 살 rainforestcafe 저녁 레스토랑 자체 정글 안 안 동물 계속 루비 식사 안 동물 구경 넋 감 식사 its Sugar 젤리 사고 boardwalk 도 호텔 파티 루비 루비 거 오늘 크리스마스이브 크리스마스 파티 dinnermenu dinner 저녁 메뉴 추천 저녁 메뉴 뉴욕 핫 뉴저지 맛집 atlanticcity christmasparty christmas christmastrip Christmas christmastrip 정글 레스토랑 이색 레스토랑 주말 메뉴 추천 주말 메뉴 연휴 happyholiday 아이 곳 추천 아이 곳 아이 곳 아이 곳 크리스마스 여행 크리스마스 명소 크리스마스 겨울 명소 christmaseve at Atlantic city rainforestcafe its Sugar boardwalk dinnermenu dinner atlanticcity christmasparty christmas christmastrip Christmas christmastrip happyholiday,,"['#뉴욕핫플', '#뉴저지맛집']"
JoJo JoJo,JoJo Restaurant,[]
비즈 빔 이후 두번째 충격 jimini newyork jimini newyork,뉴욕,[]
전세계 인 집합소,SUMMIT One Vanderbilt,[]
뉴욕 숙소 뷰 애인 뉴욕 뉴욕 숙소 추천 뉴욕 숙소 뉴욕 핫 뉴욕 호텔 nomad arlonomad arlonomadnewyork 뉴욕 여행 nomad arlonomad arlonomadnewyork,Arlo NoMad,"['#지애인뉴욕', '#뉴욕숙소추천', '#뉴욕숙소', '#뉴욕핫플', '#뉴욕호텔']"
Selfie time 갑 셀 스타 그램 예 디 때 곳 겅 때 곳 뉴욕 맛집 리픽또 뉴욕 맛집 치 Selfie time,Hao Noodle and Tea,['#뉴욕맛집']
센트럴 파크 피크닉 with 루크 랍스터 것 꼭 뉴욕 여행 뉴욕 맛집 뉴욕 스냅 뉴욕 투어 브루클린 맨해튼 덤보 피터루거 뉴욕 화보 여행 스냅 생사 진여 혼자 뉴욕 여행 newyorktravelnewyorkphotobrooklyn 여행 뉴욕 미국여행 감성 사진 뉴욕 핫 일반인 촬영 뉴욕 일상 ilovenyctravelholic 센트럴 파크 centralparknewyorkfoodie 소호 뉴욕 여행 준비 유디 뉴욕 with newyorktravelnewyorkphotobrooklyn ilovenyctravelholic centralparknewyorkfoodie,Central Park,"['#뉴욕맛집', '#뉴욕투어', '#브루클린', '#맨해튼', '#뉴욕화보', '#newyorktravel', '#newyorkphoto', '#brooklyn', '#뉴욕', '#뉴욕핫플', '#뉴욕일상', '#센트럴파크']"
