chunked_content,place,relevant_hashtags
뉴욕 맛집 저 사라 베스 하디 맛 브런치 식당 선호 미디어 유명 세 때문 관광객 사람 서비스 질도 요 식사 마치 음식 맛 하나 기억 안나 나 핫 정도 사진 여행자 시절 사진 위 소비 이제 양하 버 그도프 백화점 층 BG 이 곳도 뉴욕 나름 인기 식당 중 곳 언제 가도 맛 서비스 곳 추천 전 때 마다 음식 다음 에프 터눈티 트 라이 팍 초록 잎 무성 때 가을 나무 단풍 때 방문 나위 곳 tmi 예약 안 자리 수 미리 예약 안내 예약 추천 제 체어 창가 단 테이블 뿐 여기 분 예약 때 yellow balloon chair 메모 밥 층 크리스마스 트리 구경 덤 뉴욕 일상 뉴욕 뉴욕 여행 bergdorfgoodman nyc BG tmi yellow balloon chair bergdorfgoodman nyc,"BG Restaurant, Bergdorf Goodman - New York City","['#뉴욕맛집저는', '#뉴욕일상', '#뉴욕', '#뉴욕여행']"
가치 상승 로스 비즈 로스 비즈 커스터 마이 징 서비스 빅데이터 계정 관리 추천 탭 확산 최적화 계정 대량 배포 젠 서비스 맞춤 상품 시간 비용 로스 비즈 커스터 마이 징 서비스 프로필 링크 클릭 상담 카네이션 풍선 와인 답례 품 새 학기 시작 뉴욕 여행 구미 단체 주문 초코 브라운 서울대 입구 필라테스 양 태반 평촌 필라테스,,[]
홀 푸드 구경 재미 요즘 블랙베리 토스트 것 홀 푸드 추천 상품 로 상 토스트 프렌치 컬쳐 드 크림 French cultured cream 주문 사워크림 신맛 살짝 나 발효 질감 조금 더 맛 버터 로 상 토스트 노릇 굽 컬쳐 드 크림 블랙베리 꿀 듬뿍 입 물 갓 커피 모금 오늘 점심 자알 내일 찌 blackberrytoast blackberry French cultured cream blackberrytoast blackberry,,[]
소나기 피해 발견 장미 아이스크림 완전 럭키 비키니 시티 구 요 뉴욕 거리 사람 왜 색감 뉴욕 사진작가 살 꿈 날 뉴욕 여행 nyc newyork newyorkuniversity ootd amorinogelato 뉴욕 nyc newyork newyorkuniversity ootd amorinogelato,New York,"['#뉴욕여행', '#newyork', '#newyorkuniversity', '#뉴욕']"
타 미스 의 뉴욕 타 미스 녹음 뉴욕 날씨 이벤트 대해 안 내 낮 최고 기온 도 안팎 최저 기온 도 안팎 한국 과 온도 뉴욕 여름 습도 한국 장마철 사실 초 선셋 경 시작 로 수록 경 해 NYC Restaurant WeekJuly Aug 내 찜 레스토랑 뉴욕 레스토랑 위 예약 방법 Broadway in Bryant ParkJuly Aug 내 뮤지컬 넘버 공원 브로드웨이 인 브라이언 트 파크 Broadway Movie NightsJuly Aug 공원 감상 영화 브로드웨이 무비 나잇 See Other of PearlAug Oct 기후 환경 위기 이야기 버넌스 아일랜드 전시 TAMICE EVENT 타 미스 준비 피 닉 매트 무료 대여 뉴욕 낭만 Photo pinterest bryant park govislandcom 정보 타 미스 블로그 안 내 뉴욕 여행 타 미스 NYC Restaurant WeekJuly Aug Broadway in Bryant ParkJuly Aug Broadway Movie NightsJuly Aug See Other of PearlAug Oct TAMICE EVENT Photo pinterest bryant park govislandcom,New York City,[]
상공간 인테리어 쇼 호스트 프로필 제주 셀프 사진관 뉴욕 여행 순천 pt 천안 꽃집 추천 평촌 필라테스 신발 여의도 요가 pt,,[]
북적 북적,"Times Square, New York City",[]
날씨 트렌치코트 주문 해주시 요즘 텀 컬러 웨이 베이지 코트 가디건 가을 조합 추천,,[]
상상 초월 미국 사립학교 학비 대학 등록금 뺨치 사립학교 사실 이번 여름 미술 선생님 취업 초등학생 알 충격 사실 제 학생 학비 무려 불 것 제 대학 등록금 수준 미국 가장 보딩스쿨 고등학교 학비 불 종교 성적 입시 특수 과목 등 이유 역시 미국 학비 클라스 다른 것 얘 너 기 툰 인스타 툰 웹툰 그림 일기 미국 뉴욕 여행 영어 뉴욕 미국여행 미국생활 미국 일상 영어 공부 개그 툰 유학생 일상 주말 소통 공감 미술 학원 그림 썰툰 학비 기록 만화,,"['#미국', '#뉴욕여행', '#영어', '#뉴욕', '#미국여행', '#미국생활', '#영어공부']"
매 여행 뉴욕 뉴욕 여행 가기 전 탑 오브 더 락 전망대 일몰 시간대 창가 인증 사진 꼭 생각 hi chocohye 언니 자리 찍 수 일몰 야경 시간대 매진 예매 모든 시간대 뉴욕 풍경 보고 것 해 주소 구글맵 탑 오브 더 락 전망대 검색 운영 시간 오전 자정 더 여행 정보 minekoo 계정 팔로우 후 minekoo minekoo hi chocohye minekoo minekoo minekoo,Rockfeller - Top of the Rock,[]
난 항상 어디 가든 오빠 출근 혼자 서도 친구 볼 것 곳도 뉴욕 물 물고기 뉴욕 사람 느낌 뉴욕 사진 날 우리 호혀니 haylienoh 데이트 날 언니 뉴욕 온갖 핫 델구 지모 뉴욕 여행 haylienoh,뉴욕,['#뉴욕여행']
가을 모던 감성 차 정원 뉴욕 무채색 스타 일링 분위기 초코 포인트 스푼 차 정원 뉴욕 여행 여행 코디 뉴욕 여행 운동화 코디 운동화 추천 에샤페,,"['#뉴욕', '#뉴욕여행']"
뉴욕 여행 야경 칵테일 한잔 로망 오늘 뉴요커 에디터 추천 뉴욕 루프 탑바 BEST 맨해튼 뷰 한눈 볼 수 바 층 입구 에스코트 입장 루프 탑 엠파이어 스테이 트 뷰 가장 루프 탑 뉴욕 여행 가기 전 장해 NubeluznubeluzbyjoseRT Rooftop Bar LoungehardrockhotelnycRefinery Rooftoprefineryrooftop 뉴욕 루프 탑바 친구 태그 BEST NubeluznubeluzbyjoseRT Rooftop Bar LoungehardrockhotelnycRefinery Rooftoprefineryrooftop,뉴욕,[]
오늘 은 미국 테러 주기 Tribute in Light 은 테러 추모 위해 제작 설치 미술 작품 요 세계 무역 센터 연출 위해 두 개 빛 기둥 배열 개 수직 탐조등 구성 이후 매년 이 빛 희생 자 기리 메시지 전달 kingy nyc hiddenny Tribute in Light kingy nyc hiddenny,,[]
뉴욕 쇼핑 리스트 BEST 뉴욕 세계 쇼핑 명소 쇼핑 체험 제공 도시 중 하나 뉴욕 아이쇼핑 마저 경험 그 잡채 뉴욕 꼭 가야 쇼핑 스팟 아이템 뉴욕 쇼핑 리스트 시리즈 소개 Glossier NYC Spring St New York NY alo Spring St New York NY ELOREA Spring St New York NY 뉴욕 지역 탐험 아이템 athome trip 확인 BEST Glossier NYC Spring St New York NY alo Spring St New York NY ELOREA Spring St New York NY athome trip,뉴욕,[]
데이트립 여행 전 역사 이야기 바퀴 고대 그리스 로마 오늘날 미국 세계 여행지 역사 사실 알 가면 더욱 뜻 여행 역사 장소 공간 리더 대한 비하인드 스토리 신간 혼란 시대 리더 통해 역사 보다송동훈 제국 리더십 데이트립 앱 여행 가기 감각 공간 제국 리더십 김영사 책 추천 베스트셀러 송동훈 미국 미국여행 데이트립 책 추천 뉴욕 뉴욕 여행 뉴욕 관광,뉴욕,"['#제국의리더십', '#미국', '#미국여행', '#뉴욕', '#뉴욕여행', '#뉴욕관광']"
강 둥둥 수영장 상상 사실 이 아이디어 벌써 가까이 곧 현실 것 Pool 플러스 풀 왜 강 수영 수 농담 질문 시작 프로젝트 최근 캐시 호쿨 뉴욕 주 지사 에릭 애덤스 뉴욕 시장 피어 를 Pool 장소 지정 개 월간 정수 시범 사업 후 여름 만 나볼 수 것 강 위 게 전부 자체 여과 시스템 수영장 하루 약 백만 리터 물 정화 수 이름 모양 플러스 풀 어린이 수영장 스포츠 수영장 랩 수영장 라운지 수영장 등 네 가지 구성 모두 위 수영장 지향 에디 트 수영장 뉴욕 여행 맨해튼 Pool Pool,,"['#매거진', '#뉴욕여행', '#맨해튼']"
,New York City,[]
NYC 차 여행 차 브이 로그 영상 이 브이 로그 편집 이상 것 이번 뉴욕 브이 로그 편 업로드 편 바로 내일 관부 여러분 쪽 뉴욕 뉴욕 여행 부베트 buvette buvettenyc 뉴욕 맛집 브라이언 트 파크 nyc newyork 브이 로그 유튜버 뉴욕 공립 도서관 NYC buvette buvettenyc nyc newyork,Buvette,"['#뉴욕', '#뉴욕여행', '#뉴욕맛집', '#브라이언트파크', '#newyork', '#뉴욕공립도서관']"
가치 상승 로스 비즈 소비자 선택 브랜드 로스 비즈 올해 IT 브랜드 파워 위 한국 최우수 브랜드 대상 수상 대한민국 브랜드 만족 지수 위 로스 비즈 빅데이터 기술 족도 SNS 마케팅 솔루션 상담 프로필 링크 클릭 에르메스 지갑 거실 서재 경기도 데이트 와인 답례 품 포니테일 진주 세차 신발 뉴욕 여행 천안 꽃집 추천 쇼 호스트 프로필 IT SNS,,[]
뉴욕 August slipped away into a moment in time August slipped away into a moment in time,,['#용히뉴욕August']
The Oculus Newyork The Oculus Newyork,The Oculus at the World Trade Center,[]
가치 상승 로스 비즈 로스 비즈 커스터 마이 징 서비스 빅데이터 계정 관리 추천 탭 확산 최적화 계정 대량 배포 젠 서비스 맞춤 상품 시간 비용 로스 비즈 커스터 마이 징 서비스 프로필 링크 클릭 상담 빈티 주얼리 뉴욕 여행 양 태반 키즈 도시락 신발 순천 pt 제주 셀프 사진관 유지 터 식단 카네이션 풍선 여의도 요가 pt,,[]
회사 in New York 마지막 편 시차 적응 트럼프 저격 격동 시기 새벽 회사 온 부재 전화 보고 마음 철렁 누구 고 한국 오후 걸 뉴욕 밥값 정말 팁 이후 덜덜 요 카드 결제 키 오스 팁 자동 계산 최첨단 발 팁 문화 인스타 툰 웹툰 일상 툰 일상 만화 회사 만화 회사 직장 인스타그램 회사 스타 그램 여행 뉴욕 여행 모마 모마 스토어 메트로폴리탄 박물관 그림 베이글 미슐랭 가격 팁 계산 in New York,,"['#뉴욕여행', '#모마스토어']"
작년 말 퇴사 기념 간 뉴욕 여행 브이 로그 프로필 상단 httpsyoutubeRIN ETuHjBI httpsyoutubeRIN ETuHjBI,,['#뉴욕여행']
뉴욕 베이글 수 도시 여기 베이글 저기 베이글 밀도 쫄깃 팝업 베이글 popupbagels 은 슈미어 듬뿍 발라 프레즐 갓 베이글 시나몬 향 시나몬 슈가 슈미어 조합 매일 매일 popupbagels 뇩김 nyc popupbagels popupbagels nyc,,[]
피드 아가 사진 남편 사진 작년 두두 출장 겸 뉴욕 여행 때 사진 우리 이제 당분간 둘 어디가 Newyork 우리 사랑 도시 뉴욕 여행 Newyork,Newyork Manhattan,"['#Newyork', '#우리가사랑하는도시', '#뉴욕여행']"
인기 대도시 항공 사진 모음 유럽 북미 오세아니아 아시아 도시 각각 고유 분위기 항공 뷰 볼때 그 특징 더욱 것 여러분 분위기 가장,,[]
리버티 크루즈 타고 관광객 모드 자유의여신상 출동 사실 뉴욕 크루즈 걸 타 고민 배 자유 여신 가까이 다인 주문 리버티 크루즈 결정 날씨 맨하탄 더 덕분 난 배 제대로 태닝 유니온스퀘어 그린 마켓 과일 잔뜩 사고 원 석 악세사리 구경 의 시장 구경 쇼핑 도버 스트리트 마켓 옷 호텔 할랄 가이즈 로 마무리 역시 뉴욕 만 보 기본 사진 나 장 피드 뉴욕 일상 뉴욕 여행 뉴욕 newyork newyorkcity nyc libertycruise newyork newyorkcity nyc libertycruise,,"['#뉴욕일상', '#뉴욕여행', '#뉴욕', '#newyork', '#newyorkcity']"
새 빨 장미꽃 영화 순간 스튜디오 감성 영화 속 장면 가을 겨울 뉴욕 스냅 예약 예약 및 상품 확인 프로필 링크 확인 뉴욕 스냅 뉴욕 웨딩 뉴욕 여행 뉴욕 웨딩 스냅 뉴욕라이프 뉴욕 일상 데스티네이션 웨딩 뉴욕 스냅 사진,,"['#뉴욕스냅', '#뉴욕웨딩', '#뉴욕여행', '#뉴욕웨딩스냅', '#뉴욕라이프', '#뉴욕일상', '#뉴욕스냅사진']"
애 사비 뉴욕 여행 와인 답례 품 천안 꽃집 추천 신발 순천 pt 평촌 필라테스 실버 커플링 제주 셀프 사진관 pt,,[]
뉴욕 바퀴 엠파이어스테이트 빌딩 건물 숲 뻥 센트럴 파크 뷰 한번 수 탑 오브 더락 일정 야경 못 내년 꼭 야경 보기 저녁 smithandwollensky 스테이크 정말 jmt 다음 달 한남동 하니 존버해 RockefellerCenter Rockefeller topoftherock nyc newyork 뉴욕 여행 록펠러 센터 탑 오브 더락 뉴욕 ootd smithandwollensky jmt RockefellerCenter Rockefeller topoftherock nyc newyork ootd,Rockefeller Center,"['#탑오브더락', '#newyork', '#뉴욕여행', '#탑오브더락', '#뉴욕']"
충격 뉴욕 에어비앤비 근황 지난 감소 사실 뉴욕시 특단 조치 사실 단기 렌트 금지 덕분 뉴욕 호텔 때 최고 호황 호텔 값 가까이 똥줄 에어비앤비 뉴욕시 제발 법 달라 요청 상황 에어비앤비 월세 집값 문제 원인 뉴욕시 전면 부정 에어비앤비 여러분 생각 가요 너 기 툰 인스타 툰 일상 툰 미국 미국여행 미국생활 영어 영어 공부 뉴욕 뉴욕 여행 공감 소통 주말 유학생 직장인 취준생 주말 취업 문화 개그 툰 그림 일기 웹툰 만화 뉴욕 일상 미국생활 에어비앤비 해외여행 만화 맨해튼,,"['#미국', '#미국여행', '#미국생활', '#영어', '#영어공부', '#뉴욕', '#뉴욕여행', '#뉴욕일상', '#미국생활', '#맨해튼']"
Forever a city girlnyc Forever a city girlnyc,뉴욕,[]
뉴욕 여기 피크닉 스팟 추천 내일 맑은 하늘 예상 뉴욕 뉴욕 낭만 피크닉 센트럴 파크 th Street Transverse E th St New York NY 인기 스팟 Sheep Meadow Great Lawn The Ramble 브루클린 브릿지 파크 Furman St Brooklyn NY 브루클린 브릿지 밑 공원 다운타운 눈 담 수 거 버넌스 아일랜드 Gresham Rd Brooklyn NY 피크닉 포인트 자유 여신 피크닉 TAMICE EVENT 타 미스 피크닉 매트 준비 언제 대여 사항 인스타그램 게시 글 안 내 미국 여행 타 미스 th Street Transverse E th St New York NY Sheep Meadow Great Lawn The Ramble Furman St Brooklyn NY Gresham Rd Brooklyn NY TAMICE EVENT,New York City,[]
레이어 드 코디 활용 모멘텀 제 작 마로 티셔츠,,[]
첫 뉴욕 맞이 가을 센트럴 파크 Central Park New York Central Park New York,,[]
Bada In New York newyorkcity whereshouldigo luaandbada moschino Bada In New York newyorkcity whereshouldigo luaandbada moschino,"Soho District, New York",['#newyorkcity']
Photographed by the kidol cinkwon newyork newyorktravel koreanman koreanguy 뉴욕 여행 뉴욕 일상 뉴욕 korean 교포 스타일 Photographed by the kidol cinkwon newyork newyorktravel koreanman koreanguy korean,,"['#newyork', '#newyorktravel', '#뉴욕여행', '#뉴욕일상', '#뉴욕']"
서울 호선 뉴욕 지하철 뉴욕 지하철 우리나라 호선 빌런 사람 뱀 몸 사람 타조 흉내내 사람 해먹 설치 후 잠 청 사람 사람 마주 수 퍼포먼스 뉴욕 지하철 수단 눈 거 subwaycreatures 머리 속 여행지 해외 뉴욕 여행 뉴욕지하철 서울 호선 subwaycreatures,,"['#뉴욕여행', '#뉴욕지하철', '#서울1호선']"
여러분 여행 가시 뭐 저 여행 가면 현지 마트 쇼핑 여행 때 그 나라 마트 구경 재미 수 미국 마트 감성 영화 미국 과자 스케일 다른 크기 종류 미국 마트 월마트 분 현 지인 핫 마트 사실 오늘 푸른 투어 에디터 미국 여행 꼭 한번 미국 마트 추천 마트 별로 추천 리스트 댓글,뉴욕,[]
뉴욕 지하철 영화 속 장면 더욱 다이내믹 장면 볼 수 영화 비긴 어게인 연상 케 버스킹 공연 채 분야 퍼포먼스 댄스 배틀 때론 승객 깜짝 빌런 등 구 경 거리 볼 수 운 깜짝 버스킹 진행 유명 가수 공연 수 뉴욕 여행 시 인상 지하철 퍼포먼스 댓글 공유 shaunafaulisi whatisnewyork subwaycreatures shaunafaulisi whatisnewyork subwaycreatures,,[]
뉴욕 여행 정보 완연 가을 시작 공기 의 뉴욕뉴욕 여행 최고 의 뉴욕 모든 것 날씨 및 옷차림 평균 최고 기온 도 최저 기온 도로 한국 마찬가지 가을 시기 뉴욕 이벤트 뉴욕 필름 페스티벌 New York Film FestivalLincoln Center 일리 시 콘서트 Billie Eilish ConcertMadison Square Garden 할로윈 퍼레이드 Village Halloween Parade Greenwich Village 뉴욕 액 티비 티 탑 오브 더 락 성인 일반 타임 어린이 일반 타임 성인 피크타임 어린이 피크타임 뉴욕 스냅 워킹 투어 시리즈 브루클린 선셋 스냅 워킹 투어 브루클린 브릿지 타임 아웃 마켓 반 르윈 아이스크림 팩토리 제인 회전목마 페블 비치 덤보 월화 목금 뉴욕 야경 음악 스냅 워킹 투어 플랫 아이언 메디슨 스퀘어 파크 KTOWN 엠파이어 스테이 트 빌딩 메이시스 백화점 타임 스퀘어 브로드웨이 극장 브라이언 트 파크 뉴욕 공립 도서관 목토일 다운타운 자유 여신 워킹 투어 크루즈 포함 크루즈 탑승 시 포트 풀턴 스트리트 돌진 황소 뉴욕 증권 거래소 페더럴 홀 트리니티 교회 메모 리얼 파크 오큘러스 센터 목토일 랜드마크 스냅 차량 투어 타임 스퀘어 엠파이어 스테이 트 빌딩 플랫 아이언 첼시 마켓 소호 월 스트리트 트리니티 교회 오큘러스 센터 라운드 제로 브루클린 덤보 브루클린 브릿지 파크 월화 목금 랜드마크 야경 스팟 차량 투어 타임스퀘어 사우스 스트리트 시 포트 브루클린 덤보 허드슨 야드 베슬 해밀턴 파크 평일 뉴욕 미술관 도슨 트 투어 메트로폴리탄 도슨 트 입장권 포함 모마 도슨 트 입장권 포함 상품 별 내용 예약 및 구매 앳홈트 립 홈페이지 확인 핀터레스트 nyff timeout New York Film FestivalLincoln Center Billie Eilish ConcertMadison Square Garden Village Halloween Parade Greenwich Village KTOWN nyff timeout,"New York, New York",[]
스테이크 역시 peterluger 시간 한정 곳도 것 것 뉴욕 peterluger,,[]
맨하탄 브릿지 낮 밤 이야기 하루 빛과 도시 불빛 아래 우뚝 선 맨하탄 브릿지,Manhattan Bridge,[]
뉴욕 여행 사진 Korean man in NewYork Korean man in NewYork,NYC,['#뉴욕여행']
가을 산책 목요일 자체 아무 것 안 날 모처럼 느지막 늦잠 오늘 병원 검사 것 집안일 일 닥터 오피스 곧장 집 가을 햇살 유혹 이기 못 어퍼 웨스트 방황 방앗간 mastmarket 딸기 잼 하나 사고 건너편 popupbagels 포피 베이글 사고 종종 동네 빈티 상점 휘 겨우 겨우 다시 집 길 가끔 내 맨해튼 복판 게 실감 안 때 오늘이 바로 날 언제 또 이 계절 도시 온갖 것 눈 걱정거리 산책 수 가을 날 또 뉴욕 일상 뉴욕 뉴욕 여행 뉴욕 맛집 베이글 mastmarket popupbagels,맨해튼,"['#뉴욕일상', '#뉴욕', '#뉴욕여행', '#뉴욕맛집']"
Hamburgerologist 조지 모츠 햄버거 아메리카 hamburger america 오픈 도 채 안 가게 평생 버거 연구 조지 모츠 모든 비법 햄버거 가게 명의 조지 모츠 햄버거 다큐멘터리 책 키친 카운터 양파 패티 것 버거 접시 모두 볼 수 추천 메뉴 fried onion burger 더블 패티 양파 고기랑 오클라호마 패티 바싹 패티 테두리 안 달 양파 감칠맛 진짜 여유 꼭 키친 카운터 뇩김 hamburger smashedburger nyc Hamburgerologist hamburger america fried onion burger hamburger smashedburger nyc,,[]
뉴욕 뉴욕 뉴욕 여행 미국여행 하이라인 소호 워싱턴 스퀘어,High Line,"['#뉴욕', '#뉴욕여행', '#미국여행', '#워싱턴스퀘어']"
뉴욕 친구 한식당 여러 인종 문화 공존 이민자 도시 뉴욕 식당 하루 수십 곳 뉴욕 한식 인기 던데 정말 요 결론 말 길거리 코너 하나 델리 가면 불고기 비빔밥 불닭볶음면 수 맨해튼 거주 현지 픽 실패 한식당 맛집 리스트 한식 파라 이 리스트 엄빠 뉴욕 분 더 더욱 경기도 뉴욕 뉴욕 한식 맛집 대한 더 정보 프로필 링크 확인 Contributing Writer 레미 Contributing Writer,,[]
Sunday stroll 그 준 내 사람 Sunday stroll,뉴욕,[]
타 미스 의 뉴욕 타 미스 선선 뉴욕 날씨 이벤트 대해 안 내 낮 최고 기온 도 안팎 최저 기온 도 안팎 맨 투맨 니트 가디건 재킷 등 꼭 겉옷 초 선셋 경 시작 로 갈수록 경 해 Tim Burtons The Nightmare Before ChristmasSep Nov 뉴욕 크리스마스 악몽 팀 버튼 크리스마스 악몽 FAD MarketSep Dec 뉴욕 가을 플리 마켓 FAD 마켓 Bryant Park Winter Village Oct Mar 크리스마스 윈터 브라이언 트 파크 원 터 Village Halloween Parade in NYCOct SPOOKY NIGHT 뉴욕 할로윈 퍼레이드 TAMICE EVENT 타 미스 준비 피 닉 매트 무료 대여 뉴욕 낭만 Photo pinterest wwwfadmarketco Tim Burtons The Nightmare Before ChristmasSep Nov FAD MarketSep Dec FAD Bryant Park Winter Village Oct Mar Village Halloween Parade in NYCOct SPOOKY NIGHT TAMICE EVENT Photo pinterest wwwfadmarketco,뉴욕,[]
Newyork 모음 zip 주제 Newyork ssc newyork Newyork zip Newyork ssc newyork,MTA Subway - Hoyt/Schermerhorn Sts (A/C/G),['#Newyork']
Happyday Erinday 처음 가족 태운 날 한국 토론토 온 김 아이 뉴욕 동생 역시 뉴욕 여행 시작 Porter Airlines 에린 선배 직접 조카 보딩패스 발권 보딩 타임 보딩 조카 집 핼 렐레 모습 유니폼 모습 보더 이모 이모 연발 날씨 걱정 뉴욕 가면 강행 다리 너 무소식 희소식 려니 중 유니폼 에린 선배 토론토 스릴 스 일인자 가족 여행 보딩 타임 공항 이야기 뉴욕 여행 포터 항공사 porterairlines ewr newyorkcity airportlife canadalife 캐나다 워킹맘 Happyday Erinday Porter Airlines porterairlines ewr newyorkcity airportlife canadalife,토론토,"['#뉴욕여행', '#newyorkcity']"
날 뉴욕 날 센트럴 파크 정답 우리 충분 Photo by liebe moa NEWYORK SNAP 촬영 문의 프로필 링크 or contact DM 카카오 톡 채널 liebesnap 검색 wedding snap sample 리베 웨딩 Newyork wedding snap sample 리베 뉴욕 liebeinnewyork Photo by liebe moa NEWYORK SNAP or contact DM liebesnap wedding snap sample Newyork wedding snap sample liebeinnewyork,"Central Park, New York","['#리베인뉴욕', '#liebeinnewyork']"
전망대 별거 일몰 감탄,Top of the Rock NYC,[]
뉴욕 여행 커피한잔 휴식,,['#뉴욕여행']
뉴욕 도착 자마자 짐 풀 물이 편의점 미리 아마존 주문 논 샤크 헤어 스타 도 로비 픽업 제 일 미국 집 굳이 v 로 또 주 문 햇 샤크 강추 샤크 헤어 스타 이번 달 곰 부인 곧 곰 부인 뉴욕 뉴욕 여행 호피 v,뉴욕,['#뉴욕여행']
일주일 뉴욕 중 하루 비 비 모마 비 날 관광객 마음 더 포기 트 레이더 조 방문 요즘 미국 인기 한국 냉동 김밥 중순 인기 실감 구경 시간 마트 처 어유 트 레이더 조 처음 홀 푸드 또 다른 매력 개미지옥 오늘 아침 한국 도착 이제 또 시차 시차 적응 못 또 시차 못 사진 당분간 뉴욕 이야기 도배 maji nyc 뉴욕 여행 maji nyc,"Trader Joe's-New York,NY",['#뉴욕여행']
월 스트리트 사람 금요일 이 옷 정체 창조 발상 일 모든 크리에이터 길잡이 책 서울 옥션 이호재 회장 뉴욕 감각 뉴욕 뉴욕 여행 뉴욕 곳 뉴욕 일상 뉴요커 라이프스타일 미국 미국여행 브랜드 도시 도시 추천 브랜딩 공간 여행 해외여행 마케팅 마케팅 공부 마케터 일상 파타고니아 월스트리트 비즈니스 이슈 다산 북스 화요일 꿀잼,,"['#뉴욕의감각', '#뉴욕', '#뉴욕여행', '#뉴욕가볼만한곳', '#뉴욕일상', '#뉴요커', '#미국', '#미국여행', '#도시', '#도시추천', '#월스트리트', '#다산북스']"
뉴욕 식당 뮤지컬 수 뮤지컬 가장 곳 뉴욕 브로드웨이 현역 배우 뮤지컬 지망 생 노래 빙하 뮤지컬 레스토랑 거 배우 정해 인도 방문 감탄 곳 푸른 투어 에디터 나 뮤지컬 레스토랑,Broadway Manhattan NY,[]
미국 동부 뉴욕주 소개 일상 속 휴식 뉴요커 볼 수 뉴욕 도시 공원 센트럴 파크 세계 메트로폴리탄 미술관 방문 개 대학 뉴욕주 탐방 studynewyorkusCentralParkNYC metmuseum NiagaraFallsUSA 미국 지역 탐방 뉴욕 뉴욕 유학 뉴욕 대학 뉴욕 여행 미국 유학 미국 대학 NewYork EducationUSA StudywithUS ExchangeOurWorld StudyAbroad studynewyorkusCentralParkNYC metmuseum NiagaraFallsUSA NewYork EducationUSA StudywithUS ExchangeOurWorld StudyAbroad,,"['#미국지역탐방', '#뉴욕', '#뉴욕유학', '#뉴욕대학', '#뉴욕여행', '#미국유학', '#미국대학', '#NewYork']"
COS 해외 출장 두번째 뉴욕 행복 michelle jeon 미쉘 출장 늘 옷 선물 주시 항상 파리 뉴욕 로마 뉴욕 번의 출장 동안 뉴욕 이제 마지막 말 출발 더더 더 완전 응원 I LOVE COS editork 경미 실장 메인 사진 영 대님 사진 COSAW COS michelle jeon I LOVE COS editork COSAW,Newyork,[]
뉴욕 여행 시 고양이 머리 집사 적 가요 이 집사 고양이 머리 모습 눈 뉴욕 아이콘 SNS 인기 끌 를 지불 사진 뉴욕 여행 계획 참고 libraries SNS libraries,,[]
가을 방법 ver 가을 뉴욕 여행 진행 채 이벤트 소개 허드슨 야드 무비 나이트 Movie Nights at Hudson Yards 금요일 PM Hudson Yards New York NY 랩 다크 매 터 Mercer Labs Dark Matter Dey St New York NY 콜럼버스 데이 퍼레이드 Columbus Day Parade st th Avenue 센트럴 파크 피크닉 Picnic in Central Park Central Park NY 자유 여신 생일 The Statue of Libertys Birthday 브라이언 트 파크 윈터 Bryant Park Winter Village Bryant Park NY average socialite amNewYork mercerlabs ver Movie Nights at Hudson Yards PM Hudson Yards New York NY Mercer Labs Dark Matter Dey St New York NY Columbus Day Parade st th Avenue Picnic in Central Park Central Park NY The Statue of Libertys Birthday Bryant Park Winter Village Bryant Park NY average socialite amNewYork mercerlabs,"New York, New York",[]
