chunked_content,place,relevant_hashtags
at a romantic place nycfairy LaMercerieCafeTribecaFrenchlatergram cafe nyccafe newyork romatic daily potd nyc coffee dessert manhattan citylife nycrestaurant interior america travel 뉴욕 맨하탄 트라이베카 뉴욕 카페 뉴욕 핫 미국 여행 데 일리 언제 오버 프라 이스 늘 한국 거 손님 때 만가 곳 결론 at a romantic place nycfairy LaMercerieCafeTribecaFrenchlatergram cafe nyccafe newyork romatic daily potd nyc coffee dessert manhattan citylife nycrestaurant interior america travel,,"['#nycfairy2020', '#newyork', '#manhattan', '#citylife', '#nycrestaurant', '#뉴욕', '#맨하탄', '#뉴욕카페', '#뉴욕핫플']"
뉴욕 x 뉴웩 현실 칼 친 뉴욕 여행 뉴욕 핫 핫 레이스 뉴욕 투어 thevessel 베셀 맨하탄 뉴욕 스냅 뉴욕 맛집 뉴욕 곳 instadaily photography 일상 소통 데 일리 여행 스타 그램 dailypic daily x thevessel instadaily photography dailypic daily,,"['#뉴욕', '#뉴욕핫플', '#핫플레이스', '#뉴욕투어', '#맨하탄', '#뉴욕맛집', '#뉴욕가볼만한곳']"
칵테일 맛집 우리 즐거움 사진 서울 살롱 seoulsalon seoulsalonnyc 뉴욕 술집 뉴욕 핫 뉴욕 칵테일 바 칵테일 바 seoulsalon seoulsalonnyc,SEOUL SALON NYC,"['#뉴욕술집', '#뉴욕핫플']"
You know that scene from ratatouille where the food critic is transported to his childhood That exact moment happened for me at atomixnyc the first time around and continues to do so even at their latest bar tasting menu Still our favorite restaurant and the perfect place to celebrate our anniversary You know that scene from ratatouille where the food critic is transported to his childhood That exact moment happened for me at atomixnyc the first time around and continues to do so even at their latest bar tasting menu Still our favorite restaurant and the perfect place to celebrate our anniversary,Atomix NYC,[]
직업병 포스팅 일정 두 번 방문 샵 Fueguia 푸아그라 거위 생각 요즘 소호 샵 취향 저격 일정 두 세번 더 것 여기 왜 면 고객 경험 디자인 제품 브랜드 스토리텔링 서자 바 사이즈 평 내외 가운데 테이블 위 어림 병 정도 바틀 저 플라스크 채 디스플레이 왼쪽 오른쪽 floral musk amber green leather wood 순 달달 여성 향 드라이 남성 향 진열 각 카테고리 안 또 musk 저런 조합 가지 채 musk 볼 수 이 직관 논리 디스플레이 응 좀 거 손님 입장 향수 종류 보통 보기 경우 이유 조향사 보통 너 낌 지은 이름 바틀 또 너 낌 디스플레이 때문 고객 그 앞 밖 자신 취향 바로 것 가능 향수 대한 취향 개인 이기 때문 점원 거 안 영역 더군다나 바틀 위 플라스크 바로 향 확인 일반 향수 매장 손님 하나 하나 점원 질문 뚜껑 보통 점원 시 향 이 역시 개 정도 보고 더 테스트 보고 말 더군다나 향 탑 노트 잔향 막 종이 실제 향 확률 음 거기 다가 또 그 시 향 종이 냄새 겹 향 마지막 구조 번 손님 우르르 응대 직원 필요 거 정말 중요 거 고 정비 것 그 이상 여기 소호 매장 나 오 다가 손님 매장 직원 명 뿐 질문 거리 응대 거리 처음 것내 그동안 브랜딩 매장 설계 때 생각 부분 구현 매장 매장 정석 정석 덕분 코 마비 때 하나 브랜드 향 얘기 거 포스팅 다음 나 왜 말 fueguia 향수 향수 스타 그램 Fueguia floral musk amber green leather wood musk musk fueguia,,[]
더 리 의상 새 파란 하늘 매치 더욱 소호 의상 분위기 낼 수 뉴욕 처음 오시 분 의상 고민 거 더 리 날씨 의상 소품 모두 신경 예약 말씀 newyorksnap 뉴욕 스냅 더 리 현재 파리 스냅 오픈 기념 이벤트 접수 선착순 기회 에펠탑 사진 게시 물 참고 더 리 패키지 현재 이벤트 진행 중 신청서 확인 촬영 문의 카카오 톡 ID sky 로 홈페이지 포트폴리오 고객 리뷰 패키지 등 정보 눈 확인 수 검색 창 thehurycom 입력 newyorksnap ID sky thehurycom,Soho Nyc,"['#newyorksnap', '#뉴욕개인스냅']"
newyork newyork,SUMMIT One Vanderbilt,['#newyork']
초 grimaldis pizza 레이디 inNYCbrooklyn grimaldis pizza inNYCbrooklyn,,['#brooklyn']
주말 뭐 서울 무료 전시회 사진 보고 뉴욕 여행 지금 바로 전시회 친구 태그 LOCA 주년 기념 사진전 LOCA in NEWYORK 인증샷 이벤트 참여 뉴욕 왕복 항공권 당첨 기회 LOCA in NEWYORK 인증샷 이벤트 참여 기간 경품 인천 뉴욕 왕복 항공권 본인 인 동반 인 명 라이카 Compact 엔트리 카메라 명 투썸플레이스 뉴욕 치즈 피스 아메리카노 R 잔 명 당첨 발표 중 개별 DM 안내 참여 방법 lottecardofficial 계정 팔로우 LOCA in NEWYORK 전시회 방문 인사동 갤러리 인사 insa gallery 뉴욕 여행 온 듯 인증샷 찍기 본인 인스타그램 계정 아래 필수 해시태그 달 업로드 참여 완료 카 로카 사진전 로 카인 뉴욕 롯데 카드 사진 영상 모두 참여 비공개 계정은 당첨 선정 제외 초과 경품 대한 제 세 공과금 은 롯데 카드 부담 경품 가액 당첨 자의 기 타 소득 산정 경품 발송 및 제 세 공과금 신고 위해 개인정보 취급 및 제 자 개인정보 제공 동의 반드시 참여 롯데 카드 마케팅 활용 수 당첨 인스타그램 DM 개별 안내 기한 내 경품 제공 정보 전달 경우 당첨 취소 수 부정 방법 이벤트 참여 시 당첨 취소 수 경품 제 공일 참여 게시 물 유지 삭제 시 당첨 취소 수 경품 뉴욕 왕복 항공권 타인 양도 예약 후 변경 및 취소 수 국제선 항공권 항공권 예약 시 유류 할증 료 세금 당첨 본인 부담 경품 라이카 카메라 엔트리 라인 컴팩트 카메라 중 종 배송 경품 당첨 연락처 띵샵 선물 안내 메시지 쿠폰 유효 기간 만료 재 발송 기간 내 수령 사용 당첨 발표 일과 상품 롯데 카드 사정 사전 공지 변경 수 준법 감시인 심의 필 제 E 호 울 핫 사진 맛집 사진 핫 뉴욕 핫 서울 무료 전시회 종로 무료 전시 서울 데이트 코스 무료 전시 무료 전시 종로 핫 인사동 갤러리 인사동 전시회 안국역 안국동 인사 안국동 데이트 카 DIGILOCA 로카 주년 LOCA LOCA in NEWYORK LOCA in NEWYORK Compact R DM lottecardofficial LOCA in NEWYORK insa gallery DM E DIGILOCA,,"['#로카인뉴욕', '#서울핫플', '#뉴욕핫플', '#종로핫플']"
미키마우스 의 뉴욕 미니마우스 인형 자유 여신 미국 대표 랜드마크 자유의여신상 옷 미키마우스 bydear my youth 여행자 이야기 공유 공간 여행 제보 여행 이유 태그 여행 이유 해외 여행 이유 미국 미국여행 미국 자유여행 뉴욕 여행 뉴욕 곳 뉴욕 신상 카페 뉴욕 핫 미국 남부 여행 미국 동부 여행 미국여행 추천 미국 달 살기 뉴욕 일상 미국 디즈니랜드 여행 여행 스타 그램 여행지 추천 유럽 여행 해외 곳 해외여행 꿀팁 꿀팁 정보 해외여행 여행 이유 해외 휴양지 해외여행 추천 해외여행 추천 여름 휴가 유럽 여행 추천 bydear my youth,,"['#뉴욕가볼만한곳', '#뉴욕신상카페', '#뉴욕핫플', '#뉴욕일상']"
뉴욕 카페 BEST 뉴욕 여행 카페 순 그냥 카페 노노 커피 맛집 분위기 맛집 소개 Odd Fox Coffee Manhattan Ave Brooklyn NY Cafe Grumpy Meserole Ave Brooklyn NY Conwell Coffee Hall Hanover St New York NY 핀터레스트 conwellcoffeehall cafegrumpy BEST Odd Fox Coffee Manhattan Ave Brooklyn NY Cafe Grumpy Meserole Ave Brooklyn NY Conwell Coffee Hall Hanover St New York NY conwellcoffeehall cafegrumpy,New York City,[]
뉴욕 맨해튼 브릿지 위 브루클린 브릿지 브루클린 쪽 맨해튼 스카이라인 제인스 캐 러셀 바닐라 스카이 손톱 달 맨해튼 브릿지 메트로 다리 주 기적 동안 촬영 가능 sunsetphotography newyork brooklynbridge sunset nightphotography nightsky vanillasky magichour sunsetofnewyork travelphotography newyork ig travelnewyork nyc 야경 스타 그램 노을 바닐라 스카이 매직 워 뉴욕 핫 브루클린 브릿지 뉴욕 야경 뉴욕 여행 여행 스카 그램 sunsetphotography newyork brooklynbridge sunset nightphotography nightsky vanillasky magichour sunsetofnewyork travelphotography newyork ig travelnewyork nyc,Manhattan Bridge,"['#newyork', '#brooklynbridge', '#newyork', '#뉴욕핫플', '#브루클린브릿지', '#뉴욕야경']"
필카 감성 사람,Time Out Market New York,[]
여행 미국 뉴욕 눈 핫 전망 대마국 뉴욕 밋 더 빌트 E nd St New York NY 미국 시간 SUMMIT Experience 입장료 요즘 뉴욕 여행가 꼭 필수 핫 스피드 고속 엘리베이터 먼저 전망대 층 왓 뉴욕 전경 것 이 기분 기존 전망대 모두 유리 스릴 up 실버 벌룬 더 분위기 이 곳 치마 하이힐 바지 신발 추천 OMG 바로 시티 뷰 iamjayoung 의 여행 일기장 여행 로 우리 여행 일기장 의 여행 제보 프로필 링크 그룹 의 여행 사진 여행 태그 여행 에디터 여행 해외 여행 미국 travelmenu 미국 미국여행 뉴욕 뉴욕 여행 뉴욕 전망대 뉴욕 핫 미국여행 미국 곳 뉴욕 여행 추천 해외여행 밋 더 빌트 TRAVEL TREAVELUSA summitonevanderbilt summitone summitov E nd St New York NY SUMMIT Experience up OMG iamjayoung travelmenu TRAVEL TREAVELUSA summitonevanderbilt summitone summitov,,"['#뉴욕', '#뉴욕전망대', '#뉴욕핫플', '#뉴욕여행추천']"
루즈벨트 아일랜드 산책 세상 뉴욕 맨하탄 잠시 휴식 취하 루즈벨트 아일랜드 가세 자 연속 오리 가족 만날 수 곳 관광객 사람 장소라 사람 별로 여유 산책 사진 찍기 트램 타고 것 추천 하늘 뉴욕 전망 수 트램 안 인생 샷 수 배차 간격 상대 가격 편도 달러 운영 시간 일 목 금토 Roosevelt Island Tramway E th St NY 뉴욕 뉴욕 여행 루즈벨트 아일랜드 루즈벨트 아일랜드 트램 뉴욕 핫 뉴욕 추천 뉴욕 추천 장소 뉴욕 꿀팁 여행 꿀팁 Roosevelt Island Tramway E th St NY,Roosevelt Island New York,"['#뉴욕', '#뉴욕핫플', '#뉴욕추천', '#뉴욕추천장소']"
분위기 영화 속 튀어 듯 밴드 groovelivemusic 뉴욕 재즈 바 뉴욕 라이브 바 뉴욕 핫 뉴뇩살 groovelivemusic,Groove,"['#뉴욕재즈바', '#뉴욕핫플', '#뉴뇩살이']"
Greenpont is NEW Brooklyn 지원이 때 폴란드 사람 그린포인트 지금 브루클린 최고 핫 전 윌리엄스버그 느낌 라미레즈 여기 로컬 추천 멕시코 정통 타코 거기 거기 걸 타코 단돈 불 only cash 전날 Per Se 기억 자리 식당 ramirez 뉴욕 핫 brooklyngreenpoint 뉴욕 맛집 Greenpont is NEW Brooklyn only cash Per Se ramirez brooklyngreenpoint,Greenpoint N.Y.,"['#뉴욕핫플', '#brooklyngreenpoint', '#뉴욕맛집']"
apastabar W Broadway New York NY 예전 저장 곳 기대 맛 파스타 순서대로 트러플 피자 왕 재 방문 의사 jihoinnewyorkcity apastabar W Broadway New York NY jihoinnewyorkcity,A Pasta Bar,[]
NEW YORK 뉴욕뉴욕 맛집 올리브 가든 이탈리아 음식 길 발견 아이스크림 푸드 트럭 Hey come on 갑자기 제시 우리 원래 알 사이 어디 여행 핫 맛집 소개 해주시 재미나 잠시 여유 달달 아이스크림 젠 또 마스크 일상 뉴욕 일상 빵 빠레 아이스크림 요원 제주도 출발 지금 고속도로 타고 슝슝 시간 태풍 찬투 때문 배 지연 출발 못 찬투모 피해 바 모든 계획 머리 하늘 뜻 려니 내일 오후 출발 얼마나 다행 모두 무 하루 바 요 빵 빠레 달달 과자 몇개 자 시간 화이팅 뉴욕 여행 미국여행 미국 랜선 여행 뉴욕 버거 뉴욕 랜드마크 뉴욕 핫 뉴욕 월스트리트 뉴욕시티 newyorklife newyork 미국 쉑쉑 버거 미국 푸드 트럭 미국 푸드 트립 뉴욕 푸드 트럭 unitedstatestravel unitedstates 미국 동부 여행 여행 추천 해외여행 스타 그램 일상 여행 뉴욕 맛집 투어 뉴욕 맛집 추천 뉴욕 맛집 리브가 NEW YORK Hey come on newyorklife newyork unitedstatestravel unitedstates,,"['#뉴욕버거', '#뉴욕랜드마크', '#뉴욕핫플', '#뉴욕시티', '#newyorklife', '#newyork', '#뉴욕맛집투어', '#뉴욕맛집추천']"
내 살 모든 와중 수빈 예 약 덕 기분 전환 torrisi 미슐랭 스타 레스토랑 torrisi carbone 레스토랑 호텔 등 운영 majorfoodgroup 의 명의 업자 중 한명인 셰프 자기 이름 레스토랑 수빈 줌 오늘 음식 carbone 도 구글 후기 사진 퍼옴 그릇 눈 런던 빅마마 그룹 글로리아 식당 종류 그릇 사용 것 발견 이탈리아 데루타 지역 rooster 시리즈 핸드 페인 팅 그릇 carbone 파스타 소스 이탈리아 그릇 음식 보이 가사 하나 생각 하루 뉴욕 핫 맨해튼 맛집 torrisi torrisi carbone majorfoodgroup carbone rooster carbone,Torrisi Bar and Restaurant,"['#뉴욕핫플', '#맨해튼맛집']"
대학 친구 홍 민정 아나운서 유투 버 뉴욕 생활 차 뉴욕 정보 공유 계정 팔로 팔로 홍 mj mj,,[]
NYC JFK nomosoho 뉴욕 핫 만 소호 맛집 NYC JFK nomosoho,NoMo SoHo,"['#NYC', '#뉴욕핫플']"
뉴욕 핫 maman 커피 맛집 빵 맛집 아기자기 코지 분위기 한번 빵맛 번 곳 피스타치오 초콜릿 크로와상 정말 강추 겉바 속 촉 아몬드 크로와상 피스타치오 초콜릿 크로와상 콜드 브루 almondcroissant pistachiochocolatecroissant coldbrew coffee newyorkcafe maman almondcroissant pistachiochocolatecroissant coldbrew coffee newyorkcafe,Maman,['#뉴욕핫플']
온더로드 NY 요즘 유행 뉴욕 핫 인스타 감성 맛집 와인 바 랜드마크 TOP 해지 뉴욕 맞이 가기 곳 NY TOP,"New York, New York",[]
Oiji 오이지 뉴욕 이스트빌리지 모던 코리안 식당 며칠 전 피터 루거 스테이크 하우스 혹평 뉴욕타임즈 음식 평론가 Pete Wells 그 펜끝 레스토랑 천국 지옥 별 개 선사 극찬 레스토랑 뉴욕 어쩌면 미슐랭 더 신뢰 것 뉴욕타임즈 레스토랑 리뷰 별 점 인의 창의 열정 셰프 브라이언 킴 구태경 곳 주인공 한식 본질 메뉴 해석 힘 장난 치 더 브라이언 셰프 밤 이야기 레스토랑 경쟁 뉴욕 위해 셰프 거의 목숨 한식 미래 영 셰프 걱정 생각 기분 저녁 오이지 oiji 뉴욕타임즈 뉴욕 핫 브라이언 킴 셰프 구태경 셰프 누 메뉴 메뉴 사진 은 뉴욕타임즈 기사 Oiji Pete Wells oiji,OIJI MI,['#뉴욕핫플']
바리스타 자격증 친구 커피빈 추천 La Cabra 를 추천 걸 뉴욕 작년 요새 제일 핫 베이커리 카페 당장 커피빈 아무 생각 계산 이 깜쪽 주먹 커피빈 개 커피 알 못 저 마음 빵 또 금방 여기 제일 Cardamom Bun 커피빈 안 사고 그냥 빵 커피 곳 사람 운 수 해 La Cabra Cardamom Bun,La Cabra NYC,[]
베슬 포토 스팟 여기 워낙 한번 자꾸 베슬앞 마여 vesselhudsonyards 베슬 허드슨 야드 뉴욕 핫 달콤 뉴욕 vesselhudsonyards,The Vessel NYC,"['#뉴욕핫플', '#달콤인뉴욕']"
캐리어 정리 사진 정리 언제 다하지써밋 날 날씨 요정 날,SUMMIT One Vanderbilt,[]
오늘 버드 모드 눈 시티 씐났다 간만 핫 샐러드 꿀맛 dailysaturdayvibeseggshopnycsohohipplacebruncheggnavothaicomhangoutdminilife 일상 샵 맨하탄 뉴욕 dmini 라이프 꿀맛 뉴욕 핫 뉴욕 일상 뉴욕 맛집 주말 나들이 dailysaturdayvibeseggshopnycsohohipplacebruncheggnavothaicomhangoutdminilife dmini,Egg Shop NYC,"['#간만에핫플', '#맨하탄', '#뉴욕', '#뉴욕핫플', '#뉴욕일상', '#뉴욕맛집']"
nusretsteakhouse 한국 유명 고깃집 아들 램 추천 방문 누 스렛 스테이크하우스 moma 뉴욕 현대 미술관 바로 앞 터키인 오 너 쉐프 소금 과장 액션 혹시 비주 얼 인스타 맛집 걱정 세계 고깃집 모두 그 집 아들 램 추천 이유 맛 양념 식 재료 소금 중요시 내 취향 글 글 버터 누스렛 스페셜 안심 거의 인생 스테이크 수준 거 한국 인기 듯 후식 moma 앞 길거리 스벅 뉴욕 맛집 뉴욕 여행 뉴욕 핫 스테이크 맛집 newyork travelstagramnewyorkhotplace nusretsteakhouse moma moma newyork travelstagramnewyorkhotplace,Nusr-Et Steakhouse New York,"['#뉴욕맛집', '#뉴욕핫플', '#newyork', '#newyorkhotplace']"
Joes Pizza joes Pizza Pino Joe Pozzuoli Joes Pizza joes Pizza Pino Joe Pozzuoli,Joe's Pizza,[]
Enjoying the warm weather with bae 예전 보고 Mediterranean 맛집 Branzino 도 dip 도 Pita bread 한번 더 리필 순식간 둘이서 흡입 Enjoying the warm weather with bae Mediterranean Branzino dip Pita bread,Miss Ada,[]
만 뉴욕 뉴욕 만 루프 탑 멤버 뉴욕 또 뉴욕 핫 루프 탑 매니아,뉴욕,['#뉴욕핫플']
뉴욕 사랑,SUMMIT One Vanderbilt,[]
에이스 호텔 디자인 로만 앤 윌리엄스 rwguild 운영 곳 리빙 레스토랑 소호 lamerceriecafe nycrestaurantnycbusinesstripvillatov 뉴욕 핫 nyc villatov rwguild lamerceriecafe nycrestaurantnycbusinesstripvillatov nyc villatov,La Mercerie,['#뉴욕핫플']
분위기 굿 피날레 노모 키친 뉴욕 핫 뉴욕 여행 나니 newyork newyork,NOMO Kitchen,['#뉴욕핫플']
요새 여기 인스타그램 핫 라며 차차차 뉴욕 뉴욕 여행 뉴욕 맛집 차차 마차 뉴욕 차차 마차 chachamatcha chachamatchanyc 뉴욕 핫 뉴욕 핫 레이스 뉴욕 여행 코스 ny nycafe 일상 소통 맞팔 소통 맞팔 chachamatcha chachamatchanyc ny nycafe,Cha Cha Matcha,"['#뉴욕', '#뉴욕맛집', '#뉴욕차차마차', '#뉴욕핫플', '#뉴욕핫플레이스', '#뉴욕여행코스', '#nycafe']"
분위기 프렌치 레스토랑 boucherienyc 요새 피드 종종 보 곳 한번 벌써 기회 지점 군데 인테리어 나름 steaktartare 거 진짜 추천 템 약간 와사비 맛 완전 킥 메 츄리 알 귀욤 escargot 처음 달팽이 요리 골뱅이 산낙지 마당 달팽이 바질 파슬리 향 양념 맛 eggsbenedict 식당가 평타 메뉴 무난 천장 뚤려있어 채광 서비스 인테리어 음식 단지 흠 라면 테이블 간격 좀 웨스트 지점 층 자리 층 나름 직함 점심 저녁 메뉴 재 방문 의사 westvillage greenichvillage nycfoodie nycbrunch 달팽이 요리 프렌치 레스토랑 뉴욕 맛집 뉴욕 일상 뉴욕 여행 팔 주말 스타 그램 westvillagefood boucherie frenchnyc 뉴욕 먹방 뉴욕 핫 뉴욕 브런치 boucherienyc steaktartare escargot eggsbenedict westvillage greenichvillage nycfoodie nycbrunch westvillagefood boucherie frenchnyc,Boucherie,"['#nycfoodie', '#뉴욕맛집', '#뉴욕일상', '#뉴욕먹방', '#뉴욕핫플', '#뉴욕브런치']"
브런치 쫌 핫 뉴욕 브런치 재 방문 여기 쫌맛 여 뉴욕 맛집 뉴욕 핫 플루 비 스카 페달 콤 뉴욕 foodpornnycfoodiesnyceats foodpornnycfoodiesnyceats,Little Ruby's Cafe,"['#뉴욕브런치', '#뉴욕맛집', '#뉴욕핫플', '#달콤인뉴욕']"
스타벅스 리저 브 로스 터리 첼시 마켓 점 뉴욕뉴욕 스타벅스 첼시 마켓 옆 리저 브 로스 터리 매장 구경 곳 뉴욕 가장 스타벅스 구경 좀 일단 매장 원두 기계 정말 크게 자리 잡고 천장 원두 사람 촬영 라인 별로 커피 종류 판매 리저 브 원두 종류 층 커피 주제 Bar 도 술 커피 칵테일 굿 상품 텀블러 뿐 의류 시계 등 굿 상품 판매 구경 Bar,,[]
The prettiest beach in New York The prettiest beach in New York,"67 Steps Beach Greenport, Ny",[]
littleislandnyc littleisland 알콩 리본 뜬금 뉴욕 핫 littleislandnyc littleisland,Little Island NYC,['#뉴욕핫플']
신랑,Serra By Birreria,[]
Happy anniversary 미슐랭 스타 일레븐 메디슨 파크 오늘 얼마 뉴욕 핫 브런치 원래 달 번만 먹기 다짐 일주일 한번 바꿈 여자 여기 분위기 조 코 음식 JMT 세상 부부 것 서로 점 이해 그냥 결혼 주년 결혼기념일 뉴욕 부부 뉴욕 핫 뉴욕 맛집 부부 스타 그램 nycbrunch Happy anniversary JMT nycbrunch,RH Rooftop Restaurant,"['#뉴욕핫플', '#뉴욕맛집']"
Aught New York opening hoursWednesday Sunday pm Aught New York opening hoursWednesday Sunday pm,,[]
Thursday night with ma girls 모히또 루프 탑 한잔 뉴욕 루프 탑바 뉴욕 일상 루프 탑바 rooftopbar rooftopbarnyc cocktails 칵테일 뉴욕 핫 thetopofthestandard nyc ootd 티디 selfie Thursday night with ma girls rooftopbar rooftopbarnyc cocktails thetopofthestandard nyc ootd selfie,Top of the Standard,"['#뉴욕루프탑바', '#뉴욕일상', '#뉴욕핫플']"
New York SOHO my kind of areasoho newyork 뉴욕 핫 citywalk streetstyle outfitinspiration ootd style fashion girlstyle stylecreator getthelook model streetfashion ringeriscool 그냥 New York SOHO my kind of areasoho newyork citywalk streetstyle outfitinspiration ootd style fashion girlstyle stylecreator getthelook model streetfashion ringeriscool,New York,"['#newyork', '#뉴욕핫플', '#citywalk']"
urbantae 덕분 온 atoboynyc 또 남편 감사 고구마 밥 자꾸 치킨 jmt 뉴욕 핫 스타 그램 koreanfrench instafood atoboy nyc newyork urbantae atoboynyc jmt koreanfrench instafood atoboy nyc newyork,Atoboy,"['#뉴욕핫플', '#newyork']"
나 왓 당초 바니 뉴욕 브런치 뉴욕 핫 인스타 핫 초 바니 chobani chobanisoho newyork soho 뉴욕 여행 뉴욕 맛집 chobani chobanisoho newyork soho,Chobani Soho,"['#뉴욕브런치', '#뉴욕핫플', '#newyork', '#뉴욕맛집']"
시카고 커플 썬데이 브런치 해장 샴페인 nomosoho 뉴욕 브런치 뉴욕 맛집 뉴욕 여행 뉴욕 핫 브런치 맛집 신혼 생활 신혼 일상 nycbrunch nomosoho nycbrunch,NoMo SoHo,"['#뉴욕브런치', '#뉴욕맛집', '#뉴욕핫플']"
예술 레이어 드 보고 감탄 또 감탄 로 상 뉴욕 핫 뉴욕 일상 오늘 뉴욕 디저트 맛집 슈퍼문 베 이크 하우스 제 한번,Supermoon Bakehouse,"['#뉴욕핫플', '#뉴욕일상']"
뉴욕 루프 탑 추천 분위기 진짜 사람 뷰 황홀 화장실 야외 뷰 꼭 해,,[]
뉴욕 여행 자유의여신상 자유 여신 페리 볼 수 자유 여신 보이 Alicia Keys New York 얼마나 동영상 소리 키 저 일정 제일 수 코스 마제스틱 페리 브루클린 브릿지 스카이라인 감상 수 시간 분 마제스틱 페리 추천 Pier South St New York NY pier pier nyc majesticcruise majesticferry statueofliberty Alicia Keys New York Pier South St New York NY pier pier nyc majesticcruise majesticferry statueofliberty,Statue of Liberty New York,[]
뉴욕 전망대 무료 팁 엣지 전망대 입장료 줄 서서 가지 피크 레스토랑 라운지 테이블 예약 resy 이용 줄 안 무료 식사 메인 자리 코스 요리 주문 필수 코스 요리 분 저 라운지 테이블 예약 가시 직원 창가 달라 제일 자리 주심 메뉴 단 품 메뉴 주류 저 빵 맥주 잔 택 스랑 팁 X 주 고도 엣지 전망대 입장 티켓 값 안 실화 겨울 실내 맥주 전망 무료 셈 전망 식사 칼 바람 야외 전망대 얼른 사진 여기 술 한잔 뉴욕 여행 뉴욕 맛집 뉴욕 레스토랑 edge 전망대 peakrestaurant 미국여행 뉴욕 핫 써밋 뉴욕 전망대 허드슨 야드 resy X edge peakrestaurant,"The Edge, Hudson Yards","['#뉴욕맛집', '#뉴욕레스토랑', '#peakrestaurant', '#뉴욕핫플', '#뉴욕전망대']"
와우 뉴욕 핫 뜸 이안 애 뉴욕,RH Rooftop Restaurant,['#뉴욕핫플']
A great experience to visit a cool place in NYC 곳 일상 요즘 A great experience to visit a cool place in NYC,Brookfield Place New York,[]
여행 요즘 뉴욕 가장 핫 전망대 써밋 사진 사람 여기 인생 샷 백장 천장 만장 수 SUMMIT One Vanderbilt 오픈 시간 화요일 휴무 티켓 가격 일반 시간대 시간대 주소 및 입구 E nd St New YorkTD BANK 옆 계단 층 아래 에스컬레이터 두 층 아래 때문 안 층별 설명 B 층 티켓 확인 후 입장 덧신 및 선글라스 대여 줌 층써밋 메인 플로 풍선 방 층 조금 더 전망 공간 바닥 유리 포토 스팟 층 야외 카페 및 테라스 기념품 옷차림 덧신 필수 신어 걸 수 롱 원피스 추천 바닥 유리 하의 반바지 추천 스커트 원피스 속 바지 필수 눈 때문 선글라스 것 추천 원색 옷 사진 포토 스팟 층 엘리베이터 타고 도착 곳 여기 메인 플로 창가 자리 사수 거울 샷 것 추천 사람 사진 곳 찍기 가장 인기 곳 엠파이어 스테이 트 빌딩 곳 풍선 방 창가 중간 거울 근처 찍기 풍선 방 사진 영상 부메랑 더 워낙 포토 스팟 경쟁 곳 얼굴 철판 좀 함 층 층 덜 사진 찍 수 바닥 유리 포토 스팟 공식 카메라 사진 줌 유리 바닥 개인 폰 사진 시간 미만 왼쪽 엠파이어스테이트 빌딩 쪽 다음 다다다 찍기 미리 스마트폰 렌즈 다다다 사진 찍 준비 해 두기 요즘 뉴욕 가장 핫 써밋 오픈 런 오후 오픈 런 덜 편 일몰 시간대 티켓 뿐더러 사람 때문 각오 불구 여기 일몰 것 뉴욕 뉴욕 여행 SUMMIT One Vanderbilt E nd St New YorkTD BANK B,SUMMIT One Vanderbilt,['#뉴욕']
sohorestaurant nyclife indoordiningnyc vestry worthmoney 뉴욕 sohorestaurant nyclife indoordiningnyc vestry worthmoney,The Dominick,['#뉴욕']
뉴욕 통신원 heerawin 언니 인스타 로만 핫 오늘 날씨 애데 렐라 쥬니 홈 뉴욕 heerawin,L'Amico NYC,[]
발견 소호 핫 까페 차차 마차 완전 입구 취향 저격 커피 안 녹차 라떼 편이 계속 흥분 직원 마차 직접 음료 만 분위기 인정 센스 인정 라떼 맛 초딩 입맛 나 스 위트 너 개 사실 너므 수 크림 못 담 다시 닷 소호 카페 차차 마차,Cha Cha Matcha,[]
