chunked_content,place,relevant_hashtags
Pictures from NYC Tomi jazz Statue of Liberty DumboManhattan Bridge View City view Brooklyn bridge Central Park Brooklyn brige nycnewyork newyorkfoodie 뉴욕뉴욕 여행 뉴욕 맛집 Pictures from NYC Tomi jazz Statue of Liberty DumboManhattan Bridge View City view Brooklyn bridge Central Park Brooklyn brige nycnewyork newyorkfoodie,뉴욕,"['#newyork', '#newyorkfoodie', '#뉴욕', '#뉴욕여행', '#뉴욕맛집']"
Quarters Broadway nd Floor New Yorkshopquarters 건 여러분 저 취향 꼭 읍 코브 디테일 공간 covstudio 라미 newyork 코브 비즈 스트립 shopquarters Quarters Broadway nd Floor New Yorkshopquarters covstudio newyork shopquarters,,[]
여유 센트럴 팤,"Central Park, New York",[]
어메이징 선셋 이번 볼 수 밤하늘 별 것 덕분 모든 Sunset 선셋 뉴욕 여행 Sunset,Beach Hut Cedar Beach NY,['#뉴욕여행']
뉴욕 숙소 추천 newyorknamoo 타임스퀘어 갈수 접근 가성 비갑 다시 뉴욕 숙소 한인 민박 장거리 장시간 비행 타고 바로 체크 후 캐리어 고 바로 엠파이어 빌딩 타임스퀘어 바퀴 뉴욕 나무 숙소 매력 전망대 뷰 요 덕분 인생 사진 뉴욕 나무 한인 민박 박이상 우선 예약 가능 이벤트 관련 카톡 문의 미국여행 뉴욕 여행 뉴욕 숙소 뉴욕 나무 newyork 뉴욕 한인 민박 뉴욕 여행 뉴욕 야경 뉴욕 타임스퀘어 newyorknamoo newyork,New York City,"['#뉴욕숙소추천', '#미국여행', '#뉴욕여행', '#뉴욕숙소', '#뉴욕나무', '#newyork', '#뉴욕한인민박', '#뉴욕여행중', '#뉴욕야경', '#뉴욕타임스퀘어']"
음악 일주 시청 여행지 원금 OO 만원 찜카 x 음악 일주 가상 광고 송출 기념 깜짝 이벤트 김 음악 일주 시청 찜카 가상 광고 순간 포착 인증 찜카 여행지 원금 OO 만원 찜카 가상 광고 송출 일정 수 이벤트 기간 금 수 당첨 발표 개별 발표 이벤트 경품 여행지 원금 명 토부 그 캐리어 인치 명찜카 렌트카 할인 쿠폰 명 스타벅스 아메리카노 tall 명 참여 방법 찜카 공식 인스타그램 계정 팔로우 음악 일주 등장 찜카 가상 광고 순간 포착 촬영 프로필 링크 접속 사진 제출 끝 이벤트 팁 가상 광고 화면 번 모두 화 순간포착 성공 인증 당첨 확률 UP 번만 참여 OKWavve 김 음악 일주 다시 보기 찜카 가상 광고 다시 볼 수 이벤트 응모 폼 내 유의사항 꼭 확인 OO x OO tall UP OKWavve,,[]
아침 반 덤보 가도 사람 꽤 역시 뉴욕 뉴욕 여행 덤보 베슬,"DUMBO, Brooklyn","['#뉴욕', '#뉴욕여행']"
추석 연휴 오늘 게시 물 뉴욕 소호 촬영 커플 사진 세상 힙 거리 패션 화보 사진 더 리 소호 촬영 요 패션 스냅 미국 스냅 더 리 패키지 현재 이벤트 진행 중 신청서 확인 촬영 문의 카카오 톡 ID sky 로 홈페이지 포트폴리오 고객 리뷰 패키지 등 정보 눈 확인 수 검색 창 thehurycom 입력 ID sky thehurycom,Soho,"['#뉴욕소호', '#미국스냅']"
담 미리 예약 써밋 선셋 못 추웠댜 뉴욕 미국 뉴욕 여행 레이 오버 newyork 한국 travel 맨해튼 nyc 일상 travelgram instatravel 탑 오브 더락 여행 daily topoftherock observationdeck newyork travel nyc travelgram instatravel daily topoftherock observationdeck,Top of the Rock NYC,"['#뉴욕', '#미국', '#뉴욕여행', '#newyork', '#맨해튼', '#탑오브더락']"
뉴욕 여행 클라인 크루즈 편 뉴욕 여행 소문 뉴욕 여행 타 미스 뉴욕 여행 빼 수 코스 바로 자유 여신 크루즈 클라인 운영 삼 대장 크루즈 타 미스 팁 타 미스 빅애플 패스 크루즈 상품 구매 시 모두 할인 가격 구매 가능 코스 출발 시간 등 비교 보고 내 마음 쏙 곳 탑승 사항 타 미스 홈페이지 참고,,[]
출근 다시 휴가 달라 첫 미국 여행 가이드 제대로 못 사진 다혜씨 다혜 첫 해외여행 뉴욕,Rockefeller Center,[]
West VillagePhotography Collection Booking available Please check out the official website wwwmaisondenyccom or visit the link in bio and DM for linkmaison de nycmaison de weddingmaisondestudiomaison de family 메종드 뉴욕 시선 감성 성 수기 촬영 예약 경우 수 날짜 촬영 위해 문의 카카오 톡 메종드 뉴욕 채널 검색 추가 상담 maisondenyc newyorkphotographer nyc newyork 뉴욕 뉴욕 여행 뉴욕 스냅 뉴욕 일상 뉴욕 여행 스냅 뉴욕 생활 뉴저지 일상 뉴저지 미국여행 미국 웨딩 nycweddingphotographer 뉴욕 스냅 메종드 뉴욕 그리니치빌리지 westvillagenyc 센트럴 파크 centralparkwedding West VillagePhotography Collection Booking available Please check out the official website wwwmaisondenyccom or visit the link in bio and DM for linkmaison de nycmaison de weddingmaisondestudiomaison de family maisondenyc newyorkphotographer nyc newyork nycweddingphotographer westvillagenyc centralparkwedding,뉴욕,"['#메종드뉴욕따뜻한', '#newyorkphotographer', '#newyork', '#뉴욕', '#뉴욕여행', '#뉴욕스냅', '#뉴욕일상', '#뉴욕여행스냅', '#뉴욕생활', '#뉴저지일상', '#뉴저지', '#미국여행', '#뉴욕스냅메종드뉴욕', '#센트럴파크']"
은 미술관 여행 From the Mixedup Files of Mrs Basil E Frank Weiler by el konigsburg 비 하이브 영 어비 하이브 북 클럽 책 여행 메트로폴리탄 미술관 뉴욕 여행 여행 성동구 영어 영 비 하이브 From the Mixedup Files of Mrs Basil E Frank Weiler by el konigsburg,,"['#비하이브영어', '#두근두근책여행', '#뉴욕여행', '#특별한여행']"
추석 바로 가을,맨해튼,[]
뉴욕 여행 타임스퀘어,뉴욕 타임스퀘어,['#뉴욕여행']
가을 뉴욕 정말 사랑 뉴욕 가을 뉴욕 여행,,"['#뉴욕가을', '#뉴욕여행']"
뉴욕 부터 집 오빠 난 뉴욕 별로 계속 노래 내 구랬쨔 별 로라 구 보스턴 다행 뽐룡 해외여행 끄읕 어른 걱정 안심 일 뉴욕 여행 보스턴 여행,Logan International Airport (BOS),"['#뉴욕여행', '#보스턴여행']"
날 NYC MoMA jazz NYC MoMA jazz,뉴욕,[]
뉴욕 여행 뉴욕 브루클린,Manhattan Bridge,"['#뉴욕여행', '#뉴욕', '#브루클린']"
NEW YORK 뉴욕 뉴욕 여행 브루클린 브루클린 브릿지 덤보 자유의여신상 NEW YORK,"DUMBO, Brooklyn","['#뉴욕', '#뉴욕여행', '#브루클린', '#브루클린브릿지']"
SUMMIT One Vanderbitnewyork nyc summitonevanderbilt 뉴욕 뉴욕 여행 SUMMIT One Vanderbitnewyork nyc summitonevanderbilt,SUMMIT One Vanderbilt,"['#newyork', '#뉴욕', '#뉴욕여행']"
만 셀카 welcome to my new journal of random doodles pics 셀카 셀픽 기 록스타 그램 얼 스타 헤어 스타 그램 뉴욕 여행 피자 맛집 맛집 추천 뉴욕 맛집 일상 코디 미국여행 블로그 welcome to my new journal of random doodles pics,,"['#뉴욕여행', '#뉴욕맛집', '#미국여행']"
하루하루 곳 하루하루 사진 반도 안 좀더 뉴욕 뉴욕 여행 미국여행 자유의여신상 브라이언 트 파크 퀄리티미츠 랜드마크 크루즈 스타더스트,Statue Of Liberty,"['#뉴욕', '#뉴욕여행', '#미국여행', '#브라이언트파크']"
Soho Soho,"Soho, NewYork",[]
꿈 속 살 평소 동네 아파트 사이 지나 하늘 볼 때 젠 이 건물 뉴욕 빌딩 숲 하늘 뉴욕 늘 상상 제 지금 뉴욕 Yes I am in New York now Yes I am in New York now,"New York, New York",[]
Cold spring 위치 개 나중 꼭 개 하나 아마 모든 개인 로망 맨해튼 거리 좀 기차 갈수 요역 곳 위치 때문 개 투어 분 강 것 실 골 구매 점원 것 뭐 고민 다가 Maybe good answers 호탕 점원 기억 개 Cold spring Maybe good answers,The Endless Skein,[]
미국여행 뉴욕 여행 빌딩 숲 USA nyc streetphotography skylinephotography brooklynbridge USA nyc streetphotography skylinephotography brooklynbridge,New York City,"['#미국여행', '#뉴욕여행', '#빌딩숲', '#USA', '#brooklynbridge']"
New Yorkestiatoriomilos baccarathotels boucherie us New Yorkestiatoriomilos baccarathotels boucherie us,Estiatorio Milos Hudson Yards,[]
아침 눈 문득 뉴욕 여행 사진 사진 그때 날씨 분위기 기억 생동감 뉴욕 여행 워싱턴 dailymotivation dailymotivation,,"['#뉴욕여행', '#워싱턴']"
미국여행 남편 둘 오 고서 나중 애 데리 오자 그게 이 줄 딸 데리 비행 걱정 뉴욕 뉴욕 여행 덤보 브루클린 브릿지 자유의여신상 타임 아웃 여행 가족 여행,,"['#미국여행', '#뉴욕', '#뉴욕여행', '#브루클린브릿지']"
타 미스 피크닉 매트 대여 이벤트 기간 별도 고지 시 이벤트 대상 타 미스 빅애플 패스 구매 고객 이벤트 상품 센트럴 파크 피크닉 매트 대여 기간 대여 시간 대여 및 반납 타 미스 운영 시간 내 AM PM 대여 방법 대여 희망 일 당일 타 미스 카카오 톡 채널 대여 가능 여부 문의 사전 예약 대여 가능 시 타 미스 라운지 방문 픽업 대여 시 보증금 현금 지불 보증금 매트 반납 시 반환 유의사항 이벤트 타 미스 빅애플 패스 이용 고객 대여 대여 희망 당일 타 미스 카카오 톡 채널 대여 가능 여부 확인 수 사전 예약 대여 선착순 한정 수량 대여 시점 내 반납 대여 시 손상 미반 납 분실 위 보증금 현금 지불 반납 시 전액 반환 대여 기간 내 미반 납 분실 손상 경우 보증금 반환 수령 피크닉 매트 색상 랜덤 이벤트 마이 리얼 트립 네이버 스마트 스토어 등 플랫폼 통해 구매 주신 고객 이용 AM PM,"Central Park, New York",[]
West VillagePhotography Collection Booking available Please check out the official website wwwmaisondenyccom or visit the link in bio and DM for linkmaison de nycmaison de weddingmaisondestudiomaison de family 메종드 뉴욕 시선 감성 성 수기 촬영 예약 경우 수 날짜 촬영 위해 문의 카카오 톡 메종드 뉴욕 채널 검색 추가 상담 maisondenyc newyorkphotographer nyc newyork 뉴욕 뉴욕 여행 뉴욕 스냅 뉴욕 일상 뉴욕 여행 스냅 뉴욕 생활 뉴저지 일상 뉴저지 미국여행 nycweddingphotographer 뉴욕 스냅 메종드 뉴욕 센트럴 파크 centralpark West VillagePhotography Collection Booking available Please check out the official website wwwmaisondenyccom or visit the link in bio and DM for linkmaison de nycmaison de weddingmaisondestudiomaison de family maisondenyc newyorkphotographer nyc newyork nycweddingphotographer centralpark,뉴욕,"['#메종드뉴욕따뜻한', '#newyorkphotographer', '#newyork', '#뉴욕', '#뉴욕여행', '#뉴욕스냅', '#뉴욕일상', '#뉴욕여행스냅', '#뉴욕생활', '#뉴저지일상', '#뉴저지', '#미국여행', '#뉴욕스냅메종드뉴욕', '#센트럴파크']"
뉴욕 여행 업무 연락 때 여행 업무 수 곳 오늘 푸른 투어 에디터 뉴욕 노트북 카페 소개 작업 카페 인사 맨해튼 브루클린 게시 물 저장 후 여행 중 업무 때 여러분 뉴욕 노트북 카페 댓글 추천,,[]
우버 탈걸,5th Avenue - New-York City USA,[]
맨해튼 일상,,[]
Episode Welcome to New York City 타임스퀘어 첫 피자 조각 순간 일상 속 여행지 트렌디 함 감각 스타일 하뚜클로젯 우리 컬렉션 당신 하루 감성 불어 매력 스타일 일상 여행 경험 의류 쇼핑몰 패션 스타 그램 패셔 스타 그램 ootd 일상 패션 오늘 코디 코디 추천 코디 모음 코 디스 타 그램 의류 스타일 데 일리 뉴욕 뉴욕 맛집 뉴욕 일상 뉴욕 여행 미국여행 여행 여행사진 여행 스타 그램 뉴욕 티셔츠 newyork newcollection newyorkcity newyorklife newyorker nyc travelphotography travelblogger Episode Welcome to New York City ootd newyork newcollection newyorkcity newyorklife newyorker nyc travelphotography travelblogger,,"['#데일리룩', '#뉴욕', '#뉴욕맛집', '#뉴욕일상', '#뉴욕여행', '#미국여행', '#뉴욕티셔츠', '#newyork', '#newyorkcity', '#newyorklife', '#newyorker']"
하루 반 팔 경량 패딩 모두 예측 불가 뇩 날씨 Outer poloralphlauren Cardigan mixxo korea Bottom uniqlokr uniqlo Shoes toryburch Outer poloralphlauren Cardigan mixxo korea Bottom uniqlokr uniqlo Shoes toryburch,,[]
East Village NYCVery exciting Korean regional Busan cuisine in East Village Team is incredibly nice the decor and music is spoton and the pork gookbap heals my soul every single timeMind you ariarinyc s take on Busan food doesnt reflect the authenticity nor the core of it but nonetheless the use of seafood and some korean paste Jang in each dish is very fun to explore eationarynyc eationaryeastvillage ariarinyc 보고서 뉴욕 뉴욕 여행 뉴욕 맛집 East Village NYCVery exciting Korean regional Busan cuisine in East Village Team is incredibly nice the decor and music is spoton and the pork gookbap heals my soul every single timeMind you ariarinyc s take on Busan food doesnt reflect the authenticity nor the core of it but nonetheless the use of seafood and some korean paste Jang in each dish is very fun to explore eationarynyc eationaryeastvillage ariarinyc,Ariari,"['#먹어보고서뉴욕', '#뉴욕여행', '#뉴욕맛집']"
뉴욕 차 차곡차곡 날씨 살짝 당황 첫날 저 장 포스팅 언제 뉴욕 여행,뉴욕,['#뉴욕여행']
brooklyn 온전 하루 도 미노 파크 감동 brooklyn,뉴욕,[]
부모님 뉴욕 Day 전반전 어머니 한번 못 선택 뉴욕 댱 우리 작년 두번째 좀더 여유 마음 여행 바알 타임스퀘어 사진 득템 어머니 거의 처음 둘이서 사진 오빠 뒤 배경 거인 부모님 찬스 음식 잔뜩 뚜벅 안 우버 타고 중 뉴욕 여행 아기 여행 timesquare newyork Day timesquare newyork,"Times Square, New York City","['#뉴욕여행', '#newyork']"
미국 뉴욕 여행 브루클린 덤보 워싱턴 써밋 월스트리트 양키스 록펠러 센터,"DUMBO, Brooklyn","['#미국', '#뉴욕여행', '#브루클린', '#워싱턴', '#월스트리트']"
도심 속 힐링,Bryant Park,[]
Summit 아파트 갈뻔햿 도착 써밋너무 공 순이 등장 써밋 뉴욕 여행 newyork Summit newyork,SUMMIT One Vanderbilt,"['#뉴욕여행', '#newyork']"
뉴욕 여행 업뎃 끄읕 진짜 돈 하나 hotelbrooklynbridge 방 야경 노을 아침 뷰 마지막 배웅 생일도 축하 rimring rim with cheshirecat newyork brooklyn dumbo instatravel 야경 호캉스 뷰 맛집 instamood birthday selstagram 여행 스타 그램 hotelbrooklynbridge rimring rim with cheshirecat newyork brooklyn dumbo instatravel instamood birthday selstagram,,"['#뉴욕여행', '#1hotelbrooklynbridge', '#newyork', '#brooklyn', '#호캉스']"
Spotted at grand central bags in hand 처음 그랜드 센트럴 세레나 블레어 파지 오늘 세레나 더 우드 슨 바이브 Get your first pair for when you become a VIP justfabpartner JFViralBoot justfabonline Spotted at grand central bags in hand Get your first pair for when you become a VIP justfabpartner JFViralBoot justfabonline,Grand Central Terminal,[]
몸살 감기 이슈 도착 자마자 뉴욕 찌린내 킁카킁카 만끽 커녕 몸 달달 바로 호텔 요 양해 뉴욕 나 무슨 호캉뚜 온 줄 호텔 치안 서울 호캉스 곤지암 수련 담력 테스트 더 거리 안 문수영 체력 여행 약 약 휴식 취하 컨디션 좀 때 열 재보 도 것 나 무슨 도 상태 뉴욕 강철 체력 여자 추정 김민경 하나 덤보 박 찍 뉴욕 뚜뚜 X 뉴욕 X,"DUMBO, Brooklyn",[]
올해 처음 맞이 선선 가을 바람 뉴욕 수 더욱 관광지 숙소 근처 거리 동네 카페 작업 일상 더없이 일상 속 뉴욕 가을 못 순간 선사 마음속 깊이 행복 다시금 일 Flushing New york Flushing New york,뉴욕,[]
인생 쿠키 만난 뉴욕 디저트 카페 컬쳐 에스프레소 뉴욕 곳 초코 쿠키 꼭 집 뉴욕 블라인드 테스트 위 맛집 만큼 크런키 식감 초코 달달 함 맛 고급 진 초콜렛 가득 느낌 쿠키 라떼 조합 최고 매장 크기 회전 뉴요커 일상 컬쳐 에스프레소 캐릭터 에코 티셔츠 등 굿 도 판매 곳 Culture Espresso W th St New York NY United States 매일 am pm 모던 감각 카페 맛집 moder nstock 팔로우 Culture Espresso W th St New York NY United States am pm moder nstock,"New York, New York",[]
newyork 뉴욕 여행 오늘 마지막 밤 아쉬움 내일 한국 자유의여신상 황소 길찾기 담당 브루클린 덤보 링컨 메모 리얼 백악관 국회의사당 브로드웨이 타임스퀘어 뉴욕 여행 newyork instagram newyork newyork instagram,,"['#newyork', '#뉴욕여행', '#newyork']"
Greeny stroll in NewyorkNewyork madisonsquarepark 뉴욕 여행 felixroastingco 뉴욕 카페 Greeny stroll in NewyorkNewyork madisonsquarepark felixroastingco,Madison Square Park,"['#Newyork', '#뉴욕여행', '#뉴욕카페']"
교육 미래 대한 여권 내일 오늘 준비 사람 것 꿈 맨해튼 음대 더 빅밴드 맨해튼 음대 학과 장님 즉흥 잼 연 주 콘서트장 도서관 악보 기숙사 뷰 바로 밑층 연습실 무엇 열정 가득 학생 덕분 뉴욕 왜 뉴욕 뉴욕 맨해튼,Manhattan School of Music,[]
뉴욕 여행 전망대 편 뉴욕 여행 소문 뉴욕 여행 타 미스 뉴욕 여행 빼 수 코스 바로 전망대 아침 오후 해질녘 밤 제 가도 맨하탄 뷰 타 미스 팁 타 미스 빅애플 패스 탑 오브 더락 전망대 엠파이어 빌딩 전망대 원월드 전망대 엣지 전망대 모두 할인 가격 구매 가능 사진 모두 해당 전망대 촬영 사진 내 마음 쏙 곳 방문 사항 타 미스 홈페이지 참고,뉴욕 타임스퀘어,[]
가로 사진 모음 Photography Collection Booking available Please check out the official website wwwmaisondenyccom or visit the link in bio and DM for linkmaison de nycmaison de weddingmaisondestudiomaison de family 메종드 뉴욕 시선 감성 성 수기 촬영 예약 경우 수 날짜 촬영 위해 문의 카카오 톡 메종드 뉴욕 채널 검색 추가 상담 maisondenyc newyorkphotographer nyc newyork 뉴욕 뉴욕 여행 뉴욕 스냅 뉴욕 일상 뉴욕 여행 스냅 뉴욕 생활 뉴저지 일상 뉴저지 미국여행 미국 웨딩 nycweddingphotographer 뉴욕 스냅 메종드 뉴욕 센트럴 파크 centralparkwedding Photography Collection Booking available Please check out the official website wwwmaisondenyccom or visit the link in bio and DM for linkmaison de nycmaison de weddingmaisondestudiomaison de family maisondenyc newyorkphotographer nyc newyork nycweddingphotographer centralparkwedding,뉴욕,"['#메종드뉴욕따뜻한', '#newyorkphotographer', '#newyork', '#뉴욕', '#뉴욕여행', '#뉴욕스냅', '#뉴욕일상', '#뉴욕여행스냅', '#뉴욕생활', '#뉴저지일상', '#뉴저지', '#미국여행', '#뉴욕스냅메종드뉴욕', '#센트럴파크']"
미국여행 뉴욕 여행 빌딩 숲 USA nyc streetphotography skylinephotography USA nyc streetphotography skylinephotography,New York City,"['#미국여행', '#뉴욕여행', '#빌딩숲', '#USA']"
뉴욕 여행 비 뉴욕 뉴요커,New York City,"['#뉴욕여행', '#비오는뉴욕', '#뉴요커처럼']"
lovely lovely,Newyork,[]
아주 가을 날 뷰 맛집 씨 포트 나들이 southstreetseaportslee newyork southstreetseaportslee newyork,South Street Seaport Historic District,[]
iny usa nyc newyork travel summitonevanderbilt timessquare 미국 뉴욕 여행 미국여행 뉴욕 여행 야경 iny usa nyc newyork travel summitonevanderbilt timessquare,New York City,"['#newyork', '#미국', '#뉴욕', '#미국여행', '#뉴욕여행']"
뉴욕 여행 차 우산 안 두 손 마지막 날 날 다행 타임스퀘어 뉴욕 여행,,['#뉴욕여행']
차 아침 베이글 길 broadnosh broadnoshbagels 브로 드노 쉬 베이글 columbuscirclenewyorkcity 뉴욕 여행 broadnosh broadnoshbagels columbuscirclenewyorkcity,Columbus Circle,"['#브로드노쉬베이글', '#columbuscircle', '#newyorkcity', '#뉴욕여행']"
Nine Orchard Bar yeriyakii nyc 뉴욕 분위기 바 여기 마티니 michelinguide foodie nycfoodie nyceats 맛집 뉴욕 여행 뉴욕 뉴욕 맛집 미국여행 미국 맛집 nycbar 뉴욕 바 뉴욕 칵테일 바 여행 브이 로그 뉴욕 브이 로그 Nine Orchard Bar yeriyakii nyc michelinguide foodie nycfoodie nyceats nycbar,Nine Orchard,"['#nycfoodie', '#뉴욕여행', '#뉴욕', '#뉴욕맛집', '#미국여행', '#뉴욕바', '#뉴욕칵테일바', '#뉴욕브이로그']"
metmuseum metmuseum,"The Metropolitan Museum of Art, New York",[]
뉴욕 여행 기록 Day 전반전 베이글 사서 센트럴 파크 산책 날씨 장소 댱 리하 벤치 분유 라떼 원샷 여유 낮잠 broadnoshbagels 베이글 맛집 뉴욕 여행 newyork centralpark Day broadnoshbagels newyork centralpark,"Central Park, New York","['#뉴욕여행', '#newyork']"
뱅기 타고 여행 미국여행 뉴욕 여행 인천공항,인천공항 Incheon Airport,"['#미국여행', '#뉴욕여행']"
마지막 사진 차 우리 라미 newyork 코브 비즈 스트립 newyork,Colbo,[]
반 고흐 별 헤 밤 앤디 워홀 피카소 등 교과서 인터넷 작품 직접 눈앞 F 하루 F,MoMA The Museum of Modern Art,[]
뉴욕 여행기 젤 브루클린 브릿지 덤보 사람 별룬데 살짝 뒤 사람 사진 더 바보 나 이제 다리 강가 이유 음악 성터 부러 날씨 내 날 성터 날 사진 열 장 브루클린 브릿지 덤보 뉴욕 여행,Brooklyn Bridge,"['#브루클린브릿지', '#뉴욕여행']"
시차 덕분 아주 올해 HBD 뉴욕 여행 뉴욕 미슐랭 미슐랭 스타 미국여행 생일 HBD newyorkcity lepavillon manhattan nycmichelin nyc 뉴욕 맛집 뉴욕 일상 미국 일상 여행 미국 HBD HBD newyorkcity lepavillon manhattan nycmichelin nyc,맨해튼,"['#뉴욕여행', '#뉴욕미슐랭', '#미국여행', '#newyorkcity', '#manhattan', '#뉴욕맛집', '#뉴욕일상']"
newyork soho 내 가치 능력 위해 일만 것 여행 추억 것 이상 목표 워 밸 worklifebalance newyorkcity newyorklife nyc 뉴욕 소호 뉴욕 여행 뉴욕 일상 newyorkcityphotography newyork soho worklifebalance newyorkcity newyorklife nyc newyorkcityphotography,"Soho, New York Fashion District","['#newyork', '#newyorkcity', '#newyorklife', '#뉴욕', '#뉴욕여행', '#뉴욕일상']"
The Vessel Hudson Yards New York NY USA 대형 벌집 듯 형상 베슬 처음 한창 인기 때 내부 초 광각 사진 뉴욕 가면 꼭 버킷 각종 인명 사고 잠정 폐쇄 밖 외부 사진 날폐쇄된건 알 거 안보 후회 더 사진 스토리 베슬 미국여행 뉴욕 여행 허드슨 야드 투어 뉴욕 unitedstatesnewyorkthevesselhudsonyardsmanhattanusa The Vessel Hudson Yards New York NY USA unitedstatesnewyorkthevesselhudsonyardsmanhattanusa,Vessel,"['#미국여행', '#뉴욕여행', '#newyork', '#manhattan']"
뉴욕 가기 전 구매 벼루 던 자유의여신상 미키 영접 구매 Newyork 뉴욕 여행 Disneystore 뉴욕 미키 NYC manhattan Newyork Disneystore NYC manhattan,Disney store,"['#Newyork', '#뉴욕여행', '#뉴욕미키', '#NYC', '#manhattan']"
탑 오브 더락 탑뷰 버스 나이트 투어 덤보 불꽃놀이 록펠러 센터 탑 오브 더락 탑뷰 버스 뉴욕 뉴욕 여행,Top of the Rock NYC,"['#탑오브더락', '#탑뷰버스', '#뉴욕', '#뉴욕여행']"
뉴욕 센트럴 파크 촬영 결과물 이번 사진 더 리 뉴욕 스냅 장소 결정 뉴욕 감성 미국 공원 더 리 패키지 현재 이벤트 진행 중 신청서 확인 촬영 문의 카카오 톡 ID sky 로 홈페이지 포트폴리오 고객 리뷰 패키지 등 정보 눈 확인 수 검색 창 thehurycom 입력 ID sky thehurycom,"Central Park, New York","['#뉴욕', '#뉴욕감성', '#미국공원']"
꼭 보고 가까이 너 기대,뉴욕,[]
격식 자리 베이직 가을 용 트 위드 자켓 여유 핏 부담 하의 매치,,[]
도심 속 자연 공간 manhattan 공 원 산책 여유 로움 공존 공간 미국여행 뉴욕 여행 추억 manhattan,,"['#manhattan', '#미국여행', '#뉴욕여행']"
빵빵 실사판 uplounge official uplounge life official 유피 라운지 기 시 그 니 처 무지 머슬핏 반 팔 티셔츠 유피 라운지 UPLOUNGE UPLG 짐 웨어 짐 웨어 추천 OOTD 유피 크루 유피 크루 기 머슬핏 머슬핏반팔 uplounge official uplounge life official UPLOUNGE UPLG OOTD,뉴욕,[]
센트럴 파크 포토 스팟 총 정리 뉴욕 여행 센트럴 파크 가야 센트럴 파크 어디 가야 푸른 투어 에디터 직접 센트럴 파크 포토 스팟 선정 정리 시간 한정 라면 센트럴 파크 무작정 푸른 투어 에디터 픽 스팟 참고,뉴욕,[]
뉴욕 첫 끼 맛집 정 보람 인생 브리 오슈 프렌치토스트,Buvette,[]
유재석 덤보 뉴욕 여행 브루클린 웃음 한가위 추석 유재석 더 사진 요 httpsyoutubeB zQaLvIhZssiYPeNxSkcqtVNvMg httpsyoutubeB zQaLvIhZssiYPeNxSkcqtVNvMg,브루클린,"['#뉴욕여행', '#브루클린안녕하세요']"
Better watch Netflix Owning Manhattan 맨해튼 뉴욕 미국여행 미국 뉴욕 니콘 징 코리아 뉴욕 여행 맨해튼 브릿지 Better watch Netflix Owning Manhattan,"Manhattan Bridge, Brooklyn, NY 11201, USA","['#맨해튼', '#뉴욕', '#미국여행', '#미국뉴욕', '#뉴욕여행', '#맨해튼브릿지']"
뉴욕 도착,"New York, Central Park",[]
