chunked_content,place,relevant_hashtags
정 피디 아침 미역국 먹방 모닝콜 일 핸 모닝 junghaein 보고서 보고서 정해 정해 보고서 은종건 임 현수 뉴욕 여행 뉴욕 nyc kbs 큐 터리 반의 반 반의 반 하원 문 하원 tvn tvn 드라마 kdrama tvndrama APieceOfYourMind junghaein nyc kbs tvn tvn kdrama tvndrama APieceOfYourMind,,"['#뉴욕여행', '#뉴욕']"
리그 램 iankimsnap 센트럴 파크 가로등 아래 모녀 스냅 도 역시 스냅 스튜디오 감성 영화 속 장면 가을 겨울 뉴욕 스냅 예약 예약 및 상품 확인 프로필 링크 확인 뉴욕 스냅 뉴욕 여행 뉴욕 스냅 촬영 뉴욕라이프 뉴욕 일상 뉴욕 스냅 사진 iankimsnap,,[]
리그 램 iankimsnap 센트럴 파크 기록 사랑 이야기 김 이안 뉴욕 스냅 뉴욕 스냅 예약 예약 및 상품 확인 프로필 링크 확인 뉴욕 스냅 뉴욕 웨딩 뉴욕 여행 뉴욕 웨딩 스냅 뉴욕라이프 뉴욕 일상 데스티네이션 웨딩 뉴욕 iankimsnap,,[]
뉴욕 소호 쇼핑 핫 레이스 패션 피플 여기 여기 KITH 키스 Lafayette St New York NY 소호 브루클린 편집 매장 시작 현재 스트릿 컬처 KITH 저스틴 비버 벨라 하디 드 착용 더욱 태핫해 슈프림 Bowery New York NY 뉴욕 맨해튼 첫 매장 오픈 Supreme 역사 불구 글로벌 마니아 층 보유 스트릿 브랜드 끝판 스 투시 Spring St New York NY 서핑보드 션 스 투시 Stussy 스트릿 브랜드 원조 LEON DORE 메 레온 임 레온 Mulberry St New York NY 현재 뉴욕 가장 핫 브랜드 AIME LEON DORE 특유 색감 무드 분위기 개성 직원 가득 팔라스 Howard St New York NY 영국 슈프림 PALACE TriFerg 트 라이 퍼그 삼각형 로고 디자인 특징 여행 타 미스 KITH Lafayette St New York NY KITH Bowery New York NY Supreme Spring St New York NY Stussy LEON DORE Mulberry St New York NY AIME LEON DORE Howard St New York NY PALACE TriFerg,,[]
리그 램 iankimsnap 덤보 요 김 이안 뉴욕 스냅 하반기 상반기 예약 예약 및 상품 확인 프로필 링크 확인 뉴욕 스냅 뉴욕 웨딩 뉴욕 여행 뉴욕 웨딩 스냅 뉴욕라이프 뉴욕 일상 iankimsnap,,[]
직접 뉴욕 감각 맛집 소개 현 지인 자주 추천 공간 LOS TACOS NO 뉴욕 타코 인자 여러 지점 곳 꼭 추천 메뉴 타코 스테이크 돼지 치킨 Gallerghers steak house 살인 물가 뉴욕 스테이크 하우스 가성 비 곳 추천 메뉴 무조건 점심 코스 메뉴 LAmico 감각 공간 거 것 메뉴 이탈리안 다이닝 가성 비도 꽤 추천 메뉴 Tagliatelle Paper coffee 인테리어 커피 맛집 산미 커피 곳 힙 현지 형 곳곳 추천 메뉴 아메리카노 Ellens Stardust Diner 뮤지컬 도시 뉴욕 수 최고 수준 공연 다이닝 음식 가격 서버 뮤지컬 공연 선사 뉴욕 무조건 추천 추천 메뉴 Stardust signature salad Rubys cafe 호주 스타일 브런치 업 햇볕 때 브런치 먹기 감각 공간 추천 메뉴 아메리칸 플레이 트 Portale 최고 이탈리안 다이닝 수준 다른 이탈리안 수 곳 추천 메뉴 Bucatini Gramercy Tavern 뉴욕 최고 호스 피 티 그룹 USHG 의 창업 이자 쉑쉑 버거 창업 대니 처음 연 다이닝 추천 메뉴 The tavern burger Patent pending 니콜라 테슬라 꽃 피지 못 마지막 건물 그 안 니콜라 테슬라 컨셉 스 피크 지바 세계 어디 손색 바로 꼭 한번 추천 추천 메뉴 칵테일 LOS TACOS NO Gallerghers steak house LAmico Tagliatelle Paper coffee Ellens Stardust Diner Stardust signature salad Rubys cafe Portale Bucatini Gramercy Tavern USHG The tavern burger Patent pending,맨해튼,[]
단발머리 추천 화장 솜 핑크 바이올렛 헤드셋 유지 터 그램 스카프 의류 촬영 대행 뉴욕 여행,,[]
남자 화장품 원룸 인테리어 커리 뉴욕 여행 답례 품 송도 사진관 바프 준비 새 학기 시작,,[]
뉴욕 한복 한복순 빨강 치마 파랑 치마 태극기 만세 hanbok top hanbok top,New York,['#뉴욕']
뉴욕 빈티 샵 BEST 뉴욕 빈티 샵 브루클린 위치 곳 소개 마치 보물 경험 뉴욕 빈티 샵 구경 역사 세월 흔적 아이템 추억 낭만 가득 Feng Sway Norman Ave Brooklyn NY Dobbin Street Vintage Coop Norman Ave Brooklyn NY Mother of Junk Driggs Ave Brooklyn NY BEST Feng Sway Norman Ave Brooklyn NY Dobbin Street Vintage Coop Norman Ave Brooklyn NY Mother of Junk Driggs Ave Brooklyn NY,브루클린,[]
뉴욕 최고 길거리 음식 TOP 가성 비 갑 베이글 피자 할랄 가이즈 후 덜덜 물가 현 지인 것 요 저 뉴욕 미대 시절 돈 시간 때 이 음식 얼마나 뉴욕 여행 꼭 베이글 샌드위치 사서 공원 추천 현지 바이브 할랄 가이즈 꼭 오 리지 널 줄 보람 겨울 날 덜덜 줄 화이트 소스 잔뜩 크게 입 죽음 주머니 도 배 길거리 음식 꼭 여러분 이 중 음식 제일 인스타 툰 너 기 툰 웹툰 그림 일기 미국 미국여행 미국생활 해외여행 영어 그림 일기 뉴욕 여행 뉴욕 뉴욕 맛집 음식 유학생 문화 주말 공감 일상 소통 여행 베이글 맛집 피자 할랄 가이즈 미국 일상 뉴욕 일상 대학생 TOP,,"['#미국', '#미국여행', '#미국생활', '#영어', '#뉴욕여행', '#뉴욕', '#뉴욕맛집', '#뉴욕일상']"
뉴욕 맛집 방출 장만 계절 별로 계절 데코 샹들리 조합 밖 그냥 못 맛 맛 프렌치토스트 거기 거기 줄 입 입 조그만 입구 진짜 파리 로컬 카페 센트럴 파크 때 한잔 사서 가보 쟈 구 요 인테리어 사진 커피 주의 진짜 모든 맛 또 브루클린 모퉁이 에스프레소 바빵 원두 꼬숩 투 감성 특유 브루클린 바이브 치즈케이크 여기 살짝 크리미 치즈 알갱 치즈케이크 우선 백 선생님 움 스트리트 푸드파이터 맛집 멕시코 맛 그대로 카 몰리 사이드 추가 꼭 또띠아 칩 팔로우 여행 꿀팁 정보 말기 yesnicole p yesnicole p yesnicole p yesnicole p,뉴욕,['#뉴욕맛집']
뉴욕 필수 코스 브루클린 덤보 꿀팁 아기 코끼리 덤보,덤보 (브루클린),[]
빌딩 숲 수영 말 물 속 걷기 parkhyattnewyork parkhyatt 파크 하얏트 뉴욕 여행 newyork 뉴욕 호텔 swimwear sharemyhyattpic parkhyattnewyork parkhyatt newyork swimwear sharemyhyattpic,Park Hyatt New York,"['#뉴욕여행', '#newyork', '#뉴욕호텔']"
해외여행 몇 뉴욕 vs LA 편 이번 미국 닷 미국 어쩜 수가 속 여유 로움 수 뉴욕 핫 저 세상 텐션 LA 둘 중 도시 더 댓글 빼앰 난 LA 더 G 마켓 X 구마 불 G 마켓 구마 불 세계 여행 즉흥 여행 프로젝트 할인 세계 항공권 할인 쿠폰 유 회원 첫 구매 할인 쿠폰 매일 누구 할인 쿠폰 항공권 결제 고객 대상 해외 호텔 중복 쿠폰 httpsbitly asto W 여행 여행 가게 나 여행 여행가 미국 미국 미국여행 뉴욕 뉴욕 여행 LA LA 여행 로스앤젤레스 로스앤젤레스 여행 vs LA LA LA G X G httpsbitly asto W LA LA,,"['#미국', '#미국여행', '#뉴욕', '#뉴욕여행', '#로스앤젤레스', '#로스앤젤레스여행']"
애틀란타 뉴욕 가희 어디 갈래 피크닉 매트 공원 바다 전부 수 말 나 수영복 세 개 말 판다 익스 프레 스 운동화 부츠 신고 수영 카메라 휴대폰 팽 물 얼굴 둥둥 채 수영 깔깔 대고 과제 다가 다대 포 바다 기분 학교 성인 연락 만날 수 친구 일상 추억 거리 만 점 졸업 학교 늘 차로 일주일 동안 거의 보름치 여행 가희 아마 매년 가게 것 미국 일단 내년 또 NYC 여행사진 한참 뉴욕 여행 코니아일랜드 미국 해변 미국 바다 conyisland nyc 여행 미국 newyorklike 그로 브 빈폴 beanpole 배우 에이전시 광고 촬영 모델 에이전시 NYC conyisland nyc newyorklike beanpole,Conyisland Beach New York,"['#뉴욕여행', '#newyorklike']"
가치 상승 로스 비즈 로스 비즈 빅데이터 마케팅 계정 등급 활성화 서비스 빅데이터 계정 분석 빅데이터 잠재 고객 타겟 팅 빅데이터 시장 분석 빅데이터 해시태그 분석 모든 걸 빅데이터 계정 컨설팅 서비스 젠 계정 관리 신뢰 빅데이터 상담 프로필 링크 클릭 경산 애견 미용 의류 촬영 대행 울산 이색 데이트 돌상 사진 뉴욕 여행 원룸 인테리어 해운대 애견샵 속초 포장마차 거리 관리 남자 화장 솜,,[]
뉴욕 여행 일정 박 차 미술관 th Ave New York NY 세계 미술관 중하 나인 메트로폴리탄 미술관 뉴욕 가장 미술관 꼬박 보지 못 정도 규모 하루 종일 재 입장 가능 센트럴 파크 th Street Transverse New York NY 뉴욕 센트럴 파크 뉴욕 꼭 필수 명소 뉴욕 베이글 사 파크 구경 Ave 쇼핑 거리 th Ave th th Streets 쇼핑 매장 가득 메트로폴리탄 미술관 쭈욱 탑 오브 더 락 전망대 Rockefeller Plaza New York NY 뉴욕 여행객 가장 방문 전망대 뉴욕 전망대 중 최고 선셋 뷰 야경 뷰 자랑 재즈 바 블루노트 버드 랜드 클럽 뱅 가드 등 재즈 바 뉴욕 환상 뉴욕 밤 재즈 여행 타 미스 더 뉴욕 여행 정보 알고싶다 타 미스 블로그 확인 th Ave New York NY th Street Transverse New York NY Ave th Ave th th Streets Rockefeller Plaza New York NY,,[]
가치 상승 로스 비즈 소비자 선택 브랜드 로스 비즈 올해 IT 브랜드 파워 위 한국 최우수 브랜드 대상 수상 대한민국 브랜드 만족 지수 위 로스 비즈 빅데이터 기술 족도 SNS 마케팅 솔루션 상담 프로필 링크 클릭 반지 그램 뉴욕 여행 애쉬 블루 돌잔치 풍선 원룸 인테리어 스카프 발렌타인 울산 이색 데이트 IT SNS,,[]
고양이 화장실 동대문 인테리어 천안 곳 관리 남자 경복궁 꽃집 점집 뉴욕 여행 스카프 애쉬 블루,,[]
가치 상승 로스 비즈 소비자 선택 브랜드 로스 비즈 올해 IT 브랜드 파워 위 한국 최우수 브랜드 대상 수상 대한민국 브랜드 만족 지수 위 로스 비즈 빅데이터 기술 족도 SNS 마케팅 솔루션 상담 프로필 링크 클릭 손톱 원룸 인테리어 울산 이색 데이트 뉴욕 여행 발렌타인 애쉬 블루 스카프 점집 IT SNS,,[]
가치 상승 로스 비즈 로스 비즈 커스터 마이 징 서비스 빅데이터 계정 관리 추천 탭 확산 최적화 계정 대량 배포 젠 서비스 맞춤 상품 시간 비용 로스 비즈 커스터 마이 징 서비스 프로필 링크 클릭 상담 에르메스 스니커즈 헤드셋 단발머리 추천 유지 터 그램 뉴욕 여행 스카프 원룸 인테리어 위스키 추천 애쉬 블루,,[]
마케팅 가평 키즈 펜션 부산 브라 덜 샤워 아기 고양이 분양 웨딩 컨설팅 청주 속눈썹 필름 네일 노원 네일아트 캠핑 요리 추천 캐리어 스티커 동성로 붙임머리 붙임머리 가격 마포 카페 뉴욕 여행 마카롱,,[]
뉴욕 소품 샵 BEST 뉴요커 집 것 뉴욕 감성 아이템 뉴욕 소품 샵 소개 주방 용품 핸드 메이드 편지 샵 캔들 머그컵 만 나볼 수 이스트 보기 해도 기분 또 샵 꼭 방문 눈 호강 제대로 niconeco zakkaya E th St New York NY Babs home and Pantry Avenue A New York NY Jane CookSHop E th St New York NY BEST niconeco zakkaya E th St New York NY Babs home and Pantry Avenue A New York NY Jane CookSHop E th St New York NY,뉴욕,[]
포항 여행 추천 발렌타인 경 주 공 방 성수동 꽃집 뉴욕 여행 사주 잠실 데이트 옴브레 그램 천안 곳,,[]
체리 콕 달달 파르페 니트 당 충전,Lexington Candy Shop,[]
뉴욕 암 띵 흐흐 흠 흐흐 흠 번 안 사람 번만 간 사람 뉴욕 차자 연사 박물관 센트럴 파크 타임스퀘어 브로드웨이 뮤지컬 자연사 박물관 박물관 배경 자연사 박물관 공룡 화석 동물 박제 모형 우주 등 평소 접 자연 역사 눈 볼 수 오후 반 이후 무료 입장 가능 센트럴 파크 맨해튼 한가운데 뉴욕 최대 규모 공원 공원 주변 유명 관광지 공원 중심 여행 계획 시간 잡고 베이글 피크닉 타임스퀘어 뉴욕 가장 먼저 타임스퀘어 타임스퀘어 상징 계단 LED 대형 관고 판 뉴욕 걸 실감 수 브로드웨이 뮤지컬 뮤지컬 고장 브로드웨이 뮤지컬 관심 뉴욕 브로드웨이 꼭 번 매일 뮤지컬 골 관람 수 차 메트로폴리탄 미술관 브라이언 트 파크 그랜드 센트럴 터미널 써밋 전망대 메트로폴리탄 미술관 세계 가장 미술관 중 곳 무려 개 정도 셀 수 보물 전시 모네 반고흐 미켈란젤로 등 거장 그림 감상 수 화 수 휴무 브라이언 트 파크 뉴욕 공립 도서관 바로 옆 관광 잠시 공원 공원 잔디밭 여름 야외 영화 상영 관 겨울 아이스링크 하니 계절 그랜드 센트럴 터미널 뉴욕 대표 랜드마크 그랜드 센트럴 터미널 세계 가장 기차역 무려 개 플렛폼 개 선로 웅장 터미널 압도 기분 써밋 전망대 뉴욕 전망대 중 곳 최근 가장 핫 전망대 해 뉴욕 전망 거울 컵 은색 공이 실내 사진 여기 바로 뉴욕 핫 차 첼시 마켓 하이라인 파크 베슬 엣지 전망대 첼시 마켓 감각 인테리어 디자이너 소품 먹거리 수 첼시 마켓 랍스터 수 것 해 하이라인 파크 하이라인 뉴욕 야외 산책 장소 중 곳 햇살 오후 길 뉴요커 듯 기분 수 강력 추천 곳 구 베슬 벌집 모양 건축물 아이언맨 연상 디자인 건물 전망 이용 허드슨 감상 수 현재 내부 수 었다 해 엣지 전망대 뉴욕 전망대 중 가장 곳 무려 층 높이 건물 바닥 유리 전망대 뉴욕 도로 구경 수 야경 명소 중 곳 차 브루클린 DUMBO 브루클린 브릿지 자유 여신 페리 소호 브루클린 DUMBO 맨해튼 브리지 찍 수 유명 포토 스팟 벽돌 건물 철제 다리 하늘 조화 인생 샷 제 가도 사람 아침 시간 브루클린 브릿지 맨해튼 브루클린 다리 중 인도 도로 다리 밤 뉴욕 걸 수 야경 명소 뉴욕 자유 여신 페리 뉴욕 상징 수 자유 여신 리버티 섬 위치 섬 주변 페리 타고 자유 여신 감상 방법 가장 베스트 소호 소호 명품 및 브랜드 매장 쇼핑 감각 카페 커피 쇼핑 뉴욕 생활 뉴욕 박 경비 인 기준 항공권 약 비 수기 숙소 약 각종 입장료 교통비 약 식비 약 총 비용 사진 영상 제공 모든 분 kumzzi LED DUMBO DUMBO kumzzi,,[]
가치 상승 로스 비즈 소비자 선택 브랜드 로스 비즈 올해 IT 브랜드 파워 위 한국 최우수 브랜드 대상 수상 대한민국 브랜드 만족 지수 위 로스 비즈 빅데이터 기술 족도 SNS 마케팅 솔루션 상담 프로필 링크 클릭 네임택 뉴욕 여행 스카프 원룸 인테리어 유지 터 그램 속초 포장마차 거리 동대문 인테리어 돌잔치 풍선 천안 곳 갤럭시 s IT SNS s,,[]
미국 뉴욕 포착 걸그룹 미쓰에이 출신 민 근황 민 미쓰에이 민 뉴욕 뉴욕 여행 근황 아이돌,,"['#뉴욕', '#뉴욕여행']"
뉴욕 여행 가면 꼭 써밋 전망대 가기 해 도시 자연 선호 편 가도 야경 안보 진짜 뭘 더 감동 생각 구성 돈 안 해질녘 해 실시간 구경 약간 눈물 야경 Tip 해질녘 낮 야경 보기 Tip 창가 다리 짝 사진 완전 찍기 저 다음 선하 newyork 뉴욕 여행 Tip Tip newyork,SUMMIT One Vanderbilt,"['#선하의newyork', '#뉴욕여행']"
가치 상승 로스 비즈 로스 비즈 빅데이터 마케팅 계정 등급 활성화 서비스 빅데이터 계정 분석 빅데이터 잠재 고객 타겟 팅 빅데이터 시장 분석 빅데이터 해시태그 분석 모든 걸 빅데이터 계정 컨설팅 서비스 젠 계정 관리 신뢰 빅데이터 상담 프로필 링크 클릭 천안 곳 유지 터 그램 화장 솜 뉴욕 여행 헤드셋 핑크 바이올렛 스카프 의류 촬영 대행 원룸 인테리어 단발머리 추천,,[]
트램 타고 뉴욕 야경 단돈 오천원 보기 장만 해 두시 여행 수 뉴욕 여행 꿀팁 yesnicole p 루즈벨트 아일랜드 향 트램 환상 일몰 야경 볼 수 구글맵 Roosevelt Island TramwayN 트레인 Lexington Av st 교통 결제 가능 카드 애플 페이 교통 지하철 역 구매 가능 편도 달러 교통카드 결제 가능 교통카드 지하철 머신 구매 하루 일주일 무제한 교통카드 사용 가능 교통 이용 시 현장 구매 충전 비 추천 줄 혼잡 꿀팁 트램 무조건 오른쪽 창가 일몰 시간 확인 탑승 장해 두시 꼭 후회 여행 꿀팁 계속 업로드 팔로 여행 정보 확인 수 yesnicole p Roosevelt Island TramwayN Lexington Av st,뉴욕,[]
뉴욕 간다 젠 여기 꼭 뷰 맛집 펍 브룩클린 브릿지 맥주 수 곳 이제 다시 뉴욕 여행 일기 차차 일몰 시간 하늘 뷰 보고 브리 스킷 얼마나 미드 왜 칭찬 알 수 시간 한국인 도 사람 일몰 여유 식사 심 전 추천 전 가두 뷰 이야기 시간 모룸 Time Out Market New York Water St Brooklyn NY 미국 Time Out Market New York Water St Brooklyn NY,NewYorkCity,[]
뉴욕 여행 코스 맛집 꿀팁 총 정리 장만 해 세상 정리 거기 맛집 뉴욕 유학생 제 사촌동생 pick 박 뉴욕 여행 일정 최대한 수 거리 일 정세운 코스 차 존 F 케네디 공항 도착 알 노매드 숙소 체크 블루 스톤 베슬 인텔리 젠 시아 카페 첼시 마켓 엠파이어 스테이 트 빌딩 차 Slate Cafe 브런치 에디슨 호텔 체크 거 스테이크 하우스 브라이언 트 파크 애플 트럼프 타워 써밋 전망대 매그놀리아 베이커리 조스 피자 브로드웨이 점 타임스퀘어 차 택시 타고 덤보 도착 Time out market 사 베이글 리버티 섬 자유의여신상 황소 동상 브루클린 브릿지 나미 노리 웨스트 지점 소호 르뱅 베이커리 차 한인 택시 예약 존 F 케네디 공항 칸쿤 이용 항공 편 대한항공 인천 뉴욕 뉴욕 칸쿤 호텔 알 노매드 Arlo Nomad SKY 룸 박 에디슨 박 알 노매드 호텔 Arlo Nomad SKY 룸 전망대 안 가도 생각 뷰 깡패 호텔 단 객실 정말 정말 박 정도 추천 에디슨 호텔 Hotel Edison New York 타임스퀘어 인근 위치 가격 호텔 도 재단 객실 꼭 뉴욕 여행 스팟 덤보 써밋 전망대 리버티 섬 자유의여신상 엠파이어 스테이 트 빌딩 브루클린 브릿지 브라이언 트 파크 트럼프 타워 타임스퀘어 브 로드 웨어 소호 거리 베슬 첼시 마켓 그 외 저 일정 뿐 못 록펠러 센터 메트로폴리탄 모마 미술관 더 하이라인 월드 전망대 센트럴 파크 등 곳 맛집 추천 브런치 Slate Cafe Nomad 가성 비 코스 요리 거 스테이크 하우스 예약 필수 베이글 베이글 타임 아웃 마켓 랍스터 첼시 마켓 랍스터 레이스 랍스터 롤 매그놀리아 컵케이크 바닐라 푸딩 피자 조스 피자 일식 나미 노리 웨스트 지점 예약 필수 커피 블루 스톤 라비 카 장해 두시 뉴욕 여행 뉴욕 여행 뉴욕 뉴욕 여행 코스 뉴욕 맛집 뉴욕 꿀팁 newyork newyorktravel travelgram dumbo pick F Slate Cafe Time out market F Arlo Nomad SKY Arlo Nomad SKY Hotel Edison New York Slate Cafe Nomad newyork newyorktravel travelgram dumbo,뉴욕,"['#뉴욕여행', '#뉴욕', '#뉴욕여행코스', '#뉴욕맛집', '#뉴욕꿀팁', '#newyork', '#newyorktravel']"
아기 수영복 포니테일 거실 서재 에르메스 지갑 뉴욕 여행 평촌 필라테스 실버 커플링,,[]
뉴욕 여행 꿈 도시 숨결 자유 여신 브루클린 다리 움 센트럴 파크 평온 뮤 지엄 예술 가득 찬 순간 등 뉴욕 매력 세계 중심지 여러분 뉴욕 매력 전 지금 일상 꿈 도시 뉴욕 센트럴 파크 Central Park 메모 리얼 뮤 지엄 Memorial Museum 메트로폴리탄 미술관 The Metropolitan Museum of Art 엠파이어 스테이 트 빌딩 Empire State Building 자유 여신 Statue of Liberty National Monument 브루클린 브리지 Brooklyn Bridge 브로드웨이 Broadway shutterstock unsplash pixabay 지금 트래블 링 여행 소식 Central Park Memorial Museum The Metropolitan Museum of Art Empire State Building Statue of Liberty National Monument Brooklyn Bridge Broadway shutterstock unsplash pixabay,,[]
NYFW Shoot for tommyhilfiger 벌써 달 전이 스트 레이 키즈 필릭스 리노 TommyHilfigerSS FelixxTommyHilfigerSs LeeknowxTommyHilfigerSS 타미힐피거 NYFW Shoot for tommyhilfiger TommyHilfigerSS FelixxTommyHilfigerSs LeeknowxTommyHilfigerSS,Newyork,[]
뉴요커 에디터 시리즈 베이글 뉴욕 베이글 베이글 뉴욕 티모시 샬라메 단골 베이글 맛집 에디터 최애 맛집 각 베이글 가게 별로 메뉴 추천 덤 뉴욕 여행 준비 중이 라면 저장 뉴욕 여행 준비 친구 공유 푸른 투어 인스타 팔로우 뉴욕 여행 꿀팁 미국 최대 여행사 푸른 투어,뉴욕,[]
뉴욕 여행 울산 필라테스 자격증 광주 안경 인천 강아지 키 오스 복합기 디자이너 일상 서울대 입구 pt pt,,[]
뉴욕 여행가 꼭 뉴욕 공원 여기 해도 뉴요커 기분 요 맛집 카페 총 정리 꿀팁 학교 입학 분 good tip school 꿀팁 학교 팔로우 꾸욱 누르기 뉴욕 공원 미국 미국여행 뉴욕 여행 뉴욕 맛집 센트럴 파크 뉴욕 카페 good tip school,,"['#뉴욕공원', '#뉴욕', '#미국', '#미국여행', '#뉴욕여행', '#뉴욕맛집', '#센트럴파크', '#뉴욕카페']"
밴쿠버 워홀 러 퀘벡 뉴욕 여행 방법 저 주 동안 밴쿠버 퀘벡 수생 마리 뉴욕 밴쿠버 여행 처음 퀘벡 쪽 투어 신청 투어 정말 정신 여유 여행 못 사실 깨 캐나다 미국 동부 자유여행 후기 주 동안 마음대로 계획 수생 마리 오직 단풍 열차 위해 해당 분 스킵 점 댓글 캐나다 미국 여행 정보 joeunsday 캐나다 여행 미국여행 퀘벡 뉴욕 밴쿠버 joeunsday,"Quebec City, Quebec","['#미국여행', '#퀘벡', '#뉴욕', '#밴쿠버']"
밤,,[]
가치 상승 로스 비즈 로스 비즈 빅데이터 마케팅 계정 등급 활성화 서비스 빅데이터 계정 분석 빅데이터 잠재 고객 타겟 팅 빅데이터 시장 분석 빅데이터 해시태그 분석 모든 걸 빅데이터 계정 컨설팅 서비스 젠 계정 관리 신뢰 빅데이터 상담 프로필 링크 클릭 시크릿 투톤 염색 뉴욕 여행 동대문 인테리어 경복궁 꽃집 관리 남자 점집 가야 밀면 천안 곳 해운대 애견샵 발렌타인,,[]
티비 가로수길 데이트 옴브레 뉴욕 여행 속초 포장마차 거리 아산 헬스장 영천동 꽃집 서산 곳,,[]
가치 상승 로스 비즈 로스 비즈 커스터 마이 징 서비스 빅데이터 계정 관리 추천 탭 확산 최적화 계정 대량 배포 젠 서비스 맞춤 상품 시간 비용 로스 비즈 커스터 마이 징 서비스 프로필 링크 클릭 상담 인천 헬스 뉴욕 여행 갤럭시 s 위스키 추천 발렌타인 점집 동대문 인테리어 살사 동호회 s,,[]
가치 상승 로스 비즈 로스 비즈 커스터 마이 징 서비스 빅데이터 계정 관리 추천 탭 확산 최적화 계정 대량 배포 젠 서비스 맞춤 상품 시간 비용 로스 비즈 커스터 마이 징 서비스 프로필 링크 클릭 상담 인테리어 소품 발렌타인 원룸 인테리어 점집 울산 이색 데이트 애쉬 블루 뉴욕 여행 스카프 경복궁 꽃집 관리 남자,,[]
레드 벨벳 슬기 준 뉴욕 소호 여행 쇼핑 리스트 NO 핫 거 YESSimone Rocha Wooster St New York NY 토 AM PM 일 PM PM 구 동성 Simone Rocha 공간 직원 곳 랍 Brandy Melville Broadway New York NY 목 AM PM 금토 PM PM 핀터레스트 감성 Brandy Melville 기본 아이템 찾기 GANNI Mercer St New York NY 토 AM PM 일 PM PM 하이 슬기 브랜드 트렌디 무드 우드버리 입점해 정보 타 미스 블로그 안 내 미국 여행 타 미스 NO YESSimone Rocha Wooster St New York NY AM PM PM PM Simone Rocha Brandy Melville Broadway New York NY AM PM PM PM Brandy Melville GANNI Mercer St New York NY AM PM PM PM,"SoHo, New York",[]
가치 상승 로스 비즈 로스 비즈 커스터 마이 징 서비스 빅데이터 계정 관리 추천 탭 확산 최적화 계정 대량 배포 젠 서비스 맞춤 상품 시간 비용 로스 비즈 커스터 마이 징 서비스 프로필 링크 클릭 상담 성수동 꽃집 갤럭시 s 위스키 추천 뉴욕 여행 발렌타인 관리 남자 경복궁 꽃집 점집 s,,[]
마케팅 가요 매출 제자리 주목 매출 정체 더 이상 노출 전략 실행 우리 컨설팅 교육 덤 맞춤 전략 진행 효과 브랜드 성장 환불 간의 빅데이터 분석 대표 비즈니스 꼭 전략 제공 더 오름 AI 마케터 디자이너 하나 그룹 실시간 전략 마케팅 진행 여러분 브랜드 브랜드 탈바꿈 당신 비즈니스 위 최고 파트너 지금 고민 동안 경쟁 발 태백 맛집 스카프 울산 이색 데이트 발렌타인 원룸 인테리어 점집 뉴욕 여행 애쉬 블루 원목 책장 AI,,[]
서산 곳 그램 천안 곳 뉴욕 여행 옴브레 아산 헬스장 위스키 추천 속초 포장마차 거리 옥 가로수길 데이트,,[]
