chunked_content,place,relevant_hashtags
NYC Summit One Vanderbilt Best Observation Decks in NYC Such an amazing experience summitov 뉴욕 제일 핫 핫 No 써밋 전망대 뉴욕 뉴욕 여행 여행 여행 맨해튼 써밋 감성 사진 데일 리코 디 데 일리 티디 뉴욕 핫 플써밋 전망대 뉴욕 전망대 서밋 소통 newyorkcity travel daily nyc newyork newyorktrip ootd likeforlikes manhattansummitonevanderbiltonevanderbilt dailylookinstagood likesummitov NYC Summit One Vanderbilt Best Observation Decks in NYC Such an amazing experience summitov No newyorkcity travel daily nyc newyork newyorktrip ootd likeforlikes manhattansummitonevanderbiltonevanderbilt dailylookinstagood likesummitov,SUMMIT One Vanderbilt,"['#뉴욕', '#맨해튼', '#뉴욕핫플', '#뉴욕전망대', '#newyork', '#manhattan']"
Despite all thats happening in the world right now it always gives hope that there will be a better tomorrow when I see this view Despite all thats happening in the world right now it always gives hope that there will be a better tomorrow when I see this view,Brooklyn Heights Promenade,[]
New York SUMMIT 도 채 신상 핫 레이스 서밋 전망대 통 유리 전망대 전면 거울 사진 찍기 곳 예약 마이 리얼 트립 광고 마이 리얼 트립 마이 리얼 크루 New York SUMMIT,SUMMIT One Vanderbilt,[]
Sunday Drinks w 언니 뉴욕 여행 newyork nyc 맨하탄 manhattan havenrooftop havenrooftopnyc 뉴욕 핫 먹방 스타 그램 술 스타 그램 친 스타 그램 Sunday Drinks w newyork nyc manhattan havenrooftop havenrooftopnyc,Haven Rooftop NYC,"['#뉴욕', '#newyork', '#맨하탄', '#manhattan', '#뉴욕핫플']"
RH rooftopRestoration Hardware 매장 꼭대기 위치 루프 탑 레스토랑 워낙 핫 예약 미리 시간 워 함 한국 느낌 랄 음식 기대 안 흡입 못 버거 인생 버거 매장 구경 재미 쏠쏠 RH rooftopRestoration Hardware,RH Rooftop Restaurant,[]
아침 더 공간 유럽 온 것 유럽 느낌 스푼 아기자기 플레이 팅 이탈리안 도넛 생크림 핫 초콜릿 barpisellino bombolini cioccolato hotchocolate westvillage newyorkcafe 레이지 데이지 카페 탐방 뉴욕 카페 탐방 뉴욕 카페 뉴욕 맛집 뉴욕 핫 barpisellino bombolini cioccolato hotchocolate westvillage newyorkcafe,Bar Pisellino,"['#뉴욕카페탐방', '#뉴욕카페', '#뉴욕맛집', '#뉴욕핫플']"
Fat Witch NewYork Chelsea Marketlwfir 인재 팻 위치 팻 위치 브라우니 뉴욕 핫 뉴욕 첼시 마켓 브라우니 커피 칼로리 폭탄 커피 브라우니 더블 초코 브라우니 브랙 퍼스트 오트밀 브라우니 Fat Witch NewYork Chelsea Marketlwfir,서울,"['#뉴욕핫플', '#뉴욕']"
만 맘 에드 곳,Public Kitchen,[]
Michelin star Kbbq 오늘 점심 저녁 성공 michelinstar koreanbbq 뉴욕 핫 뉴욕 맛집 미슐랭 스타 Michelin star Kbbq michelinstar koreanbbq,Cote Korean Steakhouse,"['#뉴욕핫플', '#뉴욕맛집']"
My first NBA game At Madison Square Garden thegarden jalenbrunson is so good But dbook kills the game in secondsnba newyorkknicks 뉴욕 핫 madisonsquaregarden msg basketball myfirstnba dbook jalenbrunson nbastyle knicks 뉴욕라이프 phoenixsuns My first NBA game At Madison Square Garden thegarden jalenbrunson is so good But dbook kills the game in secondsnba newyorkknicks madisonsquaregarden msg basketball myfirstnba dbook jalenbrunson nbastyle knicks phoenixsuns,Madison Square Garden,"['#newyorkknicks', '#뉴욕핫플', '#뉴욕라이프']"
It was the best Puff that Ive ever had bibbleandsip 너 어어 무 핫 standing 또 줄 서서 살 핫 맛 bibbleandsipnyc puff sesamepuff cafe cafestagram macaron dessert coffeetime newyorkcafe puffstagram mukbang lfl fff 소통 뉴욕 핫 뉴욕 카페 일상 소통 반 맞팔 스타 뉴욕 맛집 카페 스타 그램 It was the best Puff that Ive ever had bibbleandsip standing bibbleandsipnyc puff sesamepuff cafe cafestagram macaron dessert coffeetime newyorkcafe puffstagram mukbang lfl fff,Bibble & Sip,"['#뉴욕핫플', '#뉴욕카페', '#뉴욕맛집']"
RH 의 레스토랑 바리스타 바 newyorkcityrestorationhardware 엘 뉴욕 RH newyorkcityrestorationhardware,,[]
차차 마차 뉴욕 뉴욕 여행 뉴욕 맛집 차차 마차 뉴욕 차차 마차 chachamatcha chachamatchanyc 뉴욕 핫 뉴욕 핫 레이스 뉴욕 여행 코스 ny nycafe 일상 소통 맞팔 소통 맞팔 chachamatcha chachamatchanyc ny nycafe,Cha Cha Matcha,"['#뉴욕', '#뉴욕맛집', '#뉴욕차차마차', '#뉴욕핫플', '#뉴욕핫플레이스', '#뉴욕여행코스', '#nycafe']"
더 리오 늘 뉴욕 스냅 그랜드센트럴 역 맨하튼 일대 사진 세계 가장 기차역 이자 뉴요커 생활 중심지 중 하나 그랜드센트럴 웨딩사진 찍기 장소 랍 이번 촬영 비 날 도로 반사 네온싸인 더욱 매력 날씨 최고 사진 찍기 위해 항상 연구 노력 저희 더 리 사랑 오늘 하루 뉴욕 웨딩 스냅 뉴욕 웨딩사진 더 리 패키지 현재 이벤트 진행 중 신청서 확인 촬영 문의 카카오 톡 sky 홈페이지 포트폴리오 고객 리뷰 패키지 등 정보 눈 확인 수 검색 창 thehurycom 입력 더 리 제주 뉴욕 지점 모두 스튜디오 촬영 진행 클래식 스튜디오 컨셉 사진 문의 sky thehurycom,Grand Central Terminal,"['#맨하튼', '#뉴욕웨딩스냅', '#뉴욕웨딩사진']"
리얼 뉴욕 스타일 브런치,Comfort Diner,[]
MAGNOLIA 이집 바나나 푸딩 MAGNOLIA,Magnolia Bakery,[]
디아 비콘 공장 개조 미술관 요즘 컨셉 예전 아주 힙 시도 문화 어쩌면 가장 거리 노동 상징 문화 거점 탈바꿈 역 발상 몫 이번 날씨 때문 디아 비콘 출입구 디자인 눈길 기존 공장 증축 것 벽돌 다른 방식 통일 성과 다양성 모두 물 약간 기운 건물 사선 벽돌 패턴 내부 스태프 인사 전시장 정신 수 때 잠시 출입구 스태프 양쪽 빛 천 창 경관 제외 빛 현대 갤러리 주로 사용 방식 여기 투 공장 외관 유지 일석이조 효과 연광 이용 갤러리 계절 내부 매력 항상 볼 게 듯 곳,Dia:Beacon,[]
날씨 하루 응 커피,Brooklyn Bridge,[]
전세계 개 스타벅스 리저 브 로스 터리 뉴욕 첼시 마켓 바로 옆 커피 분 꼭 구경,Starbucks Reserve Roastery NYC,[]
너 무예 뻣던 모든 심지어 맛 디너 도 셀피 그램 셀 스타 일상 스타 그램 일상 뉴욕 맛집 뉴욕 일상 그램 데 일리 데 일리 그램 취저 레스토랑 인스타그램 분위기 맛집 뉴욕 핫 핫 레이스 발견 newyork daily instadaily selsta nyc nycrestaurants instagood prettycitynewyork selfie newyork daily instadaily selsta nyc nycrestaurants instagood prettycitynewyork selfie,Pinto Garden,"['#뉴욕맛집', '#뉴욕', '#뉴욕핫플', '#핫플레이스발견', '#newyork', '#nycrestaurants']"
뉴욕 여행 브루클린 브릿지 덤보 엠파이어스테이트 빌딩 dumbo brooklyn brooklynbridge newyork nyc manhattan dumbo brooklyn brooklynbridge newyork nyc manhattan,"DUMBO, Brooklyn","['#브루클린브릿지', '#엠파이어스테이트빌딩', '#brooklyn', '#brooklynbridge', '#newyork', '#manhattan']"
Top of the Rock Rockefeller Center 땅 맨해튼 스카이라인 서정 초고 층 빌딩 숲 다이나믹 일정 여러 개 고층 전망대 각기 장단점 중 록펠러 센터 탑 오브 더락 여행기 중첫 예약 주변 빌딩 가장 웅장 전망대 라서 트랙 션 칵테일 바나 음악 부차 전망 목적 탑 오브 더락 볼 수도 말 최근 핫 써밋 엣지 전통 전망대 스타일 것 마지막 사진 유료 트랙 션 철근 위 기념 사진 찍기 정도 나 뉴욕 가장 핫 써밋 전망대 후기 애 기념 사진 풍선 기 구등 흥미 본질 전망 어디가 더 뿐 전망 때 장단점 장점 한층 더 위로 유리 벽 전망 감상 아래층 관람객 사진 위층 미니 삼각대 정도 돌 난간 카메라 손 케어 다짐 제대로 촬영 써밋 엣지 어디 유리 벽 전망 단점 굳이 단점 꼽자 위층 통로 돌 난간 삼각대 자리 쭉 도로 전망대 한번 이동 삼각대 자리 매직 워 방향 촬영 주변 유명 고층 빌딩 가까이 반면 툭 느낌 취향 사이사이 항구 바다 엣지 써밋 전망 낫다 topoftherock rockefellercenter newyork nightview nightscape nightphotography newyorkcity magichour topoftherocknyc ig newyork sunsetphotography longexposure 야경 스타 그램 야경 사진 뉴욕 야경 록펠러 센터 탑 오브 더락 뉴욕 여행 여행 스타 그램 뉴욕 핫 여행사진 뉴욕 전망대 매직 워 노을 사진 Top of the Rock Rockefeller Center topoftherock rockefellercenter newyork nightview nightscape nightphotography newyorkcity magichour topoftherocknyc ig newyork sunsetphotography longexposure,Top of the Rock NYC,"['#newyork', '#뉴욕야경', '#록펠러센터', '#뉴욕핫플', '#뉴욕전망대']"
s s,RH Rooftop Restaurant,[]
보 곱창 마무리,뉴욕,[]
DarlingRooftopDarling 달링 ParkLaneHotel 파크 레인 호텔 루프 탑 뉴욕뉴욕 핫 darlingnewyork 층뷰 센트럴 파크 뷰 darlingrooftop 뉴욕 핫 파크 레인 호텔 층 달링 DarlingRooftopDarling ParkLaneHotel darlingnewyork darlingrooftop,Darling Rooftop,"['#파크레인호텔루프탑', '#뉴욕', '#뉴욕핫플', '#47층뷰', '#센트럴파크뷰']"
인형 인형의집 온 느낌 elaina yl 여우 리도 봄 뉴욕 핫 felixroastingco elaina yl felixroastingco,,['#뉴욕핫플']
은근 계속 malatesta 웨스트빌리지 핫 예약 때 추리 닝 파스타 때 자주 시금치 뇨끼 처음 중독 When you wanna dress down and spend quality time with nice food nothing posh Malatesta is the place Rustic and homey generous wine pouring ofc this is my goto pasta place from now malatesta When you wanna dress down and spend quality time with nice food nothing posh Malatesta is the place Rustic and homey generous wine pouring ofc this is my goto pasta place from now,Malatesta Restaurant,[]
채광 곳 런치 gabi 가비 x 뉴욕 gabi x,뉴욕,['#가비x뉴욕']
Eat the World Eat the NY 저 전 세계 가도 것 호들갑 안 대부분 그냥 서울 제일 사람 미국 그것 뉴욕 못 쪼끄 저 온 간증 아시아 유럽 음식 북미 남미 음식 아시아 NARO 나로 록펠러 센터 내 지하 위치 스케이트장 입구 바로 앞 모든 음식 번 그게 제일 맛 수 듯 재료 내 평소 형태 재료 식감 맛임 느낌 수 명동 칼국수 뉴저지 맛집 클스 모든 휴무 일 때 호황 곳 줄 맛 호황 냉면 맛남 더 갈비 갈비 밥 양 인분 수준 양도 무엇 된장찌개 정말 맛남 갈비찜 고기 루 메뉴판 옆 테이블 구경 하나 둘 계속 추가 탕수육 맛남 맛 가격 생각 문득 지난 여름 홍콩 CHA PAs Noodle 고기 고기 정도 면도 먹음 무엇 쏨땀 아주 맛남 유럽 가게 이름 생각 안남 뉴요커 추천 저 오징어 샐러드 진짜 친 국물 채소 병아리 콩 정말 불구 까르보나라 나 몸 DOUBLE ZERO 뉴욕 때 맛집 꼭 이 곳 피자 빵 끝 안 먹음 모든 재료 닉 피자 도우 글루텐 프리 변경 심지어 크림 비건 크림 가능 맛남 약간 세상 제일 피 CAFFE REGGIONYU 근처 이탈리아 뱅쇼 알 알콜 때 그냥 아무 기억 일단 분위기 내 카페 오이 주스 비엔나 자 토르 테 그 사과 파이 그 음식 수 곳 심지어 코로나 시절 뉴욕 임 사람 줄 서서 곳 라면 뭐 말 굳이 비엔나 안 여기 가세 편 또 투비컨티뉻 Eat the World Eat the NY NARO CHA PAs Noodle DOUBLE ZERO CAFFE REGGIONYU,NYC,[]
완공 허드슨 야드 중심 더 베셀 thevesselnyc 지난주 개장 뉴욕 인 핵심 레이스 일만 총 개 계단 연결 여개 뷰 포인트 입장료 무료 홈페이지 통해 사전 예약 오전 영업 베셀 중심 아트 센터 더 쉐드 뉴욕 최초 니 스 입점 복합 쇼핑몰 허드슨 야드 이 건물 층 위치 초고 층 전망대 엣지 오픈 예정 랍 잉크 마르 기전 후다닥 전 엑기스 뉴욕 여행 최신 정보 오 쇼 블로그 홈페이지 확인 ohshownet 허드슨 야드 더 베셀 뉴욕 여행 thevessel theshed edgenewyork 뉴욕 핫 뉴욕 관광 브로드웨이 뉴욕 뮤지컬 오 쇼 ohshownet thevesselnyc ohshownet thevessel theshed edgenewyork ohshownet,Hudson Yards New York,"['#뉴욕핫플', '#뉴욕관광', '#브로드웨이', '#뉴욕뮤지컬']"
왜 안 뉴욕 스팟 공유 숙소 근처 발견 영화 곳 뉴욕 그랜드센트럴 터미널 입구 그 주변 브릿지 사진 찍 때 감탄 곳 뉴욕 가면 그랜드센트럴 터미널 안쪽 구경 입구 그 주변 꼭 요강 츄츄 뉴욕 상징 하나 크라이슬러 빌딩 도 한눈,Grand Central Terminal,['#크라이슬러빌딩']
도 오늘 털 코트,브루클린,[]
StaySafe StaySafe,뉴욕,[]
A Michelin starred Korean bbq spot Cote Highly recommend this place Super high quality meats definitely the best korean bbq Ive ever had amazing service they cook the meat to perfection for you Even the rice side dishes the stews were amazing Swipe all the way right to see proof aka Ryan really enjoying his piece of wagyu 미슐랭 원 스타 코리안 바베큐 전문점 진짜 맛 고기 입 살살 고기 말 직원 고기 심지어 밥 반찬 찌개 미슐랭 만해 뉴욕 오시 꼭 추천 얼마나 맨 끝 사진 라이언 규 표정 A Michelin starred Korean bbq spot Cote Highly recommend this place Super high quality meats definitely the best korean bbq Ive ever had amazing service they cook the meat to perfection for you Even the rice side dishes the stews were amazing Swipe all the way right to see proof aka Ryan really enjoying his piece of wagyu,Cote Korean Steakhouse,[]
배 날퐌타 스틱 멤버 뉴욕 온 반 인연 정말 건 내 몫 칵테일 엘에이 캐치 술 인심 후 엘에이 뉴욕 주말,Catch Rooftop,[]
In fact some sunsets are so mindbogglingly beautiful that it can be hard to find words to describe thembrooklyn newyork nyc sunset sunsetlover brooklynheights brooklynheightspromenade prettycitynewyork newyorkcitylife goldenhourphotographynewyorkiloveyou newyorkskyline In fact some sunsets are so mindbogglingly beautiful that it can be hard to find words to describe thembrooklyn newyork nyc sunset sunsetlover brooklynheights brooklynheightspromenade prettycitynewyork newyorkcitylife goldenhourphotographynewyorkiloveyou newyorkskyline,Brooklyn Heights Promenade,"['#brooklyn', '#newyork', '#brooklynheights', '#brooklynheightspromenade']"
beauon kbeauon k 뉴욕 한인 피부 뉴욕 반영구 뉴욕 한인타운 뉴욕 피부 클리 닉 뉴욕 피부 뉴욕 두피 타투 뉴욕 에스 테티 션 뉴욕 피부 추천 미국 파 메스 테 뉴욕 아이라인 문신 뉴욕 피부관리 실 미국 세 라이트 뉴욕 mts 뉴욕 아이라인 타투 미국 파 이토 신 뉴욕 피부관리 뉴욕 문신 뉴욕 두피 문신 미국 슈퍼 젝션 뉴욕 에스테 뉴욕 피부 뉴욕 눈썹 문신 newyorknails newyorkskinshop 뉴욕 핫 beauon kbeauon k mts newyorknails newyorkskinshop,,[]
트립비 토즈 프로젝트 쇼 더 로케이션 Ep 영화 여행 영화 비긴 어게인 트립비 토즈 쇼로케 편 비긴 어게인 속 뉴욕 촬영 도장 Lost stars 뉴욕 거리 활보 느낌 워싱턴 스퀘어 파크 Washington square parkil laboratorio del gelato 워싱턴 파크 근처 젤라또 맛집 센트럴 파크 베이글 타임스퀘어 록펠러 센터 탑 오브 더 락 그래머시 시어터 베슬 The vessel 뉴욕 핫 이 안 이 내 결론 뉴욕 핫 더블 영화 비긴 어게인 비긴 어게인 촬영 뉴욕 핫 뉴욕 여행 뉴욕 맛집 뉴욕 여행 준비 타임스퀘어 베이글 워싱턴 스퀘어 파크 센트럴 파크 베슬 탑 오브 더락 록펠러 센터 illaboratiodelgelato 트립비 토즈 Ep Lost stars Washington square parkil laboratorio del gelato The vessel illaboratiodelgelato,New York,"['#뉴욕핫플', '#뉴욕맛집', '#센트럴파크', '#록펠러센터']"
ryung ee k 핫 탐험 roselane nyclife nycdaily 뉴욕 일상 뉴욕 커피 뉴욕 핫 맨하탄 맨하탄 일상 뉴욕 여행 티디 데 일리 패션 ryung ee k roselane nyclife nycdaily,Park Lane Hotel New York,"['#nycdaily', '#뉴욕일상', '#뉴욕커피', '#뉴욕핫플', '#맨하탄', '#맨하탄일상']"
youth 걱정 고민 것 포기 우린 youth,Devocion USA,[]
ICFF moments ICFF moments,ICFF Javits,[]
시 처럼 동화 미국 현생 때 앨범 미국 추억 곤 해 정말 공유 여행지 사진 현생 타협 차차 PM iphone pro New York USpier 뉴욕 클라인 선셋 크루즈 매일 오후 약 운항 성인 PM iphone pro New York USpier,맨해튼,[]
뉴욕 핫 오큘러스 산티아고 칼 라트 바제 라운드 세계 무역 타 추모 뉴욕 지하철역 쇼핑몰 오큘러스 아이 손 비둘기 모습 형상 디자인 누가 가시고기 상어 뼈 느낌 건축물 스페인 건축가 산티아고 칼 라트 라바 작품 제로 라운드 심볼 매력 디자인 공간 건축 인테리어디자인 단독 다가 구 다세대 주택 설계 상공간 인테리어 리 모델링,뉴욕,['#뉴욕핫플']
요즘 뉴욕 젤 핫 베슬뷰 레스토랑 눈 호강 입 호강 Asian inspired restaurant and bar with an international approach 와일드 잉크 뉴욕 맛집 뉴욕 핫 플베슬 달콤 뉴욕 hudsonyardsvesselwildinkvesselviewnightviewfoodpornnycfoodienyceats Asian inspired restaurant and bar with an international approach hudsonyardsvesselwildinkvesselviewnightviewfoodpornnycfoodienyceats,Quin Bar NYC,"['#뉴욕맛집', '#뉴욕핫플', '#달콤인뉴욕', '#nycfoodie']"
날씨 사람 돗자리 휴식 공간 산책 도하 치킨 힐링 곳 행복 센트럴 파크,"Central Park, New York",['#센트럴파크']
거 대한 집착 감 듯 이유 메르 세리 완전 실패 오픈 한지 꽤 만 경험 ma tre d 의 눈 애티튜드 예약 통로 급 듯 간이 테이블 메뉴 선택 폭 가격 대비 맛 별루 날 간 일행 매우 나 못 선택 식당 사진 찍기 전체 인테리어 구경 Still popular Le Mercerie in Soho Food is soso but decor is indeed pretty ma tre d Still popular Le Mercerie in Soho Food is soso but decor is indeed pretty,,[]
Its only Monday and Im already daydreaming about the weekend Its only Monday and Im already daydreaming about the weekend,,[]
buvette 테이블 의자 흰색 접시 음식 브런치 대명사 buvette 의 분위기 한마디 파리 카페 연성 케 부베트 서울 핫 부베트 뉴욕 은 주말 웨이 팅 때문 여유 평일 아침 부베트 처음 음식 생각 수도 은근 배 요 주문 avocado toast jambon cru almond croissant 제일 인상 메뉴 바로 아몬드 크루아상 보통 아몬드 크루아상 frangipane 아몬드 필링 하이라이트 부베트 아몬드 크루아상 바로 껍데기 부분 세상 바삭 버터 뤼 페이스트리 위 아몬드 슬 라이스 슈가 파우더 비록 먹기 전 옷 테이블 위로 견과류 설탕 가루 입 순간 아몬드 맛 버터 달달 슈가 파우더 입안 크루아상 아이스 아메리카노 모금 마치 고구마 우유 조합 정말 집 때 아몬드 크루아상 추가 사서 건 비밀 buvette buvette avocado toast jambon cru almond croissant frangipane,Buvette,['#부베트뉴욕']
개인 취향 저격 루프 탑 뉴욕 핫 은진 nyc nyc,Serra By Birreria,[]
나 한텐 코스 진짜 배 뻔,Jungsik 정식당,[]
꿈 로또 갈랬는데 전 팔찌 소 elise eunmi 의 뉴욕 핫 bookmarc elise eunmi bookmarc,Bookmarc,['#뉴욕핫플']
뉴욕 재즈 펍 여기 내 최애,Tomi Jazz,[]
If youre a trufflelover like myself this place is for you We were able to score a reservation at this buzzing restaurant in Greenwich village oaktuscantrufflelounge This Italian restaurant focuses on truffles this is probably the only restaurant in the city thats almost everything truffle We tried bruschetta truffle burger with foie gras tagliolino classico with freshly shaved truffles They were all delicious And last but not least the ice cream with toasted pine nuts and dry figs in truffle honey was amazing Great food and great hospitality This tiny quaint restaurant reminded me very much of my tuscan trip a year ago 중심 위치 이탈리안 레스토랑 메뉴 거의 모든 트러플 곳 여기 뉴욕 곳일 거 미국 트러플 구 순간 트러플 향 확 음식 주인 아저씨 직접 서빙 설명 저희 브루스 게타 라가 트러플 버거 파스타 잣 무화과 트러플 허니 아이스크림 저 디저트 제일 것 트러플 허니 살 수 맛 트러플 작년 투스카니 지방 여행 생각 예전 사진 좀 nyc newyork nyceats foodie nyclife foodiesofinstagram nycfood foodies oaktuscantrufflelounge truffle ig nyc delicious food dinner food foodnetwork newyorker wheretofindme truffles trufflelover foodlover manhattan 뉴욕 맨하탄 뉴욕 맛집 뉴욕 핫 뉴욕 일상 트러플 맨하탄 맛집 If youre a trufflelover like myself this place is for you We were able to score a reservation at this buzzing restaurant in Greenwich village oaktuscantrufflelounge This Italian restaurant focuses on truffles this is probably the only restaurant in the city thats almost everything truffle We tried bruschetta truffle burger with foie gras tagliolino classico with freshly shaved truffles They were all delicious And last but not least the ice cream with toasted pine nuts and dry figs in truffle honey was amazing Great food and great hospitality This tiny quaint restaurant reminded me very much of my tuscan trip a year ago nyc newyork nyceats foodie nyclife foodiesofinstagram nycfood foodies oaktuscantrufflelounge truffle ig nyc delicious food dinner food foodnetwork newyorker wheretofindme truffles trufflelover foodlover manhattan,Oak Tuscan Truffle Lounge,"['#newyork', '#newyorker', '#manhattan', '#뉴욕', '#맨하탄', '#뉴욕맛집', '#뉴욕핫플', '#뉴욕일상', '#맨하탄맛집']"
엠파이어스테이트 전망대 낮 밤 물감 낮 구름 밤 생 도시 운 묘 느낌 방향 돌 촬영 어둠 몸 개 라면 동시 모든 매직 엠파이어스테이트 뉴욕 가장 전망대 현역 최고 전망대 하나 생각 엠파이어스테이트 빌딩 야경 야경 스타 그램 뉴욕 야경 뉴욕 전망대 뉴욕 핫 뉴욕 여행 empirestatebuilding empirestate manhattan manhattanview nightview nightphotography nightsky newyork newyorkcity newyorktrip travelnewyork sunsetphotography empirestatebuilding empirestate manhattan manhattanview nightview nightphotography nightsky newyork newyorkcity newyorktrip travelnewyork sunsetphotography,Empire State Building,"['#엠파이어스테이트빌딩', '#뉴욕야경', '#뉴욕전망대', '#뉴욕핫플', '#manhattan', '#manhattanview', '#newyork']"
,Sarabeth's,[]
메리 메리 크리스마스 nyc christmasinnewyork newyork nyclife xmas xmastree newyorklike 크리스마스 메리크리스마스 christmastreedecor 뉴욕 뉴욕 일상 뉴욕 크리스마스 브룩필드 레이스 뉴욕 핫 뉴욕 댁 맨하탄 nyc christmasinnewyork newyork nyclife xmas xmastree newyorklike christmastreedecor,Brookfield Place New York,"['#newyork', '#newyorklike', '#뉴욕', '#뉴욕일상', '#뉴욕핫플', '#뉴욕댁', '#맨하탄']"
더 리 아침 브루클린 덤보 개인 스냅 요즘 브루클린 브릿지 덤보 노을 야경 촬영 정말 인기 감성 사진 새벽 촬영 진행 사실 해 전 야경 느낌 물씬 덤보 사진 해 햇살 브루클린 브릿지 촬영 수 무엇 매력 건 저녁 시간 달리 사람 북적 분위기 속 촬영 수 점 랍 저희 더 리 항상 분위기 속 촬영 수 노력 언제 상담 오늘 하루 브루클린 브리지 뉴욕 여행 더 리 패키지 현재 이벤트 진행 중 신청서 확인 촬영 문의 카카오 톡 sky 홈페이지 포트폴리오 고객 리뷰 패키지 등 정보 눈 확인 수 검색 창 thehurycom 입력 더 리 제주 뉴욕 지점 모두 스튜디오 촬영 진행 클래식 스튜디오 컨셉 사진 문의 sky thehurycom,Brooklyn Bridge,['#브루클린']
가을 선선 바람 바람 롤러코스터 뉴욕 날씨,,[]
개월 전 만해 오픈 전이 허드슨 야드 베슬 뷰 장관 베슬 티킷 인터넷 미리 예약 당일 현장 미리 예약 표 옆 쇼핑몰 더셰드 구경 식사 시간 요 간 일행 베슬 위 핸드폰 분실 바람 추억 하나 추가 히스테리 피 더 다행 에피소드 캬캬캬 영상 도 뷰 nychudsonyardsthevessel 에피 뉴욕 뉴욕 핫 nychudsonyardsthevessel,Hudson Yards New York,"['#에피뉴욕', '#뉴욕핫플']"
a fruitful autumny sunday 영경 브루클린 플리 마켓 데이트 살림살이 득템 재미 진짜 보물 게 윌리엄스버그 쪽 가야 브루클린 브릿지 브루클린 플리 마켓 덤보 bkflea brooklynbridge dumbo a fruitful autumny sunday bkflea brooklynbridge dumbo,"DUMBO, Brooklyn","['#브루클린브릿지', '#brooklynbridge']"
해외 여행 잠시 동안 뉴욕 핫 오픈 동시 뉴요커 뉴욕 써밋 전망대 소개 시티 뷰 맛집 뉴욕 눈 담 수 사방 온통 유리 거울 공간 감 수 지금 트리플 확인 triplekr 프로필 링크 클릭 triplekr,Newyork,[]
뉴욕 순 곳으루,SUMMIT One Vanderbilt,[]
street rizzoli 서점 인테리어 가드닝 요리 서적 티크 내부 책 무엇 서점 씨 곳 정말 rizzolibooks 레이디 inNYC 뉴욕 뉴욕 여행 감성 사진 여행 여행 스타 그램 newyork newyorkcity bookstagram bookstore nyc 뉴욕 핫 뉴욕 카페 뉴욕 일상 여행 뉴욕 쇼핑 소통 street rizzoli rizzolibooks inNYC newyork newyorkcity bookstagram bookstore nyc,뉴욕,"['#뉴욕', '#newyork', '#뉴욕핫플', '#뉴욕카페', '#뉴욕일상', '#뉴욕쇼핑']"
