chunked_content,place,relevant_hashtags
대학 친구 홍 민정 아나운서 유투 버 뉴욕 생활 차 뉴욕 정보 공유 계정 팔로 팔로 홍 mj mj,,[]
NYC JFK nomosoho 뉴욕 핫 만 소호 맛집 NYC JFK nomosoho,NoMo SoHo,"['#NYC', '#뉴욕핫플']"
뉴욕 핫 maman 커피 맛집 빵 맛집 아기자기 코지 분위기 한번 빵맛 번 곳 피스타치오 초콜릿 크로와상 정말 강추 겉바 속 촉 아몬드 크로와상 피스타치오 초콜릿 크로와상 콜드 브루 almondcroissant pistachiochocolatecroissant coldbrew coffee newyorkcafe maman almondcroissant pistachiochocolatecroissant coldbrew coffee newyorkcafe,Maman,['#뉴욕핫플']
온더로드 NY 요즘 유행 뉴욕 핫 인스타 감성 맛집 와인 바 랜드마크 TOP 해지 뉴욕 맞이 가기 곳 NY TOP,"New York, New York",[]
Oiji 오이지 뉴욕 이스트빌리지 모던 코리안 식당 며칠 전 피터 루거 스테이크 하우스 혹평 뉴욕타임즈 음식 평론가 Pete Wells 그 펜끝 레스토랑 천국 지옥 별 개 선사 극찬 레스토랑 뉴욕 어쩌면 미슐랭 더 신뢰 것 뉴욕타임즈 레스토랑 리뷰 별 점 인의 창의 열정 셰프 브라이언 킴 구태경 곳 주인공 한식 본질 메뉴 해석 힘 장난 치 더 브라이언 셰프 밤 이야기 레스토랑 경쟁 뉴욕 위해 셰프 거의 목숨 한식 미래 영 셰프 걱정 생각 기분 저녁 오이지 oiji 뉴욕타임즈 뉴욕 핫 브라이언 킴 셰프 구태경 셰프 누 메뉴 메뉴 사진 은 뉴욕타임즈 기사 Oiji Pete Wells oiji,OIJI MI,['#뉴욕핫플']
바리스타 자격증 친구 커피빈 추천 La Cabra 를 추천 걸 뉴욕 작년 요새 제일 핫 베이커리 카페 당장 커피빈 아무 생각 계산 이 깜쪽 주먹 커피빈 개 커피 알 못 저 마음 빵 또 금방 여기 제일 Cardamom Bun 커피빈 안 사고 그냥 빵 커피 곳 사람 운 수 해 La Cabra Cardamom Bun,La Cabra NYC,[]
베슬 포토 스팟 여기 워낙 한번 자꾸 베슬앞 마여 vesselhudsonyards 베슬 허드슨 야드 뉴욕 핫 달콤 뉴욕 vesselhudsonyards,The Vessel NYC,"['#뉴욕핫플', '#달콤인뉴욕']"
캐리어 정리 사진 정리 언제 다하지써밋 날 날씨 요정 날,SUMMIT One Vanderbilt,[]
오늘 버드 모드 눈 시티 씐났다 간만 핫 샐러드 꿀맛 dailysaturdayvibeseggshopnycsohohipplacebruncheggnavothaicomhangoutdminilife 일상 샵 맨하탄 뉴욕 dmini 라이프 꿀맛 뉴욕 핫 뉴욕 일상 뉴욕 맛집 주말 나들이 dailysaturdayvibeseggshopnycsohohipplacebruncheggnavothaicomhangoutdminilife dmini,Egg Shop NYC,"['#간만에핫플', '#맨하탄', '#뉴욕', '#뉴욕핫플', '#뉴욕일상', '#뉴욕맛집']"
nusretsteakhouse 한국 유명 고깃집 아들 램 추천 방문 누 스렛 스테이크하우스 moma 뉴욕 현대 미술관 바로 앞 터키인 오 너 쉐프 소금 과장 액션 혹시 비주 얼 인스타 맛집 걱정 세계 고깃집 모두 그 집 아들 램 추천 이유 맛 양념 식 재료 소금 중요시 내 취향 글 글 버터 누스렛 스페셜 안심 거의 인생 스테이크 수준 거 한국 인기 듯 후식 moma 앞 길거리 스벅 뉴욕 맛집 뉴욕 여행 뉴욕 핫 스테이크 맛집 newyork travelstagramnewyorkhotplace nusretsteakhouse moma moma newyork travelstagramnewyorkhotplace,Nusr-Et Steakhouse New York,"['#뉴욕맛집', '#뉴욕핫플', '#newyork', '#newyorkhotplace']"
Joes Pizza joes Pizza Pino Joe Pozzuoli Joes Pizza joes Pizza Pino Joe Pozzuoli,Joe's Pizza,[]
Enjoying the warm weather with bae 예전 보고 Mediterranean 맛집 Branzino 도 dip 도 Pita bread 한번 더 리필 순식간 둘이서 흡입 Enjoying the warm weather with bae Mediterranean Branzino dip Pita bread,Miss Ada,[]
만 뉴욕 뉴욕 만 루프 탑 멤버 뉴욕 또 뉴욕 핫 루프 탑 매니아,뉴욕,['#뉴욕핫플']
뉴욕 사랑,SUMMIT One Vanderbilt,[]
에이스 호텔 디자인 로만 앤 윌리엄스 rwguild 운영 곳 리빙 레스토랑 소호 lamerceriecafe nycrestaurantnycbusinesstripvillatov 뉴욕 핫 nyc villatov rwguild lamerceriecafe nycrestaurantnycbusinesstripvillatov nyc villatov,La Mercerie,['#뉴욕핫플']
분위기 굿 피날레 노모 키친 뉴욕 핫 뉴욕 여행 나니 newyork newyork,NOMO Kitchen,['#뉴욕핫플']
요새 여기 인스타그램 핫 라며 차차차 뉴욕 뉴욕 여행 뉴욕 맛집 차차 마차 뉴욕 차차 마차 chachamatcha chachamatchanyc 뉴욕 핫 뉴욕 핫 레이스 뉴욕 여행 코스 ny nycafe 일상 소통 맞팔 소통 맞팔 chachamatcha chachamatchanyc ny nycafe,Cha Cha Matcha,"['#뉴욕', '#뉴욕맛집', '#뉴욕차차마차', '#뉴욕핫플', '#뉴욕핫플레이스', '#뉴욕여행코스', '#nycafe']"
분위기 프렌치 레스토랑 boucherienyc 요새 피드 종종 보 곳 한번 벌써 기회 지점 군데 인테리어 나름 steaktartare 거 진짜 추천 템 약간 와사비 맛 완전 킥 메 츄리 알 귀욤 escargot 처음 달팽이 요리 골뱅이 산낙지 마당 달팽이 바질 파슬리 향 양념 맛 eggsbenedict 식당가 평타 메뉴 무난 천장 뚤려있어 채광 서비스 인테리어 음식 단지 흠 라면 테이블 간격 좀 웨스트 지점 층 자리 층 나름 직함 점심 저녁 메뉴 재 방문 의사 westvillage greenichvillage nycfoodie nycbrunch 달팽이 요리 프렌치 레스토랑 뉴욕 맛집 뉴욕 일상 뉴욕 여행 팔 주말 스타 그램 westvillagefood boucherie frenchnyc 뉴욕 먹방 뉴욕 핫 뉴욕 브런치 boucherienyc steaktartare escargot eggsbenedict westvillage greenichvillage nycfoodie nycbrunch westvillagefood boucherie frenchnyc,Boucherie,"['#nycfoodie', '#뉴욕맛집', '#뉴욕일상', '#뉴욕먹방', '#뉴욕핫플', '#뉴욕브런치']"
브런치 쫌 핫 뉴욕 브런치 재 방문 여기 쫌맛 여 뉴욕 맛집 뉴욕 핫 플루 비 스카 페달 콤 뉴욕 foodpornnycfoodiesnyceats foodpornnycfoodiesnyceats,Little Ruby's Cafe,"['#뉴욕브런치', '#뉴욕맛집', '#뉴욕핫플', '#달콤인뉴욕']"
스타벅스 리저 브 로스 터리 첼시 마켓 점 뉴욕뉴욕 스타벅스 첼시 마켓 옆 리저 브 로스 터리 매장 구경 곳 뉴욕 가장 스타벅스 구경 좀 일단 매장 원두 기계 정말 크게 자리 잡고 천장 원두 사람 촬영 라인 별로 커피 종류 판매 리저 브 원두 종류 층 커피 주제 Bar 도 술 커피 칵테일 굿 상품 텀블러 뿐 의류 시계 등 굿 상품 판매 구경 Bar,,[]
The prettiest beach in New York The prettiest beach in New York,"67 Steps Beach Greenport, Ny",[]
littleislandnyc littleisland 알콩 리본 뜬금 뉴욕 핫 littleislandnyc littleisland,Little Island NYC,['#뉴욕핫플']
신랑,Serra By Birreria,[]
Happy anniversary 미슐랭 스타 일레븐 메디슨 파크 오늘 얼마 뉴욕 핫 브런치 원래 달 번만 먹기 다짐 일주일 한번 바꿈 여자 여기 분위기 조 코 음식 JMT 세상 부부 것 서로 점 이해 그냥 결혼 주년 결혼기념일 뉴욕 부부 뉴욕 핫 뉴욕 맛집 부부 스타 그램 nycbrunch Happy anniversary JMT nycbrunch,RH Rooftop Restaurant,"['#뉴욕핫플', '#뉴욕맛집']"
Aught New York opening hoursWednesday Sunday pm Aught New York opening hoursWednesday Sunday pm,,[]
Thursday night with ma girls 모히또 루프 탑 한잔 뉴욕 루프 탑바 뉴욕 일상 루프 탑바 rooftopbar rooftopbarnyc cocktails 칵테일 뉴욕 핫 thetopofthestandard nyc ootd 티디 selfie Thursday night with ma girls rooftopbar rooftopbarnyc cocktails thetopofthestandard nyc ootd selfie,Top of the Standard,"['#뉴욕루프탑바', '#뉴욕일상', '#뉴욕핫플']"
New York SOHO my kind of areasoho newyork 뉴욕 핫 citywalk streetstyle outfitinspiration ootd style fashion girlstyle stylecreator getthelook model streetfashion ringeriscool 그냥 New York SOHO my kind of areasoho newyork citywalk streetstyle outfitinspiration ootd style fashion girlstyle stylecreator getthelook model streetfashion ringeriscool,New York,"['#newyork', '#뉴욕핫플', '#citywalk']"
urbantae 덕분 온 atoboynyc 또 남편 감사 고구마 밥 자꾸 치킨 jmt 뉴욕 핫 스타 그램 koreanfrench instafood atoboy nyc newyork urbantae atoboynyc jmt koreanfrench instafood atoboy nyc newyork,Atoboy,"['#뉴욕핫플', '#newyork']"
나 왓 당초 바니 뉴욕 브런치 뉴욕 핫 인스타 핫 초 바니 chobani chobanisoho newyork soho 뉴욕 여행 뉴욕 맛집 chobani chobanisoho newyork soho,Chobani Soho,"['#뉴욕브런치', '#뉴욕핫플', '#newyork', '#뉴욕맛집']"
시카고 커플 썬데이 브런치 해장 샴페인 nomosoho 뉴욕 브런치 뉴욕 맛집 뉴욕 여행 뉴욕 핫 브런치 맛집 신혼 생활 신혼 일상 nycbrunch nomosoho nycbrunch,NoMo SoHo,"['#뉴욕브런치', '#뉴욕맛집', '#뉴욕핫플']"
예술 레이어 드 보고 감탄 또 감탄 로 상 뉴욕 핫 뉴욕 일상 오늘 뉴욕 디저트 맛집 슈퍼문 베 이크 하우스 제 한번,Supermoon Bakehouse,"['#뉴욕핫플', '#뉴욕일상']"
뉴욕 루프 탑 추천 분위기 진짜 사람 뷰 황홀 화장실 야외 뷰 꼭 해,,[]
뉴욕 여행 자유의여신상 자유 여신 페리 볼 수 자유 여신 보이 Alicia Keys New York 얼마나 동영상 소리 키 저 일정 제일 수 코스 마제스틱 페리 브루클린 브릿지 스카이라인 감상 수 시간 분 마제스틱 페리 추천 Pier South St New York NY pier pier nyc majesticcruise majesticferry statueofliberty Alicia Keys New York Pier South St New York NY pier pier nyc majesticcruise majesticferry statueofliberty,Statue of Liberty New York,[]
뉴욕 전망대 무료 팁 엣지 전망대 입장료 줄 서서 가지 피크 레스토랑 라운지 테이블 예약 resy 이용 줄 안 무료 식사 메인 자리 코스 요리 주문 필수 코스 요리 분 저 라운지 테이블 예약 가시 직원 창가 달라 제일 자리 주심 메뉴 단 품 메뉴 주류 저 빵 맥주 잔 택 스랑 팁 X 주 고도 엣지 전망대 입장 티켓 값 안 실화 겨울 실내 맥주 전망 무료 셈 전망 식사 칼 바람 야외 전망대 얼른 사진 여기 술 한잔 뉴욕 여행 뉴욕 맛집 뉴욕 레스토랑 edge 전망대 peakrestaurant 미국여행 뉴욕 핫 써밋 뉴욕 전망대 허드슨 야드 resy X edge peakrestaurant,"The Edge, Hudson Yards","['#뉴욕맛집', '#뉴욕레스토랑', '#peakrestaurant', '#뉴욕핫플', '#뉴욕전망대']"
와우 뉴욕 핫 뜸 이안 애 뉴욕,RH Rooftop Restaurant,['#뉴욕핫플']
A great experience to visit a cool place in NYC 곳 일상 요즘 A great experience to visit a cool place in NYC,Brookfield Place New York,[]
여행 요즘 뉴욕 가장 핫 전망대 써밋 사진 사람 여기 인생 샷 백장 천장 만장 수 SUMMIT One Vanderbilt 오픈 시간 화요일 휴무 티켓 가격 일반 시간대 시간대 주소 및 입구 E nd St New YorkTD BANK 옆 계단 층 아래 에스컬레이터 두 층 아래 때문 안 층별 설명 B 층 티켓 확인 후 입장 덧신 및 선글라스 대여 줌 층써밋 메인 플로 풍선 방 층 조금 더 전망 공간 바닥 유리 포토 스팟 층 야외 카페 및 테라스 기념품 옷차림 덧신 필수 신어 걸 수 롱 원피스 추천 바닥 유리 하의 반바지 추천 스커트 원피스 속 바지 필수 눈 때문 선글라스 것 추천 원색 옷 사진 포토 스팟 층 엘리베이터 타고 도착 곳 여기 메인 플로 창가 자리 사수 거울 샷 것 추천 사람 사진 곳 찍기 가장 인기 곳 엠파이어 스테이 트 빌딩 곳 풍선 방 창가 중간 거울 근처 찍기 풍선 방 사진 영상 부메랑 더 워낙 포토 스팟 경쟁 곳 얼굴 철판 좀 함 층 층 덜 사진 찍 수 바닥 유리 포토 스팟 공식 카메라 사진 줌 유리 바닥 개인 폰 사진 시간 미만 왼쪽 엠파이어스테이트 빌딩 쪽 다음 다다다 찍기 미리 스마트폰 렌즈 다다다 사진 찍 준비 해 두기 요즘 뉴욕 가장 핫 써밋 오픈 런 오후 오픈 런 덜 편 일몰 시간대 티켓 뿐더러 사람 때문 각오 불구 여기 일몰 것 뉴욕 뉴욕 여행 SUMMIT One Vanderbilt E nd St New YorkTD BANK B,SUMMIT One Vanderbilt,['#뉴욕']
sohorestaurant nyclife indoordiningnyc vestry worthmoney 뉴욕 sohorestaurant nyclife indoordiningnyc vestry worthmoney,The Dominick,['#뉴욕']
뉴욕 통신원 heerawin 언니 인스타 로만 핫 오늘 날씨 애데 렐라 쥬니 홈 뉴욕 heerawin,L'Amico NYC,[]
발견 소호 핫 까페 차차 마차 완전 입구 취향 저격 커피 안 녹차 라떼 편이 계속 흥분 직원 마차 직접 음료 만 분위기 인정 센스 인정 라떼 맛 초딩 입맛 나 스 위트 너 개 사실 너므 수 크림 못 담 다시 닷 소호 카페 차차 마차,Cha Cha Matcha,[]
곳 뉴욕 프릭 컬렉션 프릭 컬렉션 뉴욕 미술관 미술 뉴욕 핫 개인 저택 미술관 박물관 미술 작품 수집 부호 가보 옴 주인 프릭 컬렉션 정원 ny nyc 뉴욕 맨해튼 여행 스타 그램 여기 집사 ny nyc,The Frick Collection,"['#뉴욕프릭컬렉션', '#뉴욕미술관', '#뉴욕핫플', '#뉴욕', '#맨해튼']"
뉴욕 핫 도미니크 안 셰프 또 다른 샵 도미니크 안 키친 디자인 디저트 메뉴 눈길 끌 작 인테리어 셰프 베이 킹 장면 엑스레이 사진 처럼 데코 dominqueanselbakery 도미니크 안 뉴욕 핫 뉴욕 맛집 요리 인류 클럽 dominqueanselbakery,Dominique Ansel Kitchen,"['#뉴욕핫플', '#뉴욕맛집']"
햇살 맛집 nycrestaurant prettycitynewyork dailypic daily selfie selca instagood instadaily dailyfeed nyc 뉴욕 뉴욕 맛집 데 일리 일상 그램 일상 샷 셀피 그램 셀피 브루클린 셀카 일상 분위기 맛집 분위기 깡패 뉴욕 핫 인스타 성 감성 카페 nycrestaurant prettycitynewyork dailypic daily selfie selca instagood instadaily dailyfeed nyc,Apollonia Brooklyn,"['#nycrestaurant', '#뉴욕', '#뉴욕맛집', '#브루클린', '#뉴욕핫플']"
Some of my best snaps from KerbersFlowers chickens ducks and the farm vibe everything was just so peaceful and beautiful Some of my best snaps from KerbersFlowers chickens ducks and the farm vibe everything was just so peaceful and beautiful,"Kerber's Farm Long Island, New York",[]
newyork 사진 분위기 여기 핫 뉴욕 핫 publickitchentheselects newyork publickitchentheselects,Public Kitchen,['#뉴욕핫플']
Visited the Nintendo Store in New York City It was fun but I wish they had more of a Pok mon selection I really wanted to buy another Pok mon plush but they didnt have any that interested me Regardless I love Nintendo so it was still fun to look aroundFun fact Legend of Zelda is actually one of my favorite video game series ever If you like video games what do you like to play 닌텐도 마리오 젤다의전설 젤다 린 동물의숲 포켓몬 포켓몬스터 커비 소품 하루 재미 뉴욕 핫 뉴욕 여행 닌텐도 뉴욕 쇼핑 비디오게임 nintendostore nintendonyc nintendostorenyc mario legendofzelda kirbykirbykirby animalcrossingaddict pokemonplush nyctravel newyorktrip shopwithme manhattannyc Visited the Nintendo Store in New York City It was fun but I wish they had more of a Pok mon selection I really wanted to buy another Pok mon plush but they didnt have any that interested me Regardless I love Nintendo so it was still fun to look aroundFun fact Legend of Zelda is actually one of my favorite video game series ever If you like video games what do you like to play nintendostore nintendonyc nintendostorenyc mario legendofzelda kirbykirbykirby animalcrossingaddict pokemonplush nyctravel newyorktrip shopwithme manhattannyc,NintendoNYC,"['#뉴욕핫플', '#닌텐도뉴욕', '#manhattannyc']"
Charles Prime Rib Just wow 예약 a must go 생각 서비스 매우 음식 말 것 사이드 별로 고기 집중 Charles Prime Rib Just wow a must go,4 Charles Prime Rib,[]
timesquare newyork 뉴욕 핫 photography citywalk travelphotography fashionblogger outfitinspiration 여행 스타 그램 nakedcowboynyc timesquare newyork photography citywalk travelphotography fashionblogger outfitinspiration nakedcowboynyc,"Times Square, New York City","['#newyork', '#뉴욕핫플', '#citywalk']"
최근 간 곳 중 내부 가장 분위기 레스토랑 위 구성 콜키 안 와인 꼭 가기 대신 뉴욕 스테이 트산 와인 lobster salmon banana pudding short rib ravioli grilled octopus 뉴욕뉴욕 맛집 뉴욕 호텔 뉴욕 여행 월스트리트 분위기 맛집 뉴욕 일상 뉴욕 생활 신혼 생활 신혼 일상 뉴욕 핫 beekmanhoteltemplecourt lobster salmon banana pudding short rib ravioli grilled octopus beekmanhoteltemplecourt,Temple Court - The Beekman,"['#뉴욕', '#뉴욕맛집', '#뉴욕호텔', '#뉴욕일상', '#뉴욕생활', '#뉴욕핫플']"
whitbynyc 커피타임 coffeetime nyclife 뉴욕 카페 추천 뉴욕 일상 뉴욕 핫 whitbynyc coffeetime nyclife,The Whitby Hotel,"['#뉴욕카페추천', '#뉴욕일상', '#뉴욕핫플']"
약속 시간 남아 그릇 구경 lamercerie 맘 쏙 세라믹 그릇 주문 매치 그릇 가득 뉴욕 여행 오심 한번 세라믹 그릇 핸드 메이드 lamercerie,La Mercerie,[]
금요일 금요일 밤 OFFAIR 금금 밤 오프 에어 이서진 뉴욕뉴욕 OFFAIR,,['#이서진의뉴욕뉴욕']
세계 미술관 뉴욕 메트로폴리탄 미술관 건물 외관 한국 대표 설치미술가 이불 작품 설치 예정 metmuseum 미국 뉴욕 메트로폴리탄 미술관 내년 건물 정면 외관 한국 대표 설치미술가 이불 작가 작품 장식 예정 영국 내셔널 갤러리 프랑스 루브르 박물관 러시아 에르미타시 미술관 스페인 프라 미술관 세계 미술관 솝 미국 뉴욕 메트로폴리탄 미술관 이하 메트은 매년 명 방문 최고 권위 미술관 평가 그동안 메트로폴리탄 미술관 한국 작가 작품 전시 수 차례 미술관 대표 얼굴 수 건물 외부 한국 작가 작품 설치 것 이번 처음 요 메 이불 작가 대해 작품 온 이불 동시 최고 한국 현 미술가 창의 기술 혁신 기술 전문성 작품 통합 작가 설명 이불 작가 작품 내년 부터 설치 예정 해당 기간 동안 뉴욕 방문 꼭 한번 이불 작가 작 품세 이불 LEE BUL 드로잉 조각 회화 설치 미술 비디오아트 등 움 욕망 부패 쇠퇴 등 주제 표현 한국 설치미술가 베니스 비엔날레 한국 대표 참여 호암 예술상 수상한 바 디 포인트 세계 미술관 뉴욕 메트로폴리탄 미술관 이불 작가 작품 건물 외관 정면 장식 예정 작품 내년 부터 설치 예정 The Metropolitan Museum of Art th Ave New York NY USA EVERYDAY 금토 수 관 Sep May Photograph The Metropolitan Museum of Art LEE BUL 이불 작가 메트로폴리탄 뮤 지엄 d careeer metmuseum LEE BUL The Metropolitan Museum of Art th Ave New York NY USA EVERYDAY Sep May Photograph The Metropolitan Museum of Art LEE BUL d careeer,"The Metropolitan Museum of Art, New York",[]
애 둘 브런치 신랑 서로 바톤 터치 흡입 사진 모두 올리버 안고 것 오늘밤 삼 십견 예약 자기야 다음 친구 애기 보고 밤 염 칵테일 한잔 구 뉴욕 핫 뉴욕 카페 뉴욕 레스토랑 뉴저지 맘 thetimesquareeditionnycrestaurants thetimesquareeditionnycrestaurants,The Times Square EDITION,"['#뉴욕핫플', '#뉴욕카페', '#뉴욕레스토랑', '#뉴저지맘', '#nycrestaurants']"
의 날 누옄 핑크 소세지,"New York, New York",[]
요즘 뉴욕 가장 핫 전망대 뉴욕 전망대 최고봉 써밋 전망대 요즘 뉴욕 최고 핫 라면 여 기일 지도 더 빌트 빌딩 층 눈 깜짝 사이 층 도 반사 미러 구조 통 유리 공간 써밋 개 층 남쪽 엠파이어 스테이 트 빌딩 북쪽 오 센트럴 파크 뉴욕 업타운 서쪽 엣지 전망대 동쪽 크라이슬러 빌딩 등 위치 뉴욕 뷰 감상 수 강추 New York 미국 SUMMIT 다른 전망대 전시관 체험 볼거리 미러 존 통 유리 치마 통큰 바지 수 주의 신발 덧신 것 착용 티켓 일몰 시간 주말 가격 달라 티켓 종류 기본 입장권 밋 화요일 휴무 금토 목 일몰 시간 가장 사람 참고 광고 마이 리얼 트립 마이 리얼 루블 링 유리 뉴욕 summit 써밋 전망대 New York SUMMIT summit,Summit NYC,[]
am so young 덕 뉴욕 핫 love my sister nyc 뉴욕 뉴욕 핫 am so young love my sister nyc,Mercado Little Spain,"['#뉴욕', '#뉴욕핫플']"
JMTGR 존맛 당 충전 풀 충전 충전 과잉행동 맛 뉴욕 핫 뉴욕 여행 뉴욕 맛집 JMTGR,Dominique Ansel Bakery,"['#뉴욕핫플', '#뉴욕맛집']"
서울 뉴욕 여자 모이 꼭 대화 주제 필라테스 필라테스 얘기 나 뿌듯 RHrooftop 뉴욕 RHrooftop,RH Rooftop Restaurant,['#2018팡뉴욕']
더 리가 순간 진짜 평소 모습 자연 신랑 신부 촬영 시작 때 순간 미소 모습 두 분 사랑 저희 더 리 여러분 웃음 분위기 낼 수 늘 최선 언제 상담 오늘 하루 뉴욕 스냅 뉴욕 웨딩촬영 더 리 패키지 현재 이벤트 진행 중 신청서 확인 촬영 문의 카카오 톡 sky 홈페이지 포트폴리오 고객 리뷰 패키지 등 정보 눈 확인 수 검색 창 thehurycom 입력 더 리 제주 뉴욕 지점 모두 스튜디오 촬영 진행 클래식 스튜디오 컨셉 사진 문의 sky thehurycom,뉴욕,['#뉴욕웨딩촬영']
세상 천재 시골 동네 자리 듯 빵집 bakeri 비주 맛 용서 수 심지어 너트 쿠키 bakeri,,[]
분위기 컬러 동생 디저트 완벽 뉴욕 리 cafegitane newyorknewyorkcitynewyorkcafecafegitanegitanenewyork 뉴욕뉴욕 여행 뉴욕 카페 뉴욕 핫 뉴욕 디저트 뉴욕 소호 뉴욕 소호 카페 뉴욕 소호 거리 cafegitane newyorknewyorkcitynewyorkcafecafegitanegitanenewyork,Cafe Gitane NoLita,"['#뉴욕씨리', '#newyork', '#뉴욕', '#뉴욕카페', '#뉴욕핫플', '#뉴욕디저트', '#뉴욕소호', '#뉴욕소호카페', '#뉴욕소호거리']"
뉴욕 핫 사진 모음 테슬라 타고 단독 투어 날 가이드 핫 댜 주요 장소 사진 위주 dumbobrooklyn 맨하탄 브릿지 사이 엠파이어 스테이 츠 빌딩 이 거리 사진 핫 웨딩 촬영 timeoutnewyork 타임 아웃 폐공 푸드코트 여기 음식 값 역시 뉴욕 rockefellercenter 록펠러 센터 겨울 이면 대형 크리스마스트리 설치 록펠러 센터 광장 줄리어드 말로 줄리어드 처음 보고 감격 층 샵 기념품 베슬 thevessel 건축 관심 쭌 진짜 보고 건축물 영상 보고 실물 첼시 마켓 핫 곳 첼시 마켓 옆 starbucksreserve 로스팅 기계 대형 스타벅스 리저 브 매장 구글 뉴욕 오피스 빌딩 층 구글 구경 기운 eblin 쭌 뉴욕 여행 뉴욕 여행 피드 업뎃 계속 뉴욕 여행 추천 뉴욕 자유여행 뉴욕 곳 뉴욕 여행사진 초등맘 초딩 아들 초등맘 스타 그램 미국여행 여행 기록 초등맘 일상 dumbobrooklyn timeoutnewyork rockefellercenter thevessel starbucksreserve eblin,New York City,"['#뉴욕핫플', '#록펠러센터', '#뉴욕여행추천', '#뉴욕자유여행', '#뉴욕가볼만한곳', '#뉴욕여행사진']"
내년 더 살 더 신랑 케어 아주 고생 태 케어 고생 곳 층 층 가구 갤러리 층 루프 탑 레스토랑 뉴욕 여행 오시 분 꼭 오시 추천 newyork dinner 뉴욕 핫 주년 newyork dinner,RH Rooftop Restaurant,"['#newyork', '#뉴욕핫플']"
newyork 뉴욕 랄프 커피 뉴욕 ralphlauren 첫 뉴욕 여행 수박 겉핡기 두번째 나 뉴욕 여행 뉴욕 곳곳 뉴욕 핫 뉴욕 핫 추천 newyork ralphlauren,뉴욕,"['#newyork', '#4월뉴욕', '#뉴욕', '#뉴욕핫플', '#뉴욕핫플추천']"
birthdaydinner 친구 생일 파티 겸 뉴욕 핫 탐방 분위기 맛 최고 boucherie 생일 파티 먹방 파티 oystersonionsoup escargots mushroomravioli tomahawksteaksteamedmusselsprofiterolesicecream 뉴욕 핫 뉴욕 맛집 뉴욕 맛집 추천 분위기 맛집 맛집 추천 뉴욕 스테이크 맛집 스테이크 맛집 토마호크 스테이크 프랑스 요리 frenchrestaurant birthdaydinner boucherie oystersonionsoup escargots mushroomravioli tomahawksteaksteamedmusselsprofiterolesicecream frenchrestaurant,La Grande Boucherie,"['#뉴욕핫플탐방', '#뉴욕핫플', '#뉴욕맛집', '#뉴욕맛집추천', '#뉴욕스테이크맛집']"
뉴욕 핫 꽃 가득 찬 곳 여기 serrabybirreria daily newyork manhattan 일상 데 일리 세 라바 이비 레 리아 뉴욕 루프 탑 날씨 최고 뉴욕 핫 꽃 득찬곳 취향 저격 꽃 스타 그램 그램 serrabybirreria daily newyork manhattan,Serra By Birreria,"['#newyork', '#manhattan', '#뉴욕루프탑', '#뉴욕핫플']"
네버엔딩 뉴욕스토리 이제 끝 뉴욕 마지막 밤 울 너구리 수다 삼 매경 마침 너구리 루프 탑바 울 호텔 꼭대기 곳 꽤 시간 여기 진짜 존 뉴욕 야경 한번 곳 현 지인 워낙 핫 곳 예약 필수 소리 백 뉴욕 마지막 날,Westlight,[]
온더로드 NY 주말 방문 뉴욕 핫 레이스 zip 군침 맛집 분위기 레스토랑 인스타 감성 카페 뉴욕 때 꼭 참고 놀러가쟈구 뉴욕 맛집 뉴욕 카페 NY zip,New York,"['#핫플레이스', '#뉴욕맛집', '#뉴욕카페']"
Fishs Eddy fishseddy 빈티 그릇 Fishs Eddy fishseddy,Fishs Eddy,[]
뉴욕 제일 핫 곳 Summit One Vanderbilt 저번 낮 최고 해지 기전 제일 역시 말로 표현 저녁 노을 뉴욕 야경 경험 곳 꼭 추천 Best Observation Decks in NYC Such an amazing experience summitov Summit One Vanderbilt Best Observation Decks in NYC Such an amazing experience summitov,SUMMIT One Vanderbilt,[]
Breathtaking night view 전망대 하나 복합 문화 공간 뉴욕 써밋 Breathtaking night view,SUMMIT One Vanderbilt,[]
tomi jazz tomi jazz,Tomi Jazz,[]
